"No.","Time","Source","Destination","Protocol","Length","Info"
"4","9.819000438","2a00:a041:3c5d:4d00:b981:f170:feac:7cf9","2a03:2880:f258:c8:face:b00c:0:167","TLSv1.2","158","Application Data"
"5","9.821192977","2a03:2880:f258:c8:face:b00c:0:167","2a00:a041:3c5d:4d00:b981:f170:feac:7cf9","TCP","1468","443  >  39412 [ACK] Seq=1 Ack=1 Win=1364 Len=1380 TSval=2507862773 TSecr=3659576654 [TCP segment of a reassembled PDU]"
"6","9.821505455","2a03:2880:f258:c8:face:b00c:0:167","2a00:a041:3c5d:4d00:b981:f170:feac:7cf9","TLSv1.2","164","Application Data"
"7","9.821526262","2a00:a041:3c5d:4d00:b981:f170:feac:7cf9","2a03:2880:f258:c8:face:b00c:0:167","TCP","88","39412  >  443 [ACK] Seq=71 Ack=1457 Win=4404 Len=0 TSval=3659591068 TSecr=2507862773"
"8","10.042127958","2a00:a041:3c5d:4d00:b981:f170:feac:7cf9","2a03:2880:f258:c8:face:b00c:0:167","TLSv1.2","163","Application Data"
"13","10.045410555","2a03:2880:f258:c8:face:b00c:0:167","2a00:a041:3c5d:4d00:b981:f170:feac:7cf9","TCP","88","443  >  39412 [ACK] Seq=1457 Ack=71 Win=1364 Len=0 TSval=2507863011 TSecr=3659591065"
"14","10.114094568","2a03:2880:f258:c8:face:b00c:0:167","2a00:a041:3c5d:4d00:b981:f170:feac:7cf9","TLSv1.2","160","Application Data"
"15","10.122709968","2a00:a041:3c5d:4d00:b981:f170:feac:7cf9","2a03:2880:f258:c8:face:b00c:0:167","TLSv1.2","184","Application Data"
"16","10.127036441","2a03:2880:f258:c8:face:b00c:0:167","2a00:a041:3c5d:4d00:b981:f170:feac:7cf9","TCP","1468","443  >  39412 [ACK] Seq=1529 Ack=71 Win=1364 Len=1380 TSval=2507863104 TSecr=3659591065 [TCP segment of a reassembled PDU]"
"17","10.128334663","2a03:2880:f258:c8:face:b00c:0:167","2a00:a041:3c5d:4d00:b981:f170:feac:7cf9","TLSv1.2","346","Application Data, Application Data"
"18","10.128343962","2a00:a041:3c5d:4d00:b981:f170:feac:7cf9","2a03:2880:f258:c8:face:b00c:0:167","TCP","88","39412  >  443 [ACK] Seq=242 Ack=3167 Win=4404 Len=0 TSval=3659591375 TSecr=2507863104"
"23","10.184739427","2a00:a041:3c5d:4d00:b981:f170:feac:7cf9","2a00:a040:0:4:face:b00c:3333:7020","TCP","96","41344  >  443 [SYN] Seq=0 Win=64800 Len=0 MSS=1440 SACK_PERM=1 TSval=1280671014 TSecr=0 WS=128"
"24","10.228210147","2a03:2880:f258:c8:face:b00c:0:167","2a00:a041:3c5d:4d00:b981:f170:feac:7cf9","TLSv1.2","229","Application Data"
"25","10.231273589","2a00:a041:3c5d:4d00:b981:f170:feac:7cf9","2a03:2880:f258:c8:face:b00c:0:167","TLSv1.2","188","Application Data"
"26","10.244282471","2a03:2880:f258:c8:face:b00c:0:167","2a00:a041:3c5d:4d00:b981:f170:feac:7cf9","TCP","88","443  >  39412 [ACK] Seq=3308 Ack=146 Win=1364 Len=0 TSval=2507863221 TSecr=3659591289"
"27","10.270302399","2a00:a040:0:4:face:b00c:3333:7020","2a00:a041:3c5d:4d00:b981:f170:feac:7cf9","TCP","96","443  >  41344 [SYN, ACK] Seq=0 Ack=1 Win=31740 Len=0 MSS=1392 SACK_PERM=1 TSval=637485786 TSecr=1280671014 WS=256"
"28","10.270343900","2a00:a041:3c5d:4d00:b981:f170:feac:7cf9","2a00:a040:0:4:face:b00c:3333:7020","TCP","88","41344  >  443 [ACK] Seq=1 Ack=1 Win=64896 Len=0 TSval=1280671100 TSecr=637485786"
"29","10.271204260","2a00:a041:3c5d:4d00:b981:f170:feac:7cf9","2a00:a040:0:4:face:b00c:3333:7020","TLSv1.3","794","Client Hello"
"30","10.340354151","2a03:2880:f258:c8:face:b00c:0:167","2a00:a041:3c5d:4d00:b981:f170:feac:7cf9","TLSv1.2","1094","Application Data"
"31","10.343409314","2a03:2880:f258:c8:face:b00c:0:167","2a00:a041:3c5d:4d00:b981:f170:feac:7cf9","TCP","88","443  >  39412 [ACK] Seq=4314 Ack=242 Win=1364 Len=0 TSval=2507863320 TSecr=3659591369"
"32","10.383090501","2a00:a041:3c5d:4d00:b981:f170:feac:7cf9","2a03:2880:f258:c8:face:b00c:0:167","TCP","88","39412  >  443 [ACK] Seq=342 Ack=4314 Win=4404 Len=0 TSval=3659591630 TSecr=2507863316"
"33","10.430154569","2a00:a040:0:4:face:b00c:3333:7020","2a00:a041:3c5d:4d00:b981:f170:feac:7cf9","TCP","88","443  >  41344 [ACK] Seq=1 Ack=707 Win=31232 Len=0 TSval=637485947 TSecr=1280671101"
"34","10.430748277","2a00:a040:0:4:face:b00c:3333:7020","2a00:a041:3c5d:4d00:b981:f170:feac:7cf9","TLSv1.3","253","Server Hello, Application Data"
"35","10.430772376","2a00:a041:3c5d:4d00:b981:f170:feac:7cf9","2a00:a040:0:4:face:b00c:3333:7020","TCP","88","41344  >  443 [ACK] Seq=707 Ack=166 Win=64768 Len=0 TSval=1280671260 TSecr=637485947"
"36","10.431199915","2a00:a041:3c5d:4d00:b981:f170:feac:7cf9","2a00:a040:0:4:face:b00c:3333:7020","TLSv1.3","94","Change Cipher Spec"
"37","10.431329524","2a00:a041:3c5d:4d00:b981:f170:feac:7cf9","2a00:a040:0:4:face:b00c:3333:7020","TLSv1.3","146","Application Data"
"38","10.432746954","2a00:a041:3c5d:4d00:b981:f170:feac:7cf9","2a00:a040:0:4:face:b00c:3333:7020","TLSv1.3","686","Application Data"
"39","10.455811162","2a03:2880:f258:c8:face:b00c:0:167","2a00:a041:3c5d:4d00:b981:f170:feac:7cf9","TCP","88","443  >  39412 [ACK] Seq=4314 Ack=342 Win=1364 Len=0 TSval=2507863433 TSecr=3659591478"
"40","10.532541669","2a03:2880:f258:c8:face:b00c:0:167","2a00:a041:3c5d:4d00:b981:f170:feac:7cf9","TLSv1.2","229","Application Data"
"41","10.532577325","2a00:a041:3c5d:4d00:b981:f170:feac:7cf9","2a03:2880:f258:c8:face:b00c:0:167","TCP","88","39412  >  443 [ACK] Seq=342 Ack=4455 Win=4404 Len=0 TSval=3659591779 TSecr=2507863508"
"42","10.536132532","2a00:a041:3c5d:4d00:b981:f170:feac:7cf9","2a03:2880:f258:c8:face:b00c:0:167","TLSv1.2","188","Application Data"
"43","10.585187195","2a00:a040:0:4:face:b00c:3333:7020","2a00:a041:3c5d:4d00:b981:f170:feac:7cf9","TCP","88","443  >  41344 [ACK] Seq=166 Ack=771 Win=31488 Len=0 TSval=637486098 TSecr=1280671261"
"44","10.586314357","2a00:a040:0:4:face:b00c:3333:7020","2a00:a041:3c5d:4d00:b981:f170:feac:7cf9","TLSv1.3","269","Application Data"
"45","10.590249597","2a00:a040:0:4:face:b00c:3333:7020","2a00:a041:3c5d:4d00:b981:f170:feac:7cf9","TLSv1.3","684","Application Data"
"46","10.590434723","2a00:a041:3c5d:4d00:b981:f170:feac:7cf9","2a00:a040:0:4:face:b00c:3333:7020","TCP","88","41344  >  443 [ACK] Seq=1369 Ack=943 Win=64000 Len=0 TSval=1280671420 TSecr=637486098"
"47","10.590703099","2a00:a040:0:4:face:b00c:3333:7020","2a00:a041:3c5d:4d00:b981:f170:feac:7cf9","TLSv1.3","111","Application Data"
"48","10.590703228","2a00:a040:0:4:face:b00c:3333:7020","2a00:a041:3c5d:4d00:b981:f170:feac:7cf9","TCP","1468","443  >  41344 [ACK] Seq=966 Ack=1369 Win=31488 Len=1380 TSval=637486107 TSecr=1280671262 [TCP segment of a reassembled PDU]"
"49","10.590925291","2a00:a041:3c5d:4d00:b981:f170:feac:7cf9","2a00:a040:0:4:face:b00c:3333:7020","TCP","88","41344  >  443 [ACK] Seq=1369 Ack=2346 Win=63104 Len=0 TSval=1280671420 TSecr=637486107"
"50","10.592254321","2a00:a040:0:4:face:b00c:3333:7020","2a00:a041:3c5d:4d00:b981:f170:feac:7cf9","TLSv1.3","1468","Application Data [TCP segment of a reassembled PDU]"
"51","10.592739219","2a00:a040:0:4:face:b00c:3333:7020","2a00:a041:3c5d:4d00:b981:f170:feac:7cf9","TCP","1468","443  >  41344 [ACK] Seq=3726 Ack=1369 Win=31488 Len=1380 TSval=637486107 TSecr=1280671262 [TCP segment of a reassembled PDU]"
"52","10.592755097","2a00:a041:3c5d:4d00:b981:f170:feac:7cf9","2a00:a040:0:4:face:b00c:3333:7020","TCP","88","41344  >  443 [ACK] Seq=1369 Ack=5106 Win=63104 Len=0 TSval=1280671422 TSecr=637486107"
"53","10.593443727","2a00:a040:0:4:face:b00c:3333:7020","2a00:a041:3c5d:4d00:b981:f170:feac:7cf9","TCP","1468","443  >  41344 [PSH, ACK] Seq=5106 Ack=1369 Win=31488 Len=1380 TSval=637486107 TSecr=1280671262 [TCP segment of a reassembled PDU]"
"54","10.594203758","2a00:a040:0:4:face:b00c:3333:7020","2a00:a041:3c5d:4d00:b981:f170:feac:7cf9","TCP","1468","443  >  41344 [ACK] Seq=6486 Ack=1369 Win=31488 Len=1380 TSval=637486107 TSecr=1280671262 [TCP segment of a reassembled PDU]"
"55","10.594213795","2a00:a041:3c5d:4d00:b981:f170:feac:7cf9","2a00:a040:0:4:face:b00c:3333:7020","TCP","88","41344  >  443 [ACK] Seq=1369 Ack=7866 Win=63104 Len=0 TSval=1280671424 TSecr=637486107"
"56","10.594901721","2a00:a040:0:4:face:b00c:3333:7020","2a00:a041:3c5d:4d00:b981:f170:feac:7cf9","TCP","1468","443  >  41344 [PSH, ACK] Seq=7866 Ack=1369 Win=31488 Len=1380 TSval=637486107 TSecr=1280671262 [TCP segment of a reassembled PDU]"
"57","10.605104881","2a00:a040:0:4:face:b00c:3333:7020","2a00:a041:3c5d:4d00:b981:f170:feac:7cf9","TCP","1468","443  >  41344 [ACK] Seq=9246 Ack=1369 Win=31488 Len=1380 TSval=637486114 TSecr=1280671262 [TCP segment of a reassembled PDU]"
"58","10.605160318","2a00:a041:3c5d:4d00:b981:f170:feac:7cf9","2a00:a040:0:4:face:b00c:3333:7020","TCP","88","41344  >  443 [ACK] Seq=1369 Ack=10626 Win=63104 Len=0 TSval=1280671435 TSecr=637486107"
"59","10.605907370","2a00:a040:0:4:face:b00c:3333:7020","2a00:a041:3c5d:4d00:b981:f170:feac:7cf9","TCP","1468","443  >  41344 [PSH, ACK] Seq=10626 Ack=1369 Win=31488 Len=1380 TSval=637486114 TSecr=1280671262 [TCP segment of a reassembled PDU]"
"60","10.647043564","2a00:a041:3c5d:4d00:b981:f170:feac:7cf9","2a00:a040:0:4:face:b00c:3333:7020","TCP","88","41344  >  443 [ACK] Seq=1369 Ack=12006 Win=64128 Len=0 TSval=1280671477 TSecr=637486114"
"61","10.666056585","2a00:a040:0:4:face:b00c:3333:7020","2a00:a041:3c5d:4d00:b981:f170:feac:7cf9","TCP","1468","443  >  41344 [ACK] Seq=12006 Ack=1369 Win=31488 Len=1380 TSval=637486182 TSecr=1280671420 [TCP segment of a reassembled PDU]"
"62","10.666092070","2a00:a041:3c5d:4d00:b981:f170:feac:7cf9","2a00:a040:0:4:face:b00c:3333:7020","TCP","88","41344  >  443 [ACK] Seq=1369 Ack=13386 Win=63104 Len=0 TSval=1280671496 TSecr=637486182"
"63","10.666252515","2a00:a040:0:4:face:b00c:3333:7020","2a00:a041:3c5d:4d00:b981:f170:feac:7cf9","TCP","1468","443  >  41344 [PSH, ACK] Seq=13386 Ack=1369 Win=31488 Len=1380 TSval=637486182 TSecr=1280671420 [TCP segment of a reassembled PDU]"
"64","10.666266067","2a00:a041:3c5d:4d00:b981:f170:feac:7cf9","2a00:a040:0:4:face:b00c:3333:7020","TCP","88","41344  >  443 [ACK] Seq=1369 Ack=14766 Win=63104 Len=0 TSval=1280671496 TSecr=637486182"
"65","10.669458153","2a00:a040:0:4:face:b00c:3333:7020","2a00:a041:3c5d:4d00:b981:f170:feac:7cf9","TCP","1468","443  >  41344 [ACK] Seq=14766 Ack=1369 Win=31488 Len=1380 TSval=637486185 TSecr=1280671420 [TCP segment of a reassembled PDU]"
"66","10.669494042","2a00:a041:3c5d:4d00:b981:f170:feac:7cf9","2a00:a040:0:4:face:b00c:3333:7020","TCP","88","41344  >  443 [ACK] Seq=1369 Ack=16146 Win=63104 Len=0 TSval=1280671499 TSecr=637486185"
"67","10.669580223","2a00:a040:0:4:face:b00c:3333:7020","2a00:a041:3c5d:4d00:b981:f170:feac:7cf9","TCP","1468","443  >  41344 [PSH, ACK] Seq=16146 Ack=1369 Win=31488 Len=1380 TSval=637486185 TSecr=1280671420 [TCP segment of a reassembled PDU]"
"68","10.669591037","2a00:a041:3c5d:4d00:b981:f170:feac:7cf9","2a00:a040:0:4:face:b00c:3333:7020","TCP","88","41344  >  443 [ACK] Seq=1369 Ack=17526 Win=61824 Len=0 TSval=1280671499 TSecr=637486185"
"69","10.676977279","2a00:a040:0:4:face:b00c:3333:7020","2a00:a041:3c5d:4d00:b981:f170:feac:7cf9","TLSv1.3","1468","Application Data [TCP segment of a reassembled PDU]"
"70","10.676996574","2a00:a041:3c5d:4d00:b981:f170:feac:7cf9","2a00:a040:0:4:face:b00c:3333:7020","TCP","88","41344  >  443 [ACK] Seq=1369 Ack=18906 Win=63104 Len=0 TSval=1280671506 TSecr=637486192"
"71","10.677655018","2a00:a040:0:4:face:b00c:3333:7020","2a00:a041:3c5d:4d00:b981:f170:feac:7cf9","TCP","1468","443  >  41344 [PSH, ACK] Seq=18906 Ack=1369 Win=31488 Len=1380 TSval=637486192 TSecr=1280671422 [TCP segment of a reassembled PDU]"
"72","10.677669333","2a00:a041:3c5d:4d00:b981:f170:feac:7cf9","2a00:a040:0:4:face:b00c:3333:7020","TCP","88","41344  >  443 [ACK] Seq=1369 Ack=20286 Win=63104 Len=0 TSval=1280671507 TSecr=637486192"
"73","10.683828213","2a00:a040:0:4:face:b00c:3333:7020","2a00:a041:3c5d:4d00:b981:f170:feac:7cf9","TCP","1468","443  >  41344 [ACK] Seq=20286 Ack=1369 Win=31488 Len=1380 TSval=637486199 TSecr=1280671422 [TCP segment of a reassembled PDU]"
"74","10.684294687","2a00:a040:0:4:face:b00c:3333:7020","2a00:a041:3c5d:4d00:b981:f170:feac:7cf9","TCP","1468","443  >  41344 [PSH, ACK] Seq=21666 Ack=1369 Win=31488 Len=1380 TSval=637486199 TSecr=1280671422 [TCP segment of a reassembled PDU]"
"75","10.684313345","2a00:a041:3c5d:4d00:b981:f170:feac:7cf9","2a00:a040:0:4:face:b00c:3333:7020","TCP","88","41344  >  443 [ACK] Seq=1369 Ack=23046 Win=63104 Len=0 TSval=1280671514 TSecr=637486199"
"76","10.691044350","2a00:a040:0:4:face:b00c:3333:7020","2a00:a041:3c5d:4d00:b981:f170:feac:7cf9","TCP","1468","443  >  41344 [ACK] Seq=23046 Ack=1369 Win=31488 Len=1380 TSval=637486206 TSecr=1280671435 [TCP segment of a reassembled PDU]"
"77","10.692086795","2a00:a040:0:4:face:b00c:3333:7020","2a00:a041:3c5d:4d00:b981:f170:feac:7cf9","TCP","1468","443  >  41344 [PSH, ACK] Seq=24426 Ack=1369 Win=31488 Len=1380 TSval=637486206 TSecr=1280671435 [TCP segment of a reassembled PDU]"
"78","10.692104514","2a00:a041:3c5d:4d00:b981:f170:feac:7cf9","2a00:a040:0:4:face:b00c:3333:7020","TCP","88","41344  >  443 [ACK] Seq=1369 Ack=25806 Win=63104 Len=0 TSval=1280671522 TSecr=637486206"
"79","10.697060880","2a00:a040:0:4:face:b00c:3333:7020","2a00:a041:3c5d:4d00:b981:f170:feac:7cf9","TLSv1.3","1371","Application Data"
"80","10.697248963","2a00:a041:3c5d:4d00:b981:f170:feac:7cf9","2a00:a040:0:4:face:b00c:3333:7020","TCP","88","41344  >  443 [ACK] Seq=1369 Ack=27089 Win=64128 Len=0 TSval=1280671527 TSecr=637486213"
"81","10.763528600","2a03:2880:f258:c8:face:b00c:0:167","2a00:a041:3c5d:4d00:b981:f170:feac:7cf9","TCP","88","443  >  39412 [ACK] Seq=4455 Ack=442 Win=1364 Len=0 TSval=2507863740 TSecr=3659591783"
"82","10.788225760","2a00:a040:0:4:face:b00c:3333:7020","2a00:a041:3c5d:4d00:b981:f170:feac:7cf9","TCP","88","[TCP Dup ACK 45#1] 443  >  41344 [ACK] Seq=27089 Ack=1369 Win=31488 Len=0 TSval=637486305 TSecr=1280671527"
"87","14.039322605","2a03:2880:f258:c8:face:b00c:0:167","2a00:a041:3c5d:4d00:b981:f170:feac:7cf9","TLSv1.2","445","Application Data"
"88","14.083144318","2a00:a041:3c5d:4d00:b981:f170:feac:7cf9","2a03:2880:f258:c8:face:b00c:0:167","TCP","88","39412  >  443 [ACK] Seq=442 Ack=4812 Win=4404 Len=0 TSval=3659595330 TSecr=2507866932"
"89","16.770280744","2a00:a041:3c5d:4d00:b981:f170:feac:7cf9","2a00:a040:0:4:face:b00c:3333:7020","TLSv1.3","686","Application Data"
"90","16.791857366","2a00:a041:3c5d:4d00:b981:f170:feac:7cf9","2a03:2880:f258:c8:face:b00c:0:167","TLSv1.2","184","Application Data"
"91","16.888578174","2a00:a040:0:4:face:b00c:3333:7020","2a00:a041:3c5d:4d00:b981:f170:feac:7cf9","TLSv1.3","684","Application Data"
"92","16.888617877","2a00:a041:3c5d:4d00:b981:f170:feac:7cf9","2a00:a040:0:4:face:b00c:3333:7020","TCP","88","41344  >  443 [ACK] Seq=1967 Ack=27685 Win=63616 Len=0 TSval=1280677718 TSecr=637492405"
"93","16.890623593","2a00:a040:0:4:face:b00c:3333:7020","2a00:a041:3c5d:4d00:b981:f170:feac:7cf9","TLSv1.3","111","Application Data"
"94","16.890648105","2a00:a041:3c5d:4d00:b981:f170:feac:7cf9","2a00:a040:0:4:face:b00c:3333:7020","TCP","88","41344  >  443 [ACK] Seq=1967 Ack=27708 Win=64128 Len=0 TSval=1280677720 TSecr=637492407"
"95","16.891354167","2a00:a040:0:4:face:b00c:3333:7020","2a00:a041:3c5d:4d00:b981:f170:feac:7cf9","TCP","1468","443  >  41344 [ACK] Seq=27708 Ack=1967 Win=31488 Len=1380 TSval=637492407 TSecr=1280677600 [TCP segment of a reassembled PDU]"
"96","16.891372376","2a00:a041:3c5d:4d00:b981:f170:feac:7cf9","2a00:a040:0:4:face:b00c:3333:7020","TCP","88","41344  >  443 [ACK] Seq=1967 Ack=29088 Win=66944 Len=0 TSval=1280677721 TSecr=637492407"
"97","16.892098108","2a00:a040:0:4:face:b00c:3333:7020","2a00:a041:3c5d:4d00:b981:f170:feac:7cf9","TLSv1.3","1468","Application Data [TCP segment of a reassembled PDU]"
"98","16.892117625","2a00:a041:3c5d:4d00:b981:f170:feac:7cf9","2a00:a040:0:4:face:b00c:3333:7020","TCP","88","41344  >  443 [ACK] Seq=1967 Ack=30468 Win=69632 Len=0 TSval=1280677722 TSecr=637492407"
"99","16.896152396","2a00:a040:0:4:face:b00c:3333:7020","2a00:a041:3c5d:4d00:b981:f170:feac:7cf9","TCP","1468","443  >  41344 [ACK] Seq=30468 Ack=1967 Win=31488 Len=1380 TSval=637492413 TSecr=1280677600 [TCP segment of a reassembled PDU]"
"100","16.896179704","2a00:a041:3c5d:4d00:b981:f170:feac:7cf9","2a00:a040:0:4:face:b00c:3333:7020","TCP","88","41344  >  443 [ACK] Seq=1967 Ack=31848 Win=72448 Len=0 TSval=1280677726 TSecr=637492413"
"101","16.896887706","2a00:a040:0:4:face:b00c:3333:7020","2a00:a041:3c5d:4d00:b981:f170:feac:7cf9","TCP","1468","443  >  41344 [PSH, ACK] Seq=31848 Ack=1967 Win=31488 Len=1380 TSval=637492413 TSecr=1280677600 [TCP segment of a reassembled PDU]"
"102","16.896905070","2a00:a041:3c5d:4d00:b981:f170:feac:7cf9","2a00:a040:0:4:face:b00c:3333:7020","TCP","88","41344  >  443 [ACK] Seq=1967 Ack=33228 Win=75264 Len=0 TSval=1280677726 TSecr=637492413"
"103","16.933221666","2a00:a040:0:4:face:b00c:3333:7020","2a00:a041:3c5d:4d00:b981:f170:feac:7cf9","TCP","1468","443  >  41344 [ACK] Seq=33228 Ack=1967 Win=31488 Len=1380 TSval=637492418 TSecr=1280677600 [TCP segment of a reassembled PDU]"
"104","16.933259213","2a00:a041:3c5d:4d00:b981:f170:feac:7cf9","2a00:a040:0:4:face:b00c:3333:7020","TCP","88","41344  >  443 [ACK] Seq=1967 Ack=34608 Win=77952 Len=0 TSval=1280677763 TSecr=637492418"
"105","16.935912903","2a00:a040:0:4:face:b00c:3333:7020","2a00:a041:3c5d:4d00:b981:f170:feac:7cf9","TCP","1468","443  >  41344 [PSH, ACK] Seq=34608 Ack=1967 Win=31488 Len=1380 TSval=637492418 TSecr=1280677600 [TCP segment of a reassembled PDU]"
"106","16.935913089","2a00:a040:0:4:face:b00c:3333:7020","2a00:a041:3c5d:4d00:b981:f170:feac:7cf9","TCP","2848","443  >  41344 [PSH, ACK] Seq=35988 Ack=1967 Win=31488 Len=2760 TSval=637492423 TSecr=1280677600 [TCP segment of a reassembled PDU]"
"107","16.935913135","2a00:a040:0:4:face:b00c:3333:7020","2a00:a041:3c5d:4d00:b981:f170:feac:7cf9","TCP","2848","443  >  41344 [PSH, ACK] Seq=38748 Ack=1967 Win=31488 Len=2760 TSval=637492428 TSecr=1280677600 [TCP segment of a reassembled PDU]"
"108","16.935940857","2a00:a041:3c5d:4d00:b981:f170:feac:7cf9","2a00:a040:0:4:face:b00c:3333:7020","TCP","88","41344  >  443 [ACK] Seq=1967 Ack=35988 Win=80768 Len=0 TSval=1280677765 TSecr=637492418"
"109","16.935955310","2a00:a041:3c5d:4d00:b981:f170:feac:7cf9","2a00:a040:0:4:face:b00c:3333:7020","TCP","88","41344  >  443 [ACK] Seq=1967 Ack=38748 Win=86272 Len=0 TSval=1280677765 TSecr=637492423"
"110","16.935959951","2a00:a041:3c5d:4d00:b981:f170:feac:7cf9","2a00:a040:0:4:face:b00c:3333:7020","TCP","88","41344  >  443 [ACK] Seq=1967 Ack=41508 Win=91776 Len=0 TSval=1280677765 TSecr=637492428"
"111","16.937452240","2a00:a040:0:4:face:b00c:3333:7020","2a00:a041:3c5d:4d00:b981:f170:feac:7cf9","TCP","2848","443  >  41344 [PSH, ACK] Seq=41508 Ack=1967 Win=31488 Len=2760 TSval=637492433 TSecr=1280677600 [TCP segment of a reassembled PDU]"
"112","16.937452392","2a00:a040:0:4:face:b00c:3333:7020","2a00:a041:3c5d:4d00:b981:f170:feac:7cf9","TLSv1.3","2848","Application Data [TCP segment of a reassembled PDU]"
"113","16.937452434","2a00:a040:0:4:face:b00c:3333:7020","2a00:a041:3c5d:4d00:b981:f170:feac:7cf9","TCP","2848","443  >  41344 [PSH, ACK] Seq=47028 Ack=1967 Win=31488 Len=2760 TSval=637492444 TSecr=1280677600 [TCP segment of a reassembled PDU]"
"114","16.937452478","2a00:a040:0:4:face:b00c:3333:7020","2a00:a041:3c5d:4d00:b981:f170:feac:7cf9","TCP","2848","443  >  41344 [PSH, ACK] Seq=49788 Ack=1967 Win=31488 Len=2760 TSval=637492449 TSecr=1280677600 [TCP segment of a reassembled PDU]"
"115","16.937471431","2a00:a041:3c5d:4d00:b981:f170:feac:7cf9","2a00:a040:0:4:face:b00c:3333:7020","TCP","88","41344  >  443 [ACK] Seq=1967 Ack=44268 Win=97280 Len=0 TSval=1280677767 TSecr=637492433"
"116","16.937485005","2a00:a041:3c5d:4d00:b981:f170:feac:7cf9","2a00:a040:0:4:face:b00c:3333:7020","TCP","88","41344  >  443 [ACK] Seq=1967 Ack=47028 Win=102784 Len=0 TSval=1280677767 TSecr=637492438"
"117","16.937489716","2a00:a041:3c5d:4d00:b981:f170:feac:7cf9","2a00:a040:0:4:face:b00c:3333:7020","TCP","88","41344  >  443 [ACK] Seq=1967 Ack=49788 Win=108288 Len=0 TSval=1280677767 TSecr=637492444"
"118","16.937494184","2a00:a041:3c5d:4d00:b981:f170:feac:7cf9","2a00:a040:0:4:face:b00c:3333:7020","TCP","88","41344  >  443 [ACK] Seq=1967 Ack=52548 Win=113792 Len=0 TSval=1280677767 TSecr=637492449"
"119","16.938244750","2a00:a040:0:4:face:b00c:3333:7020","2a00:a041:3c5d:4d00:b981:f170:feac:7cf9","TCP","2848","443  >  41344 [PSH, ACK] Seq=52548 Ack=1967 Win=31488 Len=2760 TSval=637492454 TSecr=1280677600 [TCP segment of a reassembled PDU]"
"120","16.938261664","2a00:a041:3c5d:4d00:b981:f170:feac:7cf9","2a00:a040:0:4:face:b00c:3333:7020","TCP","88","41344  >  443 [ACK] Seq=1967 Ack=55308 Win=119424 Len=0 TSval=1280677768 TSecr=637492454"
"121","16.943096648","2a00:a040:0:4:face:b00c:3333:7020","2a00:a041:3c5d:4d00:b981:f170:feac:7cf9","TCP","1468","443  >  41344 [ACK] Seq=55308 Ack=1967 Win=31488 Len=1380 TSval=637492459 TSecr=1280677600 [TCP segment of a reassembled PDU]"
"122","16.943108417","2a00:a041:3c5d:4d00:b981:f170:feac:7cf9","2a00:a040:0:4:face:b00c:3333:7020","TCP","88","41344  >  443 [ACK] Seq=1967 Ack=56688 Win=122112 Len=0 TSval=1280677773 TSecr=637492459"
"123","16.943819350","2a00:a040:0:4:face:b00c:3333:7020","2a00:a041:3c5d:4d00:b981:f170:feac:7cf9","TCP","1468","443  >  41344 [PSH, ACK] Seq=56688 Ack=1967 Win=31488 Len=1380 TSval=637492459 TSecr=1280677600 [TCP segment of a reassembled PDU]"
"124","16.943826974","2a00:a041:3c5d:4d00:b981:f170:feac:7cf9","2a00:a040:0:4:face:b00c:3333:7020","TCP","88","41344  >  443 [ACK] Seq=1967 Ack=58068 Win=124928 Len=0 TSval=1280677773 TSecr=637492459"
"125","16.947863944","2a00:a040:0:4:face:b00c:3333:7020","2a00:a041:3c5d:4d00:b981:f170:feac:7cf9","TCP","1468","443  >  41344 [ACK] Seq=58068 Ack=1967 Win=31488 Len=1380 TSval=637492464 TSecr=1280677600 [TCP segment of a reassembled PDU]"
"126","16.947871680","2a00:a041:3c5d:4d00:b981:f170:feac:7cf9","2a00:a040:0:4:face:b00c:3333:7020","TCP","88","41344  >  443 [ACK] Seq=1967 Ack=59448 Win=127616 Len=0 TSval=1280677777 TSecr=637492464"
"127","16.950423785","2a00:a040:0:4:face:b00c:3333:7020","2a00:a041:3c5d:4d00:b981:f170:feac:7cf9","TCP","1468","443  >  41344 [ACK] Seq=59448 Ack=1967 Win=31488 Len=1380 TSval=637492467 TSecr=1280677600 [TCP segment of a reassembled PDU]"
"128","16.950429603","2a00:a041:3c5d:4d00:b981:f170:feac:7cf9","2a00:a040:0:4:face:b00c:3333:7020","TCP","88","41344  >  443 [ACK] Seq=1967 Ack=60828 Win=130432 Len=0 TSval=1280677780 TSecr=637492467"
"129","16.951010249","2a00:a040:0:4:face:b00c:3333:7020","2a00:a041:3c5d:4d00:b981:f170:feac:7cf9","TLSv1.3","1468","Application Data [TCP segment of a reassembled PDU]"
"130","16.951013028","2a00:a041:3c5d:4d00:b981:f170:feac:7cf9","2a00:a040:0:4:face:b00c:3333:7020","TCP","88","41344  >  443 [ACK] Seq=1967 Ack=62208 Win=133120 Len=0 TSval=1280677781 TSecr=637492467"
"131","16.955723706","2a00:a040:0:4:face:b00c:3333:7020","2a00:a041:3c5d:4d00:b981:f170:feac:7cf9","TCP","1468","443  >  41344 [ACK] Seq=62208 Ack=1967 Win=31488 Len=1380 TSval=637492472 TSecr=1280677600 [TCP segment of a reassembled PDU]"
"132","16.955730828","2a00:a041:3c5d:4d00:b981:f170:feac:7cf9","2a00:a040:0:4:face:b00c:3333:7020","TCP","88","41344  >  443 [ACK] Seq=1967 Ack=63588 Win=135936 Len=0 TSval=1280677785 TSecr=637492472"
"133","16.956431865","2a00:a040:0:4:face:b00c:3333:7020","2a00:a041:3c5d:4d00:b981:f170:feac:7cf9","TCP","1468","443  >  41344 [PSH, ACK] Seq=63588 Ack=1967 Win=31488 Len=1380 TSval=637492472 TSecr=1280677600 [TCP segment of a reassembled PDU]"
"134","16.956437578","2a00:a041:3c5d:4d00:b981:f170:feac:7cf9","2a00:a040:0:4:face:b00c:3333:7020","TCP","88","41344  >  443 [ACK] Seq=1967 Ack=64968 Win=138752 Len=0 TSval=1280677786 TSecr=637492472"
"135","16.960616659","2a00:a040:0:4:face:b00c:3333:7020","2a00:a041:3c5d:4d00:b981:f170:feac:7cf9","TCP","1468","443  >  41344 [ACK] Seq=64968 Ack=1967 Win=31488 Len=1380 TSval=637492477 TSecr=1280677600 [TCP segment of a reassembled PDU]"
"136","16.960622753","2a00:a041:3c5d:4d00:b981:f170:feac:7cf9","2a00:a040:0:4:face:b00c:3333:7020","TCP","88","41344  >  443 [ACK] Seq=1967 Ack=66348 Win=141440 Len=0 TSval=1280677790 TSecr=637492477"
"137","16.961369117","2a00:a040:0:4:face:b00c:3333:7020","2a00:a041:3c5d:4d00:b981:f170:feac:7cf9","TCP","1468","443  >  41344 [PSH, ACK] Seq=66348 Ack=1967 Win=31488 Len=1380 TSval=637492477 TSecr=1280677600 [TCP segment of a reassembled PDU]"
"138","16.961375001","2a00:a041:3c5d:4d00:b981:f170:feac:7cf9","2a00:a040:0:4:face:b00c:3333:7020","TCP","88","41344  >  443 [ACK] Seq=1967 Ack=67728 Win=144256 Len=0 TSval=1280677791 TSecr=637492477"
"139","16.965784755","2a00:a040:0:4:face:b00c:3333:7020","2a00:a041:3c5d:4d00:b981:f170:feac:7cf9","TCP","1468","443  >  41344 [ACK] Seq=67728 Ack=1967 Win=31488 Len=1380 TSval=637492482 TSecr=1280677600 [TCP segment of a reassembled PDU]"
"140","16.965790662","2a00:a041:3c5d:4d00:b981:f170:feac:7cf9","2a00:a040:0:4:face:b00c:3333:7020","TCP","88","41344  >  443 [ACK] Seq=1967 Ack=69108 Win=146944 Len=0 TSval=1280677795 TSecr=637492482"
"141","16.966476948","2a00:a040:0:4:face:b00c:3333:7020","2a00:a041:3c5d:4d00:b981:f170:feac:7cf9","TCP","1468","443  >  41344 [PSH, ACK] Seq=69108 Ack=1967 Win=31488 Len=1380 TSval=637492482 TSecr=1280677600 [TCP segment of a reassembled PDU]"
"142","16.966481603","2a00:a041:3c5d:4d00:b981:f170:feac:7cf9","2a00:a040:0:4:face:b00c:3333:7020","TCP","88","41344  >  443 [ACK] Seq=1967 Ack=70488 Win=149760 Len=0 TSval=1280677796 TSecr=637492482"
"143","16.970182811","2a03:2880:f258:c8:face:b00c:0:167","2a00:a041:3c5d:4d00:b981:f170:feac:7cf9","TCP","88","443  >  39412 [ACK] Seq=4812 Ack=538 Win=1364 Len=0 TSval=2507869946 TSecr=3659598038"
"144","16.994291147","2a00:a040:0:4:face:b00c:3333:7020","2a00:a041:3c5d:4d00:b981:f170:feac:7cf9","TCP","1468","443  >  41344 [ACK] Seq=70488 Ack=1967 Win=31488 Len=1380 TSval=637492510 TSecr=1280677720 [TCP segment of a reassembled PDU]"
"145","16.994306589","2a00:a041:3c5d:4d00:b981:f170:feac:7cf9","2a00:a040:0:4:face:b00c:3333:7020","TCP","88","41344  >  443 [ACK] Seq=1967 Ack=71868 Win=152448 Len=0 TSval=1280677824 TSecr=637492510"
"146","16.994990801","2a00:a040:0:4:face:b00c:3333:7020","2a00:a041:3c5d:4d00:b981:f170:feac:7cf9","TCP","1468","443  >  41344 [PSH, ACK] Seq=71868 Ack=1967 Win=31488 Len=1380 TSval=637492510 TSecr=1280677720 [TCP segment of a reassembled PDU]"
"147","16.994994981","2a00:a041:3c5d:4d00:b981:f170:feac:7cf9","2a00:a040:0:4:face:b00c:3333:7020","TCP","88","41344  >  443 [ACK] Seq=1967 Ack=73248 Win=155264 Len=0 TSval=1280677825 TSecr=637492510"
"148","16.996170012","2a00:a040:0:4:face:b00c:3333:7020","2a00:a041:3c5d:4d00:b981:f170:feac:7cf9","TCP","1468","443  >  41344 [ACK] Seq=73248 Ack=1967 Win=31488 Len=1380 TSval=637492513 TSecr=1280677720 [TCP segment of a reassembled PDU]"
"149","16.996176309","2a00:a041:3c5d:4d00:b981:f170:feac:7cf9","2a00:a040:0:4:face:b00c:3333:7020","TCP","88","41344  >  443 [ACK] Seq=1967 Ack=74628 Win=157952 Len=0 TSval=1280677826 TSecr=637492513"
"150","16.996858184","2a00:a040:0:4:face:b00c:3333:7020","2a00:a041:3c5d:4d00:b981:f170:feac:7cf9","TCP","1468","443  >  41344 [PSH, ACK] Seq=74628 Ack=1967 Win=31488 Len=1380 TSval=637492513 TSecr=1280677720 [TCP segment of a reassembled PDU]"
"151","16.996864305","2a00:a041:3c5d:4d00:b981:f170:feac:7cf9","2a00:a040:0:4:face:b00c:3333:7020","TCP","88","41344  >  443 [ACK] Seq=1967 Ack=76008 Win=160768 Len=0 TSval=1280677826 TSecr=637492513"
"152","17.001787770","2a00:a040:0:4:face:b00c:3333:7020","2a00:a041:3c5d:4d00:b981:f170:feac:7cf9","TCP","1468","443  >  41344 [ACK] Seq=76008 Ack=1967 Win=31488 Len=1380 TSval=637492518 TSecr=1280677726 [TCP segment of a reassembled PDU]"
"153","17.001796985","2a00:a041:3c5d:4d00:b981:f170:feac:7cf9","2a00:a040:0:4:face:b00c:3333:7020","TCP","88","41344  >  443 [ACK] Seq=1967 Ack=77388 Win=163584 Len=0 TSval=1280677831 TSecr=637492518"
"154","17.002478610","2a00:a040:0:4:face:b00c:3333:7020","2a00:a041:3c5d:4d00:b981:f170:feac:7cf9","TLSv1.3","1468","Application Data [TCP segment of a reassembled PDU]"
"155","17.002484702","2a00:a041:3c5d:4d00:b981:f170:feac:7cf9","2a00:a040:0:4:face:b00c:3333:7020","TCP","88","41344  >  443 [ACK] Seq=1967 Ack=78768 Win=166272 Len=0 TSval=1280677832 TSecr=637492518"
"156","17.008159909","2a00:a040:0:4:face:b00c:3333:7020","2a00:a041:3c5d:4d00:b981:f170:feac:7cf9","TCP","1468","443  >  41344 [ACK] Seq=78768 Ack=1967 Win=31488 Len=1380 TSval=637492523 TSecr=1280677726 [TCP segment of a reassembled PDU]"
"157","17.008179182","2a00:a041:3c5d:4d00:b981:f170:feac:7cf9","2a00:a040:0:4:face:b00c:3333:7020","TCP","88","41344  >  443 [ACK] Seq=1967 Ack=80148 Win=169088 Len=0 TSval=1280677838 TSecr=637492523"
"158","17.011111017","2a00:a040:0:4:face:b00c:3333:7020","2a00:a041:3c5d:4d00:b981:f170:feac:7cf9","TCP","1468","443  >  41344 [PSH, ACK] Seq=80148 Ack=1967 Win=31488 Len=1380 TSval=637492523 TSecr=1280677726 [TCP segment of a reassembled PDU]"
"159","17.011122072","2a00:a041:3c5d:4d00:b981:f170:feac:7cf9","2a00:a040:0:4:face:b00c:3333:7020","TCP","88","41344  >  443 [ACK] Seq=1967 Ack=81528 Win=171776 Len=0 TSval=1280677841 TSecr=637492523"
"160","17.012140445","2a00:a040:0:4:face:b00c:3333:7020","2a00:a041:3c5d:4d00:b981:f170:feac:7cf9","TCP","1468","443  >  41344 [ACK] Seq=81528 Ack=1967 Win=31488 Len=1380 TSval=637492528 TSecr=1280677726 [TCP segment of a reassembled PDU]"
"161","17.012150958","2a00:a041:3c5d:4d00:b981:f170:feac:7cf9","2a00:a040:0:4:face:b00c:3333:7020","TCP","88","41344  >  443 [ACK] Seq=1967 Ack=82908 Win=174592 Len=0 TSval=1280677842 TSecr=637492528"
"162","17.013179642","2a00:a040:0:4:face:b00c:3333:7020","2a00:a041:3c5d:4d00:b981:f170:feac:7cf9","TCP","1468","443  >  41344 [PSH, ACK] Seq=82908 Ack=1967 Win=31488 Len=1380 TSval=637492528 TSecr=1280677726 [TCP segment of a reassembled PDU]"
"163","17.013189007","2a00:a041:3c5d:4d00:b981:f170:feac:7cf9","2a00:a040:0:4:face:b00c:3333:7020","TCP","88","41344  >  443 [ACK] Seq=1967 Ack=84288 Win=177280 Len=0 TSval=1280677843 TSecr=637492528"
"164","17.016820592","2a00:a040:0:4:face:b00c:3333:7020","2a00:a041:3c5d:4d00:b981:f170:feac:7cf9","TCP","1468","443  >  41344 [ACK] Seq=84288 Ack=1967 Win=31488 Len=1380 TSval=637492533 TSecr=1280677726 [TCP segment of a reassembled PDU]"
"165","17.016838017","2a00:a041:3c5d:4d00:b981:f170:feac:7cf9","2a00:a040:0:4:face:b00c:3333:7020","TCP","88","41344  >  443 [ACK] Seq=1967 Ack=85668 Win=180096 Len=0 TSval=1280677846 TSecr=637492533"
"166","17.017541492","2a00:a040:0:4:face:b00c:3333:7020","2a00:a041:3c5d:4d00:b981:f170:feac:7cf9","TCP","1468","443  >  41344 [PSH, ACK] Seq=85668 Ack=1967 Win=31488 Len=1380 TSval=637492533 TSecr=1280677726 [TCP segment of a reassembled PDU]"
"167","17.017548508","2a00:a041:3c5d:4d00:b981:f170:feac:7cf9","2a00:a040:0:4:face:b00c:3333:7020","TCP","88","41344  >  443 [ACK] Seq=1967 Ack=87048 Win=182912 Len=0 TSval=1280677847 TSecr=637492533"
"168","17.024428533","2a00:a040:0:4:face:b00c:3333:7020","2a00:a041:3c5d:4d00:b981:f170:feac:7cf9","TCP","1468","443  >  41344 [ACK] Seq=87048 Ack=1967 Win=31488 Len=1380 TSval=637492541 TSecr=1280677767 [TCP segment of a reassembled PDU]"
"169","17.024445641","2a00:a041:3c5d:4d00:b981:f170:feac:7cf9","2a00:a040:0:4:face:b00c:3333:7020","TCP","88","41344  >  443 [ACK] Seq=1967 Ack=88428 Win=185600 Len=0 TSval=1280677854 TSecr=637492541"
"170","17.025382655","2a00:a040:0:4:face:b00c:3333:7020","2a00:a041:3c5d:4d00:b981:f170:feac:7cf9","TCP","1468","443  >  41344 [PSH, ACK] Seq=88428 Ack=1967 Win=31488 Len=1380 TSval=637492541 TSecr=1280677767 [TCP segment of a reassembled PDU]"
"171","17.025390624","2a00:a041:3c5d:4d00:b981:f170:feac:7cf9","2a00:a040:0:4:face:b00c:3333:7020","TCP","88","41344  >  443 [ACK] Seq=1967 Ack=89808 Win=188416 Len=0 TSval=1280677855 TSecr=637492541"
"172","17.027589598","2a00:a040:0:4:face:b00c:3333:7020","2a00:a041:3c5d:4d00:b981:f170:feac:7cf9","TCP","1468","443  >  41344 [PSH, ACK] Seq=89808 Ack=1967 Win=31488 Len=1380 TSval=637492544 TSecr=1280677767 [TCP segment of a reassembled PDU]"
"173","17.027599826","2a00:a041:3c5d:4d00:b981:f170:feac:7cf9","2a00:a040:0:4:face:b00c:3333:7020","TCP","88","41344  >  443 [ACK] Seq=1967 Ack=91188 Win=191104 Len=0 TSval=1280677857 TSecr=637492544"
"174","17.029983173","2a00:a040:0:4:face:b00c:3333:7020","2a00:a041:3c5d:4d00:b981:f170:feac:7cf9","TCP","1468","443  >  41344 [ACK] Seq=91188 Ack=1967 Win=31488 Len=1380 TSval=637492546 TSecr=1280677767 [TCP segment of a reassembled PDU]"
"175","17.029991175","2a00:a041:3c5d:4d00:b981:f170:feac:7cf9","2a00:a040:0:4:face:b00c:3333:7020","TCP","88","41344  >  443 [ACK] Seq=1967 Ack=92568 Win=193920 Len=0 TSval=1280677859 TSecr=637492546"
"176","17.030645296","2a00:a040:0:4:face:b00c:3333:7020","2a00:a041:3c5d:4d00:b981:f170:feac:7cf9","TLSv1.3","1468","Application Data [TCP segment of a reassembled PDU]"
"177","17.030649588","2a00:a041:3c5d:4d00:b981:f170:feac:7cf9","2a00:a040:0:4:face:b00c:3333:7020","TCP","88","41344  >  443 [ACK] Seq=1967 Ack=93948 Win=196608 Len=0 TSval=1280677860 TSecr=637492546"
"178","17.035340748","2a00:a040:0:4:face:b00c:3333:7020","2a00:a041:3c5d:4d00:b981:f170:feac:7cf9","TLSv1.3","1468","Application Data [TCP segment of a reassembled PDU]"
"179","17.035352808","2a00:a041:3c5d:4d00:b981:f170:feac:7cf9","2a00:a040:0:4:face:b00c:3333:7020","TCP","88","41344  >  443 [ACK] Seq=1967 Ack=95328 Win=199424 Len=0 TSval=1280677865 TSecr=637492551"
"180","17.036102993","2a00:a040:0:4:face:b00c:3333:7020","2a00:a041:3c5d:4d00:b981:f170:feac:7cf9","TLSv1.3","1468","Application Data [TCP segment of a reassembled PDU]"
"181","17.036108826","2a00:a041:3c5d:4d00:b981:f170:feac:7cf9","2a00:a040:0:4:face:b00c:3333:7020","TCP","88","41344  >  443 [ACK] Seq=1967 Ack=96708 Win=202112 Len=0 TSval=1280677866 TSecr=637492551"
"182","17.046191853","2a00:a040:0:4:face:b00c:3333:7020","2a00:a041:3c5d:4d00:b981:f170:feac:7cf9","TLSv1.3","1468","Application Data [TCP segment of a reassembled PDU]"
"183","17.046216127","2a00:a041:3c5d:4d00:b981:f170:feac:7cf9","2a00:a040:0:4:face:b00c:3333:7020","TCP","88","41344  >  443 [ACK] Seq=1967 Ack=98088 Win=204928 Len=0 TSval=1280677876 TSecr=637492556"
"184","17.046402464","2a00:a040:0:4:face:b00c:3333:7020","2a00:a041:3c5d:4d00:b981:f170:feac:7cf9","TLSv1.3","1019","Application Data"
"185","17.046412324","2a00:a041:3c5d:4d00:b981:f170:feac:7cf9","2a00:a040:0:4:face:b00c:3333:7020","TCP","88","41344  >  443 [ACK] Seq=1967 Ack=99019 Win=207744 Len=0 TSval=1280677876 TSecr=637492556"
"186","17.316268052","2a00:a041:3c5d:4d00:b981:f170:feac:7cf9","2a03:2880:f258:c8:face:b00c:0:167","TLSv1.2","187","Application Data"
"187","17.623951590","2a03:2880:f258:c8:face:b00c:0:167","2a00:a041:3c5d:4d00:b981:f170:feac:7cf9","TCP","88","443  >  39412 [ACK] Seq=4812 Ack=637 Win=1364 Len=0 TSval=2507870493 TSecr=3659598563"
"188","28.593655161","2a00:a041:3c5d:4d00:b981:f170:feac:7cf9","2a03:2880:f258:c8:face:b00c:0:167","TLSv1.2","158","Application Data"
"189","29.195666446","2a03:2880:f258:c8:face:b00c:0:167","2a00:a041:3c5d:4d00:b981:f170:feac:7cf9","TCP","88","443  >  39412 [ACK] Seq=4812 Ack=707 Win=1364 Len=0 TSval=2507882151 TSecr=3659609840"
"190","29.255068572","2a03:2880:f258:c8:face:b00c:0:167","2a00:a041:3c5d:4d00:b981:f170:feac:7cf9","TLSv1.2","160","Application Data"
"191","29.255105195","2a00:a041:3c5d:4d00:b981:f170:feac:7cf9","2a03:2880:f258:c8:face:b00c:0:167","TCP","88","39412  >  443 [ACK] Seq=707 Ack=4884 Win=4404 Len=0 TSval=3659610502 TSecr=2507882231"
"193","36.159287222","2a03:2880:f258:c8:face:b00c:0:167","2a00:a041:3c5d:4d00:b981:f170:feac:7cf9","TLSv1.2","614","Application Data"
"194","36.159323986","2a00:a041:3c5d:4d00:b981:f170:feac:7cf9","2a03:2880:f258:c8:face:b00c:0:167","TCP","88","39412  >  443 [ACK] Seq=707 Ack=5410 Win=4404 Len=0 TSval=3659617406 TSecr=2507889035"
"195","36.605068547","2a00:a041:3c5d:4d00:b981:f170:feac:7cf9","2a03:2880:f258:c8:face:b00c:0:167","TLSv1.2","181","Application Data"
"198","36.977455055","2a03:2880:f258:c8:face:b00c:0:167","2a00:a041:3c5d:4d00:b981:f170:feac:7cf9","TCP","88","443  >  39412 [ACK] Seq=5410 Ack=800 Win=1364 Len=0 TSval=2507889851 TSecr=3659617852"
"201","47.218106752","2a03:2880:f258:c8:face:b00c:0:167","2a00:a041:3c5d:4d00:b981:f170:feac:7cf9","TLSv1.2","693","Application Data"
"202","47.218157728","2a00:a041:3c5d:4d00:b981:f170:feac:7cf9","2a03:2880:f258:c8:face:b00c:0:167","TCP","88","39412  >  443 [ACK] Seq=800 Ack=6015 Win=4404 Len=0 TSval=3659628465 TSecr=2507900172"
"203","47.796863930","2a00:a041:3c5d:4d00:b981:f170:feac:7cf9","2a03:2880:f258:c8:face:b00c:0:167","TLSv1.2","187","Application Data"
"204","48.651590735","2a03:2880:f258:c8:face:b00c:0:167","2a00:a041:3c5d:4d00:b981:f170:feac:7cf9","TCP","88","443  >  39412 [ACK] Seq=6015 Ack=899 Win=1364 Len=0 TSval=2507901509 TSecr=3659629043"
"213","55.307733129","2a03:2880:f258:c8:face:b00c:0:167","2a00:a041:3c5d:4d00:b981:f170:feac:7cf9","TLSv1.2","452","Application Data"
"214","55.307777398","2a00:a041:3c5d:4d00:b981:f170:feac:7cf9","2a03:2880:f258:c8:face:b00c:0:167","TCP","88","39412  >  443 [ACK] Seq=899 Ack=6379 Win=4404 Len=0 TSval=3659636554 TSecr=2507908265"
"215","55.761362013","2a00:a041:3c5d:4d00:b981:f170:feac:7cf9","2a03:2880:f258:c8:face:b00c:0:167","TLSv1.2","181","Application Data"
"216","56.127015568","2a03:2880:f258:c8:face:b00c:0:167","2a00:a041:3c5d:4d00:b981:f170:feac:7cf9","TCP","88","443  >  39412 [ACK] Seq=6379 Ack=992 Win=1364 Len=0 TSval=2507909016 TSecr=3659637008"
"217","58.016854382","2a00:a041:3c5d:4d00:b981:f170:feac:7cf9","2a03:2880:f258:c8:face:b00c:0:167","TLSv1.2","158","Application Data"
"218","58.386014382","2a03:2880:f258:c8:face:b00c:0:167","2a00:a041:3c5d:4d00:b981:f170:feac:7cf9","TCP","88","443  >  39412 [ACK] Seq=6379 Ack=1062 Win=1364 Len=0 TSval=2507911271 TSecr=3659639263"
"219","58.386898732","2a03:2880:f258:c8:face:b00c:0:167","2a00:a041:3c5d:4d00:b981:f170:feac:7cf9","TLSv1.2","160","Application Data"
"220","58.386935392","2a00:a041:3c5d:4d00:b981:f170:feac:7cf9","2a03:2880:f258:c8:face:b00c:0:167","TCP","88","39412  >  443 [ACK] Seq=1062 Ack=6451 Win=4404 Len=0 TSval=3659639633 TSecr=2507911352"
"221","59.199482344","2a03:2880:f258:c8:face:b00c:0:167","2a00:a041:3c5d:4d00:b981:f170:feac:7cf9","TLSv1.2","176","Application Data"
"222","59.199518027","2a00:a041:3c5d:4d00:b981:f170:feac:7cf9","2a03:2880:f258:c8:face:b00c:0:167","TCP","88","39412  >  443 [ACK] Seq=1062 Ack=6539 Win=4404 Len=0 TSval=3659640446 TSecr=2507912065"
"223","59.252090153","2a00:a041:3c5d:4d00:b981:f170:feac:7cf9","2a03:2880:f258:c8:face:b00c:0:167","TLSv1.2","160","Application Data"
"226","59.713090487","2a03:2880:f258:c8:face:b00c:0:167","2a00:a041:3c5d:4d00:b981:f170:feac:7cf9","TCP","88","443  >  39412 [ACK] Seq=6539 Ack=1134 Win=1364 Len=0 TSval=2507912584 TSecr=3659640499"
"227","61.773202856","2a00:a041:3c5d:4d00:b981:f170:feac:7cf9","2a03:2880:f258:c8:face:b00c:0:167","TLSv1.2","154","Application Data"
"228","61.773264483","2a00:a041:3c5d:4d00:b981:f170:feac:7cf9","2a03:2880:f258:c8:face:b00c:0:167","TLSv1.2","205","Application Data"
"229","62.475658479","2a03:2880:f258:c8:face:b00c:0:167","2a00:a041:3c5d:4d00:b981:f170:feac:7cf9","TCP","88","443  >  39412 [ACK] Seq=6539 Ack=1200 Win=1364 Len=0 TSval=2507915357 TSecr=3659643020"
"230","62.475658855","2a03:2880:f258:c8:face:b00c:0:167","2a00:a041:3c5d:4d00:b981:f170:feac:7cf9","TCP","88","443  >  39412 [ACK] Seq=6539 Ack=1317 Win=1364 Len=0 TSval=2507915357 TSecr=3659643020"
"246","65.946727357","2a00:a041:3c5d:4d00:b981:f170:feac:7cf9","2a03:2880:f258:c8:face:b00c:0:167","TLSv1.2","184","Application Data"
"247","65.946794256","2a00:a041:3c5d:4d00:b981:f170:feac:7cf9","2a03:2880:f258:c8:face:b00c:0:167","TLSv1.2","280","Application Data, Application Data"
"248","65.947065829","2a00:a041:3c5d:4d00:b981:f170:feac:7cf9","2a03:2880:f258:c8:face:b00c:0:167","TLSv1.2","1468","Application Data, Application Data, Application Data, Application Data, Application Data, Application Data, Application Data, Application Data, Application Data, Application Data, Application Data, Application Data, Application Data, Application Data"
