"No.","Time","Source","Destination","Protocol","Length","Info"
"2","2.241860984","2a10:8012:21:4188:c63c:3614:4d2b:1483","2a03:2880:f242:c8:face:b00c:0:167","TLSv1.2","154","Application Data"
"3","2.286214342","2a03:2880:f242:c8:face:b00c:0:167","2a10:8012:21:4188:c63c:3614:4d2b:1483","TCP","88","443  >  37170 [ACK] Seq=1 Ack=67 Win=558 Len=0 TSval=2105478902 TSecr=1505303011"
"8","10.025437898","2a03:2880:f242:c8:face:b00c:0:167","2a10:8012:21:4188:c63c:3614:4d2b:1483","TLSv1.2","367","Application Data"
"9","10.025472586","2a10:8012:21:4188:c63c:3614:4d2b:1483","2a03:2880:f242:c8:face:b00c:0:167","TCP","88","37170  >  443 [ACK] Seq=67 Ack=280 Win=616 Len=0 TSval=1505310794 TSecr=2105486624"
"10","10.383248305","2a10:8012:21:4188:c63c:3614:4d2b:1483","2a03:2880:f242:c8:face:b00c:0:167","TLSv1.2","160","Application Data"
"11","10.429121959","2a03:2880:f242:c8:face:b00c:0:167","2a10:8012:21:4188:c63c:3614:4d2b:1483","TCP","88","443  >  37170 [ACK] Seq=280 Ack=139 Win=558 Len=0 TSval=2105487043 TSecr=1505311152"
"13","12.757296830","2a10:8012:21:4188:c63c:3614:4d2b:1483","2a03:2880:f242:c8:face:b00c:0:167","TLSv1.2","158","Application Data"
"14","12.803113753","2a03:2880:f242:c8:face:b00c:0:167","2a10:8012:21:4188:c63c:3614:4d2b:1483","TCP","88","443  >  37170 [ACK] Seq=280 Ack=209 Win=558 Len=0 TSval=2105489417 TSecr=1505313526"
"15","12.994163878","2a03:2880:f242:c8:face:b00c:0:167","2a10:8012:21:4188:c63c:3614:4d2b:1483","TLSv1.2","160","Application Data"
"16","12.994219175","2a10:8012:21:4188:c63c:3614:4d2b:1483","2a03:2880:f242:c8:face:b00c:0:167","TCP","88","37170  >  443 [ACK] Seq=209 Ack=352 Win=616 Len=0 TSval=1505313763 TSecr=2105489544"
"18","13.815918478","2a03:2880:f242:c8:face:b00c:0:167","2a10:8012:21:4188:c63c:3614:4d2b:1483","TLSv1.2","1726","Application Data, Application Data"
"19","13.815951313","2a10:8012:21:4188:c63c:3614:4d2b:1483","2a03:2880:f242:c8:face:b00c:0:167","TCP","88","37170  >  443 [ACK] Seq=209 Ack=1990 Win=604 Len=0 TSval=1505314585 TSecr=2105490417"
"28","14.049442741","2a10:8012:21:4188:c63c:3614:4d2b:1483","2001:4cd0:bc00:d01:face:b00c:3333:7020","TCP","96","35396  >  443 [SYN] Seq=0 Win=64260 Len=0 MSS=1428 SACK_PERM=1 TSval=3500737765 TSecr=0 WS=128"
"29","14.054471280","2001:4cd0:bc00:d01:face:b00c:3333:7020","2a10:8012:21:4188:c63c:3614:4d2b:1483","TCP","96","443  >  35396 [SYN, ACK] Seq=0 Ack=1 Win=31740 Len=0 MSS=1392 SACK_PERM=1 TSval=4022178468 TSecr=3500737765 WS=256"
"30","14.054490782","2a10:8012:21:4188:c63c:3614:4d2b:1483","2001:4cd0:bc00:d01:face:b00c:3333:7020","TCP","88","35396  >  443 [ACK] Seq=1 Ack=1 Win=64384 Len=0 TSval=3500737770 TSecr=4022178468"
"31","14.054854681","2a10:8012:21:4188:c63c:3614:4d2b:1483","2001:4cd0:bc00:d01:face:b00c:3333:7020","TLSv1.3","794","Client Hello"
"32","14.059986516","2001:4cd0:bc00:d01:face:b00c:3333:7020","2a10:8012:21:4188:c63c:3614:4d2b:1483","TCP","88","443  >  35396 [ACK] Seq=1 Ack=707 Win=31232 Len=0 TSval=4022178473 TSecr=3500737771"
"33","14.062243724","2001:4cd0:bc00:d01:face:b00c:3333:7020","2a10:8012:21:4188:c63c:3614:4d2b:1483","TLSv1.3","253","Server Hello, Application Data"
"34","14.062250077","2a10:8012:21:4188:c63c:3614:4d2b:1483","2001:4cd0:bc00:d01:face:b00c:3333:7020","TCP","88","35396  >  443 [ACK] Seq=707 Ack=166 Win=64256 Len=0 TSval=3500737778 TSecr=4022178473"
"35","14.062422903","2a10:8012:21:4188:c63c:3614:4d2b:1483","2001:4cd0:bc00:d01:face:b00c:3333:7020","TLSv1.3","94","Change Cipher Spec"
"36","14.062464401","2a10:8012:21:4188:c63c:3614:4d2b:1483","2001:4cd0:bc00:d01:face:b00c:3333:7020","TLSv1.3","146","Application Data"
"37","14.063035590","2a10:8012:21:4188:c63c:3614:4d2b:1483","2001:4cd0:bc00:d01:face:b00c:3333:7020","TLSv1.3","686","Application Data"
"38","14.067489390","2001:4cd0:bc00:d01:face:b00c:3333:7020","2a10:8012:21:4188:c63c:3614:4d2b:1483","TCP","88","443  >  35396 [ACK] Seq=166 Ack=1369 Win=31488 Len=0 TSval=4022178481 TSecr=3500737778"
"39","14.067489448","2001:4cd0:bc00:d01:face:b00c:3333:7020","2a10:8012:21:4188:c63c:3614:4d2b:1483","TLSv1.3","269","Application Data"
"40","14.111119909","2a10:8012:21:4188:c63c:3614:4d2b:1483","2001:4cd0:bc00:d01:face:b00c:3333:7020","TCP","88","35396  >  443 [ACK] Seq=1369 Ack=347 Win=64128 Len=0 TSval=3500737827 TSecr=4022178481"
"41","14.123082269","2a10:8012:21:4188:c63c:3614:4d2b:1483","2a03:2880:f242:c8:face:b00c:0:167","TLSv1.2","184","Application Data"
"42","14.165954733","2a03:2880:f242:c8:face:b00c:0:167","2a10:8012:21:4188:c63c:3614:4d2b:1483","TCP","88","443  >  37170 [ACK] Seq=1990 Ack=305 Win=558 Len=0 TSval=2105490781 TSecr=1505314892"
"43","14.633630879","2001:4cd0:bc00:d01:face:b00c:3333:7020","2a10:8012:21:4188:c63c:3614:4d2b:1483","TLSv1.3","681","Application Data"
"44","14.633631171","2001:4cd0:bc00:d01:face:b00c:3333:7020","2a10:8012:21:4188:c63c:3614:4d2b:1483","TLSv1.3","1326","Application Data"
"45","14.633631217","2001:4cd0:bc00:d01:face:b00c:3333:7020","2a10:8012:21:4188:c63c:3614:4d2b:1483","TLSv1.3","6988","Application Data, Application Data, Application Data, Application Data"
"46","14.633631270","2001:4cd0:bc00:d01:face:b00c:3333:7020","2a10:8012:21:4188:c63c:3614:4d2b:1483","TLSv1.3","1430","Application Data"
"47","14.633664337","2a10:8012:21:4188:c63c:3614:4d2b:1483","2001:4cd0:bc00:d01:face:b00c:3333:7020","TCP","88","35396  >  443 [ACK] Seq=1369 Ack=940 Win=63616 Len=0 TSval=3500738349 TSecr=4022179009"
"48","14.633687469","2a10:8012:21:4188:c63c:3614:4d2b:1483","2001:4cd0:bc00:d01:face:b00c:3333:7020","TCP","88","35396  >  443 [ACK] Seq=1369 Ack=2178 Win=62464 Len=0 TSval=3500738349 TSecr=4022179009"
"49","14.633693781","2a10:8012:21:4188:c63c:3614:4d2b:1483","2001:4cd0:bc00:d01:face:b00c:3333:7020","TCP","88","35396  >  443 [ACK] Seq=1369 Ack=9078 Win=55680 Len=0 TSval=3500738349 TSecr=4022179009"
"50","14.633701108","2a10:8012:21:4188:c63c:3614:4d2b:1483","2001:4cd0:bc00:d01:face:b00c:3333:7020","TCP","88","35396  >  443 [ACK] Seq=1369 Ack=10420 Win=54400 Len=0 TSval=3500738349 TSecr=4022179009"
"51","14.635342994","2001:4cd0:bc00:d01:face:b00c:3333:7020","2a10:8012:21:4188:c63c:3614:4d2b:1483","TLSv1.3","5608","Application Data"
"52","14.635343236","2001:4cd0:bc00:d01:face:b00c:3333:7020","2a10:8012:21:4188:c63c:3614:4d2b:1483","TCP","1468","443  >  35396 [ACK] Seq=15940 Ack=1369 Win=31488 Len=1380 TSval=4022179034 TSecr=3500737827 [TCP segment of a reassembled PDU]"
"53","14.635372483","2a10:8012:21:4188:c63c:3614:4d2b:1483","2001:4cd0:bc00:d01:face:b00c:3333:7020","TCP","88","35396  >  443 [ACK] Seq=1369 Ack=15940 Win=56960 Len=0 TSval=3500738351 TSecr=4022179010"
"54","14.635393404","2a10:8012:21:4188:c63c:3614:4d2b:1483","2001:4cd0:bc00:d01:face:b00c:3333:7020","TCP","88","35396  >  443 [ACK] Seq=1369 Ack=17320 Win=55680 Len=0 TSval=3500738351 TSecr=4022179034"
"55","14.637833976","2001:4cd0:bc00:d01:face:b00c:3333:7020","2a10:8012:21:4188:c63c:3614:4d2b:1483","TLSv1.3","8368","Application Data, Application Data, Application Data, Application Data, Application Data"
"56","14.637848130","2a10:8012:21:4188:c63c:3614:4d2b:1483","2001:4cd0:bc00:d01:face:b00c:3333:7020","TCP","88","35396  >  443 [ACK] Seq=1369 Ack=25600 Win=52864 Len=0 TSval=3500738354 TSecr=4022179052"
"57","14.639301776","2001:4cd0:bc00:d01:face:b00c:3333:7020","2a10:8012:21:4188:c63c:3614:4d2b:1483","TLSv1.3","6988","Application Data, Application Data"
"58","14.639313891","2a10:8012:21:4188:c63c:3614:4d2b:1483","2001:4cd0:bc00:d01:face:b00c:3333:7020","TCP","88","35396  >  443 [ACK] Seq=1369 Ack=32500 Win=54912 Len=0 TSval=3500738355 TSecr=4022179053"
"59","14.639875360","2001:4cd0:bc00:d01:face:b00c:3333:7020","2a10:8012:21:4188:c63c:3614:4d2b:1483","TLSv1.3","6988","Application Data, Application Data, Application Data"
"60","14.639887004","2a10:8012:21:4188:c63c:3614:4d2b:1483","2001:4cd0:bc00:d01:face:b00c:3333:7020","TCP","88","35396  >  443 [ACK] Seq=1369 Ack=39400 Win=54912 Len=0 TSval=3500738356 TSecr=4022179054"
"61","14.640764880","2001:4cd0:bc00:d01:face:b00c:3333:7020","2a10:8012:21:4188:c63c:3614:4d2b:1483","TLSv1.3","5608","Application Data [TCP segment of a reassembled PDU]"
"62","14.640776581","2a10:8012:21:4188:c63c:3614:4d2b:1483","2001:4cd0:bc00:d01:face:b00c:3333:7020","TCP","88","35396  >  443 [ACK] Seq=1369 Ack=44920 Win=56960 Len=0 TSval=3500738357 TSecr=4022179055"
"63","14.641663187","2001:4cd0:bc00:d01:face:b00c:3333:7020","2a10:8012:21:4188:c63c:3614:4d2b:1483","TCP","1468","443  >  35396 [PSH, ACK] Seq=44920 Ack=1369 Win=31488 Len=1380 TSval=4022179055 TSecr=3500738351 [TCP segment of a reassembled PDU]"
"64","14.641674630","2a10:8012:21:4188:c63c:3614:4d2b:1483","2001:4cd0:bc00:d01:face:b00c:3333:7020","TCP","88","35396  >  443 [ACK] Seq=1369 Ack=46300 Win=63104 Len=0 TSval=3500738357 TSecr=4022179055"
"65","14.643234026","2001:4cd0:bc00:d01:face:b00c:3333:7020","2a10:8012:21:4188:c63c:3614:4d2b:1483","TLSv1.3","2848","Application Data [TCP segment of a reassembled PDU]"
"66","14.643234101","2001:4cd0:bc00:d01:face:b00c:3333:7020","2a10:8012:21:4188:c63c:3614:4d2b:1483","TLSv1.3","6988","Application Data, Application Data, Application Data, Application Data"
"67","14.643246439","2a10:8012:21:4188:c63c:3614:4d2b:1483","2001:4cd0:bc00:d01:face:b00c:3333:7020","TCP","88","35396  >  443 [ACK] Seq=1369 Ack=49060 Win=61056 Len=0 TSval=3500738359 TSecr=4022179056"
"68","14.643257120","2a10:8012:21:4188:c63c:3614:4d2b:1483","2001:4cd0:bc00:d01:face:b00c:3333:7020","TCP","88","35396  >  443 [ACK] Seq=1369 Ack=55960 Win=54272 Len=0 TSval=3500738359 TSecr=4022179056"
"69","14.645357633","2001:4cd0:bc00:d01:face:b00c:3333:7020","2a10:8012:21:4188:c63c:3614:4d2b:1483","TLSv1.3","1468","Application Data [TCP segment of a reassembled PDU]"
"70","14.645357748","2001:4cd0:bc00:d01:face:b00c:3333:7020","2a10:8012:21:4188:c63c:3614:4d2b:1483","TLSv1.3","6988","Application Data, Application Data"
"71","14.645370984","2a10:8012:21:4188:c63c:3614:4d2b:1483","2001:4cd0:bc00:d01:face:b00c:3333:7020","TCP","88","35396  >  443 [ACK] Seq=1369 Ack=57340 Win=63104 Len=0 TSval=3500738361 TSecr=4022179057"
"72","14.645383118","2a10:8012:21:4188:c63c:3614:4d2b:1483","2001:4cd0:bc00:d01:face:b00c:3333:7020","TCP","88","35396  >  443 [ACK] Seq=1369 Ack=64240 Win=56320 Len=0 TSval=3500738361 TSecr=4022179058"
"73","14.645992486","2001:4cd0:bc00:d01:face:b00c:3333:7020","2a10:8012:21:4188:c63c:3614:4d2b:1483","TLSv1.3","5608","Application Data, Application Data, Application Data"
"74","14.646001389","2a10:8012:21:4188:c63c:3614:4d2b:1483","2001:4cd0:bc00:d01:face:b00c:3333:7020","TCP","88","35396  >  443 [ACK] Seq=1369 Ack=69760 Win=56960 Len=0 TSval=3500738362 TSecr=4022179059"
"75","14.647824645","2001:4cd0:bc00:d01:face:b00c:3333:7020","2a10:8012:21:4188:c63c:3614:4d2b:1483","TLSv1.3","1468","Application Data [TCP segment of a reassembled PDU]"
"76","14.647824728","2001:4cd0:bc00:d01:face:b00c:3333:7020","2a10:8012:21:4188:c63c:3614:4d2b:1483","TLSv1.3","5608","Application Data, Application Data, Application Data"
"77","14.647955367","2a10:8012:21:4188:c63c:3614:4d2b:1483","2001:4cd0:bc00:d01:face:b00c:3333:7020","TCP","88","35396  >  443 [ACK] Seq=1369 Ack=76660 Win=54912 Len=0 TSval=3500738364 TSecr=4022179059"
"78","14.648498410","2001:4cd0:bc00:d01:face:b00c:3333:7020","2a10:8012:21:4188:c63c:3614:4d2b:1483","TLSv1.3","1468","Application Data [TCP segment of a reassembled PDU]"
"79","14.648498473","2001:4cd0:bc00:d01:face:b00c:3333:7020","2a10:8012:21:4188:c63c:3614:4d2b:1483","TLSv1.3","4228","Application Data [TCP segment of a reassembled PDU]"
"80","14.648508827","2a10:8012:21:4188:c63c:3614:4d2b:1483","2001:4cd0:bc00:d01:face:b00c:3333:7020","TCP","88","35396  >  443 [ACK] Seq=1369 Ack=82180 Win=56960 Len=0 TSval=3500738364 TSecr=4022179062"
"81","14.650592533","2001:4cd0:bc00:d01:face:b00c:3333:7020","2a10:8012:21:4188:c63c:3614:4d2b:1483","TLSv1.3","1468","Application Data [TCP segment of a reassembled PDU]"
"82","14.650592663","2001:4cd0:bc00:d01:face:b00c:3333:7020","2a10:8012:21:4188:c63c:3614:4d2b:1483","TLSv1.3","3839","Application Data, Application Data, Application Data"
"83","14.650604216","2a10:8012:21:4188:c63c:3614:4d2b:1483","2001:4cd0:bc00:d01:face:b00c:3333:7020","TCP","88","35396  >  443 [ACK] Seq=1369 Ack=87311 Win=56960 Len=0 TSval=3500738366 TSecr=4022179062"
"92","24.256906637","2a10:8012:21:4188:c63c:3614:4d2b:1483","2a03:2880:f242:c8:face:b00c:0:167","TLSv1.2","1806","Application Data"
"93","24.301516741","2a03:2880:f242:c8:face:b00c:0:167","2a10:8012:21:4188:c63c:3614:4d2b:1483","TCP","88","443  >  37170 [ACK] Seq=1990 Ack=2023 Win=571 Len=0 TSval=2105500916 TSecr=1505325026"
"96","24.428033557","2a03:2880:f242:c8:face:b00c:0:167","2a10:8012:21:4188:c63c:3614:4d2b:1483","TLSv1.2","152","Application Data"
"97","24.428064476","2a10:8012:21:4188:c63c:3614:4d2b:1483","2a03:2880:f242:c8:face:b00c:0:167","TCP","88","37170  >  443 [ACK] Seq=2023 Ack=2054 Win=616 Len=0 TSval=1505325197 TSecr=2105501043"
"104","46.276526656","2a03:2880:f242:c8:face:b00c:0:167","2a10:8012:21:4188:c63c:3614:4d2b:1483","TLSv1.2","1512","Application Data"
"105","46.276560816","2a10:8012:21:4188:c63c:3614:4d2b:1483","2a03:2880:f242:c8:face:b00c:0:167","TCP","88","37170  >  443 [ACK] Seq=2023 Ack=3478 Win=613 Len=0 TSval=1505347045 TSecr=2105522878"
"106","46.448294075","2a10:8012:21:4188:c63c:3614:4d2b:1483","2001:4cd0:bc00:d01:face:b00c:3333:7020","TLSv1.3","686","Application Data"
"107","46.472476832","2a10:8012:21:4188:c63c:3614:4d2b:1483","2a03:2880:f242:c8:face:b00c:0:167","TLSv1.2","184","Application Data"
"108","46.493917673","2001:4cd0:bc00:d01:face:b00c:3333:7020","2a10:8012:21:4188:c63c:3614:4d2b:1483","TCP","88","443  >  35396 [ACK] Seq=87311 Ack=1967 Win=31488 Len=0 TSval=4022210905 TSecr=3500770164"
"109","46.514983830","2a03:2880:f242:c8:face:b00c:0:167","2a10:8012:21:4188:c63c:3614:4d2b:1483","TCP","88","443  >  37170 [ACK] Seq=3478 Ack=2119 Win=571 Len=0 TSval=2105523128 TSecr=1505347241"
"112","46.790446539","2001:4cd0:bc00:d01:face:b00c:3333:7020","2a10:8012:21:4188:c63c:3614:4d2b:1483","TLSv1.3","681","Application Data"
"113","46.790446763","2001:4cd0:bc00:d01:face:b00c:3333:7020","2a10:8012:21:4188:c63c:3614:4d2b:1483","TLSv1.3","1326","Application Data"
"114","46.790446815","2001:4cd0:bc00:d01:face:b00c:3333:7020","2a10:8012:21:4188:c63c:3614:4d2b:1483","TLSv1.3","15268","Application Data, Application Data, Application Data, Application Data, Application Data, Application Data"
"115","46.790484110","2a10:8012:21:4188:c63c:3614:4d2b:1483","2001:4cd0:bc00:d01:face:b00c:3333:7020","TCP","88","35396  >  443 [ACK] Seq=1967 Ack=87904 Win=63616 Len=0 TSval=3500770506 TSecr=4022211127"
"116","46.790510143","2a10:8012:21:4188:c63c:3614:4d2b:1483","2001:4cd0:bc00:d01:face:b00c:3333:7020","TCP","88","35396  >  443 [ACK] Seq=1967 Ack=89142 Win=62464 Len=0 TSval=3500770506 TSecr=4022211127"
"117","46.790516751","2a10:8012:21:4188:c63c:3614:4d2b:1483","2001:4cd0:bc00:d01:face:b00c:3333:7020","TCP","88","35396  >  443 [ACK] Seq=1967 Ack=104322 Win=47360 Len=0 TSval=3500770506 TSecr=4022211128"
"118","46.791987811","2001:4cd0:bc00:d01:face:b00c:3333:7020","2a10:8012:21:4188:c63c:3614:4d2b:1483","TLSv1.3","15268","Application Data, Application Data, Application Data, Application Data, Application Data, Application Data, Application Data"
"119","46.792028383","2a10:8012:21:4188:c63c:3614:4d2b:1483","2001:4cd0:bc00:d01:face:b00c:3333:7020","TCP","88","35396  >  443 [ACK] Seq=1967 Ack=119502 Win=94592 Len=0 TSval=3500770508 TSecr=4022211128"
"120","46.792095699","2001:4cd0:bc00:d01:face:b00c:3333:7020","2a10:8012:21:4188:c63c:3614:4d2b:1483","TLSv1.3","15268","Application Data, Application Data, Application Data, Application Data, Application Data, Application Data"
"121","46.792109067","2a10:8012:21:4188:c63c:3614:4d2b:1483","2001:4cd0:bc00:d01:face:b00c:3333:7020","TCP","88","35396  >  443 [ACK] Seq=1967 Ack=134682 Win=124928 Len=0 TSval=3500770508 TSecr=4022211129"
"122","46.792124381","2001:4cd0:bc00:d01:face:b00c:3333:7020","2a10:8012:21:4188:c63c:3614:4d2b:1483","TLSv1.3","2848","Application Data [TCP segment of a reassembled PDU]"
"123","46.792130465","2a10:8012:21:4188:c63c:3614:4d2b:1483","2001:4cd0:bc00:d01:face:b00c:3333:7020","TCP","88","35396  >  443 [ACK] Seq=1967 Ack=137442 Win=130432 Len=0 TSval=3500770508 TSecr=4022211130"
"124","46.792845619","2001:4cd0:bc00:d01:face:b00c:3333:7020","2a10:8012:21:4188:c63c:3614:4d2b:1483","TLSv1.3","12508","Application Data, Application Data, Application Data, Application Data, Application Data, Application Data"
"125","46.792865644","2a10:8012:21:4188:c63c:3614:4d2b:1483","2001:4cd0:bc00:d01:face:b00c:3333:7020","TCP","88","35396  >  443 [ACK] Seq=1967 Ack=149862 Win=155264 Len=0 TSval=3500770509 TSecr=4022211130"
"126","46.792912391","2001:4cd0:bc00:d01:face:b00c:3333:7020","2a10:8012:21:4188:c63c:3614:4d2b:1483","TCP","1665","443  >  35396 [PSH, ACK] Seq=149862 Ack=1967 Win=31488 Len=1577 TSval=4022211131 TSecr=3500770164 [TCP segment of a reassembled PDU]"
"127","46.792912480","2001:4cd0:bc00:d01:face:b00c:3333:7020","2a10:8012:21:4188:c63c:3614:4d2b:1483","TCP","285","[TCP Retransmission] 443  >  35396 [ACK] Seq=151242 Ack=1967 Win=31488 Len=197 TSval=4022211154 TSecr=3500770164"
"128","46.792922050","2a10:8012:21:4188:c63c:3614:4d2b:1483","2001:4cd0:bc00:d01:face:b00c:3333:7020","TCP","88","35396  >  443 [ACK] Seq=1967 Ack=151439 Win=158464 Len=0 TSval=3500770509 TSecr=4022211131"
"129","46.792932484","2a10:8012:21:4188:c63c:3614:4d2b:1483","2001:4cd0:bc00:d01:face:b00c:3333:7020","TCP","100","[TCP Dup ACK 128#1] 35396  >  443 [ACK] Seq=1967 Ack=151439 Win=158464 Len=0 TSval=3500770509 TSecr=4022211154 SLE=151242 SRE=151439"
"130","46.796240438","2001:4cd0:bc00:d01:face:b00c:3333:7020","2a10:8012:21:4188:c63c:3614:4d2b:1483","TLSv1.3","2848","Application Data, Application Data"
"131","46.796255601","2a10:8012:21:4188:c63c:3614:4d2b:1483","2001:4cd0:bc00:d01:face:b00c:3333:7020","TCP","88","35396  >  443 [ACK] Seq=1967 Ack=154199 Win=163968 Len=0 TSval=3500770512 TSecr=4022211208"
"132","46.797093309","2001:4cd0:bc00:d01:face:b00c:3333:7020","2a10:8012:21:4188:c63c:3614:4d2b:1483","TLSv1.3","2848","Application Data [TCP segment of a reassembled PDU]"
"133","46.797106305","2a10:8012:21:4188:c63c:3614:4d2b:1483","2001:4cd0:bc00:d01:face:b00c:3333:7020","TCP","88","35396  >  443 [ACK] Seq=1967 Ack=156959 Win=169472 Len=0 TSval=3500770513 TSecr=4022211209"
"134","46.800386915","2001:4cd0:bc00:d01:face:b00c:3333:7020","2a10:8012:21:4188:c63c:3614:4d2b:1483","TLSv1.3","2848","Application Data, Application Data"
"135","46.800420447","2a10:8012:21:4188:c63c:3614:4d2b:1483","2001:4cd0:bc00:d01:face:b00c:3333:7020","TCP","88","35396  >  443 [ACK] Seq=1967 Ack=159719 Win=174976 Len=0 TSval=3500770516 TSecr=4022211211"
"136","46.800825286","2001:4cd0:bc00:d01:face:b00c:3333:7020","2a10:8012:21:4188:c63c:3614:4d2b:1483","TLSv1.3","2848","Application Data, Application Data"
"137","46.800833250","2a10:8012:21:4188:c63c:3614:4d2b:1483","2001:4cd0:bc00:d01:face:b00c:3333:7020","TCP","88","35396  >  443 [ACK] Seq=1967 Ack=162479 Win=180480 Len=0 TSval=3500770517 TSecr=4022211212"
"138","46.804577637","2001:4cd0:bc00:d01:face:b00c:3333:7020","2a10:8012:21:4188:c63c:3614:4d2b:1483","TLSv1.3","2848","Application Data [TCP segment of a reassembled PDU]"
"139","46.804578012","2001:4cd0:bc00:d01:face:b00c:3333:7020","2a10:8012:21:4188:c63c:3614:4d2b:1483","TLSv1.3","2848","Application Data [TCP segment of a reassembled PDU]"
"140","46.804613829","2a10:8012:21:4188:c63c:3614:4d2b:1483","2001:4cd0:bc00:d01:face:b00c:3333:7020","TCP","88","35396  >  443 [ACK] Seq=1967 Ack=165239 Win=185984 Len=0 TSval=3500770520 TSecr=4022211216"
"141","46.804656140","2a10:8012:21:4188:c63c:3614:4d2b:1483","2001:4cd0:bc00:d01:face:b00c:3333:7020","TCP","88","35396  >  443 [ACK] Seq=1967 Ack=167999 Win=191488 Len=0 TSval=3500770520 TSecr=4022211216"
"142","46.808353248","2001:4cd0:bc00:d01:face:b00c:3333:7020","2a10:8012:21:4188:c63c:3614:4d2b:1483","TCP","2848","443  >  35396 [PSH, ACK] Seq=167999 Ack=1967 Win=31488 Len=2760 TSval=4022211220 TSecr=3500770520 [TCP segment of a reassembled PDU]"
"143","46.808353614","2001:4cd0:bc00:d01:face:b00c:3333:7020","2a10:8012:21:4188:c63c:3614:4d2b:1483","TLSv1.3","2848","Application Data, Application Data"
"144","46.808389960","2a10:8012:21:4188:c63c:3614:4d2b:1483","2001:4cd0:bc00:d01:face:b00c:3333:7020","TCP","88","35396  >  443 [ACK] Seq=1967 Ack=170759 Win=197120 Len=0 TSval=3500770524 TSecr=4022211220"
"145","46.808413854","2a10:8012:21:4188:c63c:3614:4d2b:1483","2001:4cd0:bc00:d01:face:b00c:3333:7020","TCP","88","35396  >  443 [ACK] Seq=1967 Ack=173519 Win=202624 Len=0 TSval=3500770524 TSecr=4022211220"
"146","46.812603161","2001:4cd0:bc00:d01:face:b00c:3333:7020","2a10:8012:21:4188:c63c:3614:4d2b:1483","TLSv1.3","2848","Application Data, Application Data"
"147","46.812603476","2001:4cd0:bc00:d01:face:b00c:3333:7020","2a10:8012:21:4188:c63c:3614:4d2b:1483","TLSv1.3","2848","Application Data [TCP segment of a reassembled PDU]"
"148","46.812636687","2a10:8012:21:4188:c63c:3614:4d2b:1483","2001:4cd0:bc00:d01:face:b00c:3333:7020","TCP","88","35396  >  443 [ACK] Seq=1967 Ack=176279 Win=208128 Len=0 TSval=3500770528 TSecr=4022211224"
"149","46.812661350","2a10:8012:21:4188:c63c:3614:4d2b:1483","2001:4cd0:bc00:d01:face:b00c:3333:7020","TCP","88","35396  >  443 [ACK] Seq=1967 Ack=179039 Win=213632 Len=0 TSval=3500770528 TSecr=4022211224"
"150","46.816488154","2001:4cd0:bc00:d01:face:b00c:3333:7020","2a10:8012:21:4188:c63c:3614:4d2b:1483","TLSv1.3","2848","Application Data [TCP segment of a reassembled PDU]"
"151","46.816524216","2a10:8012:21:4188:c63c:3614:4d2b:1483","2001:4cd0:bc00:d01:face:b00c:3333:7020","TCP","88","35396  >  443 [ACK] Seq=1967 Ack=181799 Win=219136 Len=0 TSval=3500770532 TSecr=4022211228"
"152","46.816816933","2001:4cd0:bc00:d01:face:b00c:3333:7020","2a10:8012:21:4188:c63c:3614:4d2b:1483","TLSv1.3","1516","Application Data"
"153","46.816835120","2a10:8012:21:4188:c63c:3614:4d2b:1483","2001:4cd0:bc00:d01:face:b00c:3333:7020","TCP","88","35396  >  443 [ACK] Seq=1967 Ack=183227 Win=221952 Len=0 TSval=3500770533 TSecr=4022211229"
"157","52.638701989","2a10:8012:21:4188:c63c:3614:4d2b:1483","2a03:2880:f242:c8:face:b00c:0:167","TLSv1.2","158","Application Data"
"158","52.683995295","2a03:2880:f242:c8:face:b00c:0:167","2a10:8012:21:4188:c63c:3614:4d2b:1483","TCP","88","443  >  37170 [ACK] Seq=3478 Ack=2189 Win=571 Len=0 TSval=2105529296 TSecr=1505353407"
"159","52.830177404","2a03:2880:f242:c8:face:b00c:0:167","2a10:8012:21:4188:c63c:3614:4d2b:1483","TLSv1.2","160","Application Data"
"160","52.830216595","2a10:8012:21:4188:c63c:3614:4d2b:1483","2a03:2880:f242:c8:face:b00c:0:167","TCP","88","37170  >  443 [ACK] Seq=2189 Ack=3550 Win=616 Len=0 TSval=1505353599 TSecr=2105529423"
"161","70.385133881","2a10:8012:21:4188:c63c:3614:4d2b:1483","2a03:2880:f242:c8:face:b00c:0:167","TLSv1.2","158","Application Data"
"162","70.430429753","2a03:2880:f242:c8:face:b00c:0:167","2a10:8012:21:4188:c63c:3614:4d2b:1483","TCP","88","443  >  37170 [ACK] Seq=3550 Ack=2259 Win=571 Len=0 TSval=2105547041 TSecr=1505371154"
"163","70.649923123","2a03:2880:f242:c8:face:b00c:0:167","2a10:8012:21:4188:c63c:3614:4d2b:1483","TLSv1.2","160","Application Data"
"164","70.649960215","2a10:8012:21:4188:c63c:3614:4d2b:1483","2a03:2880:f242:c8:face:b00c:0:167","TCP","88","37170  >  443 [ACK] Seq=2259 Ack=3622 Win=616 Len=0 TSval=1505371419 TSecr=2105547167"
"165","76.077343780","2a03:2880:f242:c8:face:b00c:0:167","2a10:8012:21:4188:c63c:3614:4d2b:1483","TLSv1.2","1352","Application Data"
"166","76.077378649","2a10:8012:21:4188:c63c:3614:4d2b:1483","2a03:2880:f242:c8:face:b00c:0:167","TCP","88","37170  >  443 [ACK] Seq=2259 Ack=4886 Win=616 Len=0 TSval=1505376846 TSecr=2105552582"
"167","76.185813357","2a10:8012:21:4188:c63c:3614:4d2b:1483","2a03:2880:f242:c8:face:b00c:0:167","TLSv1.2","163","Application Data"
"168","76.186075618","2a10:8012:21:4188:c63c:3614:4d2b:1483","2001:4cd0:bc00:d01:face:b00c:3333:7020","TLSv1.3","686","Application Data"
"169","76.191818226","2001:4cd0:bc00:d01:face:b00c:3333:7020","2a10:8012:21:4188:c63c:3614:4d2b:1483","TCP","88","443  >  35396 [ACK] Seq=183227 Ack=2565 Win=30976 Len=0 TSval=4022240601 TSecr=3500799902"
"170","76.202362942","2a10:8012:21:4188:c63c:3614:4d2b:1483","2a03:2880:f242:c8:face:b00c:0:167","TLSv1.2","184","Application Data"
"171","76.229923025","2a03:2880:f242:c8:face:b00c:0:167","2a10:8012:21:4188:c63c:3614:4d2b:1483","TCP","88","443  >  37170 [ACK] Seq=4886 Ack=2334 Win=571 Len=0 TSval=2105552841 TSecr=1505376955"
"172","76.244965110","2a03:2880:f242:c8:face:b00c:0:167","2a10:8012:21:4188:c63c:3614:4d2b:1483","TCP","88","443  >  37170 [ACK] Seq=4886 Ack=2430 Win=571 Len=0 TSval=2105552856 TSecr=1505376971"
"173","76.384415036","2a03:2880:f242:c8:face:b00c:0:167","2a10:8012:21:4188:c63c:3614:4d2b:1483","TLSv1.2","1109","Application Data"
"174","76.384446260","2a10:8012:21:4188:c63c:3614:4d2b:1483","2a03:2880:f242:c8:face:b00c:0:167","TCP","88","37170  >  443 [ACK] Seq=2430 Ack=5907 Win=616 Len=0 TSval=1505377153 TSecr=2105552968"
"175","76.454083307","2001:4cd0:bc00:d01:face:b00c:3333:7020","2a10:8012:21:4188:c63c:3614:4d2b:1483","TLSv1.3","681","Application Data"
"176","76.454083671","2001:4cd0:bc00:d01:face:b00c:3333:7020","2a10:8012:21:4188:c63c:3614:4d2b:1483","TLSv1.3","1326","Application Data"
"177","76.454115174","2a10:8012:21:4188:c63c:3614:4d2b:1483","2001:4cd0:bc00:d01:face:b00c:3333:7020","TCP","88","35396  >  443 [ACK] Seq=2565 Ack=183820 Win=224768 Len=0 TSval=3500800170 TSecr=4022240864"
"178","76.454138828","2a10:8012:21:4188:c63c:3614:4d2b:1483","2001:4cd0:bc00:d01:face:b00c:3333:7020","TCP","88","35396  >  443 [ACK] Seq=2565 Ack=185058 Win=227456 Len=0 TSval=3500800170 TSecr=4022240864"
"179","76.455191900","2001:4cd0:bc00:d01:face:b00c:3333:7020","2a10:8012:21:4188:c63c:3614:4d2b:1483","TLSv1.3","16648","Application Data, Application Data, Application Data, Application Data, Application Data, Application Data, Application Data"
"180","76.455225434","2a10:8012:21:4188:c63c:3614:4d2b:1483","2001:4cd0:bc00:d01:face:b00c:3333:7020","TCP","88","35396  >  443 [ACK] Seq=2565 Ack=201618 Win=260608 Len=0 TSval=3500800171 TSecr=4022240864"
"181","76.456302839","2001:4cd0:bc00:d01:face:b00c:3333:7020","2a10:8012:21:4188:c63c:3614:4d2b:1483","TLSv1.3","16648","Application Data, Application Data, Application Data, Application Data, Application Data, Application Data, Application Data"
"182","76.456322477","2a10:8012:21:4188:c63c:3614:4d2b:1483","2001:4cd0:bc00:d01:face:b00c:3333:7020","TCP","88","35396  >  443 [ACK] Seq=2565 Ack=218178 Win=293760 Len=0 TSval=3500800172 TSecr=4022240865"
"183","76.457524473","2001:4cd0:bc00:d01:face:b00c:3333:7020","2a10:8012:21:4188:c63c:3614:4d2b:1483","TLSv1.3","11129","Application Data, Application Data, Application Data, Application Data, Application Data"
"184","76.457541025","2a10:8012:21:4188:c63c:3614:4d2b:1483","2001:4cd0:bc00:d01:face:b00c:3333:7020","TCP","88","35396  >  443 [ACK] Seq=2565 Ack=229219 Win=315776 Len=0 TSval=3500800173 TSecr=4022240866"
"185","76.458701595","2001:4cd0:bc00:d01:face:b00c:3333:7020","2a10:8012:21:4188:c63c:3614:4d2b:1483","TLSv1.3","16648","Application Data, Application Data, Application Data, Application Data, Application Data, Application Data, Application Data"
"186","76.458717628","2a10:8012:21:4188:c63c:3614:4d2b:1483","2001:4cd0:bc00:d01:face:b00c:3333:7020","TCP","88","35396  >  443 [ACK] Seq=2565 Ack=245779 Win=348928 Len=0 TSval=3500800174 TSecr=4022240867"
"187","76.459696555","2001:4cd0:bc00:d01:face:b00c:3333:7020","2a10:8012:21:4188:c63c:3614:4d2b:1483","TLSv1.3","5438","Application Data, Application Data, Application Data"
"188","76.459710369","2a10:8012:21:4188:c63c:3614:4d2b:1483","2001:4cd0:bc00:d01:face:b00c:3333:7020","TCP","88","35396  >  443 [ACK] Seq=2565 Ack=251129 Win=359680 Len=0 TSval=3500800175 TSecr=4022240868"
"193","83.450756792","2a03:2880:f242:c8:face:b00c:0:167","2a10:8012:21:4188:c63c:3614:4d2b:1483","TLSv1.2","274","Application Data"
"194","83.450814504","2a10:8012:21:4188:c63c:3614:4d2b:1483","2a03:2880:f242:c8:face:b00c:0:167","TCP","88","37170  >  443 [ACK] Seq=2430 Ack=6093 Win=616 Len=0 TSval=1505384220 TSecr=2105559976"
"195","83.609465176","2a10:8012:21:4188:c63c:3614:4d2b:1483","2a03:2880:f242:c8:face:b00c:0:167","TLSv1.2","160","Application Data"
"196","83.654677233","2a03:2880:f242:c8:face:b00c:0:167","2a10:8012:21:4188:c63c:3614:4d2b:1483","TCP","88","443  >  37170 [ACK] Seq=6093 Ack=2502 Win=571 Len=0 TSval=2105560263 TSecr=1505384378"
"197","84.269972210","2a03:2880:f242:c8:face:b00c:0:167","2a10:8012:21:4188:c63c:3614:4d2b:1483","TLSv1.2","274","Application Data"
"198","84.270008801","2a10:8012:21:4188:c63c:3614:4d2b:1483","2a03:2880:f242:c8:face:b00c:0:167","TCP","88","37170  >  443 [ACK] Seq=2502 Ack=6279 Win=616 Len=0 TSval=1505385039 TSecr=2105560813"
"199","84.941051464","2a10:8012:21:4188:c63c:3614:4d2b:1483","2a03:2880:f242:c8:face:b00c:0:167","TLSv1.2","160","Application Data"
"200","84.985589674","2a03:2880:f242:c8:face:b00c:0:167","2a10:8012:21:4188:c63c:3614:4d2b:1483","TCP","88","443  >  37170 [ACK] Seq=6279 Ack=2574 Win=571 Len=0 TSval=2105561595 TSecr=1505385710"
"204","92.089459487","2a10:8012:21:4188:c63c:3614:4d2b:1483","2a03:2880:f242:c8:face:b00c:0:167","TLSv1.2","158","Application Data"
"205","92.133691749","2a03:2880:f242:c8:face:b00c:0:167","2a10:8012:21:4188:c63c:3614:4d2b:1483","TCP","88","443  >  37170 [ACK] Seq=6279 Ack=2644 Win=571 Len=0 TSval=2105568743 TSecr=1505392858"
"206","92.492765846","2a03:2880:f242:c8:face:b00c:0:167","2a10:8012:21:4188:c63c:3614:4d2b:1483","TLSv1.2","160","Application Data"
"207","92.492803499","2a10:8012:21:4188:c63c:3614:4d2b:1483","2a03:2880:f242:c8:face:b00c:0:167","TCP","88","37170  >  443 [ACK] Seq=2644 Ack=6351 Win=616 Len=0 TSval=1505393262 TSecr=2105568869"
"208","92.504154451","2a03:2880:f242:c8:face:b00c:0:167","2a10:8012:21:4188:c63c:3614:4d2b:1483","TCP","160","[TCP Spurious Retransmission] 443  >  37170 [PSH, ACK] Seq=6279 Ack=2644 Win=571 Len=72 TSval=2105569113 TSecr=1505392858"
"209","92.504183018","2a10:8012:21:4188:c63c:3614:4d2b:1483","2a03:2880:f242:c8:face:b00c:0:167","TCP","100","[TCP Dup ACK 207#1] 37170  >  443 [ACK] Seq=2644 Ack=6351 Win=616 Len=0 TSval=1505393273 TSecr=2105569113 SLE=6279 SRE=6351"
"213","99.529152155","2a03:2880:f242:c8:face:b00c:0:167","2a10:8012:21:4188:c63c:3614:4d2b:1483","TLSv1.2","1416","Application Data"
"214","99.529190710","2a10:8012:21:4188:c63c:3614:4d2b:1483","2a03:2880:f242:c8:face:b00c:0:167","TCP","88","37170  >  443 [ACK] Seq=2644 Ack=7679 Win=616 Len=0 TSval=1505400298 TSecr=2105576040"
"215","100.022437089","2a10:8012:21:4188:c63c:3614:4d2b:1483","2001:4cd0:bc00:d01:face:b00c:3333:7020","TLSv1.3","686","Application Data"
"216","100.028140909","2001:4cd0:bc00:d01:face:b00c:3333:7020","2a10:8012:21:4188:c63c:3614:4d2b:1483","TCP","88","443  >  35396 [ACK] Seq=251129 Ack=3163 Win=30976 Len=0 TSval=4022264436 TSecr=3500823738"
"217","100.139976393","2a10:8012:21:4188:c63c:3614:4d2b:1483","2a03:2880:f242:c8:face:b00c:0:167","TLSv1.2","184","Application Data"
"218","100.183359086","2a03:2880:f242:c8:face:b00c:0:167","2a10:8012:21:4188:c63c:3614:4d2b:1483","TCP","88","443  >  37170 [ACK] Seq=7679 Ack=2740 Win=571 Len=0 TSval=2105576792 TSecr=1505400909"
"219","100.234123655","2001:4cd0:bc00:d01:face:b00c:3333:7020","2a10:8012:21:4188:c63c:3614:4d2b:1483","TLSv1.3","682","Application Data"
"220","100.234123863","2001:4cd0:bc00:d01:face:b00c:3333:7020","2a10:8012:21:4188:c63c:3614:4d2b:1483","TLSv1.3","111","Application Data"
"221","100.234123880","2001:4cd0:bc00:d01:face:b00c:3333:7020","2a10:8012:21:4188:c63c:3614:4d2b:1483","TCP","1468","443  >  35396 [ACK] Seq=251746 Ack=3163 Win=31488 Len=1380 TSval=4022264642 TSecr=3500823738 [TCP segment of a reassembled PDU]"
"222","100.234140010","2a10:8012:21:4188:c63c:3614:4d2b:1483","2001:4cd0:bc00:d01:face:b00c:3333:7020","TCP","88","35396  >  443 [ACK] Seq=3163 Ack=251723 Win=362368 Len=0 TSval=3500823950 TSecr=4022264642"
"223","100.234149550","2a10:8012:21:4188:c63c:3614:4d2b:1483","2001:4cd0:bc00:d01:face:b00c:3333:7020","TCP","88","35396  >  443 [ACK] Seq=3163 Ack=251746 Win=362368 Len=0 TSval=3500823950 TSecr=4022264642"
"224","100.234152562","2a10:8012:21:4188:c63c:3614:4d2b:1483","2001:4cd0:bc00:d01:face:b00c:3333:7020","TCP","88","35396  >  443 [ACK] Seq=3163 Ack=253126 Win=365184 Len=0 TSval=3500823950 TSecr=4022264642"
"225","100.235560808","2001:4cd0:bc00:d01:face:b00c:3333:7020","2a10:8012:21:4188:c63c:3614:4d2b:1483","TLSv1.3","20788","Application Data, Application Data, Application Data, Application Data, Application Data, Application Data, Application Data, Application Data, Application Data, Application Data, Application Data"
"226","100.235570650","2a10:8012:21:4188:c63c:3614:4d2b:1483","2001:4cd0:bc00:d01:face:b00c:3333:7020","TCP","88","35396  >  443 [ACK] Seq=3163 Ack=273826 Win=406528 Len=0 TSval=3500823951 TSecr=4022264642"
"227","100.237195642","2001:4cd0:bc00:d01:face:b00c:3333:7020","2a10:8012:21:4188:c63c:3614:4d2b:1483","TLSv1.3","22168","Application Data, Application Data, Application Data, Application Data, Application Data, Application Data, Application Data, Application Data"
"228","100.237204016","2a10:8012:21:4188:c63c:3614:4d2b:1483","2001:4cd0:bc00:d01:face:b00c:3333:7020","TCP","88","35396  >  443 [ACK] Seq=3163 Ack=295906 Win=450688 Len=0 TSval=3500823953 TSecr=4022264643"
"229","100.238496030","2001:4cd0:bc00:d01:face:b00c:3333:7020","2a10:8012:21:4188:c63c:3614:4d2b:1483","TLSv1.3","22168","Application Data, Application Data, Application Data, Application Data, Application Data, Application Data, Application Data, Application Data, Application Data, Application Data, Application Data"
"230","100.238502738","2a10:8012:21:4188:c63c:3614:4d2b:1483","2001:4cd0:bc00:d01:face:b00c:3333:7020","TCP","88","35396  >  443 [ACK] Seq=3163 Ack=317986 Win=494848 Len=0 TSval=3500823954 TSecr=4022264644"
"231","100.239505736","2001:4cd0:bc00:d01:face:b00c:3333:7020","2a10:8012:21:4188:c63c:3614:4d2b:1483","TLSv1.3","5608","Application Data, Application Data, Application Data"
"232","100.239511905","2a10:8012:21:4188:c63c:3614:4d2b:1483","2001:4cd0:bc00:d01:face:b00c:3333:7020","TCP","88","35396  >  443 [ACK] Seq=3163 Ack=323506 Win=505984 Len=0 TSval=3500823955 TSecr=4022264645"
"233","100.239924288","2001:4cd0:bc00:d01:face:b00c:3333:7020","2a10:8012:21:4188:c63c:3614:4d2b:1483","TLSv1.3","5608","Application Data, Application Data, Application Data"
"234","100.239927269","2a10:8012:21:4188:c63c:3614:4d2b:1483","2001:4cd0:bc00:d01:face:b00c:3333:7020","TCP","88","35396  >  443 [ACK] Seq=3163 Ack=329026 Win=516992 Len=0 TSval=3500823956 TSecr=4022264645"
"235","100.241567339","2001:4cd0:bc00:d01:face:b00c:3333:7020","2a10:8012:21:4188:c63c:3614:4d2b:1483","TLSv1.3","11128","Application Data, Application Data, Application Data, Application Data, Application Data"
"236","100.241571281","2a10:8012:21:4188:c63c:3614:4d2b:1483","2001:4cd0:bc00:d01:face:b00c:3333:7020","TCP","88","35396  >  443 [ACK] Seq=3163 Ack=340066 Win=539008 Len=0 TSval=3500823957 TSecr=4022264645"
"237","100.241586966","2001:4cd0:bc00:d01:face:b00c:3333:7020","2a10:8012:21:4188:c63c:3614:4d2b:1483","TLSv1.3","18063","Application Data, Application Data, Application Data, Application Data, Application Data, Application Data, Application Data, Application Data, Application Data, Application Data, Application Data, Application Data"
"238","100.241591469","2a10:8012:21:4188:c63c:3614:4d2b:1483","2001:4cd0:bc00:d01:face:b00c:3333:7020","TCP","88","35396  >  443 [ACK] Seq=3163 Ack=358041 Win=574976 Len=0 TSval=3500823957 TSecr=4022264646"
"248","111.509798168","2a03:2880:f242:c8:face:b00c:0:167","2a10:8012:21:4188:c63c:3614:4d2b:1483","TLSv1.2","274","Application Data"
"249","111.509834569","2a10:8012:21:4188:c63c:3614:4d2b:1483","2a03:2880:f242:c8:face:b00c:0:167","TCP","88","37170  >  443 [ACK] Seq=2740 Ack=7865 Win=616 Len=0 TSval=1505412279 TSecr=2105588032"
"250","111.617380274","2a10:8012:21:4188:c63c:3614:4d2b:1483","2a03:2880:f242:c8:face:b00c:0:167","TLSv1.2","160","Application Data"
"251","111.661944638","2a03:2880:f242:c8:face:b00c:0:167","2a10:8012:21:4188:c63c:3614:4d2b:1483","TCP","88","443  >  37170 [ACK] Seq=7865 Ack=2812 Win=571 Len=0 TSval=2105588270 TSecr=1505412386"
"252","113.148345493","2a03:2880:f242:c8:face:b00c:0:167","2a10:8012:21:4188:c63c:3614:4d2b:1483","TLSv1.2","220","Application Data"
"253","113.148384383","2a10:8012:21:4188:c63c:3614:4d2b:1483","2a03:2880:f242:c8:face:b00c:0:167","TCP","88","37170  >  443 [ACK] Seq=2812 Ack=7997 Win=616 Len=0 TSval=1505413917 TSecr=2105589676"
"254","113.380185612","2a10:8012:21:4188:c63c:3614:4d2b:1483","2a03:2880:f242:c8:face:b00c:0:167","TLSv1.2","161","Application Data"
"255","113.424409943","2a03:2880:f242:c8:face:b00c:0:167","2a10:8012:21:4188:c63c:3614:4d2b:1483","TCP","88","443  >  37170 [ACK] Seq=7997 Ack=2885 Win=571 Len=0 TSval=2105590033 TSecr=1505414149"
"278","118.410362699","2a10:8012:21:4188:c63c:3614:4d2b:1483","2a03:2880:f242:c8:face:b00c:0:167","TLSv1.2","158","Application Data"
"279","118.454500610","2a03:2880:f242:c8:face:b00c:0:167","2a10:8012:21:4188:c63c:3614:4d2b:1483","TCP","88","443  >  37170 [ACK] Seq=7997 Ack=2955 Win=571 Len=0 TSval=2105595064 TSecr=1505419179"
"282","118.676861862","2a03:2880:f242:c8:face:b00c:0:167","2a10:8012:21:4188:c63c:3614:4d2b:1483","TLSv1.2","160","Application Data"
"283","118.676901920","2a10:8012:21:4188:c63c:3614:4d2b:1483","2a03:2880:f242:c8:face:b00c:0:167","TCP","88","37170  >  443 [ACK] Seq=2955 Ack=8069 Win=616 Len=0 TSval=1505419446 TSecr=2105595189"
"304","132.612531238","2a03:2880:f242:c8:face:b00c:0:167","2a10:8012:21:4188:c63c:3614:4d2b:1483","TLSv1.2","1304","Application Data"
"305","132.612582629","2a10:8012:21:4188:c63c:3614:4d2b:1483","2a03:2880:f242:c8:face:b00c:0:167","TCP","88","37170  >  443 [ACK] Seq=2955 Ack=9285 Win=616 Len=0 TSval=1505433381 TSecr=2105608954"
"306","132.806510687","2a10:8012:21:4188:c63c:3614:4d2b:1483","2001:4cd0:bc00:d01:face:b00c:3333:7020","TLSv1.3","686","Application Data"
"307","132.820766058","2001:4cd0:bc00:d01:face:b00c:3333:7020","2a10:8012:21:4188:c63c:3614:4d2b:1483","TCP","88","443  >  35396 [ACK] Seq=358041 Ack=3761 Win=30976 Len=0 TSval=4022297230 TSecr=3500856522"
"308","132.897949897","2a10:8012:21:4188:c63c:3614:4d2b:1483","2a03:2880:f242:c8:face:b00c:0:167","TLSv1.2","184","Application Data"
"309","133.022183478","2a03:2880:f242:c8:face:b00c:0:167","2a10:8012:21:4188:c63c:3614:4d2b:1483","TCP","88","443  >  37170 [ACK] Seq=9285 Ack=3051 Win=571 Len=0 TSval=2105609551 TSecr=1505433667"
"310","133.318589179","2001:4cd0:bc00:d01:face:b00c:3333:7020","2a10:8012:21:4188:c63c:3614:4d2b:1483","TLSv1.3","684","Application Data"
"311","133.318589406","2001:4cd0:bc00:d01:face:b00c:3333:7020","2a10:8012:21:4188:c63c:3614:4d2b:1483","TLSv1.3","1323","Application Data"
"312","133.318589453","2001:4cd0:bc00:d01:face:b00c:3333:7020","2a10:8012:21:4188:c63c:3614:4d2b:1483","TLSv1.3","2848","Application Data"
"313","133.318627191","2a10:8012:21:4188:c63c:3614:4d2b:1483","2001:4cd0:bc00:d01:face:b00c:3333:7020","TCP","88","35396  >  443 [ACK] Seq=3761 Ack=358637 Win=577792 Len=0 TSval=3500857034 TSecr=4022297562"
"314","133.318649635","2a10:8012:21:4188:c63c:3614:4d2b:1483","2001:4cd0:bc00:d01:face:b00c:3333:7020","TCP","88","35396  >  443 [ACK] Seq=3761 Ack=359872 Win=580480 Len=0 TSval=3500857034 TSecr=4022297562"
"315","133.318656207","2a10:8012:21:4188:c63c:3614:4d2b:1483","2001:4cd0:bc00:d01:face:b00c:3333:7020","TCP","88","35396  >  443 [ACK] Seq=3761 Ack=362632 Win=585984 Len=0 TSval=3500857034 TSecr=4022297562"
