"No.","Time","Source","Destination","Protocol","Length","Info"
"1","0.000000000","2a00:a041:3c5d:4d00:424b:6377:a930:43d","2a03:2880:f258:1c3:face:b00c:0:167","TLSv1.2","157","Application Data"
"5","0.078755170","2a03:2880:f258:1c3:face:b00c:0:167","2a00:a041:3c5d:4d00:424b:6377:a930:43d","TCP","88","443  >  41660 [ACK] Seq=1 Ack=70 Win=579 Len=0 TSval=3180550348 TSecr=2765500977"
"6","0.158515797","2a03:2880:f258:1c3:face:b00c:0:167","2a00:a041:3c5d:4d00:424b:6377:a930:43d","TLSv1.2","159","Application Data"
"7","0.158548406","2a00:a041:3c5d:4d00:424b:6377:a930:43d","2a03:2880:f258:1c3:face:b00c:0:167","TCP","88","41660  >  443 [ACK] Seq=70 Ack=72 Win=1170 Len=0 TSval=2765501136 TSecr=3180550429"
"15","4.834892125","2a03:2880:f258:1c3:face:b00c:0:167","2a00:a041:3c5d:4d00:424b:6377:a930:43d","TLSv1.2","1430","Application Data"
"16","4.834927896","2a00:a041:3c5d:4d00:424b:6377:a930:43d","2a03:2880:f258:1c3:face:b00c:0:167","TCP","88","41660  >  443 [ACK] Seq=70 Ack=1414 Win=1174 Len=0 TSval=2765505812 TSecr=3180555010"
"19","5.114741529","2a00:a041:3c5d:4d00:424b:6377:a930:43d","2a03:2880:f258:1c3:face:b00c:0:167","TLSv1.2","181","Application Data"
"20","5.191444396","2a03:2880:f258:1c3:face:b00c:0:167","2a00:a041:3c5d:4d00:424b:6377:a930:43d","TCP","88","443  >  41660 [ACK] Seq=1414 Ack=163 Win=579 Len=0 TSval=3180555463 TSecr=2765506092"
"21","6.059509303","2a00:a041:3c5d:4d00:424b:6377:a930:43d","2a00:a040:0:4:face:b00c:3333:7020","TLSv1.2","112","Application Data"
"22","6.059557048","2a00:a041:3c5d:4d00:424b:6377:a930:43d","2a00:a040:0:4:face:b00c:3333:7020","TCP","88","38828  >  443 [FIN, ACK] Seq=25 Ack=1 Win=724 Len=0 TSval=3874257209 TSecr=2838204599"
"23","6.074920433","2a00:a041:3c5d:4d00:424b:6377:a930:43d","2a00:a040:0:4:face:b00c:3333:7020","TLSv1.2","112","Application Data"
"24","6.074968182","2a00:a041:3c5d:4d00:424b:6377:a930:43d","2a00:a040:0:4:face:b00c:3333:7020","TCP","88","38842  >  443 [FIN, ACK] Seq=25 Ack=1 Win=1234 Len=0 TSval=3874257224 TSecr=2164903221"
"25","6.078415968","2a00:a040:0:4:face:b00c:3333:7020","2a00:a041:3c5d:4d00:424b:6377:a930:43d","TCP","100","443  >  38828 [ACK] Seq=1 Ack=1 Win=123 Len=0 TSval=2838264635 TSecr=3874197207 SLE=25 SRE=26"
"26","6.078859007","2a00:a040:0:4:face:b00c:3333:7020","2a00:a041:3c5d:4d00:424b:6377:a930:43d","TCP","88","443  >  38828 [ACK] Seq=1 Ack=26 Win=123 Len=0 TSval=2838264635 TSecr=3874257209"
"27","6.078859193","2a00:a040:0:4:face:b00c:3333:7020","2a00:a041:3c5d:4d00:424b:6377:a930:43d","TLSv1.2","112","Application Data"
"28","6.078910854","2a00:a041:3c5d:4d00:424b:6377:a930:43d","2a00:a040:0:4:face:b00c:3333:7020","TCP","76","38828  >  443 [RST] Seq=26 Win=0 Len=0"
"29","6.079177813","2a00:a040:0:4:face:b00c:3333:7020","2a00:a041:3c5d:4d00:424b:6377:a930:43d","TCP","88","443  >  38828 [FIN, ACK] Seq=25 Ack=26 Win=123 Len=0 TSval=2838264635 TSecr=3874257209"
"30","6.079196017","2a00:a041:3c5d:4d00:424b:6377:a930:43d","2a00:a040:0:4:face:b00c:3333:7020","TCP","76","38828  >  443 [RST] Seq=26 Win=0 Len=0"
"31","6.086359633","2a00:a041:3c5d:4d00:424b:6377:a930:43d","2a00:a040:0:4:face:b00c:3333:7020","TLSv1.2","112","Application Data"
"32","6.086406593","2a00:a041:3c5d:4d00:424b:6377:a930:43d","2a00:a040:0:4:face:b00c:3333:7020","TCP","88","38830  >  443 [FIN, ACK] Seq=25 Ack=1 Win=972 Len=0 TSval=3874257236 TSecr=2943699257"
"33","6.097482952","2a00:a040:0:4:face:b00c:3333:7020","2a00:a041:3c5d:4d00:424b:6377:a930:43d","TCP","100","443  >  38842 [ACK] Seq=1 Ack=1 Win=123 Len=0 TSval=2164963261 TSecr=3874197267 SLE=25 SRE=26"
"34","6.097970183","2a00:a040:0:4:face:b00c:3333:7020","2a00:a041:3c5d:4d00:424b:6377:a930:43d","TCP","88","443  >  38842 [ACK] Seq=1 Ack=26 Win=123 Len=0 TSval=2164963261 TSecr=3874257224"
"35","6.097970410","2a00:a040:0:4:face:b00c:3333:7020","2a00:a041:3c5d:4d00:424b:6377:a930:43d","TLSv1.2","112","Application Data"
"36","6.098031236","2a00:a041:3c5d:4d00:424b:6377:a930:43d","2a00:a040:0:4:face:b00c:3333:7020","TCP","76","38842  >  443 [RST] Seq=26 Win=0 Len=0"
"37","6.098327508","2a00:a040:0:4:face:b00c:3333:7020","2a00:a041:3c5d:4d00:424b:6377:a930:43d","TCP","88","443  >  38842 [FIN, ACK] Seq=25 Ack=26 Win=123 Len=0 TSval=2164963261 TSecr=3874257224"
"38","6.098345019","2a00:a041:3c5d:4d00:424b:6377:a930:43d","2a00:a040:0:4:face:b00c:3333:7020","TCP","76","38842  >  443 [RST] Seq=26 Win=0 Len=0"
"39","6.104223071","2a00:a040:0:4:face:b00c:3333:7020","2a00:a041:3c5d:4d00:424b:6377:a930:43d","TCP","88","443  >  38830 [ACK] Seq=1 Ack=25 Win=123 Len=0 TSval=2943759291 TSecr=3874257236"
"40","6.104384345","2a00:a040:0:4:face:b00c:3333:7020","2a00:a041:3c5d:4d00:424b:6377:a930:43d","TLSv1.2","112","Application Data"
"41","6.104384423","2a00:a040:0:4:face:b00c:3333:7020","2a00:a041:3c5d:4d00:424b:6377:a930:43d","TCP","88","443  >  38830 [FIN, ACK] Seq=25 Ack=26 Win=123 Len=0 TSval=2943759291 TSecr=3874257236"
"42","6.104416014","2a00:a041:3c5d:4d00:424b:6377:a930:43d","2a00:a040:0:4:face:b00c:3333:7020","TCP","76","38830  >  443 [RST] Seq=26 Win=0 Len=0"
"43","6.104443181","2a00:a041:3c5d:4d00:424b:6377:a930:43d","2a00:a040:0:4:face:b00c:3333:7020","TCP","76","38830  >  443 [RST] Seq=26 Win=0 Len=0"
"44","6.207547808","2a00:a041:3c5d:4d00:424b:6377:a930:43d","2a03:2880:f258:1c3:face:b00c:0:167","TLSv1.2","154","Application Data"
"45","6.285430676","2a03:2880:f258:1c3:face:b00c:0:167","2a00:a041:3c5d:4d00:424b:6377:a930:43d","TCP","88","443  >  41660 [ACK] Seq=1414 Ack=229 Win=579 Len=0 TSval=3180556557 TSecr=2765507185"
"46","8.419224722","2a03:2880:f258:1c3:face:b00c:0:167","2a00:a041:3c5d:4d00:424b:6377:a930:43d","TLSv1.2","181","Application Data"
"47","8.419262385","2a00:a041:3c5d:4d00:424b:6377:a930:43d","2a03:2880:f258:1c3:face:b00c:0:167","TCP","88","41660  >  443 [ACK] Seq=229 Ack=1507 Win=1174 Len=0 TSval=2765509396 TSecr=3180558638"
"48","8.426439495","2a00:a041:3c5d:4d00:424b:6377:a930:43d","2a03:2880:f258:1c3:face:b00c:0:167","TLSv1.2","180","Application Data"
"49","8.498865896","2a03:2880:f258:1c3:face:b00c:0:167","2a00:a041:3c5d:4d00:424b:6377:a930:43d","TCP","88","443  >  41660 [ACK] Seq=1507 Ack=321 Win=579 Len=0 TSval=3180558771 TSecr=2765509404"
"56","12.089581129","192.168.1.12","213.57.23.97","TLSv1.2","92","Application Data"
"57","12.089631780","192.168.1.12","213.57.23.97","TCP","68","38982  >  443 [FIN, ACK] Seq=25 Ack=1 Win=914 Len=0 TSval=1506198639 TSecr=2439236612"
"58","12.110060518","213.57.23.97","192.168.1.12","TCP","80","443  >  38982 [ACK] Seq=1 Ack=1 Win=123 Len=0 TSval=2439296615 TSecr=1506138636 SLE=25 SRE=26"
"59","12.110591888","213.57.23.97","192.168.1.12","TCP","68","443  >  38982 [ACK] Seq=1 Ack=26 Win=123 Len=0 TSval=2439296615 TSecr=1506198639"
"60","12.110592071","213.57.23.97","192.168.1.12","TLSv1.2","92","Application Data"
"61","12.110592119","213.57.23.97","192.168.1.12","TCP","68","443  >  38982 [FIN, ACK] Seq=25 Ack=26 Win=123 Len=0 TSval=2439296615 TSecr=1506198639"
"62","12.110648765","192.168.1.12","213.57.23.97","TCP","56","38982  >  443 [RST] Seq=26 Win=0 Len=0"
"63","12.110672036","192.168.1.12","213.57.23.97","TCP","56","38982  >  443 [RST] Seq=26 Win=0 Len=0"
"64","12.527510379","2a00:a041:3c5d:4d00:424b:6377:a930:43d","2a03:2880:f258:c8:face:b00c:0:167","TLSv1.2","112","Application Data"
"65","12.527561489","2a00:a041:3c5d:4d00:424b:6377:a930:43d","2a03:2880:f258:c8:face:b00c:0:167","TCP","88","46144  >  443 [FIN, ACK] Seq=25 Ack=1 Win=2207 Len=0 TSval=1649399815 TSecr=2586721309"
"66","12.605880636","2a03:2880:f258:c8:face:b00c:0:167","2a00:a041:3c5d:4d00:424b:6377:a930:43d","TCP","100","443  >  46144 [ACK] Seq=1 Ack=1 Win=285 Len=0 TSval=2586781388 TSecr=1649339813 SLE=25 SRE=26"
"67","12.606329622","2a03:2880:f258:c8:face:b00c:0:167","2a00:a041:3c5d:4d00:424b:6377:a930:43d","TCP","88","443  >  46144 [ACK] Seq=1 Ack=26 Win=285 Len=0 TSval=2586781388 TSecr=1649399815"
"68","12.606329701","2a03:2880:f258:c8:face:b00c:0:167","2a00:a041:3c5d:4d00:424b:6377:a930:43d","TLSv1.2","112","Application Data"
"69","12.606329720","2a03:2880:f258:c8:face:b00c:0:167","2a00:a041:3c5d:4d00:424b:6377:a930:43d","TCP","88","443  >  46144 [FIN, ACK] Seq=25 Ack=26 Win=285 Len=0 TSval=2586781388 TSecr=1649399815"
"70","12.606370133","2a00:a041:3c5d:4d00:424b:6377:a930:43d","2a03:2880:f258:c8:face:b00c:0:167","TCP","76","46144  >  443 [RST] Seq=26 Win=0 Len=0"
"71","12.606383863","2a00:a041:3c5d:4d00:424b:6377:a930:43d","2a03:2880:f258:c8:face:b00c:0:167","TCP","76","46144  >  443 [RST] Seq=26 Win=0 Len=0"
"78","24.401336712","2a03:2880:f258:1c3:face:b00c:0:167","2a00:a041:3c5d:4d00:424b:6377:a930:43d","TLSv1.2","366","Application Data"
"79","24.445409111","2a00:a041:3c5d:4d00:424b:6377:a930:43d","2a03:2880:f258:1c3:face:b00c:0:167","TCP","88","41660  >  443 [ACK] Seq=321 Ack=1785 Win=1174 Len=0 TSval=2765525423 TSecr=3180574563"
"80","24.571309546","2a00:a041:3c5d:4d00:424b:6377:a930:43d","2a03:2880:f258:1c3:face:b00c:0:167","TLSv1.2","160","Application Data"
"81","24.645513045","2a03:2880:f258:1c3:face:b00c:0:167","2a00:a041:3c5d:4d00:424b:6377:a930:43d","TCP","88","443  >  41660 [ACK] Seq=1785 Ack=393 Win=579 Len=0 TSval=3180574917 TSecr=2765525549"
"91","26.148048708","2a00:a041:3c5d:4d00:424b:6377:a930:43d","2a03:2880:f258:1c3:face:b00c:0:167","TLSv1.2","157","Application Data"
"92","26.223257725","2a03:2880:f258:1c3:face:b00c:0:167","2a00:a041:3c5d:4d00:424b:6377:a930:43d","TCP","88","443  >  41660 [ACK] Seq=1785 Ack=462 Win=579 Len=0 TSval=3180576495 TSecr=2765527125"
"97","26.302860742","2a03:2880:f258:1c3:face:b00c:0:167","2a00:a041:3c5d:4d00:424b:6377:a930:43d","TLSv1.2","159","Application Data"
"98","26.302903072","2a00:a041:3c5d:4d00:424b:6377:a930:43d","2a03:2880:f258:1c3:face:b00c:0:167","TCP","88","41660  >  443 [ACK] Seq=462 Ack=1856 Win=1174 Len=0 TSval=2765527280 TSecr=3180576575"
"124","48.048056360","2a03:2880:f258:1c3:face:b00c:0:167","2a00:a041:3c5d:4d00:424b:6377:a930:43d","TCP","1468","443  >  41660 [ACK] Seq=1856 Ack=462 Win=579 Len=1380 TSval=3180598293 TSecr=2765527280 [TCP segment of a reassembled PDU]"
"125","48.048094694","2a00:a041:3c5d:4d00:424b:6377:a930:43d","2a03:2880:f258:1c3:face:b00c:0:167","TCP","88","41660  >  443 [ACK] Seq=462 Ack=3236 Win=1174 Len=0 TSval=2765549025 TSecr=3180598293"
"126","48.048164521","2a03:2880:f258:1c3:face:b00c:0:167","2a00:a041:3c5d:4d00:424b:6377:a930:43d","TLSv1.2","114","Application Data"
"127","48.048170718","2a00:a041:3c5d:4d00:424b:6377:a930:43d","2a03:2880:f258:1c3:face:b00c:0:167","TCP","88","41660  >  443 [ACK] Seq=462 Ack=3262 Win=1174 Len=0 TSval=2765549025 TSecr=3180598293"
"128","48.093162747","2a03:2880:f258:1c3:face:b00c:0:167","2a00:a041:3c5d:4d00:424b:6377:a930:43d","TCP","1468","443  >  41660 [ACK] Seq=3262 Ack=462 Win=579 Len=1380 TSval=3180598364 TSecr=2765527280 [TCP segment of a reassembled PDU]"
"129","48.093195416","2a00:a041:3c5d:4d00:424b:6377:a930:43d","2a03:2880:f258:1c3:face:b00c:0:167","TCP","88","41660  >  443 [ACK] Seq=462 Ack=4642 Win=1174 Len=0 TSval=2765549070 TSecr=3180598364"
"130","48.093409899","2a03:2880:f258:1c3:face:b00c:0:167","2a00:a041:3c5d:4d00:424b:6377:a930:43d","TLSv1.2","226","Application Data"
"131","48.093429020","2a00:a041:3c5d:4d00:424b:6377:a930:43d","2a03:2880:f258:1c3:face:b00c:0:167","TCP","88","41660  >  443 [ACK] Seq=462 Ack=4780 Win=1174 Len=0 TSval=2765549071 TSecr=3180598364"
"132","48.152380795","2a03:2880:f258:1c3:face:b00c:0:167","2a00:a041:3c5d:4d00:424b:6377:a930:43d","TCP","1468","443  >  41660 [ACK] Seq=4780 Ack=462 Win=579 Len=1380 TSval=3180598424 TSecr=2765549025 [TCP segment of a reassembled PDU]"
"133","48.152415757","2a00:a041:3c5d:4d00:424b:6377:a930:43d","2a03:2880:f258:1c3:face:b00c:0:167","TCP","88","41660  >  443 [ACK] Seq=462 Ack=6160 Win=1174 Len=0 TSval=2765549130 TSecr=3180598424"
"134","48.153039808","2a03:2880:f258:1c3:face:b00c:0:167","2a00:a041:3c5d:4d00:424b:6377:a930:43d","TLSv1.2","114","Application Data"
"135","48.153058707","2a00:a041:3c5d:4d00:424b:6377:a930:43d","2a03:2880:f258:1c3:face:b00c:0:167","TCP","88","41660  >  443 [ACK] Seq=462 Ack=6186 Win=1174 Len=0 TSval=2765549130 TSecr=3180598424"
"144","48.196981087","2a00:a041:3c5d:4d00:424b:6377:a930:43d","2a00:a040:0:4:face:b00c:3333:7020","TCP","96","44942  >  443 [SYN] Seq=0 Win=64800 Len=0 MSS=1440 SACK_PERM=1 TSval=3874299346 TSecr=0 WS=128"
"145","48.211978980","2a00:a040:0:4:face:b00c:3333:7020","2a00:a041:3c5d:4d00:424b:6377:a930:43d","TCP","96","443  >  44942 [SYN, ACK] Seq=0 Ack=1 Win=31740 Len=0 MSS=1392 SACK_PERM=1 TSval=344036802 TSecr=3874299346 WS=256"
"146","48.211998328","2a00:a041:3c5d:4d00:424b:6377:a930:43d","2a00:a040:0:4:face:b00c:3333:7020","TCP","88","44942  >  443 [ACK] Seq=1 Ack=1 Win=64896 Len=0 TSval=3874299361 TSecr=344036802"
"147","48.212378472","2a00:a041:3c5d:4d00:424b:6377:a930:43d","2a00:a040:0:4:face:b00c:3333:7020","TLSv1.3","794","Client Hello"
"148","48.226225220","2a00:a040:0:4:face:b00c:3333:7020","2a00:a041:3c5d:4d00:424b:6377:a930:43d","TCP","88","443  >  44942 [ACK] Seq=1 Ack=707 Win=31232 Len=0 TSval=344036816 TSecr=3874299362"
"149","48.226704510","2a00:a040:0:4:face:b00c:3333:7020","2a00:a041:3c5d:4d00:424b:6377:a930:43d","TLSv1.3","253","Server Hello, Application Data"
"150","48.226715701","2a00:a041:3c5d:4d00:424b:6377:a930:43d","2a00:a040:0:4:face:b00c:3333:7020","TCP","88","44942  >  443 [ACK] Seq=707 Ack=166 Win=64768 Len=0 TSval=3874299376 TSecr=344036817"
"151","48.226915871","2a00:a041:3c5d:4d00:424b:6377:a930:43d","2a00:a040:0:4:face:b00c:3333:7020","TLSv1.3","94","Change Cipher Spec"
"152","48.226963049","2a00:a041:3c5d:4d00:424b:6377:a930:43d","2a00:a040:0:4:face:b00c:3333:7020","TLSv1.3","146","Application Data"
"153","48.227527703","2a00:a041:3c5d:4d00:424b:6377:a930:43d","2a00:a040:0:4:face:b00c:3333:7020","TLSv1.3","677","Application Data"
"154","48.253539589","2a00:a040:0:4:face:b00c:3333:7020","2a00:a041:3c5d:4d00:424b:6377:a930:43d","TCP","88","443  >  44942 [ACK] Seq=166 Ack=1360 Win=31488 Len=0 TSval=344036842 TSecr=3874299376"
"155","48.255719512","2a00:a040:0:4:face:b00c:3333:7020","2a00:a041:3c5d:4d00:424b:6377:a930:43d","TLSv1.3","269","Application Data"
"156","48.264892018","2a00:a041:3c5d:4d00:424b:6377:a930:43d","2a03:2880:f258:1c3:face:b00c:0:167","TLSv1.2","181","Application Data"
"157","48.297300784","2a00:a041:3c5d:4d00:424b:6377:a930:43d","2a00:a040:0:4:face:b00c:3333:7020","TCP","88","44942  >  443 [ACK] Seq=1360 Ack=347 Win=64640 Len=0 TSval=3874299447 TSecr=344036842"
"158","48.336139981","2a03:2880:f258:1c3:face:b00c:0:167","2a00:a041:3c5d:4d00:424b:6377:a930:43d","TCP","88","443  >  41660 [ACK] Seq=6186 Ack=555 Win=579 Len=0 TSval=3180598608 TSecr=2765549242"
"159","48.366470889","2a00:a041:3c5d:4d00:424b:6377:a930:43d","2a00:a040:0:4:face:b00c:3333:7020","TCP","96","44946  >  443 [SYN] Seq=0 Win=64800 Len=0 MSS=1440 SACK_PERM=1 TSval=3874299516 TSecr=0 WS=128"
"160","48.385496496","2a00:a040:0:4:face:b00c:3333:7020","2a00:a041:3c5d:4d00:424b:6377:a930:43d","TCP","96","443  >  44946 [SYN, ACK] Seq=0 Ack=1 Win=31740 Len=0 MSS=1392 SACK_PERM=1 TSval=2165005550 TSecr=3874299516 WS=256"
"161","48.385519906","2a00:a041:3c5d:4d00:424b:6377:a930:43d","2a00:a040:0:4:face:b00c:3333:7020","TCP","88","44946  >  443 [ACK] Seq=1 Ack=1 Win=64896 Len=0 TSval=3874299535 TSecr=2165005550"
"162","48.385910782","2a00:a041:3c5d:4d00:424b:6377:a930:43d","2a00:a040:0:4:face:b00c:3333:7020","TLSv1.3","794","Client Hello"
"163","48.388747241","2a00:a041:3c5d:4d00:424b:6377:a930:43d","2a03:2880:f258:1c3:face:b00c:0:167","TLSv1.2","181","Application Data"
"164","48.398530157","2a00:a040:0:4:face:b00c:3333:7020","2a00:a041:3c5d:4d00:424b:6377:a930:43d","TCP","88","443  >  44946 [ACK] Seq=1 Ack=707 Win=31232 Len=0 TSval=2165005563 TSecr=3874299535"
"165","48.399087450","2a00:a040:0:4:face:b00c:3333:7020","2a00:a041:3c5d:4d00:424b:6377:a930:43d","TLSv1.3","253","Server Hello, Application Data"
"166","48.399100932","2a00:a041:3c5d:4d00:424b:6377:a930:43d","2a00:a040:0:4:face:b00c:3333:7020","TCP","88","44946  >  443 [ACK] Seq=707 Ack=166 Win=64768 Len=0 TSval=3874299548 TSecr=2165005564"
"167","48.399299217","2a00:a041:3c5d:4d00:424b:6377:a930:43d","2a00:a040:0:4:face:b00c:3333:7020","TLSv1.3","94","Change Cipher Spec"
"168","48.399357576","2a00:a041:3c5d:4d00:424b:6377:a930:43d","2a00:a040:0:4:face:b00c:3333:7020","TLSv1.3","146","Application Data"
"169","48.400683829","2a00:a041:3c5d:4d00:424b:6377:a930:43d","2a00:a040:0:4:face:b00c:3333:7020","TLSv1.3","677","Application Data"
"170","48.410879778","2a00:a040:0:4:face:b00c:3333:7020","2a00:a041:3c5d:4d00:424b:6377:a930:43d","TCP","88","443  >  44946 [ACK] Seq=166 Ack=771 Win=31488 Len=0 TSval=2165005576 TSecr=3874299549"
"171","48.411274857","2a00:a040:0:4:face:b00c:3333:7020","2a00:a041:3c5d:4d00:424b:6377:a930:43d","TLSv1.3","269","Application Data"
"172","48.441971294","2a00:a040:0:4:face:b00c:3333:7020","2a00:a041:3c5d:4d00:424b:6377:a930:43d","TLSv1.3","785","Application Data"
"173","48.441989931","2a00:a041:3c5d:4d00:424b:6377:a930:43d","2a00:a040:0:4:face:b00c:3333:7020","TCP","88","44942  >  443 [ACK] Seq=1360 Ack=1044 Win=64000 Len=0 TSval=3874299591 TSecr=344037032"
"174","48.442665144","2a00:a040:0:4:face:b00c:3333:7020","2a00:a041:3c5d:4d00:424b:6377:a930:43d","TLSv1.3","111","Application Data"
"175","48.442665379","2a00:a040:0:4:face:b00c:3333:7020","2a00:a041:3c5d:4d00:424b:6377:a930:43d","TCP","1468","443  >  44942 [ACK] Seq=1067 Ack=1360 Win=31488 Len=1380 TSval=344037032 TSecr=3874299447 [TCP segment of a reassembled PDU]"
"176","48.442691879","2a00:a041:3c5d:4d00:424b:6377:a930:43d","2a00:a040:0:4:face:b00c:3333:7020","TCP","88","44942  >  443 [ACK] Seq=1360 Ack=1067 Win=64128 Len=0 TSval=3874299592 TSecr=344037032"
"177","48.442712548","2a00:a041:3c5d:4d00:424b:6377:a930:43d","2a00:a040:0:4:face:b00c:3333:7020","TCP","88","44942  >  443 [ACK] Seq=1360 Ack=2447 Win=63104 Len=0 TSval=3874299592 TSecr=344037032"
"178","48.443593705","2a00:a040:0:4:face:b00c:3333:7020","2a00:a041:3c5d:4d00:424b:6377:a930:43d","TLSv1.3","1468","Application Data [TCP segment of a reassembled PDU]"
"179","48.443593856","2a00:a040:0:4:face:b00c:3333:7020","2a00:a041:3c5d:4d00:424b:6377:a930:43d","TLSv1.3","2848","Application Data [TCP segment of a reassembled PDU]"
"180","48.443619005","2a00:a041:3c5d:4d00:424b:6377:a930:43d","2a00:a040:0:4:face:b00c:3333:7020","TCP","88","44942  >  443 [ACK] Seq=1360 Ack=3827 Win=63104 Len=0 TSval=3874299593 TSecr=344037032"
"181","48.443632128","2a00:a041:3c5d:4d00:424b:6377:a930:43d","2a00:a040:0:4:face:b00c:3333:7020","TCP","88","44942  >  443 [ACK] Seq=1360 Ack=6587 Win=60416 Len=0 TSval=3874299593 TSecr=344037032"
"182","48.444501153","2a00:a040:0:4:face:b00c:3333:7020","2a00:a041:3c5d:4d00:424b:6377:a930:43d","TLSv1.3","2848","Application Data [TCP segment of a reassembled PDU]"
"183","48.444501336","2a00:a040:0:4:face:b00c:3333:7020","2a00:a041:3c5d:4d00:424b:6377:a930:43d","TLSv1.3","2848","Application Data [TCP segment of a reassembled PDU]"
"184","48.444516899","2a00:a041:3c5d:4d00:424b:6377:a930:43d","2a00:a040:0:4:face:b00c:3333:7020","TCP","88","44942  >  443 [ACK] Seq=1360 Ack=9347 Win=61056 Len=0 TSval=3874299594 TSecr=344037032"
"185","48.444527364","2a00:a041:3c5d:4d00:424b:6377:a930:43d","2a00:a040:0:4:face:b00c:3333:7020","TCP","88","44942  >  443 [ACK] Seq=1360 Ack=12107 Win=58368 Len=0 TSval=3874299594 TSecr=344037033"
"186","48.445353913","2a00:a040:0:4:face:b00c:3333:7020","2a00:a041:3c5d:4d00:424b:6377:a930:43d","TLSv1.3","2848","Application Data [TCP segment of a reassembled PDU]"
"187","48.445394122","2a00:a041:3c5d:4d00:424b:6377:a930:43d","2a00:a040:0:4:face:b00c:3333:7020","TCP","88","44942  >  443 [ACK] Seq=1360 Ack=14867 Win=61056 Len=0 TSval=3874299595 TSecr=344037034"
"188","48.457337864","2a00:a041:3c5d:4d00:424b:6377:a930:43d","2a00:a040:0:4:face:b00c:3333:7020","TCP","88","44946  >  443 [ACK] Seq=1360 Ack=347 Win=64640 Len=0 TSval=3874299607 TSecr=2165005576"
"189","48.458411148","2a00:a040:0:4:face:b00c:3333:7020","2a00:a041:3c5d:4d00:424b:6377:a930:43d","TCP","1468","443  >  44942 [ACK] Seq=14867 Ack=1360 Win=31488 Len=1380 TSval=344037048 TSecr=3874299591 [TCP segment of a reassembled PDU]"
"190","48.458422973","2a00:a041:3c5d:4d00:424b:6377:a930:43d","2a00:a040:0:4:face:b00c:3333:7020","TCP","88","44942  >  443 [ACK] Seq=1360 Ack=16247 Win=63104 Len=0 TSval=3874299608 TSecr=344037048"
"191","48.459063728","2a00:a040:0:4:face:b00c:3333:7020","2a00:a041:3c5d:4d00:424b:6377:a930:43d","TLSv1.3","1468","Application Data, Application Data"
"192","48.459069972","2a00:a041:3c5d:4d00:424b:6377:a930:43d","2a00:a040:0:4:face:b00c:3333:7020","TCP","88","44942  >  443 [ACK] Seq=1360 Ack=17627 Win=63104 Len=0 TSval=3874299608 TSecr=344037048"
"193","48.459839680","2a00:a040:0:4:face:b00c:3333:7020","2a00:a041:3c5d:4d00:424b:6377:a930:43d","TLSv1.3","2848","Application Data [TCP segment of a reassembled PDU]"
"194","48.459856808","2a00:a041:3c5d:4d00:424b:6377:a930:43d","2a00:a040:0:4:face:b00c:3333:7020","TCP","88","44942  >  443 [ACK] Seq=1360 Ack=20387 Win=61056 Len=0 TSval=3874299609 TSecr=344037049"
"195","48.460521937","2a00:a040:0:4:face:b00c:3333:7020","2a00:a041:3c5d:4d00:424b:6377:a930:43d","TLSv1.3","1468","Application Data [TCP segment of a reassembled PDU]"
"196","48.461044820","2a00:a040:0:4:face:b00c:3333:7020","2a00:a041:3c5d:4d00:424b:6377:a930:43d","TCP","1468","443  >  44942 [PSH, ACK] Seq=21767 Ack=1360 Win=31488 Len=1380 TSval=344037050 TSecr=3874299595 [TCP segment of a reassembled PDU]"
"197","48.461060908","2a00:a041:3c5d:4d00:424b:6377:a930:43d","2a00:a040:0:4:face:b00c:3333:7020","TCP","88","44942  >  443 [ACK] Seq=1360 Ack=23147 Win=63104 Len=0 TSval=3874299610 TSecr=344037050"
"198","48.461623217","2a00:a040:0:4:face:b00c:3333:7020","2a00:a041:3c5d:4d00:424b:6377:a930:43d","TLSv1.3","2848","Application Data [TCP segment of a reassembled PDU]"
"199","48.461718823","2a00:a041:3c5d:4d00:424b:6377:a930:43d","2a00:a040:0:4:face:b00c:3333:7020","TCP","88","44942  >  443 [ACK] Seq=1360 Ack=25907 Win=61056 Len=0 TSval=3874299611 TSecr=344037051"
"200","48.462621437","2a00:a040:0:4:face:b00c:3333:7020","2a00:a041:3c5d:4d00:424b:6377:a930:43d","TCP","88","443  >  44946 [ACK] Seq=347 Ack=1360 Win=31488 Len=0 TSval=2165005626 TSecr=3874299550"
"201","48.463341740","2a00:a040:0:4:face:b00c:3333:7020","2a00:a041:3c5d:4d00:424b:6377:a930:43d","TLSv1.3","2848","Application Data [TCP segment of a reassembled PDU]"
"202","48.463358257","2a00:a041:3c5d:4d00:424b:6377:a930:43d","2a00:a040:0:4:face:b00c:3333:7020","TCP","88","44942  >  443 [ACK] Seq=1360 Ack=28667 Win=61056 Len=0 TSval=3874299613 TSecr=344037052"
"203","48.464296902","2a00:a040:0:4:face:b00c:3333:7020","2a00:a041:3c5d:4d00:424b:6377:a930:43d","TLSv1.3","2848","Application Data [TCP segment of a reassembled PDU]"
"204","48.464296947","2a00:a040:0:4:face:b00c:3333:7020","2a00:a041:3c5d:4d00:424b:6377:a930:43d","TCP","1468","443  >  44942 [ACK] Seq=31427 Ack=1360 Win=31488 Len=1380 TSval=344037053 TSecr=3874299595 [TCP segment of a reassembled PDU]"
"205","48.464302815","2a00:a041:3c5d:4d00:424b:6377:a930:43d","2a00:a040:0:4:face:b00c:3333:7020","TCP","88","44942  >  443 [ACK] Seq=1360 Ack=31427 Win=61056 Len=0 TSval=3874299614 TSecr=344037053"
"206","48.464971294","2a00:a040:0:4:face:b00c:3333:7020","2a00:a041:3c5d:4d00:424b:6377:a930:43d","TLSv1.3","1468","Application Data [TCP segment of a reassembled PDU]"
"207","48.464976430","2a00:a041:3c5d:4d00:424b:6377:a930:43d","2a00:a040:0:4:face:b00c:3333:7020","TCP","88","44942  >  443 [ACK] Seq=1360 Ack=34187 Win=63104 Len=0 TSval=3874299614 TSecr=344037053"
"208","48.465780801","2a00:a040:0:4:face:b00c:3333:7020","2a00:a041:3c5d:4d00:424b:6377:a930:43d","TLSv1.3","2848","Application Data [TCP segment of a reassembled PDU]"
"209","48.465830818","2a00:a041:3c5d:4d00:424b:6377:a930:43d","2a00:a040:0:4:face:b00c:3333:7020","TCP","88","44942  >  443 [ACK] Seq=1360 Ack=36947 Win=61056 Len=0 TSval=3874299615 TSecr=344037054"
"210","48.466226225","2a03:2880:f258:1c3:face:b00c:0:167","2a00:a041:3c5d:4d00:424b:6377:a930:43d","TCP","88","443  >  41660 [ACK] Seq=6186 Ack=648 Win=579 Len=0 TSval=3180598737 TSecr=2765549366"
"211","48.466227349","2a00:a040:0:4:face:b00c:3333:7020","2a00:a041:3c5d:4d00:424b:6377:a930:43d","TLSv1.3","1468","Application Data [TCP segment of a reassembled PDU]"
"212","48.469309875","2a00:a040:0:4:face:b00c:3333:7020","2a00:a041:3c5d:4d00:424b:6377:a930:43d","TCP","1468","443  >  44942 [PSH, ACK] Seq=38327 Ack=1360 Win=31488 Len=1380 TSval=344037055 TSecr=3874299595 [TCP segment of a reassembled PDU]"
"213","48.469316443","2a00:a041:3c5d:4d00:424b:6377:a930:43d","2a00:a040:0:4:face:b00c:3333:7020","TCP","88","44942  >  443 [ACK] Seq=1360 Ack=39707 Win=63104 Len=0 TSval=3874299619 TSecr=344037055"
"214","48.470085065","2a00:a040:0:4:face:b00c:3333:7020","2a00:a041:3c5d:4d00:424b:6377:a930:43d","TLSv1.3","2848","Application Data [TCP segment of a reassembled PDU]"
"215","48.470151823","2a00:a041:3c5d:4d00:424b:6377:a930:43d","2a00:a040:0:4:face:b00c:3333:7020","TCP","88","44942  >  443 [ACK] Seq=1360 Ack=42467 Win=61056 Len=0 TSval=3874299619 TSecr=344037056"
"216","48.470585255","2a00:a040:0:4:face:b00c:3333:7020","2a00:a041:3c5d:4d00:424b:6377:a930:43d","TLSv1.3","2848","Application Data [TCP segment of a reassembled PDU]"
"217","48.470589604","2a00:a041:3c5d:4d00:424b:6377:a930:43d","2a00:a040:0:4:face:b00c:3333:7020","TCP","88","44942  >  443 [ACK] Seq=1360 Ack=45227 Win=61056 Len=0 TSval=3874299620 TSecr=344037057"
"218","48.471026289","2a00:a040:0:4:face:b00c:3333:7020","2a00:a041:3c5d:4d00:424b:6377:a930:43d","TCP","1468","443  >  44942 [ACK] Seq=45227 Ack=1360 Win=31488 Len=1380 TSval=344037058 TSecr=3874299595 [TCP segment of a reassembled PDU]"
"219","48.471026327","2a00:a040:0:4:face:b00c:3333:7020","2a00:a041:3c5d:4d00:424b:6377:a930:43d","TLSv1.3","1468","Application Data [TCP segment of a reassembled PDU]"
"220","48.471031566","2a00:a041:3c5d:4d00:424b:6377:a930:43d","2a00:a040:0:4:face:b00c:3333:7020","TCP","88","44942  >  443 [ACK] Seq=1360 Ack=47987 Win=61056 Len=0 TSval=3874299620 TSecr=344037058"
"221","48.477592727","2a00:a040:0:4:face:b00c:3333:7020","2a00:a041:3c5d:4d00:424b:6377:a930:43d","TCP","1468","443  >  44942 [ACK] Seq=47987 Ack=1360 Win=31488 Len=1380 TSval=344037067 TSecr=3874299614 [TCP segment of a reassembled PDU]"
"222","48.478166055","2a00:a040:0:4:face:b00c:3333:7020","2a00:a041:3c5d:4d00:424b:6377:a930:43d","TLSv1.3","1468","Application Data [TCP segment of a reassembled PDU]"
"223","48.478166126","2a00:a040:0:4:face:b00c:3333:7020","2a00:a041:3c5d:4d00:424b:6377:a930:43d","TCP","1468","443  >  44942 [ACK] Seq=50747 Ack=1360 Win=31488 Len=1380 TSval=344037068 TSecr=3874299614 [TCP segment of a reassembled PDU]"
"224","48.478195752","2a00:a041:3c5d:4d00:424b:6377:a930:43d","2a00:a040:0:4:face:b00c:3333:7020","TCP","88","44942  >  443 [ACK] Seq=1360 Ack=50747 Win=63104 Len=0 TSval=3874299627 TSecr=344037067"
"225","48.478863945","2a00:a040:0:4:face:b00c:3333:7020","2a00:a041:3c5d:4d00:424b:6377:a930:43d","TLSv1.3","1468","Application Data [TCP segment of a reassembled PDU]"
"226","48.478887480","2a00:a041:3c5d:4d00:424b:6377:a930:43d","2a00:a040:0:4:face:b00c:3333:7020","TCP","88","44942  >  443 [ACK] Seq=1360 Ack=53507 Win=63104 Len=0 TSval=3874299628 TSecr=344037068"
"227","48.479665063","2a00:a040:0:4:face:b00c:3333:7020","2a00:a041:3c5d:4d00:424b:6377:a930:43d","TLSv1.3","2848","Application Data, Application Data"
"228","48.479759702","2a00:a041:3c5d:4d00:424b:6377:a930:43d","2a00:a040:0:4:face:b00c:3333:7020","TCP","88","44942  >  443 [ACK] Seq=1360 Ack=56267 Win=61056 Len=0 TSval=3874299629 TSecr=344037069"
"229","48.480170666","2a00:a040:0:4:face:b00c:3333:7020","2a00:a041:3c5d:4d00:424b:6377:a930:43d","TCP","1468","443  >  44942 [ACK] Seq=56267 Ack=1360 Win=31488 Len=1380 TSval=344037070 TSecr=3874299614 [TCP segment of a reassembled PDU]"
"230","48.480776551","2a00:a040:0:4:face:b00c:3333:7020","2a00:a041:3c5d:4d00:424b:6377:a930:43d","TCP","1468","443  >  44942 [PSH, ACK] Seq=57647 Ack=1360 Win=31488 Len=1380 TSval=344037070 TSecr=3874299614 [TCP segment of a reassembled PDU]"
"231","48.480793798","2a00:a041:3c5d:4d00:424b:6377:a930:43d","2a00:a040:0:4:face:b00c:3333:7020","TCP","88","44942  >  443 [ACK] Seq=1360 Ack=59027 Win=63104 Len=0 TSval=3874299630 TSecr=344037070"
"232","48.481563100","2a00:a040:0:4:face:b00c:3333:7020","2a00:a041:3c5d:4d00:424b:6377:a930:43d","TLSv1.3","2848","Application Data [TCP segment of a reassembled PDU]"
"233","48.481675965","2a00:a041:3c5d:4d00:424b:6377:a930:43d","2a00:a040:0:4:face:b00c:3333:7020","TCP","88","44942  >  443 [ACK] Seq=1360 Ack=61787 Win=61056 Len=0 TSval=3874299631 TSecr=344037071"
"234","48.482167856","2a00:a040:0:4:face:b00c:3333:7020","2a00:a041:3c5d:4d00:424b:6377:a930:43d","TLSv1.3","2848","Application Data [TCP segment of a reassembled PDU]"
"235","48.482175844","2a00:a041:3c5d:4d00:424b:6377:a930:43d","2a00:a040:0:4:face:b00c:3333:7020","TCP","88","44942  >  443 [ACK] Seq=1360 Ack=64547 Win=61056 Len=0 TSval=3874299631 TSecr=344037072"
"236","48.482765812","2a00:a040:0:4:face:b00c:3333:7020","2a00:a041:3c5d:4d00:424b:6377:a930:43d","TCP","1468","443  >  44942 [ACK] Seq=64547 Ack=1360 Win=31488 Len=1380 TSval=344037073 TSecr=3874299614 [TCP segment of a reassembled PDU]"
"237","48.483889384","2a00:a040:0:4:face:b00c:3333:7020","2a00:a041:3c5d:4d00:424b:6377:a930:43d","TLSv1.3","1468","Application Data [TCP segment of a reassembled PDU]"
"238","48.483894298","2a00:a041:3c5d:4d00:424b:6377:a930:43d","2a00:a040:0:4:face:b00c:3333:7020","TCP","88","44942  >  443 [ACK] Seq=1360 Ack=67307 Win=63104 Len=0 TSval=3874299633 TSecr=344037073"
"239","48.484970685","2a00:a040:0:4:face:b00c:3333:7020","2a00:a041:3c5d:4d00:424b:6377:a930:43d","TLSv1.3","2848","Application Data [TCP segment of a reassembled PDU]"
"240","48.485029390","2a00:a041:3c5d:4d00:424b:6377:a930:43d","2a00:a040:0:4:face:b00c:3333:7020","TCP","88","44942  >  443 [ACK] Seq=1360 Ack=70067 Win=61056 Len=0 TSval=3874299634 TSecr=344037073"
"241","48.485951552","2a00:a040:0:4:face:b00c:3333:7020","2a00:a041:3c5d:4d00:424b:6377:a930:43d","TLSv1.3","2848","Application Data, Application Data"
"242","48.485951606","2a00:a040:0:4:face:b00c:3333:7020","2a00:a041:3c5d:4d00:424b:6377:a930:43d","TCP","1468","443  >  44942 [ACK] Seq=72827 Ack=1360 Win=31488 Len=1380 TSval=344037075 TSecr=3874299620 [TCP segment of a reassembled PDU]"
"243","48.485956259","2a00:a041:3c5d:4d00:424b:6377:a930:43d","2a00:a040:0:4:face:b00c:3333:7020","TCP","88","44942  >  443 [ACK] Seq=1360 Ack=72827 Win=61056 Len=0 TSval=3874299635 TSecr=344037074"
"244","48.486835800","2a00:a040:0:4:face:b00c:3333:7020","2a00:a041:3c5d:4d00:424b:6377:a930:43d","TCP","1468","443  >  44942 [PSH, ACK] Seq=74207 Ack=1360 Win=31488 Len=1380 TSval=344037075 TSecr=3874299620 [TCP segment of a reassembled PDU]"
"245","48.486835829","2a00:a040:0:4:face:b00c:3333:7020","2a00:a041:3c5d:4d00:424b:6377:a930:43d","TLSv1.3","2848","Application Data, Application Data"
"246","48.486841120","2a00:a041:3c5d:4d00:424b:6377:a930:43d","2a00:a040:0:4:face:b00c:3333:7020","TCP","88","44942  >  443 [ACK] Seq=1360 Ack=75587 Win=63104 Len=0 TSval=3874299636 TSecr=344037075"
"247","48.486887688","2a00:a041:3c5d:4d00:424b:6377:a930:43d","2a00:a040:0:4:face:b00c:3333:7020","TCP","88","44942  >  443 [ACK] Seq=1360 Ack=78347 Win=60416 Len=0 TSval=3874299636 TSecr=344037076"
"248","48.487610893","2a00:a040:0:4:face:b00c:3333:7020","2a00:a041:3c5d:4d00:424b:6377:a930:43d","TLSv1.3","2848","Application Data, Application Data"
"249","48.487613760","2a00:a041:3c5d:4d00:424b:6377:a930:43d","2a00:a040:0:4:face:b00c:3333:7020","TCP","88","44942  >  443 [ACK] Seq=1360 Ack=81107 Win=61056 Len=0 TSval=3874299637 TSecr=344037077"
"250","48.488557033","2a00:a040:0:4:face:b00c:3333:7020","2a00:a041:3c5d:4d00:424b:6377:a930:43d","TLSv1.3","2848","Application Data [TCP segment of a reassembled PDU]"
"251","48.488559033","2a00:a041:3c5d:4d00:424b:6377:a930:43d","2a00:a040:0:4:face:b00c:3333:7020","TCP","88","44942  >  443 [ACK] Seq=1360 Ack=83867 Win=61056 Len=0 TSval=3874299638 TSecr=344037077"
"252","48.489265125","2a00:a040:0:4:face:b00c:3333:7020","2a00:a041:3c5d:4d00:424b:6377:a930:43d","TLSv1.3","1747","Application Data, Application Data"
"253","48.489281773","2a00:a041:3c5d:4d00:424b:6377:a930:43d","2a00:a040:0:4:face:b00c:3333:7020","TCP","88","44942  >  443 [ACK] Seq=1360 Ack=85526 Win=61056 Len=0 TSval=3874299639 TSecr=344037078"
"254","48.549855061","2a00:a041:3c5d:4d00:424b:6377:a930:43d","2a00:a040:0:4:face:b00c:3333:7020","TLSv1.3","677","Application Data"
"255","48.573643587","2a00:a041:3c5d:4d00:424b:6377:a930:43d","2a03:2880:f258:1c3:face:b00c:0:167","TLSv1.2","181","Application Data"
"256","48.610157305","2a00:a040:0:4:face:b00c:3333:7020","2a00:a041:3c5d:4d00:424b:6377:a930:43d","TCP","88","443  >  44942 [ACK] Seq=85526 Ack=1949 Win=31488 Len=0 TSval=344037200 TSecr=3874299699"
"257","48.619670454","2a00:a040:0:4:face:b00c:3333:7020","2a00:a041:3c5d:4d00:424b:6377:a930:43d","TLSv1.3","783","Application Data"
"258","48.619695799","2a00:a041:3c5d:4d00:424b:6377:a930:43d","2a00:a040:0:4:face:b00c:3333:7020","TCP","88","44946  >  443 [ACK] Seq=1360 Ack=1042 Win=64000 Len=0 TSval=3874299769 TSecr=2165005784"
"259","48.620361143","2a00:a040:0:4:face:b00c:3333:7020","2a00:a041:3c5d:4d00:424b:6377:a930:43d","TLSv1.3","111","Application Data"
"260","48.620361198","2a00:a040:0:4:face:b00c:3333:7020","2a00:a041:3c5d:4d00:424b:6377:a930:43d","TCP","1468","443  >  44946 [ACK] Seq=1065 Ack=1360 Win=31488 Len=1380 TSval=2165005784 TSecr=3874299607 [TCP segment of a reassembled PDU]"
"261","48.620368995","2a00:a041:3c5d:4d00:424b:6377:a930:43d","2a00:a040:0:4:face:b00c:3333:7020","TCP","88","44946  >  443 [ACK] Seq=1360 Ack=1065 Win=64128 Len=0 TSval=3874299770 TSecr=2165005784"
"262","48.620376690","2a00:a041:3c5d:4d00:424b:6377:a930:43d","2a00:a040:0:4:face:b00c:3333:7020","TCP","88","44946  >  443 [ACK] Seq=1360 Ack=2445 Win=63104 Len=0 TSval=3874299770 TSecr=2165005784"
"263","48.621243841","2a00:a040:0:4:face:b00c:3333:7020","2a00:a041:3c5d:4d00:424b:6377:a930:43d","TLSv1.3","1468","Application Data [TCP segment of a reassembled PDU]"
"264","48.621243958","2a00:a040:0:4:face:b00c:3333:7020","2a00:a041:3c5d:4d00:424b:6377:a930:43d","TLSv1.3","2848","Application Data [TCP segment of a reassembled PDU]"
"265","48.621243981","2a00:a040:0:4:face:b00c:3333:7020","2a00:a041:3c5d:4d00:424b:6377:a930:43d","TLSv1.3","188","Application Data"
"266","48.621253730","2a00:a041:3c5d:4d00:424b:6377:a930:43d","2a00:a040:0:4:face:b00c:3333:7020","TCP","88","44946  >  443 [ACK] Seq=1360 Ack=3825 Win=63104 Len=0 TSval=3874299770 TSecr=2165005784"
"267","48.621261128","2a00:a041:3c5d:4d00:424b:6377:a930:43d","2a00:a040:0:4:face:b00c:3333:7020","TCP","88","44946  >  443 [ACK] Seq=1360 Ack=6585 Win=60416 Len=0 TSval=3874299771 TSecr=2165005784"
"268","48.621264332","2a00:a041:3c5d:4d00:424b:6377:a930:43d","2a00:a040:0:4:face:b00c:3333:7020","TCP","88","44946  >  443 [ACK] Seq=1360 Ack=6685 Win=60416 Len=0 TSval=3874299771 TSecr=2165005784"
"269","48.621991287","2a00:a040:0:4:face:b00c:3333:7020","2a00:a041:3c5d:4d00:424b:6377:a930:43d","TCP","1468","443  >  44946 [ACK] Seq=6685 Ack=1360 Win=31488 Len=1380 TSval=2165005786 TSecr=3874299607 [TCP segment of a reassembled PDU]"
"270","48.622003990","2a00:a041:3c5d:4d00:424b:6377:a930:43d","2a00:a040:0:4:face:b00c:3333:7020","TCP","88","44946  >  443 [ACK] Seq=1360 Ack=8065 Win=63104 Len=0 TSval=3874299771 TSecr=2165005786"
"271","48.622632729","2a00:a040:0:4:face:b00c:3333:7020","2a00:a041:3c5d:4d00:424b:6377:a930:43d","TCP","1468","443  >  44946 [PSH, ACK] Seq=8065 Ack=1360 Win=31488 Len=1380 TSval=2165005786 TSecr=3874299607 [TCP segment of a reassembled PDU]"
"272","48.622641934","2a00:a041:3c5d:4d00:424b:6377:a930:43d","2a00:a040:0:4:face:b00c:3333:7020","TCP","88","44946  >  443 [ACK] Seq=1360 Ack=9445 Win=63104 Len=0 TSval=3874299772 TSecr=2165005786"
"273","48.623481646","2a00:a040:0:4:face:b00c:3333:7020","2a00:a041:3c5d:4d00:424b:6377:a930:43d","TLSv1.3","2848","Application Data [TCP segment of a reassembled PDU]"
"274","48.623481680","2a00:a040:0:4:face:b00c:3333:7020","2a00:a041:3c5d:4d00:424b:6377:a930:43d","TLSv1.3","1468","Application Data [TCP segment of a reassembled PDU]"
"275","48.623492482","2a00:a041:3c5d:4d00:424b:6377:a930:43d","2a00:a040:0:4:face:b00c:3333:7020","TCP","88","44946  >  443 [ACK] Seq=1360 Ack=12205 Win=61056 Len=0 TSval=3874299773 TSecr=2165005786"
"276","48.623498334","2a00:a041:3c5d:4d00:424b:6377:a930:43d","2a00:a040:0:4:face:b00c:3333:7020","TCP","88","44946  >  443 [ACK] Seq=1360 Ack=13585 Win=59776 Len=0 TSval=3874299773 TSecr=2165005787"
"277","48.636798017","2a00:a040:0:4:face:b00c:3333:7020","2a00:a041:3c5d:4d00:424b:6377:a930:43d","TLSv1.3","1468","Application Data [TCP segment of a reassembled PDU]"
"278","48.636815057","2a00:a041:3c5d:4d00:424b:6377:a930:43d","2a00:a040:0:4:face:b00c:3333:7020","TCP","88","44946  >  443 [ACK] Seq=1360 Ack=14965 Win=63104 Len=0 TSval=3874299786 TSecr=2165005801"
"279","48.637472100","2a00:a040:0:4:face:b00c:3333:7020","2a00:a041:3c5d:4d00:424b:6377:a930:43d","TCP","1468","443  >  44946 [PSH, ACK] Seq=14965 Ack=1360 Win=31488 Len=1380 TSval=2165005801 TSecr=3874299770 [TCP segment of a reassembled PDU]"
"280","48.638078683","2a00:a040:0:4:face:b00c:3333:7020","2a00:a041:3c5d:4d00:424b:6377:a930:43d","TLSv1.3","2848","Application Data, Application Data"
"281","48.638135123","2a00:a041:3c5d:4d00:424b:6377:a930:43d","2a00:a040:0:4:face:b00c:3333:7020","TCP","88","44946  >  443 [ACK] Seq=1360 Ack=19105 Win=61056 Len=0 TSval=3874299787 TSecr=2165005801"
"282","48.638919247","2a00:a040:0:4:face:b00c:3333:7020","2a00:a041:3c5d:4d00:424b:6377:a930:43d","TLSv1.3","2848","Application Data, Application Data"
"283","48.638925573","2a00:a041:3c5d:4d00:424b:6377:a930:43d","2a00:a040:0:4:face:b00c:3333:7020","TCP","88","44946  >  443 [ACK] Seq=1360 Ack=21865 Win=61056 Len=0 TSval=3874299788 TSecr=2165005803"
"284","48.639686199","2a00:a040:0:4:face:b00c:3333:7020","2a00:a041:3c5d:4d00:424b:6377:a930:43d","TLSv1.3","2848","Application Data, Application Data"
"285","48.639691281","2a00:a041:3c5d:4d00:424b:6377:a930:43d","2a00:a040:0:4:face:b00c:3333:7020","TCP","88","44946  >  443 [ACK] Seq=1360 Ack=24625 Win=61056 Len=0 TSval=3874299789 TSecr=2165005804"
"286","48.640375182","2a00:a040:0:4:face:b00c:3333:7020","2a00:a041:3c5d:4d00:424b:6377:a930:43d","TLSv1.3","1468","Application Data [TCP segment of a reassembled PDU]"
"287","48.640921388","2a00:a040:0:4:face:b00c:3333:7020","2a00:a041:3c5d:4d00:424b:6377:a930:43d","TLSv1.3","1468","Application Data [TCP segment of a reassembled PDU]"
"288","48.640926389","2a00:a041:3c5d:4d00:424b:6377:a930:43d","2a00:a040:0:4:face:b00c:3333:7020","TCP","88","44946  >  443 [ACK] Seq=1360 Ack=27385 Win=63104 Len=0 TSval=3874299790 TSecr=2165005805"
"289","48.641711950","2a00:a040:0:4:face:b00c:3333:7020","2a00:a041:3c5d:4d00:424b:6377:a930:43d","TCP","2848","443  >  44946 [PSH, ACK] Seq=27385 Ack=1360 Win=31488 Len=2760 TSval=2165005805 TSecr=3874299773 [TCP segment of a reassembled PDU]"
"290","48.641769290","2a00:a041:3c5d:4d00:424b:6377:a930:43d","2a00:a040:0:4:face:b00c:3333:7020","TCP","88","44946  >  443 [ACK] Seq=1360 Ack=30145 Win=64128 Len=0 TSval=3874299791 TSecr=2165005805"
"291","48.642417777","2a00:a040:0:4:face:b00c:3333:7020","2a00:a041:3c5d:4d00:424b:6377:a930:43d","TLSv1.3","1468","Application Data [TCP segment of a reassembled PDU]"
"292","48.643026629","2a00:a040:0:4:face:b00c:3333:7020","2a00:a041:3c5d:4d00:424b:6377:a930:43d","TCP","1468","443  >  44946 [PSH, ACK] Seq=31525 Ack=1360 Win=31488 Len=1380 TSval=2165005806 TSecr=3874299773 [TCP segment of a reassembled PDU]"
