"No.","Time","Source","Destination","Protocol","Length","Info"
"3","0.304433164","140.82.113.26","192.168.1.12","TLSv1.2","91","Application Data"
"4","0.304696660","192.168.1.12","140.82.113.26","TLSv1.2","95","Application Data"
"5","0.393249830","2606:4700::6812:3a2","2a00:a041:3c5d:4d00:605e:f34d:a502:2044","TLSv1.2","125","Application Data"
"6","0.393475699","2a00:a041:3c5d:4d00:605e:f34d:a502:2044","2606:4700::6812:3a2","TCP","86","33082  >  443 [FIN, ACK] Seq=1 Ack=40 Win=501 Len=0 TSval=3512531495 TSecr=1347043884"
"7","0.393732373","2606:4700::6812:3a2","2a00:a041:3c5d:4d00:605e:f34d:a502:2044","TCP","86","443  >  33082 [FIN, ACK] Seq=40 Ack=1 Win=8 Len=0 TSval=1347043885 TSecr=3512131534"
"8","0.393741726","2a00:a041:3c5d:4d00:605e:f34d:a502:2044","2606:4700::6812:3a2","TCP","86","33082  >  443 [ACK] Seq=2 Ack=41 Win=501 Len=0 TSval=3512531495 TSecr=1347043885"
"9","0.410096793","2606:4700::6812:3a2","2a00:a041:3c5d:4d00:605e:f34d:a502:2044","TCP","86","443  >  33082 [ACK] Seq=41 Ack=2 Win=7 Len=0 TSval=1347043902 TSecr=3512531495"
"10","0.454363929","140.82.113.26","192.168.1.12","TCP","66","443  >  48184 [ACK] Seq=26 Ack=30 Win=70 Len=0 TSval=1909205989 TSecr=3821916037"
"18","6.244073439","157.240.221.60","192.168.1.12","TLSv1.2","1440","Application Data"
"19","6.267281845","192.168.1.12","157.240.221.60","TLSv1.2","2465","Application Data"
"20","6.345816224","192.168.1.12","157.240.221.60","TLSv1.2","140","Application Data"
"23","6.351635337","157.240.221.60","192.168.1.12","TCP","66","443  >  45474 [ACK] Seq=1375 Ack=2400 Win=354 Len=0 TSval=2016026581 TSecr=2063764722"
"26","6.373702312","2a00:a041:3c5d:4d00:605e:f34d:a502:2044","2a00:a040:3:4:face:b00c:3333:7020","TCP","94","43262  >  443 [SYN] Seq=0 Win=64800 Len=0 MSS=1440 SACK_PERM=1 TSval=3910015484 TSecr=0 WS=128"
"27","6.390914821","2a00:a040:3:4:face:b00c:3333:7020","2a00:a041:3c5d:4d00:605e:f34d:a502:2044","TCP","94","443  >  43262 [SYN, ACK] Seq=0 Ack=1 Win=31740 Len=0 MSS=1392 SACK_PERM=1 TSval=1756405120 TSecr=3910015484 WS=256"
"28","6.390945839","2a00:a041:3c5d:4d00:605e:f34d:a502:2044","2a00:a040:3:4:face:b00c:3333:7020","TCP","86","43262  >  443 [ACK] Seq=1 Ack=1 Win=64896 Len=0 TSval=3910015502 TSecr=1756405120"
"29","6.391892064","2a00:a041:3c5d:4d00:605e:f34d:a502:2044","2a00:a040:3:4:face:b00c:3333:7020","TLSv1.3","792","Client Hello"
"30","6.435461662","2a00:a040:3:4:face:b00c:3333:7020","2a00:a041:3c5d:4d00:605e:f34d:a502:2044","TCP","86","443  >  43262 [ACK] Seq=1 Ack=707 Win=31232 Len=0 TSval=1756405159 TSecr=3910015503"
"31","6.444254343","2a00:a040:3:4:face:b00c:3333:7020","2a00:a041:3c5d:4d00:605e:f34d:a502:2044","TLSv1.3","251","Server Hello, Application Data"
"33","6.444277646","2a00:a041:3c5d:4d00:605e:f34d:a502:2044","2a00:a040:3:4:face:b00c:3333:7020","TCP","86","43262  >  443 [ACK] Seq=707 Ack=166 Win=64768 Len=0 TSval=3910015555 TSecr=1756405160"
"34","6.444579374","2a00:a041:3c5d:4d00:605e:f34d:a502:2044","2a00:a040:3:4:face:b00c:3333:7020","TLSv1.3","92","Change Cipher Spec"
"35","6.444691755","2a00:a041:3c5d:4d00:605e:f34d:a502:2044","2a00:a040:3:4:face:b00c:3333:7020","TLSv1.3","144","Application Data"
"36","6.445966606","2a00:a041:3c5d:4d00:605e:f34d:a502:2044","2a00:a040:3:4:face:b00c:3333:7020","TLSv1.3","684","Application Data"
"37","6.458273734","192.168.1.12","157.240.221.60","TLSv1.2","159","Application Data"
"38","6.461346901","157.240.221.60","192.168.1.12","TLSv1.2","129","Application Data"
"39","6.465749889","2a00:a040:3:4:face:b00c:3333:7020","2a00:a041:3c5d:4d00:605e:f34d:a502:2044","TCP","86","443  >  43262 [ACK] Seq=166 Ack=1369 Win=31488 Len=0 TSval=1756405197 TSecr=3910015555"
"40","6.466263320","2a00:a040:3:4:face:b00c:3333:7020","2a00:a041:3c5d:4d00:605e:f34d:a502:2044","TLSv1.3","267","Application Data"
"41","6.493124284","157.240.221.60","192.168.1.12","TLSv1.2","342","Application Data"
"42","6.493162851","192.168.1.12","157.240.221.60","TCP","66","45474  >  443 [ACK] Seq=2567 Ack=1714 Win=803 Len=0 TSval=2063764948 TSecr=2016026695"
"43","6.506467182","2a00:a041:3c5d:4d00:605e:f34d:a502:2044","2a00:a040:3:4:face:b00c:3333:7020","TCP","86","43262  >  443 [ACK] Seq=1369 Ack=347 Win=64640 Len=0 TSval=3910015617 TSecr=1756405197"
"44","6.551948358","157.240.221.60","192.168.1.12","TLSv1.2","1069","Application Data"
"45","6.606486512","192.168.1.12","157.240.221.60","TCP","66","45474  >  443 [ACK] Seq=2567 Ack=2717 Win=825 Len=0 TSval=2063765061 TSecr=2016026782"
"46","6.675724994","2a00:a040:3:4:face:b00c:3333:7020","2a00:a041:3c5d:4d00:605e:f34d:a502:2044","TLSv1.3","679","Application Data"
"47","6.675751493","2a00:a041:3c5d:4d00:605e:f34d:a502:2044","2a00:a040:3:4:face:b00c:3333:7020","TCP","86","43262  >  443 [ACK] Seq=1369 Ack=940 Win=64128 Len=0 TSval=3910015787 TSecr=1756405407"
"48","6.677564587","2a00:a040:3:4:face:b00c:3333:7020","2a00:a041:3c5d:4d00:605e:f34d:a502:2044","TLSv1.3","1324","Application Data"
"49","6.677584682","2a00:a041:3c5d:4d00:605e:f34d:a502:2044","2a00:a040:3:4:face:b00c:3333:7020","TCP","86","43262  >  443 [ACK] Seq=1369 Ack=2178 Win=63104 Len=0 TSval=3910015788 TSecr=1756405407"
"50","6.678831804","2a00:a040:3:4:face:b00c:3333:7020","2a00:a041:3c5d:4d00:605e:f34d:a502:2044","TCP","1466","443  >  43262 [ACK] Seq=2178 Ack=1369 Win=31488 Len=1380 TSval=1756405407 TSecr=3910015617 [TCP segment of a reassembled PDU]"
"51","6.678844442","2a00:a041:3c5d:4d00:605e:f34d:a502:2044","2a00:a040:3:4:face:b00c:3333:7020","TCP","86","43262  >  443 [ACK] Seq=1369 Ack=3558 Win=63104 Len=0 TSval=3910015790 TSecr=1756405407"
"52","6.679787094","2a00:a040:3:4:face:b00c:3333:7020","2a00:a041:3c5d:4d00:605e:f34d:a502:2044","TLSv1.3","1466","Application Data [TCP segment of a reassembled PDU]"
"53","6.679798414","2a00:a041:3c5d:4d00:605e:f34d:a502:2044","2a00:a040:3:4:face:b00c:3333:7020","TCP","86","43262  >  443 [ACK] Seq=1369 Ack=4938 Win=63104 Len=0 TSval=3910015791 TSecr=1756405407"
"54","6.680507843","2a00:a040:3:4:face:b00c:3333:7020","2a00:a041:3c5d:4d00:605e:f34d:a502:2044","TLSv1.3","361","Application Data"
"55","6.680519486","2a00:a041:3c5d:4d00:605e:f34d:a502:2044","2a00:a040:3:4:face:b00c:3333:7020","TCP","86","43262  >  443 [ACK] Seq=1369 Ack=5213 Win=63104 Len=0 TSval=3910015791 TSecr=1756405407"
"56","6.681484095","2a00:a040:3:4:face:b00c:3333:7020","2a00:a041:3c5d:4d00:605e:f34d:a502:2044","TCP","1466","443  >  43262 [ACK] Seq=5213 Ack=1369 Win=31488 Len=1380 TSval=1756405408 TSecr=3910015617 [TCP segment of a reassembled PDU]"
"57","6.681495644","2a00:a041:3c5d:4d00:605e:f34d:a502:2044","2a00:a040:3:4:face:b00c:3333:7020","TCP","86","43262  >  443 [ACK] Seq=1369 Ack=6593 Win=63104 Len=0 TSval=3910015792 TSecr=1756405408"
"58","6.682689347","2a00:a040:3:4:face:b00c:3333:7020","2a00:a041:3c5d:4d00:605e:f34d:a502:2044","TLSv1.3","1466","Application Data [TCP segment of a reassembled PDU]"
"59","6.682697319","2a00:a041:3c5d:4d00:605e:f34d:a502:2044","2a00:a040:3:4:face:b00c:3333:7020","TCP","86","43262  >  443 [ACK] Seq=1369 Ack=7973 Win=63104 Len=0 TSval=3910015793 TSecr=1756405408"
"60","6.683595863","2a00:a040:3:4:face:b00c:3333:7020","2a00:a041:3c5d:4d00:605e:f34d:a502:2044","TLSv1.3","1466","Application Data [TCP segment of a reassembled PDU]"
"61","6.683604444","2a00:a041:3c5d:4d00:605e:f34d:a502:2044","2a00:a040:3:4:face:b00c:3333:7020","TCP","86","43262  >  443 [ACK] Seq=1369 Ack=9353 Win=63104 Len=0 TSval=3910015794 TSecr=1756405408"
"62","6.684462059","2a00:a040:3:4:face:b00c:3333:7020","2a00:a041:3c5d:4d00:605e:f34d:a502:2044","TLSv1.3","1153","Application Data"
"63","6.684470588","2a00:a041:3c5d:4d00:605e:f34d:a502:2044","2a00:a040:3:4:face:b00c:3333:7020","TCP","86","43262  >  443 [ACK] Seq=1369 Ack=10420 Win=63104 Len=0 TSval=3910015795 TSecr=1756405408"
"64","6.685607344","2a00:a040:3:4:face:b00c:3333:7020","2a00:a041:3c5d:4d00:605e:f34d:a502:2044","TCP","1466","443  >  43262 [ACK] Seq=10420 Ack=1369 Win=31488 Len=1380 TSval=1756405411 TSecr=3910015617 [TCP segment of a reassembled PDU]"
"65","6.685616739","2a00:a041:3c5d:4d00:605e:f34d:a502:2044","2a00:a040:3:4:face:b00c:3333:7020","TCP","86","43262  >  443 [ACK] Seq=1369 Ack=11800 Win=63104 Len=0 TSval=3910015796 TSecr=1756405411"
"66","6.686849909","2a00:a040:3:4:face:b00c:3333:7020","2a00:a041:3c5d:4d00:605e:f34d:a502:2044","TCP","1466","443  >  43262 [PSH, ACK] Seq=11800 Ack=1369 Win=31488 Len=1380 TSval=1756405411 TSecr=3910015617 [TCP segment of a reassembled PDU]"
"67","6.686849974","2a00:a040:3:4:face:b00c:3333:7020","2a00:a041:3c5d:4d00:605e:f34d:a502:2044","TLSv1.3","1412","Application Data"
"68","6.686855307","2a00:a041:3c5d:4d00:605e:f34d:a502:2044","2a00:a040:3:4:face:b00c:3333:7020","TCP","86","43262  >  443 [ACK] Seq=1369 Ack=13180 Win=63104 Len=0 TSval=3910015798 TSecr=1756405411"
"69","6.686920853","2a00:a041:3c5d:4d00:605e:f34d:a502:2044","2a00:a040:3:4:face:b00c:3333:7020","TCP","86","43262  >  443 [ACK] Seq=1369 Ack=14506 Win=64128 Len=0 TSval=3910015798 TSecr=1756405413"
"70","6.689127511","2a00:a040:3:4:face:b00c:3333:7020","2a00:a041:3c5d:4d00:605e:f34d:a502:2044","TCP","1466","443  >  43262 [ACK] Seq=14506 Ack=1369 Win=31488 Len=1380 TSval=1756405421 TSecr=3910015787 [TCP segment of a reassembled PDU]"
"71","6.689995932","2a00:a040:3:4:face:b00c:3333:7020","2a00:a041:3c5d:4d00:605e:f34d:a502:2044","TCP","1466","443  >  43262 [PSH, ACK] Seq=15886 Ack=1369 Win=31488 Len=1380 TSval=1756405421 TSecr=3910015787 [TCP segment of a reassembled PDU]"
"72","6.690057535","2a00:a041:3c5d:4d00:605e:f34d:a502:2044","2a00:a040:3:4:face:b00c:3333:7020","TCP","86","43262  >  443 [ACK] Seq=1369 Ack=17266 Win=64128 Len=0 TSval=3910015801 TSecr=1756405421"
"73","6.690994507","2a00:a040:3:4:face:b00c:3333:7020","2a00:a041:3c5d:4d00:605e:f34d:a502:2044","TLSv1.3","1466","Application Data [TCP segment of a reassembled PDU]"
"74","6.691725126","2a00:a040:3:4:face:b00c:3333:7020","2a00:a041:3c5d:4d00:605e:f34d:a502:2044","TCP","1466","443  >  43262 [PSH, ACK] Seq=18646 Ack=1369 Win=31488 Len=1380 TSval=1756405422 TSecr=3910015790 [TCP segment of a reassembled PDU]"
"75","6.691795474","2a00:a041:3c5d:4d00:605e:f34d:a502:2044","2a00:a040:3:4:face:b00c:3333:7020","TCP","86","43262  >  443 [ACK] Seq=1369 Ack=20026 Win=64128 Len=0 TSval=3910015803 TSecr=1756405422"
"76","6.693417653","2a00:a040:3:4:face:b00c:3333:7020","2a00:a041:3c5d:4d00:605e:f34d:a502:2044","TLSv1.3","1466","Application Data [TCP segment of a reassembled PDU]"
"77","6.694179709","2a00:a040:3:4:face:b00c:3333:7020","2a00:a041:3c5d:4d00:605e:f34d:a502:2044","TLSv1.3","1466","Application Data [TCP segment of a reassembled PDU]"
"78","6.694246202","2a00:a041:3c5d:4d00:605e:f34d:a502:2044","2a00:a040:3:4:face:b00c:3333:7020","TCP","86","43262  >  443 [ACK] Seq=1369 Ack=22786 Win=63104 Len=0 TSval=3910015805 TSecr=1756405425"
"79","6.696634707","2a00:a040:3:4:face:b00c:3333:7020","2a00:a041:3c5d:4d00:605e:f34d:a502:2044","TLSv1.3","1466","Application Data [TCP segment of a reassembled PDU]"
"80","6.697406185","2a00:a040:3:4:face:b00c:3333:7020","2a00:a041:3c5d:4d00:605e:f34d:a502:2044","TLSv1.3","1466","Application Data [TCP segment of a reassembled PDU]"
"81","6.697415395","2a00:a041:3c5d:4d00:605e:f34d:a502:2044","2a00:a040:3:4:face:b00c:3333:7020","TCP","86","43262  >  443 [ACK] Seq=1369 Ack=25546 Win=63104 Len=0 TSval=3910015808 TSecr=1756405428"
"82","6.699309150","2a00:a040:3:4:face:b00c:3333:7020","2a00:a041:3c5d:4d00:605e:f34d:a502:2044","TCP","1466","443  >  43262 [ACK] Seq=25546 Ack=1369 Win=31488 Len=1380 TSval=1756405430 TSecr=3910015795 [TCP segment of a reassembled PDU]"
"83","6.700002341","2a00:a040:3:4:face:b00c:3333:7020","2a00:a041:3c5d:4d00:605e:f34d:a502:2044","TLSv1.3","1466","Application Data [TCP segment of a reassembled PDU]"
"84","6.700014208","2a00:a041:3c5d:4d00:605e:f34d:a502:2044","2a00:a040:3:4:face:b00c:3333:7020","TCP","86","43262  >  443 [ACK] Seq=1369 Ack=28306 Win=63104 Len=0 TSval=3910015811 TSecr=1756405430"
"85","6.701782584","2a00:a040:3:4:face:b00c:3333:7020","2a00:a041:3c5d:4d00:605e:f34d:a502:2044","TCP","1466","443  >  43262 [ACK] Seq=28306 Ack=1369 Win=31488 Len=1380 TSval=1756405432 TSecr=3910015795 [TCP segment of a reassembled PDU]"
"86","6.702570436","2a00:a040:3:4:face:b00c:3333:7020","2a00:a041:3c5d:4d00:605e:f34d:a502:2044","TLSv1.3","1466","Application Data [TCP segment of a reassembled PDU]"
"87","6.702581775","2a00:a041:3c5d:4d00:605e:f34d:a502:2044","2a00:a040:3:4:face:b00c:3333:7020","TCP","86","43262  >  443 [ACK] Seq=1369 Ack=31066 Win=63104 Len=0 TSval=3910015813 TSecr=1756405432"
"88","6.705656601","2a00:a040:3:4:face:b00c:3333:7020","2a00:a041:3c5d:4d00:605e:f34d:a502:2044","TCP","2846","443  >  43262 [PSH, ACK] Seq=31066 Ack=1369 Win=31488 Len=2760 TSval=1756405434 TSecr=3910015795 [TCP segment of a reassembled PDU]"
"89","6.705752104","2a00:a041:3c5d:4d00:605e:f34d:a502:2044","2a00:a040:3:4:face:b00c:3333:7020","TCP","86","43262  >  443 [ACK] Seq=1369 Ack=33826 Win=64128 Len=0 TSval=3910015817 TSecr=1756405434"
"90","6.707505535","2a00:a040:3:4:face:b00c:3333:7020","2a00:a041:3c5d:4d00:605e:f34d:a502:2044","TLSv1.3","2846","Application Data, Application Data"
"91","6.707505691","2a00:a040:3:4:face:b00c:3333:7020","2a00:a041:3c5d:4d00:605e:f34d:a502:2044","TLSv1.3","2846","Application Data [TCP segment of a reassembled PDU]"
"92","6.707583508","2a00:a041:3c5d:4d00:605e:f34d:a502:2044","2a00:a040:3:4:face:b00c:3333:7020","TCP","86","43262  >  443 [ACK] Seq=1369 Ack=39346 Win=58624 Len=0 TSval=3910015818 TSecr=1756405435"
"93","6.708685942","2a00:a040:3:4:face:b00c:3333:7020","2a00:a041:3c5d:4d00:605e:f34d:a502:2044","TCP","2846","443  >  43262 [PSH, ACK] Seq=39346 Ack=1369 Win=31488 Len=2760 TSval=1756405438 TSecr=3910015801 [TCP segment of a reassembled PDU]"
"94","6.708697195","2a00:a041:3c5d:4d00:605e:f34d:a502:2044","2a00:a040:3:4:face:b00c:3333:7020","TCP","86","43262  >  443 [ACK] Seq=1369 Ack=42106 Win=61056 Len=0 TSval=3910015819 TSecr=1756405438"
"95","6.709843540","2a00:a040:3:4:face:b00c:3333:7020","2a00:a041:3c5d:4d00:605e:f34d:a502:2044","TLSv1.3","1466","Application Data [TCP segment of a reassembled PDU]"
"96","6.710691618","2a00:a040:3:4:face:b00c:3333:7020","2a00:a041:3c5d:4d00:605e:f34d:a502:2044","TLSv1.3","1466","Application Data [TCP segment of a reassembled PDU]"
"97","6.710703966","2a00:a041:3c5d:4d00:605e:f34d:a502:2044","2a00:a040:3:4:face:b00c:3333:7020","TCP","86","43262  >  443 [ACK] Seq=1369 Ack=44866 Win=63104 Len=0 TSval=3910015821 TSecr=1756405439"
"98","6.711622365","2a00:a040:3:4:face:b00c:3333:7020","2a00:a041:3c5d:4d00:605e:f34d:a502:2044","TLSv1.3","1169","Application Data"
"99","6.711724596","2a00:a041:3c5d:4d00:605e:f34d:a502:2044","2a00:a040:3:4:face:b00c:3333:7020","TCP","86","43262  >  443 [ACK] Seq=1369 Ack=45949 Win=64128 Len=0 TSval=3910015822 TSecr=1756405440"
"100","6.727566149","2a00:a040:3:4:face:b00c:3333:7020","2a00:a041:3c5d:4d00:605e:f34d:a502:2044","TCP","86","[TCP Dup ACK 39#1] 443  >  43262 [ACK] Seq=45949 Ack=1369 Win=31488 Len=0 TSval=1756405460 TSecr=3910015822"
"101","6.802496314","192.168.1.12","157.240.221.60","TLSv1.2","138","Application Data"
"102","6.960413835","157.240.221.60","192.168.1.12","TCP","66","443  >  45474 [ACK] Seq=2717 Ack=2639 Win=354 Len=0 TSval=2016027150 TSecr=2063765257"
"103","10.134942481","157.240.221.60","192.168.1.12","TLSv1.2","159","Application Data"
"104","10.134984192","192.168.1.12","157.240.221.60","TCP","66","45474  >  443 [ACK] Seq=2639 Ack=2810 Win=825 Len=0 TSval=2063768590 TSecr=2016030226"
"105","10.140354483","192.168.1.12","157.240.221.60","TLSv1.2","158","Application Data"
"106","10.216375855","157.240.221.60","192.168.1.12","TCP","66","443  >  45474 [ACK] Seq=2810 Ack=2731 Win=354 Len=0 TSval=2016030451 TSecr=2063768595"
"108","11.364029818","20.199.120.85","192.168.1.12","TCP","60","443  >  55044 [FIN, ACK] Seq=1 Ack=1 Win=7969 Len=0"
"109","11.364713099","192.168.1.12","20.199.120.85","TCP","54","55044  >  443 [FIN, ACK] Seq=1 Ack=2 Win=501 Len=0"
"110","11.443696961","20.199.120.85","192.168.1.12","TCP","60","443  >  55044 [ACK] Seq=2 Ack=2 Win=7969 Len=0"
"111","12.369090699","192.168.1.12","20.199.120.85","TCP","74","53760  >  443 [SYN] Seq=0 Win=64240 Len=0 MSS=1460 SACK_PERM=1 TSval=2688997967 TSecr=0 WS=128"
"112","12.451391131","20.199.120.85","192.168.1.12","TCP","66","443  >  53760 [SYN, ACK] Seq=0 Ack=1 Win=8192 Len=0 MSS=1440 WS=1 SACK_PERM=1"
"113","12.451446674","192.168.1.12","20.199.120.85","TCP","54","53760  >  443 [ACK] Seq=1 Ack=1 Win=64256 Len=0"
"114","12.451873489","192.168.1.12","20.199.120.85","TLSv1.2","571","Client Hello"
"115","12.545090809","20.199.120.85","192.168.1.12","TCP","1514","443  >  53760 [PSH, ACK] Seq=1 Ack=518 Win=7675 Len=1460 [TCP segment of a reassembled PDU]"
"116","12.545154332","192.168.1.12","20.199.120.85","TCP","54","53760  >  443 [ACK] Seq=518 Ack=1461 Win=63104 Len=0"
"117","12.545871405","20.199.120.85","192.168.1.12","TCP","1514","443  >  53760 [PSH, ACK] Seq=1461 Ack=518 Win=7675 Len=1460 [TCP segment of a reassembled PDU]"
"118","12.545893148","192.168.1.12","20.199.120.85","TCP","54","53760  >  443 [ACK] Seq=518 Ack=2921 Win=63104 Len=0"
"119","12.548122483","20.199.120.85","192.168.1.12","TCP","1514","443  >  53760 [PSH, ACK] Seq=2921 Ack=518 Win=7675 Len=1460 [TCP segment of a reassembled PDU]"
"120","12.548153473","192.168.1.12","20.199.120.85","TCP","54","53760  >  443 [ACK] Seq=518 Ack=4381 Win=63104 Len=0"
"121","12.548851215","20.199.120.85","192.168.1.12","TCP","1514","443  >  53760 [PSH, ACK] Seq=4381 Ack=518 Win=7675 Len=1460 [TCP segment of a reassembled PDU]"
"122","12.548872775","192.168.1.12","20.199.120.85","TCP","54","53760  >  443 [ACK] Seq=518 Ack=5841 Win=63104 Len=0"
"123","12.647970341","20.199.120.85","192.168.1.12","TLSv1.2","141","Server Hello, Certificate, Certificate Status, Server Key Exchange, Server Hello Done"
"124","12.648007021","192.168.1.12","20.199.120.85","TCP","54","53760  >  443 [ACK] Seq=518 Ack=5928 Win=64128 Len=0"
"125","12.652011033","192.168.1.12","20.199.120.85","TLSv1.2","212","Client Key Exchange, Change Cipher Spec, Encrypted Handshake Message"
"126","12.739625946","20.199.120.85","192.168.1.12","TLSv1.2","105","Change Cipher Spec, Encrypted Handshake Message"
"127","12.741325548","192.168.1.12","20.199.120.85","TLSv1.2","329","Application Data"
"128","12.831812470","20.199.120.85","192.168.1.12","TLSv1.2","335","Application Data"
"129","12.832736558","192.168.1.12","20.199.120.85","TLSv1.2","208","Application Data"
"130","12.927696101","20.199.120.85","192.168.1.12","TLSv1.2","157","Application Data"
"131","12.928467209","192.168.1.12","20.199.120.85","TLSv1.2","538","Application Data"
"132","13.104465079","20.199.120.85","192.168.1.12","TCP","60","443  >  53760 [ACK] Seq=6363 Ack=1589 Win=8192 Len=0"
"133","13.411987330","20.199.120.85","192.168.1.12","TLSv1.2","407","Application Data"
"134","13.412923524","192.168.1.12","20.199.120.85","TLSv1.2","277","Application Data"
"135","13.493146664","20.199.120.85","192.168.1.12","TLSv1.2","157","Application Data"
"136","13.522450310","157.240.221.60","192.168.1.12","TLSv1.2","1392","Application Data"
"137","13.534511839","192.168.1.12","20.199.120.85","TCP","54","53760  >  443 [ACK] Seq=1812 Ack=6819 Win=64128 Len=0"
"138","13.566495858","192.168.1.12","157.240.221.60","TCP","66","45474  >  443 [ACK] Seq=2731 Ack=4136 Win=846 Len=0 TSval=2063772021 TSecr=2016033756"
"142","13.983875020","2a00:a041:3c5d:4d00:605e:f34d:a502:2044","2a00:a040:3:4:face:b00c:3333:7020","TLSv1.3","684","Application Data"
"143","14.052036262","2a00:a040:3:4:face:b00c:3333:7020","2a00:a041:3c5d:4d00:605e:f34d:a502:2044","TCP","86","443  >  43262 [ACK] Seq=45949 Ack=1967 Win=31488 Len=0 TSval=1756412782 TSecr=3910023095"
"144","14.078996700","2a00:a040:3:4:face:b00c:3333:7020","2a00:a041:3c5d:4d00:605e:f34d:a502:2044","TLSv1.3","677","Application Data"
"145","14.079032282","2a00:a041:3c5d:4d00:605e:f34d:a502:2044","2a00:a040:3:4:face:b00c:3333:7020","TCP","86","43262  >  443 [ACK] Seq=1967 Ack=46540 Win=63616 Len=0 TSval=3910023190 TSecr=1756412808"
"146","14.079734003","2a00:a040:3:4:face:b00c:3333:7020","2a00:a041:3c5d:4d00:605e:f34d:a502:2044","TLSv1.3","109","Application Data"
"147","14.079734177","2a00:a040:3:4:face:b00c:3333:7020","2a00:a041:3c5d:4d00:605e:f34d:a502:2044","TCP","1466","443  >  43262 [ACK] Seq=46563 Ack=1967 Win=31488 Len=1380 TSval=1756412808 TSecr=3910023095 [TCP segment of a reassembled PDU]"
"148","14.079746559","2a00:a041:3c5d:4d00:605e:f34d:a502:2044","2a00:a040:3:4:face:b00c:3333:7020","TCP","86","43262  >  443 [ACK] Seq=1967 Ack=46563 Win=64128 Len=0 TSval=3910023191 TSecr=1756412808"
"149","14.079761126","2a00:a041:3c5d:4d00:605e:f34d:a502:2044","2a00:a040:3:4:face:b00c:3333:7020","TCP","86","43262  >  443 [ACK] Seq=1967 Ack=47943 Win=66944 Len=0 TSval=3910023191 TSecr=1756412808"
"150","14.081406077","2a00:a040:3:4:face:b00c:3333:7020","2a00:a041:3c5d:4d00:605e:f34d:a502:2044","TLSv1.3","1466","Application Data [TCP segment of a reassembled PDU]"
"151","14.081418741","2a00:a041:3c5d:4d00:605e:f34d:a502:2044","2a00:a040:3:4:face:b00c:3333:7020","TCP","86","43262  >  443 [ACK] Seq=1967 Ack=49323 Win=69632 Len=0 TSval=3910023192 TSecr=1756412808"
"152","14.082133409","2a00:a040:3:4:face:b00c:3333:7020","2a00:a041:3c5d:4d00:605e:f34d:a502:2044","TLSv1.3","360","Application Data"
"153","14.082137294","2a00:a041:3c5d:4d00:605e:f34d:a502:2044","2a00:a040:3:4:face:b00c:3333:7020","TCP","86","43262  >  443 [ACK] Seq=1967 Ack=49597 Win=72448 Len=0 TSval=3910023193 TSecr=1756412809"
"154","14.084334435","2a00:a040:3:4:face:b00c:3333:7020","2a00:a041:3c5d:4d00:605e:f34d:a502:2044","TCP","1466","443  >  43262 [ACK] Seq=49597 Ack=1967 Win=31488 Len=1380 TSval=1756412810 TSecr=3910023095 [TCP segment of a reassembled PDU]"
"155","14.084346779","2a00:a041:3c5d:4d00:605e:f34d:a502:2044","2a00:a040:3:4:face:b00c:3333:7020","TCP","86","43262  >  443 [ACK] Seq=1967 Ack=50977 Win=75264 Len=0 TSval=3910023195 TSecr=1756412810"
"156","14.085224770","2a00:a040:3:4:face:b00c:3333:7020","2a00:a041:3c5d:4d00:605e:f34d:a502:2044","TCP","1466","443  >  43262 [PSH, ACK] Seq=50977 Ack=1967 Win=31488 Len=1380 TSval=1756412810 TSecr=3910023095 [TCP segment of a reassembled PDU]"
"157","14.085236823","2a00:a041:3c5d:4d00:605e:f34d:a502:2044","2a00:a040:3:4:face:b00c:3333:7020","TCP","86","43262  >  443 [ACK] Seq=1967 Ack=52357 Win=77952 Len=0 TSval=3910023196 TSecr=1756412810"
"158","14.087847765","2a00:a040:3:4:face:b00c:3333:7020","2a00:a041:3c5d:4d00:605e:f34d:a502:2044","TCP","1466","443  >  43262 [ACK] Seq=52357 Ack=1967 Win=31488 Len=1380 TSval=1756412811 TSecr=3910023095 [TCP segment of a reassembled PDU]"
"159","14.087860297","2a00:a041:3c5d:4d00:605e:f34d:a502:2044","2a00:a040:3:4:face:b00c:3333:7020","TCP","86","43262  >  443 [ACK] Seq=1967 Ack=53737 Win=80768 Len=0 TSval=3910023199 TSecr=1756412811"
"160","14.088737058","2a00:a040:3:4:face:b00c:3333:7020","2a00:a041:3c5d:4d00:605e:f34d:a502:2044","TCP","1466","443  >  43262 [PSH, ACK] Seq=53737 Ack=1967 Win=31488 Len=1380 TSval=1756412811 TSecr=3910023095 [TCP segment of a reassembled PDU]"
"161","14.088749514","2a00:a041:3c5d:4d00:605e:f34d:a502:2044","2a00:a040:3:4:face:b00c:3333:7020","TCP","86","43262  >  443 [ACK] Seq=1967 Ack=55117 Win=83456 Len=0 TSval=3910023200 TSecr=1756412811"
"162","14.092091253","2a00:a040:3:4:face:b00c:3333:7020","2a00:a041:3c5d:4d00:605e:f34d:a502:2044","TCP","1466","443  >  43262 [ACK] Seq=55117 Ack=1967 Win=31488 Len=1380 TSval=1756412811 TSecr=3910023095 [TCP segment of a reassembled PDU]"
"163","14.092103527","2a00:a041:3c5d:4d00:605e:f34d:a502:2044","2a00:a040:3:4:face:b00c:3333:7020","TCP","86","43262  >  443 [ACK] Seq=1967 Ack=56497 Win=86272 Len=0 TSval=3910023203 TSecr=1756412811"
"164","14.092706098","2a00:a040:3:4:face:b00c:3333:7020","2a00:a041:3c5d:4d00:605e:f34d:a502:2044","TCP","1466","443  >  43262 [PSH, ACK] Seq=56497 Ack=1967 Win=31488 Len=1380 TSval=1756412811 TSecr=3910023095 [TCP segment of a reassembled PDU]"
"165","14.092718243","2a00:a041:3c5d:4d00:605e:f34d:a502:2044","2a00:a040:3:4:face:b00c:3333:7020","TCP","86","43262  >  443 [ACK] Seq=1967 Ack=57877 Win=88960 Len=0 TSval=3910023203 TSecr=1756412811"
"166","14.094936273","2a00:a040:3:4:face:b00c:3333:7020","2a00:a041:3c5d:4d00:605e:f34d:a502:2044","TCP","1466","443  >  43262 [ACK] Seq=57877 Ack=1967 Win=31488 Len=1380 TSval=1756412812 TSecr=3910023095 [TCP segment of a reassembled PDU]"
"167","14.094948507","2a00:a041:3c5d:4d00:605e:f34d:a502:2044","2a00:a040:3:4:face:b00c:3333:7020","TCP","86","43262  >  443 [ACK] Seq=1967 Ack=59257 Win=91776 Len=0 TSval=3910023206 TSecr=1756412812"
"168","14.095824831","2a00:a040:3:4:face:b00c:3333:7020","2a00:a041:3c5d:4d00:605e:f34d:a502:2044","TCP","1466","443  >  43262 [PSH, ACK] Seq=59257 Ack=1967 Win=31488 Len=1380 TSval=1756412812 TSecr=3910023095 [TCP segment of a reassembled PDU]"
"169","14.095837232","2a00:a041:3c5d:4d00:605e:f34d:a502:2044","2a00:a040:3:4:face:b00c:3333:7020","TCP","86","43262  >  443 [ACK] Seq=1967 Ack=60637 Win=94592 Len=0 TSval=3910023207 TSecr=1756412812"
"170","14.098942900","2a00:a040:3:4:face:b00c:3333:7020","2a00:a041:3c5d:4d00:605e:f34d:a502:2044","TCP","1466","443  >  43262 [ACK] Seq=60637 Ack=1967 Win=31488 Len=1380 TSval=1756412813 TSecr=3910023095 [TCP segment of a reassembled PDU]"
"171","14.098955572","2a00:a041:3c5d:4d00:605e:f34d:a502:2044","2a00:a040:3:4:face:b00c:3333:7020","TCP","86","43262  >  443 [ACK] Seq=1967 Ack=62017 Win=97280 Len=0 TSval=3910023210 TSecr=1756412813"
"172","14.099832328","2a00:a040:3:4:face:b00c:3333:7020","2a00:a041:3c5d:4d00:605e:f34d:a502:2044","TLSv1.3","1466","Application Data [TCP segment of a reassembled PDU]"
"173","14.099844957","2a00:a041:3c5d:4d00:605e:f34d:a502:2044","2a00:a040:3:4:face:b00c:3333:7020","TCP","86","43262  >  443 [ACK] Seq=1967 Ack=63397 Win=100096 Len=0 TSval=3910023211 TSecr=1756412813"
"174","14.102393977","2a00:a040:3:4:face:b00c:3333:7020","2a00:a041:3c5d:4d00:605e:f34d:a502:2044","TLSv1.3","1466","Application Data [TCP segment of a reassembled PDU]"
"175","14.102431001","2a00:a041:3c5d:4d00:605e:f34d:a502:2044","2a00:a040:3:4:face:b00c:3333:7020","TCP","86","43262  >  443 [ACK] Seq=1967 Ack=64777 Win=102784 Len=0 TSval=3910023213 TSecr=1756412813"
"176","14.103309973","2a00:a040:3:4:face:b00c:3333:7020","2a00:a041:3c5d:4d00:605e:f34d:a502:2044","TCP","1466","443  >  43262 [PSH, ACK] Seq=64777 Ack=1967 Win=31488 Len=1380 TSval=1756412813 TSecr=3910023095 [TCP segment of a reassembled PDU]"
"177","14.103324409","2a00:a041:3c5d:4d00:605e:f34d:a502:2044","2a00:a040:3:4:face:b00c:3333:7020","TCP","86","43262  >  443 [ACK] Seq=1967 Ack=66157 Win=105600 Len=0 TSval=3910023214 TSecr=1756412813"
"178","14.105302923","2a00:a040:3:4:face:b00c:3333:7020","2a00:a041:3c5d:4d00:605e:f34d:a502:2044","TLSv1.3","1466","Application Data [TCP segment of a reassembled PDU]"
"179","14.105317730","2a00:a041:3c5d:4d00:605e:f34d:a502:2044","2a00:a040:3:4:face:b00c:3333:7020","TCP","86","43262  >  443 [ACK] Seq=1967 Ack=67537 Win=108288 Len=0 TSval=3910023216 TSecr=1756412814"
"180","14.106753662","2a00:a040:3:4:face:b00c:3333:7020","2a00:a041:3c5d:4d00:605e:f34d:a502:2044","TCP","1466","443  >  43262 [PSH, ACK] Seq=67537 Ack=1967 Win=31488 Len=1380 TSval=1756412814 TSecr=3910023095 [TCP segment of a reassembled PDU]"
"181","14.106766026","2a00:a041:3c5d:4d00:605e:f34d:a502:2044","2a00:a040:3:4:face:b00c:3333:7020","TCP","86","43262  >  443 [ACK] Seq=1967 Ack=68917 Win=111104 Len=0 TSval=3910023218 TSecr=1756412814"
"182","14.108349877","2a00:a040:3:4:face:b00c:3333:7020","2a00:a041:3c5d:4d00:605e:f34d:a502:2044","TCP","1466","443  >  43262 [ACK] Seq=68917 Ack=1967 Win=31488 Len=1380 TSval=1756412815 TSecr=3910023095 [TCP segment of a reassembled PDU]"
"183","14.108362332","2a00:a041:3c5d:4d00:605e:f34d:a502:2044","2a00:a040:3:4:face:b00c:3333:7020","TCP","86","43262  >  443 [ACK] Seq=1967 Ack=70297 Win=113792 Len=0 TSval=3910023219 TSecr=1756412815"
"184","14.109268062","2a00:a040:3:4:face:b00c:3333:7020","2a00:a041:3c5d:4d00:605e:f34d:a502:2044","TLSv1.3","1466","Application Data [TCP segment of a reassembled PDU]"
"185","14.109280754","2a00:a041:3c5d:4d00:605e:f34d:a502:2044","2a00:a040:3:4:face:b00c:3333:7020","TCP","86","43262  >  443 [ACK] Seq=1967 Ack=71677 Win=116608 Len=0 TSval=3910023220 TSecr=1756412815"
"186","14.111795316","2a00:a040:3:4:face:b00c:3333:7020","2a00:a041:3c5d:4d00:605e:f34d:a502:2044","TLSv1.3","1093","Application Data, Application Data"
"187","14.111821030","2a00:a041:3c5d:4d00:605e:f34d:a502:2044","2a00:a040:3:4:face:b00c:3333:7020","TCP","86","43262  >  443 [ACK] Seq=1967 Ack=72684 Win=119424 Len=0 TSval=3910023223 TSecr=1756412815"
"188","14.125611926","192.168.1.12","157.240.221.60","TLSv1.2","159","Application Data"
"189","14.205442234","157.240.221.60","192.168.1.12","TCP","66","443  >  45474 [ACK] Seq=4136 Ack=2824 Win=354 Len=0 TSval=2016034439 TSecr=2063772580"
"190","17.405443975","157.240.221.60","192.168.1.12","TLSv1.2","159","Application Data"
"191","17.405483999","192.168.1.12","157.240.221.60","TCP","66","45474  >  443 [ACK] Seq=2824 Ack=4229 Win=846 Len=0 TSval=2063775860 TSecr=2016037556"
"192","17.410329848","192.168.1.12","157.240.221.60","TLSv1.2","158","Application Data"
"193","17.486517524","157.240.221.60","192.168.1.12","TCP","66","443  >  45474 [ACK] Seq=4229 Ack=2916 Win=354 Len=0 TSval=2016037722 TSecr=2063775865"
"194","18.450564496","192.168.1.12","20.126.21.36","TCP","54","55568  >  443 [ACK] Seq=1 Ack=1 Win=501 Len=0"
"195","18.536024283","20.126.21.36","192.168.1.12","TCP","60","[TCP ACKed unseen segment] 443  >  55568 [ACK] Seq=1 Ack=2 Win=2052 Len=0"
"207","25.491162517","192.168.1.12","157.240.221.60","TLSv1.2","135","Application Data"
"208","25.570833954","157.240.221.60","192.168.1.12","TCP","66","443  >  45474 [ACK] Seq=4229 Ack=2985 Win=354 Len=0 TSval=2016045805 TSecr=2063783946"
"209","25.699683291","157.240.221.60","192.168.1.12","TLSv1.2","137","Application Data"
"210","25.742513141","192.168.1.12","157.240.221.60","TCP","66","45474  >  443 [ACK] Seq=2985 Ack=4300 Win=846 Len=0 TSval=2063784197 TSecr=2016045920"
"211","27.338628477","157.240.221.60","192.168.1.12","TLSv1.2","184","Application Data"
"212","27.338676560","192.168.1.12","157.240.221.60","TCP","66","45474  >  443 [ACK] Seq=2985 Ack=4418 Win=846 Len=0 TSval=2063785793 TSecr=2016047513"
"213","27.344470117","192.168.1.12","157.240.221.60","TLSv1.2","160","Application Data"
"214","27.431209110","157.240.221.60","192.168.1.12","TCP","66","443  >  45474 [ACK] Seq=4418 Ack=3079 Win=354 Len=0 TSval=2016047666 TSecr=2063785799"
"215","27.850283750","157.240.221.60","192.168.1.12","TCP","1446","443  >  45474 [ACK] Seq=4418 Ack=3079 Win=354 Len=1380 TSval=2016048007 TSecr=2063785799 [TCP segment of a reassembled PDU]"
"216","27.850784017","157.240.221.60","192.168.1.12","TLSv1.2","576","Application Data, Application Data"
"217","27.850812423","192.168.1.12","157.240.221.60","TCP","66","45474  >  443 [ACK] Seq=3079 Ack=6308 Win=889 Len=0 TSval=2063786306 TSecr=2016048007"
"218","28.157378217","157.240.221.60","192.168.1.12","TLSv1.2","207","Application Data"
"219","28.161038162","192.168.1.12","157.240.221.60","TLSv1.2","166","Application Data"
"220","28.238803801","157.240.221.60","192.168.1.12","TCP","66","443  >  45474 [ACK] Seq=6449 Ack=3179 Win=354 Len=0 TSval=2016048474 TSecr=2063786616"
"221","28.558593805","2a00:a041:3c5d:4d00:605e:f34d:a502:2044","2a00:a040:3:4:face:b00c:3333:7020","TLSv1.3","684","Application Data"
"222","28.584535596","2a00:a040:3:4:face:b00c:3333:7020","2a00:a041:3c5d:4d00:605e:f34d:a502:2044","TCP","86","443  >  43262 [ACK] Seq=72684 Ack=2565 Win=30976 Len=0 TSval=1756427314 TSecr=3910037669"
"223","28.590732408","192.168.1.12","157.240.221.60","TLSv1.2","162","Application Data"
"224","28.668747666","157.240.221.60","192.168.1.12","TCP","66","443  >  45474 [ACK] Seq=6449 Ack=3275 Win=354 Len=0 TSval=2016048903 TSecr=2063787045"
"225","28.730423393","2a00:a040:3:4:face:b00c:3333:7020","2a00:a041:3c5d:4d00:605e:f34d:a502:2044","TLSv1.3","678","Application Data"
"226","28.730461847","2a00:a041:3c5d:4d00:605e:f34d:a502:2044","2a00:a040:3:4:face:b00c:3333:7020","TCP","86","43262  >  443 [ACK] Seq=2565 Ack=73276 Win=122112 Len=0 TSval=3910037841 TSecr=1756427459"
"227","28.731022209","2a00:a040:3:4:face:b00c:3333:7020","2a00:a041:3c5d:4d00:605e:f34d:a502:2044","TCP","1466","443  >  43262 [ACK] Seq=73276 Ack=2565 Win=31488 Len=1380 TSval=1756427459 TSecr=3910037669 [TCP segment of a reassembled PDU]"
"228","28.731036041","2a00:a041:3c5d:4d00:605e:f34d:a502:2044","2a00:a040:3:4:face:b00c:3333:7020","TCP","86","43262  >  443 [ACK] Seq=2565 Ack=74656 Win=124928 Len=0 TSval=3910037842 TSecr=1756427459"
"229","28.742539059","2a00:a040:3:4:face:b00c:3333:7020","2a00:a041:3c5d:4d00:605e:f34d:a502:2044","TLSv1.3","227","Application Data"
"230","28.742566692","2a00:a041:3c5d:4d00:605e:f34d:a502:2044","2a00:a040:3:4:face:b00c:3333:7020","TCP","86","43262  >  443 [ACK] Seq=2565 Ack=74797 Win=127616 Len=0 TSval=3910037853 TSecr=1756427459"
"231","28.745238389","2a00:a040:3:4:face:b00c:3333:7020","2a00:a041:3c5d:4d00:605e:f34d:a502:2044","TLSv1.3","2846","Application Data"
"232","28.745238654","2a00:a040:3:4:face:b00c:3333:7020","2a00:a041:3c5d:4d00:605e:f34d:a502:2044","TLSv1.3","1892","Application Data, Application Data"
"233","28.745238701","2a00:a040:3:4:face:b00c:3333:7020","2a00:a041:3c5d:4d00:605e:f34d:a502:2044","TLSv1.3","2846","Application Data"
"234","28.745238743","2a00:a040:3:4:face:b00c:3333:7020","2a00:a041:3c5d:4d00:605e:f34d:a502:2044","TLSv1.3","720","Application Data"
"235","28.745262033","2a00:a041:3c5d:4d00:605e:f34d:a502:2044","2a00:a040:3:4:face:b00c:3333:7020","TCP","86","43262  >  443 [ACK] Seq=2565 Ack=77557 Win=133120 Len=0 TSval=3910037856 TSecr=1756427460"
"236","28.745286474","2a00:a041:3c5d:4d00:605e:f34d:a502:2044","2a00:a040:3:4:face:b00c:3333:7020","TCP","86","43262  >  443 [ACK] Seq=2565 Ack=79363 Win=136832 Len=0 TSval=3910037856 TSecr=1756427460"
"237","28.745293025","2a00:a041:3c5d:4d00:605e:f34d:a502:2044","2a00:a040:3:4:face:b00c:3333:7020","TCP","86","43262  >  443 [ACK] Seq=2565 Ack=82123 Win=142336 Len=0 TSval=3910037856 TSecr=1756427461"
"238","28.745299614","2a00:a041:3c5d:4d00:605e:f34d:a502:2044","2a00:a040:3:4:face:b00c:3333:7020","TCP","86","43262  >  443 [ACK] Seq=2565 Ack=82757 Win=145024 Len=0 TSval=3910037856 TSecr=1756427461"
"239","28.748690407","2a00:a040:3:4:face:b00c:3333:7020","2a00:a041:3c5d:4d00:605e:f34d:a502:2044","TCP","2846","443  >  43262 [PSH, ACK] Seq=82757 Ack=2565 Win=31488 Len=2760 TSval=1756427462 TSecr=3910037669 [TCP segment of a reassembled PDU]"
"240","28.748690560","2a00:a040:3:4:face:b00c:3333:7020","2a00:a041:3c5d:4d00:605e:f34d:a502:2044","TLSv1.3","1412","Application Data"
"241","28.748690606","2a00:a040:3:4:face:b00c:3333:7020","2a00:a041:3c5d:4d00:605e:f34d:a502:2044","TCP","1466","443  >  43262 [ACK] Seq=86843 Ack=2565 Win=31488 Len=1380 TSval=1756427463 TSecr=3910037669 [TCP segment of a reassembled PDU]"
"242","28.748705858","2a00:a041:3c5d:4d00:605e:f34d:a502:2044","2a00:a040:3:4:face:b00c:3333:7020","TCP","86","43262  >  443 [ACK] Seq=2565 Ack=85517 Win=150528 Len=0 TSval=3910037859 TSecr=1756427462"
"243","28.748719685","2a00:a041:3c5d:4d00:605e:f34d:a502:2044","2a00:a040:3:4:face:b00c:3333:7020","TCP","86","43262  >  443 [ACK] Seq=2565 Ack=86843 Win=153344 Len=0 TSval=3910037859 TSecr=1756427462"
"244","28.748728782","2a00:a041:3c5d:4d00:605e:f34d:a502:2044","2a00:a040:3:4:face:b00c:3333:7020","TCP","86","43262  >  443 [ACK] Seq=2565 Ack=88223 Win=156160 Len=0 TSval=3910037859 TSecr=1756427463"
"245","28.749340020","2a00:a040:3:4:face:b00c:3333:7020","2a00:a041:3c5d:4d00:605e:f34d:a502:2044","TCP","1466","443  >  43262 [PSH, ACK] Seq=88223 Ack=2565 Win=31488 Len=1380 TSval=1756427463 TSecr=3910037669 [TCP segment of a reassembled PDU]"
"246","28.749353697","2a00:a041:3c5d:4d00:605e:f34d:a502:2044","2a00:a040:3:4:face:b00c:3333:7020","TCP","86","43262  >  443 [ACK] Seq=2565 Ack=89603 Win=158848 Len=0 TSval=3910037860 TSecr=1756427463"
"247","28.750040562","2a00:a040:3:4:face:b00c:3333:7020","2a00:a041:3c5d:4d00:605e:f34d:a502:2044","TLSv1.3","1466","Application Data [TCP segment of a reassembled PDU]"
"248","28.750049034","2a00:a041:3c5d:4d00:605e:f34d:a502:2044","2a00:a040:3:4:face:b00c:3333:7020","TCP","86","43262  >  443 [ACK] Seq=2565 Ack=90983 Win=161664 Len=0 TSval=3910037861 TSecr=1756427463"
"249","28.751188940","2a00:a040:3:4:face:b00c:3333:7020","2a00:a041:3c5d:4d00:605e:f34d:a502:2044","TLSv1.3","451","Application Data"
"250","28.751201852","2a00:a041:3c5d:4d00:605e:f34d:a502:2044","2a00:a040:3:4:face:b00c:3333:7020","TCP","86","43262  >  443 [ACK] Seq=2565 Ack=91348 Win=164352 Len=0 TSval=3910037862 TSecr=1756427463"
"251","28.751857711","2a00:a040:3:4:face:b00c:3333:7020","2a00:a041:3c5d:4d00:605e:f34d:a502:2044","TCP","1466","443  >  43262 [ACK] Seq=91348 Ack=2565 Win=31488 Len=1380 TSval=1756427464 TSecr=3910037669 [TCP segment of a reassembled PDU]"
"252","28.751867294","2a00:a041:3c5d:4d00:605e:f34d:a502:2044","2a00:a040:3:4:face:b00c:3333:7020","TCP","86","43262  >  443 [ACK] Seq=2565 Ack=92728 Win=167168 Len=0 TSval=3910037863 TSecr=1756427464"
"253","28.761734594","2a00:a040:3:4:face:b00c:3333:7020","2a00:a041:3c5d:4d00:605e:f34d:a502:2044","TLSv1.3","1466","Application Data [TCP segment of a reassembled PDU]"
"254","28.761756590","2a00:a041:3c5d:4d00:605e:f34d:a502:2044","2a00:a040:3:4:face:b00c:3333:7020","TCP","86","43262  >  443 [ACK] Seq=2565 Ack=94108 Win=169856 Len=0 TSval=3910037873 TSecr=1756427464"
"255","28.764726146","2a00:a040:3:4:face:b00c:3333:7020","2a00:a041:3c5d:4d00:605e:f34d:a502:2044","TLSv1.3","1892","Application Data, Application Data"
"256","28.764726311","2a00:a040:3:4:face:b00c:3333:7020","2a00:a041:3c5d:4d00:605e:f34d:a502:2044","TLSv1.3","2846","Application Data"
"257","28.764726355","2a00:a040:3:4:face:b00c:3333:7020","2a00:a041:3c5d:4d00:605e:f34d:a502:2044","TLSv1.3","729","Application Data"
"258","28.764726398","2a00:a040:3:4:face:b00c:3333:7020","2a00:a041:3c5d:4d00:605e:f34d:a502:2044","TCP","2846","443  >  43262 [PSH, ACK] Seq=99317 Ack=2565 Win=31488 Len=2760 TSval=1756427466 TSecr=3910037669 [TCP segment of a reassembled PDU]"
"259","28.764743942","2a00:a041:3c5d:4d00:605e:f34d:a502:2044","2a00:a040:3:4:face:b00c:3333:7020","TCP","86","43262  >  443 [ACK] Seq=2565 Ack=95914 Win=173568 Len=0 TSval=3910037876 TSecr=1756427464"
"260","28.764758785","2a00:a041:3c5d:4d00:605e:f34d:a502:2044","2a00:a040:3:4:face:b00c:3333:7020","TCP","86","43262  >  443 [ACK] Seq=2565 Ack=98674 Win=179072 Len=0 TSval=3910037876 TSecr=1756427465"
"261","28.764765632","2a00:a041:3c5d:4d00:605e:f34d:a502:2044","2a00:a040:3:4:face:b00c:3333:7020","TCP","86","43262  >  443 [ACK] Seq=2565 Ack=99317 Win=181760 Len=0 TSval=3910037876 TSecr=1756427465"
"262","28.764772190","2a00:a041:3c5d:4d00:605e:f34d:a502:2044","2a00:a040:3:4:face:b00c:3333:7020","TCP","86","43262  >  443 [ACK] Seq=2565 Ack=102077 Win=187264 Len=0 TSval=3910037876 TSecr=1756427466"
"263","28.765871333","2a00:a040:3:4:face:b00c:3333:7020","2a00:a041:3c5d:4d00:605e:f34d:a502:2044","TLSv1.3","1412","Application Data"
"264","28.765871499","2a00:a040:3:4:face:b00c:3333:7020","2a00:a041:3c5d:4d00:605e:f34d:a502:2044","TCP","1466","443  >  43262 [ACK] Seq=103403 Ack=2565 Win=31488 Len=1380 TSval=1756427467 TSecr=3910037669 [TCP segment of a reassembled PDU]"
"265","28.765886137","2a00:a041:3c5d:4d00:605e:f34d:a502:2044","2a00:a040:3:4:face:b00c:3333:7020","TCP","86","43262  >  443 [ACK] Seq=2565 Ack=103403 Win=190080 Len=0 TSval=3910037877 TSecr=1756427466"
"266","28.765921437","2a00:a041:3c5d:4d00:605e:f34d:a502:2044","2a00:a040:3:4:face:b00c:3333:7020","TCP","86","43262  >  443 [ACK] Seq=2565 Ack=104783 Win=192896 Len=0 TSval=3910037877 TSecr=1756427467"
