"No.","Time","Source","Destination","Protocol","Length","Info"
"1","0.000000000","192.168.1.12","157.240.221.60","TLSv1.2","138","Application Data"
"2","0.074775440","157.240.221.60","192.168.1.12","TCP","68","443  >  57644 [ACK] Seq=1 Ack=71 Win=696 Len=0 TSval=2362276369 TSecr=3997026889"
"3","1.883749531","192.168.1.12","157.240.221.60","TLSv1.2","158","Application Data"
"4","1.958344809","157.240.221.60","192.168.1.12","TCP","68","443  >  57644 [ACK] Seq=1 Ack=161 Win=696 Len=0 TSval=2362278253 TSecr=3997028773"
"5","2.079749145","192.168.1.12","157.240.221.60","TCP","2828","57644  >  443 [PSH, ACK] Seq=161 Ack=1 Win=2768 Len=2760 TSval=3997028969 TSecr=2362278253 [TCP segment of a reassembled PDU]"
"6","2.079783184","192.168.1.12","157.240.221.60","TCP","2828","57644  >  443 [PSH, ACK] Seq=2921 Ack=1 Win=2768 Len=2760 TSval=3997028969 TSecr=2362278253 [TCP segment of a reassembled PDU]"
"7","2.082128358","192.168.1.12","157.240.221.60","TCP","2828","57644  >  443 [PSH, ACK] Seq=5681 Ack=1 Win=2768 Len=2760 TSval=3997028971 TSecr=2362278253 [TCP segment of a reassembled PDU]"
"8","2.085296692","192.168.1.12","157.240.221.60","TCP","2828","57644  >  443 [PSH, ACK] Seq=8441 Ack=1 Win=2768 Len=2760 TSval=3997028975 TSecr=2362278253 [TCP segment of a reassembled PDU]"
"9","2.086969496","192.168.1.12","157.240.221.60","TLSv1.2","768","Application Data"
"10","2.128936148","157.240.221.60","192.168.1.12","TLSv1.2","391","Application Data"
"11","2.128974606","192.168.1.12","157.240.221.60","TCP","68","57644  >  443 [ACK] Seq=11901 Ack=324 Win=2790 Len=0 TSval=3997029018 TSecr=2362278424"
"12","2.165535980","157.240.221.60","192.168.1.12","TCP","68","443  >  57644 [ACK] Seq=324 Ack=1541 Win=706 Len=0 TSval=2362278461 TSecr=3997028969"
"13","2.182420372","157.240.221.60","192.168.1.12","TCP","68","443  >  57644 [ACK] Seq=324 Ack=2921 Win=717 Len=0 TSval=2362278474 TSecr=3997028969"
"14","2.182942151","157.240.221.60","192.168.1.12","TCP","68","443  >  57644 [ACK] Seq=324 Ack=4301 Win=728 Len=0 TSval=2362278474 TSecr=3997028969"
"15","2.182942308","157.240.221.60","192.168.1.12","TCP","68","443  >  57644 [ACK] Seq=324 Ack=5681 Win=739 Len=0 TSval=2362278474 TSecr=3997028969"
"16","2.182942352","157.240.221.60","192.168.1.12","TCP","68","443  >  57644 [ACK] Seq=324 Ack=8441 Win=760 Len=0 TSval=2362278474 TSecr=3997028971"
"17","2.185830660","157.240.221.60","192.168.1.12","TCP","68","443  >  57644 [ACK] Seq=324 Ack=11201 Win=782 Len=0 TSval=2362278481 TSecr=3997028975"
"18","2.186186534","157.240.221.60","192.168.1.12","TCP","68","443  >  57644 [ACK] Seq=324 Ack=11901 Win=793 Len=0 TSval=2362278481 TSecr=3997028976"
"19","2.586724676","157.240.221.60","192.168.1.12","TCP","1448","443  >  57644 [ACK] Seq=324 Ack=11901 Win=793 Len=1380 TSval=2362278809 TSecr=3997029018 [TCP segment of a reassembled PDU]"
"20","2.586774863","192.168.1.12","157.240.221.60","TCP","68","57644  >  443 [ACK] Seq=11901 Ack=1704 Win=2812 Len=0 TSval=3997029476 TSecr=2362278809"
"21","2.595247101","157.240.221.60","192.168.1.12","TLSv1.2","1448","Application Data [TCP segment of a reassembled PDU]"
"22","2.595247275","157.240.221.60","192.168.1.12","TLSv1.2","1416","Application Data"
"23","2.595247325","157.240.221.60","192.168.1.12","TCP","2828","443  >  57644 [PSH, ACK] Seq=4432 Ack=11901 Win=793 Len=2760 TSval=2362278811 TSecr=3997029018 [TCP segment of a reassembled PDU]"
"24","2.595247369","157.240.221.60","192.168.1.12","TLSv1.2","1394","Application Data"
"25","2.595247416","157.240.221.60","192.168.1.12","TCP","2828","443  >  57644 [PSH, ACK] Seq=8518 Ack=11901 Win=793 Len=2760 TSval=2362278814 TSecr=3997029018 [TCP segment of a reassembled PDU]"
"26","2.595247464","157.240.221.60","192.168.1.12","TLSv1.2","2828","Application Data [TCP segment of a reassembled PDU]"
"27","2.595276783","192.168.1.12","157.240.221.60","TCP","68","57644  >  443 [ACK] Seq=11901 Ack=3084 Win=2833 Len=0 TSval=3997029485 TSecr=2362278809"
"28","2.595295015","192.168.1.12","157.240.221.60","TCP","68","57644  >  443 [ACK] Seq=11901 Ack=4432 Win=2855 Len=0 TSval=3997029485 TSecr=2362278810"
"29","2.595301017","192.168.1.12","157.240.221.60","TCP","68","57644  >  443 [ACK] Seq=11901 Ack=7192 Win=2898 Len=0 TSval=3997029485 TSecr=2362278811"
"30","2.595306412","192.168.1.12","157.240.221.60","TCP","68","57644  >  443 [ACK] Seq=11901 Ack=8518 Win=2919 Len=0 TSval=3997029485 TSecr=2362278813"
"31","2.595312007","192.168.1.12","157.240.221.60","TCP","68","57644  >  443 [ACK] Seq=11901 Ack=11278 Win=2962 Len=0 TSval=3997029485 TSecr=2362278814"
"32","2.595317390","192.168.1.12","157.240.221.60","TCP","68","57644  >  443 [ACK] Seq=11901 Ack=14038 Win=3006 Len=0 TSval=3997029485 TSecr=2362278816"
"33","2.595337333","157.240.221.60","192.168.1.12","TLSv1.2","2828","Application Data [TCP segment of a reassembled PDU]"
"34","2.595337378","157.240.221.60","192.168.1.12","TLSv1.2","2828","Application Data [TCP segment of a reassembled PDU]"
"35","2.595337438","157.240.221.60","192.168.1.12","TLSv1.2","2828","Application Data [TCP segment of a reassembled PDU]"
"36","2.595337486","157.240.221.60","192.168.1.12","TLSv1.2","2828","Application Data [TCP segment of a reassembled PDU]"
"37","2.595346994","192.168.1.12","157.240.221.60","TCP","68","57644  >  443 [ACK] Seq=11901 Ack=16798 Win=3049 Len=0 TSval=3997029485 TSecr=2362278818"
"38","2.595352624","192.168.1.12","157.240.221.60","TCP","68","57644  >  443 [ACK] Seq=11901 Ack=19558 Win=3092 Len=0 TSval=3997029485 TSecr=2362278820"
"39","2.595367155","192.168.1.12","157.240.221.60","TCP","68","57644  >  443 [ACK] Seq=11901 Ack=22318 Win=3135 Len=0 TSval=3997029485 TSecr=2362278822"
"40","2.595372582","192.168.1.12","157.240.221.60","TCP","68","57644  >  443 [ACK] Seq=11901 Ack=25078 Win=3178 Len=0 TSval=3997029485 TSecr=2362278824"
"41","2.595388846","157.240.221.60","192.168.1.12","TLSv1.2","2828","Application Data [TCP segment of a reassembled PDU]"
"42","2.595388891","157.240.221.60","192.168.1.12","TLSv1.2","2828","Application Data [TCP segment of a reassembled PDU]"
"43","2.595388938","157.240.221.60","192.168.1.12","TLSv1.2","902","Application Data, Application Data"
"44","2.595396590","192.168.1.12","157.240.221.60","TCP","68","57644  >  443 [ACK] Seq=11901 Ack=27838 Win=3221 Len=0 TSval=3997029485 TSecr=2362278826"
"45","2.595404308","192.168.1.12","157.240.221.60","TCP","68","57644  >  443 [ACK] Seq=11901 Ack=30598 Win=3264 Len=0 TSval=3997029485 TSecr=2362278828"
"46","2.595410425","192.168.1.12","157.240.221.60","TCP","68","57644  >  443 [ACK] Seq=11901 Ack=31432 Win=3286 Len=0 TSval=3997029485 TSecr=2362278830"
