"No.","Time","Source","Destination","Protocol","Length","Info"
"4","4.400858355","157.240.221.60","192.168.1.12","TLSv1.2","433","Application Data"
"5","4.444964934","192.168.1.12","157.240.221.60","TCP","66","45474  >  443 [ACK] Seq=1 Ack=368 Win=1015 Len=0 TSval=2064031189 TSecr=2016292866"
"6","5.030027882","192.168.1.12","157.240.221.60","TLSv1.2","165","Application Data"
"7","5.109089693","157.240.221.60","192.168.1.12","TCP","66","443  >  45474 [ACK] Seq=368 Ack=100 Win=376 Len=0 TSval=2016293633 TSecr=2064031774"
"8","6.039570073","157.240.221.60","192.168.1.12","TCP","1446","443  >  45474 [ACK] Seq=368 Ack=100 Win=376 Len=1380 TSval=2016294472 TSecr=2064031774 [TCP segment of a reassembled PDU]"
"9","6.039616142","192.168.1.12","157.240.221.60","TCP","66","45474  >  443 [ACK] Seq=100 Ack=1748 Win=1005 Len=0 TSval=2064032784 TSecr=2016294472"
"10","6.040853891","157.240.221.60","192.168.1.12","TLSv1.2","199","Application Data"
"11","6.040853969","157.240.221.60","192.168.1.12","TLSv1.2","2826","Application Data"
"12","6.040854030","157.240.221.60","192.168.1.12","TLSv1.2","73","Application Data"
"13","6.040884197","192.168.1.12","157.240.221.60","TCP","66","45474  >  443 [ACK] Seq=100 Ack=1881 Win=1004 Len=0 TSval=2064032785 TSecr=2016294472"
"14","6.040899099","192.168.1.12","157.240.221.60","TCP","66","45474  >  443 [ACK] Seq=100 Ack=4641 Win=983 Len=0 TSval=2064032785 TSecr=2016294478"
"15","6.040904546","192.168.1.12","157.240.221.60","TCP","66","45474  >  443 [ACK] Seq=100 Ack=4648 Win=983 Len=0 TSval=2064032785 TSecr=2016294481"
"16","6.128970873","192.168.1.12","20.254.144.98","TCP","54","43880  >  443 [ACK] Seq=1 Ack=1 Win=501 Len=0"
"17","6.221329838","20.254.144.98","192.168.1.12","TCP","60","[TCP ACKed unseen segment] 443  >  43880 [ACK] Seq=1 Ack=2 Win=2052 Len=0"
"18","6.318624950","192.168.1.12","157.240.221.60","TLSv1.2","159","Application Data"
"19","6.394313869","157.240.221.60","192.168.1.12","TCP","66","443  >  45474 [ACK] Seq=4648 Ack=193 Win=376 Len=0 TSval=2016294917 TSecr=2064033063"
"20","6.405550665","157.240.221.60","192.168.1.12","TLSv1.2","972","Application Data"
"21","6.405586130","192.168.1.12","157.240.221.60","TCP","66","45474  >  443 [ACK] Seq=193 Ack=5554 Win=1008 Len=0 TSval=2064033150 TSecr=2016294929"
"22","6.765721463","192.168.1.12","157.240.221.60","TLSv1.2","162","Application Data"
"23","6.806043651","157.240.221.60","192.168.1.12","TLSv1.2","207","Application Data"
"24","6.806097289","192.168.1.12","157.240.221.60","TCP","66","45474  >  443 [ACK] Seq=289 Ack=5695 Win=1014 Len=0 TSval=2064033550 TSecr=2016295328"
"25","6.810567831","192.168.1.12","157.240.221.60","TLSv1.2","166","Application Data"
"26","6.887942247","157.240.221.60","192.168.1.12","TCP","66","443  >  45474 [ACK] Seq=5695 Ack=289 Win=376 Len=0 TSval=2016295411 TSecr=2064033510"
"27","6.904342176","157.240.221.60","192.168.1.12","TCP","66","443  >  45474 [ACK] Seq=5695 Ack=389 Win=376 Len=0 TSval=2016295428 TSecr=2064033555"
"31","8.884707220","2a00:a041:3c5d:4d00:605e:f34d:a502:2044","2a00:a040:3:4:face:b00c:3333:7020","TLSv1.2","110","Application Data"
"32","8.884751082","2a00:a041:3c5d:4d00:605e:f34d:a502:2044","2a00:a040:3:4:face:b00c:3333:7020","TCP","86","44140  >  443 [FIN, ACK] Seq=25 Ack=1 Win=12296 Len=0 TSval=3910286285 TSecr=3133331536"
"33","8.906093010","2a00:a040:3:4:face:b00c:3333:7020","2a00:a041:3c5d:4d00:605e:f34d:a502:2044","TCP","98","443  >  44140 [ACK] Seq=1 Ack=1 Win=123 Len=0 TSval=3133391568 TSecr=3910226284 SLE=25 SRE=26"
"34","8.906625638","2a00:a040:3:4:face:b00c:3333:7020","2a00:a041:3c5d:4d00:605e:f34d:a502:2044","TCP","86","443  >  44140 [ACK] Seq=1 Ack=26 Win=123 Len=0 TSval=3133391568 TSecr=3910286285"
"35","8.906625820","2a00:a040:3:4:face:b00c:3333:7020","2a00:a041:3c5d:4d00:605e:f34d:a502:2044","TLSv1.2","110","Application Data"
"36","8.906671150","2a00:a041:3c5d:4d00:605e:f34d:a502:2044","2a00:a040:3:4:face:b00c:3333:7020","TCP","74","44140  >  443 [RST] Seq=26 Win=0 Len=0"
"37","8.906885452","2a00:a040:3:4:face:b00c:3333:7020","2a00:a041:3c5d:4d00:605e:f34d:a502:2044","TCP","86","443  >  44140 [FIN, ACK] Seq=25 Ack=26 Win=123 Len=0 TSval=3133391568 TSecr=3910286285"
"38","8.906902795","2a00:a041:3c5d:4d00:605e:f34d:a502:2044","2a00:a040:3:4:face:b00c:3333:7020","TCP","74","44140  >  443 [RST] Seq=26 Win=0 Len=0"
"39","10.032821113","157.240.221.60","192.168.1.12","TLSv1.2","161","Application Data"
"40","10.037839449","192.168.1.12","157.240.221.60","TLSv1.2","160","Application Data"
"41","10.114842350","157.240.221.60","192.168.1.12","TCP","66","443  >  45474 [ACK] Seq=5790 Ack=483 Win=376 Len=0 TSval=2016298638 TSecr=2064036782"
"45","16.176843569","157.240.221.60","192.168.1.12","TCP","1446","443  >  45474 [ACK] Seq=5790 Ack=483 Win=376 Len=1380 TSval=2016304612 TSecr=2064036782 [TCP segment of a reassembled PDU]"
"46","16.177359683","157.240.221.60","192.168.1.12","TLSv1.2","402","Application Data, Application Data"
"47","16.177555166","192.168.1.12","157.240.221.60","TCP","66","45474  >  443 [ACK] Seq=483 Ack=7506 Win=1002 Len=0 TSval=2064042922 TSecr=2016304612"
"48","16.484642259","157.240.221.60","192.168.1.12","TLSv1.2","207","Application Data"
"49","16.487928836","192.168.1.12","157.240.221.60","TLSv1.2","166","Application Data"
"50","16.563576810","157.240.221.60","192.168.1.12","TCP","66","443  >  45474 [ACK] Seq=7647 Ack=583 Win=376 Len=0 TSval=2016305087 TSecr=2064043232"
"51","16.920404313","192.168.1.12","157.240.221.60","TLSv1.2","162","Application Data"
"52","17.008100780","157.240.221.60","192.168.1.12","TCP","66","443  >  45474 [ACK] Seq=7647 Ack=679 Win=376 Len=0 TSval=2016305533 TSecr=2064043665"
"53","17.137075632","192.168.1.12","140.82.113.26","TCP","66","48184  >  443 [ACK] Seq=1 Ack=1 Win=501 Len=0 TSval=3822201159 TSecr=1909445898"
"54","17.161604461","192.168.1.12","157.240.221.60","TLSv1.2","135","Application Data"
"55","17.239961853","157.240.221.60","192.168.1.12","TCP","66","443  >  45474 [ACK] Seq=7647 Ack=748 Win=376 Len=0 TSval=2016305764 TSecr=2064043906"
"56","17.288443583","140.82.113.26","192.168.1.12","TCP","66","[TCP ACKed unseen segment] 443  >  48184 [ACK] Seq=1 Ack=2 Win=70 Len=0 TSval=1909491104 TSecr=3822155955"
"57","17.361039149","157.240.221.60","192.168.1.12","TLSv1.2","137","Application Data"
"58","17.405095667","192.168.1.12","157.240.221.60","TCP","66","45474  >  443 [ACK] Seq=748 Ack=7718 Win=1015 Len=0 TSval=2064044149 TSecr=2016305879"
"66","22.801093354","192.168.1.12","20.199.120.85","TCP","54","41676  >  443 [ACK] Seq=1 Ack=1 Win=501 Len=0"
"67","22.884988044","20.199.120.85","192.168.1.12","TCP","60","[TCP ACKed unseen segment] 443  >  41676 [ACK] Seq=1 Ack=2 Win=7969 Len=0"
"71","31.030313470","157.240.221.60","192.168.1.12","TCP","1446","443  >  45474 [ACK] Seq=7718 Ack=748 Win=376 Len=1380 TSval=2016319452 TSecr=2064044149 [TCP segment of a reassembled PDU]"
"72","31.030356920","192.168.1.12","157.240.221.60","TCP","66","45474  >  443 [ACK] Seq=748 Ack=9098 Win=1005 Len=0 TSval=2064057775 TSecr=2016319452"
"73","31.030769367","157.240.221.60","192.168.1.12","TLSv1.2","402","Application Data, Application Data"
"74","31.030789436","192.168.1.12","157.240.221.60","TCP","66","45474  >  443 [ACK] Seq=748 Ack=9434 Win=1003 Len=0 TSval=2064057775 TSecr=2016319452"
"75","31.281842232","192.168.1.12","157.240.221.60","TLSv1.2","162","Application Data"
"76","31.283803794","157.240.221.60","192.168.1.12","TLSv1.2","207","Application Data"
"77","31.283827785","192.168.1.12","157.240.221.60","TCP","66","45474  >  443 [ACK] Seq=844 Ack=9575 Win=1014 Len=0 TSval=2064058028 TSecr=2016319799"
"78","31.360544612","157.240.221.60","192.168.1.12","TCP","66","443  >  45474 [ACK] Seq=9575 Ack=844 Win=376 Len=0 TSval=2016319885 TSecr=2064057775"
"79","31.425390523","192.168.1.12","157.240.221.60","TLSv1.2","166","Application Data"
"80","31.511566416","157.240.221.60","192.168.1.12","TCP","66","443  >  45474 [ACK] Seq=9575 Ack=944 Win=376 Len=0 TSval=2016320036 TSecr=2064058170"
"81","31.946125218","140.82.113.26","192.168.1.12","TLSv1.2","92","[TCP ACKed unseen segment] , Application Data"
"82","31.946333349","192.168.1.12","140.82.113.26","TLSv1.2","96","[TCP Previous segment not captured] , Application Data"
"83","32.150946328","140.82.113.26","192.168.1.12","TCP","66","[TCP ACKed unseen segment] 443  >  48184 [ACK] Seq=27 Ack=32 Win=70 Len=0 TSval=1909505916 TSecr=3822215969"
"85","37.168820308","157.240.221.60","192.168.1.12","TLSv1.2","975","Application Data"
"86","37.168860743","192.168.1.12","157.240.221.60","TCP","66","45474  >  443 [ACK] Seq=944 Ack=10484 Win=1008 Len=0 TSval=2064063913 TSecr=2016325618"
"87","38.092205301","192.168.1.12","157.240.221.60","TLSv1.2","155","Application Data"
"88","38.169330346","157.240.221.60","192.168.1.12","TCP","66","443  >  45474 [ACK] Seq=10484 Ack=1033 Win=376 Len=0 TSval=2016326693 TSecr=2064064836"
"89","40.812231305","192.168.1.12","157.240.221.60","TLSv1.2","135","Application Data"
"90","40.899487633","157.240.221.60","192.168.1.12","TCP","66","443  >  45474 [ACK] Seq=10484 Ack=1102 Win=376 Len=0 TSval=2016329423 TSecr=2064067557"
"91","41.059962415","157.240.221.60","192.168.1.12","TLSv1.2","137","Application Data"
"92","41.059998281","192.168.1.12","157.240.221.60","TCP","66","45474  >  443 [ACK] Seq=1102 Ack=10555 Win=1015 Len=0 TSval=2064067804 TSecr=2016329537"
"93","41.473696715","192.168.1.12","157.240.221.60","TCP","1446","45474  >  443 [ACK] Seq=1102 Ack=10555 Win=1015 Len=1380 TSval=2064068218 TSecr=2016329537 [TCP segment of a reassembled PDU]"
"94","41.473723189","192.168.1.12","157.240.221.60","TCP","1446","45474  >  443 [ACK] Seq=2482 Ack=10555 Win=1015 Len=1380 TSval=2064068218 TSecr=2016329537 [TCP segment of a reassembled PDU]"
"95","41.477673839","192.168.1.12","157.240.221.60","TCP","1446","45474  >  443 [ACK] Seq=3862 Ack=10555 Win=1015 Len=1380 TSval=2064068222 TSecr=2016329537 [TCP segment of a reassembled PDU]"
"96","41.555228931","157.240.221.60","192.168.1.12","TCP","66","443  >  45474 [ACK] Seq=10555 Ack=2482 Win=387 Len=0 TSval=2016330078 TSecr=2064068218"
"97","41.555271352","192.168.1.12","157.240.221.60","TCP","1446","45474  >  443 [ACK] Seq=5242 Ack=10555 Win=1015 Len=1380 TSval=2064068300 TSecr=2016330078 [TCP segment of a reassembled PDU]"
"98","41.562908049","157.240.221.60","192.168.1.12","TCP","66","443  >  45474 [ACK] Seq=10555 Ack=3862 Win=397 Len=0 TSval=2016330086 TSecr=2064068218"
"99","41.562951205","192.168.1.12","157.240.221.60","TCP","1446","45474  >  443 [ACK] Seq=6622 Ack=10555 Win=1015 Len=1380 TSval=2064068307 TSecr=2016330086 [TCP segment of a reassembled PDU]"
"100","41.564932522","157.240.221.60","192.168.1.12","TCP","66","443  >  45474 [ACK] Seq=10555 Ack=5242 Win=408 Len=0 TSval=2016330086 TSecr=2064068222"
"101","41.564940324","192.168.1.12","157.240.221.60","TCP","1446","45474  >  443 [ACK] Seq=8002 Ack=10555 Win=1015 Len=1380 TSval=2064068309 TSecr=2016330086 [TCP segment of a reassembled PDU]"
"102","41.637850042","157.240.221.60","192.168.1.12","TCP","66","443  >  45474 [ACK] Seq=10555 Ack=6622 Win=419 Len=0 TSval=2016330161 TSecr=2064068300"
"103","41.637893104","192.168.1.12","157.240.221.60","TCP","1446","45474  >  443 [ACK] Seq=9382 Ack=10555 Win=1015 Len=1380 TSval=2064068382 TSecr=2016330161 [TCP segment of a reassembled PDU]"
"104","41.705554914","157.240.221.60","192.168.1.12","TCP","66","443  >  45474 [ACK] Seq=10555 Ack=8002 Win=430 Len=0 TSval=2016330229 TSecr=2064068307"
"105","41.705600762","192.168.1.12","157.240.221.60","TCP","1446","45474  >  443 [ACK] Seq=10762 Ack=10555 Win=1015 Len=1380 TSval=2064068450 TSecr=2016330229 [TCP segment of a reassembled PDU]"
"106","41.713181758","157.240.221.60","192.168.1.12","TCP","66","443  >  45474 [ACK] Seq=10555 Ack=9382 Win=441 Len=0 TSval=2016330237 TSecr=2064068309"
"107","41.713212622","192.168.1.12","157.240.221.60","TLSv1.2","1112","Application Data"
"108","41.719808252","157.240.221.60","192.168.1.12","TCP","66","443  >  45474 [ACK] Seq=10555 Ack=10762 Win=451 Len=0 TSval=2016330243 TSecr=2064068382"
"109","41.784606748","157.240.221.60","192.168.1.12","TCP","66","443  >  45474 [ACK] Seq=10555 Ack=12142 Win=462 Len=0 TSval=2016330307 TSecr=2064068450"
"110","41.792513356","157.240.221.60","192.168.1.12","TCP","66","443  >  45474 [ACK] Seq=10555 Ack=13188 Win=473 Len=0 TSval=2016330315 TSecr=2064068457"
"111","41.981161650","157.240.221.60","192.168.1.12","TLSv1.2","129","Application Data"
"112","41.981199869","192.168.1.12","157.240.221.60","TCP","66","45474  >  443 [ACK] Seq=13188 Ack=10618 Win=1015 Len=0 TSval=2064068725 TSecr=2016330471"
"114","43.518558352","157.240.221.60","192.168.1.12","TLSv1.2","371","Application Data"
"115","43.518612128","192.168.1.12","157.240.221.60","TCP","66","45474  >  443 [ACK] Seq=13188 Ack=10923 Win=1013 Len=0 TSval=2064070263 TSecr=2016332034"
"116","44.242451960","192.168.1.12","157.240.221.60","TLSv1.2","155","Application Data"
"117","44.321050951","157.240.221.60","192.168.1.12","TCP","66","443  >  45474 [ACK] Seq=10923 Ack=13277 Win=473 Len=0 TSval=2016332845 TSecr=2064070987"
"118","44.953144967","157.240.221.60","192.168.1.12","TCP","1446","443  >  45474 [ACK] Seq=10923 Ack=13277 Win=473 Len=1380 TSval=2016333414 TSecr=2064070987 [TCP segment of a reassembled PDU]"
"119","44.953200170","192.168.1.12","157.240.221.60","TCP","66","45474  >  443 [ACK] Seq=13277 Ack=12303 Win=1005 Len=0 TSval=2064071697 TSecr=2016333414"
"120","44.956065994","157.240.221.60","192.168.1.12","TLSv1.2","199","Application Data"
"121","44.956066233","157.240.221.60","192.168.1.12","TLSv1.2","2661","Application Data"
"122","44.956066280","157.240.221.60","192.168.1.12","TLSv1.2","1568","Application Data"
"123","44.956116661","192.168.1.12","157.240.221.60","TCP","66","45474  >  443 [ACK] Seq=13277 Ack=12436 Win=1004 Len=0 TSval=2064071700 TSecr=2016333414"
"124","44.956148188","192.168.1.12","157.240.221.60","TCP","66","45474  >  443 [ACK] Seq=13277 Ack=15031 Win=984 Len=0 TSval=2064071700 TSecr=2016333420"
"125","44.956154493","192.168.1.12","157.240.221.60","TCP","66","45474  >  443 [ACK] Seq=13277 Ack=16533 Win=973 Len=0 TSval=2064071700 TSecr=2016333431"
"126","45.156604769","192.168.1.12","157.240.221.60","TLSv1.2","162","Application Data"
"127","45.248312351","157.240.221.60","192.168.1.12","TCP","66","443  >  45474 [ACK] Seq=16533 Ack=13373 Win=473 Len=0 TSval=2016333773 TSecr=2064071901"
"128","45.272261911","157.240.221.60","192.168.1.12","TLSv1.2","207","Application Data"
"129","45.272297154","192.168.1.12","157.240.221.60","TCP","66","45474  >  443 [ACK] Seq=13373 Ack=16674 Win=1014 Len=0 TSval=2064072017 TSecr=2016333798"
"130","45.276128391","192.168.1.12","157.240.221.60","TLSv1.2","166","Application Data"
"131","45.462818384","157.240.221.60","192.168.1.12","TCP","66","443  >  45474 [ACK] Seq=16674 Ack=13473 Win=473 Len=0 TSval=2016333918 TSecr=2064072020"
"132","51.224980558","192.168.1.12","20.254.144.98","TCP","54","[TCP Dup ACK 16#1] 43880  >  443 [ACK] Seq=1 Ack=1 Win=501 Len=0"
"133","51.316345690","20.254.144.98","192.168.1.12","TCP","60","[TCP Dup ACK 17#1] [TCP ACKed unseen segment] 443  >  43880 [ACK] Seq=1 Ack=2 Win=2052 Len=0"
"135","53.245507144","20.199.120.85","192.168.1.12","TCP","60","[TCP ACKed unseen segment] 443  >  41676 [FIN, ACK] Seq=1 Ack=2 Win=7969 Len=0"
"136","53.246330739","192.168.1.12","20.199.120.85","TCP","54","[TCP Previous segment not captured] 41676  >  443 [FIN, ACK] Seq=2 Ack=2 Win=501 Len=0"
"137","53.326831112","20.199.120.85","192.168.1.12","TCP","60","[TCP ACKed unseen segment] 443  >  41676 [ACK] Seq=2 Ack=3 Win=7969 Len=0"
"146","54.292208204","192.168.1.12","20.199.120.151","TCP","74","36606  >  443 [SYN] Seq=0 Win=64240 Len=0 MSS=1460 SACK_PERM=1 TSval=3898457417 TSecr=0 WS=128"
"147","54.410142569","20.199.120.151","192.168.1.12","TCP","66","443  >  36606 [SYN, ACK] Seq=0 Ack=1 Win=8192 Len=0 MSS=1440 WS=1 SACK_PERM=1"
"148","54.410206143","192.168.1.12","20.199.120.151","TCP","54","36606  >  443 [ACK] Seq=1 Ack=1 Win=64256 Len=0"
"149","54.410635747","192.168.1.12","20.199.120.151","TLSv1.2","571","Client Hello"
"150","54.493173209","20.199.120.151","192.168.1.12","TCP","1514","443  >  36606 [PSH, ACK] Seq=1 Ack=518 Win=7675 Len=1460 [TCP segment of a reassembled PDU]"
"151","54.493223152","192.168.1.12","20.199.120.151","TCP","54","36606  >  443 [ACK] Seq=518 Ack=1461 Win=63104 Len=0"
"152","54.494654886","20.199.120.151","192.168.1.12","TCP","1514","443  >  36606 [PSH, ACK] Seq=1461 Ack=518 Win=7675 Len=1460 [TCP segment of a reassembled PDU]"
"153","54.494673021","192.168.1.12","20.199.120.151","TCP","54","36606  >  443 [ACK] Seq=518 Ack=2921 Win=63104 Len=0"
"154","54.495943537","20.199.120.151","192.168.1.12","TCP","1514","443  >  36606 [PSH, ACK] Seq=2921 Ack=518 Win=7675 Len=1460 [TCP segment of a reassembled PDU]"
"155","54.495961430","192.168.1.12","20.199.120.151","TCP","54","36606  >  443 [ACK] Seq=518 Ack=4381 Win=63104 Len=0"
"156","54.497198140","20.199.120.151","192.168.1.12","TCP","1514","443  >  36606 [PSH, ACK] Seq=4381 Ack=518 Win=7675 Len=1460 [TCP segment of a reassembled PDU]"
"157","54.497216569","192.168.1.12","20.199.120.151","TCP","54","36606  >  443 [ACK] Seq=518 Ack=5841 Win=63104 Len=0"
"159","54.674920550","20.199.120.151","192.168.1.12","TLSv1.2","141","Server Hello, Certificate, Certificate Status, Server Key Exchange, Server Hello Done"
"160","54.674955243","192.168.1.12","20.199.120.151","TCP","54","36606  >  443 [ACK] Seq=518 Ack=5928 Win=64128 Len=0"
"161","54.678261428","192.168.1.12","20.199.120.151","TLSv1.2","212","Client Key Exchange, Change Cipher Spec, Encrypted Handshake Message"
"162","54.770712713","20.199.120.151","192.168.1.12","TCP","60","443  >  36606 [ACK] Seq=5928 Ack=676 Win=7517 Len=0"
"163","54.771251800","20.199.120.151","192.168.1.12","TLSv1.2","105","Change Cipher Spec, Encrypted Handshake Message"
"164","54.772526762","192.168.1.12","20.199.120.151","TLSv1.2","328","Application Data"
"165","54.853868021","20.199.120.151","192.168.1.12","TLSv1.2","335","Application Data"
"166","54.854755533","192.168.1.12","20.199.120.151","TLSv1.2","208","Application Data"
"167","54.945628828","20.199.120.151","192.168.1.12","TLSv1.2","157","Application Data"
"168","54.946400667","192.168.1.12","20.199.120.151","TLSv1.2","538","Application Data"
"169","55.088389525","20.199.120.151","192.168.1.12","TCP","60","443  >  36606 [ACK] Seq=6363 Ack=1588 Win=8192 Len=0"
"170","55.514327185","20.199.120.151","192.168.1.12","TLSv1.2","407","Application Data"
"171","55.515209300","192.168.1.12","20.199.120.151","TLSv1.2","277","Application Data"
"172","55.624820917","20.199.120.151","192.168.1.12","TLSv1.2","157","Application Data"
"173","55.665027480","192.168.1.12","20.199.120.151","TCP","54","36606  >  443 [ACK] Seq=1811 Ack=6819 Win=64128 Len=0"
"174","57.570643602","192.168.1.12","157.240.221.60","TLSv1.2","135","Application Data"
"175","57.692662903","157.240.221.60","192.168.1.12","TCP","66","443  >  45474 [ACK] Seq=16674 Ack=13542 Win=473 Len=0 TSval=2016346217 TSecr=2064084315"
"176","57.853554214","157.240.221.60","192.168.1.12","TLSv1.2","137","Application Data"
"177","57.896967654","192.168.1.12","157.240.221.60","TCP","66","45474  >  443 [ACK] Seq=13542 Ack=16745 Win=1015 Len=0 TSval=2064084641 TSecr=2016346330"
"183","73.138379729","192.168.1.12","157.240.221.60","TLSv1.2","135","Application Data"
"184","73.221508067","157.240.221.60","192.168.1.12","TCP","66","443  >  45474 [ACK] Seq=16745 Ack=13611 Win=473 Len=0 TSval=2016361747 TSecr=2064099883"
"185","73.426872513","157.240.221.60","192.168.1.12","TLSv1.2","137","Application Data"
"186","73.426910376","192.168.1.12","157.240.221.60","TCP","66","45474  >  443 [ACK] Seq=13611 Ack=16816 Win=1015 Len=0 TSval=2064100171 TSecr=2016361861"
"187","77.296952731","192.168.1.12","140.82.113.26","TCP","66","[TCP Keep-Alive] 48184  >  443 [ACK] Seq=31 Ack=27 Win=501 Len=0 TSval=3822261319 TSecr=1909505916"
"188","77.514681735","140.82.113.26","192.168.1.12","TCP","66","[TCP Keep-Alive ACK] 443  >  48184 [ACK] Seq=27 Ack=32 Win=70 Len=0 TSval=1909551273 TSecr=3822215969"
"189","77.719491921","157.240.221.60","192.168.1.12","TLSv1.2","718","Application Data"
"190","77.719534292","192.168.1.12","157.240.221.60","TCP","66","45474  >  443 [ACK] Seq=13611 Ack=17468 Win=1010 Len=0 TSval=2064104464 TSecr=2016366124"
"191","79.533936305","192.168.1.12","157.240.221.60","TLSv1.2","159","Application Data"
"192","79.623907138","157.240.221.60","192.168.1.12","TCP","66","443  >  45474 [ACK] Seq=17468 Ack=13704 Win=473 Len=0 TSval=2016368136 TSecr=2064106278"
"199","85.092846197","157.240.221.60","192.168.1.12","TLSv1.2","159","Application Data"
"200","85.092897628","192.168.1.12","157.240.221.60","TCP","66","45474  >  443 [ACK] Seq=13704 Ack=17561 Win=1015 Len=0 TSval=2064111837 TSecr=2016373595"
"201","85.098617924","192.168.1.12","157.240.221.60","TLSv1.2","158","Application Data"
"202","85.172804813","157.240.221.60","192.168.1.12","TCP","66","443  >  45474 [ACK] Seq=17561 Ack=13796 Win=473 Len=0 TSval=2016373699 TSecr=2064111843"
"204","87.449955104","20.254.144.98","192.168.1.12","TCP","60","[TCP ACKed unseen segment] 443  >  43880 [RST, ACK] Seq=1 Ack=2 Win=0 Len=0"
"207","91.953048362","140.82.113.26","192.168.1.12","TLSv1.2","92","Application Data"
"208","91.953316200","192.168.1.12","140.82.113.26","TLSv1.2","96","Application Data"
"209","92.157471626","140.82.113.26","192.168.1.12","TCP","66","443  >  48184 [ACK] Seq=53 Ack=62 Win=70 Len=0 TSval=1909565917 TSecr=3822275976"
"217","100.624946654","192.168.1.12","20.199.120.151","TCP","54","[TCP Keep-Alive] 36606  >  443 [ACK] Seq=1810 Ack=6819 Win=64128 Len=0"
"218","100.708608522","20.199.120.151","192.168.1.12","TCP","60","[TCP Keep-Alive ACK] 443  >  36606 [ACK] Seq=6819 Ack=1811 Win=7969 Len=0"
"219","100.767361789","192.168.1.12","157.240.221.60","TLSv1.2","135","Application Data"
"220","100.845134410","157.240.221.60","192.168.1.12","TCP","66","443  >  45474 [ACK] Seq=17561 Ack=13865 Win=473 Len=0 TSval=2016389369 TSecr=2064127512"
"221","101.069006775","157.240.221.60","192.168.1.12","TLSv1.2","137","Application Data"
"222","101.116897959","192.168.1.12","157.240.221.60","TCP","66","45474  >  443 [ACK] Seq=13865 Ack=17632 Win=1015 Len=0 TSval=2064127861 TSecr=2016389483"
"235","120.932438071","157.240.221.60","192.168.1.12","TLSv1.2","154","Application Data"
"236","120.932482097","192.168.1.12","157.240.221.60","TCP","66","45474  >  443 [ACK] Seq=13865 Ack=17720 Win=1015 Len=0 TSval=2064147677 TSecr=2016409396"
"237","121.141972818","192.168.1.12","157.240.221.60","TLSv1.2","135","Application Data"
"238","121.218851951","157.240.221.60","192.168.1.12","TCP","66","443  >  45474 [ACK] Seq=17720 Ack=13934 Win=473 Len=0 TSval=2016409743 TSecr=2064147886"
"239","121.341746610","157.240.221.60","192.168.1.12","TLSv1.2","137","Application Data"
"240","121.341791725","192.168.1.12","157.240.221.60","TCP","66","45474  >  443 [ACK] Seq=13934 Ack=17791 Win=1015 Len=0 TSval=2064148086 TSecr=2016409857"
"241","121.933293717","192.168.1.12","157.240.221.60","TLSv1.2","138","Application Data"
"242","122.019920668","157.240.221.60","192.168.1.12","TCP","66","443  >  45474 [ACK] Seq=17791 Ack=14006 Win=473 Len=0 TSval=2016410544 TSecr=2064148678"
"244","124.414069569","157.240.221.60","192.168.1.12","TLSv1.2","160","Application Data"
"245","124.414110905","192.168.1.12","157.240.221.60","TCP","66","45474  >  443 [ACK] Seq=14006 Ack=17885 Win=1015 Len=0 TSval=2064151158 TSecr=2016412922"
"246","125.851551573","192.168.1.12","157.240.221.60","TLSv1.2","139","Application Data"
"247","125.855503840","157.240.221.60","192.168.1.12","TCP","1446","443  >  45474 [ACK] Seq=17885 Ack=14006 Win=473 Len=1380 TSval=2016414378 TSecr=2064151158 [TCP segment of a reassembled PDU]"
"248","125.855538812","192.168.1.12","157.240.221.60","TCP","66","45474  >  443 [ACK] Seq=14079 Ack=19265 Win=1005 Len=0 TSval=2064152600 TSecr=2016414378"
"249","125.856202916","157.240.221.60","192.168.1.12","TLSv1.2","400","Application Data, Application Data"
"250","125.856208426","192.168.1.12","157.240.221.60","TCP","66","45474  >  443 [ACK] Seq=14079 Ack=19599 Win=1003 Len=0 TSval=2064152600 TSecr=2016414378"
"251","125.932301251","157.240.221.60","192.168.1.12","TCP","66","443  >  45474 [ACK] Seq=19599 Ack=14079 Win=473 Len=0 TSval=2016414455 TSecr=2064151158"
"252","126.253478362","192.168.1.12","157.240.221.60","TLSv1.2","159","Application Data"
"253","126.331879723","157.240.221.60","192.168.1.12","TCP","66","443  >  45474 [ACK] Seq=19599 Ack=14172 Win=473 Len=0 TSval=2016414856 TSecr=2064152998"
"257","129.547827365","157.240.221.60","192.168.1.12","TLSv1.2","159","Application Data"
"258","129.547869879","192.168.1.12","157.240.221.60","TCP","66","45474  >  443 [ACK] Seq=14172 Ack=19692 Win=1015 Len=0 TSval=2064156292 TSecr=2016417972"
"259","129.552344547","192.168.1.12","157.240.221.60","TLSv1.2","158","Application Data"
"260","129.629059439","157.240.221.60","192.168.1.12","TCP","66","443  >  45474 [ACK] Seq=19692 Ack=14264 Win=473 Len=0 TSval=2016418153 TSecr=2064156297"
"261","130.865261393","20.199.120.151","192.168.1.12","TCP","60","443  >  36606 [FIN, ACK] Seq=6819 Ack=1811 Win=7969 Len=0"
"262","130.866002271","192.168.1.12","20.199.120.151","TCP","54","36606  >  443 [FIN, ACK] Seq=1811 Ack=6820 Win=64128 Len=0"
"263","130.945407751","20.199.120.151","192.168.1.12","TCP","60","443  >  36606 [ACK] Seq=6820 Ack=1812 Win=7969 Len=0"
"264","131.872329207","192.168.1.12","20.199.120.151","TCP","74","54962  >  443 [SYN] Seq=0 Win=64240 Len=0 MSS=1460 SACK_PERM=1 TSval=3898534998 TSecr=0 WS=128"
"265","131.964703339","157.240.221.60","192.168.1.12","TLSv1.2","214","Application Data"
"266","131.964704019","20.199.120.151","192.168.1.12","TCP","66","443  >  54962 [SYN, ACK] Seq=0 Ack=1 Win=8192 Len=0 MSS=1440 WS=1 SACK_PERM=1"
"267","131.964758238","192.168.1.12","20.199.120.151","TCP","54","54962  >  443 [ACK] Seq=1 Ack=1 Win=64256 Len=0"
"268","131.965364167","192.168.1.12","20.199.120.151","TLSv1.2","571","Client Hello"
"269","131.968517797","192.168.1.12","157.240.221.60","TLSv1.2","146","Application Data"
"270","132.046328142","157.240.221.60","192.168.1.12","TCP","66","443  >  45474 [ACK] Seq=19840 Ack=14344 Win=473 Len=0 TSval=2016420570 TSecr=2064158713"
"271","132.052431556","20.199.120.151","192.168.1.12","TCP","1514","443  >  54962 [PSH, ACK] Seq=1 Ack=518 Win=7675 Len=1460 [TCP segment of a reassembled PDU]"
"272","132.052473218","192.168.1.12","20.199.120.151","TCP","54","54962  >  443 [ACK] Seq=518 Ack=1461 Win=63104 Len=0"
"273","132.053288048","20.199.120.151","192.168.1.12","TCP","1514","443  >  54962 [PSH, ACK] Seq=1461 Ack=518 Win=7675 Len=1460 [TCP segment of a reassembled PDU]"
"274","132.053298139","192.168.1.12","20.199.120.151","TCP","54","54962  >  443 [ACK] Seq=518 Ack=2921 Win=63104 Len=0"
"275","132.057776535","20.199.120.151","192.168.1.12","TCP","1514","443  >  54962 [PSH, ACK] Seq=2921 Ack=518 Win=7675 Len=1460 [TCP segment of a reassembled PDU]"
"276","132.057788370","192.168.1.12","20.199.120.151","TCP","54","54962  >  443 [ACK] Seq=518 Ack=4381 Win=63104 Len=0"
"277","132.058578969","20.199.120.151","192.168.1.12","TCP","1514","443  >  54962 [PSH, ACK] Seq=4381 Ack=518 Win=7675 Len=1460 [TCP segment of a reassembled PDU]"
"278","132.058588237","192.168.1.12","20.199.120.151","TCP","54","54962  >  443 [ACK] Seq=518 Ack=5841 Win=63104 Len=0"
"279","132.133215666","20.199.120.151","192.168.1.12","TLSv1.2","141","Server Hello, Certificate, Certificate Status, Server Key Exchange, Server Hello Done"
"280","132.133250899","192.168.1.12","20.199.120.151","TCP","54","54962  >  443 [ACK] Seq=518 Ack=5928 Win=64128 Len=0"
"281","132.136522854","192.168.1.12","20.199.120.151","TLSv1.2","212","Client Key Exchange, Change Cipher Spec, Encrypted Handshake Message"
"282","132.231272830","20.199.120.151","192.168.1.12","TLSv1.2","105","Change Cipher Spec, Encrypted Handshake Message"
"283","132.232933010","192.168.1.12","20.199.120.151","TLSv1.2","329","Application Data"
"284","132.316718330","20.199.120.151","192.168.1.12","TLSv1.2","337","Application Data"
"285","132.317709153","192.168.1.12","20.199.120.151","TLSv1.2","208","Application Data"
"286","132.401023004","20.199.120.151","192.168.1.12","TLSv1.2","157","Application Data"
"287","132.402272328","192.168.1.12","20.199.120.151","TLSv1.2","538","Application Data"
"289","132.605629986","20.199.120.151","192.168.1.12","TCP","60","443  >  54962 [ACK] Seq=6365 Ack=1589 Win=8192 Len=0"
"290","132.913194428","20.199.120.151","192.168.1.12","TLSv1.2","407","Application Data"
"291","132.913927904","192.168.1.12","20.199.120.151","TLSv1.2","277","Application Data"
"292","132.991917217","20.199.120.151","192.168.1.12","TLSv1.2","157","Application Data"
"293","133.033028890","192.168.1.12","20.199.120.151","TCP","54","54962  >  443 [ACK] Seq=1812 Ack=6821 Win=64128 Len=0"
"294","137.200987273","192.168.1.12","140.82.113.26","TCP","66","[TCP Keep-Alive] 48184  >  443 [ACK] Seq=61 Ack=53 Win=501 Len=0 TSval=3822321223 TSecr=1909565917"
"295","137.418718807","140.82.113.26","192.168.1.12","TCP","66","[TCP Keep-Alive ACK] 443  >  48184 [ACK] Seq=53 Ack=62 Win=70 Len=0 TSval=1909611165 TSecr=3822275976"
"296","138.385552075","192.168.1.12","157.240.221.60","TLSv1.2","135","Application Data"
"297","138.462105838","157.240.221.60","192.168.1.12","TCP","66","443  >  45474 [ACK] Seq=19840 Ack=14413 Win=473 Len=0 TSval=2016426987 TSecr=2064165130"
"298","138.647569239","157.240.221.60","192.168.1.12","TLSv1.2","137","Application Data"
"299","138.689100444","192.168.1.12","157.240.221.60","TCP","66","45474  >  443 [ACK] Seq=14413 Ack=19911 Win=1015 Len=0 TSval=2064165433 TSecr=2016427100"
"300","139.262216216","157.240.221.60","192.168.1.12","TLSv1.2","346","Application Data"
"301","139.262263095","192.168.1.12","157.240.221.60","TCP","66","45474  >  443 [ACK] Seq=14413 Ack=20191 Win=1013 Len=0 TSval=2064166007 TSecr=2016427680"
"302","139.672253812","157.240.221.60","192.168.1.12","TLSv1.2","145","Application Data"
"303","139.672302465","192.168.1.12","157.240.221.60","TCP","66","45474  >  443 [ACK] Seq=14413 Ack=20270 Win=1013 Len=0 TSval=2064166417 TSecr=2016428105"
"304","139.676300254","192.168.1.12","157.240.221.60","TLSv1.2","143","Application Data"
"305","139.752465135","157.240.221.60","192.168.1.12","TCP","66","443  >  45474 [ACK] Seq=20270 Ack=14490 Win=473 Len=0 TSval=2016428277 TSecr=2064166421"
"306","139.752532565","157.240.221.60","192.168.1.12","TCP","66","[TCP Dup ACK 305#1] 443  >  45474 [ACK] Seq=20270 Ack=14490 Win=473 Len=0 TSval=2016428277 TSecr=2064166421"
"307","140.738773030","192.168.1.12","157.240.221.60","TLSv1.2","155","Application Data"
"308","140.813134626","157.240.221.60","192.168.1.12","TCP","66","443  >  45474 [ACK] Seq=20270 Ack=14579 Win=473 Len=0 TSval=2016429339 TSecr=2064167483"
"315","144.075213805","157.240.221.60","192.168.1.12","TLSv1.2","184","Application Data"
"316","144.081464365","192.168.1.12","157.240.221.60","TLSv1.2","160","Application Data"
"317","144.165267176","157.240.221.60","192.168.1.12","TCP","66","443  >  45474 [ACK] Seq=20388 Ack=14673 Win=473 Len=0 TSval=2016432681 TSecr=2064170826"
"318","145.713345015","157.240.221.60","192.168.1.12","TLSv1.2","233","Application Data"
"319","145.717118430","192.168.1.12","157.240.221.60","TLSv1.2","161","Application Data"
"320","145.792651385","157.240.221.60","192.168.1.12","TCP","66","443  >  45474 [ACK] Seq=20555 Ack=14768 Win=473 Len=0 TSval=2016434319 TSecr=2064172461"
"323","148.478563131","157.240.221.60","192.168.1.12","TLSv1.2","752","Application Data"
"324","148.521021080","192.168.1.12","157.240.221.60","TCP","66","45474  >  443 [ACK] Seq=14768 Ack=21241 Win=1015 Len=0 TSval=2064175265 TSecr=2016436916"
"325","149.563434654","192.168.1.12","157.240.221.60","TLSv1.2","162","Application Data"
"326","149.638150855","157.240.221.60","192.168.1.12","TCP","66","443  >  45474 [ACK] Seq=21241 Ack=14864 Win=473 Len=0 TSval=2016438163 TSecr=2064176308"
"329","151.653072635","157.240.221.60","192.168.1.12","TLSv1.2","420","Application Data"
"330","151.653119211","192.168.1.12","157.240.221.60","TCP","66","45474  >  443 [ACK] Seq=14864 Ack=21595 Win=1013 Len=0 TSval=2064178397 TSecr=2016440102"
"331","151.959997148","140.82.113.26","192.168.1.12","TLSv1.2","92","Application Data"
"332","151.960273571","192.168.1.12","140.82.113.26","TLSv1.2","96","Application Data"
"333","152.164573653","140.82.113.26","192.168.1.12","TCP","66","443  >  48184 [ACK] Seq=79 Ack=92 Win=70 Len=0 TSval=1909625922 TSecr=3822335983"
"335","153.233964117","192.168.1.12","157.240.221.60","TLSv1.2","141","Application Data"
"336","153.307042058","157.240.221.60","192.168.1.12","TCP","66","443  >  45474 [ACK] Seq=21595 Ack=14939 Win=473 Len=0 TSval=2016441832 TSecr=2064179978"
"337","156.773373909","157.240.221.60","192.168.1.12","TLSv1.2","207","Application Data"
"338","156.773421079","192.168.1.12","157.240.221.60","TCP","66","45474  >  443 [ACK] Seq=14939 Ack=21736 Win=1014 Len=0 TSval=2064183518 TSecr=2016445222"
"339","156.776695015","192.168.1.12","157.240.221.60","TLSv1.2","166","Application Data"
"340","156.854212070","157.240.221.60","192.168.1.12","TCP","66","443  >  45474 [ACK] Seq=21736 Ack=15039 Win=473 Len=0 TSval=2016445379 TSecr=2064183521"
"349","164.086048581","192.168.1.12","157.240.221.60","TLSv1.2","135","Application Data"
"350","164.163874366","157.240.221.60","192.168.1.12","TCP","66","443  >  45474 [ACK] Seq=21736 Ack=15108 Win=473 Len=0 TSval=2016452690 TSecr=2064190830"
"351","164.350128204","157.240.221.60","192.168.1.12","TLSv1.2","137","Application Data"
"352","164.392983365","192.168.1.12","157.240.221.60","TCP","66","45474  >  443 [ACK] Seq=15108 Ack=21807 Win=1015 Len=0 TSval=2064191137 TSecr=2016452804"
"356","178.161064264","192.168.1.12","20.199.120.151","TCP","54","[TCP Keep-Alive] 54962  >  443 [ACK] Seq=1811 Ack=6821 Win=64128 Len=0"
"357","178.242354382","20.199.120.151","192.168.1.12","TCP","60","[TCP Keep-Alive ACK] 443  >  54962 [ACK] Seq=6821 Ack=1812 Win=7969 Len=0"
"358","180.023387627","192.168.1.12","157.240.221.60","TLSv1.2","135","Application Data"
"359","180.099213573","157.240.221.60","192.168.1.12","TCP","66","443  >  45474 [ACK] Seq=21807 Ack=15177 Win=473 Len=0 TSval=2016468623 TSecr=2064206768"
"360","180.223005866","157.240.221.60","192.168.1.12","TLSv1.2","137","Application Data"
"361","180.223044011","192.168.1.12","157.240.221.60","TCP","66","45474  >  443 [ACK] Seq=15177 Ack=21878 Win=1015 Len=0 TSval=2064206967 TSecr=2016468737"
"366","188.211034696","157.240.221.60","192.168.1.12","TCP","1446","443  >  45474 [ACK] Seq=21878 Ack=15177 Win=473 Len=1380 TSval=2016476657 TSecr=2064206967 [TCP segment of a reassembled PDU]"
"367","188.211082641","192.168.1.12","157.240.221.60","TCP","66","45474  >  443 [ACK] Seq=15177 Ack=23258 Win=1005 Len=0 TSval=2064214955 TSecr=2016476657"
"368","188.211252230","157.240.221.60","192.168.1.12","TLSv1.2","384","Application Data, Application Data"
"369","188.211271232","192.168.1.12","157.240.221.60","TCP","66","45474  >  443 [ACK] Seq=15177 Ack=23576 Win=1003 Len=0 TSval=2064214956 TSecr=2016476657"
"370","188.673936460","192.168.1.12","157.240.221.60","TLSv1.2","159","Application Data"
"371","188.754262308","157.240.221.60","192.168.1.12","TCP","66","443  >  45474 [ACK] Seq=23576 Ack=15270 Win=473 Len=0 TSval=2016477278 TSecr=2064215418"
"372","192.204290284","157.240.221.60","192.168.1.12","TLSv1.2","159","Application Data"
"373","192.204330382","192.168.1.12","157.240.221.60","TCP","66","45474  >  443 [ACK] Seq=15270 Ack=23669 Win=1015 Len=0 TSval=2064218949 TSecr=2016480710"
"374","192.208828166","192.168.1.12","157.240.221.60","TLSv1.2","158","Application Data"
"375","192.285525934","157.240.221.60","192.168.1.12","TCP","66","443  >  45474 [ACK] Seq=23669 Ack=15362 Win=473 Len=0 TSval=2016480809 TSecr=2064218953"
"377","197.360915016","192.168.1.12","140.82.113.26","TCP","66","[TCP Keep-Alive] 48184  >  443 [ACK] Seq=91 Ack=79 Win=501 Len=0 TSval=3822381383 TSecr=1909625922"
"378","197.642934900","140.82.113.26","192.168.1.12","TCP","66","[TCP Keep-Alive ACK] 443  >  48184 [ACK] Seq=79 Ack=92 Win=70 Len=0 TSval=1909671339 TSecr=3822335983"
"379","198.368267383","192.168.1.12","157.240.221.60","TLSv1.2","135","Application Data"
"380","198.445875641","157.240.221.60","192.168.1.12","TCP","66","443  >  45474 [ACK] Seq=23669 Ack=15431 Win=473 Len=0 TSval=2016486971 TSecr=2064225113"
"381","198.655042746","157.240.221.60","192.168.1.12","TLSv1.2","137","Application Data"
"382","198.696912938","192.168.1.12","157.240.221.60","TCP","66","45474  >  443 [ACK] Seq=15431 Ack=23740 Win=1015 Len=0 TSval=2064225441 TSecr=2016487085"
"389","208.485968425","20.199.120.151","192.168.1.12","TCP","60","443  >  54962 [FIN, ACK] Seq=6821 Ack=1812 Win=7969 Len=0"
"390","208.486621542","192.168.1.12","20.199.120.151","TCP","54","54962  >  443 [FIN, ACK] Seq=1812 Ack=6822 Win=64128 Len=0"
"391","208.568418836","20.199.120.151","192.168.1.12","TCP","60","443  >  54962 [ACK] Seq=6822 Ack=1813 Win=7969 Len=0"
"392","209.495596050","192.168.1.12","20.199.120.151","TCP","74","49448  >  443 [SYN] Seq=0 Win=64240 Len=0 MSS=1460 SACK_PERM=1 TSval=3898612621 TSecr=0 WS=128"
"393","210.516935638","192.168.1.12","20.199.120.151","TCP","74","[TCP Retransmission] [TCP Port numbers reused] 49448  >  443 [SYN] Seq=0 Win=64240 Len=0 MSS=1460 SACK_PERM=1 TSval=3898613642 TSecr=0 WS=128"
"396","211.990571570","140.82.113.26","192.168.1.12","TLSv1.2","92","Application Data"
"397","211.990818757","192.168.1.12","140.82.113.26","TLSv1.2","96","Application Data"
"398","212.172041470","140.82.113.26","192.168.1.12","TCP","66","443  >  48184 [ACK] Seq=105 Ack=122 Win=70 Len=0 TSval=1909685962 TSecr=3822396013"
"400","212.532953930","192.168.1.12","20.199.120.151","TCP","74","[TCP Retransmission] [TCP Port numbers reused] 49448  >  443 [SYN] Seq=0 Win=64240 Len=0 MSS=1460 SACK_PERM=1 TSval=3898615658 TSecr=0 WS=128"
"403","215.060349129","192.168.1.12","157.240.221.60","TLSv1.2","135","Application Data"
"404","215.137034400","157.240.221.60","192.168.1.12","TCP","66","443  >  45474 [ACK] Seq=23740 Ack=15500 Win=473 Len=0 TSval=2016503662 TSecr=2064241805"
"405","215.346759784","157.240.221.60","192.168.1.12","TLSv1.2","137","Application Data"
"406","215.346811645","192.168.1.12","157.240.221.60","TCP","66","45474  >  443 [ACK] Seq=15500 Ack=23811 Win=1015 Len=0 TSval=2064242091 TSecr=2016503776"
"407","216.561077221","192.168.1.12","20.199.120.151","TCP","74","[TCP Retransmission] [TCP Port numbers reused] 49448  >  443 [SYN] Seq=0 Win=64240 Len=0 MSS=1460 SACK_PERM=1 TSval=3898619686 TSecr=0 WS=128"
"409","223.333902159","157.240.221.60","192.168.1.12","TLSv1.2","252","Application Data"
"410","223.333946449","192.168.1.12","157.240.221.60","TCP","66","45474  >  443 [ACK] Seq=15500 Ack=23997 Win=1014 Len=0 TSval=2064250078 TSecr=2016511843"
"411","224.752953486","192.168.1.12","20.199.120.151","TCP","74","[TCP Retransmission] [TCP Port numbers reused] 49448  >  443 [SYN] Seq=0 Win=64240 Len=0 MSS=1460 SACK_PERM=1 TSval=3898627878 TSecr=0 WS=128"
"412","225.440277887","192.168.1.12","157.240.221.60","TLSv1.2","219","Application Data"
"413","225.515852834","157.240.221.60","192.168.1.12","TCP","66","443  >  45474 [ACK] Seq=23997 Ack=15653 Win=484 Len=0 TSval=2016514041 TSecr=2064252185"
"414","225.688806388","157.240.221.60","192.168.1.12","TLSv1.2","184","Application Data"
"415","225.688840043","192.168.1.12","157.240.221.60","TCP","66","45474  >  443 [ACK] Seq=15653 Ack=24115 Win=1015 Len=0 TSval=2064252433 TSecr=2016514158"
"418","226.203571814","157.240.221.60","192.168.1.12","TLSv1.2","524","Application Data"
"419","226.203614641","192.168.1.12","157.240.221.60","TCP","66","45474  >  443 [ACK] Seq=15653 Ack=24573 Win=1012 Len=0 TSval=2064252948 TSecr=2016514706"
"432","229.725341232","2a00:a041:3c5d:4d00:605e:f34d:a502:2044","2620:1ec:12::239","TCP","94","49552  >  443 [SYN] Seq=0 Win=64800 Len=0 MSS=1440 SACK_PERM=1 TSval=3414577315 TSecr=0 WS=128"
"433","229.798189976","2620:1ec:12::239","2a00:a041:3c5d:4d00:605e:f34d:a502:2044","TCP","86","443  >  49552 [SYN, ACK] Seq=0 Ack=1 Win=65535 Len=0 MSS=1400 WS=256 SACK_PERM=1"
"434","229.798220301","2a00:a041:3c5d:4d00:605e:f34d:a502:2044","2620:1ec:12::239","TCP","74","49552  >  443 [ACK] Seq=1 Ack=1 Win=64896 Len=0"
"435","229.798577898","2a00:a041:3c5d:4d00:605e:f34d:a502:2044","2620:1ec:12::239","TLSv1.2","666","Client Hello"
"436","229.870762743","2620:1ec:12::239","2a00:a041:3c5d:4d00:605e:f34d:a502:2044","TCP","74","443  >  49552 [ACK] Seq=1 Ack=593 Win=4194048 Len=0"
"437","229.875738369","2620:1ec:12::239","2a00:a041:3c5d:4d00:605e:f34d:a502:2044","TCP","1514","443  >  49552 [ACK] Seq=1 Ack=593 Win=4194048 Len=1440 [TCP segment of a reassembled PDU]"
"438","229.875765229","2a00:a041:3c5d:4d00:605e:f34d:a502:2044","2620:1ec:12::239","TCP","74","49552  >  443 [ACK] Seq=593 Ack=1441 Win=63488 Len=0"
"439","229.880088665","2620:1ec:12::239","2a00:a041:3c5d:4d00:605e:f34d:a502:2044","TLSv1.2","4581","Server Hello, Certificate, Certificate Status, Server Key Exchange, Server Hello Done"
"440","229.880102868","2a00:a041:3c5d:4d00:605e:f34d:a502:2044","2620:1ec:12::239","TCP","74","49552  >  443 [ACK] Seq=593 Ack=5948 Win=59008 Len=0"
"441","229.887078361","2a00:a041:3c5d:4d00:605e:f34d:a502:2044","2620:1ec:12::239","TLSv1.2","232","Client Key Exchange, Change Cipher Spec, Encrypted Handshake Message"
"442","229.887429516","2a00:a041:3c5d:4d00:605e:f34d:a502:2044","2620:1ec:12::239","TLSv1.2","941","Application Data, Application Data"
"444","229.963788010","2620:1ec:12::239","2a00:a041:3c5d:4d00:605e:f34d:a502:2044","TCP","74","443  >  49552 [ACK] Seq=5948 Ack=751 Win=4193792 Len=0"
"445","229.964393339","2620:1ec:12::239","2a00:a041:3c5d:4d00:605e:f34d:a502:2044","TLSv1.2","416","New Session Ticket, Change Cipher Spec, Encrypted Handshake Message"
"446","229.964796863","2620:1ec:12::239","2a00:a041:3c5d:4d00:605e:f34d:a502:2044","TLSv1.2","143","Application Data"
"447","229.964819973","2a00:a041:3c5d:4d00:605e:f34d:a502:2044","2620:1ec:12::239","TCP","74","49552  >  443 [ACK] Seq=1618 Ack=6359 Win=64128 Len=0"
"448","229.964892727","2a00:a041:3c5d:4d00:605e:f34d:a502:2044","2620:1ec:12::239","TLSv1.2","112","Application Data"
"449","229.966322463","2620:1ec:12::239","2a00:a041:3c5d:4d00:605e:f34d:a502:2044","TCP","74","443  >  49552 [ACK] Seq=6359 Ack=1618 Win=4194560 Len=0"
"450","229.981609566","2620:1ec:12::239","2a00:a041:3c5d:4d00:605e:f34d:a502:2044","TLSv1.2","942","Application Data, Application Data"
"451","229.982461490","2620:1ec:12::239","2a00:a041:3c5d:4d00:605e:f34d:a502:2044","TLSv1.2","112","Application Data"
"452","229.983180023","2a00:a041:3c5d:4d00:605e:f34d:a502:2044","2620:1ec:12::239","TCP","74","49552  >  443 [ACK] Seq=1656 Ack=7265 Win=64128 Len=0"
"453","230.036216059","2620:1ec:12::239","2a00:a041:3c5d:4d00:605e:f34d:a502:2044","TCP","74","443  >  49552 [ACK] Seq=7265 Ack=1656 Win=4194560 Len=0"
"454","230.802843196","192.168.1.12","157.240.221.60","TLSv1.2","147","Application Data"
"455","230.841348108","192.168.1.12","157.240.221.60","TLSv1.2","159","Application Data"
"456","230.880464692","157.240.221.60","192.168.1.12","TCP","66","443  >  45474 [ACK] Seq=24573 Ack=15734 Win=484 Len=0 TSval=2016519406 TSecr=2064257547"
"457","230.912742653","157.240.221.60","192.168.1.12","TCP","66","443  >  45474 [ACK] Seq=24573 Ack=15827 Win=484 Len=0 TSval=2016519438 TSecr=2064257586"
"469","240.025806578","157.240.221.60","192.168.1.12","TCP","1446","443  >  45474 [ACK] Seq=24573 Ack=15827 Win=484 Len=1380 TSval=2016528493 TSecr=2064257586 [TCP segment of a reassembled PDU]"
"470","240.025855833","192.168.1.12","157.240.221.60","TCP","66","45474  >  443 [ACK] Seq=15827 Ack=25953 Win=1005 Len=0 TSval=2064266770 TSecr=2016528493"
"471","240.027486290","157.240.221.60","192.168.1.12","TLSv1.2","199","Application Data"
"472","240.027486511","157.240.221.60","192.168.1.12","TLSv1.2","2661","Application Data"
"473","240.027486558","157.240.221.60","192.168.1.12","TLSv1.2","1566","Application Data"
"474","240.027515505","192.168.1.12","157.240.221.60","TCP","66","45474  >  443 [ACK] Seq=15827 Ack=26086 Win=1004 Len=0 TSval=2064266772 TSecr=2016528493"
"475","240.027537294","192.168.1.12","157.240.221.60","TCP","66","45474  >  443 [ACK] Seq=15827 Ack=28681 Win=984 Len=0 TSval=2064266772 TSecr=2016528498"
"476","240.027551347","192.168.1.12","157.240.221.60","TCP","66","45474  >  443 [ACK] Seq=15827 Ack=30181 Win=973 Len=0 TSval=2064266772 TSecr=2016528510"
"477","240.569088389","192.168.1.12","157.240.221.60","TLSv1.2","159","Application Data"
"478","240.650262265","157.240.221.60","192.168.1.12","TCP","66","443  >  45474 [ACK] Seq=30181 Ack=15920 Win=484 Len=0 TSval=2016529173 TSecr=2064267313"
"479","240.880964499","192.168.1.12","20.199.120.151","TCP","74","[TCP Retransmission] [TCP Port numbers reused] 49448  >  443 [SYN] Seq=0 Win=64240 Len=0 MSS=1460 SACK_PERM=1 TSval=3898644006 TSecr=0 WS=128"
"481","243.797517567","2a00:a041:3c5d:4d00:605e:f34d:a502:2044","2620:1ec:12::239","TCP","94","32808  >  443 [SYN] Seq=0 Win=64800 Len=0 MSS=1440 SACK_PERM=1 TSval=3414591387 TSecr=0 WS=128"
"482","243.873724043","2620:1ec:12::239","2a00:a041:3c5d:4d00:605e:f34d:a502:2044","TCP","86","443  >  32808 [SYN, ACK] Seq=0 Ack=1 Win=65535 Len=0 MSS=1400 WS=256 SACK_PERM=1"
"483","243.873766876","2a00:a041:3c5d:4d00:605e:f34d:a502:2044","2620:1ec:12::239","TCP","74","32808  >  443 [ACK] Seq=1 Ack=1 Win=64896 Len=0"
"484","243.874255349","2a00:a041:3c5d:4d00:605e:f34d:a502:2044","2620:1ec:12::239","TLSv1.2","591","Client Hello"
"485","243.890278258","157.240.221.60","192.168.1.12","TLSv1.2","159","Application Data"
"486","243.890317297","192.168.1.12","157.240.221.60","TCP","66","45474  >  443 [ACK] Seq=15920 Ack=30274 Win=1015 Len=0 TSval=2064270635 TSecr=2016532416"
"487","243.895619743","192.168.1.12","157.240.221.60","TLSv1.2","158","Application Data"
"488","243.946451395","2620:1ec:12::239","2a00:a041:3c5d:4d00:605e:f34d:a502:2044","TCP","74","443  >  32808 [ACK] Seq=1 Ack=518 Win=4194048 Len=0"
"489","243.950991278","2620:1ec:12::239","2a00:a041:3c5d:4d00:605e:f34d:a502:2044","TCP","1514","443  >  32808 [ACK] Seq=1 Ack=518 Win=4194048 Len=1440 [TCP segment of a reassembled PDU]"
"490","243.951025811","2a00:a041:3c5d:4d00:605e:f34d:a502:2044","2620:1ec:12::239","TCP","74","32808  >  443 [ACK] Seq=518 Ack=1441 Win=63488 Len=0"
"491","243.952652456","2620:1ec:12::239","2a00:a041:3c5d:4d00:605e:f34d:a502:2044","TLSv1.2","4581","Server Hello, Certificate, Certificate Status, Server Key Exchange, Server Hello Done"
"492","243.952678688","2a00:a041:3c5d:4d00:605e:f34d:a502:2044","2620:1ec:12::239","TCP","74","32808  >  443 [ACK] Seq=518 Ack=5948 Win=59008 Len=0"
"493","243.959979026","2a00:a041:3c5d:4d00:605e:f34d:a502:2044","2620:1ec:12::239","TLSv1.2","232","Client Key Exchange, Change Cipher Spec, Encrypted Handshake Message"
"494","243.960348718","2a00:a041:3c5d:4d00:605e:f34d:a502:2044","2620:1ec:12::239","TLSv1.2","179","Application Data"
"495","243.960376634","2a00:a041:3c5d:4d00:605e:f34d:a502:2044","2620:1ec:12::239","TLSv1.2","2279","Application Data"
"496","243.960891744","2a00:a041:3c5d:4d00:605e:f34d:a502:2044","2620:1ec:12::239","TLSv1.2","2163","Application Data"
"497","243.970478696","157.240.221.60","192.168.1.12","TCP","66","443  >  45474 [ACK] Seq=30274 Ack=16012 Win=484 Len=0 TSval=2016532495 TSecr=2064270640"
"498","244.037605912","2620:1ec:12::239","2a00:a041:3c5d:4d00:605e:f34d:a502:2044","TCP","74","443  >  32808 [ACK] Seq=5948 Ack=676 Win=4193792 Len=0"
"499","244.038155859","2620:1ec:12::239","2a00:a041:3c5d:4d00:605e:f34d:a502:2044","TCP","74","443  >  32808 [ACK] Seq=5948 Ack=2986 Win=4194560 Len=0"
"500","244.038580558","2620:1ec:12::239","2a00:a041:3c5d:4d00:605e:f34d:a502:2044","TCP","74","443  >  32808 [ACK] Seq=5948 Ack=5075 Win=4194560 Len=0"
"501","244.039545167","2620:1ec:12::239","2a00:a041:3c5d:4d00:605e:f34d:a502:2044","TLSv1.2","416","New Session Ticket, Change Cipher Spec, Encrypted Handshake Message"
"502","244.039545237","2620:1ec:12::239","2a00:a041:3c5d:4d00:605e:f34d:a502:2044","TLSv1.2","143","Application Data"
"503","244.039674153","2a00:a041:3c5d:4d00:605e:f34d:a502:2044","2620:1ec:12::239","TCP","74","32808  >  443 [ACK] Seq=5075 Ack=6359 Win=64128 Len=0"
"504","244.039842648","2a00:a041:3c5d:4d00:605e:f34d:a502:2044","2620:1ec:12::239","TLSv1.2","112","Application Data"
"505","244.053311292","2620:1ec:12::239","2a00:a041:3c5d:4d00:605e:f34d:a502:2044","TLSv1.2","1514","Application Data"
"506","244.053946061","2620:1ec:12::239","2a00:a041:3c5d:4d00:605e:f34d:a502:2044","TLSv1.2","860","Application Data"
"507","244.053946132","2620:1ec:12::239","2a00:a041:3c5d:4d00:605e:f34d:a502:2044","TLSv1.2","112","Application Data"
"508","244.054043231","2a00:a041:3c5d:4d00:605e:f34d:a502:2044","2620:1ec:12::239","TCP","74","32808  >  443 [ACK] Seq=5113 Ack=8623 Win=64128 Len=0"
"509","244.110799545","2620:1ec:12::239","2a00:a041:3c5d:4d00:605e:f34d:a502:2044","TCP","74","443  >  32808 [ACK] Seq=8623 Ack=5113 Win=4194560 Len=0"
"517","244.262792444","2a00:a041:3c5d:4d00:605e:f34d:a502:2044","2a00:a040:0:6::d539:1799","QUIC","1292","Initial, DCID=370a4c678cb40271, PKN: 1, CRYPTO, CRYPTO, CRYPTO, PADDING, CRYPTO, PADDING"
"519","244.289209739","2a00:a040:0:6::d539:1799","2a00:a041:3c5d:4d00:605e:f34d:a502:2044","QUIC","1292","Initial, SCID=04a28d520241ee1e, PKN: 1, ACK, CRYPTO, PADDING"
"520","244.289751325","2a00:a040:0:6::d539:1799","2a00:a041:3c5d:4d00:605e:f34d:a502:2044","QUIC","309","Handshake, SCID=04a28d520241ee1e"
"521","244.290283798","2a00:a041:3c5d:4d00:605e:f34d:a502:2044","2a00:a040:0:6::d539:1799","QUIC","227","Protected Payload (KP0), DCID=04a28d520241ee1e"
"522","244.290577171","2a00:a041:3c5d:4d00:605e:f34d:a502:2044","2a00:a040:0:6::d539:1799","QUIC","1292","Protected Payload (KP0), DCID=04a28d520241ee1e"
"523","244.290595753","2a00:a041:3c5d:4d00:605e:f34d:a502:2044","2a00:a040:0:6::d539:1799","QUIC","1292","Protected Payload (KP0), DCID=04a28d520241ee1e"
"524","244.290611821","2a00:a041:3c5d:4d00:605e:f34d:a502:2044","2a00:a040:0:6::d539:1799","QUIC","904","Protected Payload (KP0), DCID=04a28d520241ee1e"
"525","244.305858756","2a00:a040:0:6::d539:1799","2a00:a041:3c5d:4d00:605e:f34d:a502:2044","QUIC","333","Protected Payload (KP0)"
"526","244.306510061","2a00:a040:0:6::d539:1799","2a00:a041:3c5d:4d00:605e:f34d:a502:2044","QUIC","125","Protected Payload (KP0)"
"527","244.306510298","2a00:a040:0:6::d539:1799","2a00:a041:3c5d:4d00:605e:f34d:a502:2044","QUIC","87","Protected Payload (KP0)"
"528","244.306670784","2a00:a041:3c5d:4d00:605e:f34d:a502:2044","2a00:a040:0:6::d539:1799","QUIC","94","Protected Payload (KP0), DCID=04a28d520241ee1e"
"529","244.312302729","2a00:a040:0:6::d539:1799","2a00:a041:3c5d:4d00:605e:f34d:a502:2044","QUIC","87","Protected Payload (KP0)"
"530","244.333754959","2a00:a041:3c5d:4d00:605e:f34d:a502:2044","2a00:a040:0:6::d539:1799","QUIC","94","Protected Payload (KP0), DCID=04a28d520241ee1e"
"531","244.339895205","2a00:a040:0:6::d539:1799","2a00:a041:3c5d:4d00:605e:f34d:a502:2044","QUIC","87","Protected Payload (KP0)"
"532","244.530733449","2a00:a040:0:6::d539:1799","2a00:a041:3c5d:4d00:605e:f34d:a502:2044","QUIC","87","Protected Payload (KP0)"
"533","244.530966166","2a00:a041:3c5d:4d00:605e:f34d:a502:2044","2a00:a040:0:6::d539:1799","QUIC","95","Protected Payload (KP0), DCID=04a28d520241ee1e"
"534","244.542223067","2a00:a041:3c5d:4d00:605e:f34d:a502:2044","2a00:a040:0:6::d539:1799","QUIC","91","Protected Payload (KP0), DCID=04a28d520241ee1e"
"535","244.543606252","2a00:a040:0:6::d539:1799","2a00:a041:3c5d:4d00:605e:f34d:a502:2044","QUIC","1288","Protected Payload (KP0)"
"536","244.543865155","2a00:a041:3c5d:4d00:605e:f34d:a502:2044","2a00:a040:0:6::d539:1799","QUIC","95","Protected Payload (KP0), DCID=04a28d520241ee1e"
"537","244.544385643","2a00:a040:0:6::d539:1799","2a00:a041:3c5d:4d00:605e:f34d:a502:2044","QUIC","563","Protected Payload (KP0)"
"538","244.544385832","2a00:a040:0:6::d539:1799","2a00:a041:3c5d:4d00:605e:f34d:a502:2044","QUIC","108","Protected Payload (KP0)"
"539","244.544385886","2a00:a040:0:6::d539:1799","2a00:a041:3c5d:4d00:605e:f34d:a502:2044","QUIC","87","Protected Payload (KP0)"
"540","244.544583581","2a00:a041:3c5d:4d00:605e:f34d:a502:2044","2a00:a040:0:6::d539:1799","QUIC","99","Protected Payload (KP0), DCID=04a28d520241ee1e"
"541","244.544622073","2a00:a041:3c5d:4d00:605e:f34d:a502:2044","2a00:a040:0:6::d539:1799","QUIC","95","Protected Payload (KP0), DCID=04a28d520241ee1e"
"542","244.564121833","2a00:a040:0:6::d539:1799","2a00:a041:3c5d:4d00:605e:f34d:a502:2044","QUIC","87","Protected Payload (KP0)"
"543","244.573503986","2a00:a041:3c5d:4d00:605e:f34d:a502:2044","2a00:a040:0:6::d539:1799","QUIC","94","Protected Payload (KP0), DCID=04a28d520241ee1e"
"544","245.164299134","192.168.1.12","157.240.221.60","TLSv1.2","135","Application Data"
"545","245.241116669","157.240.221.60","192.168.1.12","TCP","66","443  >  45474 [ACK] Seq=30274 Ack=16081 Win=484 Len=0 TSval=2016533765 TSecr=2064271909"
"546","245.453065374","157.240.221.60","192.168.1.12","TLSv1.2","137","Application Data"
"547","245.496981010","192.168.1.12","157.240.221.60","TCP","66","45474  >  443 [ACK] Seq=16081 Ack=30345 Win=1015 Len=0 TSval=2064272241 TSecr=2016533878"
"548","246.068809620","157.240.221.60","192.168.1.12","TLSv1.2","727","Application Data"
"549","246.068865399","192.168.1.12","157.240.221.60","TCP","66","45474  >  443 [ACK] Seq=16081 Ack=31006 Win=1010 Len=0 TSval=2064272813 TSecr=2016534505"
"550","246.179283053","192.168.1.12","157.240.221.60","TLSv1.2","159","Application Data"
"551","246.256752623","157.240.221.60","192.168.1.12","TCP","66","443  >  45474 [ACK] Seq=31006 Ack=16174 Win=484 Len=0 TSval=2016534781 TSecr=2064272924"
"555","257.269049691","192.168.1.12","140.82.113.26","TCP","66","[TCP Keep-Alive] 48184  >  443 [ACK] Seq=121 Ack=105 Win=501 Len=0 TSval=3822441291 TSecr=1909685962"
"556","257.433326562","140.82.113.26","192.168.1.12","TCP","66","[TCP Keep-Alive ACK] 443  >  48184 [ACK] Seq=105 Ack=122 Win=70 Len=0 TSval=1909731229 TSecr=3822396013"
"558","257.843562547","157.240.221.60","192.168.1.12","TLSv1.2","154","Application Data"
"559","257.843613743","192.168.1.12","157.240.221.60","TCP","66","45474  >  443 [ACK] Seq=16174 Ack=31094 Win=1015 Len=0 TSval=2064284588 TSecr=2016546301"
"560","257.868523941","192.168.1.12","157.240.221.60","TLSv1.2","138","Application Data"
"561","257.944911435","157.240.221.60","192.168.1.12","TCP","66","443  >  45474 [ACK] Seq=31094 Ack=16246 Win=484 Len=0 TSval=2016546467 TSecr=2064284613"
"572","259.892406372","192.168.1.12","20.229.111.167","TCP","74","41890  >  443 [SYN] Seq=0 Win=64240 Len=0 MSS=1460 SACK_PERM=1 TSval=573477244 TSecr=0 WS=128"
"573","259.976744377","20.229.111.167","192.168.1.12","TCP","66","443  >  41890 [SYN, ACK] Seq=0 Ack=1 Win=65535 Len=0 MSS=1440 WS=256 SACK_PERM=1"
"574","259.976801384","192.168.1.12","20.229.111.167","TCP","54","41890  >  443 [ACK] Seq=1 Ack=1 Win=64256 Len=0"
"575","259.977299302","192.168.1.12","20.229.111.167","TLSv1.2","571","Client Hello"
"576","260.061063597","20.229.111.167","192.168.1.12","TCP","1514","443  >  41890 [ACK] Seq=1 Ack=518 Win=525056 Len=1460 [TCP segment of a reassembled PDU]"
"577","260.061116490","192.168.1.12","20.229.111.167","TCP","54","41890  >  443 [ACK] Seq=518 Ack=1461 Win=63104 Len=0"
"578","260.063326405","20.229.111.167","192.168.1.12","TLSv1.2","4568","Server Hello, Certificate, Certificate Status, Server Key Exchange, Server Hello Done"
"579","260.063370897","192.168.1.12","20.229.111.167","TCP","54","41890  >  443 [ACK] Seq=518 Ack=5975 Win=58624 Len=0"
"580","260.066889577","192.168.1.12","20.229.111.167","TLSv1.2","212","Client Key Exchange, Change Cipher Spec, Encrypted Handshake Message"
"581","260.067271729","192.168.1.12","20.229.111.167","TLSv1.2","650","Application Data, Application Data"
"582","260.067726059","192.168.1.12","20.229.111.167","TLSv1.2","271","Application Data"
"583","260.153189891","20.229.111.167","192.168.1.12","TCP","60","443  >  41890 [ACK] Seq=5975 Ack=1489 Win=525568 Len=0"
"584","260.154775833","20.229.111.167","192.168.1.12","TLSv1.2","105","Change Cipher Spec, Encrypted Handshake Message"
"585","260.155274396","20.229.111.167","192.168.1.12","TLSv1.2","123","Application Data"
"586","260.155370749","192.168.1.12","20.229.111.167","TCP","54","41890  >  443 [ACK] Seq=1489 Ack=6095 Win=64128 Len=0"
"587","260.155468948","192.168.1.12","20.229.111.167","TLSv1.2","92","Application Data"
"588","260.156026125","20.229.111.167","192.168.1.12","TLSv1.2","134","Application Data, Application Data"
"589","260.159650778","20.229.111.167","192.168.1.12","TCP","1514","443  >  41890 [ACK] Seq=6175 Ack=1489 Win=525568 Len=1460 [TCP segment of a reassembled PDU]"
"590","260.159724159","192.168.1.12","20.229.111.167","TCP","54","41890  >  443 [ACK] Seq=1527 Ack=7635 Win=64128 Len=0"
"591","260.160813347","20.229.111.167","192.168.1.12","TCP","1514","443  >  41890 [ACK] Seq=7635 Ack=1489 Win=525568 Len=1460 [TCP segment of a reassembled PDU]"
"592","260.161933066","20.229.111.167","192.168.1.12","TCP","2974","443  >  41890 [ACK] Seq=9095 Ack=1489 Win=525568 Len=2920 [TCP segment of a reassembled PDU]"
"593","260.162047944","192.168.1.12","20.229.111.167","TCP","54","41890  >  443 [ACK] Seq=1527 Ack=12015 Win=64128 Len=0"
"594","260.163091797","20.229.111.167","192.168.1.12","TLSv1.2","2014","Application Data"
"595","260.163186720","192.168.1.12","20.229.111.167","TCP","54","41890  >  443 [ACK] Seq=1527 Ack=13975 Win=64128 Len=0"
"596","260.163215771","20.229.111.167","192.168.1.12","TLSv1.2","92","Application Data"
"597","260.204997556","192.168.1.12","20.229.111.167","TCP","54","41890  >  443 [ACK] Seq=1527 Ack=14013 Win=64128 Len=0"
"598","260.238094469","20.229.111.167","192.168.1.12","TCP","60","443  >  41890 [ACK] Seq=14013 Ack=1527 Win=525312 Len=0"
"600","266.307608989","192.168.1.12","157.240.221.60","TLSv1.2","135","Application Data"
"601","266.382672245","157.240.221.60","192.168.1.12","TCP","66","443  >  45474 [ACK] Seq=31094 Ack=16315 Win=484 Len=0 TSval=2016554908 TSecr=2064293052"
"602","266.548811365","157.240.221.60","192.168.1.12","TLSv1.2","137","Application Data"
"603","266.589090347","192.168.1.12","157.240.221.60","TCP","66","45474  >  443 [ACK] Seq=16315 Ack=31165 Win=1015 Len=0 TSval=2064293333 TSecr=2016555022"
"607","271.974866719","140.82.113.26","192.168.1.12","TLSv1.2","92","Application Data"
"608","271.975080745","192.168.1.12","140.82.113.26","TLSv1.2","96","Application Data"
"609","272.179476201","140.82.113.26","192.168.1.12","TCP","66","443  >  48184 [ACK] Seq=131 Ack=152 Win=70 Len=0 TSval=1909745934 TSecr=3822455997"
"612","272.203249164","2a00:a041:3c5d:4d00:605e:f34d:a502:2044","2620:2d:4000:1::23","TCP","94","40680  >  80 [SYN] Seq=0 Win=64800 Len=0 MSS=1440 SACK_PERM=1 TSval=1779448106 TSecr=0 WS=128"
"613","272.283297857","2620:2d:4000:1::23","2a00:a041:3c5d:4d00:605e:f34d:a502:2044","TCP","94","80  >  40680 [SYN, ACK] Seq=0 Ack=1 Win=64260 Len=0 MSS=1440 SACK_PERM=1 TSval=1407028013 TSecr=1779448106 WS=128"
"614","272.283340258","2a00:a041:3c5d:4d00:605e:f34d:a502:2044","2620:2d:4000:1::23","TCP","86","40680  >  80 [ACK] Seq=1 Ack=1 Win=64896 Len=0 TSval=1779448186 TSecr=1407028013"
"615","272.283510735","2a00:a041:3c5d:4d00:605e:f34d:a502:2044","2620:2d:4000:1::23","HTTP","173","GET / HTTP/1.1 "
"616","272.363923980","2620:2d:4000:1::23","2a00:a041:3c5d:4d00:605e:f34d:a502:2044","HTTP","275","HTTP/1.1 204 No Content "
"617","272.363966694","2a00:a041:3c5d:4d00:605e:f34d:a502:2044","2620:2d:4000:1::23","TCP","86","40680  >  80 [ACK] Seq=88 Ack=190 Win=64768 Len=0 TSval=1779448266 TSecr=1407028094"
"618","272.364128630","2a00:a041:3c5d:4d00:605e:f34d:a502:2044","2620:2d:4000:1::23","TCP","86","40680  >  80 [FIN, ACK] Seq=88 Ack=190 Win=64768 Len=0 TSval=1779448266 TSecr=1407028094"
"619","272.364155783","2620:2d:4000:1::23","2a00:a041:3c5d:4d00:605e:f34d:a502:2044","TCP","86","80  >  40680 [FIN, ACK] Seq=190 Ack=88 Win=64256 Len=0 TSval=1407028094 TSecr=1779448186"
"620","272.364173074","2a00:a041:3c5d:4d00:605e:f34d:a502:2044","2620:2d:4000:1::23","TCP","86","40680  >  80 [ACK] Seq=89 Ack=191 Win=64768 Len=0 TSval=1779448266 TSecr=1407028094"
"621","272.445763497","2620:2d:4000:1::23","2a00:a041:3c5d:4d00:605e:f34d:a502:2044","TCP","86","80  >  40680 [ACK] Seq=191 Ack=89 Win=64256 Len=0 TSval=1407028177 TSecr=1779448266"
"623","274.417056562","192.168.1.12","20.199.120.151","TCP","74","[TCP Retransmission] [TCP Port numbers reused] 49448  >  443 [SYN] Seq=0 Win=64240 Len=0 MSS=1460 SACK_PERM=1 TSval=3898677542 TSecr=0 WS=128"
"624","274.498525462","20.199.120.151","192.168.1.12","TCP","66","443  >  49448 [SYN, ACK] Seq=0 Ack=1 Win=8192 Len=0 MSS=1440 WS=1 SACK_PERM=1"
"625","274.498584135","192.168.1.12","20.199.120.151","TCP","54","49448  >  443 [ACK] Seq=1 Ack=1 Win=64256 Len=0"
"626","274.499033969","192.168.1.12","20.199.120.151","TLSv1.2","571","Client Hello"
"627","274.621247969","20.199.120.151","192.168.1.12","TCP","60","443  >  49448 [ACK] Seq=1 Ack=518 Win=7675 Len=0"
"628","274.623188369","20.199.120.151","192.168.1.12","TCP","1514","443  >  49448 [PSH, ACK] Seq=1 Ack=518 Win=7675 Len=1460 [TCP segment of a reassembled PDU]"
"629","274.623188614","20.199.120.151","192.168.1.12","TCP","1514","443  >  49448 [PSH, ACK] Seq=1461 Ack=518 Win=7675 Len=1460 [TCP segment of a reassembled PDU]"
"630","274.623188667","20.199.120.151","192.168.1.12","TCP","1514","443  >  49448 [PSH, ACK] Seq=2921 Ack=518 Win=7675 Len=1460 [TCP segment of a reassembled PDU]"
"631","274.623188717","20.199.120.151","192.168.1.12","TCP","1514","443  >  49448 [PSH, ACK] Seq=4381 Ack=518 Win=7675 Len=1460 [TCP segment of a reassembled PDU]"
"632","274.623273327","192.168.1.12","20.199.120.151","TCP","54","49448  >  443 [ACK] Seq=518 Ack=1461 Win=63104 Len=0"
"633","274.623297990","192.168.1.12","20.199.120.151","TCP","54","49448  >  443 [ACK] Seq=518 Ack=2921 Win=61696 Len=0"
"634","274.623304483","192.168.1.12","20.199.120.151","TCP","54","49448  >  443 [ACK] Seq=518 Ack=4381 Win=60288 Len=0"
"635","274.623311186","192.168.1.12","20.199.120.151","TCP","54","49448  >  443 [ACK] Seq=518 Ack=5841 Win=58880 Len=0"
"636","274.703059092","20.199.120.151","192.168.1.12","TLSv1.2","141","Server Hello, Certificate, Certificate Status, Server Key Exchange, Server Hello Done"
"637","274.703092873","192.168.1.12","20.199.120.151","TCP","54","49448  >  443 [ACK] Seq=518 Ack=5928 Win=64128 Len=0"
"638","274.706376645","192.168.1.12","20.199.120.151","TLSv1.2","212","Client Key Exchange, Change Cipher Spec, Encrypted Handshake Message"
"639","274.790682683","20.199.120.151","192.168.1.12","TLSv1.2","105","Change Cipher Spec, Encrypted Handshake Message"
"640","274.792367342","192.168.1.12","20.199.120.151","TLSv1.2","329","Application Data"
"641","274.871802331","20.199.120.151","192.168.1.12","TLSv1.2","334","Application Data"
"642","274.872606864","192.168.1.12","20.199.120.151","TLSv1.2","208","Application Data"
"646","274.962134001","20.199.120.151","192.168.1.12","TLSv1.2","157","Application Data"
"647","274.962769215","192.168.1.12","20.199.120.151","TLSv1.2","538","Application Data"
"648","275.153931301","20.199.120.151","192.168.1.12","TCP","60","443  >  49448 [ACK] Seq=6362 Ack=1589 Win=8192 Len=0"
"653","275.558819364","20.199.120.151","192.168.1.12","TLSv1.2","407","Application Data"
"654","275.559524626","192.168.1.12","20.199.120.151","TLSv1.2","277","Application Data"
"655","275.641950831","20.199.120.151","192.168.1.12","TLSv1.2","157","Application Data"
"658","275.684975634","192.168.1.12","20.199.120.151","TCP","54","49448  >  443 [ACK] Seq=1812 Ack=6818 Win=64128 Len=0"
"667","276.464949504","2a00:a041:3c5d:4d00:605e:f34d:a502:2044","2620:1ec:12::239","TCP","74","[TCP Keep-Alive] 49552  >  443 [ACK] Seq=1655 Ack=7265 Win=64128 Len=0"
"668","276.552437710","2620:1ec:12::239","2a00:a041:3c5d:4d00:605e:f34d:a502:2044","TCP","74","[TCP Keep-Alive ACK] 443  >  49552 [ACK] Seq=7265 Ack=1656 Win=4194560 Len=0"
"669","276.793201960","157.240.221.60","192.168.1.12","TCP","1446","443  >  45474 [ACK] Seq=31165 Ack=16315 Win=484 Len=1380 TSval=2016565251 TSecr=2064293333 [TCP segment of a reassembled PDU]"
"670","276.793253383","192.168.1.12","157.240.221.60","TCP","66","45474  >  443 [ACK] Seq=16315 Ack=32545 Win=1005 Len=0 TSval=2064303538 TSecr=2016565251"
"671","276.793711086","157.240.221.60","192.168.1.12","TLSv1.2","384","Application Data, Application Data"
"672","276.793742075","192.168.1.12","157.240.221.60","TCP","66","45474  >  443 [ACK] Seq=16315 Ack=32863 Win=1003 Len=0 TSval=2064303538 TSecr=2016565251"
"675","277.543048934","192.168.1.12","157.240.221.60","TLSv1.2","159","Application Data"
"676","277.618349228","157.240.221.60","192.168.1.12","TCP","66","443  >  45474 [ACK] Seq=32863 Ack=16408 Win=484 Len=0 TSval=2016566142 TSecr=2064304287"
"683","281.088843312","157.240.221.60","192.168.1.12","TLSv1.2","200","Application Data"
"684","281.088895846","192.168.1.12","157.240.221.60","TCP","66","45474  >  443 [ACK] Seq=16408 Ack=32997 Win=1014 Len=0 TSval=2064307833 TSecr=2016569567"
"685","281.094769996","192.168.1.12","157.240.221.60","TLSv1.2","160","Application Data"
"686","281.171733632","157.240.221.60","192.168.1.12","TCP","66","443  >  45474 [ACK] Seq=32997 Ack=16502 Win=484 Len=0 TSval=2016569694 TSecr=2064307839"
"690","283.449111705","157.240.221.60","192.168.1.12","TLSv1.2","159","Application Data"
"691","283.452599952","192.168.1.12","157.240.221.60","TLSv1.2","158","Application Data"
"692","283.529266468","157.240.221.60","192.168.1.12","TCP","66","443  >  45474 [ACK] Seq=33090 Ack=16594 Win=484 Len=0 TSval=2016572052 TSecr=2064310197"
"693","286.312075750","157.240.221.60","192.168.1.12","TLSv1.2","345","Application Data"
"694","286.356916584","192.168.1.12","157.240.221.60","TCP","66","45474  >  443 [ACK] Seq=16594 Ack=33369 Win=1015 Len=0 TSval=2064313101 TSecr=2016574807"
"695","286.461012426","192.168.1.12","157.240.221.60","TLSv1.2","138","Application Data"
"696","286.543677954","157.240.221.60","192.168.1.12","TCP","66","443  >  45474 [ACK] Seq=33369 Ack=16666 Win=484 Len=0 TSval=2016575068 TSecr=2064313205"
"716","288.119402071","192.168.1.12","13.69.116.104","TCP","74","41750  >  443 [SYN] Seq=0 Win=64240 Len=0 MSS=1460 SACK_PERM=1 TSval=2924577229 TSecr=0 WS=128"
"718","288.167186494","192.168.1.12","51.132.193.105","TCP","74","55964  >  443 [SYN] Seq=0 Win=64240 Len=0 MSS=1460 SACK_PERM=1 TSval=4056280489 TSecr=0 WS=128"
"719","288.205964365","13.69.116.104","192.168.1.12","TCP","66","443  >  41750 [SYN, ACK] Seq=0 Ack=1 Win=65535 Len=0 MSS=1440 WS=256 SACK_PERM=1"
"720","288.206021133","192.168.1.12","13.69.116.104","TCP","54","41750  >  443 [ACK] Seq=1 Ack=1 Win=64256 Len=0"
"721","288.206508804","192.168.1.12","13.69.116.104","TLSv1.2","571","Client Hello"
"722","288.260071721","51.132.193.105","192.168.1.12","TCP","66","443  >  55964 [SYN, ACK] Seq=0 Ack=1 Win=65535 Len=0 MSS=1440 WS=256 SACK_PERM=1"
"725","288.260135680","192.168.1.12","51.132.193.105","TCP","54","55964  >  443 [ACK] Seq=1 Ack=1 Win=64256 Len=0"
"726","288.260680931","192.168.1.12","51.132.193.105","TLSv1.2","571","Client Hello"
"727","288.262106376","192.168.1.12","157.240.221.60","TLSv1.2","135","Application Data"
"728","288.331419369","13.69.116.104","192.168.1.12","TCP","1514","443  >  41750 [ACK] Seq=1 Ack=518 Win=525056 Len=1460 [TCP segment of a reassembled PDU]"
"729","288.331474052","192.168.1.12","13.69.116.104","TCP","54","41750  >  443 [ACK] Seq=518 Ack=1461 Win=63104 Len=0"
"730","288.332098244","13.69.116.104","192.168.1.12","TCP","1514","443  >  41750 [ACK] Seq=1461 Ack=518 Win=525056 Len=1460 [TCP segment of a reassembled PDU]"
"731","288.332110663","192.168.1.12","13.69.116.104","TCP","54","41750  >  443 [ACK] Seq=518 Ack=2921 Win=63104 Len=0"
"732","288.333189487","13.69.116.104","192.168.1.12","TCP","1514","443  >  41750 [ACK] Seq=2921 Ack=518 Win=525056 Len=1460 [TCP segment of a reassembled PDU]"
"733","288.333209766","192.168.1.12","13.69.116.104","TCP","54","41750  >  443 [ACK] Seq=518 Ack=4381 Win=63104 Len=0"
"734","288.334881075","13.69.116.104","192.168.1.12","TCP","1514","443  >  41750 [ACK] Seq=4381 Ack=518 Win=525056 Len=1460 [TCP segment of a reassembled PDU]"
"735","288.334898965","192.168.1.12","13.69.116.104","TCP","54","41750  >  443 [ACK] Seq=518 Ack=5841 Win=63104 Len=0"
"736","288.335655710","13.69.116.104","192.168.1.12","TLSv1.2","519","Server Hello, Certificate, Certificate Status, Server Key Exchange, Server Hello Done"
"737","288.335660356","192.168.1.12","13.69.116.104","TCP","54","41750  >  443 [ACK] Seq=518 Ack=6306 Win=63104 Len=0"
"738","288.340176765","157.240.221.60","192.168.1.12","TCP","66","443  >  45474 [ACK] Seq=33369 Ack=16735 Win=484 Len=0 TSval=2016576865 TSecr=2064315006"
"739","288.343350499","192.168.1.12","13.69.116.104","TLSv1.2","212","Client Key Exchange, Change Cipher Spec, Encrypted Handshake Message"
"740","288.343752156","192.168.1.12","13.69.116.104","TLSv1.2","159","Application Data"
"741","288.343774642","192.168.1.12","13.69.116.104","TLSv1.2","899","Application Data"
"742","288.343833800","192.168.1.12","13.69.116.104","TCP","2934","41750  >  443 [PSH, ACK] Seq=1626 Ack=6306 Win=64128 Len=2880 [TCP segment of a reassembled PDU]"
"743","288.344258529","192.168.1.12","13.69.116.104","TCP","2934","41750  >  443 [PSH, ACK] Seq=4506 Ack=6306 Win=64128 Len=2880 [TCP segment of a reassembled PDU]"
"744","288.344798552","192.168.1.12","13.69.116.104","TLSv1.2","1497","Application Data"
"745","288.380269901","51.132.193.105","192.168.1.12","TCP","1514","443  >  55964 [ACK] Seq=1 Ack=518 Win=525056 Len=1460 [TCP segment of a reassembled PDU]"
"746","288.380323118","192.168.1.12","51.132.193.105","TCP","54","55964  >  443 [ACK] Seq=518 Ack=1461 Win=63104 Len=0"
"747","288.380995920","51.132.193.105","192.168.1.12","TCP","1514","443  >  55964 [ACK] Seq=1461 Ack=518 Win=525056 Len=1460 [TCP segment of a reassembled PDU]"
"748","288.381018975","192.168.1.12","51.132.193.105","TCP","54","55964  >  443 [ACK] Seq=518 Ack=2921 Win=63104 Len=0"
"749","288.383085619","51.132.193.105","192.168.1.12","TCP","2974","443  >  55964 [ACK] Seq=2921 Ack=518 Win=525056 Len=2920 [TCP segment of a reassembled PDU]"
"750","288.383130080","192.168.1.12","51.132.193.105","TCP","54","55964  >  443 [ACK] Seq=518 Ack=5841 Win=61056 Len=0"
"751","288.383639205","51.132.193.105","192.168.1.12","TLSv1.2","517","Server Hello, Certificate, Certificate Status, Server Key Exchange, Server Hello Done"
"752","288.383659642","192.168.1.12","51.132.193.105","TCP","54","55964  >  443 [ACK] Seq=518 Ack=6304 Win=63104 Len=0"
"753","288.391528648","192.168.1.12","51.132.193.105","TLSv1.2","212","Client Key Exchange, Change Cipher Spec, Encrypted Handshake Message"
"754","288.391923605","192.168.1.12","51.132.193.105","TLSv1.2","578","Application Data, Application Data"
"755","288.392034482","192.168.1.12","51.132.193.105","TCP","2934","55964  >  443 [PSH, ACK] Seq=1200 Ack=6304 Win=64128 Len=2880 [TCP segment of a reassembled PDU]"
"756","288.392242072","192.168.1.12","51.132.193.105","TCP","2934","55964  >  443 [PSH, ACK] Seq=4080 Ack=6304 Win=64128 Len=2880 [TCP segment of a reassembled PDU]"
"757","288.393484048","192.168.1.12","51.132.193.105","TCP","2934","55964  >  443 [PSH, ACK] Seq=6960 Ack=6304 Win=64128 Len=2880 [TCP segment of a reassembled PDU]"
"758","288.394022505","192.168.1.12","51.132.193.105","TCP","2934","55964  >  443 [PSH, ACK] Seq=9840 Ack=6304 Win=64128 Len=2880 [TCP segment of a reassembled PDU]"
"759","288.433133554","13.69.116.104","192.168.1.12","TCP","60","443  >  41750 [ACK] Seq=6306 Ack=781 Win=524800 Len=0"
"760","288.433491591","13.69.116.104","192.168.1.12","TCP","60","443  >  41750 [ACK] Seq=6306 Ack=5946 Win=525568 Len=0"
"761","288.435260813","13.69.116.104","192.168.1.12","TCP","60","443  >  41750 [ACK] Seq=6306 Ack=8829 Win=525568 Len=0"
"762","288.441298439","13.69.116.104","192.168.1.12","TLSv1.2","105","Change Cipher Spec, Encrypted Handshake Message"
"763","288.448019880","13.69.116.104","192.168.1.12","TLSv1.2","123","Application Data"
"764","288.448195938","192.168.1.12","13.69.116.104","TCP","54","41750  >  443 [ACK] Seq=8829 Ack=6426 Win=64128 Len=0"
"765","288.448376121","192.168.1.12","13.69.116.104","TLSv1.2","92","Application Data"
"766","288.454330588","157.240.221.60","192.168.1.12","TLSv1.2","137","Application Data"
"767","288.454367616","192.168.1.12","157.240.221.60","TCP","66","45474  >  443 [ACK] Seq=16735 Ack=33440 Win=1015 Len=0 TSval=2064315199 TSecr=2016576979"
"768","288.456281312","13.69.116.104","192.168.1.12","TLSv1.2","147","Application Data, Application Data"
"769","288.456903516","13.69.116.104","192.168.1.12","TLSv1.2","109","Application Data"
"770","288.456903716","13.69.116.104","192.168.1.12","TLSv1.2","109","Application Data"
"771","288.456903768","13.69.116.104","192.168.1.12","TLSv1.2","96","Application Data"
"772","288.457054493","192.168.1.12","13.69.116.104","TCP","54","41750  >  443 [ACK] Seq=8867 Ack=6671 Win=64128 Len=0"
"773","288.483958371","51.132.193.105","192.168.1.12","TCP","60","443  >  55964 [ACK] Seq=6304 Ack=5520 Win=525568 Len=0"
"774","288.484007673","192.168.1.12","51.132.193.105","TCP","2934","55964  >  443 [PSH, ACK] Seq=12720 Ack=6304 Win=64128 Len=2880 [TCP segment of a reassembled PDU]"
"775","288.484034033","192.168.1.12","51.132.193.105","TLSv1.2","2934","Application Data [TCP segment of a reassembled PDU]"
"776","288.484212349","51.132.193.105","192.168.1.12","TCP","60","443  >  55964 [ACK] Seq=6304 Ack=6960 Win=524032 Len=0"
"777","288.485059395","192.168.1.12","51.132.193.105","TCP","2934","55964  >  443 [PSH, ACK] Seq=18480 Ack=6304 Win=64128 Len=2880 [TCP segment of a reassembled PDU]"
"778","288.485091956","192.168.1.12","51.132.193.105","TCP","2934","55964  >  443 [PSH, ACK] Seq=21360 Ack=6304 Win=64128 Len=2880 [TCP segment of a reassembled PDU]"
"779","288.486071477","192.168.1.12","51.132.193.105","TCP","2934","55964  >  443 [PSH, ACK] Seq=24240 Ack=6304 Win=64128 Len=2880 [TCP segment of a reassembled PDU]"
"780","288.486091008","192.168.1.12","51.132.193.105","TCP","2934","55964  >  443 [PSH, ACK] Seq=27120 Ack=6304 Win=64128 Len=2880 [TCP segment of a reassembled PDU]"
"781","288.491873253","51.132.193.105","192.168.1.12","TLSv1.2","105","Change Cipher Spec, Encrypted Handshake Message"
"782","288.492362239","51.132.193.105","192.168.1.12","TCP","60","443  >  55964 [ACK] Seq=6355 Ack=12720 Win=525568 Len=0"
"783","288.492405792","192.168.1.12","51.132.193.105","TLSv1.2","2391","Application Data"
"784","288.499034331","51.132.193.105","192.168.1.12","TLSv1.2","123","Application Data"
"785","288.499291704","192.168.1.12","51.132.193.105","TLSv1.2","92","Application Data"
"786","288.571196565","13.69.116.104","192.168.1.12","TLSv1.2","341","Application Data"
"787","288.575648069","51.132.193.105","192.168.1.12","TLSv1.2","92","Application Data"
"788","288.576035550","51.132.193.105","192.168.1.12","TCP","60","443  >  55964 [ACK] Seq=6462 Ack=19920 Win=525568 Len=0"
"789","288.612912293","192.168.1.12","13.69.116.104","TCP","54","41750  >  443 [ACK] Seq=8867 Ack=6958 Win=64128 Len=0"
"790","288.617050892","192.168.1.12","51.132.193.105","TCP","54","55964  >  443 [ACK] Seq=32375 Ack=6462 Win=64128 Len=0"
"791","288.622148865","51.132.193.105","192.168.1.12","TLSv1.2","109","Application Data"
"792","288.622302409","192.168.1.12","51.132.193.105","TCP","54","55964  >  443 [ACK] Seq=32375 Ack=6517 Win=64128 Len=0"
"793","288.623175086","51.132.193.105","192.168.1.12","TLSv1.2","109","Application Data"
"794","288.623175269","51.132.193.105","192.168.1.12","TLSv1.2","109","Application Data"
"795","288.623175317","51.132.193.105","192.168.1.12","TLSv1.2","109","Application Data"
"796","288.623175361","51.132.193.105","192.168.1.12","TLSv1.2","109","Application Data"
"797","288.623175409","51.132.193.105","192.168.1.12","TLSv1.2","109","Application Data"
"798","288.623175457","51.132.193.105","192.168.1.12","TLSv1.2","109","Application Data"
"799","288.623175504","51.132.193.105","192.168.1.12","TLSv1.2","109","Application Data"
"800","288.623175554","51.132.193.105","192.168.1.12","TCP","60","443  >  55964 [ACK] Seq=6902 Ack=24240 Win=525568 Len=0"
"801","288.623225035","51.132.193.105","192.168.1.12","TCP","60","443  >  55964 [ACK] Seq=6902 Ack=25680 Win=524032 Len=0"
"802","288.623225110","51.132.193.105","192.168.1.12","TCP","60","443  >  55964 [ACK] Seq=6902 Ack=31440 Win=525568 Len=0"
"803","288.623225164","51.132.193.105","192.168.1.12","TCP","60","443  >  55964 [ACK] Seq=6902 Ack=32375 Win=524544 Len=0"
"804","288.623225208","51.132.193.105","192.168.1.12","TLSv1.2","109","Application Data"
"805","288.623245839","192.168.1.12","51.132.193.105","TCP","54","55964  >  443 [ACK] Seq=32375 Ack=6902 Win=64128 Len=0"
"806","288.623282342","192.168.1.12","51.132.193.105","TCP","54","55964  >  443 [ACK] Seq=32375 Ack=6957 Win=64128 Len=0"
"807","289.080883571","51.132.193.105","192.168.1.12","TLSv1.2","96","Application Data"
"808","289.080929306","192.168.1.12","51.132.193.105","TCP","54","55964  >  443 [ACK] Seq=32375 Ack=6999 Win=64128 Len=0"
"809","289.485472939","51.132.193.105","192.168.1.12","TLSv1.2","343","Application Data"
"810","289.485514900","192.168.1.12","51.132.193.105","TCP","54","55964  >  443 [ACK] Seq=32375 Ack=7288 Win=63872 Len=0"
"813","289.654552370","192.168.1.12","35.224.170.84","TCP","74","57450  >  80 [SYN] Seq=0 Win=64240 Len=0 MSS=1460 SACK_PERM=1 TSval=1837472278 TSecr=0 WS=128"
"814","289.900460852","35.224.170.84","192.168.1.12","TCP","74","80  >  57450 [SYN, ACK] Seq=0 Ack=1 Win=64768 Len=0 MSS=1420 SACK_PERM=1 TSval=2622150757 TSecr=1837472278 WS=128"
"817","289.900517599","192.168.1.12","35.224.170.84","TCP","66","57450  >  80 [ACK] Seq=1 Ack=1 Win=64256 Len=0 TSval=1837472524 TSecr=2622150757"
"818","289.900650443","192.168.1.12","35.224.170.84","HTTP","153","GET / HTTP/1.1 "
"819","290.099538565","35.224.170.84","192.168.1.12","TCP","66","80  >  57450 [ACK] Seq=1 Ack=88 Win=64256 Len=0 TSval=2622151025 TSecr=1837472524"
"820","290.101116698","35.224.170.84","192.168.1.12","TCP","66","[TCP Dup ACK 819#1] 80  >  57450 [ACK] Seq=1 Ack=88 Win=64256 Len=0 TSval=2622151025 TSecr=1837472524"
"821","290.101116941","35.224.170.84","192.168.1.12","HTTP","214","HTTP/1.1 204 No Content "
"822","290.101158190","192.168.1.12","35.224.170.84","TCP","66","57450  >  80 [ACK] Seq=88 Ack=149 Win=64128 Len=0 TSval=1837472724 TSecr=2622151025"
"823","290.101256027","192.168.1.12","35.224.170.84","TCP","66","57450  >  80 [FIN, ACK] Seq=88 Ack=149 Win=64128 Len=0 TSval=1837472725 TSecr=2622151025"
"824","290.101302771","35.224.170.84","192.168.1.12","TCP","66","80  >  57450 [FIN, ACK] Seq=149 Ack=88 Win=64256 Len=0 TSval=2622151026 TSecr=1837472524"
"825","290.101325223","192.168.1.12","35.224.170.84","TCP","66","57450  >  80 [ACK] Seq=89 Ack=150 Win=64128 Len=0 TSval=1837472725 TSecr=2622151026"
"828","290.307180786","35.224.170.84","192.168.1.12","TCP","66","80  >  57450 [ACK] Seq=150 Ack=89 Win=64256 Len=0 TSval=2622151222 TSecr=1837472725"
"830","290.800952778","2a00:a041:3c5d:4d00:605e:f34d:a502:2044","2620:1ec:12::239","TCP","74","[TCP Keep-Alive] 32808  >  443 [ACK] Seq=5112 Ack=8623 Win=64128 Len=0"
"831","290.886950519","2620:1ec:12::239","2a00:a041:3c5d:4d00:605e:f34d:a502:2044","TCP","74","[TCP Keep-Alive ACK] 443  >  32808 [ACK] Seq=8623 Ack=5113 Win=4194560 Len=0"
"837","299.214178603","157.240.221.60","192.168.1.12","TLSv1.2","786","Application Data"
"838","299.214222183","192.168.1.12","157.240.221.60","TCP","66","45474  >  443 [ACK] Seq=16735 Ack=34160 Win=1010 Len=0 TSval=2064325958 TSecr=2016587659"
"839","299.418505395","157.240.221.60","192.168.1.12","TCP","1446","443  >  45474 [ACK] Seq=34160 Ack=16735 Win=484 Len=1380 TSval=2016587894 TSecr=2064325958 [TCP segment of a reassembled PDU]"
"840","299.418537563","192.168.1.12","157.240.221.60","TCP","66","45474  >  443 [ACK] Seq=16735 Ack=35540 Win=1000 Len=0 TSval=2064326163 TSecr=2016587894"
"841","299.419315586","157.240.221.60","192.168.1.12","TLSv1.2","402","Application Data, Application Data"
"842","299.419333016","192.168.1.12","157.240.221.60","TCP","66","45474  >  443 [ACK] Seq=16735 Ack=35876 Win=998 Len=0 TSval=2064326164 TSecr=2016587894"
"843","299.627207712","192.168.1.12","157.240.221.60","TLSv1.2","162","Application Data"
"844","299.644256429","157.240.221.60","192.168.1.12","TLSv1.2","207","Application Data"
"845","299.644296392","192.168.1.12","157.240.221.60","TCP","66","45474  >  443 [ACK] Seq=16831 Ack=36017 Win=1014 Len=0 TSval=2064326389 TSecr=2016588169"
"846","299.647769183","192.168.1.12","157.240.221.60","TLSv1.2","166","Application Data"
"847","299.705991738","157.240.221.60","192.168.1.12","TCP","66","443  >  45474 [ACK] Seq=36017 Ack=16831 Win=484 Len=0 TSval=2016588228 TSecr=2064326371"
"848","299.725034816","157.240.221.60","192.168.1.12","TCP","66","443  >  45474 [ACK] Seq=36017 Ack=16931 Win=484 Len=0 TSval=2016588249 TSecr=2064326392"
"849","300.377197921","192.168.1.12","157.240.221.60","TLSv1.2","162","Application Data"
"850","300.451895873","157.240.221.60","192.168.1.12","TCP","66","443  >  45474 [ACK] Seq=36017 Ack=17027 Win=484 Len=0 TSval=2016588977 TSecr=2064327121"
"857","305.240970486","192.168.1.12","20.229.111.167","TCP","54","[TCP Keep-Alive] 41890  >  443 [ACK] Seq=1526 Ack=14013 Win=64128 Len=0"
"858","305.323998285","20.229.111.167","192.168.1.12","TCP","60","[TCP Keep-Alive ACK] 443  >  41890 [ACK] Seq=14013 Ack=1527 Win=525312 Len=0"
"873","307.712909206","157.240.221.60","192.168.1.12","TLSv1.2","136","Application Data"
"874","307.761008114","192.168.1.12","157.240.221.60","TCP","66","45474  >  443 [ACK] Seq=17027 Ack=36087 Win=1015 Len=0 TSval=2064334505 TSecr=2016596216"
"896","310.694810448","157.240.221.60","192.168.1.12","TCP","1446","443  >  45474 [ACK] Seq=36087 Ack=17027 Win=484 Len=1380 TSval=2016599128 TSecr=2064334505 [TCP segment of a reassembled PDU]"
"899","310.694856502","192.168.1.12","157.240.221.60","TCP","66","45474  >  443 [ACK] Seq=17027 Ack=37467 Win=1005 Len=0 TSval=2064337439 TSecr=2016599128"
"900","310.695032289","157.240.221.60","192.168.1.12","TLSv1.2","384","Application Data, Application Data"
"901","310.695064373","192.168.1.12","157.240.221.60","TCP","66","45474  >  443 [ACK] Seq=17027 Ack=37785 Win=1003 Len=0 TSval=2064337439 TSecr=2016599128"
"902","310.705711756","192.168.1.12","157.240.221.60","TLSv1.2","135","Application Data"
"903","310.784197285","157.240.221.60","192.168.1.12","TCP","66","443  >  45474 [ACK] Seq=37785 Ack=17096 Win=484 Len=0 TSval=2016599308 TSecr=2064337450"
"904","310.991129813","157.240.221.60","192.168.1.12","TLSv1.2","137","Application Data"
"905","311.033024127","192.168.1.12","157.240.221.60","TCP","66","45474  >  443 [ACK] Seq=17096 Ack=37856 Win=1015 Len=0 TSval=2064337777 TSecr=2016599422"
"906","311.140388483","192.168.1.12","157.240.221.60","TLSv1.2","159","Application Data"
"907","311.217881411","157.240.221.60","192.168.1.12","TCP","66","443  >  45474 [ACK] Seq=37856 Ack=17189 Win=484 Len=0 TSval=2016599742 TSecr=2064337885"
"918","314.369130482","157.240.221.60","192.168.1.12","TLSv1.2","159","Application Data"
"919","314.369173225","192.168.1.12","157.240.221.60","TCP","66","45474  >  443 [ACK] Seq=17189 Ack=37949 Win=1015 Len=0 TSval=2064341113 TSecr=2016602858"
"920","314.373728078","192.168.1.12","157.240.221.60","TLSv1.2","158","Application Data"
"921","314.461273079","157.240.221.60","192.168.1.12","TCP","66","443  >  45474 [ACK] Seq=37949 Ack=17281 Win=484 Len=0 TSval=2016602976 TSecr=2064341118"
"922","315.495615744","157.240.221.60","192.168.1.12","TLSv1.2","290","Application Data"
"923","315.536966161","192.168.1.12","157.240.221.60","TCP","66","45474  >  443 [ACK] Seq=17281 Ack=38173 Win=1015 Len=0 TSval=2064342281 TSecr=2016603952"
"926","315.949102358","192.168.1.12","157.240.221.60","TLSv1.2","139","Application Data"
"927","316.024912452","157.240.221.60","192.168.1.12","TCP","66","443  >  45474 [ACK] Seq=38173 Ack=17354 Win=484 Len=0 TSval=2016604549 TSecr=2064342693"
"928","317.424902537","192.168.1.12","140.82.113.26","TCP","66","[TCP Keep-Alive] 48184  >  443 [ACK] Seq=151 Ack=131 Win=501 Len=0 TSval=3822501447 TSecr=1909745934"
"929","317.650664533","140.82.113.26","192.168.1.12","TCP","66","[TCP Keep-Alive ACK] 443  >  48184 [ACK] Seq=131 Ack=152 Win=70 Len=0 TSval=1909791385 TSecr=3822455997"
"934","321.520952066","192.168.1.12","20.199.120.151","TCP","54","[TCP Keep-Alive] 49448  >  443 [ACK] Seq=1811 Ack=6818 Win=64128 Len=0"
"935","321.552975047","2a00:a041:3c5d:4d00:605e:f34d:a502:2044","2620:1ec:12::239","TCP","74","[TCP Keep-Alive] 49552  >  443 [ACK] Seq=1655 Ack=7265 Win=64128 Len=0"
"936","321.606706952","20.199.120.151","192.168.1.12","TCP","60","[TCP Keep-Alive ACK] 443  >  49448 [ACK] Seq=6818 Ack=1812 Win=7969 Len=0"
"937","321.632979461","2620:1ec:12::239","2a00:a041:3c5d:4d00:605e:f34d:a502:2044","TCP","74","[TCP Keep-Alive ACK] 443  >  49552 [ACK] Seq=7265 Ack=1656 Win=4194560 Len=0"
"948","331.982174977","140.82.113.26","192.168.1.12","TLSv1.2","92","Application Data"
"949","331.982417011","192.168.1.12","140.82.113.26","TLSv1.2","96","Application Data"
"950","332.188928538","140.82.113.26","192.168.1.12","TCP","66","443  >  48184 [ACK] Seq=157 Ack=182 Win=70 Len=0 TSval=1909805936 TSecr=3822516005"
"951","332.817430223","192.168.1.12","157.240.221.60","TLSv1.2","135","Application Data"
"952","332.904495308","157.240.221.60","192.168.1.12","TCP","66","443  >  45474 [ACK] Seq=38173 Ack=17423 Win=484 Len=0 TSval=2016621428 TSecr=2064359562"
"953","333.108243119","157.240.221.60","192.168.1.12","TLSv1.2","137","Application Data"
"954","333.108282990","192.168.1.12","157.240.221.60","TCP","66","45474  >  443 [ACK] Seq=17423 Ack=38244 Win=1015 Len=0 TSval=2064359853 TSecr=2016621542"
"955","333.808969404","192.168.1.12","13.69.116.104","TCP","54","[TCP Keep-Alive] 41750  >  443 [ACK] Seq=8866 Ack=6958 Win=64128 Len=0"
"956","333.892173151","13.69.116.104","192.168.1.12","TCP","60","[TCP Keep-Alive ACK] 443  >  41750 [ACK] Seq=6958 Ack=8867 Win=525312 Len=0"
"957","334.512960578","192.168.1.12","51.132.193.105","TCP","54","[TCP Keep-Alive] 55964  >  443 [ACK] Seq=32374 Ack=7288 Win=64128 Len=0"
"958","334.601647088","51.132.193.105","192.168.1.12","TCP","60","[TCP Keep-Alive ACK] 443  >  55964 [ACK] Seq=7288 Ack=32375 Win=524544 Len=0"
"959","335.889038611","2a00:a041:3c5d:4d00:605e:f34d:a502:2044","2620:1ec:12::239","TCP","74","[TCP Keep-Alive] 32808  >  443 [ACK] Seq=5112 Ack=8623 Win=64128 Len=0"
"960","335.963223602","2620:1ec:12::239","2a00:a041:3c5d:4d00:605e:f34d:a502:2044","TCP","74","[TCP Keep-Alive ACK] 443  >  32808 [ACK] Seq=8623 Ack=5113 Win=4194560 Len=0"
