"No.","Time","Source","Destination","Protocol","Length","Info"
"1","0.000000000","192.168.1.18","224.0.0.251","MDNS","101","Standard query 0x0000 SRV Roku 3   1GJ37V014681._airplay._tcp.local, ""QU"" question"
"2","0.000000221","192.168.1.18","224.0.0.251","MDNS","182","Standard query response 0x0000 SRV, cache flush 0 0 7000 1GJ37V014681.local A, cache flush 192.168.1.18 NSEC, cache flush Roku 3   1GJ37V014681._airplay._tcp.local NSEC, cache flush 1GJ37V014681.local"
"3","2.557890207","192.168.1.10","224.0.0.251","MDNS","91","Standard query 0x0000 PTR _raop._tcp.local, ""QU"" question PTR _airplay._tcp.local, ""QU"" question"
"4","4.400858355","157.240.221.60","192.168.1.12","TLSv1.2","433","Application Data"
"5","4.444964934","192.168.1.12","157.240.221.60","TCP","66","45474  >  443 [ACK] Seq=1 Ack=368 Win=1015 Len=0 TSval=2064031189 TSecr=2016292866"
"6","5.030027882","192.168.1.12","157.240.221.60","TLSv1.2","165","Application Data"
"7","5.109089693","157.240.221.60","192.168.1.12","TCP","66","443  >  45474 [ACK] Seq=368 Ack=100 Win=376 Len=0 TSval=2016293633 TSecr=2064031774"
"8","6.039570073","157.240.221.60","192.168.1.12","TCP","1446","443  >  45474 [ACK] Seq=368 Ack=100 Win=376 Len=1380 TSval=2016294472 TSecr=2064031774 [TCP segment of a reassembled PDU]"
"9","6.039616142","192.168.1.12","157.240.221.60","TCP","66","45474  >  443 [ACK] Seq=100 Ack=1748 Win=1005 Len=0 TSval=2064032784 TSecr=2016294472"
"10","6.040853891","157.240.221.60","192.168.1.12","TLSv1.2","199","Application Data"
"11","6.040853969","157.240.221.60","192.168.1.12","TLSv1.2","2826","Application Data"
"12","6.040854030","157.240.221.60","192.168.1.12","TLSv1.2","73","Application Data"
"13","6.040884197","192.168.1.12","157.240.221.60","TCP","66","45474  >  443 [ACK] Seq=100 Ack=1881 Win=1004 Len=0 TSval=2064032785 TSecr=2016294472"
"14","6.040899099","192.168.1.12","157.240.221.60","TCP","66","45474  >  443 [ACK] Seq=100 Ack=4641 Win=983 Len=0 TSval=2064032785 TSecr=2016294478"
"15","6.040904546","192.168.1.12","157.240.221.60","TCP","66","45474  >  443 [ACK] Seq=100 Ack=4648 Win=983 Len=0 TSval=2064032785 TSecr=2016294481"
"16","6.128970873","192.168.1.12","20.254.144.98","TCP","54","43880  >  443 [ACK] Seq=1 Ack=1 Win=501 Len=0"
"17","6.221329838","20.254.144.98","192.168.1.12","TCP","60","[TCP ACKed unseen segment] 443  >  43880 [ACK] Seq=1 Ack=2 Win=2052 Len=0"
"18","6.318624950","192.168.1.12","157.240.221.60","TLSv1.2","159","Application Data"
"19","6.394313869","157.240.221.60","192.168.1.12","TCP","66","443  >  45474 [ACK] Seq=4648 Ack=193 Win=376 Len=0 TSval=2016294917 TSecr=2064033063"
"20","6.405550665","157.240.221.60","192.168.1.12","TLSv1.2","972","Application Data"
"21","6.405586130","192.168.1.12","157.240.221.60","TCP","66","45474  >  443 [ACK] Seq=193 Ack=5554 Win=1008 Len=0 TSval=2064033150 TSecr=2016294929"
"22","6.765721463","192.168.1.12","157.240.221.60","TLSv1.2","162","Application Data"
"23","6.806043651","157.240.221.60","192.168.1.12","TLSv1.2","207","Application Data"
"24","6.806097289","192.168.1.12","157.240.221.60","TCP","66","45474  >  443 [ACK] Seq=289 Ack=5695 Win=1014 Len=0 TSval=2064033550 TSecr=2016295328"
"25","6.810567831","192.168.1.12","157.240.221.60","TLSv1.2","166","Application Data"
"26","6.887942247","157.240.221.60","192.168.1.12","TCP","66","443  >  45474 [ACK] Seq=5695 Ack=289 Win=376 Len=0 TSval=2016295411 TSecr=2064033510"
"27","6.904342176","157.240.221.60","192.168.1.12","TCP","66","443  >  45474 [ACK] Seq=5695 Ack=389 Win=376 Len=0 TSval=2016295428 TSecr=2064033555"
"28","7.576086081","fe80::e2ce:c3ff:fe1a:1978","ff02::1","ICMPv6","174","Router Advertisement from e0:ce:c3:1a:19:78"
"29","7.585095054","fe80::a8c:14f0:c17c:d903","ff02::16","ICMPv6","150","Multicast Listener Report Message v2"
"30","7.604986074","fe80::a8c:14f0:c17c:d903","ff02::16","ICMPv6","150","Multicast Listener Report Message v2"
"31","8.884707220","2a00:a041:3c5d:4d00:605e:f34d:a502:2044","2a00:a040:3:4:face:b00c:3333:7020","TLSv1.2","110","Application Data"
"32","8.884751082","2a00:a041:3c5d:4d00:605e:f34d:a502:2044","2a00:a040:3:4:face:b00c:3333:7020","TCP","86","44140  >  443 [FIN, ACK] Seq=25 Ack=1 Win=12296 Len=0 TSval=3910286285 TSecr=3133331536"
"33","8.906093010","2a00:a040:3:4:face:b00c:3333:7020","2a00:a041:3c5d:4d00:605e:f34d:a502:2044","TCP","98","443  >  44140 [ACK] Seq=1 Ack=1 Win=123 Len=0 TSval=3133391568 TSecr=3910226284 SLE=25 SRE=26"
"34","8.906625638","2a00:a040:3:4:face:b00c:3333:7020","2a00:a041:3c5d:4d00:605e:f34d:a502:2044","TCP","86","443  >  44140 [ACK] Seq=1 Ack=26 Win=123 Len=0 TSval=3133391568 TSecr=3910286285"
"35","8.906625820","2a00:a040:3:4:face:b00c:3333:7020","2a00:a041:3c5d:4d00:605e:f34d:a502:2044","TLSv1.2","110","Application Data"
"36","8.906671150","2a00:a041:3c5d:4d00:605e:f34d:a502:2044","2a00:a040:3:4:face:b00c:3333:7020","TCP","74","44140  >  443 [RST] Seq=26 Win=0 Len=0"
"37","8.906885452","2a00:a040:3:4:face:b00c:3333:7020","2a00:a041:3c5d:4d00:605e:f34d:a502:2044","TCP","86","443  >  44140 [FIN, ACK] Seq=25 Ack=26 Win=123 Len=0 TSval=3133391568 TSecr=3910286285"
"38","8.906902795","2a00:a041:3c5d:4d00:605e:f34d:a502:2044","2a00:a040:3:4:face:b00c:3333:7020","TCP","74","44140  >  443 [RST] Seq=26 Win=0 Len=0"
"39","10.032821113","157.240.221.60","192.168.1.12","TLSv1.2","161","Application Data"
"40","10.037839449","192.168.1.12","157.240.221.60","TLSv1.2","160","Application Data"
"41","10.114842350","157.240.221.60","192.168.1.12","TCP","66","443  >  45474 [ACK] Seq=5790 Ack=483 Win=376 Len=0 TSval=2016298638 TSecr=2064036782"
"42","12.593073695","192.168.1.10","224.0.0.251","MDNS","91","Standard query 0x0000 PTR _raop._tcp.local, ""QU"" question PTR _airplay._tcp.local, ""QU"" question"
"43","14.065087384","fe80::a8c:14f0:c17c:d903","fe80::e2ce:c3ff:fe1a:1978","ICMPv6","86","Neighbor Solicitation for fe80::e2ce:c3ff:fe1a:1978 from b0:7d:64:eb:49:20"
"44","14.069963227","fe80::e2ce:c3ff:fe1a:1978","fe80::a8c:14f0:c17c:d903","ICMPv6","78","Neighbor Advertisement fe80::e2ce:c3ff:fe1a:1978 (rtr, sol)"
"45","16.176843569","157.240.221.60","192.168.1.12","TCP","1446","443  >  45474 [ACK] Seq=5790 Ack=483 Win=376 Len=1380 TSval=2016304612 TSecr=2064036782 [TCP segment of a reassembled PDU]"
"46","16.177359683","157.240.221.60","192.168.1.12","TLSv1.2","402","Application Data, Application Data"
"47","16.177555166","192.168.1.12","157.240.221.60","TCP","66","45474  >  443 [ACK] Seq=483 Ack=7506 Win=1002 Len=0 TSval=2064042922 TSecr=2016304612"
"48","16.484642259","157.240.221.60","192.168.1.12","TLSv1.2","207","Application Data"
"49","16.487928836","192.168.1.12","157.240.221.60","TLSv1.2","166","Application Data"
"50","16.563576810","157.240.221.60","192.168.1.12","TCP","66","443  >  45474 [ACK] Seq=7647 Ack=583 Win=376 Len=0 TSval=2016305087 TSecr=2064043232"
"51","16.920404313","192.168.1.12","157.240.221.60","TLSv1.2","162","Application Data"
"52","17.008100780","157.240.221.60","192.168.1.12","TCP","66","443  >  45474 [ACK] Seq=7647 Ack=679 Win=376 Len=0 TSval=2016305533 TSecr=2064043665"
"53","17.137075632","192.168.1.12","140.82.113.26","TCP","66","48184  >  443 [ACK] Seq=1 Ack=1 Win=501 Len=0 TSval=3822201159 TSecr=1909445898"
"54","17.161604461","192.168.1.12","157.240.221.60","TLSv1.2","135","Application Data"
"55","17.239961853","157.240.221.60","192.168.1.12","TCP","66","443  >  45474 [ACK] Seq=7647 Ack=748 Win=376 Len=0 TSval=2016305764 TSecr=2064043906"
"56","17.288443583","140.82.113.26","192.168.1.12","TCP","66","[TCP ACKed unseen segment] 443  >  48184 [ACK] Seq=1 Ack=2 Win=70 Len=0 TSval=1909491104 TSecr=3822155955"
"57","17.361039149","157.240.221.60","192.168.1.12","TLSv1.2","137","Application Data"
"58","17.405095667","192.168.1.12","157.240.221.60","TCP","66","45474  >  443 [ACK] Seq=748 Ack=7718 Win=1015 Len=0 TSval=2064044149 TSecr=2016305879"
"59","18.429367405","fe80::e2ce:c3ff:fe1a:1978","fe80::a8c:14f0:c17c:d903","ICMPv6","86","Neighbor Solicitation for fe80::a8c:14f0:c17c:d903 from e0:ce:c3:1a:19:78"
"60","18.429400966","fe80::a8c:14f0:c17c:d903","fe80::e2ce:c3ff:fe1a:1978","ICMPv6","78","Neighbor Advertisement fe80::a8c:14f0:c17c:d903 (sol)"
"61","21.619509549","fe80::e2ce:c3ff:fe1a:1978","ff02::1","ICMPv6","174","Router Advertisement from e0:ce:c3:1a:19:78"
"62","21.632954979","fe80::a8c:14f0:c17c:d903","ff02::16","ICMPv6","150","Multicast Listener Report Message v2"
"63","22.096953290","fe80::a8c:14f0:c17c:d903","ff02::16","ICMPv6","150","Multicast Listener Report Message v2"
"64","22.526161401","192.168.1.10","224.0.0.251","MDNS","91","Standard query 0x0000 PTR _raop._tcp.local, ""QU"" question PTR _airplay._tcp.local, ""QU"" question"
"65","22.630745217","fe80::a8c:14f0:c17c:d903","ff02::2","ICMPv6","62","Router Solicitation"
"66","22.801093354","192.168.1.12","20.199.120.85","TCP","54","41676  >  443 [ACK] Seq=1 Ack=1 Win=501 Len=0"
"67","22.884988044","20.199.120.85","192.168.1.12","TCP","60","[TCP ACKed unseen segment] 443  >  41676 [ACK] Seq=1 Ack=2 Win=7969 Len=0"
"68","24.677055167","fe80::e2ce:c3ff:fe1a:1978","ff02::1","ICMPv6","174","Router Advertisement from e0:ce:c3:1a:19:78"
"69","24.689091987","fe80::a8c:14f0:c17c:d903","ff02::16","ICMPv6","150","Multicast Listener Report Message v2"
"70","25.684971908","fe80::a8c:14f0:c17c:d903","ff02::16","ICMPv6","150","Multicast Listener Report Message v2"
"71","31.030313470","157.240.221.60","192.168.1.12","TCP","1446","443  >  45474 [ACK] Seq=7718 Ack=748 Win=376 Len=1380 TSval=2016319452 TSecr=2064044149 [TCP segment of a reassembled PDU]"
"72","31.030356920","192.168.1.12","157.240.221.60","TCP","66","45474  >  443 [ACK] Seq=748 Ack=9098 Win=1005 Len=0 TSval=2064057775 TSecr=2016319452"
"73","31.030769367","157.240.221.60","192.168.1.12","TLSv1.2","402","Application Data, Application Data"
"74","31.030789436","192.168.1.12","157.240.221.60","TCP","66","45474  >  443 [ACK] Seq=748 Ack=9434 Win=1003 Len=0 TSval=2064057775 TSecr=2016319452"
"75","31.281842232","192.168.1.12","157.240.221.60","TLSv1.2","162","Application Data"
"76","31.283803794","157.240.221.60","192.168.1.12","TLSv1.2","207","Application Data"
"77","31.283827785","192.168.1.12","157.240.221.60","TCP","66","45474  >  443 [ACK] Seq=844 Ack=9575 Win=1014 Len=0 TSval=2064058028 TSecr=2016319799"
"78","31.360544612","157.240.221.60","192.168.1.12","TCP","66","443  >  45474 [ACK] Seq=9575 Ack=844 Win=376 Len=0 TSval=2016319885 TSecr=2064057775"
"79","31.425390523","192.168.1.12","157.240.221.60","TLSv1.2","166","Application Data"
"80","31.511566416","157.240.221.60","192.168.1.12","TCP","66","443  >  45474 [ACK] Seq=9575 Ack=944 Win=376 Len=0 TSval=2016320036 TSecr=2064058170"
"81","31.946125218","140.82.113.26","192.168.1.12","TLSv1.2","92","[TCP ACKed unseen segment] , Application Data"
"82","31.946333349","192.168.1.12","140.82.113.26","TLSv1.2","96","[TCP Previous segment not captured] , Application Data"
"83","32.150946328","140.82.113.26","192.168.1.12","TCP","66","[TCP ACKed unseen segment] 443  >  48184 [ACK] Seq=27 Ack=32 Win=70 Len=0 TSval=1909505916 TSecr=3822215969"
"84","32.561210256","192.168.1.10","224.0.0.251","MDNS","91","Standard query 0x0000 PTR _raop._tcp.local, ""QU"" question PTR _airplay._tcp.local, ""QU"" question"
"85","37.168820308","157.240.221.60","192.168.1.12","TLSv1.2","975","Application Data"
"86","37.168860743","192.168.1.12","157.240.221.60","TCP","66","45474  >  443 [ACK] Seq=944 Ack=10484 Win=1008 Len=0 TSval=2064063913 TSecr=2016325618"
"87","38.092205301","192.168.1.12","157.240.221.60","TLSv1.2","155","Application Data"
"88","38.169330346","157.240.221.60","192.168.1.12","TCP","66","443  >  45474 [ACK] Seq=10484 Ack=1033 Win=376 Len=0 TSval=2016326693 TSecr=2064064836"
"89","40.812231305","192.168.1.12","157.240.221.60","TLSv1.2","135","Application Data"
"90","40.899487633","157.240.221.60","192.168.1.12","TCP","66","443  >  45474 [ACK] Seq=10484 Ack=1102 Win=376 Len=0 TSval=2016329423 TSecr=2064067557"
"91","41.059962415","157.240.221.60","192.168.1.12","TLSv1.2","137","Application Data"
"92","41.059998281","192.168.1.12","157.240.221.60","TCP","66","45474  >  443 [ACK] Seq=1102 Ack=10555 Win=1015 Len=0 TSval=2064067804 TSecr=2016329537"
"93","41.473696715","192.168.1.12","157.240.221.60","TCP","1446","45474  >  443 [ACK] Seq=1102 Ack=10555 Win=1015 Len=1380 TSval=2064068218 TSecr=2016329537 [TCP segment of a reassembled PDU]"
"94","41.473723189","192.168.1.12","157.240.221.60","TCP","1446","45474  >  443 [ACK] Seq=2482 Ack=10555 Win=1015 Len=1380 TSval=2064068218 TSecr=2016329537 [TCP segment of a reassembled PDU]"
"95","41.477673839","192.168.1.12","157.240.221.60","TCP","1446","45474  >  443 [ACK] Seq=3862 Ack=10555 Win=1015 Len=1380 TSval=2064068222 TSecr=2016329537 [TCP segment of a reassembled PDU]"
"96","41.555228931","157.240.221.60","192.168.1.12","TCP","66","443  >  45474 [ACK] Seq=10555 Ack=2482 Win=387 Len=0 TSval=2016330078 TSecr=2064068218"
"97","41.555271352","192.168.1.12","157.240.221.60","TCP","1446","45474  >  443 [ACK] Seq=5242 Ack=10555 Win=1015 Len=1380 TSval=2064068300 TSecr=2016330078 [TCP segment of a reassembled PDU]"
"98","41.562908049","157.240.221.60","192.168.1.12","TCP","66","443  >  45474 [ACK] Seq=10555 Ack=3862 Win=397 Len=0 TSval=2016330086 TSecr=2064068218"
"99","41.562951205","192.168.1.12","157.240.221.60","TCP","1446","45474  >  443 [ACK] Seq=6622 Ack=10555 Win=1015 Len=1380 TSval=2064068307 TSecr=2016330086 [TCP segment of a reassembled PDU]"
"100","41.564932522","157.240.221.60","192.168.1.12","TCP","66","443  >  45474 [ACK] Seq=10555 Ack=5242 Win=408 Len=0 TSval=2016330086 TSecr=2064068222"
"101","41.564940324","192.168.1.12","157.240.221.60","TCP","1446","45474  >  443 [ACK] Seq=8002 Ack=10555 Win=1015 Len=1380 TSval=2064068309 TSecr=2016330086 [TCP segment of a reassembled PDU]"
"102","41.637850042","157.240.221.60","192.168.1.12","TCP","66","443  >  45474 [ACK] Seq=10555 Ack=6622 Win=419 Len=0 TSval=2016330161 TSecr=2064068300"
"103","41.637893104","192.168.1.12","157.240.221.60","TCP","1446","45474  >  443 [ACK] Seq=9382 Ack=10555 Win=1015 Len=1380 TSval=2064068382 TSecr=2016330161 [TCP segment of a reassembled PDU]"
"104","41.705554914","157.240.221.60","192.168.1.12","TCP","66","443  >  45474 [ACK] Seq=10555 Ack=8002 Win=430 Len=0 TSval=2016330229 TSecr=2064068307"
"105","41.705600762","192.168.1.12","157.240.221.60","TCP","1446","45474  >  443 [ACK] Seq=10762 Ack=10555 Win=1015 Len=1380 TSval=2064068450 TSecr=2016330229 [TCP segment of a reassembled PDU]"
"106","41.713181758","157.240.221.60","192.168.1.12","TCP","66","443  >  45474 [ACK] Seq=10555 Ack=9382 Win=441 Len=0 TSval=2016330237 TSecr=2064068309"
"107","41.713212622","192.168.1.12","157.240.221.60","TLSv1.2","1112","Application Data"
"108","41.719808252","157.240.221.60","192.168.1.12","TCP","66","443  >  45474 [ACK] Seq=10555 Ack=10762 Win=451 Len=0 TSval=2016330243 TSecr=2064068382"
"109","41.784606748","157.240.221.60","192.168.1.12","TCP","66","443  >  45474 [ACK] Seq=10555 Ack=12142 Win=462 Len=0 TSval=2016330307 TSecr=2064068450"
"110","41.792513356","157.240.221.60","192.168.1.12","TCP","66","443  >  45474 [ACK] Seq=10555 Ack=13188 Win=473 Len=0 TSval=2016330315 TSecr=2064068457"
"111","41.981161650","157.240.221.60","192.168.1.12","TLSv1.2","129","Application Data"
"112","41.981199869","192.168.1.12","157.240.221.60","TCP","66","45474  >  443 [ACK] Seq=13188 Ack=10618 Win=1015 Len=0 TSval=2064068725 TSecr=2016330471"
"113","42.596513457","192.168.1.10","224.0.0.251","MDNS","91","Standard query 0x0000 PTR _raop._tcp.local, ""QU"" question PTR _airplay._tcp.local, ""QU"" question"
"114","43.518558352","157.240.221.60","192.168.1.12","TLSv1.2","371","Application Data"
"115","43.518612128","192.168.1.12","157.240.221.60","TCP","66","45474  >  443 [ACK] Seq=13188 Ack=10923 Win=1013 Len=0 TSval=2064070263 TSecr=2016332034"
"116","44.242451960","192.168.1.12","157.240.221.60","TLSv1.2","155","Application Data"
"117","44.321050951","157.240.221.60","192.168.1.12","TCP","66","443  >  45474 [ACK] Seq=10923 Ack=13277 Win=473 Len=0 TSval=2016332845 TSecr=2064070987"
"118","44.953144967","157.240.221.60","192.168.1.12","TCP","1446","443  >  45474 [ACK] Seq=10923 Ack=13277 Win=473 Len=1380 TSval=2016333414 TSecr=2064070987 [TCP segment of a reassembled PDU]"
"119","44.953200170","192.168.1.12","157.240.221.60","TCP","66","45474  >  443 [ACK] Seq=13277 Ack=12303 Win=1005 Len=0 TSval=2064071697 TSecr=2016333414"
"120","44.956065994","157.240.221.60","192.168.1.12","TLSv1.2","199","Application Data"
"121","44.956066233","157.240.221.60","192.168.1.12","TLSv1.2","2661","Application Data"
"122","44.956066280","157.240.221.60","192.168.1.12","TLSv1.2","1568","Application Data"
"123","44.956116661","192.168.1.12","157.240.221.60","TCP","66","45474  >  443 [ACK] Seq=13277 Ack=12436 Win=1004 Len=0 TSval=2064071700 TSecr=2016333414"
"124","44.956148188","192.168.1.12","157.240.221.60","TCP","66","45474  >  443 [ACK] Seq=13277 Ack=15031 Win=984 Len=0 TSval=2064071700 TSecr=2016333420"
"125","44.956154493","192.168.1.12","157.240.221.60","TCP","66","45474  >  443 [ACK] Seq=13277 Ack=16533 Win=973 Len=0 TSval=2064071700 TSecr=2016333431"
"126","45.156604769","192.168.1.12","157.240.221.60","TLSv1.2","162","Application Data"
"127","45.248312351","157.240.221.60","192.168.1.12","TCP","66","443  >  45474 [ACK] Seq=16533 Ack=13373 Win=473 Len=0 TSval=2016333773 TSecr=2064071901"
"128","45.272261911","157.240.221.60","192.168.1.12","TLSv1.2","207","Application Data"
"129","45.272297154","192.168.1.12","157.240.221.60","TCP","66","45474  >  443 [ACK] Seq=13373 Ack=16674 Win=1014 Len=0 TSval=2064072017 TSecr=2016333798"
"130","45.276128391","192.168.1.12","157.240.221.60","TLSv1.2","166","Application Data"
"131","45.462818384","157.240.221.60","192.168.1.12","TCP","66","443  >  45474 [ACK] Seq=16674 Ack=13473 Win=473 Len=0 TSval=2016333918 TSecr=2064072020"
"132","51.224980558","192.168.1.12","20.254.144.98","TCP","54","[TCP Dup ACK 16#1] 43880  >  443 [ACK] Seq=1 Ack=1 Win=501 Len=0"
"133","51.316345690","20.254.144.98","192.168.1.12","TCP","60","[TCP Dup ACK 17#1] [TCP ACKed unseen segment] 443  >  43880 [ACK] Seq=1 Ack=2 Win=2052 Len=0"
"134","52.529289960","192.168.1.10","224.0.0.251","MDNS","91","Standard query 0x0000 PTR _raop._tcp.local, ""QU"" question PTR _airplay._tcp.local, ""QU"" question"
"135","53.245507144","20.199.120.85","192.168.1.12","TCP","60","[TCP ACKed unseen segment] 443  >  41676 [FIN, ACK] Seq=1 Ack=2 Win=7969 Len=0"
"136","53.246330739","192.168.1.12","20.199.120.85","TCP","54","[TCP Previous segment not captured] 41676  >  443 [FIN, ACK] Seq=2 Ack=2 Win=501 Len=0"
"137","53.326831112","20.199.120.85","192.168.1.12","TCP","60","[TCP ACKed unseen segment] 443  >  41676 [ACK] Seq=2 Ack=3 Win=7969 Len=0"
"138","53.963598945","fe80::e2ce:c3ff:fe1a:1978","ff02::1","ICMPv6","174","Router Advertisement from e0:ce:c3:1a:19:78"
"139","53.976941892","fe80::a8c:14f0:c17c:d903","ff02::16","ICMPv6","150","Multicast Listener Report Message v2"
"140","54.255059245","192.168.1.12","213.57.2.5","DNS","93","Standard query 0xb597 AAAA client.wns.windows.com OPT"
"141","54.255192987","192.168.1.12","213.57.2.5","DNS","93","Standard query 0x9825 A client.wns.windows.com OPT"
"142","54.272125860","213.57.2.5","192.168.1.12","DNS","152","Standard query response 0x9825 A client.wns.windows.com CNAME wns.notify.trafficmanager.net A 20.199.120.151 OPT"
"143","54.272322205","213.57.2.5","192.168.1.12","DNS","194","Standard query response 0xb597 AAAA client.wns.windows.com CNAME wns.notify.trafficmanager.net SOA tm1.dns-tm.com OPT"
"144","54.272749660","192.168.1.12","213.57.2.5","DNS","100","Standard query 0xce5a AAAA wns.notify.trafficmanager.net OPT"
"145","54.291596156","213.57.2.5","192.168.1.12","DNS","161","Standard query response 0xce5a AAAA wns.notify.trafficmanager.net SOA tm1.dns-tm.com OPT"
"146","54.292208204","192.168.1.12","20.199.120.151","TCP","74","36606  >  443 [SYN] Seq=0 Win=64240 Len=0 MSS=1460 SACK_PERM=1 TSval=3898457417 TSecr=0 WS=128"
"147","54.410142569","20.199.120.151","192.168.1.12","TCP","66","443  >  36606 [SYN, ACK] Seq=0 Ack=1 Win=8192 Len=0 MSS=1440 WS=1 SACK_PERM=1"
"148","54.410206143","192.168.1.12","20.199.120.151","TCP","54","36606  >  443 [ACK] Seq=1 Ack=1 Win=64256 Len=0"
"149","54.410635747","192.168.1.12","20.199.120.151","TLSv1.2","571","Client Hello"
"150","54.493173209","20.199.120.151","192.168.1.12","TCP","1514","443  >  36606 [PSH, ACK] Seq=1 Ack=518 Win=7675 Len=1460 [TCP segment of a reassembled PDU]"
"151","54.493223152","192.168.1.12","20.199.120.151","TCP","54","36606  >  443 [ACK] Seq=518 Ack=1461 Win=63104 Len=0"
"152","54.494654886","20.199.120.151","192.168.1.12","TCP","1514","443  >  36606 [PSH, ACK] Seq=1461 Ack=518 Win=7675 Len=1460 [TCP segment of a reassembled PDU]"
"153","54.494673021","192.168.1.12","20.199.120.151","TCP","54","36606  >  443 [ACK] Seq=518 Ack=2921 Win=63104 Len=0"
"154","54.495943537","20.199.120.151","192.168.1.12","TCP","1514","443  >  36606 [PSH, ACK] Seq=2921 Ack=518 Win=7675 Len=1460 [TCP segment of a reassembled PDU]"
"155","54.495961430","192.168.1.12","20.199.120.151","TCP","54","36606  >  443 [ACK] Seq=518 Ack=4381 Win=63104 Len=0"
"156","54.497198140","20.199.120.151","192.168.1.12","TCP","1514","443  >  36606 [PSH, ACK] Seq=4381 Ack=518 Win=7675 Len=1460 [TCP segment of a reassembled PDU]"
"157","54.497216569","192.168.1.12","20.199.120.151","TCP","54","36606  >  443 [ACK] Seq=518 Ack=5841 Win=63104 Len=0"
"158","54.673098678","fe80::a8c:14f0:c17c:d903","ff02::16","ICMPv6","150","Multicast Listener Report Message v2"
"159","54.674920550","20.199.120.151","192.168.1.12","TLSv1.2","141","Server Hello, Certificate, Certificate Status, Server Key Exchange, Server Hello Done"
"160","54.674955243","192.168.1.12","20.199.120.151","TCP","54","36606  >  443 [ACK] Seq=518 Ack=5928 Win=64128 Len=0"
"161","54.678261428","192.168.1.12","20.199.120.151","TLSv1.2","212","Client Key Exchange, Change Cipher Spec, Encrypted Handshake Message"
"162","54.770712713","20.199.120.151","192.168.1.12","TCP","60","443  >  36606 [ACK] Seq=5928 Ack=676 Win=7517 Len=0"
"163","54.771251800","20.199.120.151","192.168.1.12","TLSv1.2","105","Change Cipher Spec, Encrypted Handshake Message"
"164","54.772526762","192.168.1.12","20.199.120.151","TLSv1.2","328","Application Data"
"165","54.853868021","20.199.120.151","192.168.1.12","TLSv1.2","335","Application Data"
"166","54.854755533","192.168.1.12","20.199.120.151","TLSv1.2","208","Application Data"
"167","54.945628828","20.199.120.151","192.168.1.12","TLSv1.2","157","Application Data"
"168","54.946400667","192.168.1.12","20.199.120.151","TLSv1.2","538","Application Data"
"169","55.088389525","20.199.120.151","192.168.1.12","TCP","60","443  >  36606 [ACK] Seq=6363 Ack=1588 Win=8192 Len=0"
"170","55.514327185","20.199.120.151","192.168.1.12","TLSv1.2","407","Application Data"
"171","55.515209300","192.168.1.12","20.199.120.151","TLSv1.2","277","Application Data"
"172","55.624820917","20.199.120.151","192.168.1.12","TLSv1.2","157","Application Data"
"173","55.665027480","192.168.1.12","20.199.120.151","TCP","54","36606  >  443 [ACK] Seq=1811 Ack=6819 Win=64128 Len=0"
"174","57.570643602","192.168.1.12","157.240.221.60","TLSv1.2","135","Application Data"
"175","57.692662903","157.240.221.60","192.168.1.12","TCP","66","443  >  45474 [ACK] Seq=16674 Ack=13542 Win=473 Len=0 TSval=2016346217 TSecr=2064084315"
"176","57.853554214","157.240.221.60","192.168.1.12","TLSv1.2","137","Application Data"
"177","57.896967654","192.168.1.12","157.240.221.60","TCP","66","45474  >  443 [ACK] Seq=13542 Ack=16745 Win=1015 Len=0 TSval=2064084641 TSecr=2016346330"
"178","62.564828520","192.168.1.10","224.0.0.251","MDNS","91","Standard query 0x0000 PTR _raop._tcp.local, ""QU"" question PTR _airplay._tcp.local, ""QU"" question"
"179","72.293263148","fe80::e2ce:c3ff:fe1a:1978","ff02::1","ICMPv6","174","Router Advertisement from e0:ce:c3:1a:19:78"
"180","72.304984422","fe80::a8c:14f0:c17c:d903","ff02::16","ICMPv6","150","Multicast Listener Report Message v2"
"181","72.497415547","192.168.1.10","224.0.0.251","MDNS","91","Standard query 0x0000 PTR _raop._tcp.local, ""QU"" question PTR _airplay._tcp.local, ""QU"" question"
"182","72.752976848","fe80::a8c:14f0:c17c:d903","ff02::16","ICMPv6","150","Multicast Listener Report Message v2"
"183","73.138379729","192.168.1.12","157.240.221.60","TLSv1.2","135","Application Data"
"184","73.221508067","157.240.221.60","192.168.1.12","TCP","66","443  >  45474 [ACK] Seq=16745 Ack=13611 Win=473 Len=0 TSval=2016361747 TSecr=2064099883"
"185","73.426872513","157.240.221.60","192.168.1.12","TLSv1.2","137","Application Data"
"186","73.426910376","192.168.1.12","157.240.221.60","TCP","66","45474  >  443 [ACK] Seq=13611 Ack=16816 Win=1015 Len=0 TSval=2064100171 TSecr=2016361861"
"187","77.296952731","192.168.1.12","140.82.113.26","TCP","66","[TCP Keep-Alive] 48184  >  443 [ACK] Seq=31 Ack=27 Win=501 Len=0 TSval=3822261319 TSecr=1909505916"
"188","77.514681735","140.82.113.26","192.168.1.12","TCP","66","[TCP Keep-Alive ACK] 443  >  48184 [ACK] Seq=27 Ack=32 Win=70 Len=0 TSval=1909551273 TSecr=3822215969"
"189","77.719491921","157.240.221.60","192.168.1.12","TLSv1.2","718","Application Data"
"190","77.719534292","192.168.1.12","157.240.221.60","TCP","66","45474  >  443 [ACK] Seq=13611 Ack=17468 Win=1010 Len=0 TSval=2064104464 TSecr=2016366124"
"191","79.533936305","192.168.1.12","157.240.221.60","TLSv1.2","159","Application Data"
"192","79.623907138","157.240.221.60","192.168.1.12","TCP","66","443  >  45474 [ACK] Seq=17468 Ack=13704 Win=473 Len=0 TSval=2016368136 TSecr=2064106278"
"193","79.669030179","192.168.1.1","224.0.0.1","IGMPv2","42","Membership Query, general"
"194","79.669030789","192.168.1.1","224.0.0.1","IGMPv3","46","Membership Query, general"
"195","79.669030844","fe80::e2ce:c3ff:fe1a:1978","ff02::1","ICMPv6","90","Multicast Listener Query"
"196","80.281399126","192.168.1.18","224.0.0.251","IGMPv2","60","Membership Report group 224.0.0.251"
"197","81.905090126","fe80::a8c:14f0:c17c:d903","ff02::16","ICMPv6","150","Multicast Listener Report Message v2"
"198","82.532757016","192.168.1.10","224.0.0.251","MDNS","91","Standard query 0x0000 PTR _raop._tcp.local, ""QU"" question PTR _airplay._tcp.local, ""QU"" question"
"199","85.092846197","157.240.221.60","192.168.1.12","TLSv1.2","159","Application Data"
"200","85.092897628","192.168.1.12","157.240.221.60","TCP","66","45474  >  443 [ACK] Seq=13704 Ack=17561 Win=1015 Len=0 TSval=2064111837 TSecr=2016373595"
"201","85.098617924","192.168.1.12","157.240.221.60","TLSv1.2","158","Application Data"
"202","85.172804813","157.240.221.60","192.168.1.12","TCP","66","443  >  45474 [ACK] Seq=17561 Ack=13796 Win=473 Len=0 TSval=2016373699 TSecr=2064111843"
"203","87.449915837","fe80::e2ce:c3ff:fe1a:1978","ff02::1","ICMPv6","174","Router Advertisement from e0:ce:c3:1a:19:78"
"204","87.449955104","20.254.144.98","192.168.1.12","TCP","60","[TCP ACKed unseen segment] 443  >  43880 [RST, ACK] Seq=1 Ack=2 Win=0 Len=0"
"205","87.461008949","fe80::a8c:14f0:c17c:d903","ff02::16","ICMPv6","150","Multicast Listener Report Message v2"
"206","88.401063133","fe80::a8c:14f0:c17c:d903","ff02::16","ICMPv6","150","Multicast Listener Report Message v2"
"207","91.953048362","140.82.113.26","192.168.1.12","TLSv1.2","92","Application Data"
"208","91.953316200","192.168.1.12","140.82.113.26","TLSv1.2","96","Application Data"
"209","92.157471626","140.82.113.26","192.168.1.12","TCP","66","443  >  48184 [ACK] Seq=53 Ack=62 Win=70 Len=0 TSval=1909565917 TSecr=3822275976"
"210","92.568021082","192.168.1.10","224.0.0.251","MDNS","91","Standard query 0x0000 PTR _raop._tcp.local, ""QU"" question PTR _airplay._tcp.local, ""QU"" question"
"211","92.633642531","fe80::a8c:14f0:c17c:d903","ff02::2","ICMPv6","62","Router Solicitation"
"212","93.183113240","fe80::e2ce:c3ff:fe1a:1978","ff02::1","ICMPv6","174","Router Advertisement from e0:ce:c3:1a:19:78"
"213","93.196953566","fe80::a8c:14f0:c17c:d903","ff02::16","ICMPv6","150","Multicast Listener Report Message v2"
"214","93.969048601","fe80::a8c:14f0:c17c:d903","ff02::16","ICMPv6","150","Multicast Listener Report Message v2"
"215","95.029411629","192.168.1.10","192.168.1.255","BROWSER","253","Local Master Announcement HOTBOX-DMS, Workstation, Server, Print Queue Server, Xenix Server, NT Workstation, NT Server, Master Browser, DFS server"
"216","95.029411957","192.168.1.10","192.168.1.255","BROWSER","253","Domain/Workgroup Announcement WORKGROUP, NT Workstation, Domain Enum"
"217","100.624946654","192.168.1.12","20.199.120.151","TCP","54","[TCP Keep-Alive] 36606  >  443 [ACK] Seq=1810 Ack=6819 Win=64128 Len=0"
"218","100.708608522","20.199.120.151","192.168.1.12","TCP","60","[TCP Keep-Alive ACK] 443  >  36606 [ACK] Seq=6819 Ack=1811 Win=7969 Len=0"
"219","100.767361789","192.168.1.12","157.240.221.60","TLSv1.2","135","Application Data"
"220","100.845134410","157.240.221.60","192.168.1.12","TCP","66","443  >  45474 [ACK] Seq=17561 Ack=13865 Win=473 Len=0 TSval=2016389369 TSecr=2064127512"
"221","101.069006775","157.240.221.60","192.168.1.12","TLSv1.2","137","Application Data"
"222","101.116897959","192.168.1.12","157.240.221.60","TCP","66","45474  >  443 [ACK] Seq=13865 Ack=17632 Win=1015 Len=0 TSval=2064127861 TSecr=2016389483"
"223","102.500770848","192.168.1.10","224.0.0.251","MDNS","91","Standard query 0x0000 PTR _raop._tcp.local, ""QU"" question PTR _airplay._tcp.local, ""QU"" question"
"224","111.872650953","192.168.1.12","239.255.255.250","SSDP","215","M-SEARCH * HTTP/1.1 "
"225","112.536328116","192.168.1.10","224.0.0.251","MDNS","91","Standard query 0x0000 PTR _raop._tcp.local, ""QU"" question PTR _airplay._tcp.local, ""QU"" question"
"226","112.740376088","192.168.1.18","192.168.1.12","SSDP","321","HTTP/1.1 200 OK "
"227","112.877862344","192.168.1.12","239.255.255.250","SSDP","215","M-SEARCH * HTTP/1.1 "
"228","113.149778056","192.168.1.18","192.168.1.12","SSDP","321","HTTP/1.1 200 OK "
"229","113.886943959","192.168.1.12","239.255.255.250","SSDP","215","M-SEARCH * HTTP/1.1 "
"230","114.418399624","192.168.1.18","192.168.1.12","SSDP","321","HTTP/1.1 200 OK "
"231","114.894350351","192.168.1.12","239.255.255.250","SSDP","215","M-SEARCH * HTTP/1.1 "
"232","115.402920213","192.168.1.18","192.168.1.12","SSDP","321","HTTP/1.1 200 OK "
"233","117.758010536","Roku_83:14:62","IntelCor_eb:49:20","ARP","60","Who has 192.168.1.12? Tell 192.168.1.18"
"234","117.758028157","IntelCor_eb:49:20","Roku_83:14:62","ARP","42","192.168.1.12 is at b0:7d:64:eb:49:20"
"235","120.932438071","157.240.221.60","192.168.1.12","TLSv1.2","154","Application Data"
"236","120.932482097","192.168.1.12","157.240.221.60","TCP","66","45474  >  443 [ACK] Seq=13865 Ack=17720 Win=1015 Len=0 TSval=2064147677 TSecr=2016409396"
"237","121.141972818","192.168.1.12","157.240.221.60","TLSv1.2","135","Application Data"
"238","121.218851951","157.240.221.60","192.168.1.12","TCP","66","443  >  45474 [ACK] Seq=17720 Ack=13934 Win=473 Len=0 TSval=2016409743 TSecr=2064147886"
"239","121.341746610","157.240.221.60","192.168.1.12","TLSv1.2","137","Application Data"
"240","121.341791725","192.168.1.12","157.240.221.60","TCP","66","45474  >  443 [ACK] Seq=13934 Ack=17791 Win=1015 Len=0 TSval=2064148086 TSecr=2016409857"
"241","121.933293717","192.168.1.12","157.240.221.60","TLSv1.2","138","Application Data"
"242","122.019920668","157.240.221.60","192.168.1.12","TCP","66","443  >  45474 [ACK] Seq=17791 Ack=14006 Win=473 Len=0 TSval=2016410544 TSecr=2064148678"
"243","122.571209009","192.168.1.10","224.0.0.251","MDNS","91","Standard query 0x0000 PTR _raop._tcp.local, ""QU"" question PTR _airplay._tcp.local, ""QU"" question"
"244","124.414069569","157.240.221.60","192.168.1.12","TLSv1.2","160","Application Data"
"245","124.414110905","192.168.1.12","157.240.221.60","TCP","66","45474  >  443 [ACK] Seq=14006 Ack=17885 Win=1015 Len=0 TSval=2064151158 TSecr=2016412922"
"246","125.851551573","192.168.1.12","157.240.221.60","TLSv1.2","139","Application Data"
"247","125.855503840","157.240.221.60","192.168.1.12","TCP","1446","443  >  45474 [ACK] Seq=17885 Ack=14006 Win=473 Len=1380 TSval=2016414378 TSecr=2064151158 [TCP segment of a reassembled PDU]"
"248","125.855538812","192.168.1.12","157.240.221.60","TCP","66","45474  >  443 [ACK] Seq=14079 Ack=19265 Win=1005 Len=0 TSval=2064152600 TSecr=2016414378"
"249","125.856202916","157.240.221.60","192.168.1.12","TLSv1.2","400","Application Data, Application Data"
"250","125.856208426","192.168.1.12","157.240.221.60","TCP","66","45474  >  443 [ACK] Seq=14079 Ack=19599 Win=1003 Len=0 TSval=2064152600 TSecr=2016414378"
"251","125.932301251","157.240.221.60","192.168.1.12","TCP","66","443  >  45474 [ACK] Seq=19599 Ack=14079 Win=473 Len=0 TSval=2016414455 TSecr=2064151158"
"252","126.253478362","192.168.1.12","157.240.221.60","TLSv1.2","159","Application Data"
"253","126.331879723","157.240.221.60","192.168.1.12","TCP","66","443  >  45474 [ACK] Seq=19599 Ack=14172 Win=473 Len=0 TSval=2016414856 TSecr=2064152998"
"254","128.818575590","fe80::e2ce:c3ff:fe1a:1978","ff02::1","ICMPv6","174","Router Advertisement from e0:ce:c3:1a:19:78"
"255","128.829075755","fe80::a8c:14f0:c17c:d903","ff02::16","ICMPv6","150","Multicast Listener Report Message v2"
"256","129.201224176","fe80::a8c:14f0:c17c:d903","ff02::16","ICMPv6","150","Multicast Listener Report Message v2"
"257","129.547827365","157.240.221.60","192.168.1.12","TLSv1.2","159","Application Data"
"258","129.547869879","192.168.1.12","157.240.221.60","TCP","66","45474  >  443 [ACK] Seq=14172 Ack=19692 Win=1015 Len=0 TSval=2064156292 TSecr=2016417972"
"259","129.552344547","192.168.1.12","157.240.221.60","TLSv1.2","158","Application Data"
"260","129.629059439","157.240.221.60","192.168.1.12","TCP","66","443  >  45474 [ACK] Seq=19692 Ack=14264 Win=473 Len=0 TSval=2016418153 TSecr=2064156297"
"261","130.865261393","20.199.120.151","192.168.1.12","TCP","60","443  >  36606 [FIN, ACK] Seq=6819 Ack=1811 Win=7969 Len=0"
"262","130.866002271","192.168.1.12","20.199.120.151","TCP","54","36606  >  443 [FIN, ACK] Seq=1811 Ack=6820 Win=64128 Len=0"
"263","130.945407751","20.199.120.151","192.168.1.12","TCP","60","443  >  36606 [ACK] Seq=6820 Ack=1812 Win=7969 Len=0"
"264","131.872329207","192.168.1.12","20.199.120.151","TCP","74","54962  >  443 [SYN] Seq=0 Win=64240 Len=0 MSS=1460 SACK_PERM=1 TSval=3898534998 TSecr=0 WS=128"
"265","131.964703339","157.240.221.60","192.168.1.12","TLSv1.2","214","Application Data"
"266","131.964704019","20.199.120.151","192.168.1.12","TCP","66","443  >  54962 [SYN, ACK] Seq=0 Ack=1 Win=8192 Len=0 MSS=1440 WS=1 SACK_PERM=1"
"267","131.964758238","192.168.1.12","20.199.120.151","TCP","54","54962  >  443 [ACK] Seq=1 Ack=1 Win=64256 Len=0"
"268","131.965364167","192.168.1.12","20.199.120.151","TLSv1.2","571","Client Hello"
"269","131.968517797","192.168.1.12","157.240.221.60","TLSv1.2","146","Application Data"
"270","132.046328142","157.240.221.60","192.168.1.12","TCP","66","443  >  45474 [ACK] Seq=19840 Ack=14344 Win=473 Len=0 TSval=2016420570 TSecr=2064158713"
"271","132.052431556","20.199.120.151","192.168.1.12","TCP","1514","443  >  54962 [PSH, ACK] Seq=1 Ack=518 Win=7675 Len=1460 [TCP segment of a reassembled PDU]"
"272","132.052473218","192.168.1.12","20.199.120.151","TCP","54","54962  >  443 [ACK] Seq=518 Ack=1461 Win=63104 Len=0"
"273","132.053288048","20.199.120.151","192.168.1.12","TCP","1514","443  >  54962 [PSH, ACK] Seq=1461 Ack=518 Win=7675 Len=1460 [TCP segment of a reassembled PDU]"
"274","132.053298139","192.168.1.12","20.199.120.151","TCP","54","54962  >  443 [ACK] Seq=518 Ack=2921 Win=63104 Len=0"
"275","132.057776535","20.199.120.151","192.168.1.12","TCP","1514","443  >  54962 [PSH, ACK] Seq=2921 Ack=518 Win=7675 Len=1460 [TCP segment of a reassembled PDU]"
"276","132.057788370","192.168.1.12","20.199.120.151","TCP","54","54962  >  443 [ACK] Seq=518 Ack=4381 Win=63104 Len=0"
"277","132.058578969","20.199.120.151","192.168.1.12","TCP","1514","443  >  54962 [PSH, ACK] Seq=4381 Ack=518 Win=7675 Len=1460 [TCP segment of a reassembled PDU]"
"278","132.058588237","192.168.1.12","20.199.120.151","TCP","54","54962  >  443 [ACK] Seq=518 Ack=5841 Win=63104 Len=0"
"279","132.133215666","20.199.120.151","192.168.1.12","TLSv1.2","141","Server Hello, Certificate, Certificate Status, Server Key Exchange, Server Hello Done"
"280","132.133250899","192.168.1.12","20.199.120.151","TCP","54","54962  >  443 [ACK] Seq=518 Ack=5928 Win=64128 Len=0"
"281","132.136522854","192.168.1.12","20.199.120.151","TLSv1.2","212","Client Key Exchange, Change Cipher Spec, Encrypted Handshake Message"
"282","132.231272830","20.199.120.151","192.168.1.12","TLSv1.2","105","Change Cipher Spec, Encrypted Handshake Message"
"283","132.232933010","192.168.1.12","20.199.120.151","TLSv1.2","329","Application Data"
"284","132.316718330","20.199.120.151","192.168.1.12","TLSv1.2","337","Application Data"
"285","132.317709153","192.168.1.12","20.199.120.151","TLSv1.2","208","Application Data"
"286","132.401023004","20.199.120.151","192.168.1.12","TLSv1.2","157","Application Data"
"287","132.402272328","192.168.1.12","20.199.120.151","TLSv1.2","538","Application Data"
"288","132.505845540","192.168.1.10","224.0.0.251","MDNS","91","Standard query 0x0000 PTR _raop._tcp.local, ""QU"" question PTR _airplay._tcp.local, ""QU"" question"
"289","132.605629986","20.199.120.151","192.168.1.12","TCP","60","443  >  54962 [ACK] Seq=6365 Ack=1589 Win=8192 Len=0"
"290","132.913194428","20.199.120.151","192.168.1.12","TLSv1.2","407","Application Data"
"291","132.913927904","192.168.1.12","20.199.120.151","TLSv1.2","277","Application Data"
"292","132.991917217","20.199.120.151","192.168.1.12","TLSv1.2","157","Application Data"
"293","133.033028890","192.168.1.12","20.199.120.151","TCP","54","54962  >  443 [ACK] Seq=1812 Ack=6821 Win=64128 Len=0"
"294","137.200987273","192.168.1.12","140.82.113.26","TCP","66","[TCP Keep-Alive] 48184  >  443 [ACK] Seq=61 Ack=53 Win=501 Len=0 TSval=3822321223 TSecr=1909565917"
"295","137.418718807","140.82.113.26","192.168.1.12","TCP","66","[TCP Keep-Alive ACK] 443  >  48184 [ACK] Seq=53 Ack=62 Win=70 Len=0 TSval=1909611165 TSecr=3822275976"
"296","138.385552075","192.168.1.12","157.240.221.60","TLSv1.2","135","Application Data"
"297","138.462105838","157.240.221.60","192.168.1.12","TCP","66","443  >  45474 [ACK] Seq=19840 Ack=14413 Win=473 Len=0 TSval=2016426987 TSecr=2064165130"
"298","138.647569239","157.240.221.60","192.168.1.12","TLSv1.2","137","Application Data"
"299","138.689100444","192.168.1.12","157.240.221.60","TCP","66","45474  >  443 [ACK] Seq=14413 Ack=19911 Win=1015 Len=0 TSval=2064165433 TSecr=2016427100"
"300","139.262216216","157.240.221.60","192.168.1.12","TLSv1.2","346","Application Data"
"301","139.262263095","192.168.1.12","157.240.221.60","TCP","66","45474  >  443 [ACK] Seq=14413 Ack=20191 Win=1013 Len=0 TSval=2064166007 TSecr=2016427680"
"302","139.672253812","157.240.221.60","192.168.1.12","TLSv1.2","145","Application Data"
"303","139.672302465","192.168.1.12","157.240.221.60","TCP","66","45474  >  443 [ACK] Seq=14413 Ack=20270 Win=1013 Len=0 TSval=2064166417 TSecr=2016428105"
"304","139.676300254","192.168.1.12","157.240.221.60","TLSv1.2","143","Application Data"
"305","139.752465135","157.240.221.60","192.168.1.12","TCP","66","443  >  45474 [ACK] Seq=20270 Ack=14490 Win=473 Len=0 TSval=2016428277 TSecr=2064166421"
"306","139.752532565","157.240.221.60","192.168.1.12","TCP","66","[TCP Dup ACK 305#1] 443  >  45474 [ACK] Seq=20270 Ack=14490 Win=473 Len=0 TSval=2016428277 TSecr=2064166421"
"307","140.738773030","192.168.1.12","157.240.221.60","TLSv1.2","155","Application Data"
"308","140.813134626","157.240.221.60","192.168.1.12","TCP","66","443  >  45474 [ACK] Seq=20270 Ack=14579 Win=473 Len=0 TSval=2016429339 TSecr=2064167483"
