"No.","Time","Source","Destination","Protocol","Length","Info"
"1","0.000000000","2a00:a041:3c5d:4d00:424b:6377:a930:43d","2a03:2880:f258:1c3:face:b00c:0:167","TLSv1.2","154","Application Data"
"2","0.079472561","2a03:2880:f258:1c3:face:b00c:0:167","2a00:a041:3c5d:4d00:424b:6377:a930:43d","TCP","88","443  >  41660 [ACK] Seq=1 Ack=67 Win=959 Len=0 TSval=3183237170 TSecr=2768187795"
"3","0.125329194","2a00:a041:3c5d:4d00:424b:6377:a930:43d","2a03:2880:f258:1c3:face:b00c:0:167","TLSv1.2","158","Application Data"
"4","0.198779993","2a03:2880:f258:1c3:face:b00c:0:167","2a00:a041:3c5d:4d00:424b:6377:a930:43d","TCP","88","443  >  41660 [ACK] Seq=1 Ack=137 Win=959 Len=0 TSval=3183237293 TSecr=2768187921"
"5","0.280410150","2a03:2880:f258:1c3:face:b00c:0:167","2a00:a041:3c5d:4d00:424b:6377:a930:43d","TLSv1.2","160","Application Data"
"6","0.323379125","2a00:a041:3c5d:4d00:424b:6377:a930:43d","2a03:2880:f258:1c3:face:b00c:0:167","TCP","88","41660  >  443 [ACK] Seq=137 Ack=73 Win=1193 Len=0 TSval=2768188119 TSecr=3183237373"
"8","8.083653281","2a03:2880:f258:1c3:face:b00c:0:167","2a00:a041:3c5d:4d00:424b:6377:a930:43d","TLSv1.2","902","Application Data"
"9","8.083729333","2a00:a041:3c5d:4d00:424b:6377:a930:43d","2a03:2880:f258:1c3:face:b00c:0:167","TCP","88","41660  >  443 [ACK] Seq=137 Ack=887 Win=1187 Len=0 TSval=2768195879 TSecr=3183245120"
"10","8.309885580","2a00:a041:3c5d:4d00:424b:6377:a930:43d","2a03:2880:f258:1c3:face:b00c:0:167","TLSv1.2","181","Application Data"
"11","8.377651676","2a03:2880:f258:1c3:face:b00c:0:167","2a00:a041:3c5d:4d00:424b:6377:a930:43d","TLSv1.2","181","Application Data"
"12","8.377677481","2a00:a041:3c5d:4d00:424b:6377:a930:43d","2a03:2880:f258:1c3:face:b00c:0:167","TCP","88","41660  >  443 [ACK] Seq=230 Ack=980 Win=1193 Len=0 TSval=2768196173 TSecr=3183245471"
"13","8.381182997","2a00:a041:3c5d:4d00:424b:6377:a930:43d","2a03:2880:f258:1c3:face:b00c:0:167","TLSv1.2","180","Application Data"
"14","8.386612873","2a03:2880:f258:1c3:face:b00c:0:167","2a00:a041:3c5d:4d00:424b:6377:a930:43d","TCP","88","443  >  41660 [ACK] Seq=980 Ack=230 Win=959 Len=0 TSval=3183245480 TSecr=2768196105"
"15","8.456879412","2a03:2880:f258:1c3:face:b00c:0:167","2a00:a041:3c5d:4d00:424b:6377:a930:43d","TCP","88","443  >  41660 [ACK] Seq=980 Ack=322 Win=959 Len=0 TSval=3183245551 TSecr=2768196176"
"25","28.845755938","2a00:a041:3c5d:4d00:424b:6377:a930:43d","2a03:2880:f258:1c3:face:b00c:0:167","TLSv1.2","158","Application Data"
"26","28.926103940","2a03:2880:f258:1c3:face:b00c:0:167","2a00:a041:3c5d:4d00:424b:6377:a930:43d","TCP","88","443  >  41660 [ACK] Seq=980 Ack=392 Win=959 Len=0 TSval=3183266019 TSecr=2768216641"
"27","29.004879550","2a03:2880:f258:1c3:face:b00c:0:167","2a00:a041:3c5d:4d00:424b:6377:a930:43d","TLSv1.2","160","Application Data"
"28","29.047336623","2a00:a041:3c5d:4d00:424b:6377:a930:43d","2a03:2880:f258:1c3:face:b00c:0:167","TCP","88","41660  >  443 [ACK] Seq=392 Ack=1052 Win=1193 Len=0 TSval=2768216843 TSecr=3183266099"
"109","38.531310943","2a00:a041:3c5d:4d00:424b:6377:a930:43d","2600:9000:2024:9c00:3:db06:4200:93a1","TCP","96","33404  >  443 [SYN] Seq=0 Win=64800 Len=0 MSS=1440 SACK_PERM=1 TSval=1609992277 TSecr=0 WS=128"
"115","38.551827649","2600:9000:2024:9c00:3:db06:4200:93a1","2a00:a041:3c5d:4d00:424b:6377:a930:43d","TCP","96","443  >  33404 [SYN, ACK] Seq=0 Ack=1 Win=65535 Len=0 MSS=1220 SACK_PERM=1 TSval=2183981628 TSecr=1609992277 WS=512"
"116","38.551846926","2a00:a041:3c5d:4d00:424b:6377:a930:43d","2600:9000:2024:9c00:3:db06:4200:93a1","TCP","88","33404  >  443 [ACK] Seq=1 Ack=1 Win=64896 Len=0 TSval=1609992297 TSecr=2183981628"
"124","38.562393014","2a00:a041:3c5d:4d00:424b:6377:a930:43d","2620:2d:4000:1::3e","TCP","96","45538  >  443 [SYN] Seq=0 Win=64800 Len=0 MSS=1440 SACK_PERM=1 TSval=125450159 TSecr=0 WS=128"
"127","38.607952875","192.168.1.12","40.114.136.21","TCP","76","52812  >  443 [SYN] Seq=0 Win=64240 Len=0 MSS=1460 SACK_PERM=1 TSval=3610021437 TSecr=0 WS=128"
"155","38.660189616","2a00:a041:3c5d:4d00:424b:6377:a930:43d","2600:9000:2024:9c00:3:db06:4200:93a1","TLSv1.3","485","Client Hello"
"156","38.684430420","2620:2d:4000:1::3e","2a00:a041:3c5d:4d00:424b:6377:a930:43d","TCP","96","443  >  45538 [SYN, ACK] Seq=0 Ack=1 Win=64260 Len=0 MSS=1440 SACK_PERM=1 TSval=3531646745 TSecr=125450159 WS=128"
"157","38.684465390","2a00:a041:3c5d:4d00:424b:6377:a930:43d","2620:2d:4000:1::3e","TCP","88","45538  >  443 [ACK] Seq=1 Ack=1 Win=64896 Len=0 TSval=125450281 TSecr=3531646745"
"158","38.693531688","2600:9000:2024:9c00:3:db06:4200:93a1","2a00:a041:3c5d:4d00:424b:6377:a930:43d","TCP","88","443  >  33404 [ACK] Seq=1 Ack=398 Win=67072 Len=0 TSval=2183981764 TSecr=1609992405"
"159","38.693775882","40.114.136.21","192.168.1.12","TCP","76","443  >  52812 [SYN, ACK] Seq=0 Ack=1 Win=65160 Len=0 MSS=1440 SACK_PERM=1 TSval=3608790843 TSecr=3610021437 WS=128"
"160","38.693816796","192.168.1.12","40.114.136.21","TCP","68","52812  >  443 [ACK] Seq=1 Ack=1 Win=64256 Len=0 TSval=3610021523 TSecr=3608790843"
"161","38.696382057","2600:9000:2024:9c00:3:db06:4200:93a1","2a00:a041:3c5d:4d00:424b:6377:a930:43d","TLSv1.3","3712","Server Hello, Change Cipher Spec, Application Data"
"162","38.696382227","2600:9000:2024:9c00:3:db06:4200:93a1","2a00:a041:3c5d:4d00:424b:6377:a930:43d","TCP","1296","443  >  33404 [ACK] Seq=3625 Ack=398 Win=67072 Len=1208 TSval=2183981764 TSecr=1609992405 [TCP segment of a reassembled PDU]"
"163","38.696382275","2600:9000:2024:9c00:3:db06:4200:93a1","2a00:a041:3c5d:4d00:424b:6377:a930:43d","TLSv1.3","1367","Application Data, Application Data, Application Data"
"164","38.696407501","2a00:a041:3c5d:4d00:424b:6377:a930:43d","2600:9000:2024:9c00:3:db06:4200:93a1","TCP","88","33404  >  443 [ACK] Seq=398 Ack=3625 Win=61312 Len=0 TSval=1609992442 TSecr=2183981764"
"165","38.696426847","2a00:a041:3c5d:4d00:424b:6377:a930:43d","2600:9000:2024:9c00:3:db06:4200:93a1","TCP","88","33404  >  443 [ACK] Seq=398 Ack=4833 Win=60160 Len=0 TSval=1609992442 TSecr=2183981764"
"166","38.696442863","2a00:a041:3c5d:4d00:424b:6377:a930:43d","2600:9000:2024:9c00:3:db06:4200:93a1","TCP","88","33404  >  443 [ACK] Seq=398 Ack=6112 Win=59008 Len=0 TSval=1609992442 TSecr=2183981766"
"167","38.696851045","2a00:a041:3c5d:4d00:424b:6377:a930:43d","2600:9000:2024:9c00:3:db06:4200:93a1","TLSv1.3","94","Change Cipher Spec"
"168","38.700491006","2a00:a041:3c5d:4d00:424b:6377:a930:43d","2620:2d:4000:1::3e","TLSv1.2","490","Client Hello"
"172","38.707134171","192.168.1.12","40.114.136.21","TLSv1.2","468","Client Hello"
"181","38.717364580","2600:9000:2024:9c00:3:db06:4200:93a1","2a00:a041:3c5d:4d00:424b:6377:a930:43d","TCP","88","443  >  33404 [ACK] Seq=6112 Ack=404 Win=67072 Len=0 TSval=2183981793 TSecr=1609992442"
"182","38.717364701","2600:9000:2024:9c00:3:db06:4200:93a1","2a00:a041:3c5d:4d00:424b:6377:a930:43d","TCP","88","[TCP Dup ACK 181#1] 443  >  33404 [ACK] Seq=6112 Ack=404 Win=67072 Len=0 TSval=2183981793 TSecr=1609992442"
"183","38.717401002","2a00:a041:3c5d:4d00:424b:6377:a930:43d","2600:9000:2024:9c00:3:db06:4200:93a1","TLSv1.3","396","Application Data, Application Data"
"196","38.734495836","2600:9000:2024:9c00:3:db06:4200:93a1","2a00:a041:3c5d:4d00:424b:6377:a930:43d","TCP","88","443  >  33404 [ACK] Seq=6112 Ack=712 Win=68096 Len=0 TSval=2183981811 TSecr=1609992463"
"197","38.734956790","2600:9000:2024:9c00:3:db06:4200:93a1","2a00:a041:3c5d:4d00:424b:6377:a930:43d","TLSv1.3","234","Application Data"
"198","38.735536983","2600:9000:2024:9c00:3:db06:4200:93a1","2a00:a041:3c5d:4d00:424b:6377:a930:43d","TLSv1.3","514","Application Data"
"199","38.735634831","2a00:a041:3c5d:4d00:424b:6377:a930:43d","2600:9000:2024:9c00:3:db06:4200:93a1","TCP","88","33404  >  443 [ACK] Seq=712 Ack=6684 Win=64128 Len=0 TSval=1609992481 TSecr=2183981811"
"200","38.735899318","2a00:a041:3c5d:4d00:424b:6377:a930:43d","2600:9000:2024:9c00:3:db06:4200:93a1","TLSv1.3","290","Application Data"
"207","38.747423599","2600:9000:2024:9c00:3:db06:4200:93a1","2a00:a041:3c5d:4d00:424b:6377:a930:43d","TCP","88","443  >  33404 [ACK] Seq=6684 Ack=914 Win=69120 Len=0 TSval=2183981824 TSecr=1609992481"
"217","38.780366555","2620:2d:4000:1::3e","2a00:a041:3c5d:4d00:424b:6377:a930:43d","TCP","88","443  >  45538 [ACK] Seq=1 Ack=403 Win=64128 Len=0 TSval=3531646843 TSecr=125450297"
"218","38.781618518","2620:2d:4000:1::3e","2a00:a041:3c5d:4d00:424b:6377:a930:43d","TLSv1.2","1516","Server Hello"
"219","38.781635727","2a00:a041:3c5d:4d00:424b:6377:a930:43d","2620:2d:4000:1::3e","TCP","88","45538  >  443 [ACK] Seq=403 Ack=1429 Win=63488 Len=0 TSval=125450378 TSecr=3531646844"
"220","38.782046257","2620:2d:4000:1::3e","2a00:a041:3c5d:4d00:424b:6377:a930:43d","TLSv1.2","1516","Certificate [TCP segment of a reassembled PDU]"
"221","38.782051827","2a00:a041:3c5d:4d00:424b:6377:a930:43d","2620:2d:4000:1::3e","TCP","88","45538  >  443 [ACK] Seq=403 Ack=2857 Win=63104 Len=0 TSval=125450378 TSecr=3531646844"
"222","38.782606839","2620:2d:4000:1::3e","2a00:a041:3c5d:4d00:424b:6377:a930:43d","TLSv1.2","254","Server Key Exchange, Server Hello Done"
"223","38.782611805","2a00:a041:3c5d:4d00:424b:6377:a930:43d","2620:2d:4000:1::3e","TCP","88","45538  >  443 [ACK] Seq=403 Ack=3023 Win=62976 Len=0 TSval=125450379 TSecr=3531646844"
"224","38.784733847","2a00:a041:3c5d:4d00:424b:6377:a930:43d","2620:2d:4000:1::3e","TLSv1.2","214","Client Key Exchange, Change Cipher Spec, Encrypted Handshake Message"
"225","38.786968863","40.114.136.21","192.168.1.12","TCP","68","443  >  52812 [ACK] Seq=1 Ack=401 Win=64768 Len=0 TSval=3608790939 TSecr=3610021536"
"226","38.787517693","40.114.136.21","192.168.1.12","TLSv1.2","1516","Server Hello"
"227","38.787543499","192.168.1.12","40.114.136.21","TCP","68","52812  >  443 [ACK] Seq=401 Ack=1449 Win=63104 Len=0 TSval=3610021617 TSecr=3608790939"
"228","38.788309351","40.114.136.21","192.168.1.12","TCP","1516","443  >  52812 [PSH, ACK] Seq=1449 Ack=401 Win=64768 Len=1448 TSval=3608790939 TSecr=3610021536 [TCP segment of a reassembled PDU]"
"229","38.788330692","192.168.1.12","40.114.136.21","TCP","68","52812  >  443 [ACK] Seq=401 Ack=2897 Win=63104 Len=0 TSval=3610021618 TSecr=3608790939"
"230","38.790027553","40.114.136.21","192.168.1.12","TCP","1268","443  >  52812 [PSH, ACK] Seq=2897 Ack=401 Win=64768 Len=1200 TSval=3608790939 TSecr=3610021536 [TCP segment of a reassembled PDU]"
"231","38.790048984","192.168.1.12","40.114.136.21","TCP","68","52812  >  443 [ACK] Seq=401 Ack=4097 Win=63104 Len=0 TSval=3610021619 TSecr=3608790939"
"238","38.793024027","40.114.136.21","192.168.1.12","TLSv1.2","1516","Certificate [TCP segment of a reassembled PDU]"
"239","38.793035410","192.168.1.12","40.114.136.21","TCP","68","52812  >  443 [ACK] Seq=401 Ack=5545 Win=63104 Len=0 TSval=3610021622 TSecr=3608790945"
"240","38.793521827","40.114.136.21","192.168.1.12","TLSv1.2","1516","Certificate Status [TCP segment of a reassembled PDU]"
"241","38.793537444","192.168.1.12","40.114.136.21","TCP","68","52812  >  443 [ACK] Seq=401 Ack=6993 Win=63104 Len=0 TSval=3610021623 TSecr=3608790945"
"243","38.794128487","40.114.136.21","192.168.1.12","TLSv1.2","502","Server Key Exchange, Server Hello Done"
"244","38.794158011","192.168.1.12","40.114.136.21","TCP","68","52812  >  443 [ACK] Seq=401 Ack=7427 Win=62720 Len=0 TSval=3610021623 TSecr=3608790945"
"249","38.798547249","192.168.1.12","40.114.136.21","TLSv1.2","226","Client Key Exchange, Change Cipher Spec, Encrypted Handshake Message"
"314","38.862435114","2620:2d:4000:1::3e","2a00:a041:3c5d:4d00:424b:6377:a930:43d","TCP","88","443  >  45538 [ACK] Seq=3023 Ack=529 Win=64128 Len=0 TSval=3531646925 TSecr=125450381"
"315","38.862919132","2620:2d:4000:1::3e","2a00:a041:3c5d:4d00:424b:6377:a930:43d","TLSv1.2","378","New Session Ticket, Change Cipher Spec, Encrypted Handshake Message"
"316","38.863358638","2a00:a041:3c5d:4d00:424b:6377:a930:43d","2620:2d:4000:1::3e","TLSv1.2","359","Application Data"
"333","38.877645165","40.114.136.21","192.168.1.12","TCP","68","443  >  52812 [ACK] Seq=7427 Ack=559 Win=64640 Len=0 TSval=3608791029 TSecr=3610021628"
"334","38.877645289","40.114.136.21","192.168.1.12","TCP","68","[TCP Dup ACK 333#1] 443  >  52812 [ACK] Seq=7427 Ack=559 Win=64640 Len=0 TSval=3608791029 TSecr=3610021628"
"339","38.880598478","40.114.136.21","192.168.1.12","TLSv1.2","119","Change Cipher Spec, Encrypted Handshake Message"
"340","38.880832084","192.168.1.12","40.114.136.21","TLSv1.2","327","Application Data"
"347","38.943353699","2620:2d:4000:1::3e","2a00:a041:3c5d:4d00:424b:6377:a930:43d","TLSv1.2","360","Application Data"
"348","38.943902948","2620:2d:4000:1::3e","2a00:a041:3c5d:4d00:424b:6377:a930:43d","TLSv1.2","119","Encrypted Alert"
"349","38.943903010","2620:2d:4000:1::3e","2a00:a041:3c5d:4d00:424b:6377:a930:43d","TCP","88","443  >  45538 [FIN, ACK] Seq=3616 Ack=800 Win=64128 Len=0 TSval=3531647004 TSecr=125450460"
"351","38.963063417","40.114.136.21","192.168.1.12","TCP","68","443  >  52812 [ACK] Seq=7478 Ack=818 Win=64384 Len=0 TSval=3608791116 TSecr=3610021710"
"352","38.963490022","40.114.136.21","192.168.1.12","TLSv1.2","383","Application Data"
"362","38.987334897","2a00:a041:3c5d:4d00:424b:6377:a930:43d","2620:2d:4000:1::3e","TCP","88","45538  >  443 [ACK] Seq=800 Ack=3617 Win=64128 Len=0 TSval=125450584 TSecr=3531647004"
"366","39.007346412","192.168.1.12","40.114.136.21","TCP","68","52812  >  443 [ACK] Seq=818 Ack=7793 Win=64128 Len=0 TSval=3610021837 TSecr=3608791116"
"425","39.316317590","2600:9000:2024:9c00:3:db06:4200:93a1","2a00:a041:3c5d:4d00:424b:6377:a930:43d","TLSv1.3","845","Application Data"
"426","39.316786847","2a00:a041:3c5d:4d00:424b:6377:a930:43d","2600:9000:2024:9c00:3:db06:4200:93a1","TLSv1.3","288","Application Data"
"435","39.335325936","2600:9000:2024:9c00:3:db06:4200:93a1","2a00:a041:3c5d:4d00:424b:6377:a930:43d","TCP","88","443  >  33404 [ACK] Seq=7441 Ack=1114 Win=70144 Len=0 TSval=2183982412 TSecr=1609993062"
"515","39.523192481","2600:9000:2024:9c00:3:db06:4200:93a1","2a00:a041:3c5d:4d00:424b:6377:a930:43d","TLSv1.3","843","Application Data"
"516","39.563296659","2a00:a041:3c5d:4d00:424b:6377:a930:43d","2600:9000:2024:9c00:3:db06:4200:93a1","TCP","88","33404  >  443 [ACK] Seq=1114 Ack=8196 Win=64128 Len=0 TSval=1609993309 TSecr=2183982599"
"640","39.749608788","2a00:a041:3c5d:4d00:424b:6377:a930:43d","2620:2d:4000:1::2e","TCP","96","53682  >  443 [SYN] Seq=0 Win=64800 Len=0 MSS=1440 SACK_PERM=1 TSval=3387286418 TSecr=0 WS=128"
"646","39.832314449","2620:2d:4000:1::2e","2a00:a041:3c5d:4d00:424b:6377:a930:43d","TCP","96","443  >  53682 [SYN, ACK] Seq=0 Ack=1 Win=64260 Len=0 MSS=1440 SACK_PERM=1 TSval=2819280045 TSecr=3387286418 WS=128"
"647","39.832343169","2a00:a041:3c5d:4d00:424b:6377:a930:43d","2620:2d:4000:1::2e","TCP","88","53682  >  443 [ACK] Seq=1 Ack=1 Win=64896 Len=0 TSval=3387286501 TSecr=2819280045"
"648","39.839809552","2a00:a041:3c5d:4d00:424b:6377:a930:43d","2620:2d:4000:1::2e","TLSv1.3","480","Client Hello"
"651","39.918703956","2620:2d:4000:1::2e","2a00:a041:3c5d:4d00:424b:6377:a930:43d","TLSv1.3","1516","Server Hello, Change Cipher Spec, Application Data"
"652","39.918730036","2a00:a041:3c5d:4d00:424b:6377:a930:43d","2620:2d:4000:1::2e","TCP","88","53682  >  443 [ACK] Seq=393 Ack=1429 Win=63488 Len=0 TSval=3387286587 TSecr=2819280131"
"653","39.919211547","2a00:a041:3c5d:4d00:424b:6377:a930:43d","2620:2d:4000:1::2e","TLSv1.3","94","Change Cipher Spec"
"654","39.919410842","2620:2d:4000:1::2e","2a00:a041:3c5d:4d00:424b:6377:a930:43d","TLSv1.3","1516","Application Data [TCP segment of a reassembled PDU]"
"655","39.920302126","2620:2d:4000:1::2e","2a00:a041:3c5d:4d00:424b:6377:a930:43d","TLSv1.3","413","Application Data, Application Data"
"656","39.920406886","2a00:a041:3c5d:4d00:424b:6377:a930:43d","2620:2d:4000:1::2e","TCP","88","53682  >  443 [ACK] Seq=399 Ack=3182 Win=63104 Len=0 TSval=3387286589 TSecr=2819280131"
"715","40.046894620","2620:2d:4000:1::2e","2a00:a041:3c5d:4d00:424b:6377:a930:43d","TCP","88","443  >  53682 [ACK] Seq=3182 Ack=399 Win=64128 Len=0 TSval=2819280260 TSecr=3387286587"
"716","40.046915189","2a00:a041:3c5d:4d00:424b:6377:a930:43d","2620:2d:4000:1::2e","TLSv1.3","420","Application Data, Application Data"
"759","40.124916896","2620:2d:4000:1::2e","2a00:a041:3c5d:4d00:424b:6377:a930:43d","TCP","88","443  >  53682 [ACK] Seq=3182 Ack=731 Win=64128 Len=0 TSval=2819280339 TSecr=3387286715"
"760","40.125334767","2620:2d:4000:1::2e","2a00:a041:3c5d:4d00:424b:6377:a930:43d","TLSv1.3","359","Application Data"
"761","40.125334823","2620:2d:4000:1::2e","2a00:a041:3c5d:4d00:424b:6377:a930:43d","TLSv1.3","359","Application Data"
"762","40.125431958","2a00:a041:3c5d:4d00:424b:6377:a930:43d","2620:2d:4000:1::2e","TCP","88","53682  >  443 [ACK] Seq=731 Ack=3724 Win=64128 Len=0 TSval=3387286794 TSecr=2819280339"
"763","40.126407662","2620:2d:4000:1::2e","2a00:a041:3c5d:4d00:424b:6377:a930:43d","TCP","1516","443  >  53682 [ACK] Seq=3724 Ack=731 Win=64128 Len=1428 TSval=2819280339 TSecr=3387286715 [TCP segment of a reassembled PDU]"
"764","40.126933712","2620:2d:4000:1::2e","2a00:a041:3c5d:4d00:424b:6377:a930:43d","TCP","1516","443  >  53682 [PSH, ACK] Seq=5152 Ack=731 Win=64128 Len=1428 TSval=2819280339 TSecr=3387286715 [TCP segment of a reassembled PDU]"
"765","40.126942980","2a00:a041:3c5d:4d00:424b:6377:a930:43d","2620:2d:4000:1::2e","TCP","88","53682  >  443 [ACK] Seq=731 Ack=6580 Win=64128 Len=0 TSval=3387286795 TSecr=2819280339"
"766","40.127598542","2620:2d:4000:1::2e","2a00:a041:3c5d:4d00:424b:6377:a930:43d","TCP","1516","443  >  53682 [ACK] Seq=6580 Ack=731 Win=64128 Len=1428 TSval=2819280339 TSecr=3387286715 [TCP segment of a reassembled PDU]"
"767","40.128156666","2620:2d:4000:1::2e","2a00:a041:3c5d:4d00:424b:6377:a930:43d","TCP","1516","443  >  53682 [PSH, ACK] Seq=8008 Ack=731 Win=64128 Len=1428 TSval=2819280339 TSecr=3387286715 [TCP segment of a reassembled PDU]"
"768","40.128174599","2a00:a041:3c5d:4d00:424b:6377:a930:43d","2620:2d:4000:1::2e","TCP","88","53682  >  443 [ACK] Seq=731 Ack=9436 Win=64128 Len=0 TSval=3387286796 TSecr=2819280339"
"769","40.128848607","2620:2d:4000:1::2e","2a00:a041:3c5d:4d00:424b:6377:a930:43d","TCP","1516","443  >  53682 [ACK] Seq=9436 Ack=731 Win=64128 Len=1428 TSval=2819280339 TSecr=3387286715 [TCP segment of a reassembled PDU]"
"770","40.129358743","2620:2d:4000:1::2e","2a00:a041:3c5d:4d00:424b:6377:a930:43d","TLSv1.3","806","Application Data"
"771","40.129389286","2a00:a041:3c5d:4d00:424b:6377:a930:43d","2620:2d:4000:1::2e","TCP","88","53682  >  443 [ACK] Seq=731 Ack=11582 Win=64128 Len=0 TSval=3387286798 TSecr=2819280339"
"772","40.129766364","2a00:a041:3c5d:4d00:424b:6377:a930:43d","2620:2d:4000:1::2e","TLSv1.3","345","Application Data"
"775","40.217158569","2620:2d:4000:1::2e","2a00:a041:3c5d:4d00:424b:6377:a930:43d","TCP","88","443  >  53682 [ACK] Seq=11582 Ack=988 Win=64128 Len=0 TSval=2819280431 TSecr=3387286798"
"776","40.217316426","2620:2d:4000:1::2e","2a00:a041:3c5d:4d00:424b:6377:a930:43d","TCP","88","[TCP Dup ACK 775#1] 443  >  53682 [ACK] Seq=11582 Ack=988 Win=64128 Len=0 TSval=2819280431 TSecr=3387286798"
"777","40.220153559","2620:2d:4000:1::2e","2a00:a041:3c5d:4d00:424b:6377:a930:43d","TCP","1516","443  >  53682 [ACK] Seq=11582 Ack=988 Win=64128 Len=1428 TSval=2819280431 TSecr=3387286798 [TCP segment of a reassembled PDU]"
"778","40.220683411","2620:2d:4000:1::2e","2a00:a041:3c5d:4d00:424b:6377:a930:43d","TCP","1516","443  >  53682 [PSH, ACK] Seq=13010 Ack=988 Win=64128 Len=1428 TSval=2819280431 TSecr=3387286798 [TCP segment of a reassembled PDU]"
"779","40.220746931","2a00:a041:3c5d:4d00:424b:6377:a930:43d","2620:2d:4000:1::2e","TCP","88","53682  >  443 [ACK] Seq=988 Ack=14438 Win=64128 Len=0 TSval=3387286889 TSecr=2819280431"
"780","40.222750277","2620:2d:4000:1::2e","2a00:a041:3c5d:4d00:424b:6377:a930:43d","TCP","1516","443  >  53682 [ACK] Seq=14438 Ack=988 Win=64128 Len=1428 TSval=2819280436 TSecr=3387286798 [TCP segment of a reassembled PDU]"
"781","40.223215067","2620:2d:4000:1::2e","2a00:a041:3c5d:4d00:424b:6377:a930:43d","TCP","1516","443  >  53682 [PSH, ACK] Seq=15866 Ack=988 Win=64128 Len=1428 TSval=2819280436 TSecr=3387286798 [TCP segment of a reassembled PDU]"
"782","40.223225915","2a00:a041:3c5d:4d00:424b:6377:a930:43d","2620:2d:4000:1::2e","TCP","88","53682  >  443 [ACK] Seq=988 Ack=17294 Win=64128 Len=0 TSval=3387286892 TSecr=2819280436"
"783","40.228710503","2620:2d:4000:1::2e","2a00:a041:3c5d:4d00:424b:6377:a930:43d","TCP","1516","443  >  53682 [ACK] Seq=17294 Ack=988 Win=64128 Len=1428 TSval=2819280442 TSecr=3387286798 [TCP segment of a reassembled PDU]"
"784","40.229208080","2620:2d:4000:1::2e","2a00:a041:3c5d:4d00:424b:6377:a930:43d","TLSv1.3","712","Application Data"
"785","40.229280163","2a00:a041:3c5d:4d00:424b:6377:a930:43d","2620:2d:4000:1::2e","TCP","88","53682  >  443 [ACK] Seq=988 Ack=19346 Win=64128 Len=0 TSval=3387286898 TSecr=2819280442"
"819","40.318998240","2a00:a041:3c5d:4d00:424b:6377:a930:43d","2620:2d:4000:1::2e","TCP","88","53682  >  443 [FIN, ACK] Seq=988 Ack=19346 Win=64128 Len=0 TSval=3387286987 TSecr=2819280442"
"917","40.397837162","2620:2d:4000:1::2e","2a00:a041:3c5d:4d00:424b:6377:a930:43d","TLSv1.3","112","Application Data"
"918","40.397837496","2620:2d:4000:1::2e","2a00:a041:3c5d:4d00:424b:6377:a930:43d","TCP","88","443  >  53682 [FIN, ACK] Seq=19370 Ack=989 Win=64128 Len=0 TSval=2819280610 TSecr=3387286987"
"919","40.397875842","2a00:a041:3c5d:4d00:424b:6377:a930:43d","2620:2d:4000:1::2e","TCP","76","53682  >  443 [RST] Seq=989 Win=0 Len=0"
"920","40.397902593","2a00:a041:3c5d:4d00:424b:6377:a930:43d","2620:2d:4000:1::2e","TCP","76","53682  >  443 [RST] Seq=989 Win=0 Len=0"
"3297","42.159951125","192.168.1.12","40.114.136.21","TCP","68","52812  >  443 [FIN, ACK] Seq=818 Ack=7793 Win=64128 Len=0 TSval=3610024989 TSecr=3608791116"
"3298","42.160437220","2a00:a041:3c5d:4d00:424b:6377:a930:43d","2620:2d:4000:1::3e","TCP","88","45538  >  443 [RST, ACK] Seq=800 Ack=3617 Win=64128 Len=0 TSval=125453757 TSecr=3531647004"
"3300","42.161385333","2a00:a041:3c5d:4d00:424b:6377:a930:43d","2600:9000:2024:9c00:3:db06:4200:93a1","TCP","88","33404  >  443 [FIN, ACK] Seq=1114 Ack=8196 Win=64128 Len=0 TSval=1609995907 TSecr=2183982599"
"3303","42.175195102","2600:9000:2024:9c00:3:db06:4200:93a1","2a00:a041:3c5d:4d00:424b:6377:a930:43d","TCP","88","443  >  33404 [FIN, ACK] Seq=8196 Ack=1115 Win=70144 Len=0 TSval=2183985251 TSecr=1609995907"
"3304","42.175215723","2a00:a041:3c5d:4d00:424b:6377:a930:43d","2600:9000:2024:9c00:3:db06:4200:93a1","TCP","88","33404  >  443 [ACK] Seq=1115 Ack=8197 Win=64128 Len=0 TSval=1609995920 TSecr=2183985251"
"3308","42.239304495","40.114.136.21","192.168.1.12","TCP","68","443  >  52812 [FIN, ACK] Seq=7793 Ack=819 Win=64384 Len=0 TSval=3608794391 TSecr=3610024989"
"3309","42.239343955","192.168.1.12","40.114.136.21","TCP","68","52812  >  443 [ACK] Seq=819 Ack=7794 Win=64128 Len=0 TSval=3610025069 TSecr=3608794391"
"3313","47.814983845","2a03:2880:f258:1c3:face:b00c:0:167","2a00:a041:3c5d:4d00:424b:6377:a930:43d","TLSv1.2","902","Application Data"
"3314","47.815051871","2a00:a041:3c5d:4d00:424b:6377:a930:43d","2a03:2880:f258:1c3:face:b00c:0:167","TCP","88","41660  >  443 [ACK] Seq=392 Ack=1866 Win=1187 Len=0 TSval=2768235610 TSecr=3183284854"
"3315","48.224334477","2a03:2880:f258:1c3:face:b00c:0:167","2a00:a041:3c5d:4d00:424b:6377:a930:43d","TLSv1.2","181","Application Data"
"3316","48.224364554","2a00:a041:3c5d:4d00:424b:6377:a930:43d","2a03:2880:f258:1c3:face:b00c:0:167","TCP","88","41660  >  443 [ACK] Seq=392 Ack=1959 Win=1187 Len=0 TSval=2768236020 TSecr=3183285241"
"3317","48.324673067","2a00:a041:3c5d:4d00:424b:6377:a930:43d","2a03:2880:f258:1c3:face:b00c:0:167","TLSv1.2","180","Application Data"
"3318","48.403579679","2a03:2880:f258:1c3:face:b00c:0:167","2a00:a041:3c5d:4d00:424b:6377:a930:43d","TCP","88","443  >  41660 [ACK] Seq=1959 Ack=484 Win=959 Len=0 TSval=3183285498 TSecr=2768236120"
"3319","48.503187773","2a00:a041:3c5d:4d00:424b:6377:a930:43d","2a03:2880:f258:1c3:face:b00c:0:167","TLSv1.2","181","Application Data"
"3320","48.576380283","2a03:2880:f258:1c3:face:b00c:0:167","2a00:a041:3c5d:4d00:424b:6377:a930:43d","TCP","88","443  >  41660 [ACK] Seq=1959 Ack=577 Win=959 Len=0 TSval=3183285671 TSecr=2768236298"
"3321","52.417004081","2a00:a041:3c5d:4d00:424b:6377:a930:43d","2a03:2880:f258:1c3:face:b00c:0:167","TLSv1.2","158","Application Data"
"3322","52.495581482","2a03:2880:f258:1c3:face:b00c:0:167","2a00:a041:3c5d:4d00:424b:6377:a930:43d","TCP","88","443  >  41660 [ACK] Seq=1959 Ack=647 Win=959 Len=0 TSval=3183289590 TSecr=2768240212"
"3323","52.632469721","2a03:2880:f258:1c3:face:b00c:0:167","2a00:a041:3c5d:4d00:424b:6377:a930:43d","TLSv1.2","160","Application Data"
"3324","52.632508744","2a00:a041:3c5d:4d00:424b:6377:a930:43d","2a03:2880:f258:1c3:face:b00c:0:167","TCP","88","41660  >  443 [ACK] Seq=647 Ack=2031 Win=1193 Len=0 TSval=2768240428 TSecr=3183289670"
"3334","75.677354332","2a00:a041:3c5d:4d00:424b:6377:a930:43d","2a03:2880:f258:1c3:face:b00c:0:167","TLSv1.2","158","Application Data"
"3335","75.754665626","2a03:2880:f258:1c3:face:b00c:0:167","2a00:a041:3c5d:4d00:424b:6377:a930:43d","TCP","88","443  >  41660 [ACK] Seq=2031 Ack=717 Win=959 Len=0 TSval=3183312848 TSecr=2768263473"
"3336","75.834771289","2a03:2880:f258:1c3:face:b00c:0:167","2a00:a041:3c5d:4d00:424b:6377:a930:43d","TLSv1.2","160","Application Data"
"3337","75.834808186","2a00:a041:3c5d:4d00:424b:6377:a930:43d","2a03:2880:f258:1c3:face:b00c:0:167","TCP","88","41660  >  443 [ACK] Seq=717 Ack=2103 Win=1193 Len=0 TSval=2768263630 TSecr=3183312928"
"3354","98.335674895","2a00:a041:3c5d:4d00:424b:6377:a930:43d","2a03:2880:f258:1c3:face:b00c:0:167","TLSv1.2","158","Application Data"
"3355","98.414814877","2a03:2880:f258:1c3:face:b00c:0:167","2a00:a041:3c5d:4d00:424b:6377:a930:43d","TCP","88","443  >  41660 [ACK] Seq=2103 Ack=787 Win=959 Len=0 TSval=3183335509 TSecr=2768286131"
"3356","98.495049326","2a03:2880:f258:1c3:face:b00c:0:167","2a00:a041:3c5d:4d00:424b:6377:a930:43d","TLSv1.2","160","Application Data"
"3357","98.495084694","2a00:a041:3c5d:4d00:424b:6377:a930:43d","2a03:2880:f258:1c3:face:b00c:0:167","TCP","88","41660  >  443 [ACK] Seq=787 Ack=2175 Win=1193 Len=0 TSval=2768286290 TSecr=3183335589"
"3363","113.895665866","2a00:a041:3c5d:4d00:424b:6377:a930:43d","2a03:2880:f258:1c3:face:b00c:0:167","TLSv1.2","158","Application Data"
"3364","113.975188490","2a03:2880:f258:1c3:face:b00c:0:167","2a00:a041:3c5d:4d00:424b:6377:a930:43d","TCP","88","443  >  41660 [ACK] Seq=2175 Ack=857 Win=959 Len=0 TSval=3183351067 TSecr=2768301691"
"3365","114.004685207","2a03:2880:f258:1c3:face:b00c:0:167","2a00:a041:3c5d:4d00:424b:6377:a930:43d","TLSv1.2","902","Application Data"
"3366","114.004746538","2a00:a041:3c5d:4d00:424b:6377:a930:43d","2a03:2880:f258:1c3:face:b00c:0:167","TCP","88","41660  >  443 [ACK] Seq=857 Ack=2989 Win=1187 Len=0 TSval=2768301800 TSecr=3183351092"
"3367","114.052524471","2a03:2880:f258:1c3:face:b00c:0:167","2a00:a041:3c5d:4d00:424b:6377:a930:43d","TLSv1.2","160","Application Data"
"3368","114.052557627","2a00:a041:3c5d:4d00:424b:6377:a930:43d","2a03:2880:f258:1c3:face:b00c:0:167","TCP","88","41660  >  443 [ACK] Seq=857 Ack=3061 Win=1190 Len=0 TSval=2768301848 TSecr=3183351146"
"3369","114.395119166","2a00:a041:3c5d:4d00:424b:6377:a930:43d","2a03:2880:f258:1c3:face:b00c:0:167","TLSv1.2","181","Application Data"
"3370","114.580058095","2a03:2880:f258:1c3:face:b00c:0:167","2a00:a041:3c5d:4d00:424b:6377:a930:43d","TCP","88","443  >  41660 [ACK] Seq=3061 Ack=950 Win=959 Len=0 TSval=3183351608 TSecr=2768302190"
"3371","115.194455664","2a03:2880:f258:1c3:face:b00c:0:167","2a00:a041:3c5d:4d00:424b:6377:a930:43d","TLSv1.2","181","Application Data"
"3372","115.194489951","2a00:a041:3c5d:4d00:424b:6377:a930:43d","2a03:2880:f258:1c3:face:b00c:0:167","TCP","88","41660  >  443 [ACK] Seq=950 Ack=3154 Win=1193 Len=0 TSval=2768302990 TSecr=3183352276"
"3373","115.205209145","2a00:a041:3c5d:4d00:424b:6377:a930:43d","2a03:2880:f258:1c3:face:b00c:0:167","TLSv1.2","180","Application Data"
"3374","115.279338071","2a03:2880:f258:1c3:face:b00c:0:167","2a00:a041:3c5d:4d00:424b:6377:a930:43d","TCP","88","443  >  41660 [ACK] Seq=3154 Ack=1042 Win=959 Len=0 TSval=3183352374 TSecr=2768303000"
"3384","140.604472920","2a00:a041:3c5d:4d00:424b:6377:a930:43d","2a03:2880:f258:1c3:face:b00c:0:167","TLSv1.2","158","Application Data"
"3385","140.678722781","2a03:2880:f258:1c3:face:b00c:0:167","2a00:a041:3c5d:4d00:424b:6377:a930:43d","TCP","88","443  >  41660 [ACK] Seq=3154 Ack=1112 Win=959 Len=0 TSval=3183377773 TSecr=2768328400"
"3386","140.759507378","2a03:2880:f258:1c3:face:b00c:0:167","2a00:a041:3c5d:4d00:424b:6377:a930:43d","TLSv1.2","160","Application Data"
"3387","140.803302364","2a00:a041:3c5d:4d00:424b:6377:a930:43d","2a03:2880:f258:1c3:face:b00c:0:167","TCP","88","41660  >  443 [ACK] Seq=1112 Ack=3226 Win=1193 Len=0 TSval=2768328599 TSecr=3183377853"
"3392","162.401437883","2a03:2880:f258:1c3:face:b00c:0:167","2a00:a041:3c5d:4d00:424b:6377:a930:43d","TLSv1.2","886","Application Data"
"3393","162.401488588","2a00:a041:3c5d:4d00:424b:6377:a930:43d","2a03:2880:f258:1c3:face:b00c:0:167","TCP","88","41660  >  443 [ACK] Seq=1112 Ack=4024 Win=1187 Len=0 TSval=2768350197 TSecr=3183399483"
"3394","162.648739714","2a00:a041:3c5d:4d00:424b:6377:a930:43d","2a03:2880:f258:1c3:face:b00c:0:167","TLSv1.2","181","Application Data"
"3396","162.728100310","2a03:2880:f258:1c3:face:b00c:0:167","2a00:a041:3c5d:4d00:424b:6377:a930:43d","TCP","88","443  >  41660 [ACK] Seq=4024 Ack=1205 Win=959 Len=0 TSval=3183399823 TSecr=2768350444"
"3398","163.220299809","2a03:2880:f258:1c3:face:b00c:0:167","2a00:a041:3c5d:4d00:424b:6377:a930:43d","TLSv1.2","181","Application Data"
"3399","163.220320439","2a00:a041:3c5d:4d00:424b:6377:a930:43d","2a03:2880:f258:1c3:face:b00c:0:167","TCP","88","41660  >  443 [ACK] Seq=1205 Ack=4117 Win=1193 Len=0 TSval=2768351016 TSecr=3183400299"
"3400","163.224436178","2a00:a041:3c5d:4d00:424b:6377:a930:43d","2a03:2880:f258:1c3:face:b00c:0:167","TLSv1.2","180","Application Data"
"3401","163.301719603","2a03:2880:f258:1c3:face:b00c:0:167","2a00:a041:3c5d:4d00:424b:6377:a930:43d","TCP","88","443  >  41660 [ACK] Seq=4117 Ack=1297 Win=959 Len=0 TSval=3183400397 TSecr=2768351020"
"3406","169.149056632","2a00:a041:3c5d:4d00:424b:6377:a930:43d","2a03:2880:f258:1c3:face:b00c:0:167","TLSv1.2","158","Application Data"
"3407","169.248033433","2a03:2880:f258:1c3:face:b00c:0:167","2a00:a041:3c5d:4d00:424b:6377:a930:43d","TCP","88","443  >  41660 [ACK] Seq=4117 Ack=1367 Win=959 Len=0 TSval=3183406343 TSecr=2768356944"
"3408","169.328745786","2a03:2880:f258:1c3:face:b00c:0:167","2a00:a041:3c5d:4d00:424b:6377:a930:43d","TLSv1.2","160","Application Data"
"3409","169.371255275","2a00:a041:3c5d:4d00:424b:6377:a930:43d","2a03:2880:f258:1c3:face:b00c:0:167","TCP","88","41660  >  443 [ACK] Seq=1367 Ack=4189 Win=1193 Len=0 TSval=2768357167 TSecr=3183406424"
"3410","172.510022249","2a00:a041:3c5d:4d00:424b:6377:a930:43d","2a03:2880:f258:1c3:face:b00c:0:167","TCP","1468","41660  >  443 [ACK] Seq=1367 Ack=4189 Win=1193 Len=1380 TSval=2768360305 TSecr=3183406424 [TCP segment of a reassembled PDU]"
"3411","172.510049265","2a00:a041:3c5d:4d00:424b:6377:a930:43d","2a03:2880:f258:1c3:face:b00c:0:167","TCP","1468","41660  >  443 [ACK] Seq=2747 Ack=4189 Win=1193 Len=1380 TSval=2768360305 TSecr=3183406424 [TCP segment of a reassembled PDU]"
"3412","172.512051077","2a00:a041:3c5d:4d00:424b:6377:a930:43d","2a03:2880:f258:1c3:face:b00c:0:167","TLSv1.2","1300","Application Data"
"3413","172.610037857","2a03:2880:f258:1c3:face:b00c:0:167","2a00:a041:3c5d:4d00:424b:6377:a930:43d","TCP","88","443  >  41660 [ACK] Seq=4189 Ack=2747 Win=969 Len=0 TSval=3183409687 TSecr=2768360305"
"3414","172.610546985","2a03:2880:f258:1c3:face:b00c:0:167","2a00:a041:3c5d:4d00:424b:6377:a930:43d","TCP","88","443  >  41660 [ACK] Seq=4189 Ack=4127 Win=980 Len=0 TSval=3183409687 TSecr=2768360305"
"3415","172.610547180","2a03:2880:f258:1c3:face:b00c:0:167","2a00:a041:3c5d:4d00:424b:6377:a930:43d","TCP","88","443  >  41660 [ACK] Seq=4189 Ack=5339 Win=991 Len=0 TSval=3183409687 TSecr=2768360307"
"3422","172.675885772","2a03:2880:f258:1c3:face:b00c:0:167","2a00:a041:3c5d:4d00:424b:6377:a930:43d","TLSv1.2","152","Application Data"
"3423","172.675917272","2a00:a041:3c5d:4d00:424b:6377:a930:43d","2a03:2880:f258:1c3:face:b00c:0:167","TCP","88","41660  >  443 [ACK] Seq=5339 Ack=4253 Win=1193 Len=0 TSval=2768360471 TSecr=3183409769"
"3430","172.720465728","2a00:a041:3c5d:4d00:424b:6377:a930:43d","2a03:2880:f258:c8:face:b00c:0:167","TCP","96","41170  >  443 [SYN] Seq=0 Win=64800 Len=0 MSS=1440 SACK_PERM=1 TSval=1652246826 TSecr=0 WS=128"
"3431","172.720600599","2a00:a041:3c5d:4d00:424b:6377:a930:43d","2a03:2880:f258:c8:face:b00c:0:167","TCP","96","41186  >  443 [SYN] Seq=0 Win=64800 Len=0 MSS=1440 SACK_PERM=1 TSval=1652246826 TSecr=0 WS=128"
"3432","172.799682430","2a03:2880:f258:c8:face:b00c:0:167","2a00:a041:3c5d:4d00:424b:6377:a930:43d","TCP","96","443  >  41170 [SYN, ACK] Seq=0 Ack=1 Win=65535 Len=0 MSS=1392 SACK_PERM=1 TSval=1433002513 TSecr=1652246826 WS=256"
"3433","172.799731242","2a00:a041:3c5d:4d00:424b:6377:a930:43d","2a03:2880:f258:c8:face:b00c:0:167","TCP","88","41170  >  443 [ACK] Seq=1 Ack=1 Win=64896 Len=0 TSval=1652246905 TSecr=1433002513"
"3434","172.800665755","2a00:a041:3c5d:4d00:424b:6377:a930:43d","2a03:2880:f258:c8:face:b00c:0:167","TLSv1.3","782","Client Hello"
"3435","172.809871077","2a03:2880:f258:c8:face:b00c:0:167","2a00:a041:3c5d:4d00:424b:6377:a930:43d","TCP","96","443  >  41186 [SYN, ACK] Seq=0 Ack=1 Win=65535 Len=0 MSS=1392 SACK_PERM=1 TSval=3791597906 TSecr=1652246826 WS=256"
"3436","172.809921679","2a00:a041:3c5d:4d00:424b:6377:a930:43d","2a03:2880:f258:c8:face:b00c:0:167","TCP","88","41186  >  443 [ACK] Seq=1 Ack=1 Win=64896 Len=0 TSval=1652246915 TSecr=3791597906"
"3437","172.810807169","2a00:a041:3c5d:4d00:424b:6377:a930:43d","2a03:2880:f258:c8:face:b00c:0:167","TLSv1.3","782","Client Hello"
"3438","172.881858427","2a03:2880:f258:c8:face:b00c:0:167","2a00:a041:3c5d:4d00:424b:6377:a930:43d","TCP","88","443  >  41170 [ACK] Seq=1 Ack=695 Win=67072 Len=0 TSval=1433002596 TSecr=1652246906"
"3439","172.882127530","2a03:2880:f258:c8:face:b00c:0:167","2a00:a041:3c5d:4d00:424b:6377:a930:43d","TLSv1.3","253","Server Hello, Application Data"
"3440","172.882147782","2a00:a041:3c5d:4d00:424b:6377:a930:43d","2a03:2880:f258:c8:face:b00c:0:167","TCP","88","41170  >  443 [ACK] Seq=695 Ack=166 Win=64768 Len=0 TSval=1652246987 TSecr=1433002597"
"3441","172.882514894","2a00:a041:3c5d:4d00:424b:6377:a930:43d","2a03:2880:f258:c8:face:b00c:0:167","TLSv1.3","94","Change Cipher Spec"
"3442","172.882637108","2a00:a041:3c5d:4d00:424b:6377:a930:43d","2a03:2880:f258:c8:face:b00c:0:167","TLSv1.3","146","Application Data"
"3443","172.884363575","2a00:a041:3c5d:4d00:424b:6377:a930:43d","2a03:2880:f258:c8:face:b00c:0:167","TLSv1.3","566","Application Data"
"3444","172.884440587","2a00:a041:3c5d:4d00:424b:6377:a930:43d","2a03:2880:f258:c8:face:b00c:0:167","TLSv1.3","958","Application Data"
"3445","172.885961756","2a03:2880:f258:c8:face:b00c:0:167","2a00:a041:3c5d:4d00:424b:6377:a930:43d","TCP","88","443  >  41186 [ACK] Seq=1 Ack=695 Win=67072 Len=0 TSval=3791597988 TSecr=1652246916"
"3446","172.886506273","2a03:2880:f258:c8:face:b00c:0:167","2a00:a041:3c5d:4d00:424b:6377:a930:43d","TCP","88","[TCP Dup ACK 3445#1] 443  >  41186 [ACK] Seq=1 Ack=695 Win=67072 Len=0 TSval=3791597988 TSecr=1652246916"
"3447","172.886506467","2a03:2880:f258:c8:face:b00c:0:167","2a00:a041:3c5d:4d00:424b:6377:a930:43d","TLSv1.3","253","Server Hello, Application Data"
"3448","172.886528662","2a00:a041:3c5d:4d00:424b:6377:a930:43d","2a03:2880:f258:c8:face:b00c:0:167","TCP","88","41186  >  443 [ACK] Seq=695 Ack=166 Win=64768 Len=0 TSval=1652246992 TSecr=3791597989"
"3449","172.886902524","2a00:a041:3c5d:4d00:424b:6377:a930:43d","2a03:2880:f258:c8:face:b00c:0:167","TLSv1.3","94","Change Cipher Spec"
"3450","172.887013705","2a00:a041:3c5d:4d00:424b:6377:a930:43d","2a03:2880:f258:c8:face:b00c:0:167","TLSv1.3","146","Application Data"
"3451","172.888480159","2a00:a041:3c5d:4d00:424b:6377:a930:43d","2a03:2880:f258:c8:face:b00c:0:167","TLSv1.3","566","Application Data"
"3452","172.888544195","2a00:a041:3c5d:4d00:424b:6377:a930:43d","2a03:2880:f258:c8:face:b00c:0:167","TLSv1.3","958","Application Data"
"3453","172.959911893","2a03:2880:f258:c8:face:b00c:0:167","2a00:a041:3c5d:4d00:424b:6377:a930:43d","TCP","88","443  >  41170 [ACK] Seq=166 Ack=759 Win=67072 Len=0 TSval=1433002674 TSecr=1652246988"
"3454","172.960401173","2a03:2880:f258:c8:face:b00c:0:167","2a00:a041:3c5d:4d00:424b:6377:a930:43d","TLSv1.3","257","Application Data"
"3455","172.967134453","2a03:2880:f258:c8:face:b00c:0:167","2a00:a041:3c5d:4d00:424b:6377:a930:43d","TCP","88","443  >  41186 [ACK] Seq=166 Ack=1237 Win=68352 Len=0 TSval=3791598069 TSecr=1652246992"
"3456","172.967597360","2a03:2880:f258:c8:face:b00c:0:167","2a00:a041:3c5d:4d00:424b:6377:a930:43d","TLSv1.3","257","Application Data"
"3457","172.968988890","2a03:2880:f258:c8:face:b00c:0:167","2a00:a041:3c5d:4d00:424b:6377:a930:43d","TCP","88","443  >  41170 [ACK] Seq=335 Ack=2107 Win=70144 Len=0 TSval=1433002683 TSecr=1652246990"
"3458","173.003386622","2a00:a041:3c5d:4d00:424b:6377:a930:43d","2a03:2880:f258:c8:face:b00c:0:167","TCP","88","41170  >  443 [ACK] Seq=2107 Ack=335 Win=64640 Len=0 TSval=1652247109 TSecr=1433002675"
"3459","173.011407151","2a00:a041:3c5d:4d00:424b:6377:a930:43d","2a03:2880:f258:c8:face:b00c:0:167","TCP","88","41186  >  443 [ACK] Seq=2107 Ack=335 Win=64640 Len=0 TSval=1652247117 TSecr=3791598070"
"3460","173.066755499","2a03:2880:f258:c8:face:b00c:0:167","2a00:a041:3c5d:4d00:424b:6377:a930:43d","TLSv1.3","836","Application Data"
"3461","173.066788265","2a00:a041:3c5d:4d00:424b:6377:a930:43d","2a03:2880:f258:c8:face:b00c:0:167","TCP","88","41170  >  443 [ACK] Seq=2107 Ack=1083 Win=64000 Len=0 TSval=1652247172 TSecr=1433002780"
"3462","173.072448949","2a03:2880:f258:c8:face:b00c:0:167","2a00:a041:3c5d:4d00:424b:6377:a930:43d","TLSv1.3","836","Application Data"
"3463","173.072481272","2a00:a041:3c5d:4d00:424b:6377:a930:43d","2a03:2880:f258:c8:face:b00c:0:167","TCP","88","41186  >  443 [ACK] Seq=2107 Ack=1083 Win=64000 Len=0 TSval=1652247178 TSecr=3791598175"
"3469","190.309366219","2a00:a041:3c5d:4d00:424b:6377:a930:43d","2a03:2880:f258:1c3:face:b00c:0:167","TLSv1.2","158","Application Data"
"3470","190.388824686","2a03:2880:f258:1c3:face:b00c:0:167","2a00:a041:3c5d:4d00:424b:6377:a930:43d","TCP","88","443  >  41660 [ACK] Seq=4253 Ack=5409 Win=991 Len=0 TSval=3183427483 TSecr=2768378105"
"3471","190.468921541","2a03:2880:f258:1c3:face:b00c:0:167","2a00:a041:3c5d:4d00:424b:6377:a930:43d","TLSv1.2","160","Application Data"
"3472","190.468959612","2a00:a041:3c5d:4d00:424b:6377:a930:43d","2a03:2880:f258:1c3:face:b00c:0:167","TCP","88","41660  >  443 [ACK] Seq=5409 Ack=4325 Win=1193 Len=0 TSval=2768378264 TSecr=3183427563"
"3497","219.643417378","2a03:2880:f258:1c3:face:b00c:0:167","2a00:a041:3c5d:4d00:424b:6377:a930:43d","TLSv1.2","902","Application Data"
"3498","219.643454329","2a00:a041:3c5d:4d00:424b:6377:a930:43d","2a03:2880:f258:1c3:face:b00c:0:167","TCP","88","41660  >  443 [ACK] Seq=5409 Ack=5139 Win=1187 Len=0 TSval=2768407439 TSecr=3183456681"
"3499","219.865536580","2a00:a041:3c5d:4d00:424b:6377:a930:43d","2a03:2880:f258:1c3:face:b00c:0:167","TLSv1.2","181","Application Data"
"3500","219.938566314","2a03:2880:f258:1c3:face:b00c:0:167","2a00:a041:3c5d:4d00:424b:6377:a930:43d","TLSv1.2","181","Application Data"
"3501","219.938596956","2a00:a041:3c5d:4d00:424b:6377:a930:43d","2a03:2880:f258:1c3:face:b00c:0:167","TCP","88","41660  >  443 [ACK] Seq=5502 Ack=5232 Win=1193 Len=0 TSval=2768407734 TSecr=3183457033"
"3502","219.941331313","2a00:a041:3c5d:4d00:424b:6377:a930:43d","2a03:2880:f258:1c3:face:b00c:0:167","TLSv1.2","180","Application Data"
"3503","219.943444406","2a03:2880:f258:1c3:face:b00c:0:167","2a00:a041:3c5d:4d00:424b:6377:a930:43d","TCP","88","443  >  41660 [ACK] Seq=5232 Ack=5502 Win=991 Len=0 TSval=3183457037 TSecr=2768407661"
"3504","220.020022886","2a03:2880:f258:1c3:face:b00c:0:167","2a00:a041:3c5d:4d00:424b:6377:a930:43d","TCP","88","443  >  41660 [ACK] Seq=5232 Ack=5594 Win=991 Len=0 TSval=3183457114 TSecr=2768407737"
"3505","220.424465030","2a00:a041:3c5d:4d00:424b:6377:a930:43d","2a03:2880:f258:1c3:face:b00c:0:167","TLSv1.2","158","Application Data"
"3506","220.502020913","2a03:2880:f258:1c3:face:b00c:0:167","2a00:a041:3c5d:4d00:424b:6377:a930:43d","TCP","88","443  >  41660 [ACK] Seq=5232 Ack=5664 Win=991 Len=0 TSval=3183457596 TSecr=2768408220"
"3507","220.582077109","2a03:2880:f258:1c3:face:b00c:0:167","2a00:a041:3c5d:4d00:424b:6377:a930:43d","TLSv1.2","160","Application Data"
"3508","220.623321904","2a00:a041:3c5d:4d00:424b:6377:a930:43d","2a03:2880:f258:1c3:face:b00c:0:167","TCP","88","41660  >  443 [ACK] Seq=5664 Ack=5304 Win=1193 Len=0 TSval=2768408419 TSecr=3183457676"
"3510","233.068119579","2a00:a041:3c5d:4d00:424b:6377:a930:43d","2a03:2880:f258:c8:face:b00c:0:167","TLSv1.3","112","Application Data"
"3511","233.068163769","2a00:a041:3c5d:4d00:424b:6377:a930:43d","2a03:2880:f258:c8:face:b00c:0:167","TCP","88","41170  >  443 [FIN, ACK] Seq=2131 Ack=1083 Win=64128 Len=0 TSval=1652307173 TSecr=1433002780"
"3512","233.073625966","2a00:a041:3c5d:4d00:424b:6377:a930:43d","2a03:2880:f258:c8:face:b00c:0:167","TLSv1.3","112","Application Data"
"3513","233.073683032","2a00:a041:3c5d:4d00:424b:6377:a930:43d","2a03:2880:f258:c8:face:b00c:0:167","TCP","88","41186  >  443 [FIN, ACK] Seq=2131 Ack=1083 Win=64128 Len=0 TSval=1652307179 TSecr=3791598175"
"3514","233.147384730","2a03:2880:f258:c8:face:b00c:0:167","2a00:a041:3c5d:4d00:424b:6377:a930:43d","TLSv1.3","112","Application Data"
"3515","233.147440007","2a00:a041:3c5d:4d00:424b:6377:a930:43d","2a03:2880:f258:c8:face:b00c:0:167","TCP","76","41170  >  443 [RST] Seq=2132 Win=0 Len=0"
"3516","233.147725104","2a03:2880:f258:c8:face:b00c:0:167","2a00:a041:3c5d:4d00:424b:6377:a930:43d","TCP","88","443  >  41170 [FIN, ACK] Seq=1107 Ack=2132 Win=70144 Len=0 TSval=1433062861 TSecr=1652307173"
"3517","233.147752799","2a00:a041:3c5d:4d00:424b:6377:a930:43d","2a03:2880:f258:c8:face:b00c:0:167","TCP","76","41170  >  443 [RST] Seq=2132 Win=0 Len=0"
"3518","233.150839297","2a03:2880:f258:c8:face:b00c:0:167","2a00:a041:3c5d:4d00:424b:6377:a930:43d","TLSv1.3","112","Application Data"
"3519","233.150889349","2a00:a041:3c5d:4d00:424b:6377:a930:43d","2a03:2880:f258:c8:face:b00c:0:167","TCP","76","41186  >  443 [RST] Seq=2132 Win=0 Len=0"
"3520","233.150961880","2a03:2880:f258:c8:face:b00c:0:167","2a00:a041:3c5d:4d00:424b:6377:a930:43d","TCP","88","443  >  41186 [FIN, ACK] Seq=1107 Ack=2132 Win=70144 Len=0 TSval=3791658253 TSecr=1652307179"
"3521","233.150969615","2a00:a041:3c5d:4d00:424b:6377:a930:43d","2a03:2880:f258:c8:face:b00c:0:167","TCP","76","41186  >  443 [RST] Seq=2132 Win=0 Len=0"
"3547","247.522645943","2a00:a041:3c5d:4d00:424b:6377:a930:43d","2a03:2880:f258:1c3:face:b00c:0:167","TLSv1.2","158","Application Data"
"3548","247.614816820","2a03:2880:f258:1c3:face:b00c:0:167","2a00:a041:3c5d:4d00:424b:6377:a930:43d","TCP","88","443  >  41660 [ACK] Seq=5304 Ack=5734 Win=991 Len=0 TSval=3183484707 TSecr=2768435318"
"3549","247.693231861","2a03:2880:f258:1c3:face:b00c:0:167","2a00:a041:3c5d:4d00:424b:6377:a930:43d","TLSv1.2","160","Application Data"
"3550","247.693271427","2a00:a041:3c5d:4d00:424b:6377:a930:43d","2a03:2880:f258:1c3:face:b00c:0:167","TCP","88","41660  >  443 [ACK] Seq=5734 Ack=5376 Win=1193 Len=0 TSval=2768435489 TSecr=3183484788"
"3560","269.352584809","2a00:a041:3c5d:4d00:424b:6377:a930:43d","2a03:2880:f258:1c3:face:b00c:0:167","TLSv1.2","158","Application Data"
"3561","269.435275984","2a03:2880:f258:1c3:face:b00c:0:167","2a00:a041:3c5d:4d00:424b:6377:a930:43d","TCP","88","443  >  41660 [ACK] Seq=5376 Ack=5804 Win=991 Len=0 TSval=3183506526 TSecr=2768457148"
"3562","269.511577053","2a03:2880:f258:1c3:face:b00c:0:167","2a00:a041:3c5d:4d00:424b:6377:a930:43d","TLSv1.2","160","Application Data"
"3563","269.511613361","2a00:a041:3c5d:4d00:424b:6377:a930:43d","2a03:2880:f258:1c3:face:b00c:0:167","TCP","88","41660  >  443 [ACK] Seq=5804 Ack=5448 Win=1193 Len=0 TSval=2768457307 TSecr=3183506606"
"3571","291.323821877","2a03:2880:f258:1c3:face:b00c:0:167","2a00:a041:3c5d:4d00:424b:6377:a930:43d","TLSv1.2","902","Application Data"
"3572","291.323886281","2a00:a041:3c5d:4d00:424b:6377:a930:43d","2a03:2880:f258:1c3:face:b00c:0:167","TCP","88","41660  >  443 [ACK] Seq=5804 Ack=6262 Win=1187 Len=0 TSval=2768479119 TSecr=3183528362"
"3573","291.604988833","2a00:a041:3c5d:4d00:424b:6377:a930:43d","2a03:2880:f258:1c3:face:b00c:0:167","TLSv1.2","181","Application Data"
"3574","291.641225992","2a03:2880:f258:1c3:face:b00c:0:167","2a00:a041:3c5d:4d00:424b:6377:a930:43d","TLSv1.2","181","Application Data"
"3575","291.641247392","2a00:a041:3c5d:4d00:424b:6377:a930:43d","2a03:2880:f258:1c3:face:b00c:0:167","TCP","88","41660  >  443 [ACK] Seq=5897 Ack=6355 Win=1193 Len=0 TSval=2768479437 TSecr=3183528736"
"3576","291.648311622","2a00:a041:3c5d:4d00:424b:6377:a930:43d","2a03:2880:f258:1c3:face:b00c:0:167","TLSv1.2","180","Application Data"
"3577","291.711887099","2a03:2880:f258:1c3:face:b00c:0:167","2a00:a041:3c5d:4d00:424b:6377:a930:43d","TCP","88","443  >  41660 [ACK] Seq=6355 Ack=5897 Win=991 Len=0 TSval=3183528806 TSecr=2768479400"
"3578","291.724892251","2a03:2880:f258:1c3:face:b00c:0:167","2a00:a041:3c5d:4d00:424b:6377:a930:43d","TCP","88","443  >  41660 [ACK] Seq=6355 Ack=5989 Win=991 Len=0 TSval=3183528818 TSecr=2768479444"
"3579","292.645721306","2a00:a041:3c5d:4d00:424b:6377:a930:43d","2a03:2880:f258:1c3:face:b00c:0:167","TLSv1.2","158","Application Data"
"3580","292.725768296","2a03:2880:f258:1c3:face:b00c:0:167","2a00:a041:3c5d:4d00:424b:6377:a930:43d","TCP","88","443  >  41660 [ACK] Seq=6355 Ack=6059 Win=991 Len=0 TSval=3183529819 TSecr=2768480441"
"3581","292.805337051","2a03:2880:f258:1c3:face:b00c:0:167","2a00:a041:3c5d:4d00:424b:6377:a930:43d","TLSv1.2","160","Application Data"
"3582","292.851398568","2a00:a041:3c5d:4d00:424b:6377:a930:43d","2a03:2880:f258:1c3:face:b00c:0:167","TCP","88","41660  >  443 [ACK] Seq=6059 Ack=6427 Win=1193 Len=0 TSval=2768480647 TSecr=3183529899"
