"No.","Time","Source","Destination","Protocol","Length","Info"
"5","3.379087926","2a10:8012:21:4188:cd91:9afe:93c7:a048","2a03:2880:f242:c8:face:b00c:0:167","TLSv1.2","157","Application Data"
"6","3.423786234","2a03:2880:f242:c8:face:b00c:0:167","2a10:8012:21:4188:cd91:9afe:93c7:a048","TCP","88","443  >  40532 [ACK] Seq=1 Ack=70 Win=772 Len=0 TSval=2609976035 TSecr=921429540"
"7","3.584574325","2a03:2880:f242:c8:face:b00c:0:167","2a10:8012:21:4188:cd91:9afe:93c7:a048","TLSv1.2","159","Application Data"
"8","3.584611845","2a10:8012:21:4188:cd91:9afe:93c7:a048","2a03:2880:f242:c8:face:b00c:0:167","TCP","88","40532  >  443 [ACK] Seq=70 Ack=72 Win=2122 Len=0 TSval=921429745 TSecr=2609976166"
"11","8.472936869","2a10:8012:21:4188:cd91:9afe:93c7:a048","2a03:2880:f242:c8:face:b00c:0:167","TLSv1.2","154","Application Data"
"12","8.516114549","2a03:2880:f242:c8:face:b00c:0:167","2a10:8012:21:4188:cd91:9afe:93c7:a048","TCP","88","443  >  40532 [ACK] Seq=72 Ack=136 Win=772 Len=0 TSval=2609981128 TSecr=921434634"
"13","8.807516149","2a03:2880:f242:c8:face:b00c:0:167","2a10:8012:21:4188:cd91:9afe:93c7:a048","TLSv1.2","198","Application Data"
"14","8.807560992","2a10:8012:21:4188:cd91:9afe:93c7:a048","2a03:2880:f242:c8:face:b00c:0:167","TCP","88","40532  >  443 [ACK] Seq=136 Ack=182 Win=2122 Len=0 TSval=921434968 TSecr=2609981374"
"21","21.373507571","2a10:8012:21:4188:cd91:9afe:93c7:a048","2a03:2880:f242:c8:face:b00c:0:167","TLSv1.2","157","Application Data"
"22","21.418121421","2a03:2880:f242:c8:face:b00c:0:167","2a10:8012:21:4188:cd91:9afe:93c7:a048","TCP","88","443  >  40532 [ACK] Seq=182 Ack=205 Win=772 Len=0 TSval=2609994029 TSecr=921447534"
"23","21.606745431","2a03:2880:f242:c8:face:b00c:0:167","2a10:8012:21:4188:cd91:9afe:93c7:a048","TLSv1.2","159","Application Data"
"24","21.606784246","2a10:8012:21:4188:cd91:9afe:93c7:a048","2a03:2880:f242:c8:face:b00c:0:167","TCP","88","40532  >  443 [ACK] Seq=205 Ack=253 Win=2122 Len=0 TSval=921447768 TSecr=2609994160"
"31","33.793550702","2a03:2880:f242:c8:face:b00c:0:167","2a10:8012:21:4188:cd91:9afe:93c7:a048","TLSv1.2","903","Application Data"
"32","33.793588797","2a10:8012:21:4188:cd91:9afe:93c7:a048","2a03:2880:f242:c8:face:b00c:0:167","TCP","88","40532  >  443 [ACK] Seq=205 Ack=1068 Win=2126 Len=0 TSval=921459954 TSecr=2610006298"
"33","34.313315770","2a10:8012:21:4188:cd91:9afe:93c7:a048","2a03:2880:f242:c8:face:b00c:0:167","TLSv1.2","177","Application Data"
"34","34.357895128","2a03:2880:f242:c8:face:b00c:0:167","2a10:8012:21:4188:cd91:9afe:93c7:a048","TCP","88","443  >  40532 [ACK] Seq=1068 Ack=294 Win=772 Len=0 TSval=2610006969 TSecr=921460474"
"35","34.453693384","2a10:8012:21:4188:cd91:9afe:93c7:a048","2a03:2880:f242:c8:face:b00c:0:167","TLSv1.2","179","Application Data"
"36","34.454091720","2a10:8012:21:4188:cd91:9afe:93c7:a048","2a03:2880:f242:c8:face:b00c:0:167","TLSv1.2","179","Application Data"
"37","34.459218320","2a10:8012:21:4188:cd91:9afe:93c7:a048","2a03:2880:f242:c8:face:b00c:0:167","TLSv1.2","162","Application Data"
"38","34.495683404","2a03:2880:f242:c8:face:b00c:0:167","2a10:8012:21:4188:cd91:9afe:93c7:a048","TCP","88","443  >  40532 [ACK] Seq=1068 Ack=385 Win=772 Len=0 TSval=2610007107 TSecr=921460615"
"39","34.496614784","2a03:2880:f242:c8:face:b00c:0:167","2a10:8012:21:4188:cd91:9afe:93c7:a048","TCP","88","443  >  40532 [ACK] Seq=1068 Ack=476 Win=772 Len=0 TSval=2610007108 TSecr=921460615"
"40","34.501631379","2a03:2880:f242:c8:face:b00c:0:167","2a10:8012:21:4188:cd91:9afe:93c7:a048","TCP","88","443  >  40532 [ACK] Seq=1068 Ack=550 Win=772 Len=0 TSval=2610007113 TSecr=921460620"
"41","37.534336989","2a10:8012:21:4188:cd91:9afe:93c7:a048","2a03:2880:f242:c8:face:b00c:0:167","TLSv1.2","157","Application Data"
"42","37.579105022","2a03:2880:f242:c8:face:b00c:0:167","2a10:8012:21:4188:cd91:9afe:93c7:a048","TCP","88","443  >  40532 [ACK] Seq=1068 Ack=619 Win=772 Len=0 TSval=2610010190 TSecr=921463695"
"43","37.786441908","2a03:2880:f242:c8:face:b00c:0:167","2a10:8012:21:4188:cd91:9afe:93c7:a048","TLSv1.2","159","Application Data"
"44","37.786482912","2a10:8012:21:4188:cd91:9afe:93c7:a048","2a03:2880:f242:c8:face:b00c:0:167","TCP","88","40532  >  443 [ACK] Seq=619 Ack=1139 Win=2126 Len=0 TSval=921463947 TSecr=2610010322"
"45","38.811350803","2a03:2880:f242:c8:face:b00c:0:167","2a10:8012:21:4188:cd91:9afe:93c7:a048","TLSv1.2","181","Application Data"
"46","38.811405295","2a10:8012:21:4188:cd91:9afe:93c7:a048","2a03:2880:f242:c8:face:b00c:0:167","TCP","88","40532  >  443 [ACK] Seq=619 Ack=1232 Win=2126 Len=0 TSval=921464972 TSecr=2610011322"
"47","39.815139253","2a10:8012:21:4188:cd91:9afe:93c7:a048","2a03:2880:f242:c8:face:b00c:0:167","TLSv1.2","180","Application Data"
"48","39.859897487","2a03:2880:f242:c8:face:b00c:0:167","2a10:8012:21:4188:cd91:9afe:93c7:a048","TCP","88","443  >  40532 [ACK] Seq=1232 Ack=711 Win=772 Len=0 TSval=2610012472 TSecr=921465976"
"49","41.063140282","2a03:2880:f242:c8:face:b00c:0:167","2a10:8012:21:4188:cd91:9afe:93c7:a048","TLSv1.2","364","Application Data"
"50","41.063161233","2a10:8012:21:4188:cd91:9afe:93c7:a048","2a03:2880:f242:c8:face:b00c:0:167","TCP","88","40532  >  443 [ACK] Seq=711 Ack=1508 Win=2126 Len=0 TSval=921467224 TSecr=2610013518"
"59","44.750935308","2a03:2880:f242:c8:face:b00c:0:167","2a10:8012:21:4188:cd91:9afe:93c7:a048","TLSv1.2","1112","Application Data"
"60","44.750968171","2a10:8012:21:4188:cd91:9afe:93c7:a048","2a03:2880:f242:c8:face:b00c:0:167","TCP","88","40532  >  443 [ACK] Seq=711 Ack=2532 Win=2126 Len=0 TSval=921470912 TSecr=2610017298"
"63","47.531350211","2a10:8012:21:4188:cd91:9afe:93c7:a048","2a03:2880:f242:1c2:face:b00c:0:167","TLSv1.2","112","Application Data"
"64","47.531394676","2a10:8012:21:4188:cd91:9afe:93c7:a048","2a03:2880:f242:1c2:face:b00c:0:167","TCP","88","49740  >  443 [FIN, ACK] Seq=25 Ack=1 Win=501 Len=0 TSval=3605894160 TSecr=3661015265"
"65","47.616838544","2a03:2880:f242:1c2:face:b00c:0:167","2a10:8012:21:4188:cd91:9afe:93c7:a048","TCP","88","443  >  49740 [ACK] Seq=1 Ack=25 Win=272 Len=0 TSval=3661075313 TSecr=3605894160"
"66","47.616838830","2a03:2880:f242:1c2:face:b00c:0:167","2a10:8012:21:4188:cd91:9afe:93c7:a048","TLSv1.2","112","Application Data"
"67","47.616902956","2a10:8012:21:4188:cd91:9afe:93c7:a048","2a03:2880:f242:1c2:face:b00c:0:167","TCP","76","49740  >  443 [RST] Seq=25 Win=0 Len=0"
"68","47.617751883","2a03:2880:f242:1c2:face:b00c:0:167","2a10:8012:21:4188:cd91:9afe:93c7:a048","TCP","88","443  >  49740 [FIN, ACK] Seq=25 Ack=25 Win=272 Len=0 TSval=3661075313 TSecr=3605894160"
"69","47.617752088","2a03:2880:f242:1c2:face:b00c:0:167","2a10:8012:21:4188:cd91:9afe:93c7:a048","TCP","88","443  >  49740 [ACK] Seq=26 Ack=26 Win=272 Len=0 TSval=3661075314 TSecr=3605894160"
"70","47.617771385","2a10:8012:21:4188:cd91:9afe:93c7:a048","2a03:2880:f242:1c2:face:b00c:0:167","TCP","76","49740  >  443 [RST] Seq=25 Win=0 Len=0"
"71","47.617786479","2a10:8012:21:4188:cd91:9afe:93c7:a048","2a03:2880:f242:1c2:face:b00c:0:167","TCP","76","49740  >  443 [RST] Seq=26 Win=0 Len=0"
"72","50.757173152","2a10:8012:21:4188:cd91:9afe:93c7:a048","2a03:2880:f242:c8:face:b00c:0:167","TLSv1.2","160","Application Data"
"73","50.801017435","2a03:2880:f242:c8:face:b00c:0:167","2a10:8012:21:4188:cd91:9afe:93c7:a048","TCP","88","443  >  40532 [ACK] Seq=2532 Ack=783 Win=772 Len=0 TSval=2610023413 TSecr=921476918"
"81","62.431747073","2a10:8012:21:4188:cd91:9afe:93c7:a048","2a03:2880:f242:c8:face:b00c:0:167","TLSv1.2","157","Application Data"
"82","62.484031632","2a03:2880:f242:c8:face:b00c:0:167","2a10:8012:21:4188:cd91:9afe:93c7:a048","TCP","88","443  >  40532 [ACK] Seq=2532 Ack=852 Win=772 Len=0 TSval=2610035088 TSecr=921488593"
"83","62.673339350","2a03:2880:f242:c8:face:b00c:0:167","2a10:8012:21:4188:cd91:9afe:93c7:a048","TLSv1.2","159","Application Data"
"85","62.673377914","2a10:8012:21:4188:cd91:9afe:93c7:a048","2a03:2880:f242:c8:face:b00c:0:167","TCP","88","40532  >  443 [ACK] Seq=852 Ack=2603 Win=2126 Len=0 TSval=921488834 TSecr=2610035219"
"98","64.591716002","2a10:8012:21:4188:cd91:9afe:93c7:a048","2a03:2880:f242:1c2:face:b00c:0:167","TCP","96","41538  >  443 [SYN] Seq=0 Win=64260 Len=0 MSS=1428 SACK_PERM=1 TSval=3605911221 TSecr=0 WS=128"
"99","64.634140898","2a03:2880:f242:1c2:face:b00c:0:167","2a10:8012:21:4188:cd91:9afe:93c7:a048","TCP","96","443  >  41538 [SYN, ACK] Seq=0 Ack=1 Win=65535 Len=0 MSS=1392 SACK_PERM=1 TSval=3675966093 TSecr=3605911221 WS=256"
"100","64.634182324","2a10:8012:21:4188:cd91:9afe:93c7:a048","2a03:2880:f242:1c2:face:b00c:0:167","TCP","88","41538  >  443 [ACK] Seq=1 Ack=1 Win=64384 Len=0 TSval=3605911263 TSecr=3675966093"
"101","64.634990038","2a10:8012:21:4188:cd91:9afe:93c7:a048","2a03:2880:f242:1c2:face:b00c:0:167","TLSv1.3","782","Client Hello"
"102","64.677203344","2a03:2880:f242:1c2:face:b00c:0:167","2a10:8012:21:4188:cd91:9afe:93c7:a048","TCP","88","443  >  41538 [ACK] Seq=1 Ack=695 Win=67072 Len=0 TSval=3675966136 TSecr=3605911264"
"103","64.677651711","2a03:2880:f242:1c2:face:b00c:0:167","2a10:8012:21:4188:cd91:9afe:93c7:a048","TLSv1.3","253","Server Hello, Application Data"
"104","64.677674728","2a10:8012:21:4188:cd91:9afe:93c7:a048","2a03:2880:f242:1c2:face:b00c:0:167","TCP","88","41538  >  443 [ACK] Seq=695 Ack=166 Win=64256 Len=0 TSval=3605911306 TSecr=3675966137"
"105","64.678000045","2a10:8012:21:4188:cd91:9afe:93c7:a048","2a03:2880:f242:1c2:face:b00c:0:167","TLSv1.3","94","Change Cipher Spec"
"106","64.678108073","2a10:8012:21:4188:cd91:9afe:93c7:a048","2a03:2880:f242:1c2:face:b00c:0:167","TLSv1.3","146","Application Data"
"107","64.679563099","2a10:8012:21:4188:cd91:9afe:93c7:a048","2a03:2880:f242:1c2:face:b00c:0:167","TLSv1.3","689","Application Data"
"108","64.719796161","2a03:2880:f242:1c2:face:b00c:0:167","2a10:8012:21:4188:cd91:9afe:93c7:a048","TCP","88","443  >  41538 [ACK] Seq=166 Ack=759 Win=67072 Len=0 TSval=3675966179 TSecr=3605911307"
"109","64.720160912","2a03:2880:f242:1c2:face:b00c:0:167","2a10:8012:21:4188:cd91:9afe:93c7:a048","TLSv1.3","257","Application Data"
"110","64.762748740","2a03:2880:f242:1c2:face:b00c:0:167","2a10:8012:21:4188:cd91:9afe:93c7:a048","TCP","88","443  >  41538 [ACK] Seq=335 Ack=1360 Win=68352 Len=0 TSval=3675966222 TSecr=3605911308"
"111","64.762788207","2a10:8012:21:4188:cd91:9afe:93c7:a048","2a03:2880:f242:1c2:face:b00c:0:167","TCP","88","41538  >  443 [ACK] Seq=1360 Ack=335 Win=64128 Len=0 TSval=3605911392 TSecr=3675966180"
"112","64.790627620","2a03:2880:f242:1c2:face:b00c:0:167","2a10:8012:21:4188:cd91:9afe:93c7:a048","TLSv1.3","2134","Application Data, Application Data"
"113","64.790627887","2a03:2880:f242:1c2:face:b00c:0:167","2a10:8012:21:4188:cd91:9afe:93c7:a048","TLSv1.3","2848","Application Data"
"114","64.790627932","2a03:2880:f242:1c2:face:b00c:0:167","2a10:8012:21:4188:cd91:9afe:93c7:a048","TLSv1.3","2848","Application Data, Application Data"
"115","64.790627980","2a03:2880:f242:1c2:face:b00c:0:167","2a10:8012:21:4188:cd91:9afe:93c7:a048","TLSv1.3","2848","Application Data, Application Data"
"116","64.790836310","2a10:8012:21:4188:cd91:9afe:93c7:a048","2a03:2880:f242:1c2:face:b00c:0:167","TCP","88","41538  >  443 [ACK] Seq=1360 Ack=10661 Win=53888 Len=0 TSval=3605911420 TSecr=3675966250"
"117","64.793357040","2a03:2880:f242:1c2:face:b00c:0:167","2a10:8012:21:4188:cd91:9afe:93c7:a048","TCP","2848","443  >  41538 [PSH, ACK] Seq=10661 Ack=1360 Win=68352 Len=2760 TSval=3675966253 TSecr=3605911308 [TCP segment of a reassembled PDU]"
"118","64.793375704","2a10:8012:21:4188:cd91:9afe:93c7:a048","2a03:2880:f242:1c2:face:b00c:0:167","TCP","88","41538  >  443 [ACK] Seq=1360 Ack=13421 Win=61056 Len=0 TSval=3605911422 TSecr=3675966253"
"119","64.804928859","2a03:2880:f242:1c2:face:b00c:0:167","2a10:8012:21:4188:cd91:9afe:93c7:a048","TLSv1.3","2848","Application Data [TCP segment of a reassembled PDU]"
"120","64.804967851","2a10:8012:21:4188:cd91:9afe:93c7:a048","2a03:2880:f242:1c2:face:b00c:0:167","TCP","88","41538  >  443 [ACK] Seq=1360 Ack=16181 Win=61056 Len=0 TSval=3605911434 TSecr=3675966264"
"121","64.832924403","2a03:2880:f242:1c2:face:b00c:0:167","2a10:8012:21:4188:cd91:9afe:93c7:a048","TLSv1.3","2848","Application Data [TCP segment of a reassembled PDU]"
"122","64.832955236","2a10:8012:21:4188:cd91:9afe:93c7:a048","2a03:2880:f242:1c2:face:b00c:0:167","TCP","88","41538  >  443 [ACK] Seq=1360 Ack=18941 Win=61056 Len=0 TSval=3605911462 TSecr=3675966292"
"123","64.834405331","2a03:2880:f242:1c2:face:b00c:0:167","2a10:8012:21:4188:cd91:9afe:93c7:a048","TLSv1.3","1734","Application Data, Application Data"
"124","64.834421852","2a10:8012:21:4188:cd91:9afe:93c7:a048","2a03:2880:f242:1c2:face:b00c:0:167","TCP","88","41538  >  443 [ACK] Seq=1360 Ack=20587 Win=61056 Len=0 TSval=3605911463 TSecr=3675966294"
"129","75.265886715","2a03:2880:f242:c8:face:b00c:0:167","2a10:8012:21:4188:cd91:9afe:93c7:a048","TLSv1.2","903","Application Data"
"130","75.265922874","2a10:8012:21:4188:cd91:9afe:93c7:a048","2a03:2880:f242:c8:face:b00c:0:167","TCP","88","40532  >  443 [ACK] Seq=852 Ack=3418 Win=2126 Len=0 TSval=921501427 TSecr=2610047789"
"131","75.675787836","2a03:2880:f242:c8:face:b00c:0:167","2a10:8012:21:4188:cd91:9afe:93c7:a048","TLSv1.2","312","Application Data"
"132","75.675821929","2a10:8012:21:4188:cd91:9afe:93c7:a048","2a03:2880:f242:c8:face:b00c:0:167","TCP","88","40532  >  443 [ACK] Seq=852 Ack=3642 Win=2126 Len=0 TSval=921501837 TSecr=2610048211"
"133","78.645029306","2a03:2880:f242:c8:face:b00c:0:167","2a10:8012:21:4188:cd91:9afe:93c7:a048","TLSv1.2","181","Application Data"
"134","78.645066844","2a10:8012:21:4188:cd91:9afe:93c7:a048","2a03:2880:f242:c8:face:b00c:0:167","TCP","88","40532  >  443 [ACK] Seq=852 Ack=3735 Win=2126 Len=0 TSval=921504806 TSecr=2610051213"
"135","78.649115777","2a10:8012:21:4188:cd91:9afe:93c7:a048","2a03:2880:f242:c8:face:b00c:0:167","TLSv1.2","180","Application Data"
"136","78.691405116","2a03:2880:f242:c8:face:b00c:0:167","2a10:8012:21:4188:cd91:9afe:93c7:a048","TCP","88","443  >  40532 [ACK] Seq=3735 Ack=944 Win=772 Len=0 TSval=2610051303 TSecr=921504810"
"141","84.816857056","2a10:8012:21:4188:cd91:9afe:93c7:a048","2a03:2880:f242:c8:face:b00c:0:167","TLSv1.2","157","Application Data"
"142","84.861260419","2a03:2880:f242:c8:face:b00c:0:167","2a10:8012:21:4188:cd91:9afe:93c7:a048","TCP","88","443  >  40532 [ACK] Seq=3735 Ack=1013 Win=772 Len=0 TSval=2610057473 TSecr=921510978"
"143","85.095744235","2a03:2880:f242:c8:face:b00c:0:167","2a10:8012:21:4188:cd91:9afe:93c7:a048","TLSv1.2","159","Application Data"
"144","85.139646709","2a10:8012:21:4188:cd91:9afe:93c7:a048","2a03:2880:f242:c8:face:b00c:0:167","TCP","88","40532  >  443 [ACK] Seq=1013 Ack=3806 Win=2126 Len=0 TSval=921511300 TSecr=2610057604"
"154","95.052919829","2a10:8012:21:4188:cd91:9afe:93c7:a048","2a03:2880:f242:c8:face:b00c:0:167","TLSv1.2","184","Application Data"
"155","95.096877312","2a03:2880:f242:c8:face:b00c:0:167","2a10:8012:21:4188:cd91:9afe:93c7:a048","TCP","88","443  >  40532 [ACK] Seq=3806 Ack=1109 Win=772 Len=0 TSval=2610067708 TSecr=921521214"
"157","95.634584336","2a10:8012:21:4188:cd91:9afe:93c7:a048","2a03:2880:f242:c8:face:b00c:0:167","TLSv1.2","161","Application Data"
"158","95.678378415","2a03:2880:f242:c8:face:b00c:0:167","2a10:8012:21:4188:cd91:9afe:93c7:a048","TCP","88","443  >  40532 [ACK] Seq=3806 Ack=1182 Win=772 Len=0 TSval=2610068290 TSecr=921521795"
"163","102.204270035","2a10:8012:21:4188:cd91:9afe:93c7:a048","2a03:2880:f242:c8:face:b00c:0:167","TLSv1.2","169","Application Data"
"164","102.248284729","2a03:2880:f242:c8:face:b00c:0:167","2a10:8012:21:4188:cd91:9afe:93c7:a048","TCP","88","443  >  40532 [ACK] Seq=3806 Ack=1263 Win=772 Len=0 TSval=2610074860 TSecr=921528365"
"167","104.191079237","2a10:8012:21:4188:cd91:9afe:93c7:a048","2a03:2880:f242:1c2:face:b00c:0:167","TLSv1.3","710","Application Data"
"168","104.235671129","2a03:2880:f242:1c2:face:b00c:0:167","2a10:8012:21:4188:cd91:9afe:93c7:a048","TCP","88","443  >  41538 [ACK] Seq=20587 Ack=1982 Win=69888 Len=0 TSval=3676005695 TSecr=3605950820"
"169","104.236730163","2a03:2880:f242:1c2:face:b00c:0:167","2a10:8012:21:4188:cd91:9afe:93c7:a048","TLSv1.3","1113","Application Data"
"170","104.237268797","2a03:2880:f242:1c2:face:b00c:0:167","2a10:8012:21:4188:cd91:9afe:93c7:a048","TLSv1.3","2848","Application Data"
"171","104.237345908","2a10:8012:21:4188:cd91:9afe:93c7:a048","2a03:2880:f242:1c2:face:b00c:0:167","TCP","88","41538  >  443 [ACK] Seq=1982 Ack=24372 Win=61056 Len=0 TSval=3605950866 TSecr=3676005696"
"172","104.240274760","2a03:2880:f242:1c2:face:b00c:0:167","2a10:8012:21:4188:cd91:9afe:93c7:a048","TCP","2848","443  >  41538 [PSH, ACK] Seq=24372 Ack=1982 Win=69888 Len=2760 TSval=3676005699 TSecr=3605950820 [TCP segment of a reassembled PDU]"
"173","104.240280013","2a10:8012:21:4188:cd91:9afe:93c7:a048","2a03:2880:f242:1c2:face:b00c:0:167","TCP","88","41538  >  443 [ACK] Seq=1982 Ack=27132 Win=61056 Len=0 TSval=3605950869 TSecr=3676005699"
"174","104.243683786","2a03:2880:f242:1c2:face:b00c:0:167","2a10:8012:21:4188:cd91:9afe:93c7:a048","TCP","2848","443  >  41538 [PSH, ACK] Seq=27132 Ack=1982 Win=69888 Len=2760 TSval=3676005702 TSecr=3605950820 [TCP segment of a reassembled PDU]"
"175","104.243688499","2a10:8012:21:4188:cd91:9afe:93c7:a048","2a03:2880:f242:1c2:face:b00c:0:167","TCP","88","41538  >  443 [ACK] Seq=1982 Ack=29892 Win=61056 Len=0 TSval=3605950873 TSecr=3676005702"
"176","104.246234997","2a03:2880:f242:1c2:face:b00c:0:167","2a10:8012:21:4188:cd91:9afe:93c7:a048","TCP","2848","443  >  41538 [PSH, ACK] Seq=29892 Ack=1982 Win=69888 Len=2760 TSval=3676005705 TSecr=3605950820 [TCP segment of a reassembled PDU]"
"177","104.246238205","2a10:8012:21:4188:cd91:9afe:93c7:a048","2a03:2880:f242:1c2:face:b00c:0:167","TCP","88","41538  >  443 [ACK] Seq=1982 Ack=32652 Win=61056 Len=0 TSval=3605950875 TSecr=3676005705"
"178","104.249245382","2a03:2880:f242:1c2:face:b00c:0:167","2a10:8012:21:4188:cd91:9afe:93c7:a048","TCP","2848","443  >  41538 [PSH, ACK] Seq=32652 Ack=1982 Win=69888 Len=2760 TSval=3676005708 TSecr=3605950820 [TCP segment of a reassembled PDU]"
"179","104.249249249","2a10:8012:21:4188:cd91:9afe:93c7:a048","2a03:2880:f242:1c2:face:b00c:0:167","TCP","88","41538  >  443 [ACK] Seq=1982 Ack=35412 Win=61056 Len=0 TSval=3605950878 TSecr=3676005708"
"180","104.252350239","2a03:2880:f242:1c2:face:b00c:0:167","2a10:8012:21:4188:cd91:9afe:93c7:a048","TCP","2848","443  >  41538 [PSH, ACK] Seq=35412 Ack=1982 Win=69888 Len=2760 TSval=3676005711 TSecr=3605950820 [TCP segment of a reassembled PDU]"
"181","104.252358275","2a10:8012:21:4188:cd91:9afe:93c7:a048","2a03:2880:f242:1c2:face:b00c:0:167","TCP","88","41538  >  443 [ACK] Seq=1982 Ack=38172 Win=61056 Len=0 TSval=3605950881 TSecr=3676005711"
"182","104.255277247","2a03:2880:f242:1c2:face:b00c:0:167","2a10:8012:21:4188:cd91:9afe:93c7:a048","TLSv1.3","2848","Application Data [TCP segment of a reassembled PDU]"
"183","104.255299057","2a10:8012:21:4188:cd91:9afe:93c7:a048","2a03:2880:f242:1c2:face:b00c:0:167","TCP","88","41538  >  443 [ACK] Seq=1982 Ack=40932 Win=61056 Len=0 TSval=3605950884 TSecr=3676005714"
"184","104.258280536","2a03:2880:f242:1c2:face:b00c:0:167","2a10:8012:21:4188:cd91:9afe:93c7:a048","TCP","2848","443  >  41538 [PSH, ACK] Seq=40932 Ack=1982 Win=69888 Len=2760 TSval=3676005717 TSecr=3605950820 [TCP segment of a reassembled PDU]"
"185","104.258336146","2a10:8012:21:4188:cd91:9afe:93c7:a048","2a03:2880:f242:1c2:face:b00c:0:167","TCP","88","41538  >  443 [ACK] Seq=1982 Ack=43692 Win=61056 Len=0 TSval=3605950887 TSecr=3676005717"
"186","104.258664914","2a10:8012:21:4188:cd91:9afe:93c7:a048","2a03:2880:f242:c8:face:b00c:0:167","TLSv1.2","181","Application Data"
"187","104.261354480","2a03:2880:f242:1c2:face:b00c:0:167","2a10:8012:21:4188:cd91:9afe:93c7:a048","TCP","2848","443  >  41538 [PSH, ACK] Seq=43692 Ack=1982 Win=69888 Len=2760 TSval=3676005720 TSecr=3605950820 [TCP segment of a reassembled PDU]"
"188","104.261441017","2a10:8012:21:4188:cd91:9afe:93c7:a048","2a03:2880:f242:1c2:face:b00c:0:167","TCP","88","41538  >  443 [ACK] Seq=1982 Ack=46452 Win=61056 Len=0 TSval=3605950890 TSecr=3676005720"
"189","104.264335599","2a03:2880:f242:1c2:face:b00c:0:167","2a10:8012:21:4188:cd91:9afe:93c7:a048","TCP","2848","443  >  41538 [PSH, ACK] Seq=46452 Ack=1982 Win=69888 Len=2760 TSval=3676005723 TSecr=3605950820 [TCP segment of a reassembled PDU]"
"190","104.264347883","2a10:8012:21:4188:cd91:9afe:93c7:a048","2a03:2880:f242:1c2:face:b00c:0:167","TCP","88","41538  >  443 [ACK] Seq=1982 Ack=49212 Win=61056 Len=0 TSval=3605950893 TSecr=3676005723"
"191","104.267822875","2a03:2880:f242:1c2:face:b00c:0:167","2a10:8012:21:4188:cd91:9afe:93c7:a048","TCP","2848","443  >  41538 [PSH, ACK] Seq=49212 Ack=1982 Win=69888 Len=2760 TSval=3676005726 TSecr=3605950820 [TCP segment of a reassembled PDU]"
"192","104.267838828","2a10:8012:21:4188:cd91:9afe:93c7:a048","2a03:2880:f242:1c2:face:b00c:0:167","TCP","88","41538  >  443 [ACK] Seq=1982 Ack=51972 Win=61056 Len=0 TSval=3605950897 TSecr=3676005726"
"193","104.270371379","2a03:2880:f242:1c2:face:b00c:0:167","2a10:8012:21:4188:cd91:9afe:93c7:a048","TCP","2848","443  >  41538 [PSH, ACK] Seq=51972 Ack=1982 Win=69888 Len=2760 TSval=3676005729 TSecr=3605950820 [TCP segment of a reassembled PDU]"
"194","104.270382637","2a10:8012:21:4188:cd91:9afe:93c7:a048","2a03:2880:f242:1c2:face:b00c:0:167","TCP","88","41538  >  443 [ACK] Seq=1982 Ack=54732 Win=61056 Len=0 TSval=3605950899 TSecr=3676005729"
"195","104.279408672","2a03:2880:f242:1c2:face:b00c:0:167","2a10:8012:21:4188:cd91:9afe:93c7:a048","TLSv1.3","2848","Application Data [TCP segment of a reassembled PDU]"
"196","104.279467206","2a10:8012:21:4188:cd91:9afe:93c7:a048","2a03:2880:f242:1c2:face:b00c:0:167","TCP","88","41538  >  443 [ACK] Seq=1982 Ack=57492 Win=61056 Len=0 TSval=3605950908 TSecr=3676005739"
"197","104.281115263","2a03:2880:f242:1c2:face:b00c:0:167","2a10:8012:21:4188:cd91:9afe:93c7:a048","TCP","2848","443  >  41538 [PSH, ACK] Seq=57492 Ack=1982 Win=69888 Len=2760 TSval=3676005740 TSecr=3605950866 [TCP segment of a reassembled PDU]"
"198","104.281173499","2a10:8012:21:4188:cd91:9afe:93c7:a048","2a03:2880:f242:1c2:face:b00c:0:167","TCP","88","41538  >  443 [ACK] Seq=1982 Ack=60252 Win=69760 Len=0 TSval=3605950910 TSecr=3676005740"
"199","104.283866974","2a03:2880:f242:1c2:face:b00c:0:167","2a10:8012:21:4188:cd91:9afe:93c7:a048","TCP","2848","443  >  41538 [PSH, ACK] Seq=60252 Ack=1982 Win=69888 Len=2760 TSval=3676005743 TSecr=3605950866 [TCP segment of a reassembled PDU]"
"200","104.283888181","2a10:8012:21:4188:cd91:9afe:93c7:a048","2a03:2880:f242:1c2:face:b00c:0:167","TCP","88","41538  >  443 [ACK] Seq=1982 Ack=63012 Win=75264 Len=0 TSval=3605950913 TSecr=3676005743"
"201","104.287103386","2a03:2880:f242:1c2:face:b00c:0:167","2a10:8012:21:4188:cd91:9afe:93c7:a048","TCP","1468","443  >  41538 [PSH, ACK] Seq=63012 Ack=1982 Win=69888 Len=1380 TSval=3676005746 TSecr=3605950866 [TCP segment of a reassembled PDU]"
"202","104.289059726","2a03:2880:f242:1c2:face:b00c:0:167","2a10:8012:21:4188:cd91:9afe:93c7:a048","TCP","2848","443  >  41538 [PSH, ACK] Seq=64392 Ack=1982 Win=69888 Len=2760 TSval=3676005748 TSecr=3605950869 [TCP segment of a reassembled PDU]"
"203","104.289078209","2a10:8012:21:4188:cd91:9afe:93c7:a048","2a03:2880:f242:1c2:face:b00c:0:167","TCP","88","41538  >  443 [ACK] Seq=1982 Ack=67152 Win=83456 Len=0 TSval=3605950918 TSecr=3676005746"
"204","104.291448480","2a03:2880:f242:1c2:face:b00c:0:167","2a10:8012:21:4188:cd91:9afe:93c7:a048","TCP","2848","443  >  41538 [PSH, ACK] Seq=67152 Ack=1982 Win=69888 Len=2760 TSval=3676005751 TSecr=3605950869 [TCP segment of a reassembled PDU]"
"205","104.291464709","2a10:8012:21:4188:cd91:9afe:93c7:a048","2a03:2880:f242:1c2:face:b00c:0:167","TCP","88","41538  >  443 [ACK] Seq=1982 Ack=69912 Win=88960 Len=0 TSval=3605950920 TSecr=3676005751"
"206","104.294480916","2a03:2880:f242:1c2:face:b00c:0:167","2a10:8012:21:4188:cd91:9afe:93c7:a048","TLSv1.3","2848","Application Data [TCP segment of a reassembled PDU]"
"207","104.294513497","2a10:8012:21:4188:cd91:9afe:93c7:a048","2a03:2880:f242:1c2:face:b00c:0:167","TCP","88","41538  >  443 [ACK] Seq=1982 Ack=72672 Win=94592 Len=0 TSval=3605950923 TSecr=3676005754"
"208","104.297653748","2a03:2880:f242:1c2:face:b00c:0:167","2a10:8012:21:4188:cd91:9afe:93c7:a048","TCP","2848","443  >  41538 [PSH, ACK] Seq=72672 Ack=1982 Win=69888 Len=2760 TSval=3676005757 TSecr=3605950878 [TCP segment of a reassembled PDU]"
"209","104.297688721","2a10:8012:21:4188:cd91:9afe:93c7:a048","2a03:2880:f242:1c2:face:b00c:0:167","TCP","88","41538  >  443 [ACK] Seq=1982 Ack=75432 Win=100096 Len=0 TSval=3605950926 TSecr=3676005757"
"210","104.300774124","2a03:2880:f242:1c2:face:b00c:0:167","2a10:8012:21:4188:cd91:9afe:93c7:a048","TCP","2848","443  >  41538 [PSH, ACK] Seq=75432 Ack=1982 Win=69888 Len=2760 TSval=3676005760 TSecr=3605950881 [TCP segment of a reassembled PDU]"
"211","104.300797515","2a10:8012:21:4188:cd91:9afe:93c7:a048","2a03:2880:f242:1c2:face:b00c:0:167","TCP","88","41538  >  443 [ACK] Seq=1982 Ack=78192 Win=105600 Len=0 TSval=3605950930 TSecr=3676005760"
"212","104.301649957","2a03:2880:f242:c8:face:b00c:0:167","2a10:8012:21:4188:cd91:9afe:93c7:a048","TCP","88","443  >  40532 [ACK] Seq=3806 Ack=1356 Win=772 Len=0 TSval=2610076913 TSecr=921530419"
"213","104.303459990","2a03:2880:f242:1c2:face:b00c:0:167","2a10:8012:21:4188:cd91:9afe:93c7:a048","TCP","2848","443  >  41538 [PSH, ACK] Seq=78192 Ack=1982 Win=69888 Len=2760 TSval=3676005763 TSecr=3605950884 [TCP segment of a reassembled PDU]"
"214","104.303482025","2a10:8012:21:4188:cd91:9afe:93c7:a048","2a03:2880:f242:1c2:face:b00c:0:167","TCP","88","41538  >  443 [ACK] Seq=1982 Ack=80952 Win=111104 Len=0 TSval=3605950932 TSecr=3676005763"
"215","104.306466360","2a03:2880:f242:1c2:face:b00c:0:167","2a10:8012:21:4188:cd91:9afe:93c7:a048","TCP","2848","443  >  41538 [PSH, ACK] Seq=80952 Ack=1982 Win=69888 Len=2760 TSval=3676005766 TSecr=3605950884 [TCP segment of a reassembled PDU]"
"216","104.306493542","2a10:8012:21:4188:cd91:9afe:93c7:a048","2a03:2880:f242:1c2:face:b00c:0:167","TCP","88","41538  >  443 [ACK] Seq=1982 Ack=83712 Win=116608 Len=0 TSval=3605950935 TSecr=3676005766"
"217","104.308965646","2a03:2880:f242:1c2:face:b00c:0:167","2a10:8012:21:4188:cd91:9afe:93c7:a048","TCP","2848","443  >  41538 [PSH, ACK] Seq=83712 Ack=1982 Win=69888 Len=2760 TSval=3676005768 TSecr=3605950890 [TCP segment of a reassembled PDU]"
"218","104.308987163","2a10:8012:21:4188:cd91:9afe:93c7:a048","2a03:2880:f242:1c2:face:b00c:0:167","TCP","88","41538  >  443 [ACK] Seq=1982 Ack=86472 Win=122112 Len=0 TSval=3605950938 TSecr=3676005768"
"219","104.311456688","2a03:2880:f242:1c2:face:b00c:0:167","2a10:8012:21:4188:cd91:9afe:93c7:a048","TLSv1.3","2848","Application Data, Application Data"
"220","104.311483115","2a10:8012:21:4188:cd91:9afe:93c7:a048","2a03:2880:f242:1c2:face:b00c:0:167","TCP","88","41538  >  443 [ACK] Seq=1982 Ack=89232 Win=127616 Len=0 TSval=3605950940 TSecr=3676005771"
"221","104.314170182","2a03:2880:f242:1c2:face:b00c:0:167","2a10:8012:21:4188:cd91:9afe:93c7:a048","TCP","2848","443  >  41538 [PSH, ACK] Seq=89232 Ack=1982 Win=69888 Len=2760 TSval=3676005773 TSecr=3605950893 [TCP segment of a reassembled PDU]"
"222","104.314204096","2a10:8012:21:4188:cd91:9afe:93c7:a048","2a03:2880:f242:1c2:face:b00c:0:167","TCP","88","41538  >  443 [ACK] Seq=1982 Ack=91992 Win=133120 Len=0 TSval=3605950943 TSecr=3676005773"
"223","104.316454526","2a03:2880:f242:1c2:face:b00c:0:167","2a10:8012:21:4188:cd91:9afe:93c7:a048","TLSv1.3","608","Application Data"
"224","104.359672278","2a10:8012:21:4188:cd91:9afe:93c7:a048","2a03:2880:f242:1c2:face:b00c:0:167","TCP","88","41538  >  443 [ACK] Seq=1982 Ack=92512 Win=135936 Len=0 TSval=3605950988 TSecr=3676005776"
"226","105.899396918","2a10:8012:21:4188:cd91:9afe:93c7:a048","2a03:2880:f242:c8:face:b00c:0:167","TLSv1.2","157","Application Data"
"227","105.943470266","2a03:2880:f242:c8:face:b00c:0:167","2a10:8012:21:4188:cd91:9afe:93c7:a048","TCP","88","443  >  40532 [ACK] Seq=3806 Ack=1425 Win=772 Len=0 TSval=2610078555 TSecr=921532060"
"228","106.087270186","2a03:2880:f242:c8:face:b00c:0:167","2a10:8012:21:4188:cd91:9afe:93c7:a048","TLSv1.2","159","Application Data"
"229","106.087309525","2a10:8012:21:4188:cd91:9afe:93c7:a048","2a03:2880:f242:c8:face:b00c:0:167","TCP","88","40532  >  443 [ACK] Seq=1425 Ack=3877 Win=2126 Len=0 TSval=921532248 TSecr=2610078686"
"230","107.561910108","2a10:8012:21:4188:cd91:9afe:93c7:a048","2a03:2880:f242:1c2:face:b00c:0:167","TLSv1.3","709","Application Data"
"231","107.562557630","2a10:8012:21:4188:cd91:9afe:93c7:a048","2a03:2880:f242:c8:face:b00c:0:167","TLSv1.2","181","Application Data"
"232","107.623472502","2a03:2880:f242:c8:face:b00c:0:167","2a10:8012:21:4188:cd91:9afe:93c7:a048","TCP","88","443  >  40532 [ACK] Seq=3877 Ack=1518 Win=772 Len=0 TSval=2610080218 TSecr=921533723"
"233","107.624997936","2a03:2880:f242:1c2:face:b00c:0:167","2a10:8012:21:4188:cd91:9afe:93c7:a048","TLSv1.3","2848","Application Data"
"234","107.624998093","2a03:2880:f242:1c2:face:b00c:0:167","2a10:8012:21:4188:cd91:9afe:93c7:a048","TCP","2848","443  >  41538 [PSH, ACK] Seq=95272 Ack=2603 Win=71168 Len=2760 TSval=3676009067 TSecr=3605954191 [TCP segment of a reassembled PDU]"
"235","107.625021247","2a10:8012:21:4188:cd91:9afe:93c7:a048","2a03:2880:f242:1c2:face:b00c:0:167","TCP","88","41538  >  443 [ACK] Seq=2603 Ack=95272 Win=141440 Len=0 TSval=3605954254 TSecr=3676009067"
"236","107.625035632","2a10:8012:21:4188:cd91:9afe:93c7:a048","2a03:2880:f242:1c2:face:b00c:0:167","TCP","88","41538  >  443 [ACK] Seq=2603 Ack=98032 Win=146944 Len=0 TSval=3605954254 TSecr=3676009067"
"237","107.627512230","2a03:2880:f242:1c2:face:b00c:0:167","2a10:8012:21:4188:cd91:9afe:93c7:a048","TCP","2848","443  >  41538 [PSH, ACK] Seq=98032 Ack=2603 Win=71168 Len=2760 TSval=3676009068 TSecr=3605954191 [TCP segment of a reassembled PDU]"
"238","107.627512321","2a03:2880:f242:1c2:face:b00c:0:167","2a10:8012:21:4188:cd91:9afe:93c7:a048","TCP","2848","443  >  41538 [PSH, ACK] Seq=100792 Ack=2603 Win=71168 Len=2760 TSval=3676009070 TSecr=3605954191 [TCP segment of a reassembled PDU]"
"239","107.627512342","2a03:2880:f242:1c2:face:b00c:0:167","2a10:8012:21:4188:cd91:9afe:93c7:a048","TCP","2848","443  >  41538 [PSH, ACK] Seq=103552 Ack=2603 Win=71168 Len=2760 TSval=3676009071 TSecr=3605954191 [TCP segment of a reassembled PDU]"
"240","107.627512357","2a03:2880:f242:1c2:face:b00c:0:167","2a10:8012:21:4188:cd91:9afe:93c7:a048","TLSv1.3","2848","Application Data [TCP segment of a reassembled PDU]"
"241","107.627522523","2a10:8012:21:4188:cd91:9afe:93c7:a048","2a03:2880:f242:1c2:face:b00c:0:167","TCP","88","41538  >  443 [ACK] Seq=2603 Ack=100792 Win=152448 Len=0 TSval=3605954256 TSecr=3676009068"
"242","107.627529175","2a10:8012:21:4188:cd91:9afe:93c7:a048","2a03:2880:f242:1c2:face:b00c:0:167","TCP","88","41538  >  443 [ACK] Seq=2603 Ack=103552 Win=158080 Len=0 TSval=3605954256 TSecr=3676009070"
"243","107.627531148","2a10:8012:21:4188:cd91:9afe:93c7:a048","2a03:2880:f242:1c2:face:b00c:0:167","TCP","88","41538  >  443 [ACK] Seq=2603 Ack=106312 Win=163584 Len=0 TSval=3605954256 TSecr=3676009071"
"244","107.627573543","2a10:8012:21:4188:cd91:9afe:93c7:a048","2a03:2880:f242:1c2:face:b00c:0:167","TCP","88","41538  >  443 [ACK] Seq=2603 Ack=109072 Win=169088 Len=0 TSval=3605954256 TSecr=3676009072"
"245","107.627578540","2a03:2880:f242:1c2:face:b00c:0:167","2a10:8012:21:4188:cd91:9afe:93c7:a048","TCP","2848","443  >  41538 [PSH, ACK] Seq=109072 Ack=2603 Win=71168 Len=2760 TSval=3676009073 TSecr=3605954191 [TCP segment of a reassembled PDU]"
"246","107.627578557","2a03:2880:f242:1c2:face:b00c:0:167","2a10:8012:21:4188:cd91:9afe:93c7:a048","TCP","2848","443  >  41538 [PSH, ACK] Seq=111832 Ack=2603 Win=71168 Len=2760 TSval=3676009074 TSecr=3605954191 [TCP segment of a reassembled PDU]"
"247","107.627578573","2a03:2880:f242:1c2:face:b00c:0:167","2a10:8012:21:4188:cd91:9afe:93c7:a048","TCP","2848","443  >  41538 [PSH, ACK] Seq=114592 Ack=2603 Win=71168 Len=2760 TSval=3676009075 TSecr=3605954191 [TCP segment of a reassembled PDU]"
"248","107.627578592","2a03:2880:f242:1c2:face:b00c:0:167","2a10:8012:21:4188:cd91:9afe:93c7:a048","TCP","2848","443  >  41538 [PSH, ACK] Seq=117352 Ack=2603 Win=71168 Len=2760 TSval=3676009076 TSecr=3605954191 [TCP segment of a reassembled PDU]"
"249","107.627581247","2a10:8012:21:4188:cd91:9afe:93c7:a048","2a03:2880:f242:1c2:face:b00c:0:167","TCP","88","41538  >  443 [ACK] Seq=2603 Ack=111832 Win=174592 Len=0 TSval=3605954256 TSecr=3676009073"
"250","107.627583464","2a10:8012:21:4188:cd91:9afe:93c7:a048","2a03:2880:f242:1c2:face:b00c:0:167","TCP","88","41538  >  443 [ACK] Seq=2603 Ack=114592 Win=180096 Len=0 TSval=3605954256 TSecr=3676009074"
"251","107.627585955","2a10:8012:21:4188:cd91:9afe:93c7:a048","2a03:2880:f242:1c2:face:b00c:0:167","TCP","88","41538  >  443 [ACK] Seq=2603 Ack=117352 Win=185600 Len=0 TSval=3605954256 TSecr=3676009075"
"252","107.627588139","2a10:8012:21:4188:cd91:9afe:93c7:a048","2a03:2880:f242:1c2:face:b00c:0:167","TCP","88","41538  >  443 [ACK] Seq=2603 Ack=120112 Win=191104 Len=0 TSval=3605954256 TSecr=3676009076"
"253","107.627591626","2a03:2880:f242:1c2:face:b00c:0:167","2a10:8012:21:4188:cd91:9afe:93c7:a048","TCP","2848","443  >  41538 [PSH, ACK] Seq=120112 Ack=2603 Win=71168 Len=2760 TSval=3676009077 TSecr=3605954191 [TCP segment of a reassembled PDU]"
"254","107.627591644","2a03:2880:f242:1c2:face:b00c:0:167","2a10:8012:21:4188:cd91:9afe:93c7:a048","TLSv1.3","2848","Application Data [TCP segment of a reassembled PDU]"
"255","107.627591662","2a03:2880:f242:1c2:face:b00c:0:167","2a10:8012:21:4188:cd91:9afe:93c7:a048","TCP","2848","443  >  41538 [PSH, ACK] Seq=125632 Ack=2603 Win=71168 Len=2760 TSval=3676009080 TSecr=3605954191 [TCP segment of a reassembled PDU]"
"256","107.627591679","2a03:2880:f242:1c2:face:b00c:0:167","2a10:8012:21:4188:cd91:9afe:93c7:a048","TCP","2848","443  >  41538 [PSH, ACK] Seq=128392 Ack=2603 Win=71168 Len=2760 TSval=3676009081 TSecr=3605954191 [TCP segment of a reassembled PDU]"
"257","107.627594671","2a10:8012:21:4188:cd91:9afe:93c7:a048","2a03:2880:f242:1c2:face:b00c:0:167","TCP","88","41538  >  443 [ACK] Seq=2603 Ack=122872 Win=196608 Len=0 TSval=3605954256 TSecr=3676009077"
"258","107.627596646","2a10:8012:21:4188:cd91:9afe:93c7:a048","2a03:2880:f242:1c2:face:b00c:0:167","TCP","88","41538  >  443 [ACK] Seq=2603 Ack=125632 Win=202240 Len=0 TSval=3605954256 TSecr=3676009079"
"259","107.627598589","2a10:8012:21:4188:cd91:9afe:93c7:a048","2a03:2880:f242:1c2:face:b00c:0:167","TCP","88","41538  >  443 [ACK] Seq=2603 Ack=128392 Win=207744 Len=0 TSval=3605954256 TSecr=3676009080"
"260","107.627608744","2a10:8012:21:4188:cd91:9afe:93c7:a048","2a03:2880:f242:1c2:face:b00c:0:167","TCP","88","41538  >  443 [ACK] Seq=2603 Ack=131152 Win=213248 Len=0 TSval=3605954256 TSecr=3676009081"
"261","107.627615148","2a03:2880:f242:1c2:face:b00c:0:167","2a10:8012:21:4188:cd91:9afe:93c7:a048","TCP","2848","443  >  41538 [PSH, ACK] Seq=131152 Ack=2603 Win=71168 Len=2760 TSval=3676009082 TSecr=3605954191 [TCP segment of a reassembled PDU]"
"262","107.627615231","2a03:2880:f242:1c2:face:b00c:0:167","2a10:8012:21:4188:cd91:9afe:93c7:a048","TCP","2848","443  >  41538 [PSH, ACK] Seq=133912 Ack=2603 Win=71168 Len=2760 TSval=3676009083 TSecr=3605954191 [TCP segment of a reassembled PDU]"
"263","107.627615251","2a03:2880:f242:1c2:face:b00c:0:167","2a10:8012:21:4188:cd91:9afe:93c7:a048","TCP","2848","443  >  41538 [PSH, ACK] Seq=136672 Ack=2603 Win=71168 Len=2760 TSval=3676009084 TSecr=3605954191 [TCP segment of a reassembled PDU]"
"264","107.627624221","2a10:8012:21:4188:cd91:9afe:93c7:a048","2a03:2880:f242:1c2:face:b00c:0:167","TCP","88","41538  >  443 [ACK] Seq=2603 Ack=133912 Win=218752 Len=0 TSval=3605954256 TSecr=3676009082"
"265","107.627630603","2a10:8012:21:4188:cd91:9afe:93c7:a048","2a03:2880:f242:1c2:face:b00c:0:167","TCP","88","41538  >  443 [ACK] Seq=2603 Ack=136672 Win=224256 Len=0 TSval=3605954256 TSecr=3676009083"
"266","107.627632591","2a10:8012:21:4188:cd91:9afe:93c7:a048","2a03:2880:f242:1c2:face:b00c:0:167","TCP","88","41538  >  443 [ACK] Seq=2603 Ack=139432 Win=229760 Len=0 TSval=3605954256 TSecr=3676009084"
"267","107.628844100","2a03:2880:f242:1c2:face:b00c:0:167","2a10:8012:21:4188:cd91:9afe:93c7:a048","TLSv1.3","1862","Application Data"
"268","107.628849508","2a10:8012:21:4188:cd91:9afe:93c7:a048","2a03:2880:f242:1c2:face:b00c:0:167","TCP","88","41538  >  443 [ACK] Seq=2603 Ack=141206 Win=233344 Len=0 TSval=3605954258 TSecr=3676009085"
"269","107.651211810","2a10:8012:21:4188:cd91:9afe:93c7:a048","2a03:2880:f242:1c2:face:b00c:0:167","TLSv1.3","692","Application Data"
"270","107.694730366","2a03:2880:f242:1c2:face:b00c:0:167","2a10:8012:21:4188:cd91:9afe:93c7:a048","TLSv1.3","1009","Application Data"
"271","107.735679479","2a10:8012:21:4188:cd91:9afe:93c7:a048","2a03:2880:f242:1c2:face:b00c:0:167","TCP","88","41538  >  443 [ACK] Seq=3207 Ack=142127 Win=236032 Len=0 TSval=3605954364 TSecr=3676009154"
"272","108.046102564","2a10:8012:21:4188:cd91:9afe:93c7:a048","2a03:2880:f242:c8:face:b00c:0:167","TLSv1.2","184","Application Data"
"273","108.090458345","2a03:2880:f242:c8:face:b00c:0:167","2a10:8012:21:4188:cd91:9afe:93c7:a048","TCP","88","443  >  40532 [ACK] Seq=3877 Ack=1614 Win=772 Len=0 TSval=2610080702 TSecr=921534207"
"277","113.713797814","2a10:8012:21:4188:cd91:9afe:93c7:a048","2a03:2880:f242:c8:face:b00c:0:167","TLSv1.2","181","Application Data"
"278","113.758786562","2a03:2880:f242:c8:face:b00c:0:167","2a10:8012:21:4188:cd91:9afe:93c7:a048","TCP","88","443  >  40532 [ACK] Seq=3877 Ack=1707 Win=772 Len=0 TSval=2610086370 TSecr=921539875"
"281","114.191890658","2a10:8012:21:4188:cd91:9afe:93c7:a048","2a03:2880:f242:1c2:face:b00c:0:167","TLSv1.3","730","Application Data"
"282","114.193007584","2a10:8012:21:4188:cd91:9afe:93c7:a048","2a03:2880:f242:c8:face:b00c:0:167","TLSv1.2","181","Application Data"
"283","114.279303354","2a03:2880:f242:c8:face:b00c:0:167","2a10:8012:21:4188:cd91:9afe:93c7:a048","TCP","88","443  >  40532 [ACK] Seq=3877 Ack=1800 Win=772 Len=0 TSval=2610086847 TSecr=921540354"
"284","114.280583456","2a03:2880:f242:1c2:face:b00c:0:167","2a10:8012:21:4188:cd91:9afe:93c7:a048","TLSv1.3","416","Application Data"
"285","114.280583538","2a03:2880:f242:1c2:face:b00c:0:167","2a10:8012:21:4188:cd91:9afe:93c7:a048","TLSv1.3","2848","Application Data"
"286","114.280583559","2a03:2880:f242:1c2:face:b00c:0:167","2a10:8012:21:4188:cd91:9afe:93c7:a048","TCP","2848","443  >  41538 [PSH, ACK] Seq=145215 Ack=3849 Win=73984 Len=2760 TSval=3676015699 TSecr=3605960821 [TCP segment of a reassembled PDU]"
"287","114.280583577","2a03:2880:f242:1c2:face:b00c:0:167","2a10:8012:21:4188:cd91:9afe:93c7:a048","TCP","2848","443  >  41538 [PSH, ACK] Seq=147975 Ack=3849 Win=73984 Len=2760 TSval=3676015701 TSecr=3605960821 [TCP segment of a reassembled PDU]"
"288","114.280583597","2a03:2880:f242:1c2:face:b00c:0:167","2a10:8012:21:4188:cd91:9afe:93c7:a048","TCP","2848","443  >  41538 [PSH, ACK] Seq=150735 Ack=3849 Win=73984 Len=2760 TSval=3676015702 TSecr=3605960821 [TCP segment of a reassembled PDU]"
"289","114.280602321","2a10:8012:21:4188:cd91:9afe:93c7:a048","2a03:2880:f242:1c2:face:b00c:0:167","TCP","88","41538  >  443 [ACK] Seq=3849 Ack=142455 Win=238848 Len=0 TSval=3605960909 TSecr=3676015698"
"290","114.280616821","2a10:8012:21:4188:cd91:9afe:93c7:a048","2a03:2880:f242:1c2:face:b00c:0:167","TCP","88","41538  >  443 [ACK] Seq=3849 Ack=145215 Win=244352 Len=0 TSval=3605960909 TSecr=3676015699"
"291","114.280619419","2a10:8012:21:4188:cd91:9afe:93c7:a048","2a03:2880:f242:1c2:face:b00c:0:167","TCP","88","41538  >  443 [ACK] Seq=3849 Ack=147975 Win=249856 Len=0 TSval=3605960909 TSecr=3676015699"
