"No.","Time","Source","Destination","Protocol","Length","Info"
"4","4.314555392","2a00:a041:3c5d:4d00:424b:6377:a930:43d","2a00:a040:0:4:face:b00c:3333:7020","TLSv1.2","112","Application Data"
"5","4.314615085","2a00:a041:3c5d:4d00:424b:6377:a930:43d","2a00:a040:0:4:face:b00c:3333:7020","TCP","88","35408  >  443 [FIN, ACK] Seq=25 Ack=1 Win=2938 Len=0 TSval=3875621924 TSecr=3419844779"
"6","4.330641379","2a00:a040:0:4:face:b00c:3333:7020","2a00:a041:3c5d:4d00:424b:6377:a930:43d","TCP","100","443  >  35408 [ACK] Seq=1 Ack=1 Win=123 Len=0 TSval=3419904802 TSecr=3875561918 SLE=25 SRE=26"
"7","4.331151866","2a00:a040:0:4:face:b00c:3333:7020","2a00:a041:3c5d:4d00:424b:6377:a930:43d","TCP","88","443  >  35408 [ACK] Seq=1 Ack=26 Win=123 Len=0 TSval=3419904802 TSecr=3875621924"
"8","4.331152060","2a00:a040:0:4:face:b00c:3333:7020","2a00:a041:3c5d:4d00:424b:6377:a930:43d","TLSv1.2","112","Application Data"
"9","4.331152108","2a00:a040:0:4:face:b00c:3333:7020","2a00:a041:3c5d:4d00:424b:6377:a930:43d","TCP","88","443  >  35408 [FIN, ACK] Seq=25 Ack=26 Win=123 Len=0 TSval=3419904802 TSecr=3875621924"
"10","4.331204901","2a00:a041:3c5d:4d00:424b:6377:a930:43d","2a00:a040:0:4:face:b00c:3333:7020","TCP","76","35408  >  443 [RST] Seq=26 Win=0 Len=0"
"11","4.331230689","2a00:a041:3c5d:4d00:424b:6377:a930:43d","2a00:a040:0:4:face:b00c:3333:7020","TCP","76","35408  >  443 [RST] Seq=26 Win=0 Len=0"
"16","11.570461498","2a03:2880:f258:1c3:face:b00c:0:167","2a00:a041:3c5d:4d00:424b:6377:a930:43d","TCP","1468","443  >  41660 [ACK] Seq=1 Ack=1 Win=788 Len=1380 TSval=3181928227 TSecr=2766863475 [TCP segment of a reassembled PDU]"
"17","11.570714854","2a03:2880:f258:1c3:face:b00c:0:167","2a00:a041:3c5d:4d00:424b:6377:a930:43d","TLSv1.2","406","Application Data, Application Data"
"18","11.570737194","2a00:a041:3c5d:4d00:424b:6377:a930:43d","2a03:2880:f258:1c3:face:b00c:0:167","TCP","88","41660  >  443 [ACK] Seq=1 Ack=1699 Win=1174 Len=0 TSval=2766879008 TSecr=3181928227"
"19","11.879475339","2a00:a041:3c5d:4d00:424b:6377:a930:43d","2a03:2880:f258:1c3:face:b00c:0:167","TLSv1.2","181","Application Data"
"20","11.966485457","2a03:2880:f258:1c3:face:b00c:0:167","2a00:a041:3c5d:4d00:424b:6377:a930:43d","TCP","88","443  >  41660 [ACK] Seq=1699 Ack=94 Win=788 Len=0 TSval=3181928697 TSecr=2766879317"
"21","12.101263097","2a00:a041:3c5d:4d00:424b:6377:a930:43d","2a03:2880:f258:1c3:face:b00c:0:167","TLSv1.2","154","Application Data"
"22","12.187762227","2a03:2880:f258:1c3:face:b00c:0:167","2a00:a041:3c5d:4d00:424b:6377:a930:43d","TCP","88","443  >  41660 [ACK] Seq=1699 Ack=160 Win=788 Len=0 TSval=3181928919 TSecr=2766879539"
"23","12.191721549","2a03:2880:f258:1c3:face:b00c:0:167","2a00:a041:3c5d:4d00:424b:6377:a930:43d","TLSv1.2","181","Application Data"
"24","12.195573822","2a00:a041:3c5d:4d00:424b:6377:a930:43d","2a03:2880:f258:1c3:face:b00c:0:167","TLSv1.2","180","Application Data"
"25","12.388975901","2a03:2880:f258:1c3:face:b00c:0:167","2a00:a041:3c5d:4d00:424b:6377:a930:43d","TCP","88","443  >  41660 [ACK] Seq=1792 Ack=252 Win=788 Len=0 TSval=3181929058 TSecr=2766879633"
"27","19.437218528","2a00:a041:3c5d:4d00:424b:6377:a930:43d","2a03:2880:f258:1c3:face:b00c:0:167","TLSv1.2","158","Application Data"
"28","19.509817571","2a03:2880:f258:1c3:face:b00c:0:167","2a00:a041:3c5d:4d00:424b:6377:a930:43d","TCP","88","443  >  41660 [ACK] Seq=1792 Ack=322 Win=788 Len=0 TSval=3181936242 TSecr=2766886874"
"29","19.589401000","2a03:2880:f258:1c3:face:b00c:0:167","2a00:a041:3c5d:4d00:424b:6377:a930:43d","TLSv1.2","160","Application Data"
"30","19.633341495","2a00:a041:3c5d:4d00:424b:6377:a930:43d","2a03:2880:f258:1c3:face:b00c:0:167","TCP","88","41660  >  443 [ACK] Seq=322 Ack=1864 Win=1174 Len=0 TSval=2766887071 TSecr=3181936322"
"49","27.852048928","2a03:2880:f258:1c3:face:b00c:0:167","2a00:a041:3c5d:4d00:424b:6377:a930:43d","TLSv1.2","365","Application Data"
"50","27.852090376","2a00:a041:3c5d:4d00:424b:6377:a930:43d","2a03:2880:f258:1c3:face:b00c:0:167","TCP","88","41660  >  443 [ACK] Seq=322 Ack=2141 Win=1174 Len=0 TSval=2766895289 TSecr=3181944541"
"51","28.141844870","2a00:a041:3c5d:4d00:424b:6377:a930:43d","2a03:2880:f258:1c3:face:b00c:0:167","TLSv1.2","160","Application Data"
"52","28.216511935","2a03:2880:f258:1c3:face:b00c:0:167","2a00:a041:3c5d:4d00:424b:6377:a930:43d","TCP","88","443  >  41660 [ACK] Seq=2141 Ack=394 Win=788 Len=0 TSval=3181944948 TSecr=2766895579"
"61","44.206792934","2a00:a041:3c5d:4d00:424b:6377:a930:43d","2a03:2880:f258:1c3:face:b00c:0:167","TLSv1.2","158","Application Data"
"62","44.281406015","2a03:2880:f258:1c3:face:b00c:0:167","2a00:a041:3c5d:4d00:424b:6377:a930:43d","TCP","88","443  >  41660 [ACK] Seq=2141 Ack=464 Win=788 Len=0 TSval=3181961013 TSecr=2766911644"
"63","44.361419820","2a03:2880:f258:1c3:face:b00c:0:167","2a00:a041:3c5d:4d00:424b:6377:a930:43d","TLSv1.2","160","Application Data"
"64","44.361452343","2a00:a041:3c5d:4d00:424b:6377:a930:43d","2a03:2880:f258:1c3:face:b00c:0:167","TCP","88","41660  >  443 [ACK] Seq=464 Ack=2213 Win=1174 Len=0 TSval=2766911799 TSecr=3181961094"
"66","46.079412574","2a03:2880:f258:1c3:face:b00c:0:167","2a00:a041:3c5d:4d00:424b:6377:a930:43d","TLSv1.2","310","Application Data"
"67","46.079452497","2a00:a041:3c5d:4d00:424b:6377:a930:43d","2a03:2880:f258:1c3:face:b00c:0:167","TCP","88","41660  >  443 [ACK] Seq=464 Ack=2435 Win=1174 Len=0 TSval=2766913517 TSecr=3181962786"
"68","46.113658414","2a00:a041:3c5d:4d00:424b:6377:a930:43d","2a03:2880:f258:1c3:face:b00c:0:167","TLSv1.2","161","Application Data"
"69","46.187396309","2a03:2880:f258:1c3:face:b00c:0:167","2a00:a041:3c5d:4d00:424b:6377:a930:43d","TCP","88","443  >  41660 [ACK] Seq=2435 Ack=537 Win=788 Len=0 TSval=3181962919 TSecr=2766913551"
"70","48.844307573","2a03:2880:f258:1c3:face:b00c:0:167","2a00:a041:3c5d:4d00:424b:6377:a930:43d","TLSv1.2","275","Application Data"
"71","48.889243912","2a00:a041:3c5d:4d00:424b:6377:a930:43d","2a03:2880:f258:1c3:face:b00c:0:167","TCP","88","41660  >  443 [ACK] Seq=537 Ack=2622 Win=1174 Len=0 TSval=2766916327 TSecr=3181965501"
"72","48.955662276","2a03:2880:f258:1c3:face:b00c:0:167","2a00:a041:3c5d:4d00:424b:6377:a930:43d","TCP","275","[TCP Spurious Retransmission] 443  >  41660 [PSH, ACK] Seq=2435 Ack=537 Win=788 Len=187 TSval=3181965688 TSecr=2766913551"
"73","48.955691896","2a00:a041:3c5d:4d00:424b:6377:a930:43d","2a03:2880:f258:1c3:face:b00c:0:167","TCP","100","[TCP Dup ACK 71#1] 41660  >  443 [ACK] Seq=537 Ack=2622 Win=1174 Len=0 TSval=2766916393 TSecr=3181965688 SLE=2435 SRE=2622"
"74","49.142968830","2a00:a041:3c5d:4d00:424b:6377:a930:43d","2a03:2880:f258:1c3:face:b00c:0:167","TLSv1.2","160","Application Data"
"75","49.220399972","2a03:2880:f258:1c3:face:b00c:0:167","2a00:a041:3c5d:4d00:424b:6377:a930:43d","TCP","88","443  >  41660 [ACK] Seq=2622 Ack=609 Win=788 Len=0 TSval=3181965952 TSecr=2766916580"
"93","62.061026149","2a03:2880:f258:1c3:face:b00c:0:167","2a00:a041:3c5d:4d00:424b:6377:a930:43d","TCP","1468","443  >  41660 [ACK] Seq=2622 Ack=609 Win=788 Len=1380 TSval=3181978772 TSecr=2766916580 [TCP segment of a reassembled PDU]"
"94","62.061064026","2a00:a041:3c5d:4d00:424b:6377:a930:43d","2a03:2880:f258:1c3:face:b00c:0:167","TCP","88","41660  >  443 [ACK] Seq=609 Ack=4002 Win=1174 Len=0 TSval=2766929498 TSecr=3181978772"
"95","62.061209447","2a03:2880:f258:1c3:face:b00c:0:167","2a00:a041:3c5d:4d00:424b:6377:a930:43d","TLSv1.2","221","Application Data"
"96","62.061219759","2a00:a041:3c5d:4d00:424b:6377:a930:43d","2a03:2880:f258:1c3:face:b00c:0:167","TCP","88","41660  >  443 [ACK] Seq=609 Ack=4135 Win=1173 Len=0 TSval=2766929498 TSecr=3181978772"
"97","62.061263093","2a03:2880:f258:1c3:face:b00c:0:167","2a00:a041:3c5d:4d00:424b:6377:a930:43d","TLSv1.2","1345","Application Data"
"98","62.061269567","2a00:a041:3c5d:4d00:424b:6377:a930:43d","2a03:2880:f258:1c3:face:b00c:0:167","TCP","88","41660  >  443 [ACK] Seq=609 Ack=5392 Win=1164 Len=0 TSval=2766929499 TSecr=3181978773"
"99","63.180230755","2a03:2880:f258:1c3:face:b00c:0:167","2a00:a041:3c5d:4d00:424b:6377:a930:43d","TLSv1.2","181","Application Data"
"100","63.180264055","2a00:a041:3c5d:4d00:424b:6377:a930:43d","2a03:2880:f258:1c3:face:b00c:0:167","TCP","88","41660  >  443 [ACK] Seq=609 Ack=5485 Win=1174 Len=0 TSval=2766930618 TSecr=3181979891"
"101","63.183926060","2a00:a041:3c5d:4d00:424b:6377:a930:43d","2a03:2880:f258:1c3:face:b00c:0:167","TLSv1.2","180","Application Data"
"102","63.263149783","2a03:2880:f258:1c3:face:b00c:0:167","2a00:a041:3c5d:4d00:424b:6377:a930:43d","TCP","88","443  >  41660 [ACK] Seq=5485 Ack=701 Win=788 Len=0 TSval=3181979995 TSecr=2766930621"
"106","70.632462795","2a00:a041:3c5d:4d00:424b:6377:a930:43d","2a03:2880:f258:1c3:face:b00c:0:167","TLSv1.2","158","Application Data"
"107","70.707177665","2a03:2880:f258:1c3:face:b00c:0:167","2a00:a041:3c5d:4d00:424b:6377:a930:43d","TCP","88","443  >  41660 [ACK] Seq=5485 Ack=771 Win=788 Len=0 TSval=3181987439 TSecr=2766938070"
"108","70.731681288","2a00:a041:3c5d:4d00:424b:6377:a930:43d","2a03:2880:f258:1c3:face:b00c:0:167","TLSv1.2","181","Application Data"
"109","70.786711293","2a03:2880:f258:1c3:face:b00c:0:167","2a00:a041:3c5d:4d00:424b:6377:a930:43d","TLSv1.2","160","Application Data"
"110","70.803050204","2a03:2880:f258:1c3:face:b00c:0:167","2a00:a041:3c5d:4d00:424b:6377:a930:43d","TCP","88","443  >  41660 [ACK] Seq=5557 Ack=864 Win=788 Len=0 TSval=3181987535 TSecr=2766938169"
"111","70.829302542","2a00:a041:3c5d:4d00:424b:6377:a930:43d","2a03:2880:f258:1c3:face:b00c:0:167","TCP","88","41660  >  443 [ACK] Seq=864 Ack=5557 Win=1174 Len=0 TSval=2766938267 TSecr=3181987519"
"116","80.569122639","2a00:a041:3c5d:4d00:424b:6377:a930:43d","2a03:2880:f258:1c3:face:b00c:0:167","TCP","1468","41660  >  443 [ACK] Seq=864 Ack=5557 Win=1174 Len=1380 TSval=2766948006 TSecr=3181987519 [TCP segment of a reassembled PDU]"
"117","80.569150987","2a00:a041:3c5d:4d00:424b:6377:a930:43d","2a03:2880:f258:1c3:face:b00c:0:167","TLSv1.2","1377","Application Data"
"122","80.647833445","2a03:2880:f258:1c3:face:b00c:0:167","2a00:a041:3c5d:4d00:424b:6377:a930:43d","TCP","88","443  >  41660 [ACK] Seq=5557 Ack=3533 Win=809 Len=0 TSval=3181997380 TSecr=2766948006"
"131","80.712139480","2a00:a041:3c5d:4d00:424b:6377:a930:43d","2a03:2880:f258:c8:face:b00c:0:167","TCP","96","47108  >  443 [SYN] Seq=0 Win=64800 Len=0 MSS=1440 SACK_PERM=1 TSval=1650834459 TSecr=0 WS=128"
"132","80.712263866","2a00:a041:3c5d:4d00:424b:6377:a930:43d","2a03:2880:f258:c8:face:b00c:0:167","TCP","96","47120  >  443 [SYN] Seq=0 Win=64800 Len=0 MSS=1440 SACK_PERM=1 TSval=1650834460 TSecr=0 WS=128"
"133","80.728474025","2a03:2880:f258:1c3:face:b00c:0:167","2a00:a041:3c5d:4d00:424b:6377:a930:43d","TLSv1.2","152","Application Data"
"134","80.728506583","2a00:a041:3c5d:4d00:424b:6377:a930:43d","2a03:2880:f258:1c3:face:b00c:0:167","TCP","88","41660  >  443 [ACK] Seq=3533 Ack=5621 Win=1174 Len=0 TSval=2766948166 TSecr=3181997461"
"135","80.793316341","2a03:2880:f258:c8:face:b00c:0:167","2a00:a041:3c5d:4d00:424b:6377:a930:43d","TCP","96","443  >  47108 [SYN, ACK] Seq=0 Ack=1 Win=65535 Len=0 MSS=1392 SACK_PERM=1 TSval=148818986 TSecr=1650834459 WS=256"
"136","80.793361613","2a00:a041:3c5d:4d00:424b:6377:a930:43d","2a03:2880:f258:c8:face:b00c:0:167","TCP","88","47108  >  443 [ACK] Seq=1 Ack=1 Win=64896 Len=0 TSval=1650834541 TSecr=148818986"
"137","80.794286273","2a00:a041:3c5d:4d00:424b:6377:a930:43d","2a03:2880:f258:c8:face:b00c:0:167","TLSv1.3","782","Client Hello"
"138","80.797721191","2a03:2880:f258:c8:face:b00c:0:167","2a00:a041:3c5d:4d00:424b:6377:a930:43d","TCP","96","443  >  47120 [SYN, ACK] Seq=0 Ack=1 Win=65535 Len=0 MSS=1392 SACK_PERM=1 TSval=3325669398 TSecr=1650834460 WS=256"
"139","80.797768391","2a00:a041:3c5d:4d00:424b:6377:a930:43d","2a03:2880:f258:c8:face:b00c:0:167","TCP","88","47120  >  443 [ACK] Seq=1 Ack=1 Win=64896 Len=0 TSval=1650834545 TSecr=3325669398"
"140","80.798630838","2a00:a041:3c5d:4d00:424b:6377:a930:43d","2a03:2880:f258:c8:face:b00c:0:167","TLSv1.3","782","Client Hello"
"141","80.871074392","2a03:2880:f258:c8:face:b00c:0:167","2a00:a041:3c5d:4d00:424b:6377:a930:43d","TCP","88","443  >  47108 [ACK] Seq=1 Ack=695 Win=67072 Len=0 TSval=148819065 TSecr=1650834542"
"142","80.871562837","2a03:2880:f258:c8:face:b00c:0:167","2a00:a041:3c5d:4d00:424b:6377:a930:43d","TLSv1.3","253","Server Hello, Application Data"
"143","80.871601520","2a00:a041:3c5d:4d00:424b:6377:a930:43d","2a03:2880:f258:c8:face:b00c:0:167","TCP","88","47108  >  443 [ACK] Seq=695 Ack=166 Win=64768 Len=0 TSval=1650834619 TSecr=148819066"
"144","80.872023443","2a00:a041:3c5d:4d00:424b:6377:a930:43d","2a03:2880:f258:c8:face:b00c:0:167","TLSv1.3","94","Change Cipher Spec"
"145","80.872164118","2a00:a041:3c5d:4d00:424b:6377:a930:43d","2a03:2880:f258:c8:face:b00c:0:167","TLSv1.3","146","Application Data"
"146","80.873803271","2a00:a041:3c5d:4d00:424b:6377:a930:43d","2a03:2880:f258:c8:face:b00c:0:167","TLSv1.3","566","Application Data"
"147","80.873880533","2a00:a041:3c5d:4d00:424b:6377:a930:43d","2a03:2880:f258:c8:face:b00c:0:167","TLSv1.3","1009","Application Data"
"148","80.877041902","2a03:2880:f258:c8:face:b00c:0:167","2a00:a041:3c5d:4d00:424b:6377:a930:43d","TCP","88","443  >  47120 [ACK] Seq=1 Ack=695 Win=67072 Len=0 TSval=3325669478 TSecr=1650834546"
"149","80.877728469","2a03:2880:f258:c8:face:b00c:0:167","2a00:a041:3c5d:4d00:424b:6377:a930:43d","TLSv1.3","253","Server Hello, Application Data"
"150","80.877757822","2a00:a041:3c5d:4d00:424b:6377:a930:43d","2a03:2880:f258:c8:face:b00c:0:167","TCP","88","47120  >  443 [ACK] Seq=695 Ack=166 Win=64768 Len=0 TSval=1650834625 TSecr=3325669479"
"151","80.878151084","2a00:a041:3c5d:4d00:424b:6377:a930:43d","2a03:2880:f258:c8:face:b00c:0:167","TLSv1.3","94","Change Cipher Spec"
"152","80.878281222","2a00:a041:3c5d:4d00:424b:6377:a930:43d","2a03:2880:f258:c8:face:b00c:0:167","TLSv1.3","146","Application Data"
"153","80.879857171","2a00:a041:3c5d:4d00:424b:6377:a930:43d","2a03:2880:f258:c8:face:b00c:0:167","TLSv1.3","566","Application Data"
"154","80.879932015","2a00:a041:3c5d:4d00:424b:6377:a930:43d","2a03:2880:f258:c8:face:b00c:0:167","TLSv1.3","1009","Application Data"
"155","80.960582596","2a03:2880:f258:c8:face:b00c:0:167","2a00:a041:3c5d:4d00:424b:6377:a930:43d","TCP","88","443  >  47120 [ACK] Seq=166 Ack=1237 Win=68352 Len=0 TSval=3325669556 TSecr=1650834625"
"156","80.960786887","2a03:2880:f258:c8:face:b00c:0:167","2a00:a041:3c5d:4d00:424b:6377:a930:43d","TLSv1.3","257","Application Data"
"157","80.960825583","2a03:2880:f258:c8:face:b00c:0:167","2a00:a041:3c5d:4d00:424b:6377:a930:43d","TCP","88","443  >  47108 [ACK] Seq=166 Ack=2158 Win=70400 Len=0 TSval=148819150 TSecr=1650834619"
"158","80.960825813","2a03:2880:f258:c8:face:b00c:0:167","2a00:a041:3c5d:4d00:424b:6377:a930:43d","TLSv1.3","257","Application Data"
"159","81.000627536","2a03:2880:f258:c8:face:b00c:0:167","2a00:a041:3c5d:4d00:424b:6377:a930:43d","TCP","88","443  >  47120 [ACK] Seq=335 Ack=2158 Win=70400 Len=0 TSval=3325669602 TSecr=1650834627"
"160","81.000661512","2a00:a041:3c5d:4d00:424b:6377:a930:43d","2a03:2880:f258:c8:face:b00c:0:167","TCP","88","47120  >  443 [ACK] Seq=2158 Ack=335 Win=64640 Len=0 TSval=1650834748 TSecr=3325669557"
"161","81.001345102","2a00:a041:3c5d:4d00:424b:6377:a930:43d","2a03:2880:f258:c8:face:b00c:0:167","TCP","88","47108  >  443 [ACK] Seq=2158 Ack=335 Win=64640 Len=0 TSval=1650834749 TSecr=148819151"
"162","81.057879635","2a03:2880:f258:c8:face:b00c:0:167","2a00:a041:3c5d:4d00:424b:6377:a930:43d","TLSv1.3","836","Application Data"
"163","81.057900408","2a00:a041:3c5d:4d00:424b:6377:a930:43d","2a03:2880:f258:c8:face:b00c:0:167","TCP","88","47108  >  443 [ACK] Seq=2158 Ack=1083 Win=64000 Len=0 TSval=1650834805 TSecr=148819252"
"164","81.062105880","2a03:2880:f258:c8:face:b00c:0:167","2a00:a041:3c5d:4d00:424b:6377:a930:43d","TLSv1.3","836","Application Data"
"165","81.109403113","2a00:a041:3c5d:4d00:424b:6377:a930:43d","2a03:2880:f258:c8:face:b00c:0:167","TCP","88","47120  >  443 [ACK] Seq=2158 Ack=1083 Win=64128 Len=0 TSval=1650834857 TSecr=3325669663"
"170","95.334343092","2a03:2880:f258:1c3:face:b00c:0:167","2a00:a041:3c5d:4d00:424b:6377:a930:43d","TLSv1.2","274","Application Data"
"171","95.334378396","2a00:a041:3c5d:4d00:424b:6377:a930:43d","2a03:2880:f258:1c3:face:b00c:0:167","TCP","88","41660  >  443 [ACK] Seq=3533 Ack=5807 Win=1174 Len=0 TSval=2766962772 TSecr=3182012018"
"172","95.595298088","2a00:a041:3c5d:4d00:424b:6377:a930:43d","2a03:2880:f258:1c3:face:b00c:0:167","TLSv1.2","160","Application Data"
"174","95.670742106","2a03:2880:f258:1c3:face:b00c:0:167","2a00:a041:3c5d:4d00:424b:6377:a930:43d","TCP","88","443  >  41660 [ACK] Seq=5807 Ack=3605 Win=809 Len=0 TSval=3182012402 TSecr=2766963033"
"175","95.724583199","2a03:2880:f258:1c3:face:b00c:0:167","2a00:a041:3c5d:4d00:424b:6377:a930:43d","TCP","1468","443  >  41660 [ACK] Seq=5807 Ack=3605 Win=809 Len=1380 TSval=3182012457 TSecr=2766963033 [TCP segment of a reassembled PDU]"
"176","95.724649140","2a00:a041:3c5d:4d00:424b:6377:a930:43d","2a03:2880:f258:1c3:face:b00c:0:167","TCP","88","41660  >  443 [ACK] Seq=3605 Ack=7187 Win=1174 Len=0 TSval=2766963162 TSecr=3182012457"
"177","95.724973617","2a03:2880:f258:1c3:face:b00c:0:167","2a00:a041:3c5d:4d00:424b:6377:a930:43d","TLSv1.2","221","Application Data"
"178","95.724994287","2a00:a041:3c5d:4d00:424b:6377:a930:43d","2a03:2880:f258:1c3:face:b00c:0:167","TCP","88","41660  >  443 [ACK] Seq=3605 Ack=7320 Win=1174 Len=0 TSval=2766963162 TSecr=3182012457"
"179","95.726597245","2a03:2880:f258:1c3:face:b00c:0:167","2a00:a041:3c5d:4d00:424b:6377:a930:43d","TCP","1468","443  >  41660 [ACK] Seq=7320 Ack=3605 Win=809 Len=1380 TSval=3182012458 TSecr=2766963033 [TCP segment of a reassembled PDU]"
"180","95.726630431","2a00:a041:3c5d:4d00:424b:6377:a930:43d","2a03:2880:f258:1c3:face:b00c:0:167","TCP","88","41660  >  443 [ACK] Seq=3605 Ack=8700 Win=1174 Len=0 TSval=2766963164 TSecr=3182012458"
"181","95.727385218","2a03:2880:f258:1c3:face:b00c:0:167","2a00:a041:3c5d:4d00:424b:6377:a930:43d","TLSv1.2","1468","Application Data [TCP segment of a reassembled PDU]"
"182","95.727405931","2a00:a041:3c5d:4d00:424b:6377:a930:43d","2a03:2880:f258:1c3:face:b00c:0:167","TCP","88","41660  >  443 [ACK] Seq=3605 Ack=10080 Win=1174 Len=0 TSval=2766963165 TSecr=3182012458"
"183","95.729398961","2a03:2880:f258:1c3:face:b00c:0:167","2a00:a041:3c5d:4d00:424b:6377:a930:43d","TLSv1.2","673","Application Data"
"184","95.729425550","2a00:a041:3c5d:4d00:424b:6377:a930:43d","2a03:2880:f258:1c3:face:b00c:0:167","TCP","88","41660  >  443 [ACK] Seq=3605 Ack=10665 Win=1174 Len=0 TSval=2766963167 TSecr=3182012461"
"185","95.762962893","2a03:2880:f258:1c3:face:b00c:0:167","2a00:a041:3c5d:4d00:424b:6377:a930:43d","TLSv1.2","275","Application Data"
"186","95.762979247","2a00:a041:3c5d:4d00:424b:6377:a930:43d","2a03:2880:f258:1c3:face:b00c:0:167","TCP","88","41660  >  443 [ACK] Seq=3605 Ack=10852 Win=1174 Len=0 TSval=2766963200 TSecr=3182012495"
"187","96.062593840","2a00:a041:3c5d:4d00:424b:6377:a930:43d","2a03:2880:f258:1c3:face:b00c:0:167","TLSv1.2","160","Application Data"
"188","96.163831750","2a03:2880:f258:1c3:face:b00c:0:167","2a00:a041:3c5d:4d00:424b:6377:a930:43d","TCP","88","443  >  41660 [ACK] Seq=10852 Ack=3677 Win=809 Len=0 TSval=3182012896 TSecr=2766963500"
"189","96.214085416","2a03:2880:f258:1c3:face:b00c:0:167","2a00:a041:3c5d:4d00:424b:6377:a930:43d","TLSv1.2","274","Application Data"
"190","96.214101934","2a00:a041:3c5d:4d00:424b:6377:a930:43d","2a03:2880:f258:1c3:face:b00c:0:167","TCP","88","41660  >  443 [ACK] Seq=3677 Ack=11038 Win=1174 Len=0 TSval=2766963651 TSecr=3182012946"
"191","96.767511622","2a03:2880:f258:1c3:face:b00c:0:167","2a00:a041:3c5d:4d00:424b:6377:a930:43d","TLSv1.2","181","Application Data"
"192","96.767547390","2a00:a041:3c5d:4d00:424b:6377:a930:43d","2a03:2880:f258:1c3:face:b00c:0:167","TCP","88","41660  >  443 [ACK] Seq=3677 Ack=11131 Win=1174 Len=0 TSval=2766964205 TSecr=3182013441"
"193","96.780994000","2a00:a041:3c5d:4d00:424b:6377:a930:43d","2a03:2880:f258:1c3:face:b00c:0:167","TLSv1.2","180","Application Data"
"194","96.853848843","2a03:2880:f258:1c3:face:b00c:0:167","2a00:a041:3c5d:4d00:424b:6377:a930:43d","TCP","88","443  >  41660 [ACK] Seq=11131 Ack=3769 Win=809 Len=0 TSval=3182013585 TSecr=2766964218"
"195","97.616398397","2a00:a041:3c5d:4d00:424b:6377:a930:43d","2a03:2880:f258:1c3:face:b00c:0:167","TLSv1.2","181","Application Data"
"196","97.691790995","2a03:2880:f258:1c3:face:b00c:0:167","2a00:a041:3c5d:4d00:424b:6377:a930:43d","TCP","88","443  >  41660 [ACK] Seq=11131 Ack=3862 Win=809 Len=0 TSval=3182014424 TSecr=2766965054"
"197","97.889431072","2a00:a041:3c5d:4d00:424b:6377:a930:43d","2a03:2880:f258:1c3:face:b00c:0:167","TLSv1.2","160","Application Data"
"198","97.967161292","2a03:2880:f258:1c3:face:b00c:0:167","2a00:a041:3c5d:4d00:424b:6377:a930:43d","TCP","88","443  >  41660 [ACK] Seq=11131 Ack=3934 Win=809 Len=0 TSval=3182014700 TSecr=2766965327"
"199","97.988166721","2a03:2880:f258:1c3:face:b00c:0:167","2a00:a041:3c5d:4d00:424b:6377:a930:43d","TLSv1.2","365","Application Data"
"200","98.041329072","2a00:a041:3c5d:4d00:424b:6377:a930:43d","2a03:2880:f258:1c3:face:b00c:0:167","TCP","88","41660  >  443 [ACK] Seq=3934 Ack=11408 Win=1174 Len=0 TSval=2766965479 TSecr=3182014720"
"201","98.624736442","2a00:a041:3c5d:4d00:424b:6377:a930:43d","2a03:2880:f258:1c3:face:b00c:0:167","TLSv1.2","160","Application Data"
"202","98.815319396","2a03:2880:f258:1c3:face:b00c:0:167","2a00:a041:3c5d:4d00:424b:6377:a930:43d","TCP","88","443  >  41660 [ACK] Seq=11408 Ack=4006 Win=809 Len=0 TSval=3182015474 TSecr=2766966062"
"204","108.032815120","2a03:2880:f258:1c3:face:b00c:0:167","2a00:a041:3c5d:4d00:424b:6377:a930:43d","TLSv1.2","232","Application Data"
"205","108.032848141","2a00:a041:3c5d:4d00:424b:6377:a930:43d","2a03:2880:f258:1c3:face:b00c:0:167","TCP","88","41660  >  443 [ACK] Seq=4006 Ack=11552 Win=1174 Len=0 TSval=2766975470 TSecr=3182024629"
"206","108.055229049","2a00:a041:3c5d:4d00:424b:6377:a930:43d","2a03:2880:f258:1c3:face:b00c:0:167","TLSv1.2","191","Application Data"
"207","108.128594169","2a03:2880:f258:1c3:face:b00c:0:167","2a00:a041:3c5d:4d00:424b:6377:a930:43d","TCP","88","443  >  41660 [ACK] Seq=11552 Ack=4109 Win=809 Len=0 TSval=3182024861 TSecr=2766975492"
"210","109.026824207","2a00:a041:3c5d:4d00:424b:6377:a930:43d","2a03:2880:f258:1c3:face:b00c:0:167","TLSv1.2","158","Application Data"
"213","109.101027850","2a03:2880:f258:1c3:face:b00c:0:167","2a00:a041:3c5d:4d00:424b:6377:a930:43d","TCP","88","443  >  41660 [ACK] Seq=11552 Ack=4179 Win=809 Len=0 TSval=3182025833 TSecr=2766976464"
"214","109.180678812","2a03:2880:f258:1c3:face:b00c:0:167","2a00:a041:3c5d:4d00:424b:6377:a930:43d","TLSv1.2","160","Application Data"
"215","109.221329764","2a00:a041:3c5d:4d00:424b:6377:a930:43d","2a03:2880:f258:1c3:face:b00c:0:167","TCP","88","41660  >  443 [ACK] Seq=4179 Ack=11624 Win=1174 Len=0 TSval=2766976659 TSecr=3182025913"
"221","128.631848662","2a00:a041:3c5d:4d00:424b:6377:a930:43d","2a03:2880:f258:1c3:face:b00c:0:167","TLSv1.2","158","Application Data"
"222","128.707154175","2a03:2880:f258:1c3:face:b00c:0:167","2a00:a041:3c5d:4d00:424b:6377:a930:43d","TCP","88","443  >  41660 [ACK] Seq=11624 Ack=4249 Win=809 Len=0 TSval=3182045440 TSecr=2766996069"
"223","128.787101863","2a03:2880:f258:1c3:face:b00c:0:167","2a00:a041:3c5d:4d00:424b:6377:a930:43d","TLSv1.2","160","Application Data"
"224","128.787133722","2a00:a041:3c5d:4d00:424b:6377:a930:43d","2a03:2880:f258:1c3:face:b00c:0:167","TCP","88","41660  >  443 [ACK] Seq=4249 Ack=11696 Win=1174 Len=0 TSval=2766996224 TSecr=3182045519"
"228","133.836707381","2a03:2880:f258:1c3:face:b00c:0:167","2a00:a041:3c5d:4d00:424b:6377:a930:43d","TLSv1.2","220","Application Data"
"229","133.836744365","2a00:a041:3c5d:4d00:424b:6377:a930:43d","2a03:2880:f258:1c3:face:b00c:0:167","TCP","88","41660  >  443 [ACK] Seq=4249 Ack=11828 Win=1174 Len=0 TSval=2767001274 TSecr=3182050532"
"230","133.839698198","2a00:a041:3c5d:4d00:424b:6377:a930:43d","2a03:2880:f258:1c3:face:b00c:0:167","TLSv1.2","161","Application Data"
"231","133.915908028","2a03:2880:f258:1c3:face:b00c:0:167","2a00:a041:3c5d:4d00:424b:6377:a930:43d","TCP","88","443  >  41660 [ACK] Seq=11828 Ack=4322 Win=809 Len=0 TSval=3182050648 TSecr=2767001277"
"233","141.059592455","2a00:a041:3c5d:4d00:424b:6377:a930:43d","2a03:2880:f258:c8:face:b00c:0:167","TLSv1.3","112","Application Data"
"234","141.059651929","2a00:a041:3c5d:4d00:424b:6377:a930:43d","2a03:2880:f258:c8:face:b00c:0:167","TCP","88","47108  >  443 [FIN, ACK] Seq=2182 Ack=1083 Win=64128 Len=0 TSval=1650894807 TSecr=148819252"
"235","141.063108178","2a00:a041:3c5d:4d00:424b:6377:a930:43d","2a03:2880:f258:c8:face:b00c:0:167","TLSv1.3","112","Application Data"
"236","141.063144095","2a00:a041:3c5d:4d00:424b:6377:a930:43d","2a03:2880:f258:c8:face:b00c:0:167","TCP","88","47120  >  443 [FIN, ACK] Seq=2182 Ack=1083 Win=64128 Len=0 TSval=1650894810 TSecr=3325669663"
"237","141.161588134","2a03:2880:f258:c8:face:b00c:0:167","2a00:a041:3c5d:4d00:424b:6377:a930:43d","TCP","100","[TCP Dup ACK 159#1] 443  >  47120 [ACK] Seq=1083 Ack=2158 Win=70400 Len=0 TSval=3325729759 TSecr=1650834857 SLE=2182 SRE=2183"
"238","141.162325480","2a03:2880:f258:c8:face:b00c:0:167","2a00:a041:3c5d:4d00:424b:6377:a930:43d","TCP","88","443  >  47120 [ACK] Seq=1083 Ack=2183 Win=70400 Len=0 TSval=3325729759 TSecr=1650894810"
"239","141.162325819","2a03:2880:f258:c8:face:b00c:0:167","2a00:a041:3c5d:4d00:424b:6377:a930:43d","TLSv1.3","112","Application Data"
"240","141.162325866","2a03:2880:f258:c8:face:b00c:0:167","2a00:a041:3c5d:4d00:424b:6377:a930:43d","TCP","88","443  >  47120 [FIN, ACK] Seq=1107 Ack=2183 Win=70400 Len=0 TSval=3325729760 TSecr=1650894810"
"241","141.162340122","2a03:2880:f258:c8:face:b00c:0:167","2a00:a041:3c5d:4d00:424b:6377:a930:43d","TCP","100","[TCP Dup ACK 157#1] 443  >  47108 [ACK] Seq=1083 Ack=2158 Win=70400 Len=0 TSval=148879353 TSecr=1650834805 SLE=2182 SRE=2183"
"242","141.162340345","2a03:2880:f258:c8:face:b00c:0:167","2a00:a041:3c5d:4d00:424b:6377:a930:43d","TCP","88","443  >  47108 [ACK] Seq=1083 Ack=2183 Win=70400 Len=0 TSval=148879353 TSecr=1650894807"
"243","141.162340394","2a03:2880:f258:c8:face:b00c:0:167","2a00:a041:3c5d:4d00:424b:6377:a930:43d","TLSv1.3","112","Application Data"
"244","141.162395658","2a00:a041:3c5d:4d00:424b:6377:a930:43d","2a03:2880:f258:c8:face:b00c:0:167","TCP","76","47120  >  443 [RST] Seq=2183 Win=0 Len=0"
"245","141.162411650","2a00:a041:3c5d:4d00:424b:6377:a930:43d","2a03:2880:f258:c8:face:b00c:0:167","TCP","76","47108  >  443 [RST] Seq=2183 Win=0 Len=0"
"246","141.162421598","2a00:a041:3c5d:4d00:424b:6377:a930:43d","2a03:2880:f258:c8:face:b00c:0:167","TCP","76","47120  >  443 [RST] Seq=2183 Win=0 Len=0"
"247","141.162697731","2a03:2880:f258:c8:face:b00c:0:167","2a00:a041:3c5d:4d00:424b:6377:a930:43d","TCP","88","443  >  47108 [FIN, ACK] Seq=1107 Ack=2183 Win=70400 Len=0 TSval=148879353 TSecr=1650894807"
"248","141.162714299","2a00:a041:3c5d:4d00:424b:6377:a930:43d","2a03:2880:f258:c8:face:b00c:0:167","TCP","76","47108  >  443 [RST] Seq=2183 Win=0 Len=0"
"258","153.654816483","2a00:a041:3c5d:4d00:424b:6377:a930:43d","2a03:2880:f258:1c3:face:b00c:0:167","TLSv1.2","158","Application Data"
"259","153.733161094","2a03:2880:f258:1c3:face:b00c:0:167","2a00:a041:3c5d:4d00:424b:6377:a930:43d","TCP","88","443  >  41660 [ACK] Seq=11828 Ack=4392 Win=809 Len=0 TSval=3182070465 TSecr=2767021092"
"260","153.812779714","2a03:2880:f258:1c3:face:b00c:0:167","2a00:a041:3c5d:4d00:424b:6377:a930:43d","TLSv1.2","160","Application Data"
"261","153.853319561","2a00:a041:3c5d:4d00:424b:6377:a930:43d","2a03:2880:f258:1c3:face:b00c:0:167","TCP","88","41660  >  443 [ACK] Seq=4392 Ack=11900 Win=1174 Len=0 TSval=2767021291 TSecr=3182070545"
"262","155.341117505","2a03:2880:f258:1c3:face:b00c:0:167","2a00:a041:3c5d:4d00:424b:6377:a930:43d","TLSv1.2","369","Application Data"
"263","155.341156857","2a00:a041:3c5d:4d00:424b:6377:a930:43d","2a03:2880:f258:1c3:face:b00c:0:167","TCP","88","41660  >  443 [ACK] Seq=4392 Ack=12181 Win=1174 Len=0 TSval=2767022778 TSecr=3182072047"
"264","155.576505971","2a00:a041:3c5d:4d00:424b:6377:a930:43d","2a03:2880:f258:1c3:face:b00c:0:167","TLSv1.2","181","Application Data"
"265","155.643186423","2a03:2880:f258:1c3:face:b00c:0:167","2a00:a041:3c5d:4d00:424b:6377:a930:43d","TLSv1.2","401","Application Data"
"266","155.643239403","2a00:a041:3c5d:4d00:424b:6377:a930:43d","2a03:2880:f258:1c3:face:b00c:0:167","TCP","88","41660  >  443 [ACK] Seq=4485 Ack=12494 Win=1174 Len=0 TSval=2767023080 TSecr=3182072376"
"267","155.654479666","2a03:2880:f258:1c3:face:b00c:0:167","2a00:a041:3c5d:4d00:424b:6377:a930:43d","TCP","88","443  >  41660 [ACK] Seq=12494 Ack=4485 Win=809 Len=0 TSval=3182072387 TSecr=2767023014"
"269","156.024667006","2a00:a041:3c5d:4d00:424b:6377:a930:43d","2a03:2880:f258:1c3:face:b00c:0:167","TLSv1.2","181","Application Data"
"270","156.028470190","2a03:2880:f258:1c3:face:b00c:0:167","2a00:a041:3c5d:4d00:424b:6377:a930:43d","TLSv1.2","369","Application Data"
"271","156.028503489","2a00:a041:3c5d:4d00:424b:6377:a930:43d","2a03:2880:f258:1c3:face:b00c:0:167","TCP","88","41660  >  443 [ACK] Seq=4578 Ack=12775 Win=1174 Len=0 TSval=2767023466 TSecr=3182072710"
"272","156.132458970","2a03:2880:f258:1c3:face:b00c:0:167","2a00:a041:3c5d:4d00:424b:6377:a930:43d","TCP","88","443  >  41660 [ACK] Seq=12775 Ack=4578 Win=809 Len=0 TSval=3182072842 TSecr=2767023462"
"273","156.159328674","2a03:2880:f258:1c3:face:b00c:0:167","2a00:a041:3c5d:4d00:424b:6377:a930:43d","TLSv1.2","181","Application Data"
"274","156.159363502","2a00:a041:3c5d:4d00:424b:6377:a930:43d","2a03:2880:f258:1c3:face:b00c:0:167","TCP","88","41660  >  443 [ACK] Seq=4578 Ack=12868 Win=1174 Len=0 TSval=2767023597 TSecr=3182072891"
"275","156.159678876","2a03:2880:f258:1c3:face:b00c:0:167","2a00:a041:3c5d:4d00:424b:6377:a930:43d","TLSv1.2","181","Application Data"
"276","156.159701681","2a00:a041:3c5d:4d00:424b:6377:a930:43d","2a03:2880:f258:1c3:face:b00c:0:167","TCP","88","41660  >  443 [ACK] Seq=4578 Ack=12961 Win=1174 Len=0 TSval=2767023597 TSecr=3182072892"
"277","156.166420866","2a00:a041:3c5d:4d00:424b:6377:a930:43d","2a03:2880:f258:1c3:face:b00c:0:167","TLSv1.2","180","Application Data"
"278","156.252544268","2a00:a041:3c5d:4d00:424b:6377:a930:43d","2a03:2880:f258:1c3:face:b00c:0:167","TLSv1.2","180","Application Data"
"279","156.252856750","2a03:2880:f258:1c3:face:b00c:0:167","2a00:a041:3c5d:4d00:424b:6377:a930:43d","TCP","88","443  >  41660 [ACK] Seq=12961 Ack=4670 Win=809 Len=0 TSval=3182072975 TSecr=2767023604"
"280","156.266467938","2a03:2880:f258:1c3:face:b00c:0:167","2a00:a041:3c5d:4d00:424b:6377:a930:43d","TLSv1.2","369","Application Data"
"281","156.278869734","2a03:2880:f258:1c3:face:b00c:0:167","2a00:a041:3c5d:4d00:424b:6377:a930:43d","TLSv1.2","181","Application Data"
"282","156.279070376","2a00:a041:3c5d:4d00:424b:6377:a930:43d","2a03:2880:f258:1c3:face:b00c:0:167","TCP","88","41660  >  443 [ACK] Seq=4762 Ack=13335 Win=1174 Len=0 TSval=2767023716 TSecr=3182072998"
"283","156.369046451","2a03:2880:f258:1c3:face:b00c:0:167","2a00:a041:3c5d:4d00:424b:6377:a930:43d","TCP","88","443  >  41660 [ACK] Seq=13335 Ack=4762 Win=809 Len=0 TSval=3182073102 TSecr=2767023690"
"284","156.477768283","2a00:a041:3c5d:4d00:424b:6377:a930:43d","2a03:2880:f258:1c3:face:b00c:0:167","TLSv1.2","180","Application Data"
"285","156.558099726","2a03:2880:f258:1c3:face:b00c:0:167","2a00:a041:3c5d:4d00:424b:6377:a930:43d","TCP","88","443  >  41660 [ACK] Seq=13335 Ack=4854 Win=809 Len=0 TSval=3182073290 TSecr=2767023915"
"286","156.569227325","2a03:2880:f258:1c3:face:b00c:0:167","2a00:a041:3c5d:4d00:424b:6377:a930:43d","TLSv1.2","369","Application Data"
"287","156.578826236","2a03:2880:f258:1c3:face:b00c:0:167","2a00:a041:3c5d:4d00:424b:6377:a930:43d","TLSv1.2","181","Application Data"
"288","156.579007686","2a00:a041:3c5d:4d00:424b:6377:a930:43d","2a03:2880:f258:1c3:face:b00c:0:167","TCP","88","41660  >  443 [ACK] Seq=4854 Ack=13709 Win=1174 Len=0 TSval=2767024016 TSecr=3182073301"
"289","156.600816620","2a00:a041:3c5d:4d00:424b:6377:a930:43d","2a03:2880:f258:1c3:face:b00c:0:167","TLSv1.2","180","Application Data"
"290","156.758372569","2a00:a041:3c5d:4d00:424b:6377:a930:43d","2a03:2880:f258:1c3:face:b00c:0:167","TLSv1.2","181","Application Data"
"291","156.760273786","2a03:2880:f258:1c3:face:b00c:0:167","2a00:a041:3c5d:4d00:424b:6377:a930:43d","TCP","88","443  >  41660 [ACK] Seq=13709 Ack=4946 Win=809 Len=0 TSval=3182073447 TSecr=2767024038"
"292","156.833307439","2a03:2880:f258:1c3:face:b00c:0:167","2a00:a041:3c5d:4d00:424b:6377:a930:43d","TCP","88","443  >  41660 [ACK] Seq=13709 Ack=5039 Win=809 Len=0 TSval=3182073566 TSecr=2767024196"
"293","156.833867254","2a03:2880:f258:1c3:face:b00c:0:167","2a00:a041:3c5d:4d00:424b:6377:a930:43d","TLSv1.2","369","Application Data"
"294","156.877357570","2a00:a041:3c5d:4d00:424b:6377:a930:43d","2a03:2880:f258:1c3:face:b00c:0:167","TCP","88","41660  >  443 [ACK] Seq=5039 Ack=13990 Win=1174 Len=0 TSval=2767024315 TSecr=3182073566"
"295","156.900106270","2a03:2880:f258:1c3:face:b00c:0:167","2a00:a041:3c5d:4d00:424b:6377:a930:43d","TLSv1.2","181","Application Data"
"296","156.900144685","2a00:a041:3c5d:4d00:424b:6377:a930:43d","2a03:2880:f258:1c3:face:b00c:0:167","TCP","88","41660  >  443 [ACK] Seq=5039 Ack=14083 Win=1174 Len=0 TSval=2767024337 TSecr=3182073624"
"297","156.903690029","2a00:a041:3c5d:4d00:424b:6377:a930:43d","2a03:2880:f258:1c3:face:b00c:0:167","TLSv1.2","180","Application Data"
"298","157.081392347","2a03:2880:f258:1c3:face:b00c:0:167","2a00:a041:3c5d:4d00:424b:6377:a930:43d","TCP","88","443  >  41660 [ACK] Seq=14083 Ack=5131 Win=809 Len=0 TSval=3182073755 TSecr=2767024341"
"299","157.098641700","2a00:a041:3c5d:4d00:424b:6377:a930:43d","2a03:2880:f258:1c3:face:b00c:0:167","TLSv1.2","181","Application Data"
"300","157.119476652","2a03:2880:f258:1c3:face:b00c:0:167","2a00:a041:3c5d:4d00:424b:6377:a930:43d","TLSv1.2","181","Application Data"
"301","157.123552891","2a00:a041:3c5d:4d00:424b:6377:a930:43d","2a03:2880:f258:1c3:face:b00c:0:167","TLSv1.2","180","Application Data"
"302","157.172515718","2a03:2880:f258:1c3:face:b00c:0:167","2a00:a041:3c5d:4d00:424b:6377:a930:43d","TCP","88","[TCP Previous segment not captured] 443  >  41660 [ACK] Seq=14457 Ack=5224 Win=809 Len=0 TSval=3182073904 TSecr=2767024536"
"303","157.196561372","2a03:2880:f258:1c3:face:b00c:0:167","2a00:a041:3c5d:4d00:424b:6377:a930:43d","TCP","88","443  >  41660 [ACK] Seq=14457 Ack=5316 Win=809 Len=0 TSval=3182073929 TSecr=2767024561"
"304","157.491369363","2a03:2880:f258:1c3:face:b00c:0:167","2a00:a041:3c5d:4d00:424b:6377:a930:43d","TCP","369","[TCP Retransmission] 443  >  41660 [PSH, ACK] Seq=14176 Ack=5316 Win=809 Len=281 TSval=3182074119 TSecr=2767024561"
"305","157.491771204","2a03:2880:f258:1c3:face:b00c:0:167","2a00:a041:3c5d:4d00:424b:6377:a930:43d","TLSv1.2","181","Application Data"
"306","157.491859704","2a00:a041:3c5d:4d00:424b:6377:a930:43d","2a03:2880:f258:1c3:face:b00c:0:167","TCP","88","41660  >  443 [ACK] Seq=5316 Ack=14550 Win=1174 Len=0 TSval=2767024929 TSecr=3182074119"
"307","157.560725373","2a00:a041:3c5d:4d00:424b:6377:a930:43d","2a03:2880:f258:1c3:face:b00c:0:167","TLSv1.2","180","Application Data"
"308","157.651458345","2a03:2880:f258:1c3:face:b00c:0:167","2a00:a041:3c5d:4d00:424b:6377:a930:43d","TCP","88","443  >  41660 [ACK] Seq=14550 Ack=5408 Win=809 Len=0 TSval=3182074369 TSecr=2767024998"
"309","157.673855317","2a03:2880:f258:1c3:face:b00c:0:167","2a00:a041:3c5d:4d00:424b:6377:a930:43d","TLSv1.2","401","Application Data"
"310","157.675184079","2a00:a041:3c5d:4d00:424b:6377:a930:43d","2a03:2880:f258:1c3:face:b00c:0:167","TLSv1.2","181","Application Data"
"311","158.001267533","2a00:a041:3c5d:4d00:424b:6377:a930:43d","2a03:2880:f258:1c3:face:b00c:0:167","TCP","181","[TCP Retransmission] 41660  >  443 [PSH, ACK] Seq=5408 Ack=14863 Win=1174 Len=93 TSval=2767025439 TSecr=3182074406"
"312","158.003068473","2a03:2880:f258:1c3:face:b00c:0:167","2a00:a041:3c5d:4d00:424b:6377:a930:43d","TCP","88","443  >  41660 [ACK] Seq=14863 Ack=5501 Win=809 Len=0 TSval=3182074536 TSecr=2767025112"
"313","158.003641763","2a03:2880:f258:1c3:face:b00c:0:167","2a00:a041:3c5d:4d00:424b:6377:a930:43d","TLSv1.2","181","Application Data"
"314","158.003641814","2a03:2880:f258:1c3:face:b00c:0:167","2a00:a041:3c5d:4d00:424b:6377:a930:43d","TLSv1.2","369","Application Data"
"315","158.003759799","2a00:a041:3c5d:4d00:424b:6377:a930:43d","2a03:2880:f258:1c3:face:b00c:0:167","TCP","88","41660  >  443 [ACK] Seq=5501 Ack=15237 Win=1174 Len=0 TSval=2767025441 TSecr=3182074705"
"316","158.023982470","2a00:a041:3c5d:4d00:424b:6377:a930:43d","2a03:2880:f258:1c3:face:b00c:0:167","TLSv1.2","180","Application Data"
"317","158.077274977","2a03:2880:f258:1c3:face:b00c:0:167","2a00:a041:3c5d:4d00:424b:6377:a930:43d","TCP","88","[TCP Dup ACK 312#1] 443  >  41660 [ACK] Seq=15237 Ack=5501 Win=809 Len=0 TSval=3182074810 TSecr=2767025439"
"318","158.099334521","2a03:2880:f258:1c3:face:b00c:0:167","2a00:a041:3c5d:4d00:424b:6377:a930:43d","TCP","88","443  >  41660 [ACK] Seq=15237 Ack=5593 Win=809 Len=0 TSval=3182074832 TSecr=2767025461"
"319","158.122947134","2a00:a041:3c5d:4d00:424b:6377:a930:43d","2a03:2880:f258:1c3:face:b00c:0:167","TLSv1.2","181","Application Data"
"320","158.194192827","2a03:2880:f258:1c3:face:b00c:0:167","2a00:a041:3c5d:4d00:424b:6377:a930:43d","TCP","88","443  >  41660 [ACK] Seq=15237 Ack=5686 Win=809 Len=0 TSval=3182074927 TSecr=2767025560"
"321","158.287297887","2a03:2880:f258:1c3:face:b00c:0:167","2a00:a041:3c5d:4d00:424b:6377:a930:43d","TLSv1.2","181","Application Data"
"322","158.293144135","2a00:a041:3c5d:4d00:424b:6377:a930:43d","2a03:2880:f258:1c3:face:b00c:0:167","TLSv1.2","180","Application Data"
"323","158.295285626","2a03:2880:f258:1c3:face:b00c:0:167","2a00:a041:3c5d:4d00:424b:6377:a930:43d","TLSv1.2","385","Application Data"
"324","158.337330960","2a00:a041:3c5d:4d00:424b:6377:a930:43d","2a03:2880:f258:1c3:face:b00c:0:167","TCP","88","41660  >  443 [ACK] Seq=5778 Ack=15627 Win=1174 Len=0 TSval=2767025775 TSecr=3182075027"
"325","158.382139289","2a03:2880:f258:1c3:face:b00c:0:167","2a00:a041:3c5d:4d00:424b:6377:a930:43d","TCP","88","443  >  41660 [ACK] Seq=15627 Ack=5778 Win=809 Len=0 TSval=3182075114 TSecr=2767025730"
"326","158.720151941","2a03:2880:f258:1c3:face:b00c:0:167","2a00:a041:3c5d:4d00:424b:6377:a930:43d","TLSv1.2","385","Application Data"
"327","158.720186450","2a00:a041:3c5d:4d00:424b:6377:a930:43d","2a03:2880:f258:1c3:face:b00c:0:167","TCP","88","41660  >  443 [ACK] Seq=5778 Ack=15924 Win=1174 Len=0 TSval=2767026157 TSecr=3182075370"
"328","158.720479640","2a03:2880:f258:1c3:face:b00c:0:167","2a00:a041:3c5d:4d00:424b:6377:a930:43d","TLSv1.2","181","Application Data"
"329","158.720501836","2a00:a041:3c5d:4d00:424b:6377:a930:43d","2a03:2880:f258:1c3:face:b00c:0:167","TCP","88","41660  >  443 [ACK] Seq=5778 Ack=16017 Win=1174 Len=0 TSval=2767026158 TSecr=3182075391"
"330","158.723501288","2a00:a041:3c5d:4d00:424b:6377:a930:43d","2a03:2880:f258:1c3:face:b00c:0:167","TLSv1.2","180","Application Data"
"331","158.803209887","2a03:2880:f258:1c3:face:b00c:0:167","2a00:a041:3c5d:4d00:424b:6377:a930:43d","TCP","88","443  >  41660 [ACK] Seq=16017 Ack=5870 Win=809 Len=0 TSval=3182075536 TSecr=2767026161"
"332","158.839519232","2a00:a041:3c5d:4d00:424b:6377:a930:43d","2a03:2880:f258:1c3:face:b00c:0:167","TLSv1.2","181","Application Data"
"333","158.892428181","2a03:2880:f258:1c3:face:b00c:0:167","2a00:a041:3c5d:4d00:424b:6377:a930:43d","TLSv1.2","385","[TCP Previous segment not captured] , Application Data"
"334","158.892448835","2a00:a041:3c5d:4d00:424b:6377:a930:43d","2a03:2880:f258:1c3:face:b00c:0:167","TCP","100","[TCP Dup ACK 329#1] 41660  >  443 [ACK] Seq=5963 Ack=16017 Win=1174 Len=0 TSval=2767026330 TSecr=3182075536 SLE=16110 SRE=16407"
"335","158.965119147","2a03:2880:f258:1c3:face:b00c:0:167","2a00:a041:3c5d:4d00:424b:6377:a930:43d","TCP","88","443  >  41660 [ACK] Seq=16407 Ack=5963 Win=809 Len=0 TSval=3182075697 TSecr=2767026277"
"336","159.002141973","2a03:2880:f258:1c3:face:b00c:0:167","2a00:a041:3c5d:4d00:424b:6377:a930:43d","TCP","181","[TCP Retransmission] 443  >  41660 [PSH, ACK] Seq=16017 Ack=5963 Win=809 Len=93 TSval=3182075735 TSecr=2767026330"
"337","159.002210373","2a00:a041:3c5d:4d00:424b:6377:a930:43d","2a03:2880:f258:1c3:face:b00c:0:167","TCP","88","41660  >  443 [ACK] Seq=5963 Ack=16407 Win=1171 Len=0 TSval=2767026439 TSecr=3182075735"
"338","159.010268133","2a00:a041:3c5d:4d00:424b:6377:a930:43d","2a03:2880:f258:1c3:face:b00c:0:167","TLSv1.2","180","Application Data"
"339","159.084207695","2a03:2880:f258:1c3:face:b00c:0:167","2a00:a041:3c5d:4d00:424b:6377:a930:43d","TCP","88","443  >  41660 [ACK] Seq=16407 Ack=6055 Win=809 Len=0 TSval=3182075816 TSecr=2767026448"
"340","159.179632395","2a00:a041:3c5d:4d00:424b:6377:a930:43d","2a03:2880:f258:1c3:face:b00c:0:167","TLSv1.2","181","Application Data"
"341","159.216827521","2a03:2880:f258:1c3:face:b00c:0:167","2a00:a041:3c5d:4d00:424b:6377:a930:43d","TLSv1.2","385","Application Data"
"342","159.257250883","2a00:a041:3c5d:4d00:424b:6377:a930:43d","2a03:2880:f258:1c3:face:b00c:0:167","TCP","88","41660  >  443 [ACK] Seq=6148 Ack=16704 Win=1193 Len=0 TSval=2767026695 TSecr=3182075948"
"343","159.258137392","2a03:2880:f258:1c3:face:b00c:0:167","2a00:a041:3c5d:4d00:424b:6377:a930:43d","TCP","88","443  >  41660 [ACK] Seq=16704 Ack=6148 Win=809 Len=0 TSval=3182075989 TSecr=2767026617"
"344","159.279622324","2a03:2880:f258:1c3:face:b00c:0:167","2a00:a041:3c5d:4d00:424b:6377:a930:43d","TLSv1.2","181","Application Data"
"345","159.279658630","2a00:a041:3c5d:4d00:424b:6377:a930:43d","2a03:2880:f258:1c3:face:b00c:0:167","TCP","88","41660  >  443 [ACK] Seq=6148 Ack=16797 Win=1193 Len=0 TSval=2767026717 TSecr=3182076011"
"346","159.283253264","2a00:a041:3c5d:4d00:424b:6377:a930:43d","2a03:2880:f258:1c3:face:b00c:0:167","TLSv1.2","180","Application Data"
"347","159.436550899","2a03:2880:f258:1c3:face:b00c:0:167","2a00:a041:3c5d:4d00:424b:6377:a930:43d","TCP","88","443  >  41660 [ACK] Seq=16797 Ack=6240 Win=809 Len=0 TSval=3182076136 TSecr=2767026721"
"348","159.484747621","2a00:a041:3c5d:4d00:424b:6377:a930:43d","2a03:2880:f258:1c3:face:b00c:0:167","TLSv1.2","181","Application Data"
"349","159.494490497","2a03:2880:f258:1c3:face:b00c:0:167","2a00:a041:3c5d:4d00:424b:6377:a930:43d","TLSv1.2","369","Application Data"
"350","159.537288984","2a00:a041:3c5d:4d00:424b:6377:a930:43d","2a03:2880:f258:1c3:face:b00c:0:167","TCP","88","41660  >  443 [ACK] Seq=6333 Ack=17078 Win=1193 Len=0 TSval=2767026975 TSecr=3182076227"
"351","159.559250336","2a03:2880:f258:1c3:face:b00c:0:167","2a00:a041:3c5d:4d00:424b:6377:a930:43d","TCP","88","443  >  41660 [ACK] Seq=17078 Ack=6333 Win=809 Len=0 TSval=3182076292 TSecr=2767026922"
"352","159.644115983","2a03:2880:f258:1c3:face:b00c:0:167","2a00:a041:3c5d:4d00:424b:6377:a930:43d","TLSv1.2","181","Application Data"
"353","159.644136180","2a00:a041:3c5d:4d00:424b:6377:a930:43d","2a03:2880:f258:1c3:face:b00c:0:167","TCP","88","41660  >  443 [ACK] Seq=6333 Ack=17171 Win=1193 Len=0 TSval=2767027081 TSecr=3182076377"
"354","159.650866417","2a00:a041:3c5d:4d00:424b:6377:a930:43d","2a03:2880:f258:1c3:face:b00c:0:167","TLSv1.2","180","Application Data"
"355","159.725392461","2a03:2880:f258:1c3:face:b00c:0:167","2a00:a041:3c5d:4d00:424b:6377:a930:43d","TCP","88","443  >  41660 [ACK] Seq=17171 Ack=6425 Win=809 Len=0 TSval=3182076458 TSecr=2767027088"
"356","159.726762802","2a03:2880:f258:1c3:face:b00c:0:167","2a00:a041:3c5d:4d00:424b:6377:a930:43d","TLSv1.2","181","Application Data"
"357","159.728098584","2a00:a041:3c5d:4d00:424b:6377:a930:43d","2a03:2880:f258:1c3:face:b00c:0:167","TLSv1.2","180","Application Data"
"358","159.816326085","2a03:2880:f258:1c3:face:b00c:0:167","2a00:a041:3c5d:4d00:424b:6377:a930:43d","TLSv1.2","369","Application Data"
"359","159.857346138","2a00:a041:3c5d:4d00:424b:6377:a930:43d","2a03:2880:f258:1c3:face:b00c:0:167","TCP","88","41660  >  443 [ACK] Seq=6517 Ack=17545 Win=1193 Len=0 TSval=2767027295 TSecr=3182076549"
"360","160.094284121","2a00:a041:3c5d:4d00:424b:6377:a930:43d","2a03:2880:f258:1c3:face:b00c:0:167","TLSv1.2","181","Application Data"
"361","160.122771461","2a03:2880:f258:1c3:face:b00c:0:167","2a00:a041:3c5d:4d00:424b:6377:a930:43d","TLSv1.2","401","Application Data"
"362","160.122925362","2a00:a041:3c5d:4d00:424b:6377:a930:43d","2a03:2880:f258:1c3:face:b00c:0:167","TCP","88","41660  >  443 [ACK] Seq=6610 Ack=17858 Win=1193 Len=0 TSval=2767027560 TSecr=3182076855"
"363","160.256025297","2a03:2880:f258:1c3:face:b00c:0:167","2a00:a041:3c5d:4d00:424b:6377:a930:43d","TCP","88","[TCP Previous segment not captured] 443  >  41660 [ACK] Seq=17951 Ack=6610 Win=809 Len=0 TSval=3182076958 TSecr=2767027532"
"364","160.311664130","2a00:a041:3c5d:4d00:424b:6377:a930:43d","2a03:2880:f258:1c3:face:b00c:0:167","TLSv1.2","181","Application Data"
"365","160.386194154","2a03:2880:f258:1c3:face:b00c:0:167","2a00:a041:3c5d:4d00:424b:6377:a930:43d","TCP","88","443  >  41660 [ACK] Seq=17951 Ack=6703 Win=809 Len=0 TSval=3182077119 TSecr=2767027749"
"366","160.403279763","2a03:2880:f258:1c3:face:b00c:0:167","2a00:a041:3c5d:4d00:424b:6377:a930:43d","TCP","181","[TCP Retransmission] 443  >  41660 [PSH, ACK] Seq=17858 Ack=6703 Win=809 Len=93 TSval=3182077136 TSecr=2767027749"
"367","160.403467827","2a00:a041:3c5d:4d00:424b:6377:a930:43d","2a03:2880:f258:1c3:face:b00c:0:167","TCP","88","41660  >  443 [ACK] Seq=6703 Ack=17951 Win=1193 Len=0 TSval=2767027841 TSecr=3182077136"
"368","160.405929798","2a00:a041:3c5d:4d00:424b:6377:a930:43d","2a03:2880:f258:1c3:face:b00c:0:167","TLSv1.2","180","Application Data"
"369","160.456714816","2a03:2880:f258:1c3:face:b00c:0:167","2a00:a041:3c5d:4d00:424b:6377:a930:43d","TLSv1.2","369","Application Data"
"370","160.490731250","2a03:2880:f258:1c3:face:b00c:0:167","2a00:a041:3c5d:4d00:424b:6377:a930:43d","TLSv1.2","181","Application Data"
"371","160.490752645","2a00:a041:3c5d:4d00:424b:6377:a930:43d","2a03:2880:f258:1c3:face:b00c:0:167","TCP","88","41660  >  443 [ACK] Seq=6795 Ack=18325 Win=1191 Len=0 TSval=2767027928 TSecr=3182077189"
"372","160.570205773","2a00:a041:3c5d:4d00:424b:6377:a930:43d","2a03:2880:f258:1c3:face:b00c:0:167","TLSv1.2","180","Application Data"
"373","160.870392085","2a03:2880:f258:1c3:face:b00c:0:167","2a00:a041:3c5d:4d00:424b:6377:a930:43d","TCP","88","443  >  41660 [ACK] Seq=18325 Ack=6887 Win=809 Len=0 TSval=3182077426 TSecr=2767028007"
"374","160.870879871","2a03:2880:f258:1c3:face:b00c:0:167","2a00:a041:3c5d:4d00:424b:6377:a930:43d","TLSv1.2","385","Application Data"
"375","160.870879938","2a03:2880:f258:1c3:face:b00c:0:167","2a00:a041:3c5d:4d00:424b:6377:a930:43d","TLSv1.2","181","Application Data"
"376","160.871019285","2a00:a041:3c5d:4d00:424b:6377:a930:43d","2a03:2880:f258:1c3:face:b00c:0:167","TCP","88","41660  >  443 [ACK] Seq=6887 Ack=18715 Win=1193 Len=0 TSval=2767028308 TSecr=3182077451"
"377","160.874859140","2a00:a041:3c5d:4d00:424b:6377:a930:43d","2a03:2880:f258:1c3:face:b00c:0:167","TLSv1.2","180","Application Data"
"378","160.923088260","2a03:2880:f258:1c3:face:b00c:0:167","2a00:a041:3c5d:4d00:424b:6377:a930:43d","TCP","181","[TCP Spurious Retransmission] 443  >  41660 [PSH, ACK] Seq=18622 Ack=6887 Win=809 Len=93 TSval=3182077656 TSecr=2767028007"
"379","160.923140374","2a00:a041:3c5d:4d00:424b:6377:a930:43d","2a03:2880:f258:1c3:face:b00c:0:167","TCP","100","[TCP Dup ACK 376#1] 41660  >  443 [ACK] Seq=6979 Ack=18715 Win=1193 Len=0 TSval=2767028360 TSecr=3182077656 SLE=18622 SRE=18715"
"380","160.951503278","2a03:2880:f258:1c3:face:b00c:0:167","2a00:a041:3c5d:4d00:424b:6377:a930:43d","TCP","88","443  >  41660 [ACK] Seq=18715 Ack=6979 Win=809 Len=0 TSval=3182077684 TSecr=2767028312"
"381","161.007151008","2a03:2880:f258:1c3:face:b00c:0:167","2a00:a041:3c5d:4d00:424b:6377:a930:43d","TLSv1.2","181","Application Data"
"382","161.007188712","2a00:a041:3c5d:4d00:424b:6377:a930:43d","2a03:2880:f258:1c3:face:b00c:0:167","TCP","88","41660  >  443 [ACK] Seq=6979 Ack=18808 Win=1193 Len=0 TSval=2767028444 TSecr=3182077739"
"383","161.010902318","2a00:a041:3c5d:4d00:424b:6377:a930:43d","2a03:2880:f258:1c3:face:b00c:0:167","TLSv1.2","180","Application Data"
"384","161.011189362","2a03:2880:f258:1c3:face:b00c:0:167","2a00:a041:3c5d:4d00:424b:6377:a930:43d","TLSv1.2","369","Application Data"
"385","161.057257396","2a00:a041:3c5d:4d00:424b:6377:a930:43d","2a03:2880:f258:1c3:face:b00c:0:167","TCP","88","41660  >  443 [ACK] Seq=7071 Ack=19089 Win=1193 Len=0 TSval=2767028495 TSecr=3182077743"
"386","161.086862560","2a03:2880:f258:1c3:face:b00c:0:167","2a00:a041:3c5d:4d00:424b:6377:a930:43d","TCP","88","443  >  41660 [ACK] Seq=19089 Ack=7071 Win=809 Len=0 TSval=3182077819 TSecr=2767028448"
"387","161.272442958","2a00:a041:3c5d:4d00:424b:6377:a930:43d","2a03:2880:f258:1c3:face:b00c:0:167","TLSv1.2","181","Application Data"
"388","161.338224858","2a03:2880:f258:1c3:face:b00c:0:167","2a00:a041:3c5d:4d00:424b:6377:a930:43d","TLSv1.2","385","Application Data"
"389","161.338255159","2a00:a041:3c5d:4d00:424b:6377:a930:43d","2a03:2880:f258:1c3:face:b00c:0:167","TCP","88","41660  >  443 [ACK] Seq=7164 Ack=19386 Win=1191 Len=0 TSval=2767028776 TSecr=3182078071"
"390","161.348222165","2a03:2880:f258:1c3:face:b00c:0:167","2a00:a041:3c5d:4d00:424b:6377:a930:43d","TCP","88","443  >  41660 [ACK] Seq=19386 Ack=7164 Win=809 Len=0 TSval=3182078081 TSecr=2767028710"
"391","161.365008743","2a03:2880:f258:1c3:face:b00c:0:167","2a00:a041:3c5d:4d00:424b:6377:a930:43d","TLSv1.2","181","Application Data"
"392","161.365041897","2a00:a041:3c5d:4d00:424b:6377:a930:43d","2a03:2880:f258:1c3:face:b00c:0:167","TCP","88","41660  >  443 [ACK] Seq=7164 Ack=19479 Win=1191 Len=0 TSval=2767028802 TSecr=3182078097"
"393","161.368488921","2a00:a041:3c5d:4d00:424b:6377:a930:43d","2a03:2880:f258:1c3:face:b00c:0:167","TLSv1.2","180","Application Data"
"394","161.527399094","2a00:a041:3c5d:4d00:424b:6377:a930:43d","2a03:2880:f258:1c3:face:b00c:0:167","TLSv1.2","181","Application Data"
"395","161.529593958","2a03:2880:f258:1c3:face:b00c:0:167","2a00:a041:3c5d:4d00:424b:6377:a930:43d","TCP","88","443  >  41660 [ACK] Seq=19479 Ack=7256 Win=809 Len=0 TSval=3182078228 TSecr=2767028806"
"396","161.602728583","2a03:2880:f258:1c3:face:b00c:0:167","2a00:a041:3c5d:4d00:424b:6377:a930:43d","TCP","88","443  >  41660 [ACK] Seq=19479 Ack=7349 Win=809 Len=0 TSval=3182078335 TSecr=2767028965"
"397","161.651819186","2a03:2880:f258:1c3:face:b00c:0:167","2a00:a041:3c5d:4d00:424b:6377:a930:43d","TLSv1.2","181","Application Data"
"398","161.655733877","2a03:2880:f258:1c3:face:b00c:0:167","2a00:a041:3c5d:4d00:424b:6377:a930:43d","TLSv1.2","369","Application Data"
"399","161.655915096","2a00:a041:3c5d:4d00:424b:6377:a930:43d","2a03:2880:f258:1c3:face:b00c:0:167","TCP","88","41660  >  443 [ACK] Seq=7349 Ack=19853 Win=1193 Len=0 TSval=2767029093 TSecr=3182078384"
"400","161.659046149","2a00:a041:3c5d:4d00:424b:6377:a930:43d","2a03:2880:f258:1c3:face:b00c:0:167","TLSv1.2","180","Application Data"
"401","161.732536069","2a03:2880:f258:1c3:face:b00c:0:167","2a00:a041:3c5d:4d00:424b:6377:a930:43d","TCP","88","443  >  41660 [ACK] Seq=19853 Ack=7441 Win=809 Len=0 TSval=3182078465 TSecr=2767029096"
"402","161.807453679","2a00:a041:3c5d:4d00:424b:6377:a930:43d","2a03:2880:f258:1c3:face:b00c:0:167","TLSv1.2","181","Application Data"
"403","161.882955079","2a03:2880:f258:1c3:face:b00c:0:167","2a00:a041:3c5d:4d00:424b:6377:a930:43d","TCP","88","443  >  41660 [ACK] Seq=19853 Ack=7534 Win=809 Len=0 TSval=3182078613 TSecr=2767029245"
"404","161.974975275","2a03:2880:f258:1c3:face:b00c:0:167","2a00:a041:3c5d:4d00:424b:6377:a930:43d","TLSv1.2","353","Application Data"
"405","161.975261144","2a03:2880:f258:1c3:face:b00c:0:167","2a00:a041:3c5d:4d00:424b:6377:a930:43d","TLSv1.2","181","Application Data"
"406","161.975340816","2a00:a041:3c5d:4d00:424b:6377:a930:43d","2a03:2880:f258:1c3:face:b00c:0:167","TCP","88","41660  >  443 [ACK] Seq=7534 Ack=20211 Win=1193 Len=0 TSval=2767029413 TSecr=3182078707"
"407","161.978154481","2a00:a041:3c5d:4d00:424b:6377:a930:43d","2a03:2880:f258:1c3:face:b00c:0:167","TLSv1.2","180","Application Data"
"408","162.054266730","2a03:2880:f258:1c3:face:b00c:0:167","2a00:a041:3c5d:4d00:424b:6377:a930:43d","TCP","88","443  >  41660 [ACK] Seq=20211 Ack=7626 Win=809 Len=0 TSval=3182078787 TSecr=2767029415"
"409","162.115656260","2a00:a041:3c5d:4d00:424b:6377:a930:43d","2a03:2880:f258:1c3:face:b00c:0:167","TLSv1.2","181","Application Data"
"410","162.189111111","2a03:2880:f258:1c3:face:b00c:0:167","2a00:a041:3c5d:4d00:424b:6377:a930:43d","TCP","88","443  >  41660 [ACK] Seq=20211 Ack=7719 Win=809 Len=0 TSval=3182078922 TSecr=2767029553"
"411","162.237575366","2a03:2880:f258:1c3:face:b00c:0:167","2a00:a041:3c5d:4d00:424b:6377:a930:43d","TLSv1.2","369","Application Data"
"412","162.281323469","2a00:a041:3c5d:4d00:424b:6377:a930:43d","2a03:2880:f258:1c3:face:b00c:0:167","TCP","88","41660  >  443 [ACK] Seq=7719 Ack=20492 Win=1193 Len=0 TSval=2767029719 TSecr=3182078970"
"413","162.285891785","2a03:2880:f258:1c3:face:b00c:0:167","2a00:a041:3c5d:4d00:424b:6377:a930:43d","TLSv1.2","181","Application Data"
"414","162.286090385","2a00:a041:3c5d:4d00:424b:6377:a930:43d","2a03:2880:f258:1c3:face:b00c:0:167","TCP","88","41660  >  443 [ACK] Seq=7719 Ack=20585 Win=1193 Len=0 TSval=2767029723 TSecr=3182079018"
"415","162.288910451","2a00:a041:3c5d:4d00:424b:6377:a930:43d","2a03:2880:f258:1c3:face:b00c:0:167","TLSv1.2","180","Application Data"
"416","162.361826391","2a03:2880:f258:1c3:face:b00c:0:167","2a00:a041:3c5d:4d00:424b:6377:a930:43d","TCP","88","443  >  41660 [ACK] Seq=20585 Ack=7811 Win=809 Len=0 TSval=3182079094 TSecr=2767029726"
"417","162.611401908","2a03:2880:f258:1c3:face:b00c:0:167","2a00:a041:3c5d:4d00:424b:6377:a930:43d","TLSv1.2","181","Application Data"
"418","162.613586497","2a00:a041:3c5d:4d00:424b:6377:a930:43d","2a03:2880:f258:1c3:face:b00c:0:167","TLSv1.2","180","Application Data"
"419","162.666076674","2a00:a041:3c5d:4d00:424b:6377:a930:43d","2a03:2880:f258:1c3:face:b00c:0:167","TLSv1.2","181","Application Data"
"420","162.690148085","2a03:2880:f258:1c3:face:b00c:0:167","2a00:a041:3c5d:4d00:424b:6377:a930:43d","TCP","88","443  >  41660 [ACK] Seq=20678 Ack=7903 Win=809 Len=0 TSval=3182079422 TSecr=2767030051"
"421","162.764993861","2a03:2880:f258:1c3:face:b00c:0:167","2a00:a041:3c5d:4d00:424b:6377:a930:43d","TCP","88","443  >  41660 [ACK] Seq=20678 Ack=7996 Win=809 Len=0 TSval=3182079496 TSecr=2767030103"
"422","163.356294179","2a00:a041:3c5d:4d00:424b:6377:a930:43d","2a03:2880:f258:1c3:face:b00c:0:167","TLSv1.2","181","Application Data"
"423","163.434266424","2a03:2880:f258:1c3:face:b00c:0:167","2a00:a041:3c5d:4d00:424b:6377:a930:43d","TCP","88","443  >  41660 [ACK] Seq=20678 Ack=8089 Win=809 Len=0 TSval=3182080165 TSecr=2767030794"
"424","163.706930356","2a00:a041:3c5d:4d00:424b:6377:a930:43d","2a03:2880:f258:1c3:face:b00c:0:167","TLSv1.2","181","Application Data"
"425","163.781952654","2a03:2880:f258:1c3:face:b00c:0:167","2a00:a041:3c5d:4d00:424b:6377:a930:43d","TCP","88","443  >  41660 [ACK] Seq=20678 Ack=8182 Win=809 Len=0 TSval=3182080513 TSecr=2767031144"
"426","164.335106319","2a00:a041:3c5d:4d00:424b:6377:a930:43d","2a03:2880:f258:1c3:face:b00c:0:167","TLSv1.2","181","Application Data"
"427","164.420888903","2a03:2880:f258:1c3:face:b00c:0:167","2a00:a041:3c5d:4d00:424b:6377:a930:43d","TCP","88","443  >  41660 [ACK] Seq=20678 Ack=8275 Win=809 Len=0 TSval=3182081152 TSecr=2767031772"
"428","164.720855106","2a00:a041:3c5d:4d00:424b:6377:a930:43d","2a03:2880:f258:1c3:face:b00c:0:167","TLSv1.2","181","Application Data"
"429","164.795927936","2a03:2880:f258:1c3:face:b00c:0:167","2a00:a041:3c5d:4d00:424b:6377:a930:43d","TCP","88","443  >  41660 [ACK] Seq=20678 Ack=8368 Win=809 Len=0 TSval=3182081528 TSecr=2767032158"
"430","165.014779781","2a00:a041:3c5d:4d00:424b:6377:a930:43d","2a03:2880:f258:1c3:face:b00c:0:167","TLSv1.2","181","Application Data"
"431","165.089510788","2a03:2880:f258:1c3:face:b00c:0:167","2a00:a041:3c5d:4d00:424b:6377:a930:43d","TCP","88","443  >  41660 [ACK] Seq=20678 Ack=8461 Win=809 Len=0 TSval=3182081822 TSecr=2767032452"
"432","165.354995315","2a00:a041:3c5d:4d00:424b:6377:a930:43d","2a03:2880:f258:1c3:face:b00c:0:167","TLSv1.2","181","Application Data"
"433","165.430986852","2a03:2880:f258:1c3:face:b00c:0:167","2a00:a041:3c5d:4d00:424b:6377:a930:43d","TCP","88","443  >  41660 [ACK] Seq=20678 Ack=8554 Win=809 Len=0 TSval=3182082164 TSecr=2767032792"
"435","165.740754316","2a00:a041:3c5d:4d00:424b:6377:a930:43d","2a03:2880:f258:1c3:face:b00c:0:167","TLSv1.2","181","Application Data"
"436","165.826706396","2a03:2880:f258:1c3:face:b00c:0:167","2a00:a041:3c5d:4d00:424b:6377:a930:43d","TCP","88","443  >  41660 [ACK] Seq=20678 Ack=8647 Win=809 Len=0 TSval=3182082559 TSecr=2767033178"
"437","169.779636643","2a03:2880:f258:1c3:face:b00c:0:167","2a00:a041:3c5d:4d00:424b:6377:a930:43d","TLSv1.2","274","Application Data"
"438","169.783097315","2a00:a041:3c5d:4d00:424b:6377:a930:43d","2a03:2880:f258:1c3:face:b00c:0:167","TLSv1.2","160","Application Data"
"439","169.855617567","2a03:2880:f258:1c3:face:b00c:0:167","2a00:a041:3c5d:4d00:424b:6377:a930:43d","TCP","88","443  >  41660 [ACK] Seq=20864 Ack=8719 Win=809 Len=0 TSval=3182086587 TSecr=2767037220"
"440","171.210044282","2a00:a041:3c5d:4d00:424b:6377:a930:43d","2a03:2880:f258:1c3:face:b00c:0:167","TLSv1.2","158","Application Data"
"441","171.294562611","2a03:2880:f258:1c3:face:b00c:0:167","2a00:a041:3c5d:4d00:424b:6377:a930:43d","TCP","88","443  >  41660 [ACK] Seq=20864 Ack=8789 Win=809 Len=0 TSval=3182088027 TSecr=2767038647"
"442","171.375094373","2a03:2880:f258:1c3:face:b00c:0:167","2a00:a041:3c5d:4d00:424b:6377:a930:43d","TLSv1.2","160","Application Data"
"443","171.417314749","2a00:a041:3c5d:4d00:424b:6377:a930:43d","2a03:2880:f258:1c3:face:b00c:0:167","TCP","88","41660  >  443 [ACK] Seq=8789 Ack=20936 Win=1193 Len=0 TSval=2767038855 TSecr=3182088107"
