"No.","Time","Source","Destination","Protocol","Length","Info"
"2","1.639043610","157.240.221.60","192.168.1.12","TLSv1.2","148","Application Data"
"3","1.639087589","192.168.1.12","157.240.221.60","TCP","68","42240  >  443 [ACK] Seq=1 Ack=81 Win=501 Len=0 TSval=1292298823 TSecr=1403566018"
"4","1.662054364","157.240.221.60","192.168.1.12","TCP","148","[TCP Spurious Retransmission] 443  >  42240 [PSH, ACK] Seq=1 Ack=1 Win=437 Len=80 TSval=1403566301 TSecr=1292294607"
"5","1.662097054","192.168.1.12","157.240.221.60","TCP","80","[TCP Dup ACK 3#1] 42240  >  443 [ACK] Seq=1 Ack=81 Win=501 Len=0 TSval=1292298846 TSecr=1403566301 SLE=1 SRE=81"
"6","2.560692525","157.240.221.60","192.168.1.12","TLSv1.2","148","Application Data"
"7","2.560732708","192.168.1.12","157.240.221.60","TCP","68","42240  >  443 [ACK] Seq=1 Ack=161 Win=501 Len=0 TSval=1292299745 TSecr=1403567148"
"8","4.709975043","157.240.221.60","192.168.1.12","TLSv1.2","145","Application Data"
"9","4.710015204","192.168.1.12","157.240.221.60","TCP","68","42240  >  443 [ACK] Seq=1 Ack=238 Win=501 Len=0 TSval=1292301894 TSecr=1403569306"
"10","5.221942472","157.240.221.60","192.168.1.12","TLSv1.2","148","Application Data"
"11","5.221985620","192.168.1.12","157.240.221.60","TCP","68","42240  >  443 [ACK] Seq=1 Ack=318 Win=501 Len=0 TSval=1292302406 TSecr=1403569823"
"12","6.514688273","2a00:a041:3c5d:4d00:c4e8:6181:3ac7:bd41","2a00:a040:3:4:face:b00c:3333:7020","TLSv1.2","112","Application Data"
"13","6.514731900","2a00:a041:3c5d:4d00:c4e8:6181:3ac7:bd41","2a00:a040:3:4:face:b00c:3333:7020","TCP","88","39720  >  443 [FIN, ACK] Seq=25 Ack=1 Win=1715 Len=0 TSval=3235451329 TSecr=919255343"
"14","6.552508093","2a00:a040:3:4:face:b00c:3333:7020","2a00:a041:3c5d:4d00:c4e8:6181:3ac7:bd41","TLSv1.2","112","Application Data"
"15","6.552562547","2a00:a041:3c5d:4d00:c4e8:6181:3ac7:bd41","2a00:a040:3:4:face:b00c:3333:7020","TCP","76","39720  >  443 [RST] Seq=26 Win=0 Len=0"
"16","6.552604712","2a00:a040:3:4:face:b00c:3333:7020","2a00:a041:3c5d:4d00:c4e8:6181:3ac7:bd41","TCP","88","443  >  39720 [FIN, ACK] Seq=25 Ack=26 Win=123 Len=0 TSval=919315401 TSecr=3235451328"
"17","6.552613531","2a00:a041:3c5d:4d00:c4e8:6181:3ac7:bd41","2a00:a040:3:4:face:b00c:3333:7020","TCP","76","39720  >  443 [RST] Seq=26 Win=0 Len=0"
"18","6.560141237","2a00:a041:3c5d:4d00:c4e8:6181:3ac7:bd41","2a00:a040:3:4:face:b00c:3333:7020","TLSv1.2","112","Application Data"
"19","6.560194617","2a00:a041:3c5d:4d00:c4e8:6181:3ac7:bd41","2a00:a040:3:4:face:b00c:3333:7020","TCP","88","36076  >  443 [FIN, ACK] Seq=25 Ack=1 Win=1341 Len=0 TSval=3235451374 TSecr=1739527382"
"20","6.574698434","2a00:a040:3:4:face:b00c:3333:7020","2a00:a041:3c5d:4d00:c4e8:6181:3ac7:bd41","TLSv1.2","112","Application Data"
"21","6.574749446","2a00:a041:3c5d:4d00:c4e8:6181:3ac7:bd41","2a00:a040:3:4:face:b00c:3333:7020","TCP","76","36076  >  443 [RST] Seq=26 Win=0 Len=0"
"22","6.575136417","2a00:a040:3:4:face:b00c:3333:7020","2a00:a041:3c5d:4d00:c4e8:6181:3ac7:bd41","TCP","88","443  >  36076 [FIN, ACK] Seq=25 Ack=26 Win=123 Len=0 TSval=1739587401 TSecr=3235451374"
"23","6.575144369","2a00:a041:3c5d:4d00:c4e8:6181:3ac7:bd41","2a00:a040:3:4:face:b00c:3333:7020","TCP","76","36076  >  443 [RST] Seq=26 Win=0 Len=0"
"24","7.270149050","157.240.221.60","192.168.1.12","TLSv1.2","164","Application Data"
"25","7.270197464","192.168.1.12","157.240.221.60","TCP","68","42240  >  443 [ACK] Seq=1 Ack=414 Win=501 Len=0 TSval=1292304454 TSecr=1403571868"
"26","7.275811479","192.168.1.12","157.240.221.60","TLSv1.2","163","Application Data"
"27","7.474245448","157.240.221.60","192.168.1.12","TCP","68","443  >  42240 [ACK] Seq=414 Ack=96 Win=437 Len=0 TSval=1403571990 TSecr=1292304460"
"28","7.986980856","157.240.221.60","192.168.1.12","TCP","1448","443  >  42240 [ACK] Seq=414 Ack=96 Win=437 Len=1380 TSval=1403572524 TSecr=1292304460 [TCP segment of a reassembled PDU]"
"29","7.987766689","157.240.221.60","192.168.1.12","TLSv1.2","201","Application Data"
"30","7.987767030","157.240.221.60","192.168.1.12","TLSv1.2","1409","Application Data"
"31","7.987977178","192.168.1.12","157.240.221.60","TCP","68","42240  >  443 [ACK] Seq=96 Ack=3268 Win=479 Len=0 TSval=1292305172 TSecr=1403572524"
"32","8.422576184","2a00:a041:3c5d:4d00:c4e8:6181:3ac7:bd41","2a00:a040:3:4:face:b00c:3333:7020","TLSv1.2","693","Application Data"
"33","8.439259022","2a00:a040:3:4:face:b00c:3333:7020","2a00:a041:3c5d:4d00:c4e8:6181:3ac7:bd41","TLSv1.2","808","Application Data"
"34","8.439296913","2a00:a041:3c5d:4d00:c4e8:6181:3ac7:bd41","2a00:a040:3:4:face:b00c:3333:7020","TCP","88","39736  >  443 [ACK] Seq=606 Ack=721 Win=3941 Len=0 TSval=3235453253 TSecr=3285580478"
"35","8.439895286","2a00:a040:3:4:face:b00c:3333:7020","2a00:a041:3c5d:4d00:c4e8:6181:3ac7:bd41","TLSv1.2","111","Application Data"
"36","8.439912311","2a00:a041:3c5d:4d00:c4e8:6181:3ac7:bd41","2a00:a040:3:4:face:b00c:3333:7020","TCP","88","39736  >  443 [ACK] Seq=606 Ack=744 Win=3941 Len=0 TSval=3235453254 TSecr=3285580480"
"37","8.440748740","2a00:a040:3:4:face:b00c:3333:7020","2a00:a041:3c5d:4d00:c4e8:6181:3ac7:bd41","TCP","1468","443  >  39736 [ACK] Seq=744 Ack=606 Win=123 Len=1380 TSval=3285580480 TSecr=3235453236 [TCP segment of a reassembled PDU]"
"38","8.440765402","2a00:a041:3c5d:4d00:c4e8:6181:3ac7:bd41","2a00:a040:3:4:face:b00c:3333:7020","TCP","88","39736  >  443 [ACK] Seq=606 Ack=2124 Win=3962 Len=0 TSval=3235453255 TSecr=3285580480"
"39","8.442090283","2a00:a040:3:4:face:b00c:3333:7020","2a00:a041:3c5d:4d00:c4e8:6181:3ac7:bd41","TLSv1.2","4228","Application Data [TCP segment of a reassembled PDU]"
"40","8.442108689","2a00:a041:3c5d:4d00:c4e8:6181:3ac7:bd41","2a00:a040:3:4:face:b00c:3333:7020","TCP","88","39736  >  443 [ACK] Seq=606 Ack=6264 Win=3979 Len=0 TSval=3235453256 TSecr=3285580480"
"41","8.443661146","2a00:a040:3:4:face:b00c:3333:7020","2a00:a041:3c5d:4d00:c4e8:6181:3ac7:bd41","TCP","1468","443  >  39736 [PSH, ACK] Seq=6264 Ack=606 Win=123 Len=1380 TSval=3285580480 TSecr=3235453236 [TCP segment of a reassembled PDU]"
"42","8.443661330","2a00:a040:3:4:face:b00c:3333:7020","2a00:a041:3c5d:4d00:c4e8:6181:3ac7:bd41","TCP","4228","443  >  39736 [ACK] Seq=7644 Ack=606 Win=123 Len=4140 TSval=3285580480 TSecr=3235453236 [TCP segment of a reassembled PDU]"
"43","8.443679636","2a00:a041:3c5d:4d00:c4e8:6181:3ac7:bd41","2a00:a040:3:4:face:b00c:3333:7020","TCP","88","39736  >  443 [ACK] Seq=606 Ack=7644 Win=4000 Len=0 TSval=3235453257 TSecr=3285580480"
"44","8.443694547","2a00:a041:3c5d:4d00:c4e8:6181:3ac7:bd41","2a00:a040:3:4:face:b00c:3333:7020","TCP","88","39736  >  443 [ACK] Seq=606 Ack=11784 Win=3968 Len=0 TSval=3235453258 TSecr=3285580480"
"45","8.445238465","2a00:a040:3:4:face:b00c:3333:7020","2a00:a041:3c5d:4d00:c4e8:6181:3ac7:bd41","TCP","2848","443  >  39736 [PSH, ACK] Seq=11784 Ack=606 Win=123 Len=2760 TSval=3285580480 TSecr=3235453236 [TCP segment of a reassembled PDU]"
"46","8.445238650","2a00:a040:3:4:face:b00c:3333:7020","2a00:a041:3c5d:4d00:c4e8:6181:3ac7:bd41","TCP","2848","443  >  39736 [ACK] Seq=14544 Ack=606 Win=123 Len=2760 TSval=3285580481 TSecr=3235453236 [TCP segment of a reassembled PDU]"
"47","8.445256875","2a00:a041:3c5d:4d00:c4e8:6181:3ac7:bd41","2a00:a040:3:4:face:b00c:3333:7020","TCP","88","39736  >  443 [ACK] Seq=606 Ack=14544 Win=3995 Len=0 TSval=3235453259 TSecr=3285580480"
"48","8.445271135","2a00:a041:3c5d:4d00:c4e8:6181:3ac7:bd41","2a00:a040:3:4:face:b00c:3333:7020","TCP","88","39736  >  443 [ACK] Seq=606 Ack=17304 Win=3974 Len=0 TSval=3235453259 TSecr=3285580481"
"49","8.447289156","2a00:a040:3:4:face:b00c:3333:7020","2a00:a041:3c5d:4d00:c4e8:6181:3ac7:bd41","TLSv1.2","4228","Application Data [TCP segment of a reassembled PDU]"
"50","8.447289355","2a00:a040:3:4:face:b00c:3333:7020","2a00:a041:3c5d:4d00:c4e8:6181:3ac7:bd41","TCP","4228","443  >  39736 [ACK] Seq=21444 Ack=606 Win=123 Len=4140 TSval=3285580482 TSecr=3235453236 [TCP segment of a reassembled PDU]"
"51","8.447307628","2a00:a041:3c5d:4d00:c4e8:6181:3ac7:bd41","2a00:a040:3:4:face:b00c:3333:7020","TCP","88","39736  >  443 [ACK] Seq=606 Ack=21444 Win=3979 Len=0 TSval=3235453261 TSecr=3285580481"
"52","8.447321937","2a00:a041:3c5d:4d00:c4e8:6181:3ac7:bd41","2a00:a040:3:4:face:b00c:3333:7020","TCP","88","39736  >  443 [ACK] Seq=606 Ack=25584 Win=3947 Len=0 TSval=3235453261 TSecr=3285580482"
"53","8.449577911","2a00:a040:3:4:face:b00c:3333:7020","2a00:a041:3c5d:4d00:c4e8:6181:3ac7:bd41","TCP","1468","443  >  39736 [ACK] Seq=25584 Ack=606 Win=123 Len=1380 TSval=3285580482 TSecr=3235453236 [TCP segment of a reassembled PDU]"
"54","8.449595919","2a00:a041:3c5d:4d00:c4e8:6181:3ac7:bd41","2a00:a040:3:4:face:b00c:3333:7020","TCP","88","39736  >  443 [ACK] Seq=606 Ack=26964 Win=4011 Len=0 TSval=3235453263 TSecr=3285580482"
"55","8.451013013","2a00:a040:3:4:face:b00c:3333:7020","2a00:a041:3c5d:4d00:c4e8:6181:3ac7:bd41","TCP","1468","443  >  39736 [PSH, ACK] Seq=26964 Ack=606 Win=123 Len=1380 TSval=3285580482 TSecr=3235453236 [TCP segment of a reassembled PDU]"
"56","8.451013131","2a00:a040:3:4:face:b00c:3333:7020","2a00:a041:3c5d:4d00:c4e8:6181:3ac7:bd41","TLSv1.2","6988","Application Data [TCP segment of a reassembled PDU]"
"57","8.451027647","2a00:a041:3c5d:4d00:c4e8:6181:3ac7:bd41","2a00:a040:3:4:face:b00c:3333:7020","TCP","88","39736  >  443 [ACK] Seq=606 Ack=28344 Win=4011 Len=0 TSval=3235453265 TSecr=3285580482"
"58","8.451039960","2a00:a041:3c5d:4d00:c4e8:6181:3ac7:bd41","2a00:a040:3:4:face:b00c:3333:7020","TCP","88","39736  >  443 [ACK] Seq=606 Ack=35244 Win=3958 Len=0 TSval=3235453265 TSecr=3285580483"
"59","8.454722709","2a00:a040:3:4:face:b00c:3333:7020","2a00:a041:3c5d:4d00:c4e8:6181:3ac7:bd41","TCP","6988","443  >  39736 [PSH, ACK] Seq=35244 Ack=606 Win=123 Len=6900 TSval=3285580484 TSecr=3235453236 [TCP segment of a reassembled PDU]"
"60","8.454722994","2a00:a040:3:4:face:b00c:3333:7020","2a00:a041:3c5d:4d00:c4e8:6181:3ac7:bd41","TCP","6988","443  >  39736 [PSH, ACK] Seq=42144 Ack=606 Win=123 Len=6900 TSval=3285580485 TSecr=3235453236 [TCP segment of a reassembled PDU]"
"61","8.454743442","2a00:a041:3c5d:4d00:c4e8:6181:3ac7:bd41","2a00:a040:3:4:face:b00c:3333:7020","TCP","88","39736  >  443 [ACK] Seq=606 Ack=42144 Win=3947 Len=0 TSval=3235453269 TSecr=3285580484"
"62","8.454758537","2a00:a041:3c5d:4d00:c4e8:6181:3ac7:bd41","2a00:a040:3:4:face:b00c:3333:7020","TCP","88","39736  >  443 [ACK] Seq=606 Ack=49044 Win=3894 Len=0 TSval=3235453269 TSecr=3285580485"
"63","8.454769859","2a00:a040:3:4:face:b00c:3333:7020","2a00:a041:3c5d:4d00:c4e8:6181:3ac7:bd41","TLSv1.2","4228","Application Data [TCP segment of a reassembled PDU]"
"64","8.454773725","2a00:a041:3c5d:4d00:c4e8:6181:3ac7:bd41","2a00:a040:3:4:face:b00c:3333:7020","TCP","88","39736  >  443 [ACK] Seq=606 Ack=53184 Win=3862 Len=0 TSval=3235453269 TSecr=3285580486"
"65","8.458678653","2a00:a040:3:4:face:b00c:3333:7020","2a00:a041:3c5d:4d00:c4e8:6181:3ac7:bd41","TCP","2848","443  >  39736 [PSH, ACK] Seq=53184 Ack=606 Win=123 Len=2760 TSval=3285580486 TSecr=3235453236 [TCP segment of a reassembled PDU]"
"66","8.458678914","2a00:a040:3:4:face:b00c:3333:7020","2a00:a041:3c5d:4d00:c4e8:6181:3ac7:bd41","TCP","6988","443  >  39736 [PSH, ACK] Seq=55944 Ack=606 Win=123 Len=6900 TSval=3285580487 TSecr=3235453236 [TCP segment of a reassembled PDU]"
"67","8.458678958","2a00:a040:3:4:face:b00c:3333:7020","2a00:a041:3c5d:4d00:c4e8:6181:3ac7:bd41","TCP","2848","443  >  39736 [PSH, ACK] Seq=62844 Ack=606 Win=123 Len=2760 TSval=3285580488 TSecr=3235453236 [TCP segment of a reassembled PDU]"
"68","8.458697654","2a00:a041:3c5d:4d00:c4e8:6181:3ac7:bd41","2a00:a040:3:4:face:b00c:3333:7020","TCP","88","39736  >  443 [ACK] Seq=606 Ack=55944 Win=3995 Len=0 TSval=3235453272 TSecr=3285580486"
"69","8.458711462","2a00:a041:3c5d:4d00:c4e8:6181:3ac7:bd41","2a00:a040:3:4:face:b00c:3333:7020","TCP","88","39736  >  443 [ACK] Seq=606 Ack=62844 Win=3942 Len=0 TSval=3235453273 TSecr=3285580487"
"70","8.458716211","2a00:a041:3c5d:4d00:c4e8:6181:3ac7:bd41","2a00:a040:3:4:face:b00c:3333:7020","TCP","88","39736  >  443 [ACK] Seq=606 Ack=65604 Win=3921 Len=0 TSval=3235453273 TSecr=3285580488"
"71","8.458728696","2a00:a040:3:4:face:b00c:3333:7020","2a00:a041:3c5d:4d00:c4e8:6181:3ac7:bd41","TLSv1.2","6988","Application Data, Application Data"
"72","8.458829632","2a00:a041:3c5d:4d00:c4e8:6181:3ac7:bd41","2a00:a040:3:4:face:b00c:3333:7020","TCP","88","39736  >  443 [ACK] Seq=606 Ack=72504 Win=3868 Len=0 TSval=3235453273 TSecr=3285580488"
"73","8.459746822","2a00:a040:3:4:face:b00c:3333:7020","2a00:a041:3c5d:4d00:c4e8:6181:3ac7:bd41","TCP","2848","443  >  39736 [ACK] Seq=72504 Ack=606 Win=123 Len=2760 TSval=3285580489 TSecr=3235453236 [TCP segment of a reassembled PDU]"
"74","8.459764067","2a00:a041:3c5d:4d00:c4e8:6181:3ac7:bd41","2a00:a040:3:4:face:b00c:3333:7020","TCP","88","39736  >  443 [ACK] Seq=606 Ack=75264 Win=3995 Len=0 TSval=3235453274 TSecr=3285580489"
"75","8.462202767","2a00:a040:3:4:face:b00c:3333:7020","2a00:a041:3c5d:4d00:c4e8:6181:3ac7:bd41","TCP","4228","443  >  39736 [PSH, ACK] Seq=75264 Ack=606 Win=123 Len=4140 TSval=3285580489 TSecr=3235453236 [TCP segment of a reassembled PDU]"
"76","8.462203043","2a00:a040:3:4:face:b00c:3333:7020","2a00:a041:3c5d:4d00:c4e8:6181:3ac7:bd41","TCP","4228","443  >  39736 [ACK] Seq=79404 Ack=606 Win=123 Len=4140 TSval=3285580490 TSecr=3235453236 [TCP segment of a reassembled PDU]"
"77","8.462337385","2a00:a041:3c5d:4d00:c4e8:6181:3ac7:bd41","2a00:a040:3:4:face:b00c:3333:7020","TCP","88","39736  >  443 [ACK] Seq=606 Ack=83544 Win=4011 Len=0 TSval=3235453276 TSecr=3285580489"
"78","8.463889172","2a00:a040:3:4:face:b00c:3333:7020","2a00:a041:3c5d:4d00:c4e8:6181:3ac7:bd41","TLSv1.2","2848","Application Data [TCP segment of a reassembled PDU]"
"79","8.463889259","2a00:a040:3:4:face:b00c:3333:7020","2a00:a041:3c5d:4d00:c4e8:6181:3ac7:bd41","TCP","6988","443  >  39736 [PSH, ACK] Seq=86304 Ack=606 Win=123 Len=6900 TSval=3285580491 TSecr=3235453236 [TCP segment of a reassembled PDU]"
"80","8.464010361","2a00:a041:3c5d:4d00:c4e8:6181:3ac7:bd41","2a00:a040:3:4:face:b00c:3333:7020","TCP","88","39736  >  443 [ACK] Seq=606 Ack=93204 Win=3936 Len=0 TSval=3235453278 TSecr=3285580490"
"81","8.469451153","2a00:a040:3:4:face:b00c:3333:7020","2a00:a041:3c5d:4d00:c4e8:6181:3ac7:bd41","TCP","2848","443  >  39736 [ACK] Seq=93204 Ack=606 Win=123 Len=2760 TSval=3285580492 TSecr=3235453236 [TCP segment of a reassembled PDU]"
"82","8.469468788","2a00:a041:3c5d:4d00:c4e8:6181:3ac7:bd41","2a00:a040:3:4:face:b00c:3333:7020","TCP","88","39736  >  443 [ACK] Seq=606 Ack=95964 Win=3995 Len=0 TSval=3235453283 TSecr=3285580492"
"83","8.471563047","2a00:a040:3:4:face:b00c:3333:7020","2a00:a041:3c5d:4d00:c4e8:6181:3ac7:bd41","TCP","4228","443  >  39736 [PSH, ACK] Seq=95964 Ack=606 Win=123 Len=4140 TSval=3285580492 TSecr=3235453236 [TCP segment of a reassembled PDU]"
"84","8.471714279","2a00:a041:3c5d:4d00:c4e8:6181:3ac7:bd41","2a00:a040:3:4:face:b00c:3333:7020","TCP","88","39736  >  443 [ACK] Seq=606 Ack=100104 Win=4011 Len=0 TSval=3235453286 TSecr=3285580492"
"85","8.473958884","2a00:a040:3:4:face:b00c:3333:7020","2a00:a041:3c5d:4d00:c4e8:6181:3ac7:bd41","TLSv1.2","6988","Application Data [TCP segment of a reassembled PDU]"
"86","8.473959086","2a00:a040:3:4:face:b00c:3333:7020","2a00:a041:3c5d:4d00:c4e8:6181:3ac7:bd41","TCP","6988","443  >  39736 [PSH, ACK] Seq=107004 Ack=606 Win=123 Len=6900 TSval=3285580494 TSecr=3235453236 [TCP segment of a reassembled PDU]"
"87","8.473984555","2a00:a040:3:4:face:b00c:3333:7020","2a00:a041:3c5d:4d00:c4e8:6181:3ac7:bd41","TLSv1.2","6988","Application Data [TCP segment of a reassembled PDU]"
"88","8.473984619","2a00:a040:3:4:face:b00c:3333:7020","2a00:a041:3c5d:4d00:c4e8:6181:3ac7:bd41","TCP","1468","443  >  39736 [ACK] Seq=120804 Ack=606 Win=123 Len=1380 TSval=3285580495 TSecr=3235453253 [TCP segment of a reassembled PDU]"
"89","8.474115307","2a00:a041:3c5d:4d00:c4e8:6181:3ac7:bd41","2a00:a040:3:4:face:b00c:3333:7020","TCP","88","39736  >  443 [ACK] Seq=606 Ack=122184 Win=3839 Len=0 TSval=3235453288 TSecr=3285580493"
"90","8.476762628","2a00:a040:3:4:face:b00c:3333:7020","2a00:a041:3c5d:4d00:c4e8:6181:3ac7:bd41","TCP","5608","443  >  39736 [PSH, ACK] Seq=122184 Ack=606 Win=123 Len=5520 TSval=3285580495 TSecr=3235453253 [TCP segment of a reassembled PDU]"
"91","8.476779038","2a00:a041:3c5d:4d00:c4e8:6181:3ac7:bd41","2a00:a040:3:4:face:b00c:3333:7020","TCP","88","39736  >  443 [ACK] Seq=606 Ack=127704 Win=3963 Len=0 TSval=3235453291 TSecr=3285580495"
"92","8.484155845","2a00:a040:3:4:face:b00c:3333:7020","2a00:a041:3c5d:4d00:c4e8:6181:3ac7:bd41","TCP","1468","443  >  39736 [ACK] Seq=127704 Ack=606 Win=123 Len=1380 TSval=3285580523 TSecr=3235453291 [TCP segment of a reassembled PDU]"
"93","8.485202798","2a00:a040:3:4:face:b00c:3333:7020","2a00:a041:3c5d:4d00:c4e8:6181:3ac7:bd41","TCP","1468","443  >  39736 [PSH, ACK] Seq=129084 Ack=606 Win=123 Len=1380 TSval=3285580523 TSecr=3235453291 [TCP segment of a reassembled PDU]"
"94","8.485202971","2a00:a040:3:4:face:b00c:3333:7020","2a00:a041:3c5d:4d00:c4e8:6181:3ac7:bd41","TLSv1.2","1659","Application Data"
"95","8.485220523","2a00:a041:3c5d:4d00:c4e8:6181:3ac7:bd41","2a00:a040:3:4:face:b00c:3333:7020","TCP","88","39736  >  443 [ACK] Seq=606 Ack=130464 Win=4011 Len=0 TSval=3235453299 TSecr=3285580523"
"96","8.485352913","2a00:a041:3c5d:4d00:c4e8:6181:3ac7:bd41","2a00:a040:3:4:face:b00c:3333:7020","TCP","88","39736  >  443 [ACK] Seq=606 Ack=132035 Win=4011 Len=0 TSval=3235453299 TSecr=3285580524"
"97","8.590794127","192.168.1.12","157.240.221.60","TLSv1.2","164","Application Data"
"98","8.675142976","157.240.221.60","192.168.1.12","TCP","68","443  >  42240 [ACK] Seq=3268 Ack=192 Win=437 Len=0 TSval=1403573302 TSecr=1292305775"
"104","12.071849950","192.168.1.12","157.240.221.60","TLSv1.2","134","Application Data"
"107","12.148187098","157.240.221.60","192.168.1.12","TCP","68","443  >  42240 [ACK] Seq=3268 Ack=258 Win=437 Len=0 TSval=1403576787 TSecr=1292309256"
"115","22.180296497","192.168.1.12","157.240.221.60","TLSv1.2","137","Application Data"
"116","22.251915532","157.240.221.60","192.168.1.12","TCP","68","443  >  42240 [ACK] Seq=3268 Ack=327 Win=437 Len=0 TSval=1403586891 TSecr=1292319364"
"117","22.401818629","157.240.221.60","192.168.1.12","TLSv1.2","139","Application Data"
"118","22.443320951","192.168.1.12","157.240.221.60","TCP","68","42240  >  443 [ACK] Seq=327 Ack=3339 Win=501 Len=0 TSval=1292319627 TSecr=1403587006"
"119","24.371179118","157.240.221.60","192.168.1.12","TLSv1.2","782","Application Data"
"120","24.371224994","192.168.1.12","157.240.221.60","TCP","68","42240  >  443 [ACK] Seq=327 Ack=4053 Win=496 Len=0 TSval=1292321555 TSecr=1403588981"
"121","24.645391028","192.168.1.12","157.240.221.60","TLSv1.2","164","Application Data"
"122","24.719258191","157.240.221.60","192.168.1.12","TCP","68","443  >  42240 [ACK] Seq=4053 Ack=423 Win=437 Len=0 TSval=1403589358 TSecr=1292321829"
"131","48.775154676","192.168.1.12","157.240.221.60","TLSv1.2","137","Application Data"
"132","48.848387801","157.240.221.60","192.168.1.12","TCP","68","443  >  42240 [ACK] Seq=4053 Ack=492 Win=437 Len=0 TSval=1403613487 TSecr=1292345959"
"133","49.055647220","157.240.221.60","192.168.1.12","TLSv1.2","139","Application Data"
"134","49.055696086","192.168.1.12","157.240.221.60","TCP","68","42240  >  443 [ACK] Seq=492 Ack=4124 Win=501 Len=0 TSval=1292346239 TSecr=1403613602"
"136","52.467207028","192.168.1.12","157.240.251.60","TLSv1.2","92","Application Data"
"137","52.467267069","192.168.1.12","157.240.251.60","TCP","68","53602  >  443 [FIN, ACK] Seq=25 Ack=1 Win=1788 Len=0 TSval=2950670352 TSecr=1663467669"
"138","52.544198832","157.240.251.60","192.168.1.12","TLSv1.2","92","Application Data"
"139","52.544257551","192.168.1.12","157.240.251.60","TCP","56","53602  >  443 [RST] Seq=26 Win=0 Len=0"
"140","52.544958553","157.240.251.60","192.168.1.12","TCP","68","443  >  53602 [FIN, ACK] Seq=25 Ack=26 Win=272 Len=0 TSval=1663527748 TSecr=2950670352"
"141","52.544983251","192.168.1.12","157.240.251.60","TCP","56","53602  >  443 [RST] Seq=26 Win=0 Len=0"
"142","52.570847974","192.168.1.12","157.240.251.60","TLSv1.2","92","Application Data"
"143","52.570901066","192.168.1.12","157.240.251.60","TCP","68","52280  >  443 [FIN, ACK] Seq=25 Ack=1 Win=1574 Len=0 TSval=2950670456 TSecr=610114507"
"144","52.649737246","157.240.251.60","192.168.1.12","TCP","80","443  >  52280 [ACK] Seq=1 Ack=1 Win=294 Len=0 TSval=610174585 TSecr=2950610454 SLE=25 SRE=26"
"145","52.649993586","157.240.251.60","192.168.1.12","TCP","68","443  >  52280 [ACK] Seq=1 Ack=26 Win=294 Len=0 TSval=610174585 TSecr=2950670456"
"146","52.649993807","157.240.251.60","192.168.1.12","TLSv1.2","92","Application Data"
"147","52.649993859","157.240.251.60","192.168.1.12","TCP","68","443  >  52280 [FIN, ACK] Seq=25 Ack=26 Win=294 Len=0 TSval=610174585 TSecr=2950670456"
"148","52.650057641","192.168.1.12","157.240.251.60","TCP","56","52280  >  443 [RST] Seq=26 Win=0 Len=0"
"149","52.650084056","192.168.1.12","157.240.251.60","TCP","56","52280  >  443 [RST] Seq=26 Win=0 Len=0"
"150","53.034189800","192.168.1.12","157.240.251.60","TLSv1.2","92","Application Data"
"151","53.034235875","192.168.1.12","157.240.251.60","TCP","68","58938  >  443 [FIN, ACK] Seq=25 Ack=1 Win=640 Len=0 TSval=2950670919 TSecr=3319186007"
"152","53.074760005","192.168.1.12","157.240.251.60","TLSv1.2","92","Application Data"
"153","53.074812452","192.168.1.12","157.240.251.60","TCP","68","58934  >  443 [FIN, ACK] Seq=25 Ack=1 Win=760 Len=0 TSval=2950670960 TSecr=3230440233"
"154","53.113349746","157.240.251.60","192.168.1.12","TLSv1.2","92","Application Data"
"155","53.113409617","192.168.1.12","157.240.251.60","TCP","56","58938  >  443 [RST] Seq=26 Win=0 Len=0"
"156","53.113463387","157.240.251.60","192.168.1.12","TCP","68","443  >  58938 [FIN, ACK] Seq=25 Ack=26 Win=266 Len=0 TSval=3319246089 TSecr=2950670919"
"157","53.113473568","192.168.1.12","157.240.251.60","TCP","56","58938  >  443 [RST] Seq=26 Win=0 Len=0"
"158","53.119267412","192.168.1.12","157.240.251.60","TLSv1.2","92","Application Data"
"159","53.119316131","192.168.1.12","157.240.251.60","TCP","68","58944  >  443 [FIN, ACK] Seq=25 Ack=1 Win=846 Len=0 TSval=2950671004 TSecr=2032971633"
"160","53.163546875","157.240.251.60","192.168.1.12","TCP","80","443  >  58934 [ACK] Seq=1 Ack=1 Win=266 Len=0 TSval=3230500252 TSecr=2950610958 SLE=25 SRE=26"
"161","53.164066265","157.240.251.60","192.168.1.12","TCP","68","443  >  58934 [ACK] Seq=1 Ack=26 Win=266 Len=0 TSval=3230500252 TSecr=2950670960"
"162","53.164066417","157.240.251.60","192.168.1.12","TLSv1.2","92","Application Data"
"163","53.164066473","157.240.251.60","192.168.1.12","TCP","68","443  >  58934 [FIN, ACK] Seq=25 Ack=26 Win=266 Len=0 TSval=3230500252 TSecr=2950670960"
"164","53.164125962","192.168.1.12","157.240.251.60","TCP","56","58934  >  443 [RST] Seq=26 Win=0 Len=0"
"165","53.164151572","192.168.1.12","157.240.251.60","TCP","56","58934  >  443 [RST] Seq=26 Win=0 Len=0"
"166","53.173723559","192.168.1.12","157.240.251.60","TLSv1.2","92","Application Data"
"167","53.173773413","192.168.1.12","157.240.251.60","TCP","68","58924  >  443 [FIN, ACK] Seq=25 Ack=1 Win=1573 Len=0 TSval=2950671059 TSecr=159568147"
"168","53.192366651","157.240.251.60","192.168.1.12","TCP","80","443  >  58944 [ACK] Seq=1 Ack=1 Win=267 Len=0 TSval=2033031705 TSecr=2950611003 SLE=25 SRE=26"
"169","53.195207939","157.240.251.60","192.168.1.12","TCP","68","443  >  58944 [ACK] Seq=1 Ack=26 Win=267 Len=0 TSval=2033031705 TSecr=2950671004"
"170","53.195208240","157.240.251.60","192.168.1.12","TLSv1.2","92","Application Data"
"171","53.195208286","157.240.251.60","192.168.1.12","TCP","68","443  >  58944 [FIN, ACK] Seq=25 Ack=26 Win=267 Len=0 TSval=2033031705 TSecr=2950671004"
"172","53.195303954","192.168.1.12","157.240.251.60","TCP","56","58944  >  443 [RST] Seq=26 Win=0 Len=0"
"173","53.195336336","192.168.1.12","157.240.251.60","TCP","56","58944  >  443 [RST] Seq=26 Win=0 Len=0"
"174","53.253876910","157.240.251.60","192.168.1.12","TCP","80","443  >  58924 [ACK] Seq=1 Ack=1 Win=266 Len=0 TSval=159628227 TSecr=2950611057 SLE=25 SRE=26"
"175","53.254201241","157.240.251.60","192.168.1.12","TCP","68","443  >  58924 [ACK] Seq=1 Ack=26 Win=266 Len=0 TSval=159628227 TSecr=2950671059"
"176","53.254201546","157.240.251.60","192.168.1.12","TLSv1.2","92","Application Data"
"177","53.254201598","157.240.251.60","192.168.1.12","TCP","68","443  >  58924 [FIN, ACK] Seq=25 Ack=26 Win=266 Len=0 TSval=159628227 TSecr=2950671059"
"178","53.254281096","192.168.1.12","157.240.251.60","TCP","56","58924  >  443 [RST] Seq=26 Win=0 Len=0"
"179","53.254312745","192.168.1.12","157.240.251.60","TCP","56","58924  >  443 [RST] Seq=26 Win=0 Len=0"
"180","57.036830139","157.240.221.60","192.168.1.12","TLSv1.2","254","Application Data"
"181","57.036875580","192.168.1.12","157.240.221.60","TCP","68","42240  >  443 [ACK] Seq=492 Ack=4310 Win=500 Len=0 TSval=1292354221 TSecr=1403621640"
"182","57.044751743","192.168.1.12","157.240.221.60","TLSv1.2","162","Application Data"
"183","57.115297213","157.240.221.60","192.168.1.12","TCP","68","443  >  42240 [ACK] Seq=4310 Ack=586 Win=437 Len=0 TSval=1403621754 TSecr=1292354229"
"185","68.487289466","2a00:a041:3c5d:4d00:c4e8:6181:3ac7:bd41","2a00:a040:3:4:face:b00c:3333:7020","TLSv1.2","112","Application Data"
"186","68.487336203","2a00:a041:3c5d:4d00:c4e8:6181:3ac7:bd41","2a00:a040:3:4:face:b00c:3333:7020","TCP","88","39736  >  443 [FIN, ACK] Seq=630 Ack=132035 Win=4011 Len=0 TSval=3235513301 TSecr=3285580524"
"187","68.505839698","2a00:a040:3:4:face:b00c:3333:7020","2a00:a041:3c5d:4d00:c4e8:6181:3ac7:bd41","TLSv1.2","112","Application Data"
"188","68.505888040","2a00:a041:3c5d:4d00:c4e8:6181:3ac7:bd41","2a00:a040:3:4:face:b00c:3333:7020","TCP","76","39736  >  443 [RST] Seq=631 Win=0 Len=0"
"189","68.505926928","2a00:a040:3:4:face:b00c:3333:7020","2a00:a041:3c5d:4d00:c4e8:6181:3ac7:bd41","TCP","88","443  >  39736 [FIN, ACK] Seq=132059 Ack=631 Win=123 Len=0 TSval=3285640540 TSecr=3235513301"
"190","68.505934391","2a00:a041:3c5d:4d00:c4e8:6181:3ac7:bd41","2a00:a040:3:4:face:b00c:3333:7020","TCP","76","39736  >  443 [RST] Seq=631 Win=0 Len=0"
"192","73.349142212","192.168.1.12","157.240.221.60","TLSv1.2","137","Application Data"
"193","73.476487093","157.240.221.60","192.168.1.12","TCP","68","443  >  42240 [ACK] Seq=4310 Ack=655 Win=437 Len=0 TSval=1403638115 TSecr=1292370533"
"196","73.592155384","157.240.221.60","192.168.1.12","TLSv1.2","139","Application Data"
"197","73.639383630","192.168.1.12","157.240.221.60","TCP","68","42240  >  443 [ACK] Seq=655 Ack=4381 Win=501 Len=0 TSval=1292370823 TSecr=1403638230"
"203","79.258241414","157.240.221.60","192.168.1.12","TLSv1.2","156","Application Data"
"204","79.258285220","192.168.1.12","157.240.221.60","TCP","68","42240  >  443 [ACK] Seq=655 Ack=4469 Win=501 Len=0 TSval=1292376442 TSecr=1403643805"
"205","79.293518967","192.168.1.12","157.240.221.60","TLSv1.2","140","Application Data"
"206","79.363831523","157.240.221.60","192.168.1.12","TCP","68","443  >  42240 [ACK] Seq=4469 Ack=727 Win=437 Len=0 TSval=1403644003 TSecr=1292376477"
"207","79.443320576","157.240.221.60","192.168.1.12","TLSv1.2","1412","Application Data"
"208","79.491244953","192.168.1.12","157.240.221.60","TCP","68","42240  >  443 [ACK] Seq=727 Ack=5813 Win=501 Len=0 TSval=1292376675 TSecr=1403644082"
"218","79.637117410","2a00:a041:3c5d:4d00:c4e8:6181:3ac7:bd41","2a00:a040:3:4:face:b00c:3333:7020","TCP","96","40850  >  443 [SYN] Seq=0 Win=64800 Len=0 MSS=1440 SACK_PERM=1 TSval=3235524451 TSecr=0 WS=128"
"219","79.653208541","2a00:a040:3:4:face:b00c:3333:7020","2a00:a041:3c5d:4d00:c4e8:6181:3ac7:bd41","TCP","96","443  >  40850 [SYN, ACK] Seq=0 Ack=1 Win=31740 Len=0 MSS=1392 SACK_PERM=1 TSval=2347296042 TSecr=3235524451 WS=256"
"220","79.653239745","2a00:a041:3c5d:4d00:c4e8:6181:3ac7:bd41","2a00:a040:3:4:face:b00c:3333:7020","TCP","88","40850  >  443 [ACK] Seq=1 Ack=1 Win=64896 Len=0 TSval=3235524467 TSecr=2347296042"
"221","79.653928042","2a00:a041:3c5d:4d00:c4e8:6181:3ac7:bd41","2a00:a040:3:4:face:b00c:3333:7020","TLSv1.3","794","Client Hello"
"222","79.667927138","2a00:a040:3:4:face:b00c:3333:7020","2a00:a041:3c5d:4d00:c4e8:6181:3ac7:bd41","TCP","88","443  >  40850 [ACK] Seq=1 Ack=707 Win=31232 Len=0 TSval=2347296055 TSecr=3235524468"
"223","79.668443807","2a00:a040:3:4:face:b00c:3333:7020","2a00:a041:3c5d:4d00:c4e8:6181:3ac7:bd41","TLSv1.3","253","Server Hello, Application Data"
"224","79.668460140","2a00:a041:3c5d:4d00:c4e8:6181:3ac7:bd41","2a00:a040:3:4:face:b00c:3333:7020","TCP","88","40850  >  443 [ACK] Seq=707 Ack=166 Win=64768 Len=0 TSval=3235524482 TSecr=2347296056"
"225","79.668783439","2a00:a041:3c5d:4d00:c4e8:6181:3ac7:bd41","2a00:a040:3:4:face:b00c:3333:7020","TLSv1.3","94","Change Cipher Spec"
"226","79.668879420","2a00:a041:3c5d:4d00:c4e8:6181:3ac7:bd41","2a00:a040:3:4:face:b00c:3333:7020","TLSv1.3","146","Application Data"
"227","79.670160786","2a00:a041:3c5d:4d00:c4e8:6181:3ac7:bd41","2a00:a040:3:4:face:b00c:3333:7020","TLSv1.3","686","Application Data"
"228","79.683924785","2a00:a040:3:4:face:b00c:3333:7020","2a00:a041:3c5d:4d00:c4e8:6181:3ac7:bd41","TCP","88","443  >  40850 [ACK] Seq=166 Ack=1369 Win=31488 Len=0 TSval=2347296073 TSecr=3235524483"
"229","79.684378149","2a00:a040:3:4:face:b00c:3333:7020","2a00:a041:3c5d:4d00:c4e8:6181:3ac7:bd41","TLSv1.3","269","Application Data"
"230","79.727256370","2a00:a041:3c5d:4d00:c4e8:6181:3ac7:bd41","2a00:a040:3:4:face:b00c:3333:7020","TCP","88","40850  >  443 [ACK] Seq=1369 Ack=347 Win=64640 Len=0 TSval=3235524541 TSecr=2347296073"
"231","79.779129022","192.168.1.12","157.240.221.60","TLSv1.2","164","Application Data"
"234","79.849291857","157.240.221.60","192.168.1.12","TCP","68","443  >  42240 [ACK] Seq=5813 Ack=823 Win=437 Len=0 TSval=1403644488 TSecr=1292376963"
"235","79.919716484","2a00:a040:3:4:face:b00c:3333:7020","2a00:a041:3c5d:4d00:c4e8:6181:3ac7:bd41","TLSv1.3","680","Application Data"
"236","79.919762941","2a00:a041:3c5d:4d00:c4e8:6181:3ac7:bd41","2a00:a040:3:4:face:b00c:3333:7020","TCP","88","40850  >  443 [ACK] Seq=1369 Ack=939 Win=64128 Len=0 TSval=3235524734 TSecr=2347296309"
"237","79.920110747","2a00:a040:3:4:face:b00c:3333:7020","2a00:a041:3c5d:4d00:c4e8:6181:3ac7:bd41","TLSv1.3","111","Application Data"
"238","79.920132855","2a00:a041:3c5d:4d00:c4e8:6181:3ac7:bd41","2a00:a040:3:4:face:b00c:3333:7020","TCP","88","40850  >  443 [ACK] Seq=1369 Ack=962 Win=64128 Len=0 TSval=3235524734 TSecr=2347296309"
"239","79.921191931","2a00:a040:3:4:face:b00c:3333:7020","2a00:a041:3c5d:4d00:c4e8:6181:3ac7:bd41","TLSv1.3","2848","Application Data"
"240","79.921228784","2a00:a041:3c5d:4d00:c4e8:6181:3ac7:bd41","2a00:a040:3:4:face:b00c:3333:7020","TCP","88","40850  >  443 [ACK] Seq=1369 Ack=3722 Win=61440 Len=0 TSval=3235524735 TSecr=2347296309"
"241","79.923505548","2a00:a040:3:4:face:b00c:3333:7020","2a00:a041:3c5d:4d00:c4e8:6181:3ac7:bd41","TLSv1.3","2848","Application Data, Application Data"
"242","79.923505908","2a00:a040:3:4:face:b00c:3333:7020","2a00:a041:3c5d:4d00:c4e8:6181:3ac7:bd41","TLSv1.3","1468","Application Data [TCP segment of a reassembled PDU]"
"243","79.923530865","2a00:a041:3c5d:4d00:c4e8:6181:3ac7:bd41","2a00:a040:3:4:face:b00c:3333:7020","TCP","88","40850  >  443 [ACK] Seq=1369 Ack=6482 Win=61056 Len=0 TSval=3235524737 TSecr=2347296309"
"244","79.923548202","2a00:a041:3c5d:4d00:c4e8:6181:3ac7:bd41","2a00:a040:3:4:face:b00c:3333:7020","TCP","88","40850  >  443 [ACK] Seq=1369 Ack=7862 Win=59776 Len=0 TSval=3235524737 TSecr=2347296309"
"245","79.926912339","2a00:a040:3:4:face:b00c:3333:7020","2a00:a041:3c5d:4d00:c4e8:6181:3ac7:bd41","TLSv1.3","1468","Application Data [TCP segment of a reassembled PDU]"
"246","79.926912609","2a00:a040:3:4:face:b00c:3333:7020","2a00:a041:3c5d:4d00:c4e8:6181:3ac7:bd41","TLSv1.3","2848","Application Data [TCP segment of a reassembled PDU]"
"247","79.926912654","2a00:a040:3:4:face:b00c:3333:7020","2a00:a041:3c5d:4d00:c4e8:6181:3ac7:bd41","TLSv1.3","2848","Application Data [TCP segment of a reassembled PDU]"
"248","79.926933114","2a00:a041:3c5d:4d00:c4e8:6181:3ac7:bd41","2a00:a040:3:4:face:b00c:3333:7020","TCP","88","40850  >  443 [ACK] Seq=1369 Ack=9242 Win=63104 Len=0 TSval=3235524741 TSecr=2347296309"
"249","79.926949569","2a00:a041:3c5d:4d00:c4e8:6181:3ac7:bd41","2a00:a040:3:4:face:b00c:3333:7020","TCP","88","40850  >  443 [ACK] Seq=1369 Ack=12002 Win=60416 Len=0 TSval=3235524741 TSecr=2347296310"
"250","79.926954712","2a00:a041:3c5d:4d00:c4e8:6181:3ac7:bd41","2a00:a040:3:4:face:b00c:3333:7020","TCP","88","40850  >  443 [ACK] Seq=1369 Ack=14762 Win=57728 Len=0 TSval=3235524741 TSecr=2347296311"
"251","79.933480617","2a00:a040:3:4:face:b00c:3333:7020","2a00:a041:3c5d:4d00:c4e8:6181:3ac7:bd41","TCP","1468","443  >  40850 [ACK] Seq=14762 Ack=1369 Win=31488 Len=1380 TSval=2347296322 TSecr=3235524734 [TCP segment of a reassembled PDU]"
"252","79.933518539","2a00:a041:3c5d:4d00:c4e8:6181:3ac7:bd41","2a00:a040:3:4:face:b00c:3333:7020","TCP","88","40850  >  443 [ACK] Seq=1369 Ack=16142 Win=63104 Len=0 TSval=3235524747 TSecr=2347296322"
"253","79.934088726","2a00:a040:3:4:face:b00c:3333:7020","2a00:a041:3c5d:4d00:c4e8:6181:3ac7:bd41","TLSv1.3","1468","Application Data [TCP segment of a reassembled PDU]"
"254","79.934100017","2a00:a041:3c5d:4d00:c4e8:6181:3ac7:bd41","2a00:a040:3:4:face:b00c:3333:7020","TCP","88","40850  >  443 [ACK] Seq=1369 Ack=17522 Win=63104 Len=0 TSval=3235524748 TSecr=2347296322"
"255","79.940077360","2a00:a040:3:4:face:b00c:3333:7020","2a00:a041:3c5d:4d00:c4e8:6181:3ac7:bd41","TCP","1468","443  >  40850 [ACK] Seq=17522 Ack=1369 Win=31488 Len=1380 TSval=2347296328 TSecr=3235524734 [TCP segment of a reassembled PDU]"
"256","79.940117946","2a00:a041:3c5d:4d00:c4e8:6181:3ac7:bd41","2a00:a040:3:4:face:b00c:3333:7020","TCP","88","40850  >  443 [ACK] Seq=1369 Ack=18902 Win=63104 Len=0 TSval=3235524754 TSecr=2347296328"
"257","79.940947244","2a00:a040:3:4:face:b00c:3333:7020","2a00:a041:3c5d:4d00:c4e8:6181:3ac7:bd41","TLSv1.3","1468","Application Data [TCP segment of a reassembled PDU]"
"258","79.940947493","2a00:a040:3:4:face:b00c:3333:7020","2a00:a041:3c5d:4d00:c4e8:6181:3ac7:bd41","TLSv1.3","1468","Application Data [TCP segment of a reassembled PDU]"
"259","79.940966619","2a00:a041:3c5d:4d00:c4e8:6181:3ac7:bd41","2a00:a040:3:4:face:b00c:3333:7020","TCP","88","40850  >  443 [ACK] Seq=1369 Ack=20282 Win=63104 Len=0 TSval=3235524755 TSecr=2347296328"
"260","79.940981140","2a00:a041:3c5d:4d00:c4e8:6181:3ac7:bd41","2a00:a040:3:4:face:b00c:3333:7020","TCP","88","40850  >  443 [ACK] Seq=1369 Ack=21662 Win=61824 Len=0 TSval=3235524755 TSecr=2347296329"
"261","79.942167981","2a00:a040:3:4:face:b00c:3333:7020","2a00:a041:3c5d:4d00:c4e8:6181:3ac7:bd41","TLSv1.3","1468","Application Data [TCP segment of a reassembled PDU]"
"262","79.942168628","2a00:a040:3:4:face:b00c:3333:7020","2a00:a041:3c5d:4d00:c4e8:6181:3ac7:bd41","TLSv1.3","2848","Application Data, Application Data"
"263","79.942190232","2a00:a041:3c5d:4d00:c4e8:6181:3ac7:bd41","2a00:a040:3:4:face:b00c:3333:7020","TCP","88","40850  >  443 [ACK] Seq=1369 Ack=23042 Win=63104 Len=0 TSval=3235524756 TSecr=2347296329"
"264","79.942211167","2a00:a041:3c5d:4d00:c4e8:6181:3ac7:bd41","2a00:a040:3:4:face:b00c:3333:7020","TCP","88","40850  >  443 [ACK] Seq=1369 Ack=25802 Win=60416 Len=0 TSval=3235524756 TSecr=2347296330"
"265","79.943104821","2a00:a040:3:4:face:b00c:3333:7020","2a00:a041:3c5d:4d00:c4e8:6181:3ac7:bd41","TLSv1.3","2848","Application Data [TCP segment of a reassembled PDU]"
"266","79.943117641","2a00:a041:3c5d:4d00:c4e8:6181:3ac7:bd41","2a00:a040:3:4:face:b00c:3333:7020","TCP","88","40850  >  443 [ACK] Seq=1369 Ack=28562 Win=61056 Len=0 TSval=3235524757 TSecr=2347296331"
"267","79.944216333","2a00:a040:3:4:face:b00c:3333:7020","2a00:a041:3c5d:4d00:c4e8:6181:3ac7:bd41","TLSv1.3","2848","Application Data [TCP segment of a reassembled PDU]"
"268","79.944234850","2a00:a041:3c5d:4d00:c4e8:6181:3ac7:bd41","2a00:a040:3:4:face:b00c:3333:7020","TCP","88","40850  >  443 [ACK] Seq=1369 Ack=31322 Win=61056 Len=0 TSval=3235524758 TSecr=2347296332"
"269","79.945186545","2a00:a040:3:4:face:b00c:3333:7020","2a00:a041:3c5d:4d00:c4e8:6181:3ac7:bd41","TLSv1.3","2848","Application Data [TCP segment of a reassembled PDU]"
"270","79.945201477","2a00:a041:3c5d:4d00:c4e8:6181:3ac7:bd41","2a00:a040:3:4:face:b00c:3333:7020","TCP","88","40850  >  443 [ACK] Seq=1369 Ack=34082 Win=61056 Len=0 TSval=3235524759 TSecr=2347296333"
"271","79.946240106","2a00:a040:3:4:face:b00c:3333:7020","2a00:a041:3c5d:4d00:c4e8:6181:3ac7:bd41","TLSv1.3","2848","Application Data, Application Data"
"272","79.946251916","2a00:a041:3c5d:4d00:c4e8:6181:3ac7:bd41","2a00:a040:3:4:face:b00c:3333:7020","TCP","88","40850  >  443 [ACK] Seq=1369 Ack=36842 Win=61056 Len=0 TSval=3235524760 TSecr=2347296334"
"273","79.947336725","2a00:a040:3:4:face:b00c:3333:7020","2a00:a041:3c5d:4d00:c4e8:6181:3ac7:bd41","TLSv1.3","2848","Application Data [TCP segment of a reassembled PDU]"
"274","79.947353706","2a00:a041:3c5d:4d00:c4e8:6181:3ac7:bd41","2a00:a040:3:4:face:b00c:3333:7020","TCP","88","40850  >  443 [ACK] Seq=1369 Ack=39602 Win=61056 Len=0 TSval=3235524761 TSecr=2347296335"
"275","79.949288419","2a00:a040:3:4:face:b00c:3333:7020","2a00:a041:3c5d:4d00:c4e8:6181:3ac7:bd41","TLSv1.3","2848","Application Data, Application Data"
"276","79.949288825","2a00:a040:3:4:face:b00c:3333:7020","2a00:a041:3c5d:4d00:c4e8:6181:3ac7:bd41","TCP","2848","443  >  40850 [PSH, ACK] Seq=42362 Ack=1369 Win=31488 Len=2760 TSval=2347296336 TSecr=3235524741 [TCP segment of a reassembled PDU]"
"277","79.949316709","2a00:a041:3c5d:4d00:c4e8:6181:3ac7:bd41","2a00:a040:3:4:face:b00c:3333:7020","TCP","88","40850  >  443 [ACK] Seq=1369 Ack=42362 Win=61056 Len=0 TSval=3235524763 TSecr=2347296336"
"278","79.949439088","2a00:a041:3c5d:4d00:c4e8:6181:3ac7:bd41","2a00:a040:3:4:face:b00c:3333:7020","TCP","88","40850  >  443 [ACK] Seq=1369 Ack=45122 Win=58368 Len=0 TSval=3235524763 TSecr=2347296336"
"279","79.950062323","2a00:a040:3:4:face:b00c:3333:7020","2a00:a041:3c5d:4d00:c4e8:6181:3ac7:bd41","TLSv1.3","1468","Application Data [TCP segment of a reassembled PDU]"
"280","79.951221858","2a00:a040:3:4:face:b00c:3333:7020","2a00:a041:3c5d:4d00:c4e8:6181:3ac7:bd41","TLSv1.3","2848","Application Data [TCP segment of a reassembled PDU]"
"281","79.951252817","2a00:a041:3c5d:4d00:c4e8:6181:3ac7:bd41","2a00:a040:3:4:face:b00c:3333:7020","TCP","88","40850  >  443 [ACK] Seq=1369 Ack=49262 Win=61056 Len=0 TSval=3235524765 TSecr=2347296337"
"282","79.952700087","2a00:a040:3:4:face:b00c:3333:7020","2a00:a041:3c5d:4d00:c4e8:6181:3ac7:bd41","TLSv1.3","1468","Application Data [TCP segment of a reassembled PDU]"
"283","79.955239912","2a00:a040:3:4:face:b00c:3333:7020","2a00:a041:3c5d:4d00:c4e8:6181:3ac7:bd41","TCP","1468","443  >  40850 [PSH, ACK] Seq=50642 Ack=1369 Win=31488 Len=1380 TSval=2347296338 TSecr=3235524748 [TCP segment of a reassembled PDU]"
"284","79.955240161","2a00:a040:3:4:face:b00c:3333:7020","2a00:a041:3c5d:4d00:c4e8:6181:3ac7:bd41","TLSv1.3","1468","Application Data [TCP segment of a reassembled PDU]"
"285","79.955240249","2a00:a040:3:4:face:b00c:3333:7020","2a00:a041:3c5d:4d00:c4e8:6181:3ac7:bd41","TLSv1.3","2848","Application Data, Application Data"
"286","79.955240300","2a00:a040:3:4:face:b00c:3333:7020","2a00:a041:3c5d:4d00:c4e8:6181:3ac7:bd41","TLSv1.3","2848","Application Data, Application Data"
"287","79.955240344","2a00:a040:3:4:face:b00c:3333:7020","2a00:a041:3c5d:4d00:c4e8:6181:3ac7:bd41","TCP","1468","443  >  40850 [ACK] Seq=58922 Ack=1369 Win=31488 Len=1380 TSval=2347296342 TSecr=3235524755 [TCP segment of a reassembled PDU]"
"288","79.955266586","2a00:a041:3c5d:4d00:c4e8:6181:3ac7:bd41","2a00:a040:3:4:face:b00c:3333:7020","TCP","88","40850  >  443 [ACK] Seq=1369 Ack=52022 Win=63104 Len=0 TSval=3235524769 TSecr=2347296338"
"289","79.955358401","2a00:a041:3c5d:4d00:c4e8:6181:3ac7:bd41","2a00:a040:3:4:face:b00c:3333:7020","TCP","88","40850  >  443 [ACK] Seq=1369 Ack=60302 Win=54912 Len=0 TSval=3235524769 TSecr=2347296339"
"290","79.956082125","2a00:a040:3:4:face:b00c:3333:7020","2a00:a041:3c5d:4d00:c4e8:6181:3ac7:bd41","TCP","1468","443  >  40850 [PSH, ACK] Seq=60302 Ack=1369 Win=31488 Len=1380 TSval=2347296342 TSecr=3235524755 [TCP segment of a reassembled PDU]"
"291","79.958929613","2a00:a040:3:4:face:b00c:3333:7020","2a00:a041:3c5d:4d00:c4e8:6181:3ac7:bd41","TLSv1.3","1468","Application Data [TCP segment of a reassembled PDU]"
"292","79.958941166","2a00:a041:3c5d:4d00:c4e8:6181:3ac7:bd41","2a00:a040:3:4:face:b00c:3333:7020","TCP","88","40850  >  443 [ACK] Seq=1369 Ack=63062 Win=63104 Len=0 TSval=3235524773 TSecr=2347296342"
"293","79.959979603","2a00:a040:3:4:face:b00c:3333:7020","2a00:a041:3c5d:4d00:c4e8:6181:3ac7:bd41","TCP","1468","443  >  40850 [PSH, ACK] Seq=63062 Ack=1369 Win=31488 Len=1380 TSval=2347296348 TSecr=3235524757 [TCP segment of a reassembled PDU]"
"294","79.959979781","2a00:a040:3:4:face:b00c:3333:7020","2a00:a041:3c5d:4d00:c4e8:6181:3ac7:bd41","TLSv1.3","1468","Application Data [TCP segment of a reassembled PDU]"
"295","79.960106617","2a00:a041:3c5d:4d00:c4e8:6181:3ac7:bd41","2a00:a040:3:4:face:b00c:3333:7020","TCP","88","40850  >  443 [ACK] Seq=1369 Ack=65822 Win=61056 Len=0 TSval=3235524774 TSecr=2347296348"
"296","79.961399270","2a00:a040:3:4:face:b00c:3333:7020","2a00:a041:3c5d:4d00:c4e8:6181:3ac7:bd41","TLSv1.3","1468","Application Data [TCP segment of a reassembled PDU]"
"297","79.961399376","2a00:a040:3:4:face:b00c:3333:7020","2a00:a041:3c5d:4d00:c4e8:6181:3ac7:bd41","TLSv1.3","2848","Application Data [TCP segment of a reassembled PDU]"
"298","79.961399440","2a00:a040:3:4:face:b00c:3333:7020","2a00:a041:3c5d:4d00:c4e8:6181:3ac7:bd41","TLSv1.3","1468","Application Data [TCP segment of a reassembled PDU]"
"299","79.961522772","2a00:a041:3c5d:4d00:c4e8:6181:3ac7:bd41","2a00:a040:3:4:face:b00c:3333:7020","TCP","88","40850  >  443 [ACK] Seq=1369 Ack=71342 Win=56960 Len=0 TSval=3235524775 TSecr=2347296348"
"300","79.964598976","2a00:a040:3:4:face:b00c:3333:7020","2a00:a041:3c5d:4d00:c4e8:6181:3ac7:bd41","TLSv1.3","4228","Application Data, Application Data, Application Data"
"301","79.964621443","2a00:a041:3c5d:4d00:c4e8:6181:3ac7:bd41","2a00:a040:3:4:face:b00c:3333:7020","TCP","88","40850  >  443 [ACK] Seq=1369 Ack=75482 Win=59008 Len=0 TSval=3235524778 TSecr=2347296349"
"302","79.965229883","2a00:a040:3:4:face:b00c:3333:7020","2a00:a041:3c5d:4d00:c4e8:6181:3ac7:bd41","TLSv1.3","2848","Application Data [TCP segment of a reassembled PDU]"
"303","79.965245760","2a00:a041:3c5d:4d00:c4e8:6181:3ac7:bd41","2a00:a040:3:4:face:b00c:3333:7020","TCP","88","40850  >  443 [ACK] Seq=1369 Ack=78242 Win=61056 Len=0 TSval=3235524779 TSecr=2347296350"
"304","79.966074999","2a00:a040:3:4:face:b00c:3333:7020","2a00:a041:3c5d:4d00:c4e8:6181:3ac7:bd41","TLSv1.3","2848","Application Data [TCP segment of a reassembled PDU]"
"305","79.966098412","2a00:a041:3c5d:4d00:c4e8:6181:3ac7:bd41","2a00:a040:3:4:face:b00c:3333:7020","TCP","88","40850  >  443 [ACK] Seq=1369 Ack=81002 Win=61056 Len=0 TSval=3235524780 TSecr=2347296351"
"306","79.966612572","2a00:a040:3:4:face:b00c:3333:7020","2a00:a041:3c5d:4d00:c4e8:6181:3ac7:bd41","TCP","2848","443  >  40850 [PSH, ACK] Seq=81002 Ack=1369 Win=31488 Len=2760 TSval=2347296351 TSecr=3235524765 [TCP segment of a reassembled PDU]"
"307","79.966628759","2a00:a041:3c5d:4d00:c4e8:6181:3ac7:bd41","2a00:a040:3:4:face:b00c:3333:7020","TCP","88","40850  >  443 [ACK] Seq=1369 Ack=83762 Win=61056 Len=0 TSval=3235524780 TSecr=2347296351"
"308","79.967509488","2a00:a040:3:4:face:b00c:3333:7020","2a00:a041:3c5d:4d00:c4e8:6181:3ac7:bd41","TLSv1.3","2848","Application Data [TCP segment of a reassembled PDU]"
"309","79.967526272","2a00:a041:3c5d:4d00:c4e8:6181:3ac7:bd41","2a00:a040:3:4:face:b00c:3333:7020","TCP","88","40850  >  443 [ACK] Seq=1369 Ack=86522 Win=61056 Len=0 TSval=3235524781 TSecr=2347296351"
"310","79.968578573","2a00:a040:3:4:face:b00c:3333:7020","2a00:a041:3c5d:4d00:c4e8:6181:3ac7:bd41","TLSv1.3","2848","Application Data, Application Data"
"311","79.968600719","2a00:a041:3c5d:4d00:c4e8:6181:3ac7:bd41","2a00:a040:3:4:face:b00c:3333:7020","TCP","88","40850  >  443 [ACK] Seq=1369 Ack=89282 Win=61056 Len=0 TSval=3235524782 TSecr=2347296351"
"312","79.970146144","2a00:a040:3:4:face:b00c:3333:7020","2a00:a041:3c5d:4d00:c4e8:6181:3ac7:bd41","TLSv1.3","5608","Application Data, Application Data, Application Data"
"313","79.970146375","2a00:a040:3:4:face:b00c:3333:7020","2a00:a041:3c5d:4d00:c4e8:6181:3ac7:bd41","TLSv1.3","3419","Application Data, Application Data"
"314","79.970248047","2a00:a041:3c5d:4d00:c4e8:6181:3ac7:bd41","2a00:a040:3:4:face:b00c:3333:7020","TCP","88","40850  >  443 [ACK] Seq=1369 Ack=98133 Win=52224 Len=0 TSval=3235524784 TSecr=2347296352"
"316","79.990377848","2a00:a040:3:4:face:b00c:3333:7020","2a00:a041:3c5d:4d00:c4e8:6181:3ac7:bd41","TCP","88","[TCP Dup ACK 228#1] 443  >  40850 [ACK] Seq=98133 Ack=1369 Win=31488 Len=0 TSval=2347296379 TSecr=3235524784"
"318","81.717295587","157.240.221.60","192.168.1.12","TCP","1448","443  >  42240 [ACK] Seq=5813 Ack=823 Win=437 Len=1380 TSval=1403646331 TSecr=1292376963 [TCP segment of a reassembled PDU]"
"319","81.717340216","192.168.1.12","157.240.221.60","TCP","68","42240  >  443 [ACK] Seq=823 Ack=7193 Win=493 Len=0 TSval=1292378901 TSecr=1403646331"
"320","81.717382919","157.240.221.60","192.168.1.12","TLSv1.2","244","Application Data, Application Data"
"321","81.717393607","192.168.1.12","157.240.221.60","TCP","68","42240  >  443 [ACK] Seq=823 Ack=7369 Win=492 Len=0 TSval=1292378901 TSecr=1403646331"
"322","82.022751378","157.240.221.60","192.168.1.12","TLSv1.2","209","Application Data"
"323","82.022788989","192.168.1.12","157.240.221.60","TCP","68","42240  >  443 [ACK] Seq=823 Ack=7510 Win=493 Len=0 TSval=1292379207 TSecr=1403646628"
"324","82.040060516","2a00:a041:3c5d:4d00:c4e8:6181:3ac7:bd41","2a00:a040:3:4:face:b00c:3333:7020","TLSv1.3","678","Application Data"
"325","82.058370766","157.240.221.60","192.168.1.12","TLSv1.2","161","Application Data"
"326","82.058410980","192.168.1.12","157.240.221.60","TCP","68","42240  >  443 [ACK] Seq=823 Ack=7603 Win=501 Len=0 TSval=1292379242 TSecr=1403646697"
"327","82.096222352","2a00:a040:3:4:face:b00c:3333:7020","2a00:a041:3c5d:4d00:c4e8:6181:3ac7:bd41","TCP","88","443  >  40850 [ACK] Seq=98133 Ack=1959 Win=31488 Len=0 TSval=2347298484 TSecr=3235526854"
"328","82.119394451","2a00:a040:3:4:face:b00c:3333:7020","2a00:a041:3c5d:4d00:c4e8:6181:3ac7:bd41","TLSv1.3","418","Application Data"
"329","82.119418576","2a00:a041:3c5d:4d00:c4e8:6181:3ac7:bd41","2a00:a040:3:4:face:b00c:3333:7020","TCP","88","40850  >  443 [ACK] Seq=1959 Ack=98463 Win=63872 Len=0 TSval=3235526933 TSecr=2347298507"
"330","82.124471448","2a00:a040:3:4:face:b00c:3333:7020","2a00:a041:3c5d:4d00:c4e8:6181:3ac7:bd41","TLSv1.3","111","Application Data"
"331","82.124500651","2a00:a041:3c5d:4d00:c4e8:6181:3ac7:bd41","2a00:a040:3:4:face:b00c:3333:7020","TCP","88","40850  >  443 [ACK] Seq=1959 Ack=98486 Win=64128 Len=0 TSval=3235526938 TSecr=2347298508"
"332","82.126414637","2a00:a040:3:4:face:b00c:3333:7020","2a00:a041:3c5d:4d00:c4e8:6181:3ac7:bd41","TLSv1.3","6988","Application Data"
"333","82.126414908","2a00:a040:3:4:face:b00c:3333:7020","2a00:a041:3c5d:4d00:c4e8:6181:3ac7:bd41","TCP","4228","443  >  40850 [ACK] Seq=105386 Ack=1959 Win=31488 Len=4140 TSval=2347298509 TSecr=3235526854 [TCP segment of a reassembled PDU]"
"334","82.126443001","2a00:a041:3c5d:4d00:c4e8:6181:3ac7:bd41","2a00:a040:3:4:face:b00c:3333:7020","TCP","88","40850  >  443 [ACK] Seq=1959 Ack=105386 Win=77952 Len=0 TSval=3235526940 TSecr=2347298508"
"335","82.126461189","2a00:a041:3c5d:4d00:c4e8:6181:3ac7:bd41","2a00:a040:3:4:face:b00c:3333:7020","TCP","88","40850  >  443 [ACK] Seq=1959 Ack=109526 Win=86272 Len=0 TSval=3235526940 TSecr=2347298509"
"336","82.130244426","2a00:a040:3:4:face:b00c:3333:7020","2a00:a041:3c5d:4d00:c4e8:6181:3ac7:bd41","TCP","2848","443  >  40850 [PSH, ACK] Seq=109526 Ack=1959 Win=31488 Len=2760 TSval=2347298509 TSecr=3235526854 [TCP segment of a reassembled PDU]"
"337","82.130244590","2a00:a040:3:4:face:b00c:3333:7020","2a00:a041:3c5d:4d00:c4e8:6181:3ac7:bd41","TCP","1468","443  >  40850 [ACK] Seq=112286 Ack=1959 Win=31488 Len=1380 TSval=2347298510 TSecr=3235526854 [TCP segment of a reassembled PDU]"
"338","82.130261786","2a00:a041:3c5d:4d00:c4e8:6181:3ac7:bd41","2a00:a040:3:4:face:b00c:3333:7020","TCP","88","40850  >  443 [ACK] Seq=1959 Ack=112286 Win=91776 Len=0 TSval=3235526944 TSecr=2347298509"
"339","82.130275243","2a00:a041:3c5d:4d00:c4e8:6181:3ac7:bd41","2a00:a040:3:4:face:b00c:3333:7020","TCP","88","40850  >  443 [ACK] Seq=1959 Ack=113666 Win=94592 Len=0 TSval=3235526944 TSecr=2347298510"
"340","82.135024932","2a00:a040:3:4:face:b00c:3333:7020","2a00:a041:3c5d:4d00:c4e8:6181:3ac7:bd41","TLSv1.3","2848","Application Data, Application Data"
"341","82.135025102","2a00:a040:3:4:face:b00c:3333:7020","2a00:a041:3c5d:4d00:c4e8:6181:3ac7:bd41","TCP","5608","443  >  40850 [ACK] Seq=116426 Ack=1959 Win=31488 Len=5520 TSval=2347298510 TSecr=3235526854 [TCP segment of a reassembled PDU]"
"342","82.135046481","2a00:a041:3c5d:4d00:c4e8:6181:3ac7:bd41","2a00:a040:3:4:face:b00c:3333:7020","TCP","88","40850  >  443 [ACK] Seq=1959 Ack=116426 Win=100096 Len=0 TSval=3235526949 TSecr=2347298510"
"343","82.135063190","2a00:a041:3c5d:4d00:c4e8:6181:3ac7:bd41","2a00:a040:3:4:face:b00c:3333:7020","TCP","88","40850  >  443 [ACK] Seq=1959 Ack=121946 Win=111104 Len=0 TSval=3235526949 TSecr=2347298510"
"344","82.136626507","2a00:a040:3:4:face:b00c:3333:7020","2a00:a041:3c5d:4d00:c4e8:6181:3ac7:bd41","TCP","1468","443  >  40850 [PSH, ACK] Seq=121946 Ack=1959 Win=31488 Len=1380 TSval=2347298510 TSecr=3235526854 [TCP segment of a reassembled PDU]"
"345","82.136626669","2a00:a040:3:4:face:b00c:3333:7020","2a00:a041:3c5d:4d00:c4e8:6181:3ac7:bd41","TCP","6988","443  >  40850 [PSH, ACK] Seq=123326 Ack=1959 Win=31488 Len=6900 TSval=2347298511 TSecr=3235526854 [TCP segment of a reassembled PDU]"
"346","82.136644900","2a00:a041:3c5d:4d00:c4e8:6181:3ac7:bd41","2a00:a040:3:4:face:b00c:3333:7020","TCP","88","40850  >  443 [ACK] Seq=1959 Ack=123326 Win=113792 Len=0 TSval=3235526950 TSecr=2347298510"
"347","82.136658774","2a00:a041:3c5d:4d00:c4e8:6181:3ac7:bd41","2a00:a040:3:4:face:b00c:3333:7020","TCP","88","40850  >  443 [ACK] Seq=1959 Ack=130226 Win=127616 Len=0 TSval=3235526950 TSecr=2347298511"
"348","82.138142005","2a00:a040:3:4:face:b00c:3333:7020","2a00:a041:3c5d:4d00:c4e8:6181:3ac7:bd41","TLSv1.3","2848","Application Data, Application Data"
"349","82.138167047","2a00:a041:3c5d:4d00:c4e8:6181:3ac7:bd41","2a00:a040:3:4:face:b00c:3333:7020","TCP","88","40850  >  443 [ACK] Seq=1959 Ack=132986 Win=133120 Len=0 TSval=3235526952 TSecr=2347298512"
"350","82.138888512","2a00:a040:3:4:face:b00c:3333:7020","2a00:a041:3c5d:4d00:c4e8:6181:3ac7:bd41","TCP","1468","443  >  40850 [ACK] Seq=132986 Ack=1959 Win=31488 Len=1380 TSval=2347298512 TSecr=3235526854 [TCP segment of a reassembled PDU]"
"351","82.138905741","2a00:a041:3c5d:4d00:c4e8:6181:3ac7:bd41","2a00:a040:3:4:face:b00c:3333:7020","TCP","88","40850  >  443 [ACK] Seq=1959 Ack=134366 Win=135936 Len=0 TSval=3235526953 TSecr=2347298512"
"352","82.139661585","2a00:a040:3:4:face:b00c:3333:7020","2a00:a041:3c5d:4d00:c4e8:6181:3ac7:bd41","TCP","1468","443  >  40850 [ACK] Seq=134366 Ack=1959 Win=31488 Len=1380 TSval=2347298512 TSecr=3235526854 [TCP segment of a reassembled PDU]"
"353","82.139677597","2a00:a041:3c5d:4d00:c4e8:6181:3ac7:bd41","2a00:a040:3:4:face:b00c:3333:7020","TCP","88","40850  >  443 [ACK] Seq=1959 Ack=135746 Win=138752 Len=0 TSval=3235526953 TSecr=2347298512"
"354","82.140998401","2a00:a040:3:4:face:b00c:3333:7020","2a00:a041:3c5d:4d00:c4e8:6181:3ac7:bd41","TCP","1468","443  >  40850 [PSH, ACK] Seq=135746 Ack=1959 Win=31488 Len=1380 TSval=2347298512 TSecr=3235526854 [TCP segment of a reassembled PDU]"
"355","82.141014416","2a00:a041:3c5d:4d00:c4e8:6181:3ac7:bd41","2a00:a040:3:4:face:b00c:3333:7020","TCP","88","40850  >  443 [ACK] Seq=1959 Ack=137126 Win=141440 Len=0 TSval=3235526955 TSecr=2347298512"
"356","82.142013273","2a00:a040:3:4:face:b00c:3333:7020","2a00:a041:3c5d:4d00:c4e8:6181:3ac7:bd41","TCP","1468","443  >  40850 [ACK] Seq=137126 Ack=1959 Win=31488 Len=1380 TSval=2347298513 TSecr=3235526854 [TCP segment of a reassembled PDU]"
"357","82.142018044","2a00:a041:3c5d:4d00:c4e8:6181:3ac7:bd41","2a00:a040:3:4:face:b00c:3333:7020","TCP","88","40850  >  443 [ACK] Seq=1959 Ack=138506 Win=144256 Len=0 TSval=3235526956 TSecr=2347298513"
"358","82.143973095","2a00:a040:3:4:face:b00c:3333:7020","2a00:a041:3c5d:4d00:c4e8:6181:3ac7:bd41","TCP","2848","443  >  40850 [ACK] Seq=138506 Ack=1959 Win=31488 Len=2760 TSval=2347298513 TSecr=3235526854 [TCP segment of a reassembled PDU]"
"359","82.143989967","2a00:a041:3c5d:4d00:c4e8:6181:3ac7:bd41","2a00:a040:3:4:face:b00c:3333:7020","TCP","88","40850  >  443 [ACK] Seq=1959 Ack=141266 Win=149760 Len=0 TSval=3235526958 TSecr=2347298513"
"360","82.145218245","2a00:a040:3:4:face:b00c:3333:7020","2a00:a041:3c5d:4d00:c4e8:6181:3ac7:bd41","TCP","2848","443  >  40850 [PSH, ACK] Seq=141266 Ack=1959 Win=31488 Len=2760 TSval=2347298513 TSecr=3235526854 [TCP segment of a reassembled PDU]"
"361","82.145218401","2a00:a040:3:4:face:b00c:3333:7020","2a00:a041:3c5d:4d00:c4e8:6181:3ac7:bd41","TCP","1468","443  >  40850 [ACK] Seq=144026 Ack=1959 Win=31488 Len=1380 TSval=2347298514 TSecr=3235526854 [TCP segment of a reassembled PDU]"
"362","82.145235621","2a00:a041:3c5d:4d00:c4e8:6181:3ac7:bd41","2a00:a040:3:4:face:b00c:3333:7020","TCP","88","40850  >  443 [ACK] Seq=1959 Ack=144026 Win=155264 Len=0 TSval=3235526959 TSecr=2347298513"
"363","82.145249208","2a00:a041:3c5d:4d00:c4e8:6181:3ac7:bd41","2a00:a040:3:4:face:b00c:3333:7020","TCP","88","40850  >  443 [ACK] Seq=1959 Ack=145406 Win=157952 Len=0 TSval=3235526959 TSecr=2347298514"
"364","82.148392944","2a00:a040:3:4:face:b00c:3333:7020","2a00:a041:3c5d:4d00:c4e8:6181:3ac7:bd41","TCP","1468","443  >  40850 [ACK] Seq=145406 Ack=1959 Win=31488 Len=1380 TSval=2347298514 TSecr=3235526854 [TCP segment of a reassembled PDU]"
"365","82.148418365","2a00:a041:3c5d:4d00:c4e8:6181:3ac7:bd41","2a00:a040:3:4:face:b00c:3333:7020","TCP","88","40850  >  443 [ACK] Seq=1959 Ack=146786 Win=160768 Len=0 TSval=3235526962 TSecr=2347298514"
"366","82.149837921","2a00:a040:3:4:face:b00c:3333:7020","2a00:a041:3c5d:4d00:c4e8:6181:3ac7:bd41","TLSv1.3","1468","Application Data [TCP segment of a reassembled PDU]"
"367","82.149862296","2a00:a041:3c5d:4d00:c4e8:6181:3ac7:bd41","2a00:a040:3:4:face:b00c:3333:7020","TCP","88","40850  >  443 [ACK] Seq=1959 Ack=148166 Win=163584 Len=0 TSval=3235526964 TSecr=2347298514"
"368","82.152366080","2a00:a040:3:4:face:b00c:3333:7020","2a00:a041:3c5d:4d00:c4e8:6181:3ac7:bd41","TLSv1.3","2848","Application Data [TCP segment of a reassembled PDU]"
"369","82.152366250","2a00:a040:3:4:face:b00c:3333:7020","2a00:a041:3c5d:4d00:c4e8:6181:3ac7:bd41","TCP","2848","443  >  40850 [ACK] Seq=150926 Ack=1959 Win=31488 Len=2760 TSval=2347298514 TSecr=3235526854 [TCP segment of a reassembled PDU]"
"370","82.152382995","2a00:a041:3c5d:4d00:c4e8:6181:3ac7:bd41","2a00:a040:3:4:face:b00c:3333:7020","TCP","88","40850  >  443 [ACK] Seq=1959 Ack=150926 Win=169088 Len=0 TSval=3235526966 TSecr=2347298514"
"371","82.152396381","2a00:a041:3c5d:4d00:c4e8:6181:3ac7:bd41","2a00:a040:3:4:face:b00c:3333:7020","TCP","88","40850  >  443 [ACK] Seq=1959 Ack=153686 Win=174592 Len=0 TSval=3235526966 TSecr=2347298514"
"372","82.154453864","2a00:a040:3:4:face:b00c:3333:7020","2a00:a041:3c5d:4d00:c4e8:6181:3ac7:bd41","TCP","4228","443  >  40850 [PSH, ACK] Seq=153686 Ack=1959 Win=31488 Len=4140 TSval=2347298514 TSecr=3235526854 [TCP segment of a reassembled PDU]"
"373","82.154454021","2a00:a040:3:4:face:b00c:3333:7020","2a00:a041:3c5d:4d00:c4e8:6181:3ac7:bd41","TCP","4523","443  >  40850 [PSH, ACK] Seq=157826 Ack=1959 Win=31488 Len=4435 TSval=2347298515 TSecr=3235526854 [TCP segment of a reassembled PDU]"
"374","82.154454065","2a00:a040:3:4:face:b00c:3333:7020","2a00:a041:3c5d:4d00:c4e8:6181:3ac7:bd41","TCP","1468","443  >  40850 [ACK] Seq=162261 Ack=1959 Win=31488 Len=1380 TSval=2347298536 TSecr=3235526940 [TCP segment of a reassembled PDU]"
"375","82.154472405","2a00:a041:3c5d:4d00:c4e8:6181:3ac7:bd41","2a00:a040:3:4:face:b00c:3333:7020","TCP","88","40850  >  443 [ACK] Seq=1959 Ack=157826 Win=182912 Len=0 TSval=3235526968 TSecr=2347298514"
"376","82.154494560","2a00:a041:3c5d:4d00:c4e8:6181:3ac7:bd41","2a00:a040:3:4:face:b00c:3333:7020","TCP","88","40850  >  443 [ACK] Seq=1959 Ack=162261 Win=191744 Len=0 TSval=3235526968 TSecr=2347298515"
"377","82.154499532","2a00:a041:3c5d:4d00:c4e8:6181:3ac7:bd41","2a00:a040:3:4:face:b00c:3333:7020","TCP","88","40850  >  443 [ACK] Seq=1959 Ack=163641 Win=194432 Len=0 TSval=3235526968 TSecr=2347298536"
"378","82.156060755","2a00:a040:3:4:face:b00c:3333:7020","2a00:a041:3c5d:4d00:c4e8:6181:3ac7:bd41","TLSv1.3","1468","Application Data [TCP segment of a reassembled PDU]"
"379","82.156077023","2a00:a041:3c5d:4d00:c4e8:6181:3ac7:bd41","2a00:a040:3:4:face:b00c:3333:7020","TCP","88","40850  >  443 [ACK] Seq=1959 Ack=165021 Win=197248 Len=0 TSval=3235526970 TSecr=2347298536"
"380","82.156929185","2a00:a040:3:4:face:b00c:3333:7020","2a00:a041:3c5d:4d00:c4e8:6181:3ac7:bd41","TLSv1.3","3933","Application Data [TCP segment of a reassembled PDU]"
"381","82.156929342","2a00:a040:3:4:face:b00c:3333:7020","2a00:a041:3c5d:4d00:c4e8:6181:3ac7:bd41","TCP","1468","443  >  40850 [ACK] Seq=168866 Ack=1959 Win=31488 Len=1380 TSval=2347298536 TSecr=3235526940 [TCP segment of a reassembled PDU]"
"382","82.156946603","2a00:a041:3c5d:4d00:c4e8:6181:3ac7:bd41","2a00:a040:3:4:face:b00c:3333:7020","TCP","88","40850  >  443 [ACK] Seq=1959 Ack=168866 Win=204928 Len=0 TSval=3235526971 TSecr=2347298536"
"383","82.156960068","2a00:a041:3c5d:4d00:c4e8:6181:3ac7:bd41","2a00:a040:3:4:face:b00c:3333:7020","TCP","88","40850  >  443 [ACK] Seq=1959 Ack=170246 Win=207744 Len=0 TSval=3235526971 TSecr=2347298536"
"384","82.158321735","2a00:a040:3:4:face:b00c:3333:7020","2a00:a041:3c5d:4d00:c4e8:6181:3ac7:bd41","TCP","1468","443  >  40850 [ACK] Seq=170246 Ack=1959 Win=31488 Len=1380 TSval=2347298536 TSecr=3235526940 [TCP segment of a reassembled PDU]"
"385","82.158338916","2a00:a041:3c5d:4d00:c4e8:6181:3ac7:bd41","2a00:a040:3:4:face:b00c:3333:7020","TCP","88","40850  >  443 [ACK] Seq=1959 Ack=171626 Win=210432 Len=0 TSval=3235526972 TSecr=2347298536"
"386","82.159109950","2a00:a040:3:4:face:b00c:3333:7020","2a00:a041:3c5d:4d00:c4e8:6181:3ac7:bd41","TCP","4228","443  >  40850 [PSH, ACK] Seq=171626 Ack=1959 Win=31488 Len=4140 TSval=2347298536 TSecr=3235526940 [TCP segment of a reassembled PDU]"
"387","82.159121471","2a00:a041:3c5d:4d00:c4e8:6181:3ac7:bd41","2a00:a040:3:4:face:b00c:3333:7020","TCP","88","40850  >  443 [ACK] Seq=1959 Ack=175766 Win=218752 Len=0 TSval=3235526973 TSecr=2347298536"
"388","82.164073826","2a00:a040:3:4:face:b00c:3333:7020","2a00:a041:3c5d:4d00:c4e8:6181:3ac7:bd41","TLSv1.3","6988","Application Data, Application Data"
"389","82.164094361","2a00:a041:3c5d:4d00:c4e8:6181:3ac7:bd41","2a00:a040:3:4:face:b00c:3333:7020","TCP","88","40850  >  443 [ACK] Seq=1959 Ack=182666 Win=232576 Len=0 TSval=3235526978 TSecr=2347298537"
"390","82.166638432","2a00:a040:3:4:face:b00c:3333:7020","2a00:a041:3c5d:4d00:c4e8:6181:3ac7:bd41","TLSv1.3","6988","Application Data, Application Data"
"391","82.166638757","2a00:a040:3:4:face:b00c:3333:7020","2a00:a041:3c5d:4d00:c4e8:6181:3ac7:bd41","TLSv1.3","4228","Application Data [TCP segment of a reassembled PDU]"
"392","82.166663474","2a00:a041:3c5d:4d00:c4e8:6181:3ac7:bd41","2a00:a040:3:4:face:b00c:3333:7020","TCP","88","40850  >  443 [ACK] Seq=1959 Ack=189566 Win=246272 Len=0 TSval=3235526980 TSecr=2347298538"
"393","82.166679452","2a00:a041:3c5d:4d00:c4e8:6181:3ac7:bd41","2a00:a040:3:4:face:b00c:3333:7020","TCP","88","40850  >  443 [ACK] Seq=1959 Ack=193706 Win=254592 Len=0 TSval=3235526980 TSecr=2347298539"
"394","82.167895714","2a00:a040:3:4:face:b00c:3333:7020","2a00:a041:3c5d:4d00:c4e8:6181:3ac7:bd41","TLSv1.3","1575","Application Data"
"395","82.167912589","2a00:a041:3c5d:4d00:c4e8:6181:3ac7:bd41","2a00:a040:3:4:face:b00c:3333:7020","TCP","88","40850  >  443 [ACK] Seq=1959 Ack=195193 Win=257536 Len=0 TSval=3235526982 TSecr=2347298539"
"396","82.184885858","2a00:a040:3:4:face:b00c:3333:7020","2a00:a041:3c5d:4d00:c4e8:6181:3ac7:bd41","TCP","88","[TCP Dup ACK 327#1] 443  >  40850 [ACK] Seq=195193 Ack=1959 Win=31488 Len=0 TSval=2347298574 TSecr=3235526982"
"397","82.477153802","192.168.1.12","157.240.221.60","TLSv1.2","168","Application Data"
"398","82.487717983","192.168.1.12","157.240.221.60","TLSv1.2","161","Application Data"
"399","82.502641859","192.168.1.12","157.240.221.60","TLSv1.2","160","Application Data"
"400","82.551538360","157.240.221.60","192.168.1.12","TCP","68","443  >  42240 [ACK] Seq=7603 Ack=923 Win=437 Len=0 TSval=1403647190 TSecr=1292379661"
"401","82.560621954","157.240.221.60","192.168.1.12","TCP","68","443  >  42240 [ACK] Seq=7603 Ack=1016 Win=437 Len=0 TSval=1403647199 TSecr=1292379672"
"402","82.573565970","157.240.221.60","192.168.1.12","TCP","68","443  >  42240 [ACK] Seq=7603 Ack=1108 Win=437 Len=0 TSval=1403647212 TSecr=1292379686"
"403","83.888611825","157.240.221.60","192.168.1.12","TLSv1.2","163","Application Data"
"404","83.888653582","192.168.1.12","157.240.221.60","TCP","68","42240  >  443 [ACK] Seq=1108 Ack=7698 Win=501 Len=0 TSval=1292381072 TSecr=1403648414"
"405","83.893908638","192.168.1.12","157.240.221.60","TLSv1.2","162","Application Data"
"406","83.967706228","157.240.221.60","192.168.1.12","TCP","68","443  >  42240 [ACK] Seq=7698 Ack=1202 Win=437 Len=0 TSval=1403648606 TSecr=1292381078"
"408","93.493176200","192.168.1.12","157.240.221.60","TLSv1.2","137","Application Data"
"409","93.568848265","157.240.221.60","192.168.1.12","TCP","68","443  >  42240 [ACK] Seq=7698 Ack=1271 Win=437 Len=0 TSval=1403658206 TSecr=1292390677"
"412","93.696220292","157.240.221.60","192.168.1.12","TLSv1.2","139","Application Data"
"413","93.755280846","192.168.1.12","157.240.221.60","TCP","68","42240  >  443 [ACK] Seq=1271 Ack=7769 Win=501 Len=0 TSval=1292390939 TSecr=1403658321"
"414","95.028948908","157.240.221.60","192.168.1.12","TLSv1.2","347","Application Data"
"415","95.028993829","192.168.1.12","157.240.221.60","TCP","68","42240  >  443 [ACK] Seq=1271 Ack=8048 Win=499 Len=0 TSval=1292392213 TSecr=1403659636"
"416","96.111686056","192.168.1.12","157.240.221.60","TLSv1.2","140","Application Data"
"417","96.186412773","157.240.221.60","192.168.1.12","TCP","68","443  >  42240 [ACK] Seq=8048 Ack=1343 Win=437 Len=0 TSval=1403660825 TSecr=1292393295"
"436","111.514667203","157.240.221.60","192.168.1.12","TLSv1.2","754","Application Data"
"437","111.514715399","192.168.1.12","157.240.221.60","TCP","68","42240  >  443 [ACK] Seq=1343 Ack=8734 Win=496 Len=0 TSval=1292408699 TSecr=1403676019"
"438","111.718756119","157.240.221.60","192.168.1.12","TLSv1.2","209","Application Data"
"439","111.718805142","192.168.1.12","157.240.221.60","TCP","68","42240  >  443 [ACK] Seq=1343 Ack=8875 Win=495 Len=0 TSval=1292408903 TSecr=1403676344"
"440","111.724404756","192.168.1.12","157.240.221.60","TLSv1.2","168","Application Data"
"441","111.796858544","157.240.221.60","192.168.1.12","TCP","68","443  >  42240 [ACK] Seq=8875 Ack=1443 Win=437 Len=0 TSval=1403676435 TSecr=1292408908"
"442","112.622409023","192.168.1.12","157.240.221.60","TLSv1.2","164","Application Data"
"443","112.701333771","157.240.221.60","192.168.1.12","TCP","68","443  >  42240 [ACK] Seq=8875 Ack=1539 Win=437 Len=0 TSval=1403677340 TSecr=1292409806"
"444","115.317660769","192.168.1.12","157.240.221.60","TLSv1.2","137","Application Data"
"445","115.390530513","157.240.221.60","192.168.1.12","TCP","68","443  >  42240 [ACK] Seq=8875 Ack=1608 Win=437 Len=0 TSval=1403680029 TSecr=1292412501"
"446","115.613057507","157.240.221.60","192.168.1.12","TLSv1.2","139","Application Data"
"447","115.655206920","192.168.1.12","157.240.221.60","TCP","68","42240  >  443 [ACK] Seq=1608 Ack=8946 Win=501 Len=0 TSval=1292412839 TSecr=1403680144"
