"No.","Time","Source","Destination","Protocol","Length","Info"
"1","0.000000000","fe80::a8c:14f0:c17c:d903","ff02::2","ICMPv6","64","Router Solicitation"
"2","0.381335201","192.168.1.1","239.255.255.250","SSDP","386","NOTIFY * HTTP/1.1 "
"3","0.381335428","192.168.1.1","239.255.255.250","SSDP","442","NOTIFY * HTTP/1.1 "
"4","0.381335477","192.168.1.1","239.255.255.250","SSDP","370","NOTIFY * HTTP/1.1 "
"5","0.392632582","192.168.1.1","239.255.255.250","SSDP","362","NOTIFY * HTTP/1.1 "
"6","0.392632821","192.168.1.1","239.255.255.250","SSDP","406","NOTIFY * HTTP/1.1 "
"7","0.392632886","192.168.1.1","239.255.255.250","SSDP","382","NOTIFY * HTTP/1.1 "
"8","0.406491637","192.168.1.1","239.255.255.250","SSDP","436","NOTIFY * HTTP/1.1 "
"9","0.406492012","192.168.1.1","239.255.255.250","SSDP","434","NOTIFY * HTTP/1.1 "
"10","0.406492063","192.168.1.1","239.255.255.250","SSDP","438","NOTIFY * HTTP/1.1 "
"11","0.409037120","192.168.1.1","239.255.255.250","SSDP","430","NOTIFY * HTTP/1.1 "
"12","1.189359591","157.240.221.60","192.168.1.12","TCP","1448","443  >  42542 [ACK] Seq=1 Ack=1 Win=931 Len=1380 TSval=3818557591 TSecr=1288241800 [TCP segment of a reassembled PDU]"
"13","1.189425235","192.168.1.12","157.240.221.60","TCP","68","42542  >  443 [ACK] Seq=1 Ack=1381 Win=1066 Len=0 TSval=1288251939 TSecr=3818557591"
"14","1.189886749","157.240.221.60","192.168.1.12","TLSv1.2","386","Application Data, Application Data"
"15","1.189919117","192.168.1.12","157.240.221.60","TCP","68","42542  >  443 [ACK] Seq=1 Ack=1699 Win=1066 Len=0 TSval=1288251940 TSecr=3818557591"
"16","1.489260822","2a00:a041:3c5d:4d00:c4e8:6181:3ac7:bd41","2600:1901:1:c36::","TCP","88","42850  >  443 [ACK] Seq=1 Ack=1 Win=501 Len=0 TSval=591582846 TSecr=4160096355"
"17","1.506285466","2600:1901:1:c36::","2a00:a041:3c5d:4d00:c4e8:6181:3ac7:bd41","TCP","88","[TCP ACKed unseen segment] 443  >  42850 [ACK] Seq=1 Ack=2 Win=268 Len=0 TSval=4160141409 TSecr=591311237"
"18","1.574127601","157.240.221.60","192.168.1.12","TLSv1.2","161","Application Data"
"19","1.574170434","192.168.1.12","157.240.221.60","TCP","68","42542  >  443 [ACK] Seq=1 Ack=1792 Win=1066 Len=0 TSval=1288252324 TSecr=3818558033"
"20","1.577934707","192.168.1.12","157.240.221.60","TLSv1.2","160","Application Data"
"21","1.654193965","157.240.221.60","192.168.1.12","TCP","68","443  >  42542 [ACK] Seq=1792 Ack=93 Win=931 Len=0 TSval=3818558113 TSecr=1288252328"
"22","2.067120970","192.168.1.12","157.240.221.60","TLSv1.2","146","Application Data"
"23","2.138969690","157.240.221.60","192.168.1.12","TCP","68","443  >  42542 [ACK] Seq=1792 Ack=171 Win=931 Len=0 TSval=3818558598 TSecr=1288252817"
"24","2.417763423","fe80::e2ce:c3ff:fe1a:1978","ff02::1","ICMPv6","176","Router Advertisement from e0:ce:c3:1a:19:78"
"25","2.429110762","fe80::a8c:14f0:c17c:d903","ff02::16","ICMPv6","152","Multicast Listener Report Message v2"
"26","2.698984531","192.168.1.12","157.240.221.60","TLSv1.2","161","Application Data"
"27","2.775305982","157.240.221.60","192.168.1.12","TCP","68","443  >  42542 [ACK] Seq=1792 Ack=264 Win=931 Len=0 TSval=3818559233 TSecr=1288253449"
"28","3.281286636","fe80::a8c:14f0:c17c:d903","ff02::16","ICMPv6","152","Multicast Listener Report Message v2"
"29","3.441211556","192.168.1.14","192.168.1.255","UDP","88","57621  >  57621 Len=44"
"30","3.492696417","2a00:a041:3c5d:4d00:c4e8:6181:3ac7:bd41","2600:1901:1:a98::","TLSv1.2","131","Application Data"
"31","3.508958044","2600:1901:1:a98::","2a00:a041:3c5d:4d00:c4e8:6181:3ac7:bd41","TCP","88","443  >  57558 [ACK] Seq=1 Ack=44 Win=268 Len=0 TSval=122171853 TSecr=3829472814"
"32","3.565981094","2600:1901:1:a98::","2a00:a041:3c5d:4d00:c4e8:6181:3ac7:bd41","TLSv1.2","128","Application Data"
"33","3.566014960","2a00:a041:3c5d:4d00:c4e8:6181:3ac7:bd41","2600:1901:1:a98::","TCP","88","57558  >  443 [ACK] Seq=44 Ack=41 Win=501 Len=0 TSval=3829472887 TSecr=122171908"
"34","6.206012866","192.168.1.10","224.0.0.251","MDNS","93","Standard query 0x0000 PTR _raop._tcp.local, ""QU"" question PTR _airplay._tcp.local, ""QU"" question"
"35","7.633149742","2a00:a041:3c5d:4d00:c4e8:6181:3ac7:bd41","2600:1901:1:c36::","TCP","88","57540  >  443 [ACK] Seq=1 Ack=1 Win=501 Len=0 TSval=591588990 TSecr=379627343"
"36","7.657520316","2600:1901:1:c36::","2a00:a041:3c5d:4d00:c4e8:6181:3ac7:bd41","TCP","88","[TCP ACKed unseen segment] 443  >  57540 [ACK] Seq=1 Ack=2 Win=298 Len=0 TSval=379672407 TSecr=591318511"
"37","9.380378067","AskeyCom_1a:19:78","","ARP","62","Who has 192.168.1.14? Tell 192.168.1.1"
"38","10.002873749","127.0.0.1","127.0.0.53","DNS","96","Standard query 0x17ad A spclient.wg.spotify.com OPT"
"39","10.003212270","192.168.1.12","213.57.22.5","DNS","96","Standard query 0x5373 A spclient.wg.spotify.com OPT"
"40","10.420850392","192.168.1.14","224.0.0.251","MDNS","73","Standard query 0x0000 ANY Jerry.local, ""QM"" question"
"41","10.420850769","fe80::d0fa:494a:913c:2b60","ff02::fb","MDNS","93","Standard query 0x0000 ANY Jerry.local, ""QM"" question"
"42","10.420850815","192.168.1.14","224.0.0.251","MDNS","167","Standard query response 0x0000 AAAA 2a00:a041:3c5d:4d00:8a6d:800c:ac09:c93d AAAA 2a00:a041:3c5d:4d00:61b4:8c91:d0fd:e056 AAAA fe80::d0fa:494a:913c:2b60 A 192.168.1.14"
"43","10.420850861","fe80::d0fa:494a:913c:2b60","ff02::fb","MDNS","187","Standard query response 0x0000 AAAA 2a00:a041:3c5d:4d00:8a6d:800c:ac09:c93d AAAA 2a00:a041:3c5d:4d00:61b4:8c91:d0fd:e056 AAAA fe80::d0fa:494a:913c:2b60 A 192.168.1.14"
"44","11.761233502","192.168.1.12","146.75.54.250","TCP","68","44504  >  443 [ACK] Seq=1 Ack=1 Win=501 Len=0 TSval=3805000749 TSecr=3558224706"
"45","11.769250622","192.168.1.12","151.101.242.248","TCP","68","55506  >  443 [ACK] Seq=1 Ack=1 Win=749 Len=0 TSval=650334924 TSecr=856066843"
"46","11.817080680","192.168.1.12","151.101.242.248","TCP","68","55520  >  443 [ACK] Seq=1 Ack=1 Win=501 Len=0 TSval=650334972 TSecr=3203041986"
"47","11.821210428","192.168.1.12","146.75.54.250","TCP","68","44520  >  443 [ACK] Seq=1 Ack=1 Win=501 Len=0 TSval=3805000809 TSecr=4139022302"
"48","11.846680522","146.75.54.250","192.168.1.12","TCP","68","[TCP ACKed unseen segment] 443  >  44504 [ACK] Seq=1 Ack=2 Win=287 Len=0 TSval=3558269793 TSecr=3804726650"
"49","11.861239521","151.101.242.248","192.168.1.12","TCP","68","[TCP ACKed unseen segment] 443  >  55506 [ACK] Seq=1 Ack=2 Win=288 Len=0 TSval=856111937 TSecr=650060752"
"50","11.928880749","151.101.242.248","192.168.1.12","TCP","68","[TCP ACKed unseen segment] 443  >  55520 [ACK] Seq=1 Ack=2 Win=285 Len=0 TSval=3203087101 TSecr=650060868"
"51","11.933123721","146.75.54.250","192.168.1.12","TCP","68","[TCP ACKed unseen segment] 443  >  44520 [ACK] Seq=1 Ack=2 Win=285 Len=0 TSval=4139067418 TSecr=3804726592"
"52","13.196011531","192.168.1.12","35.186.224.47","TLSv1.2","103","Application Data"
"53","13.216572609","35.186.224.47","192.168.1.12","TCP","68","443  >  51376 [ACK] Seq=1 Ack=36 Win=267 Len=0 TSval=255583326 TSecr=461339647"
"54","13.283584505","35.186.224.47","192.168.1.12","TLSv1.2","99","Application Data"
"55","13.283629996","192.168.1.12","35.186.224.47","TCP","68","51376  >  443 [ACK] Seq=36 Ack=32 Win=501 Len=0 TSval=461339735 TSecr=255583388"
"56","13.777210175","192.168.1.12","151.101.242.248","TCP","68","55496  >  443 [ACK] Seq=1 Ack=1 Win=3538 Len=0 TSval=650336932 TSecr=2106250640"
"57","13.777271526","192.168.1.12","146.75.54.250","TCP","68","44502  >  443 [ACK] Seq=1 Ack=1 Win=501 Len=0 TSval=3805002765 TSecr=552833521"
"58","13.777287204","192.168.1.12","146.75.54.250","TCP","68","44528  >  443 [ACK] Seq=1 Ack=1 Win=501 Len=0 TSval=3805002765 TSecr=4038343305"
"59","13.777294291","192.168.1.12","151.101.242.248","TCP","68","49324  >  443 [ACK] Seq=1 Ack=1 Win=501 Len=0 TSval=650336932 TSecr=3621304324"
"60","13.865189863","151.101.242.248","192.168.1.12","TCP","68","[TCP ACKed unseen segment] 443  >  55496 [ACK] Seq=1 Ack=2 Win=302 Len=0 TSval=2106297758 TSecr=650289902"
"61","13.866073052","151.101.242.248","192.168.1.12","TCP","68","[TCP ACKed unseen segment] 443  >  49324 [ACK] Seq=1 Ack=2 Win=285 Len=0 TSval=3621351361 TSecr=650063256"
"62","13.884630332","146.75.54.250","192.168.1.12","TCP","68","[TCP ACKed unseen segment] 443  >  44502 [ACK] Seq=1 Ack=2 Win=287 Len=0 TSval=552880571 TSecr=3804726525"
"63","13.885111557","146.75.54.250","192.168.1.12","TCP","68","[TCP ACKed unseen segment] 443  >  44528 [ACK] Seq=1 Ack=2 Win=285 Len=0 TSval=4038390306 TSecr=3804726594"
"64","13.929280997","192.168.1.12","151.101.242.248","TCP","68","55466  >  443 [ACK] Seq=1 Ack=1 Win=501 Len=0 TSval=650337084 TSecr=414414171"
"65","13.929306877","192.168.1.12","146.75.54.248","TCP","68","48298  >  443 [ACK] Seq=1 Ack=1 Win=501 Len=0 TSval=621834349 TSecr=2314565218"
"66","13.933217198","192.168.1.12","151.101.242.248","TCP","68","55454  >  443 [ACK] Seq=1 Ack=1 Win=1333 Len=0 TSval=650337088 TSecr=2876878298"
"67","13.937192439","192.168.1.12","151.101.242.248","TCP","68","49320  >  443 [ACK] Seq=1 Ack=1 Win=764 Len=0 TSval=650337092 TSecr=3469894699"
"68","13.937227346","192.168.1.12","146.75.54.248","TCP","68","48312  >  443 [ACK] Seq=1 Ack=1 Win=1133 Len=0 TSval=621834357 TSecr=1064949429"
"69","14.015865214","151.101.242.248","192.168.1.12","TCP","68","[TCP ACKed unseen segment] 443  >  55466 [ACK] Seq=1 Ack=2 Win=296 Len=0 TSval=414459261 TSecr=650064017"
"70","14.018339262","146.75.54.248","192.168.1.12","TCP","68","[TCP ACKed unseen segment] 443  >  48298 [ACK] Seq=1 Ack=2 Win=285 Len=0 TSval=2314610307 TSecr=621561561"
"71","14.029926761","151.101.242.248","192.168.1.12","TCP","68","[TCP ACKed unseen segment] 443  >  55454 [ACK] Seq=1 Ack=2 Win=296 Len=0 TSval=2876923394 TSecr=650064005"
"72","14.030164007","151.101.242.248","192.168.1.12","TCP","68","[TCP ACKed unseen segment] 443  >  49320 [ACK] Seq=1 Ack=2 Win=288 Len=0 TSval=3469939795 TSecr=650063367"
"73","14.032405759","146.75.54.248","192.168.1.12","TCP","68","[TCP ACKed unseen segment] 443  >  48312 [ACK] Seq=1 Ack=2 Win=288 Len=0 TSval=1064994525 TSecr=621561668"
"74","15.008048873","127.0.0.1","127.0.0.53","DNS","96","Standard query 0x17ad A spclient.wg.spotify.com OPT"
"75","15.008333164","192.168.1.12","213.57.2.5","DNS","96","Standard query 0x5373 A spclient.wg.spotify.com OPT"
"76","15.026079318","213.57.2.5","192.168.1.12","DNS","145","Standard query response 0x5373 A spclient.wg.spotify.com CNAME edge-web.dual-gslb.spotify.com A 35.186.224.25 OPT"
"77","15.026389710","127.0.0.53","127.0.0.1","DNS","145","Standard query response 0x17ad A spclient.wg.spotify.com CNAME edge-web.dual-gslb.spotify.com A 35.186.224.25 OPT"
"78","15.026563184","127.0.0.1","127.0.0.53","DNS","96","Standard query 0x0db6 AAAA spclient.wg.spotify.com OPT"
"79","15.026926921","192.168.1.12","213.57.2.5","DNS","103","Standard query 0x577f AAAA edge-web.dual-gslb.spotify.com OPT"
"80","15.042524570","213.57.2.5","192.168.1.12","DNS","131","Standard query response 0x577f AAAA edge-web.dual-gslb.spotify.com AAAA 2600:1901:1:c36:: OPT"
"81","15.042813543","127.0.0.53","127.0.0.1","DNS","173","Standard query response 0x0db6 AAAA spclient.wg.spotify.com CNAME edge-web.dual-gslb.spotify.com AAAA 2600:1901:1:c36:: A 35.186.224.25 OPT"
"82","15.043855834","2a00:a041:3c5d:4d00:c4e8:6181:3ac7:bd41","2600:1901:1:c36::","QUIC","1294","Initial, DCID=2c520a4d71367b77, PKN: 1, CRYPTO, CRYPTO, PING, PING, CRYPTO, CRYPTO, PADDING, CRYPTO, CRYPTO, PING, PADDING, PING, CRYPTO, PING"
"83","15.044092672","2a00:a041:3c5d:4d00:c4e8:6181:3ac7:bd41","2600:1901:1:c36::","TLSv1.2","170","Application Data"
"84","15.044138299","2a00:a041:3c5d:4d00:c4e8:6181:3ac7:bd41","2600:1901:1:c36::","TLSv1.2","1687","Application Data, Application Data"
"85","15.080924050","2600:1901:1:c36::","2a00:a041:3c5d:4d00:c4e8:6181:3ac7:bd41","TCP","88","443  >  42892 [ACK] Seq=1 Ack=1511 Win=543 Len=0 TSval=1118164198 TSecr=591596401"
"86","15.081379062","2600:1901:1:c36::","2a00:a041:3c5d:4d00:c4e8:6181:3ac7:bd41","TLSv1.2","127","Application Data"
"87","15.094692293","2600:1901:1:c36::","2a00:a041:3c5d:4d00:c4e8:6181:3ac7:bd41","QUIC","1294","Initial, SCID=ec520a4d71367b77, PKN: 1, ACK, PADDING"
"88","15.117746942","2a00:a041:3c5d:4d00:c4e8:6181:3ac7:bd41","2600:1901:1:c36::","QUIC","1294","Initial, DCID=ec520a4d71367b77, PKN: 3, PADDING, PING, PADDING"
"89","15.125175591","2a00:a041:3c5d:4d00:c4e8:6181:3ac7:bd41","2600:1901:1:c36::","TCP","88","42892  >  443 [ACK] Seq=1682 Ack=40 Win=9924 Len=0 TSval=591596482 TSecr=1118164198"
"90","15.130856486","2600:1901:1:c36::","2a00:a041:3c5d:4d00:c4e8:6181:3ac7:bd41","QUIC","1294","Protected Payload (KP0)"
"91","15.131800812","2a00:a041:3c5d:4d00:c4e8:6181:3ac7:bd41","2600:1901:1:c36::","QUIC","231","Protected Payload (KP0), DCID=ec520a4d71367b77"
"92","15.136383012","2600:1901:1:c36::","2a00:a041:3c5d:4d00:c4e8:6181:3ac7:bd41","QUIC","1294","Protected Payload (KP0)"
"93","15.136691549","2a00:a041:3c5d:4d00:c4e8:6181:3ac7:bd41","2600:1901:1:c36::","QUIC","233","Protected Payload (KP0), DCID=ec520a4d71367b77"
"94","15.150749185","2600:1901:1:c36::","2a00:a041:3c5d:4d00:c4e8:6181:3ac7:bd41","QUIC","582","Protected Payload (KP0)"
"95","15.150996103","2a00:a041:3c5d:4d00:c4e8:6181:3ac7:bd41","2600:1901:1:c36::","QUIC","97","Protected Payload (KP0), DCID=ec520a4d71367b77"
"96","15.151233994","2600:1901:1:c36::","2a00:a041:3c5d:4d00:c4e8:6181:3ac7:bd41","QUIC","185","Protected Payload (KP0)"
"97","15.151321420","2a00:a041:3c5d:4d00:c4e8:6181:3ac7:bd41","2600:1901:1:c36::","QUIC","97","Protected Payload (KP0), DCID=ec520a4d71367b77"
"98","15.156956997","2600:1901:1:c36::","2a00:a041:3c5d:4d00:c4e8:6181:3ac7:bd41","QUIC","89","Protected Payload (KP0)"
"99","15.194669669","2600:1901:1:c36::","2a00:a041:3c5d:4d00:c4e8:6181:3ac7:bd41","TLSv1.2","171","Application Data"
"100","15.194744205","2a00:a041:3c5d:4d00:c4e8:6181:3ac7:bd41","2600:1901:1:c36::","TCP","88","42892  >  443 [ACK] Seq=1682 Ack=123 Win=9924 Len=0 TSval=591596552 TSecr=1118164326"
"101","15.196546089","2a00:a041:3c5d:4d00:c4e8:6181:3ac7:bd41","2600:1901:1:c36::","TLSv1.2","127","Application Data"
"102","15.219531165","2600:1901:1:c36::","2a00:a041:3c5d:4d00:c4e8:6181:3ac7:bd41","TCP","88","443  >  42892 [ACK] Seq=123 Ack=1721 Win=554 Len=0 TSval=1118164350 TSecr=591596553"
"103","15.219535470","fe80::e2ce:c3ff:fe1a:1978","ff02::1","ICMPv6","176","Router Advertisement from e0:ce:c3:1a:19:78"
"104","15.229135360","fe80::a8c:14f0:c17c:d903","ff02::16","ICMPv6","152","Multicast Listener Report Message v2"
"105","15.861077705","192.168.1.12","151.101.242.248","TCP","68","55478  >  443 [ACK] Seq=1 Ack=1 Win=817 Len=0 TSval=650339016 TSecr=1888290093"
"106","15.865107066","192.168.1.12","151.101.242.248","TCP","68","55474  >  443 [ACK] Seq=1 Ack=1 Win=3172 Len=0 TSval=650339020 TSecr=2876880229"
"107","15.865128031","192.168.1.12","151.101.242.248","TCP","68","55492  >  443 [ACK] Seq=1 Ack=1 Win=885 Len=0 TSval=650339020 TSecr=717343935"
"108","15.947098915","151.101.242.248","192.168.1.12","TCP","68","[TCP ACKed unseen segment] 443  >  55478 [ACK] Seq=1 Ack=2 Win=294 Len=0 TSval=1888335184 TSecr=650064915"
"109","15.959865542","151.101.242.248","192.168.1.12","TCP","68","[TCP ACKed unseen segment] 443  >  55492 [ACK] Seq=1 Ack=2 Win=296 Len=0 TSval=717389031 TSecr=650064895"
"110","15.960190712","151.101.242.248","192.168.1.12","TCP","68","[TCP ACKed unseen segment] 443  >  55474 [ACK] Seq=1 Ack=2 Win=302 Len=0 TSval=2876925325 TSecr=650064917"
"111","16.213271447","fe80::a8c:14f0:c17c:d903","ff02::16","ICMPv6","152","Multicast Listener Report Message v2"
"112","16.243146095","192.168.1.10","224.0.0.251","MDNS","93","Standard query 0x0000 PTR _raop._tcp.local, ""QU"" question PTR _airplay._tcp.local, ""QU"" question"
"113","16.849137345","2a00:a041:3c5d:4d00:c4e8:6181:3ac7:bd41","2600:1901:1:c36::","TCP","88","57544  >  443 [ACK] Seq=1 Ack=1 Win=501 Len=0 TSval=591598206 TSecr=3813033762"
"114","16.868016294","2600:1901:1:c36::","2a00:a041:3c5d:4d00:c4e8:6181:3ac7:bd41","TCP","88","[TCP ACKed unseen segment] 443  >  57544 [ACK] Seq=1 Ack=2 Win=286 Len=0 TSval=3813078848 TSecr=591553115"
"115","19.834377745","192.168.1.14","239.255.255.250","SSDP","220","M-SEARCH * HTTP/1.1 "
"116","19.834378132","192.168.1.14","224.0.0.251","MDNS","89","Standard query 0x0000 PTR _spotify-connect._tcp.local, ""QM"" question"
"117","19.834378179","192.168.1.14","239.255.255.250","SSDP","214","M-SEARCH * HTTP/1.1 "
"118","19.834378230","fe80::d0fa:494a:913c:2b60","ff02::fb","MDNS","109","Standard query 0x0000 PTR _spotify-connect._tcp.local, ""QM"" question"
"119","19.834378276","fe80::d0fa:494a:913c:2b60","ff02::fb","MDNS","109","Standard query 0x0000 PTR _spotify-connect._tcp.local, ""QM"" question"
"120","19.834378325","fe80::d0fa:494a:913c:2b60","ff02::fb","MDNS","109","Standard query 0x0000 PTR _spotify-connect._tcp.local, ""QM"" question"
"121","19.930745834","192.168.1.18","224.0.0.251","MDNS","243","Standard query response 0x0000 PTR 23c33299-7089-5951-8cfd-e1c181c9847d._spotify-connect._tcp.local TXT, cache flush SRV, cache flush 0 0 54050 1GJ37V014681.local A, cache flush 192.168.1.18 NSEC, cache flush 23c33299-7089-5951-8cfd-e1c181c9847d._spotify-connect._tcp.local NSEC, cache flush 1GJ37V014681.local"
"122","19.930746194","192.168.1.14","239.255.255.250","SSDP","169","M-SEARCH * HTTP/1.1 "
"123","20.374628396","192.168.1.12","157.240.221.60","TLSv1.2","137","Application Data"
"124","20.442252193","Chongqin_99:f9:45","","ARP","44","Who has 192.168.1.29? Tell 192.168.1.14"
"125","20.442252566","Chongqin_99:f9:45","","ARP","44","Who has 192.168.1.66? Tell 192.168.1.14"
"126","20.447047942","157.240.221.60","192.168.1.12","TCP","68","443  >  42542 [ACK] Seq=1792 Ack=333 Win=931 Len=0 TSval=3818576905 TSecr=1288271125"
"127","20.644711345","157.240.221.60","192.168.1.12","TLSv1.2","139","Application Data"
"128","20.685240547","192.168.1.12","157.240.221.60","TCP","68","42542  >  443 [ACK] Seq=333 Ack=1863 Win=1066 Len=0 TSval=1288271435 TSecr=3818577023"
"129","20.776396697","157.240.221.60","192.168.1.12","TCP","139","[TCP Spurious Retransmission] 443  >  42542 [PSH, ACK] Seq=1792 Ack=333 Win=931 Len=71 TSval=3818577234 TSecr=1288271125"
"130","20.776432502","192.168.1.12","157.240.221.60","TCP","80","[TCP Dup ACK 128#1] 42542  >  443 [ACK] Seq=333 Ack=1863 Win=1066 Len=0 TSval=1288271526 TSecr=3818577234 SLE=1792 SRE=1863"
"131","20.854316292","192.168.1.14","239.255.255.250","SSDP","220","M-SEARCH * HTTP/1.1 "
"132","20.854316662","192.168.1.14","239.255.255.250","SSDP","214","M-SEARCH * HTTP/1.1 "
"133","21.876557914","192.168.1.14","239.255.255.250","SSDP","220","M-SEARCH * HTTP/1.1 "
"134","21.876558290","192.168.1.14","239.255.255.250","SSDP","214","M-SEARCH * HTTP/1.1 "
"135","21.969255234","2a00:a041:3c5d:4d00:c4e8:6181:3ac7:bd41","2600:1901:1:5ca::","TCP","88","51966  >  443 [ACK] Seq=1 Ack=1 Win=501 Len=0 TSval=3978993654 TSecr=498859281"
"136","21.969281631","2a00:a041:3c5d:4d00:c4e8:6181:3ac7:bd41","2a00:a040:3:6::d539:18ca","TCP","88","36194  >  443 [ACK] Seq=1 Ack=1 Win=8684 Len=0 TSval=3057288626 TSecr=64734202"
"137","21.969296858","192.168.1.12","146.75.122.250","TCP","68","45536  >  443 [ACK] Seq=1 Ack=1 Win=501 Len=0 TSval=1947050058 TSecr=3497653372"
"138","21.969310943","192.168.1.12","146.75.122.250","TCP","68","45546  >  443 [ACK] Seq=1 Ack=1 Win=501 Len=0 TSval=1947050058 TSecr=2554195405"
"139","21.985758903","2a00:a040:3:6::d539:18ca","2a00:a041:3c5d:4d00:c4e8:6181:3ac7:bd41","TCP","88","[TCP ACKed unseen segment] 443  >  36194 [ACK] Seq=1 Ack=2 Win=501 Len=0 TSval=64780592 TSecr=3057242261"
"140","21.988312276","2600:1901:1:5ca::","2a00:a041:3c5d:4d00:c4e8:6181:3ac7:bd41","TCP","88","[TCP ACKed unseen segment] 443  >  51966 [ACK] Seq=1 Ack=2 Win=337 Len=0 TSval=498905175 TSecr=3978947762"
"141","22.054922004","146.75.122.250","192.168.1.12","TCP","68","[TCP ACKed unseen segment] 443  >  45536 [ACK] Seq=1 Ack=2 Win=287 Len=0 TSval=3497745504 TSecr=1946774554"
"142","22.056155359","146.75.122.250","192.168.1.12","TCP","68","[TCP ACKed unseen segment] 443  >  45546 [ACK] Seq=1 Ack=2 Win=285 Len=0 TSval=2554287518 TSecr=1946774514"
"143","22.796162337","192.168.1.14","239.255.255.250","SSDP","220","M-SEARCH * HTTP/1.1 "
"144","22.898432069","192.168.1.14","239.255.255.250","SSDP","214","M-SEARCH * HTTP/1.1 "
"145","23.000520234","Chongqin_99:f9:45","","ARP","44","Who has 192.168.1.29? Tell 192.168.1.14"
"146","23.000520508","Chongqin_99:f9:45","","ARP","44","Who has 192.168.1.66? Tell 192.168.1.14"
"147","23.921874366","Chongqin_99:f9:45","","ARP","44","Who has 192.168.1.29? Tell 192.168.1.14"
"148","23.921874732","Chongqin_99:f9:45","","ARP","44","Who has 192.168.1.66? Tell 192.168.1.14"
"149","24.945868691","Chongqin_99:f9:45","","ARP","44","Who has 192.168.1.29? Tell 192.168.1.14"
"150","24.945869077","Chongqin_99:f9:45","","ARP","44","Who has 192.168.1.66? Tell 192.168.1.14"
"151","26.276799312","192.168.1.10","224.0.0.251","MDNS","93","Standard query 0x0000 PTR _raop._tcp.local, ""QU"" question PTR _airplay._tcp.local, ""QU"" question"
"152","26.993874703","Chongqin_99:f9:45","","ARP","44","Who has 192.168.1.29? Tell 192.168.1.14"
"153","26.993875093","Chongqin_99:f9:45","","ARP","44","Who has 192.168.1.66? Tell 192.168.1.14"
"154","27.915591195","Chongqin_99:f9:45","","ARP","44","Who has 192.168.1.29? Tell 192.168.1.14"
"155","27.915591461","Chongqin_99:f9:45","","ARP","44","Who has 192.168.1.66? Tell 192.168.1.14"
"156","28.165219574","2a00:a041:3c5d:4d00:c4e8:6181:3ac7:bd41","2600:1900:4110:86f::","TCP","88","33264  >  80 [ACK] Seq=1 Ack=1 Win=12299 Len=0 TSval=1670611649 TSecr=3810347091"
"157","28.224978544","2600:1900:4110:86f::","2a00:a041:3c5d:4d00:c4e8:6181:3ac7:bd41","TCP","88","[TCP ACKed unseen segment] 80  >  33264 [ACK] Seq=1 Ack=2 Win=261 Len=0 TSval=3810392153 TSecr=1670251120"
"158","28.328323910","192.168.1.1","224.0.0.1","IGMPv2","44","Membership Query, general"
"159","28.328324269","192.168.1.1","224.0.0.1","IGMPv3","48","Membership Query, general"
"160","28.328324316","fe80::e2ce:c3ff:fe1a:1978","ff02::1","ICMPv6","92","Multicast Listener Query"
"161","28.428543450","192.168.1.14","224.0.0.251","IGMPv2","48","Membership Report group 224.0.0.251"
"162","28.428543677","192.168.1.14","239.255.255.250","IGMPv2","48","Membership Report group 239.255.255.250"
"163","28.844173478","192.168.1.12","224.0.0.251","MDNS","89","Standard query 0x0000 PTR _spotify-connect._tcp.local, ""QM"" question"
"164","28.844233306","fe80::a8c:14f0:c17c:d903","ff02::fb","MDNS","109","Standard query 0x0000 PTR _spotify-connect._tcp.local, ""QM"" question"
"165","28.844248590","fe80::a8c:14f0:c17c:d903","ff02::fb","MDNS","109","Standard query 0x0000 PTR _spotify-connect._tcp.local, ""QM"" question"
"166","28.844262012","fe80::a8c:14f0:c17c:d903","ff02::fb","MDNS","109","Standard query 0x0000 PTR _spotify-connect._tcp.local, ""QM"" question"
"167","28.948707090","Chongqin_99:f9:45","","ARP","44","Who has 192.168.1.29? Tell 192.168.1.14"
"168","28.948707334","Chongqin_99:f9:45","","ARP","44","Who has 192.168.1.66? Tell 192.168.1.14"
"169","28.948707383","192.168.1.18","224.0.0.251","MDNS","243","Standard query response 0x0000 PTR 23c33299-7089-5951-8cfd-e1c181c9847d._spotify-connect._tcp.local TXT, cache flush SRV, cache flush 0 0 54050 1GJ37V014681.local A, cache flush 192.168.1.18 NSEC, cache flush 23c33299-7089-5951-8cfd-e1c181c9847d._spotify-connect._tcp.local NSEC, cache flush 1GJ37V014681.local"
"170","29.084937832","192.168.1.12","104.199.65.124","TCP","79","37320  >  4070 [PSH, ACK] Seq=1 Ack=1 Win=501 Len=11 TSval=3260750035 TSecr=3368476826"
"171","29.161394709","104.199.65.124","192.168.1.12","TCP","79","4070  >  37320 [PSH, ACK] Seq=1 Ack=12 Win=16 Len=11 TSval=3368536950 TSecr=3260750035"
"172","29.161434891","192.168.1.12","104.199.65.124","TCP","68","37320  >  4070 [ACK] Seq=12 Ack=12 Win=501 Len=0 TSval=3260750111 TSecr=3368536950"
"173","29.615002853","192.168.1.12","192.168.1.255","UDP","88","57621  >  57621 Len=44"
"174","30.257869152","192.168.1.12","104.199.65.124","TCP","1713","37320  >  4070 [PSH, ACK] Seq=12 Ack=12 Win=501 Len=1645 TSval=3260751208 TSecr=3368536950"
"175","30.258328698","192.168.1.12","104.199.65.124","TCP","2524","37320  >  4070 [PSH, ACK] Seq=1657 Ack=12 Win=501 Len=2456 TSval=3260751208 TSecr=3368536950"
"176","30.337478642","104.199.65.124","192.168.1.12","TCP","68","4070  >  37320 [ACK] Seq=12 Ack=1657 Win=16 Len=0 TSval=3368538129 TSecr=3260751208"
"177","30.337522589","192.168.1.12","104.199.65.124","TCP","667","37320  >  4070 [PSH, ACK] Seq=4113 Ack=12 Win=501 Len=599 TSval=3260751287 TSecr=3368538129"
"178","30.337872564","104.199.65.124","192.168.1.12","TCP","68","4070  >  37320 [ACK] Seq=12 Ack=4113 Win=16 Len=0 TSval=3368538129 TSecr=3260751208"
"179","30.341631784","104.199.65.124","192.168.1.12","TCP","1003","4070  >  37320 [PSH, ACK] Seq=12 Ack=4113 Win=16 Len=935 TSval=3368538132 TSecr=3260751208"
"180","30.341679575","192.168.1.12","104.199.65.124","TCP","68","37320  >  4070 [ACK] Seq=4712 Ack=947 Win=494 Len=0 TSval=3260751292 TSecr=3368538132"
"181","30.384898635","192.168.1.1","239.255.255.250","SSDP","386","NOTIFY * HTTP/1.1 "
"182","30.384898990","192.168.1.1","239.255.255.250","SSDP","442","NOTIFY * HTTP/1.1 "
"183","30.384899035","192.168.1.1","239.255.255.250","SSDP","370","NOTIFY * HTTP/1.1 "
"184","30.396252452","192.168.1.1","239.255.255.250","SSDP","362","NOTIFY * HTTP/1.1 "
"185","30.396252677","192.168.1.1","239.255.255.250","SSDP","406","NOTIFY * HTTP/1.1 "
"186","30.396252724","192.168.1.1","239.255.255.250","SSDP","382","NOTIFY * HTTP/1.1 "
"187","30.409868176","192.168.1.1","239.255.255.250","SSDP","436","NOTIFY * HTTP/1.1 "
"188","30.409868411","192.168.1.1","239.255.255.250","SSDP","434","NOTIFY * HTTP/1.1 "
"189","30.409868477","192.168.1.1","239.255.255.250","SSDP","438","NOTIFY * HTTP/1.1 "
"190","30.414325024","192.168.1.1","239.255.255.250","SSDP","430","NOTIFY * HTTP/1.1 "
"191","30.417486086","104.199.65.124","192.168.1.12","TCP","233","4070  >  37320 [PSH, ACK] Seq=947 Ack=4712 Win=16 Len=165 TSval=3368538209 TSecr=3260751287"
"192","30.417540648","192.168.1.12","104.199.65.124","TCP","68","37320  >  4070 [ACK] Seq=4712 Ack=1112 Win=493 Len=0 TSval=3260751367 TSecr=3368538209"
"193","30.781798591","157.240.221.60","192.168.1.12","TCP","1448","443  >  42542 [ACK] Seq=1863 Ack=333 Win=931 Len=1380 TSval=3818587167 TSecr=1288271526 [TCP segment of a reassembled PDU]"
"194","30.781843875","192.168.1.12","157.240.221.60","TCP","68","42542  >  443 [ACK] Seq=333 Ack=3243 Win=1066 Len=0 TSval=1288281532 TSecr=3818587167"
"195","30.782256459","157.240.221.60","192.168.1.12","TLSv1.2","386","Application Data, Application Data"
"196","30.782288877","192.168.1.12","157.240.221.60","TCP","68","42542  >  443 [ACK] Seq=333 Ack=3561 Win=1066 Len=0 TSval=1288281532 TSecr=3818587167"
"197","30.815942135","192.168.1.12","239.255.255.250","SSDP","169","M-SEARCH * HTTP/1.1 "
"198","30.933107161","fe80::a8c:14f0:c17c:d903","ff02::16","ICMPv6","152","Multicast Listener Report Message v2"
"199","31.101278515","192.168.1.10","239.255.255.250","SSDP","360","NOTIFY * HTTP/1.1 "
"200","31.101278904","192.168.1.10","239.255.255.250","SSDP","351","NOTIFY * HTTP/1.1 "
"201","31.101278956","192.168.1.10","239.255.255.250","SSDP","403","NOTIFY * HTTP/1.1 "
"202","31.104543642","192.168.1.10","239.255.255.250","SSDP","417","NOTIFY * HTTP/1.1 "
"203","31.220846464","157.240.221.60","192.168.1.12","TLSv1.2","161","Application Data"
"204","31.220882993","192.168.1.12","157.240.221.60","TCP","68","42542  >  443 [ACK] Seq=333 Ack=3654 Win=1066 Len=0 TSval=1288281971 TSecr=3818587544"
"205","31.271774104","192.168.1.12","157.240.221.60","TLSv1.2","160","Application Data"
"206","31.274927417","192.168.1.12","157.240.221.60","TLSv1.2","161","Application Data"
"207","31.306489695","192.168.1.10","239.255.255.250","SSDP","415","NOTIFY * HTTP/1.1 "
"208","31.306489973","192.168.1.10","239.255.255.250","SSDP","431","NOTIFY * HTTP/1.1 "
"209","31.306490021","192.168.1.10","239.255.255.250","SSDP","360","NOTIFY * HTTP/1.1 "
"210","31.317644292","192.168.1.10","239.255.255.250","SSDP","351","NOTIFY * HTTP/1.1 "
"211","31.344871425","157.240.221.60","192.168.1.12","TCP","68","443  >  42542 [ACK] Seq=3654 Ack=425 Win=931 Len=0 TSval=3818587804 TSecr=1288282022"
"212","31.345144170","157.240.221.60","192.168.1.12","TCP","68","443  >  42542 [ACK] Seq=3654 Ack=518 Win=931 Len=0 TSval=3818587804 TSecr=1288282025"
"213","31.511849253","192.168.1.10","239.255.255.250","SSDP","403","NOTIFY * HTTP/1.1 "
"214","31.511849560","192.168.1.10","239.255.255.250","SSDP","360","NOTIFY * HTTP/1.1 "
"215","31.511849602","192.168.1.10","239.255.255.250","SSDP","351","NOTIFY * HTTP/1.1 "
"216","31.514124956","192.168.1.10","239.255.255.250","SSDP","383","NOTIFY * HTTP/1.1 "
"217","31.600732312","192.168.1.18","192.168.1.12","SSDP","323","HTTP/1.1 200 OK "
"218","32.209157306","2a00:a041:3c5d:4d00:c4e8:6181:3ac7:bd41","2a00:1450:4028:800::2001","TCP","88","49172  >  443 [ACK] Seq=1 Ack=1 Win=501 Len=0 TSval=197202351 TSecr=3383719086"
"219","32.230098525","2a00:1450:4028:800::2001","2a00:a041:3c5d:4d00:c4e8:6181:3ac7:bd41","TCP","76","443  >  49172 [RST] Seq=1 Win=0 Len=0"
"220","33.137990292","fe80::e2ce:c3ff:fe1a:1978","ff02::1","ICMPv6","176","Router Advertisement from e0:ce:c3:1a:19:78"
"221","33.153141299","fe80::a8c:14f0:c17c:d903","ff02::16","ICMPv6","152","Multicast Listener Report Message v2"
"222","33.197225094","fe80::a8c:14f0:c17c:d903","ff02::16","ICMPv6","152","Multicast Listener Report Message v2"
"223","33.567052897","2a00:a041:3c5d:4d00:c4e8:6181:3ac7:bd41","2600:1901:1:a98::","TLSv1.2","131","Application Data"
"224","33.584674834","2600:1901:1:a98::","2a00:a041:3c5d:4d00:c4e8:6181:3ac7:bd41","TCP","88","443  >  57558 [ACK] Seq=41 Ack=87 Win=268 Len=0 TSval=122201928 TSecr=3829502888"
"225","33.639696237","2600:1901:1:a98::","2a00:a041:3c5d:4d00:c4e8:6181:3ac7:bd41","TLSv1.2","128","Application Data"
"226","33.639732339","2a00:a041:3c5d:4d00:c4e8:6181:3ac7:bd41","2600:1901:1:a98::","TCP","88","57558  >  443 [ACK] Seq=87 Ack=81 Win=501 Len=0 TSval=3829502961 TSecr=122201983"
"227","34.007143847","192.168.1.12","213.57.2.5","DNS","102","Standard query 0xc8d7 A connectivity-check.ubuntu.com OPT"
"228","34.024558545","213.57.2.5","192.168.1.12","DNS","246","Standard query response 0xc8d7 A connectivity-check.ubuntu.com A 91.189.91.49 A 34.122.121.32 A 35.232.111.17 A 185.125.190.18 A 185.125.190.48 A 91.189.91.48 A 35.224.170.84 A 185.125.190.49 A 185.125.190.17 OPT"
"229","34.025759124","192.168.1.12","91.189.91.49","TCP","76","46196  >  80 [SYN] Seq=0 Win=64240 Len=0 MSS=1460 SACK_PERM=1 TSval=3248039441 TSecr=0 WS=128"
"230","34.257087742","192.168.1.12","35.188.42.15","TCP","68","41906  >  443 [ACK] Seq=1 Ack=1 Win=501 Len=0 TSval=3100657689 TSecr=3641187497"
"231","34.258994778","91.189.91.49","192.168.1.12","TCP","76","80  >  46196 [SYN, ACK] Seq=0 Ack=1 Win=65160 Len=0 MSS=1460 SACK_PERM=1 TSval=2950660598 TSecr=3248039441 WS=128"
"232","34.259039850","192.168.1.12","91.189.91.49","TCP","68","46196  >  80 [ACK] Seq=1 Ack=1 Win=64256 Len=0 TSval=3248039674 TSecr=2950660598"
"233","34.259163021","192.168.1.12","91.189.91.49","HTTP","155","GET / HTTP/1.1 "
"234","34.325081384","192.168.1.12","146.75.54.248","TCP","68","48220  >  443 [ACK] Seq=1 Ack=1 Win=501 Len=0 TSval=621854745 TSecr=3629958735"
"235","34.325107748","192.168.1.12","146.75.54.248","TCP","68","48250  >  443 [ACK] Seq=1 Ack=1 Win=501 Len=0 TSval=621854745 TSecr=1337500425"
"236","34.349105218","192.168.1.12","146.75.54.248","TCP","68","48284  >  443 [ACK] Seq=1 Ack=1 Win=2720 Len=0 TSval=621854769 TSecr=3695400174"
"237","34.349128019","192.168.1.12","146.75.54.248","TCP","68","48274  >  443 [ACK] Seq=1 Ack=1 Win=3980 Len=0 TSval=621854769 TSecr=3762914481"
"238","34.349145208","192.168.1.12","146.75.54.248","TCP","68","48262  >  443 [ACK] Seq=1 Ack=1 Win=4531 Len=0 TSval=621854769 TSecr=1064969834"
"239","34.410027618","146.75.54.248","192.168.1.12","TCP","68","[TCP ACKed unseen segment] 443  >  48220 [ACK] Seq=1 Ack=2 Win=288 Len=0 TSval=3630003824 TSecr=621581607"
"240","34.411032450","146.75.54.248","192.168.1.12","TCP","68","[TCP ACKed unseen segment] 443  >  48250 [ACK] Seq=1 Ack=2 Win=288 Len=0 TSval=1337545513 TSecr=621581523"
"241","34.422547883","91.189.91.49","192.168.1.12","HTTP","257","HTTP/1.1 204 No Content "
"242","34.422616887","192.168.1.12","91.189.91.49","TCP","68","46196  >  80 [ACK] Seq=88 Ack=190 Win=64128 Len=0 TSval=3248039838 TSecr=2950660866"
"243","34.422766885","192.168.1.12","91.189.91.49","TCP","68","46196  >  80 [FIN, ACK] Seq=88 Ack=190 Win=64128 Len=0 TSval=3248039838 TSecr=2950660866"
"244","34.424479883","91.189.91.49","192.168.1.12","TCP","68","80  >  46196 [FIN, ACK] Seq=190 Ack=88 Win=64256 Len=0 TSval=2950660867 TSecr=3248039674"
"245","34.424501662","192.168.1.12","91.189.91.49","TCP","68","46196  >  80 [ACK] Seq=89 Ack=191 Win=64128 Len=0 TSval=3248039839 TSecr=2950660867"
"246","34.444493987","146.75.54.248","192.168.1.12","TCP","68","[TCP ACKed unseen segment] 443  >  48262 [ACK] Seq=1 Ack=2 Win=297 Len=0 TSval=1065014939 TSecr=621581353"
"247","34.446153735","146.75.54.248","192.168.1.12","TCP","68","[TCP ACKed unseen segment] 443  >  48274 [ACK] Seq=1 Ack=2 Win=300 Len=0 TSval=3762959586 TSecr=621581301"
"248","34.446369243","146.75.54.248","192.168.1.12","TCP","68","[TCP ACKed unseen segment] 443  >  48284 [ACK] Seq=1 Ack=2 Win=300 Len=0 TSval=3695445279 TSecr=621581357"
"249","34.673206428","91.189.91.49","192.168.1.12","TCP","68","80  >  46196 [ACK] Seq=191 Ack=89 Win=64256 Len=0 TSval=2950661026 TSecr=3248039838"
"250","34.981255810","Chongqin_99:f9:45","","ARP","44","Who has 192.168.1.29? Tell 192.168.1.14"
"251","34.981256080","Chongqin_99:f9:45","","ARP","44","Who has 192.168.1.66? Tell 192.168.1.14"
"252","35.902744556","Chongqin_99:f9:45","","ARP","44","Who has 192.168.1.29? Tell 192.168.1.14"
"253","35.902744905","Chongqin_99:f9:45","","ARP","44","Who has 192.168.1.66? Tell 192.168.1.14"
"254","36.209368250","192.168.1.10","224.0.0.251","MDNS","93","Standard query 0x0000 PTR _raop._tcp.local, ""QU"" question PTR _airplay._tcp.local, ""QU"" question"
"255","36.377076542","192.168.1.12","146.75.54.248","TCP","68","48234  >  443 [ACK] Seq=1 Ack=1 Win=1787 Len=0 TSval=621856797 TSecr=1264900665"
"256","36.515705946","146.75.54.248","192.168.1.12","TCP","68","[TCP ACKed unseen segment] 443  >  48234 [ACK] Seq=1 Ack=2 Win=290 Len=0 TSval=1264945777 TSecr=621581397"
"257","36.516116242","Roku_83:14:62","","ARP","62","Who has 192.168.1.12? Tell 192.168.1.18"
"258","36.516128985","IntelCor_eb:49:20","","ARP","44","192.168.1.12 is at b0:7d:64:eb:49:20"
"259","36.928470074","Chongqin_99:f9:45","","ARP","44","Who has 192.168.1.29? Tell 192.168.1.14"
"260","36.928470419","Chongqin_99:f9:45","","ARP","44","Who has 192.168.1.66? Tell 192.168.1.14"
"261","38.401136291","192.168.1.12","151.101.242.248","TCP","68","54132  >  443 [ACK] Seq=1 Ack=1 Win=1115 Len=0 TSval=650361556 TSecr=1082319250"
"262","38.563939043","151.101.242.248","192.168.1.12","TCP","68","[TCP ACKed unseen segment] 443  >  54132 [ACK] Seq=1 Ack=2 Win=287 Len=0 TSval=1082364375 TSecr=650087215"
"263","38.845414976","192.168.1.12","157.240.251.60","TLSv1.2","92","Application Data"
"264","38.845462688","192.168.1.12","157.240.251.60","TCP","68","57850  >  443 [FIN, ACK] Seq=25 Ack=1 Win=1513 Len=0 TSval=2946610296 TSecr=2028910914"
"265","38.918345365","157.240.251.60","192.168.1.12","TLSv1.2","92","Application Data"
"266","38.918402100","192.168.1.12","157.240.251.60","TCP","56","57850  >  443 [RST] Seq=26 Win=0 Len=0"
"267","38.918726239","157.240.251.60","192.168.1.12","TCP","68","443  >  57850 [FIN, ACK] Seq=25 Ack=26 Win=275 Len=0 TSval=2028970996 TSecr=2946610296"
"268","38.918748320","192.168.1.12","157.240.251.60","TCP","56","57850  >  443 [RST] Seq=26 Win=0 Len=0"
"269","39.178683292","157.240.221.60","192.168.1.12","TLSv1.2","338","Application Data"
"270","39.178737284","192.168.1.12","157.240.221.60","TCP","68","42542  >  443 [ACK] Seq=518 Ack=3924 Win=1066 Len=0 TSval=1288289929 TSecr=3818595536"
"271","39.622441378","192.168.1.12","157.240.221.60","TLSv1.2","143","Application Data"
"272","39.794502848","157.240.221.60","192.168.1.12","TCP","68","443  >  42542 [ACK] Seq=3924 Ack=593 Win=931 Len=0 TSval=3818596153 TSecr=1288290372"
"273","40.028386896","2a00:a041:3c5d:4d00:c4e8:6181:3ac7:bd41","2600:1901:1:c36::","QUIC","1290","Protected Payload (KP0), DCID=ec520a4d71367b77"
"274","40.028449780","2a00:a041:3c5d:4d00:c4e8:6181:3ac7:bd41","2600:1901:1:c36::","QUIC","1294","Protected Payload (KP0), DCID=ec520a4d71367b77"
"275","40.028465219","2a00:a041:3c5d:4d00:c4e8:6181:3ac7:bd41","2600:1901:1:c36::","QUIC","1294","Protected Payload (KP0), DCID=ec520a4d71367b77"
"276","40.028476720","2a00:a041:3c5d:4d00:c4e8:6181:3ac7:bd41","2600:1901:1:c36::","QUIC","1294","Protected Payload (KP0), DCID=ec520a4d71367b77"
"277","40.028487917","2a00:a041:3c5d:4d00:c4e8:6181:3ac7:bd41","2600:1901:1:c36::","QUIC","1294","Protected Payload (KP0), DCID=ec520a4d71367b77"
"278","40.028499001","2a00:a041:3c5d:4d00:c4e8:6181:3ac7:bd41","2600:1901:1:c36::","QUIC","1294","Protected Payload (KP0), DCID=ec520a4d71367b77"
"279","40.028510477","2a00:a041:3c5d:4d00:c4e8:6181:3ac7:bd41","2600:1901:1:c36::","QUIC","1294","Protected Payload (KP0), DCID=ec520a4d71367b77"
"280","40.028522074","2a00:a041:3c5d:4d00:c4e8:6181:3ac7:bd41","2600:1901:1:c36::","QUIC","1294","Protected Payload (KP0), DCID=ec520a4d71367b77"
"281","40.028533166","2a00:a041:3c5d:4d00:c4e8:6181:3ac7:bd41","2600:1901:1:c36::","QUIC","1294","Protected Payload (KP0), DCID=ec520a4d71367b77"
"282","40.028544698","2a00:a041:3c5d:4d00:c4e8:6181:3ac7:bd41","2600:1901:1:c36::","QUIC","568","Protected Payload (KP0), DCID=ec520a4d71367b77"
"283","40.064411025","2600:1901:1:c36::","2a00:a041:3c5d:4d00:c4e8:6181:3ac7:bd41","QUIC","93","Protected Payload (KP0)"
"284","40.064436124","2600:1901:1:c36::","2a00:a041:3c5d:4d00:c4e8:6181:3ac7:bd41","QUIC","89","Protected Payload (KP0)"
"285","40.067573034","2600:1901:1:c36::","2a00:a041:3c5d:4d00:c4e8:6181:3ac7:bd41","QUIC","89","Protected Payload (KP0)"
"286","40.090026943","2a00:a041:3c5d:4d00:c4e8:6181:3ac7:bd41","2600:1901:1:c36::","QUIC","96","Protected Payload (KP0), DCID=ec520a4d71367b77"
"287","40.304830613","2600:1901:1:c36::","2a00:a041:3c5d:4d00:c4e8:6181:3ac7:bd41","QUIC","249","Protected Payload (KP0)"
"288","40.305167113","2a00:a041:3c5d:4d00:c4e8:6181:3ac7:bd41","2600:1901:1:c36::","QUIC","99","Protected Payload (KP0), DCID=ec520a4d71367b77"
"289","40.305285919","2600:1901:1:c36::","2a00:a041:3c5d:4d00:c4e8:6181:3ac7:bd41","QUIC","249","Protected Payload (KP0)"
"290","40.307009119","2a00:a041:3c5d:4d00:c4e8:6181:3ac7:bd41","2600:1901:1:c36::","QUIC","97","Protected Payload (KP0), DCID=ec520a4d71367b77"
"291","40.313921947","2a00:a041:3c5d:4d00:c4e8:6181:3ac7:bd41","2600:1901:1:c36::","QUIC","1290","Protected Payload (KP0), DCID=ec520a4d71367b77"
"292","40.313983931","2a00:a041:3c5d:4d00:c4e8:6181:3ac7:bd41","2600:1901:1:c36::","QUIC","1294","Protected Payload (KP0), DCID=ec520a4d71367b77"
"293","40.313998644","2a00:a041:3c5d:4d00:c4e8:6181:3ac7:bd41","2600:1901:1:c36::","QUIC","1294","Protected Payload (KP0), DCID=ec520a4d71367b77"
"294","40.314009495","2a00:a041:3c5d:4d00:c4e8:6181:3ac7:bd41","2600:1901:1:c36::","QUIC","1294","Protected Payload (KP0), DCID=ec520a4d71367b77"
"295","40.314026060","2a00:a041:3c5d:4d00:c4e8:6181:3ac7:bd41","2600:1901:1:c36::","QUIC","1294","Protected Payload (KP0), DCID=ec520a4d71367b77"
"296","40.314043307","2a00:a041:3c5d:4d00:c4e8:6181:3ac7:bd41","2600:1901:1:c36::","QUIC","1294","Protected Payload (KP0), DCID=ec520a4d71367b77"
"297","40.314054448","2a00:a041:3c5d:4d00:c4e8:6181:3ac7:bd41","2600:1901:1:c36::","QUIC","1294","Protected Payload (KP0), DCID=ec520a4d71367b77"
"298","40.314065537","2a00:a041:3c5d:4d00:c4e8:6181:3ac7:bd41","2600:1901:1:c36::","QUIC","1294","Protected Payload (KP0), DCID=ec520a4d71367b77"
"299","40.314077386","2a00:a041:3c5d:4d00:c4e8:6181:3ac7:bd41","2600:1901:1:c36::","QUIC","946","Protected Payload (KP0), DCID=ec520a4d71367b77"
"300","40.337720139","2600:1901:1:c36::","2a00:a041:3c5d:4d00:c4e8:6181:3ac7:bd41","QUIC","91","Protected Payload (KP0)"
"301","40.338054803","2600:1901:1:c36::","2a00:a041:3c5d:4d00:c4e8:6181:3ac7:bd41","QUIC","87","Protected Payload (KP0)"
"302","40.346193030","2600:1901:1:c36::","2a00:a041:3c5d:4d00:c4e8:6181:3ac7:bd41","QUIC","87","Protected Payload (KP0)"
"303","40.363735690","2a00:a041:3c5d:4d00:c4e8:6181:3ac7:bd41","2600:1901:1:c36::","QUIC","96","Protected Payload (KP0), DCID=ec520a4d71367b77"
"304","40.612025813","2600:1901:1:c36::","2a00:a041:3c5d:4d00:c4e8:6181:3ac7:bd41","QUIC","99","Protected Payload (KP0)"
"305","40.612366901","2a00:a041:3c5d:4d00:c4e8:6181:3ac7:bd41","2600:1901:1:c36::","QUIC","99","Protected Payload (KP0), DCID=ec520a4d71367b77"
"306","40.618424449","2600:1901:1:c36::","2a00:a041:3c5d:4d00:c4e8:6181:3ac7:bd41","QUIC","99","Protected Payload (KP0)"
"307","40.618650341","2a00:a041:3c5d:4d00:c4e8:6181:3ac7:bd41","2600:1901:1:c36::","QUIC","97","Protected Payload (KP0), DCID=ec520a4d71367b77"
"308","40.619404224","2a00:a041:3c5d:4d00:c4e8:6181:3ac7:bd41","2600:1901:1:c36::","QUIC","1290","Protected Payload (KP0), DCID=ec520a4d71367b77"
"309","40.619437890","2a00:a041:3c5d:4d00:c4e8:6181:3ac7:bd41","2600:1901:1:c36::","QUIC","1294","Protected Payload (KP0), DCID=ec520a4d71367b77"
"310","40.619449713","2a00:a041:3c5d:4d00:c4e8:6181:3ac7:bd41","2600:1901:1:c36::","QUIC","1294","Protected Payload (KP0), DCID=ec520a4d71367b77"
"311","40.619460307","2a00:a041:3c5d:4d00:c4e8:6181:3ac7:bd41","2600:1901:1:c36::","QUIC","1294","Protected Payload (KP0), DCID=ec520a4d71367b77"
"312","40.619470686","2a00:a041:3c5d:4d00:c4e8:6181:3ac7:bd41","2600:1901:1:c36::","QUIC","1294","Protected Payload (KP0), DCID=ec520a4d71367b77"
"313","40.619481298","2a00:a041:3c5d:4d00:c4e8:6181:3ac7:bd41","2600:1901:1:c36::","QUIC","881","Protected Payload (KP0), DCID=ec520a4d71367b77"
"314","40.640126809","2600:1901:1:c36::","2a00:a041:3c5d:4d00:c4e8:6181:3ac7:bd41","QUIC","91","Protected Payload (KP0)"
"315","40.640630858","2600:1901:1:c36::","2a00:a041:3c5d:4d00:c4e8:6181:3ac7:bd41","QUIC","87","Protected Payload (KP0)"
"316","40.643705359","2600:1901:1:c36::","2a00:a041:3c5d:4d00:c4e8:6181:3ac7:bd41","QUIC","87","Protected Payload (KP0)"
"317","40.666058549","2a00:a041:3c5d:4d00:c4e8:6181:3ac7:bd41","2600:1901:1:c36::","QUIC","96","Protected Payload (KP0), DCID=ec520a4d71367b77"
"318","40.919493411","2600:1901:1:c36::","2a00:a041:3c5d:4d00:c4e8:6181:3ac7:bd41","QUIC","128","Protected Payload (KP0)"
"319","40.919844352","2a00:a041:3c5d:4d00:c4e8:6181:3ac7:bd41","2600:1901:1:c36::","QUIC","99","Protected Payload (KP0), DCID=ec520a4d71367b77"
"320","40.932746610","2600:1901:1:c36::","2a00:a041:3c5d:4d00:c4e8:6181:3ac7:bd41","QUIC","128","Protected Payload (KP0)"
"321","40.932918958","2a00:a041:3c5d:4d00:c4e8:6181:3ac7:bd41","2600:1901:1:c36::","QUIC","97","Protected Payload (KP0), DCID=ec520a4d71367b77"
"322","40.962845212","2600:1901:1:c36::","2a00:a041:3c5d:4d00:c4e8:6181:3ac7:bd41","QUIC","88","Protected Payload (KP0)"
"323","44.210484758","192.168.1.12","157.240.221.60","TLSv1.2","137","Application Data"
"324","44.223103368","192.168.1.12","35.186.224.47","TLSv1.2","103","Application Data"
"325","44.238810447","35.186.224.47","192.168.1.12","TCP","68","443  >  51376 [ACK] Seq=32 Ack=71 Win=267 Len=0 TSval=255614347 TSecr=461370674"
"326","44.285679707","157.240.221.60","192.168.1.12","TCP","68","443  >  42542 [ACK] Seq=3924 Ack=662 Win=931 Len=0 TSval=3818600744 TSecr=1288294960"
"327","44.303541540","35.186.224.47","192.168.1.12","TLSv1.2","99","Application Data"
"328","44.303582452","192.168.1.12","35.186.224.47","TCP","68","51376  >  443 [ACK] Seq=71 Ack=63 Win=501 Len=0 TSval=461370754 TSecr=255614410"
"329","44.403510363","157.240.221.60","192.168.1.12","TLSv1.2","139","Application Data"
"330","44.403557220","192.168.1.12","157.240.221.60","TCP","68","42542  >  443 [ACK] Seq=662 Ack=3995 Win=1066 Len=0 TSval=1288295153 TSecr=3818600862"
"331","44.497102584","2a00:a041:3c5d:4d00:c4e8:6181:3ac7:bd41","2600:1901:0:524d::","TCP","88","41548  >  443 [ACK] Seq=1 Ack=1 Win=501 Len=0 TSval=1228472979 TSecr=2391618070"
"332","44.514165296","2600:1901:0:524d::","2a00:a041:3c5d:4d00:c4e8:6181:3ac7:bd41","TCP","88","[TCP ACKed unseen segment] 443  >  41548 [ACK] Seq=1 Ack=2 Win=269 Len=0 TSval=2391663123 TSecr=1228157160"
"333","46.244583305","192.168.1.10","224.0.0.251","MDNS","93","Standard query 0x0000 PTR _raop._tcp.local, ""QU"" question PTR _airplay._tcp.local, ""QU"" question"
"334","46.545241454","2a00:a041:3c5d:4d00:c4e8:6181:3ac7:bd41","2600:1901:1:c36::","TCP","88","[TCP Dup ACK 16#1] 42850  >  443 [ACK] Seq=1 Ack=1 Win=501 Len=0 TSval=591627902 TSecr=4160141409"
"335","46.589190393","2600:1901:1:c36::","2a00:a041:3c5d:4d00:c4e8:6181:3ac7:bd41","TCP","88","[TCP Dup ACK 17#1] [TCP ACKed unseen segment] 443  >  42850 [ACK] Seq=1 Ack=2 Win=268 Len=0 TSval=4160186468 TSecr=591311237"
"336","49.624121557","192.168.1.14","192.168.1.255","UDP","88","57621  >  57621 Len=44"
"337","52.693125634","2a00:a041:3c5d:4d00:c4e8:6181:3ac7:bd41","2600:1901:1:c36::","TCP","88","[TCP Dup ACK 35#1] 57540  >  443 [ACK] Seq=1 Ack=1 Win=501 Len=0 TSval=591634050 TSecr=379672407"
"338","56.280219100","192.168.1.10","224.0.0.251","MDNS","93","Standard query 0x0000 PTR _raop._tcp.local, ""QU"" question PTR _airplay._tcp.local, ""QU"" question"
"339","56.484553934","157.240.221.60","192.168.1.12","TLSv1.2","855","Application Data"
"340","56.484606014","192.168.1.12","157.240.221.60","TCP","68","42542  >  443 [ACK] Seq=662 Ack=4782 Win=1066 Len=0 TSval=1288307235 TSecr=3818612889"
"341","56.656216629","127.0.0.1","127.0.0.53","DNS","102","Standard query 0x7bb6 A media-fra5-1.cdn.whatsapp.net OPT"
"342","56.656240234","127.0.0.1","127.0.0.53","DNS","102","Standard query 0x50b9 AAAA media-fra5-1.cdn.whatsapp.net OPT"
"343","56.656563633","192.168.1.12","213.57.2.5","DNS","102","Standard query 0xdc1c A media-fra5-1.cdn.whatsapp.net OPT"
"344","56.656715939","192.168.1.12","213.57.2.5","DNS","102","Standard query 0xf035 AAAA media-fra5-1.cdn.whatsapp.net OPT"
"345","56.685803825","213.57.2.5","192.168.1.12","DNS","130","Standard query response 0xf035 AAAA media-fra5-1.cdn.whatsapp.net AAAA 2a03:2880:f276:cd:face:b00c:0:167 OPT"
"346","56.686054808","127.0.0.53","127.0.0.1","DNS","130","Standard query response 0x50b9 AAAA media-fra5-1.cdn.whatsapp.net AAAA 2a03:2880:f276:cd:face:b00c:0:167 OPT"
"347","56.688383618","213.57.2.5","192.168.1.12","DNS","118","Standard query response 0xdc1c A media-fra5-1.cdn.whatsapp.net A 157.240.251.60 OPT"
"348","56.688531074","127.0.0.53","127.0.0.1","DNS","118","Standard query response 0x7bb6 A media-fra5-1.cdn.whatsapp.net A 157.240.251.60 OPT"
"349","56.688917435","2a00:a041:3c5d:4d00:c4e8:6181:3ac7:bd41","2a03:2880:f276:cd:face:b00c:0:167","TCP","96","42540  >  443 [SYN] Seq=0 Win=64800 Len=0 MSS=1440 SACK_PERM=1 TSval=2592685963 TSecr=0 WS=128"
"350","56.824416143","192.168.1.12","157.240.221.60","TLSv1.2","143","Application Data"
"351","56.853139004","192.168.1.12","146.75.54.250","TCP","68","[TCP Dup ACK 44#1] 44504  >  443 [ACK] Seq=1 Ack=1 Win=501 Len=0 TSval=3805045841 TSecr=3558269793"
"352","56.865183169","192.168.1.12","151.101.242.248","TCP","68","[TCP Dup ACK 45#1] 55506  >  443 [ACK] Seq=1 Ack=1 Win=749 Len=0 TSval=650380020 TSecr=856111937"
"353","56.912695544","157.240.221.60","192.168.1.12","TCP","68","443  >  42542 [ACK] Seq=4782 Ack=737 Win=931 Len=0 TSval=3818613371 TSecr=1288307574"
"354","56.940058698","192.168.1.12","157.240.251.60","TCP","76","39012  >  443 [SYN] Seq=0 Win=64240 Len=0 MSS=1460 SACK_PERM=1 TSval=2946628391 TSecr=0 WS=128"
"355","56.941940322","146.75.54.250","192.168.1.12","TCP","68","[TCP Dup ACK 48#1] [TCP ACKed unseen segment] 443  >  44504 [ACK] Seq=1 Ack=2 Win=287 Len=0 TSval=3558314888 TSecr=3804726650"
"356","56.960374160","151.101.242.248","192.168.1.12","TCP","68","[TCP Dup ACK 49#1] [TCP ACKed unseen segment] 443  >  55506 [ACK] Seq=1 Ack=2 Win=288 Len=0 TSval=856157035 TSecr=650060752"
"357","57.015637822","157.240.251.60","192.168.1.12","TCP","76","443  >  39012 [SYN, ACK] Seq=0 Ack=1 Win=65535 Len=0 MSS=1392 SACK_PERM=1 TSval=606132518 TSecr=2946628391 WS=256"
"358","57.015687445","192.168.1.12","157.240.251.60","TCP","68","39012  >  443 [ACK] Seq=1 Ack=1 Win=64256 Len=0 TSval=2946628467 TSecr=606132518"
"359","57.016423020","192.168.1.12","157.240.251.60","TLSv1.3","762","Client Hello"
"360","57.093210856","157.240.251.60","192.168.1.12","TCP","68","443  >  39012 [ACK] Seq=1 Ack=695 Win=67072 Len=0 TSval=606132596 TSecr=2946628467"
"361","57.093665315","157.240.251.60","192.168.1.12","TCP","68","[TCP Dup ACK 360#1] 443  >  39012 [ACK] Seq=1 Ack=695 Win=67072 Len=0 TSval=606132596 TSecr=2946628467"
"362","57.095478400","157.240.251.60","192.168.1.12","TLSv1.3","233","Server Hello, Application Data"
"363","57.095518644","192.168.1.12","157.240.251.60","TCP","68","39012  >  443 [ACK] Seq=695 Ack=166 Win=64128 Len=0 TSval=2946628546 TSecr=606132597"
"364","57.095916543","192.168.1.12","157.240.251.60","TLSv1.3","74","Change Cipher Spec"
"365","57.096073742","192.168.1.12","157.240.251.60","TLSv1.3","126","Application Data"
"366","57.097875100","192.168.1.12","157.240.251.60","TLSv1.3","690","Application Data"
"367","57.173986626","157.240.251.60","192.168.1.12","TCP","68","443  >  39012 [ACK] Seq=166 Ack=1381 Win=68352 Len=0 TSval=606132676 TSecr=2946628547"
"368","57.174301484","157.240.251.60","192.168.1.12","TLSv1.3","237","Application Data"
"369","57.217090461","192.168.1.12","157.240.251.60","TCP","68","39012  >  443 [ACK] Seq=1381 Ack=335 Win=64128 Len=0 TSval=2946628668 TSecr=606132677"
"370","57.405667312","157.240.251.60","192.168.1.12","TLSv1.3","891","Application Data"
"371","57.405705621","192.168.1.12","157.240.251.60","TCP","68","39012  >  443 [ACK] Seq=1381 Ack=1158 Win=63360 Len=0 TSval=2946628857 TSecr=606132840"
"372","57.409950006","157.240.251.60","192.168.1.12","TLSv1.3","2828","Application Data"
"373","57.409950166","157.240.251.60","192.168.1.12","TLSv1.3","2828","Application Data [TCP segment of a reassembled PDU]"
"374","57.409950210","157.240.251.60","192.168.1.12","TLSv1.3","2828","Application Data [TCP segment of a reassembled PDU]"
"375","57.409950254","157.240.251.60","192.168.1.12","TCP","1448","443  >  39012 [ACK] Seq=9438 Ack=1381 Win=68352 Len=1380 TSval=606132841 TSecr=2946628668 [TCP segment of a reassembled PDU]"
"376","57.409984994","192.168.1.12","157.240.251.60","TCP","68","39012  >  443 [ACK] Seq=1381 Ack=3918 Win=61056 Len=0 TSval=2946628861 TSecr=606132841"
"377","57.410008022","192.168.1.12","157.240.251.60","TCP","68","39012  >  443 [ACK] Seq=1381 Ack=6678 Win=58368 Len=0 TSval=2946628861 TSecr=606132841"
"378","57.410014057","192.168.1.12","157.240.251.60","TCP","68","39012  >  443 [ACK] Seq=1381 Ack=9438 Win=55680 Len=0 TSval=2946628861 TSecr=606132841"
"379","57.410019714","192.168.1.12","157.240.251.60","TCP","68","39012  >  443 [ACK] Seq=1381 Ack=10818 Win=54400 Len=0 TSval=2946628861 TSecr=606132841"
"380","57.411130926","157.240.251.60","192.168.1.12","TLSv1.3","115","Application Data"
"381","57.411131040","157.240.251.60","192.168.1.12","TLSv1.3","2828","Application Data"
"382","57.411131081","157.240.251.60","192.168.1.12","TLSv1.3","1391","Application Data"
"383","57.411153039","192.168.1.12","157.240.251.60","TCP","68","39012  >  443 [ACK] Seq=1381 Ack=10865 Win=64128 Len=0 TSval=2946628862 TSecr=606132841"
"384","57.411164966","192.168.1.12","157.240.251.60","TCP","68","39012  >  443 [ACK] Seq=1381 Ack=13625 Win=61440 Len=0 TSval=2946628862 TSecr=606132843"
"385","57.411170686","192.168.1.12","157.240.251.60","TCP","68","39012  >  443 [ACK] Seq=1381 Ack=14948 Win=60160 Len=0 TSval=2946628862 TSecr=606132849"
"386","58.837170112","192.168.1.12","151.101.242.248","TCP","68","[TCP Dup ACK 46#1] 55520  >  443 [ACK] Seq=1 Ack=1 Win=501 Len=0 TSval=650381992 TSecr=3203087101"
"387","58.837194759","192.168.1.12","146.75.54.250","TCP","68","[TCP Dup ACK 47#1] 44520  >  443 [ACK] Seq=1 Ack=1 Win=501 Len=0 TSval=3805047825 TSecr=4139067418"
"388","58.869123863","192.168.1.12","151.101.242.248","TCP","68","[TCP Dup ACK 56#1] 55496  >  443 [ACK] Seq=1 Ack=1 Win=3538 Len=0 TSval=650382024 TSecr=2106297758"
"389","58.869151505","192.168.1.12","151.101.242.248","TCP","68","[TCP Dup ACK 59#1] 49324  >  443 [ACK] Seq=1 Ack=1 Win=501 Len=0 TSval=650382024 TSecr=3621351361"
"390","58.885169158","192.168.1.12","146.75.54.250","TCP","68","[TCP Dup ACK 57#1] 44502  >  443 [ACK] Seq=1 Ack=1 Win=501 Len=0 TSval=3805047873 TSecr=552880571"
"391","58.889177592","192.168.1.12","146.75.54.250","TCP","68","[TCP Dup ACK 58#1] 44528  >  443 [ACK] Seq=1 Ack=1 Win=501 Len=0 TSval=3805047877 TSecr=4038390306"
"392","58.924230468","151.101.242.248","192.168.1.12","TCP","68","[TCP Dup ACK 50#1] [TCP ACKed unseen segment] 443  >  55520 [ACK] Seq=1 Ack=2 Win=285 Len=0 TSval=3203134095 TSecr=650060868"
"393","58.927187526","146.75.54.250","192.168.1.12","TCP","68","[TCP Dup ACK 51#1] [TCP ACKed unseen segment] 443  >  44520 [ACK] Seq=1 Ack=2 Win=285 Len=0 TSval=4139114412 TSecr=3804726592"
"394","58.951280095","151.101.242.248","192.168.1.12","TCP","68","[TCP Dup ACK 60#1] [TCP ACKed unseen segment] 443  >  55496 [ACK] Seq=1 Ack=2 Win=302 Len=0 TSval=2106342846 TSecr=650289902"
"395","58.952507087","151.101.242.248","192.168.1.12","TCP","68","[TCP Dup ACK 61#1] [TCP ACKed unseen segment] 443  >  49324 [ACK] Seq=1 Ack=2 Win=285 Len=0 TSval=3621396450 TSecr=650063256"
"396","58.989477234","146.75.54.250","192.168.1.12","TCP","68","[TCP Dup ACK 62#1] [TCP ACKed unseen segment] 443  >  44502 [ACK] Seq=1 Ack=2 Win=287 Len=0 TSval=552925678 TSecr=3804726525"
"397","58.996495922","146.75.54.250","192.168.1.12","TCP","68","[TCP Dup ACK 63#1] [TCP ACKed unseen segment] 443  >  44528 [ACK] Seq=1 Ack=2 Win=285 Len=0 TSval=4038435420 TSecr=3804726594"
"398","60.274427459","fe80::e2ce:c3ff:fe1a:1978","ff02::1","ICMPv6","176","Router Advertisement from e0:ce:c3:1a:19:78"
"399","60.285315053","fe80::a8c:14f0:c17c:d903","ff02::16","ICMPv6","152","Multicast Listener Report Message v2"
"400","60.388394994","192.168.1.1","239.255.255.250","SSDP","386","NOTIFY * HTTP/1.1 "
"401","60.388395368","192.168.1.1","239.255.255.250","SSDP","442","NOTIFY * HTTP/1.1 "
"402","60.388395416","192.168.1.1","239.255.255.250","SSDP","370","NOTIFY * HTTP/1.1 "
"403","60.400707325","192.168.1.1","239.255.255.250","SSDP","362","NOTIFY * HTTP/1.1 "
"404","60.400707689","192.168.1.1","239.255.255.250","SSDP","406","NOTIFY * HTTP/1.1 "
"405","60.400707736","192.168.1.1","239.255.255.250","SSDP","382","NOTIFY * HTTP/1.1 "
"406","60.414902298","192.168.1.1","239.255.255.250","SSDP","436","NOTIFY * HTTP/1.1 "
"407","60.414902677","192.168.1.1","239.255.255.250","SSDP","434","NOTIFY * HTTP/1.1 "
"408","60.414902729","192.168.1.1","239.255.255.250","SSDP","438","NOTIFY * HTTP/1.1 "
"409","60.420478534","192.168.1.1","239.255.255.250","SSDP","430","NOTIFY * HTTP/1.1 "
"410","60.477994230","Chongqin_99:f9:45","","ARP","44","Who has 192.168.1.47? Tell 192.168.1.14"
"411","60.657163904","fe80::a8c:14f0:c17c:d903","ff02::16","ICMPv6","152","Multicast Listener Report Message v2"
"412","60.881179715","2a00:a041:3c5d:4d00:c4e8:6181:3ac7:bd41","2600:1901:1:c36::","TCP","88","[TCP Keep-Alive] 42892  >  443 [ACK] Seq=1720 Ack=123 Win=9924 Len=0 TSval=591642238 TSecr=1118164350"
"413","60.881209393","192.168.1.12","151.101.242.248","TCP","68","[TCP Dup ACK 66#1] 55454  >  443 [ACK] Seq=1 Ack=1 Win=1333 Len=0 TSval=650384036 TSecr=2876923394"
"414","60.881224054","192.168.1.12","151.101.242.248","TCP","68","[TCP Dup ACK 67#1] 49320  >  443 [ACK] Seq=1 Ack=1 Win=764 Len=0 TSval=650384036 TSecr=3469939795"
"415","60.881238377","192.168.1.12","146.75.54.248","TCP","68","[TCP Dup ACK 65#1] 48298  >  443 [ACK] Seq=1 Ack=1 Win=501 Len=0 TSval=621881301 TSecr=2314610307"
"416","60.885128792","192.168.1.12","146.75.54.248","TCP","68","[TCP Dup ACK 68#1] 48312  >  443 [ACK] Seq=1 Ack=1 Win=1133 Len=0 TSval=621881305 TSecr=1064994525"
"417","60.885160532","192.168.1.12","151.101.242.248","TCP","68","[TCP Dup ACK 64#1] 55466  >  443 [ACK] Seq=1 Ack=1 Win=501 Len=0 TSval=650384040 TSecr=414459261"
"418","60.901244648","2600:1901:1:c36::","2a00:a041:3c5d:4d00:c4e8:6181:3ac7:bd41","TCP","88","[TCP Keep-Alive ACK] 443  >  42892 [ACK] Seq=123 Ack=1721 Win=554 Len=0 TSval=1118210032 TSecr=591596553"
"419","60.949257116","192.168.1.12","151.101.242.248","TCP","68","[TCP Dup ACK 105#1] 55478  >  443 [ACK] Seq=1 Ack=1 Win=817 Len=0 TSval=650384104 TSecr=1888335184"
"420","60.961210303","192.168.1.12","151.101.242.248","TCP","68","[TCP Dup ACK 106#1] 55474  >  443 [ACK] Seq=1 Ack=1 Win=3172 Len=0 TSval=650384116 TSecr=2876925325"
"421","60.961237188","192.168.1.12","151.101.242.248","TCP","68","[TCP Dup ACK 107#1] 55492  >  443 [ACK] Seq=1 Ack=1 Win=885 Len=0 TSval=650384116 TSecr=717389031"
"422","60.971089500","146.75.54.248","192.168.1.12","TCP","68","[TCP Dup ACK 70#1] [TCP ACKed unseen segment] 443  >  48298 [ACK] Seq=1 Ack=2 Win=285 Len=0 TSval=2314657262 TSecr=621561561"
"423","60.977158465","151.101.242.248","192.168.1.12","TCP","68","[TCP Dup ACK 69#1] [TCP ACKed unseen segment] 443  >  55466 [ACK] Seq=1 Ack=2 Win=296 Len=0 TSval=414506222 TSecr=650064017"
"424","60.977672936","151.101.242.248","192.168.1.12","TCP","68","[TCP Dup ACK 71#1] [TCP ACKed unseen segment] 443  >  55454 [ACK] Seq=1 Ack=2 Win=296 Len=0 TSval=2876970342 TSecr=650064005"
"425","60.977676447","151.101.242.248","192.168.1.12","TCP","68","[TCP Dup ACK 72#1] [TCP ACKed unseen segment] 443  >  49320 [ACK] Seq=1 Ack=2 Win=288 Len=0 TSval=3469986743 TSecr=650063367"
"426","60.985249033","146.75.54.248","192.168.1.12","TCP","68","[TCP Dup ACK 73#1] [TCP ACKed unseen segment] 443  >  48312 [ACK] Seq=1 Ack=2 Win=288 Len=0 TSval=1065041479 TSecr=621561668"
"427","61.033265552","151.101.242.248","192.168.1.12","TCP","68","[TCP Dup ACK 108#1] [TCP ACKed unseen segment] 443  >  55478 [ACK] Seq=1 Ack=2 Win=294 Len=0 TSval=1888380270 TSecr=650064915"
"428","61.056085898","151.101.242.248","192.168.1.12","TCP","68","[TCP Dup ACK 110#1] [TCP ACKed unseen segment] 443  >  55474 [ACK] Seq=1 Ack=2 Win=302 Len=0 TSval=2876970422 TSecr=650064917"
"429","61.057472955","151.101.242.248","192.168.1.12","TCP","68","[TCP Dup ACK 109#1] [TCP ACKed unseen segment] 443  >  55492 [ACK] Seq=1 Ack=2 Win=296 Len=0 TSval=717434128 TSecr=650064895"
"430","62.929217853","2a00:a041:3c5d:4d00:c4e8:6181:3ac7:bd41","2600:1901:1:c36::","TCP","88","[TCP Dup ACK 113#1] 57544  >  443 [ACK] Seq=1 Ack=1 Win=501 Len=0 TSval=591644286 TSecr=3813078848"
"431","62.931607244","157.240.221.60","192.168.1.12","TCP","1448","443  >  42542 [ACK] Seq=4782 Ack=737 Win=931 Len=1380 TSval=3818619303 TSecr=1288307574 [TCP segment of a reassembled PDU]"
"432","62.931654230","192.168.1.12","157.240.221.60","TCP","68","42542  >  443 [ACK] Seq=737 Ack=6162 Win=1066 Len=0 TSval=1288313682 TSecr=3818619303"
"433","62.931988208","157.240.221.60","192.168.1.12","TLSv1.2","386","Application Data, Application Data"
"434","62.932001572","192.168.1.12","157.240.221.60","TCP","68","42542  >  443 [ACK] Seq=737 Ack=6480 Win=1066 Len=0 TSval=1288313682 TSecr=3818619303"
"435","62.936355703","Chongqin_99:f9:45","","ARP","44","Who has 192.168.1.47? Tell 192.168.1.14"
"436","62.955890876","2600:1901:1:c36::","2a00:a041:3c5d:4d00:c4e8:6181:3ac7:bd41","TCP","88","[TCP Dup ACK 114#1] [TCP ACKed unseen segment] 443  >  57544 [ACK] Seq=1 Ack=2 Win=286 Len=0 TSval=3813124935 TSecr=591553115"
"437","63.247923855","157.240.221.60","192.168.1.12","TLSv1.2","161","Application Data"
"438","63.247963903","192.168.1.12","157.240.221.60","TCP","68","42542  >  443 [ACK] Seq=737 Ack=6573 Win=1066 Len=0 TSval=1288313998 TSecr=3818619662"
"439","63.399116302","192.168.1.12","157.240.221.60","TLSv1.2","160","Application Data"
"440","63.463016370","192.168.1.12","157.240.221.60","TLSv1.2","161","Application Data"
"441","63.474735867","157.240.221.60","192.168.1.12","TCP","68","443  >  42542 [ACK] Seq=6573 Ack=829 Win=931 Len=0 TSval=3818619933 TSecr=1288314149"
"442","63.539622252","157.240.221.60","192.168.1.12","TCP","68","443  >  42542 [ACK] Seq=6573 Ack=922 Win=931 Len=0 TSval=3818619997 TSecr=1288314213"
"443","63.640757333","2a00:a041:3c5d:4d00:c4e8:6181:3ac7:bd41","2600:1901:1:a98::","TLSv1.2","131","Application Data"
"444","63.659726407","2600:1901:1:a98::","2a00:a041:3c5d:4d00:c4e8:6181:3ac7:bd41","TCP","88","443  >  57558 [ACK] Seq=81 Ack=130 Win=268 Len=0 TSval=122232002 TSecr=3829532962"
"445","63.725515027","2600:1901:1:a98::","2a00:a041:3c5d:4d00:c4e8:6181:3ac7:bd41","TLSv1.2","128","Application Data"
"446","63.725546706","2a00:a041:3c5d:4d00:c4e8:6181:3ac7:bd41","2600:1901:1:a98::","TCP","88","57558  >  443 [ACK] Seq=130 Ack=121 Win=501 Len=0 TSval=3829533046 TSecr=122232058"
"447","63.959785369","Chongqin_99:f9:45","","ARP","44","Who has 192.168.1.47? Tell 192.168.1.14"
"448","63.999962109","fe80::a8c:14f0:c17c:d903","ff02::2","ICMPv6","64","Router Solicitation"
"449","64.370255910","fe80::e2ce:c3ff:fe1a:1978","ff02::1","ICMPv6","176","Router Advertisement from e0:ce:c3:1a:19:78"
"450","64.381115841","fe80::a8c:14f0:c17c:d903","ff02::16","ICMPv6","152","Multicast Listener Report Message v2"
"451","64.593255201","fe80::a8c:14f0:c17c:d903","ff02::16","ICMPv6","152","Multicast Listener Report Message v2"
"452","64.983883195","Chongqin_99:f9:45","","ARP","44","Who has 192.168.1.47? Tell 192.168.1.14"
"453","66.213436903","192.168.1.10","224.0.0.251","MDNS","93","Standard query 0x0000 PTR _raop._tcp.local, ""QU"" question PTR _airplay._tcp.local, ""QU"" question"
"454","66.929312494","Chongqin_99:f9:45","","ARP","44","Who has 192.168.1.47? Tell 192.168.1.14"
"455","67.025135210","2a00:a041:3c5d:4d00:c4e8:6181:3ac7:bd41","2600:1901:1:5ca::","TCP","88","[TCP Dup ACK 135#1] 51966  >  443 [ACK] Seq=1 Ack=1 Win=501 Len=0 TSval=3979038710 TSecr=498905175"
"456","67.025161177","2a00:a041:3c5d:4d00:c4e8:6181:3ac7:bd41","2a00:a040:3:6::d539:18ca","TCP","88","[TCP Dup ACK 136#1] 36194  >  443 [ACK] Seq=1 Ack=1 Win=8684 Len=0 TSval=3057333682 TSecr=64780592"
"457","67.039881674","2a00:a040:3:6::d539:18ca","2a00:a041:3c5d:4d00:c4e8:6181:3ac7:bd41","TCP","88","[TCP Dup ACK 139#1] [TCP ACKed unseen segment] 443  >  36194 [ACK] Seq=1 Ack=2 Win=501 Len=0 TSval=64825647 TSecr=3057242261"
"458","67.044589377","2600:1901:1:5ca::","2a00:a041:3c5d:4d00:c4e8:6181:3ac7:bd41","TCP","88","[TCP Dup ACK 140#1] [TCP ACKed unseen segment] 443  >  51966 [ACK] Seq=1 Ack=2 Win=337 Len=0 TSval=498950229 TSecr=3978947762"
"459","67.057210075","192.168.1.12","146.75.122.250","TCP","68","[TCP Dup ACK 137#1] 45536  >  443 [ACK] Seq=1 Ack=1 Win=501 Len=0 TSval=1947095146 TSecr=3497745504"
"460","67.057240538","192.168.1.12","146.75.122.250","TCP","68","[TCP Dup ACK 138#1] 45546  >  443 [ACK] Seq=1 Ack=1 Win=501 Len=0 TSval=1947095146 TSecr=2554287518"
"461","67.142501343","146.75.122.250","192.168.1.12","TCP","68","[TCP Dup ACK 141#1] [TCP ACKed unseen segment] 443  >  45536 [ACK] Seq=1 Ack=2 Win=287 Len=0 TSval=3497790590 TSecr=1946774554"
"462","67.143410593","146.75.122.250","192.168.1.12","TCP","68","[TCP Dup ACK 142#1] [TCP ACKed unseen segment] 443  >  45546 [ACK] Seq=1 Ack=2 Win=285 Len=0 TSval=2554332604 TSecr=1946774514"
"463","67.953228424","Chongqin_99:f9:45","","ARP","44","Who has 192.168.1.47? Tell 192.168.1.14"
"464","68.977253427","Chongqin_99:f9:45","","ARP","44","Who has 192.168.1.47? Tell 192.168.1.14"
"465","69.763284296","192.168.1.12","192.168.1.255","UDP","88","57621  >  57621 Len=44"
"466","71.303783041","192.168.1.12","157.240.221.60","TLSv1.2","137","Application Data"
"467","71.376675821","157.240.221.60","192.168.1.12","TCP","68","443  >  42542 [ACK] Seq=6573 Ack=991 Win=931 Len=0 TSval=3818627835 TSecr=1288322054"
"468","71.536729039","157.240.221.60","192.168.1.12","TLSv1.2","139","Application Data"
"469","71.536767008","192.168.1.12","157.240.221.60","TCP","68","42542  >  443 [ACK] Seq=991 Ack=6644 Win=1066 Len=0 TSval=1288322287 TSecr=3818627954"
"470","73.225216491","2a00:a041:3c5d:4d00:c4e8:6181:3ac7:bd41","2600:1900:4110:86f::","TCP","88","[TCP Dup ACK 156#1] 33264  >  80 [ACK] Seq=1 Ack=1 Win=12299 Len=0 TSval=1670656709 TSecr=3810392153"
"471","73.284659757","2600:1900:4110:86f::","2a00:a041:3c5d:4d00:c4e8:6181:3ac7:bd41","TCP","88","[TCP Dup ACK 157#1] [TCP ACKed unseen segment] 80  >  33264 [ACK] Seq=1 Ack=2 Win=261 Len=0 TSval=3810437213 TSecr=1670251120"
"472","75.019280979","Chongqin_99:f9:45","","ARP","44","Who has 192.168.1.47? Tell 192.168.1.14"
"473","75.194825909","192.168.1.12","35.186.224.47","TLSv1.2","103","Application Data"
"474","75.217557044","35.186.224.47","192.168.1.12","TCP","68","443  >  51376 [ACK] Seq=63 Ack=106 Win=267 Len=0 TSval=255645326 TSecr=461401646"
"475","75.279778803","35.186.224.47","192.168.1.12","TLSv1.2","99","Application Data"
"476","75.279822026","192.168.1.12","35.186.224.47","TCP","68","51376  >  443 [ACK] Seq=106 Ack=94 Win=501 Len=0 TSval=461401731 TSecr=255645389"
"477","75.940635995","Chongqin_99:f9:45","","ARP","44","Who has 192.168.1.47? Tell 192.168.1.14"
"478","76.248385577","192.168.1.10","224.0.0.251","MDNS","93","Standard query 0x0000 PTR _raop._tcp.local, ""QU"" question PTR _airplay._tcp.local, ""QU"" question"
"479","76.964814023","Chongqin_99:f9:45","","ARP","44","Who has 192.168.1.47? Tell 192.168.1.14"
"480","79.313125561","192.168.1.12","35.188.42.15","TCP","68","[TCP Dup ACK 230#1] 41906  >  443 [ACK] Seq=1 Ack=1 Win=501 Len=0 TSval=3100702745 TSecr=3641187497"
"481","80.550807901","fe80::e2ce:c3ff:fe1a:1978","ff02::1","ICMPv6","176","Router Advertisement from e0:ce:c3:1a:19:78"
"482","80.561199448","fe80::a8c:14f0:c17c:d903","ff02::16","ICMPv6","152","Multicast Listener Report Message v2"
"483","81.361236864","192.168.1.12","146.75.54.248","TCP","68","[TCP Dup ACK 238#1] 48262  >  443 [ACK] Seq=1 Ack=1 Win=4531 Len=0 TSval=621901781 TSecr=1065014939"
"484","81.361267575","192.168.1.12","146.75.54.248","TCP","68","[TCP Dup ACK 234#1] 48220  >  443 [ACK] Seq=1 Ack=1 Win=501 Len=0 TSval=621901781 TSecr=3630003824"
"485","81.361284999","192.168.1.12","146.75.54.248","TCP","68","[TCP Dup ACK 236#1] 48284  >  443 [ACK] Seq=1 Ack=1 Win=2720 Len=0 TSval=621901781 TSecr=3695445279"
"486","81.361295763","192.168.1.12","146.75.54.248","TCP","68","[TCP Dup ACK 237#1] 48274  >  443 [ACK] Seq=1 Ack=1 Win=3980 Len=0 TSval=621901781 TSecr=3762959586"
"487","81.361306354","192.168.1.12","146.75.54.248","TCP","68","[TCP Dup ACK 235#1] 48250  >  443 [ACK] Seq=1 Ack=1 Win=501 Len=0 TSval=621901781 TSecr=1337545513"
"488","81.425242820","fe80::a8c:14f0:c17c:d903","ff02::16","ICMPv6","152","Multicast Listener Report Message v2"
"489","81.450218173","146.75.54.248","192.168.1.12","TCP","68","[TCP Dup ACK 239#1] [TCP ACKed unseen segment] 443  >  48220 [ACK] Seq=1 Ack=2 Win=288 Len=0 TSval=3630050864 TSecr=621581607"
"490","81.451536265","146.75.54.248","192.168.1.12","TCP","68","[TCP Dup ACK 240#1] [TCP ACKed unseen segment] 443  >  48250 [ACK] Seq=1 Ack=2 Win=288 Len=0 TSval=1337592554 TSecr=621581523"
"491","81.459101316","146.75.54.248","192.168.1.12","TCP","68","[TCP Dup ACK 246#1] [TCP ACKed unseen segment] 443  >  48262 [ACK] Seq=1 Ack=2 Win=297 Len=0 TSval=1065061954 TSecr=621581353"
"492","81.459939351","146.75.54.248","192.168.1.12","TCP","68","[TCP Dup ACK 247#1] [TCP ACKed unseen segment] 443  >  48274 [ACK] Seq=1 Ack=2 Win=300 Len=0 TSval=3763006600 TSecr=621581301"
"493","81.461183315","146.75.54.248","192.168.1.12","TCP","68","[TCP Dup ACK 248#1] [TCP ACKed unseen segment] 443  >  48284 [ACK] Seq=1 Ack=2 Win=300 Len=0 TSval=3695492293 TSecr=621581357"
"494","83.409190412","192.168.1.12","146.75.54.248","TCP","68","[TCP Dup ACK 255#1] 48234  >  443 [ACK] Seq=1 Ack=1 Win=1787 Len=0 TSval=621903829 TSecr=1264945777"
"495","83.565187790","192.168.1.12","151.101.242.248","TCP","68","[TCP Dup ACK 261#1] 54132  >  443 [ACK] Seq=1 Ack=1 Win=1115 Len=0 TSval=650406720 TSecr=1082364375"
"496","83.567486061","146.75.54.248","192.168.1.12","TCP","68","[TCP Dup ACK 256#1] [TCP ACKed unseen segment] 443  >  48234 [ACK] Seq=1 Ack=2 Win=290 Len=0 TSval=1264992807 TSecr=621581397"
"497","83.661883111","151.101.242.248","192.168.1.12","TCP","68","[TCP Dup ACK 262#1] [TCP ACKed unseen segment] 443  >  54132 [ACK] Seq=1 Ack=2 Win=287 Len=0 TSval=1082409515 TSecr=650087215"
"498","86.181411419","192.168.1.14","192.168.1.255","UDP","88","57621  >  57621 Len=44"
"499","86.283409283","192.168.1.10","224.0.0.251","MDNS","93","Standard query 0x0000 PTR _raop._tcp.local, ""QU"" question PTR _airplay._tcp.local, ""QU"" question"
"500","89.150325535","104.199.65.124","192.168.1.12","TCP","79","4070  >  37320 [PSH, ACK] Seq=1112 Ack=4712 Win=16 Len=11 TSval=3368596837 TSecr=3260751367"
"501","89.150371177","192.168.1.12","104.199.65.124","TCP","68","37320  >  4070 [ACK] Seq=4712 Ack=1123 Win=501 Len=0 TSval=3260810100 TSecr=3368596837"
"502","89.357334324","192.168.1.12","239.255.255.250","SSDP","212","M-SEARCH * HTTP/1.1 "
"503","89.553202398","2a00:a041:3c5d:4d00:c4e8:6181:3ac7:bd41","2600:1901:0:524d::","TCP","88","[TCP Dup ACK 331#1] 41548  >  443 [ACK] Seq=1 Ack=1 Win=501 Len=0 TSval=1228518035 TSecr=2391663123"
"504","89.569217501","2600:1901:0:524d::","2a00:a041:3c5d:4d00:c4e8:6181:3ac7:bd41","TCP","88","[TCP Dup ACK 332#1] [TCP ACKed unseen segment] 443  >  41548 [ACK] Seq=1 Ack=2 Win=269 Len=0 TSval=2391708180 TSecr=1228157160"
"505","90.174075716","192.168.1.18","192.168.1.12","SSDP","323","HTTP/1.1 200 OK "
"506","90.358664029","192.168.1.12","239.255.255.250","SSDP","212","M-SEARCH * HTTP/1.1 "
"507","90.391491922","192.168.1.1","239.255.255.250","SSDP","386","NOTIFY * HTTP/1.1 "
"508","90.391492176","192.168.1.1","239.255.255.250","SSDP","442","NOTIFY * HTTP/1.1 "
"509","90.391492243","192.168.1.1","239.255.255.250","SSDP","370","NOTIFY * HTTP/1.1 "
"510","90.402920639","192.168.1.1","239.255.255.250","SSDP","362","NOTIFY * HTTP/1.1 "
"511","90.402921003","192.168.1.1","239.255.255.250","SSDP","406","NOTIFY * HTTP/1.1 "
"512","90.402921051","192.168.1.1","239.255.255.250","SSDP","382","NOTIFY * HTTP/1.1 "
"513","90.416649198","192.168.1.1","239.255.255.250","SSDP","436","NOTIFY * HTTP/1.1 "
"514","90.416649569","192.168.1.1","239.255.255.250","SSDP","434","NOTIFY * HTTP/1.1 "
"515","90.416649619","192.168.1.1","239.255.255.250","SSDP","438","NOTIFY * HTTP/1.1 "
"516","90.421345045","192.168.1.1","239.255.255.250","SSDP","430","NOTIFY * HTTP/1.1 "
"517","90.993228808","192.168.1.18","192.168.1.12","SSDP","323","HTTP/1.1 200 OK "
"518","91.360059144","192.168.1.12","239.255.255.250","SSDP","212","M-SEARCH * HTTP/1.1 "
"519","91.605178386","2a00:a041:3c5d:4d00:c4e8:6181:3ac7:bd41","2600:1901:1:c36::","TCP","88","[TCP Dup ACK 16#2] 42850  >  443 [ACK] Seq=1 Ack=1 Win=501 Len=0 TSval=591672962 TSecr=4160186468"
"520","91.610832274","192.168.1.10","239.255.255.250","SSDP","360","NOTIFY * HTTP/1.1 "
"521","91.635607507","2600:1901:1:c36::","2a00:a041:3c5d:4d00:c4e8:6181:3ac7:bd41","TCP","88","[TCP Dup ACK 17#2] [TCP ACKed unseen segment] 443  >  42850 [ACK] Seq=1 Ack=2 Win=268 Len=0 TSval=4160231528 TSecr=591311237"
"522","91.824869643","192.168.1.10","239.255.255.250","SSDP","351","NOTIFY * HTTP/1.1 "
"523","91.824869994","192.168.1.10","239.255.255.250","SSDP","403","NOTIFY * HTTP/1.1 "
"524","91.824870044","192.168.1.10","239.255.255.250","SSDP","417","NOTIFY * HTTP/1.1 "
"525","91.826667522","192.168.1.10","239.255.255.250","SSDP","415","NOTIFY * HTTP/1.1 "
"526","91.923882697","192.168.1.10","239.255.255.250","SSDP","431","NOTIFY * HTTP/1.1 "
"527","91.923883078","192.168.1.10","239.255.255.250","SSDP","360","NOTIFY * HTTP/1.1 "
"528","91.923883126","fe80::e2ce:c3ff:fe1a:1978","ff02::1","ICMPv6","176","Router Advertisement from e0:ce:c3:1a:19:78"
"529","91.933099442","fe80::a8c:14f0:c17c:d903","ff02::16","ICMPv6","152","Multicast Listener Report Message v2"
"530","92.025606115","192.168.1.10","239.255.255.250","SSDP","351","NOTIFY * HTTP/1.1 "
"531","92.025606454","192.168.1.10","239.255.255.250","SSDP","403","NOTIFY * HTTP/1.1 "
"532","92.125962360","192.168.1.10","239.255.255.250","SSDP","360","NOTIFY * HTTP/1.1 "
"533","92.125962602","192.168.1.10","239.255.255.250","SSDP","351","NOTIFY * HTTP/1.1 "
"534","92.224875745","192.168.1.10","239.255.255.250","SSDP","383","NOTIFY * HTTP/1.1 "
"535","92.324464690","192.168.1.18","192.168.1.12","SSDP","323","HTTP/1.1 200 OK "
"536","92.360853130","192.168.1.12","239.255.255.250","SSDP","212","M-SEARCH * HTTP/1.1 "
"537","92.529189549","fe80::a8c:14f0:c17c:d903","ff02::16","ICMPv6","152","Multicast Listener Report Message v2"
"538","93.264652646","192.168.1.18","192.168.1.12","SSDP","323","HTTP/1.1 200 OK "
"539","93.726600495","2a00:a041:3c5d:4d00:c4e8:6181:3ac7:bd41","2600:1901:1:a98::","TLSv1.2","131","Application Data"
"540","93.745993949","2600:1901:1:a98::","2a00:a041:3c5d:4d00:c4e8:6181:3ac7:bd41","TCP","88","443  >  57558 [ACK] Seq=121 Ack=173 Win=268 Len=0 TSval=122262090 TSecr=3829563048"
"541","93.803202068","2600:1901:1:a98::","2a00:a041:3c5d:4d00:c4e8:6181:3ac7:bd41","TLSv1.2","128","Application Data"
"542","93.803237204","2a00:a041:3c5d:4d00:c4e8:6181:3ac7:bd41","2600:1901:1:a98::","TCP","88","57558  >  443 [ACK] Seq=173 Ack=161 Win=501 Len=0 TSval=3829563124 TSecr=122262146"
"543","94.167956943","157.240.221.60","192.168.1.12","TLSv1.2","256","Application Data"
"544","94.168003995","192.168.1.12","157.240.221.60","TCP","68","42542  >  443 [ACK] Seq=991 Ack=6832 Win=1066 Len=0 TSval=1288344918 TSecr=3818650616"
"545","95.034406479","192.168.1.12","157.240.221.60","TLSv1.2","139","Application Data"
"546","95.107357539","157.240.221.60","192.168.1.12","TCP","68","443  >  42542 [ACK] Seq=6832 Ack=1062 Win=931 Len=0 TSval=3818651566 TSecr=1288345784"
"547","95.163098817","Roku_83:14:62","","ARP","62","Who has 192.168.1.12? Tell 192.168.1.18"
"548","95.163114929","IntelCor_eb:49:20","","ARP","44","192.168.1.12 is at b0:7d:64:eb:49:20"
"549","96.216440139","192.168.1.10","224.0.0.251","MDNS","93","Standard query 0x0000 PTR _raop._tcp.local, ""QU"" question PTR _airplay._tcp.local, ""QU"" question"
"550","97.745130468","2a00:a041:3c5d:4d00:c4e8:6181:3ac7:bd41","2600:1901:1:c36::","TCP","88","[TCP Dup ACK 35#2] 57540  >  443 [ACK] Seq=1 Ack=1 Win=501 Len=0 TSval=591679102 TSecr=379672407"
"551","97.763958738","2600:1901:1:c36::","2a00:a041:3c5d:4d00:c4e8:6181:3ac7:bd41","TCP","88","[TCP Dup ACK 36#1] [TCP ACKed unseen segment] 443  >  57540 [ACK] Seq=1 Ack=2 Win=298 Len=0 TSval=379762513 TSecr=591318511"
"552","99.799928983","157.240.221.60","192.168.1.12","TCP","1448","443  >  42542 [ACK] Seq=6832 Ack=1062 Win=931 Len=1380 TSval=3818656217 TSecr=1288345784 [TCP segment of a reassembled PDU]"
"553","99.799975129","192.168.1.12","157.240.221.60","TCP","68","42542  >  443 [ACK] Seq=1062 Ack=8212 Win=1066 Len=0 TSval=1288350550 TSecr=3818656217"
"554","99.801116607","157.240.221.60","192.168.1.12","TLSv1.2","386","Application Data, Application Data"
"555","99.801132050","192.168.1.12","157.240.221.60","TCP","68","42542  >  443 [ACK] Seq=1062 Ack=8530 Win=1066 Len=0 TSval=1288350551 TSecr=3818656217"
"556","100.415225390","Chongqin_99:f9:45","","ARP","44","Who has 192.168.1.112? Tell 192.168.1.14"
"557","100.415225724","Chongqin_99:f9:45","","ARP","44","Who has 192.168.1.50? Tell 192.168.1.14"
"558","100.744777176","192.168.1.12","157.240.221.60","TLSv1.2","161","Application Data"
"559","100.817137456","157.240.221.60","192.168.1.12","TCP","68","443  >  42542 [ACK] Seq=8530 Ack=1155 Win=931 Len=0 TSval=3818657275 TSecr=1288351495"
"560","100.892682099","157.240.221.60","192.168.1.12","TLSv1.2","161","Application Data"
"561","100.892721925","192.168.1.12","157.240.221.60","TCP","68","42542  >  443 [ACK] Seq=1155 Ack=8623 Win=1066 Len=0 TSval=1288351643 TSecr=3818657351"
"562","100.895857625","192.168.1.12","157.240.221.60","TLSv1.2","160","Application Data"
"563","100.933219832","192.168.1.12","157.240.221.60","TLSv1.2","137","Application Data"
"564","100.971571012","157.240.221.60","192.168.1.12","TCP","68","443  >  42542 [ACK] Seq=8623 Ack=1247 Win=931 Len=0 TSval=3818657429 TSecr=1288351646"
"565","101.004982253","157.240.221.60","192.168.1.12","TCP","68","443  >  42542 [ACK] Seq=8623 Ack=1316 Win=931 Len=0 TSval=3818657463 TSecr=1288351683"
"566","101.233720836","157.240.221.60","192.168.1.12","TLSv1.2","139","Application Data"
"567","101.277213215","192.168.1.12","157.240.221.60","TCP","68","42542  >  443 [ACK] Seq=1316 Ack=8694 Win=1066 Len=0 TSval=1288352027 TSecr=3818657581"
"568","102.975220615","Chongqin_99:f9:45","","ARP","44","Who has 192.168.1.112? Tell 192.168.1.14"
"569","102.975221027","Chongqin_99:f9:45","","ARP","44","Who has 192.168.1.50? Tell 192.168.1.14"
"570","103.889215004","192.168.1.12","146.75.54.250","TCP","68","[TCP Dup ACK 44#2] 44504  >  443 [ACK] Seq=1 Ack=1 Win=501 Len=0 TSval=3805092877 TSecr=3558314888"
"571","103.889248266","192.168.1.12","151.101.242.248","TCP","68","[TCP Dup ACK 45#2] 55506  >  443 [ACK] Seq=1 Ack=1 Win=749 Len=0 TSval=650427044 TSecr=856157035"
"572","103.898728967","Chongqin_99:f9:45","","ARP","44","Who has 192.168.1.112? Tell 192.168.1.14"
"573","103.898729324","Chongqin_99:f9:45","","ARP","44","Who has 192.168.1.50? Tell 192.168.1.14"
"574","103.925132916","192.168.1.12","151.101.242.248","TCP","68","[TCP Dup ACK 46#2] 55520  >  443 [ACK] Seq=1 Ack=1 Win=501 Len=0 TSval=650427080 TSecr=3203134095"
"575","103.929164252","192.168.1.12","146.75.54.250","TCP","68","[TCP Dup ACK 47#2] 44520  >  443 [ACK] Seq=1 Ack=1 Win=501 Len=0 TSval=3805092917 TSecr=4139114412"
"576","103.953201147","192.168.1.12","151.101.242.248","TCP","68","[TCP Dup ACK 56#2] 55496  >  443 [ACK] Seq=1 Ack=1 Win=3538 Len=0 TSval=650427108 TSecr=2106342846"
"577","103.953231677","192.168.1.12","151.101.242.248","TCP","68","[TCP Dup ACK 59#2] 49324  >  443 [ACK] Seq=1 Ack=1 Win=501 Len=0 TSval=650427108 TSecr=3621396450"
"578","103.977202293","146.75.54.250","192.168.1.12","TCP","68","[TCP Dup ACK 48#2] [TCP ACKed unseen segment] 443  >  44504 [ACK] Seq=1 Ack=2 Win=287 Len=0 TSval=3558361923 TSecr=3804726650"
"579","103.985605310","151.101.242.248","192.168.1.12","TCP","68","[TCP Dup ACK 49#2] [TCP ACKed unseen segment] 443  >  55506 [ACK] Seq=1 Ack=2 Win=288 Len=0 TSval=856204061 TSecr=650060752"
"580","103.993171789","192.168.1.12","146.75.54.250","TCP","68","[TCP Dup ACK 57#2] 44502  >  443 [ACK] Seq=1 Ack=1 Win=501 Len=0 TSval=3805092981 TSecr=552925678"
"581","104.009178686","151.101.242.248","192.168.1.12","TCP","68","[TCP Dup ACK 50#2] [TCP ACKed unseen segment] 443  >  55520 [ACK] Seq=1 Ack=2 Win=285 Len=0 TSval=3203179181 TSecr=650060868"
"582","104.018943360","146.75.54.250","192.168.1.12","TCP","68","[TCP Dup ACK 51#2] [TCP ACKed unseen segment] 443  >  44520 [ACK] Seq=1 Ack=2 Win=285 Len=0 TSval=4139159504 TSecr=3804726592"
"583","104.049121284","151.101.242.248","192.168.1.12","TCP","68","[TCP Dup ACK 60#2] [TCP ACKed unseen segment] 443  >  55496 [ACK] Seq=1 Ack=2 Win=302 Len=0 TSval=2106387935 TSecr=650289902"
"584","104.049297218","151.101.242.248","192.168.1.12","TCP","68","[TCP Dup ACK 61#2] [TCP ACKed unseen segment] 443  >  49324 [ACK] Seq=1 Ack=2 Win=285 Len=0 TSval=3621441538 TSecr=650063256"
"585","104.097699172","146.75.54.250","192.168.1.12","TCP","68","[TCP Dup ACK 62#2] [TCP ACKed unseen segment] 443  >  44502 [ACK] Seq=1 Ack=2 Win=287 Len=0 TSval=552970786 TSecr=3804726525"
"586","104.920950916","Chongqin_99:f9:45","","ARP","44","Who has 192.168.1.112? Tell 192.168.1.14"
"587","104.920951283","Chongqin_99:f9:45","","ARP","44","Who has 192.168.1.50? Tell 192.168.1.14"
"588","105.937137333","2a00:a041:3c5d:4d00:c4e8:6181:3ac7:bd41","2600:1901:1:c36::","TCP","88","[TCP Keep-Alive] 42892  >  443 [ACK] Seq=1720 Ack=123 Win=9924 Len=0 TSval=591687294 TSecr=1118210032"
"589","105.937173562","192.168.1.12","146.75.54.250","TCP","68","[TCP Dup ACK 58#2] 44528  >  443 [ACK] Seq=1 Ack=1 Win=501 Len=0 TSval=3805094925 TSecr=4038435420"
"590","105.955865688","2600:1901:1:c36::","2a00:a041:3c5d:4d00:c4e8:6181:3ac7:bd41","TCP","88","[TCP Keep-Alive ACK] 443  >  42892 [ACK] Seq=123 Ack=1721 Win=554 Len=0 TSval=1118255086 TSecr=591596553"
"591","105.973171181","192.168.1.12","146.75.54.248","TCP","68","[TCP Dup ACK 65#2] 48298  >  443 [ACK] Seq=1 Ack=1 Win=501 Len=0 TSval=621926393 TSecr=2314657262"
"592","105.981227810","192.168.1.12","151.101.242.248","TCP","68","[TCP Dup ACK 67#2] 49320  >  443 [ACK] Seq=1 Ack=1 Win=764 Len=0 TSval=650429136 TSecr=3469986743"
"593","105.981254436","192.168.1.12","151.101.242.248","TCP","68","[TCP Dup ACK 66#2] 55454  >  443 [ACK] Seq=1 Ack=1 Win=1333 Len=0 TSval=650429136 TSecr=2876970342"
"594","105.981269716","192.168.1.12","151.101.242.248","TCP","68","[TCP Dup ACK 64#2] 55466  >  443 [ACK] Seq=1 Ack=1 Win=501 Len=0 TSval=650429136 TSecr=414506222"
"595","105.989120689","192.168.1.12","146.75.54.248","TCP","68","[TCP Dup ACK 68#2] 48312  >  443 [ACK] Seq=1 Ack=1 Win=1133 Len=0 TSval=621926409 TSecr=1065041479"
"596","106.042754594","146.75.54.250","192.168.1.12","TCP","68","[TCP Dup ACK 63#2] [TCP ACKed unseen segment] 443  >  44528 [ACK] Seq=1 Ack=2 Win=285 Len=0 TSval=4038482466 TSecr=3804726594"
"597","106.061210439","146.75.54.248","192.168.1.12","TCP","68","[TCP Dup ACK 70#2] [TCP ACKed unseen segment] 443  >  48298 [ACK] Seq=1 Ack=2 Win=285 Len=0 TSval=2314702351 TSecr=621561561"
"598","106.066342298","151.101.242.248","192.168.1.12","TCP","68","[TCP Dup ACK 69#2] [TCP ACKed unseen segment] 443  >  55466 [ACK] Seq=1 Ack=2 Win=296 Len=0 TSval=414551311 TSecr=650064017"
"599","106.072378221","151.101.242.248","192.168.1.12","TCP","68","[TCP Dup ACK 71#2] [TCP ACKed unseen segment] 443  >  55454 [ACK] Seq=1 Ack=2 Win=296 Len=0 TSval=2877015438 TSecr=650064005"
"600","106.072749037","151.101.242.248","192.168.1.12","TCP","68","[TCP Dup ACK 72#2] [TCP ACKed unseen segment] 443  >  49320 [ACK] Seq=1 Ack=2 Win=288 Len=0 TSval=3470031839 TSecr=650063367"
"601","106.084300729","146.75.54.248","192.168.1.12","TCP","68","[TCP Dup ACK 73#2] [TCP ACKed unseen segment] 443  >  48312 [ACK] Seq=1 Ack=2 Win=288 Len=0 TSval=1065086578 TSecr=621561668"
"602","106.219179206","192.168.1.12","35.186.224.47","TLSv1.2","103","Application Data"
"603","106.244692602","35.186.224.47","192.168.1.12","TCP","68","443  >  51376 [ACK] Seq=94 Ack=141 Win=267 Len=0 TSval=255676353 TSecr=461432670"
"604","106.253318545","192.168.1.10","224.0.0.251","MDNS","93","Standard query 0x0000 PTR _raop._tcp.local, ""QU"" question PTR _airplay._tcp.local, ""QU"" question"
"605","106.309614566","35.186.224.47","192.168.1.12","TLSv1.2","99","Application Data"
"606","106.309658468","192.168.1.12","35.186.224.47","TCP","68","51376  >  443 [ACK] Seq=141 Ack=125 Win=501 Len=0 TSval=461432761 TSecr=255676416"
"607","106.322142672","157.240.221.60","192.168.1.12","TLSv1.2","256","Application Data"
"608","106.322180279","192.168.1.12","157.240.221.60","TCP","68","42542  >  443 [ACK] Seq=1316 Ack=8882 Win=1066 Len=0 TSval=1288357072 TSecr=3818662780"
