"No.","Time","Source","Destination","Protocol","Length","Info"
"1","0.000000000","157.240.214.60","192.168.1.12","TCP","578","443  >  58402 [ACK] Seq=1 Ack=1 Win=1219 Len=512 TSval=3599923325 TSecr=4149047032 [TCP segment of a reassembled PDU]"
"2","0.000048896","192.168.1.12","157.240.214.60","TCP","66","58402  >  443 [ACK] Seq=1 Ack=513 Win=1159 Len=0 TSval=4149052214 TSecr=3599923325"
"3","0.000715487","157.240.214.60","192.168.1.12","TCP","578","443  >  58402 [PSH, ACK] Seq=513 Ack=1 Win=1219 Len=512 TSval=3599923325 TSecr=4149047032 [TCP segment of a reassembled PDU]"
"4","0.000741503","192.168.1.12","157.240.214.60","TCP","66","58402  >  443 [ACK] Seq=1 Ack=1025 Win=1159 Len=0 TSval=4149052215 TSecr=3599923325"
"5","0.000760743","157.240.214.60","192.168.1.12","TLSv1.2","509","Application Data"
"6","0.000767579","192.168.1.12","157.240.214.60","TCP","66","58402  >  443 [ACK] Seq=1 Ack=1468 Win=1156 Len=0 TSval=4149052215 TSecr=3599923325"
"8","1.631814653","192.168.1.12","157.240.214.60","TLSv1.2","159","Application Data"
"9","1.715354783","157.240.214.60","192.168.1.12","TCP","66","443  >  58402 [ACK] Seq=1468 Ack=94 Win=1219 Len=0 TSval=3599925125 TSecr=4149053846"
"10","5.938117741","157.240.214.60","192.168.1.12","TLSv1.2","159","Application Data"
"11","5.938173977","192.168.1.12","157.240.214.60","TCP","66","58402  >  443 [ACK] Seq=94 Ack=1561 Win=1159 Len=0 TSval=4149058152 TSecr=3599929276"
"12","5.947256467","192.168.1.12","157.240.214.60","TLSv1.2","158","Application Data"
"13","6.033283996","157.240.214.60","192.168.1.12","TCP","66","443  >  58402 [ACK] Seq=1561 Ack=186 Win=1219 Len=0 TSval=3599929437 TSecr=4149058161"
"14","9.329193147","192.168.1.12","157.240.214.60","TLSv1.2","132","Application Data"
"15","9.408024084","157.240.214.60","192.168.1.12","TCP","66","443  >  58402 [ACK] Seq=1561 Ack=252 Win=1219 Len=0 TSval=3599932823 TSecr=4149061543"
"16","9.960396136","192.168.1.12","157.240.214.60","TLSv1.2","135","Application Data"
"17","10.037942766","157.240.214.60","192.168.1.12","TCP","66","443  >  58402 [ACK] Seq=1561 Ack=321 Win=1219 Len=0 TSval=3599933452 TSecr=4149062174"
"18","10.240053972","157.240.214.60","192.168.1.12","TLSv1.2","137","Application Data"
"19","10.282169485","192.168.1.12","157.240.214.60","TCP","66","58402  >  443 [ACK] Seq=321 Ack=1632 Win=1159 Len=0 TSval=4149062496 TSecr=3599933567"
"25","26.481816075","192.168.1.12","157.240.214.60","TLSv1.2","135","Application Data"
"26","26.556719080","157.240.214.60","192.168.1.12","TCP","66","443  >  58402 [ACK] Seq=1632 Ack=390 Win=1219 Len=0 TSval=3599949970 TSecr=4149078696"
"27","26.749414655","157.240.214.60","192.168.1.12","TLSv1.2","137","Application Data"
"28","26.749457975","192.168.1.12","157.240.214.60","TCP","66","58402  >  443 [ACK] Seq=390 Ack=1703 Win=1159 Len=0 TSval=4149078963 TSecr=3599950084"
"37","39.962175338","192.168.1.12","157.240.251.60","TLSv1.2","90","Application Data"
"38","39.962225719","192.168.1.12","157.240.251.60","TCP","66","45726  >  443 [FIN, ACK] Seq=25 Ack=1 Win=501 Len=0 TSval=2930216496 TSecr=1212035028"
"39","40.047388129","157.240.251.60","192.168.1.12","TLSv1.2","90","Application Data"
"40","40.047444038","192.168.1.12","157.240.251.60","TCP","54","45726  >  443 [RST] Seq=26 Win=0 Len=0"
"41","40.048444349","157.240.251.60","192.168.1.12","TCP","66","443  >  45726 [FIN, ACK] Seq=25 Ack=26 Win=267 Len=0 TSval=1212095115 TSecr=2930216496"
"42","40.048467634","192.168.1.12","157.240.251.60","TCP","54","45726  >  443 [RST] Seq=26 Win=0 Len=0"
"44","42.086453042","157.240.214.60","192.168.1.12","TCP","578","443  >  58402 [ACK] Seq=1703 Ack=390 Win=1219 Len=512 TSval=3599965452 TSecr=4149078963 [TCP segment of a reassembled PDU]"
"45","42.086494622","192.168.1.12","157.240.214.60","TCP","66","58402  >  443 [ACK] Seq=390 Ack=2215 Win=1159 Len=0 TSval=4149094300 TSecr=3599965452"
"46","42.087485536","157.240.214.60","192.168.1.12","TCP","578","443  >  58402 [PSH, ACK] Seq=2215 Ack=390 Win=1219 Len=512 TSval=3599965452 TSecr=4149078963 [TCP segment of a reassembled PDU]"
"47","42.087512865","192.168.1.12","157.240.214.60","TCP","66","58402  >  443 [ACK] Seq=390 Ack=2727 Win=1159 Len=0 TSval=4149094302 TSecr=3599965452"
"48","42.087485766","157.240.214.60","192.168.1.12","TLSv1.2","304","Application Data"
"49","42.087530459","192.168.1.12","157.240.214.60","TCP","66","58402  >  443 [ACK] Seq=390 Ack=2965 Win=1158 Len=0 TSval=4149094302 TSecr=3599965452"
"50","45.709872139","192.168.1.12","157.240.214.60","TLSv1.2","159","Application Data"
"51","45.787938607","157.240.214.60","192.168.1.12","TCP","66","443  >  58402 [ACK] Seq=2965 Ack=483 Win=1219 Len=0 TSval=3599969202 TSecr=4149097924"
"52","45.837525411","157.240.214.60","192.168.1.12","TLSv1.2","159","Application Data"
"53","45.837566473","192.168.1.12","157.240.214.60","TCP","66","58402  >  443 [ACK] Seq=483 Ack=3058 Win=1159 Len=0 TSval=4149098052 TSecr=3599969251"
"54","45.841746400","192.168.1.12","157.240.214.60","TLSv1.2","158","Application Data"
"55","45.919816973","157.240.214.60","192.168.1.12","TCP","66","443  >  58402 [ACK] Seq=3058 Ack=575 Win=1219 Len=0 TSval=3599969334 TSecr=4149098056"
"56","48.479093166","192.168.1.12","157.240.214.60","TLSv1.2","135","Application Data"
"57","48.559637575","157.240.214.60","192.168.1.12","TCP","66","443  >  58402 [ACK] Seq=3058 Ack=644 Win=1219 Len=0 TSval=3599971973 TSecr=4149100693"
"58","48.741688480","157.240.214.60","192.168.1.12","TLSv1.2","137","Application Data"
"59","48.782129907","192.168.1.12","157.240.214.60","TCP","66","58402  >  443 [ACK] Seq=644 Ack=3129 Win=1159 Len=0 TSval=4149100996 TSecr=3599972087"
"70","72.070736126","192.168.1.12","157.240.214.60","TLSv1.2","135","Application Data"
"71","72.151203252","157.240.214.60","192.168.1.12","TCP","66","443  >  58402 [ACK] Seq=3129 Ack=713 Win=1219 Len=0 TSval=3599995564 TSecr=4149124285"
"72","72.293357850","157.240.214.60","192.168.1.12","TLSv1.2","137","Application Data"
"73","72.293404269","192.168.1.12","157.240.214.60","TCP","66","58402  >  443 [ACK] Seq=713 Ack=3200 Win=1159 Len=0 TSval=4149124507 TSecr=3599995678"
"75","81.920792516","157.240.214.60","192.168.1.12","TCP","578","443  >  58402 [ACK] Seq=3200 Ack=713 Win=1219 Len=512 TSval=3600005278 TSecr=4149124507 [TCP segment of a reassembled PDU]"
"76","81.920835094","192.168.1.12","157.240.214.60","TCP","66","58402  >  443 [ACK] Seq=713 Ack=3712 Win=1159 Len=0 TSval=4149134135 TSecr=3600005278"
"77","81.922294598","157.240.214.60","192.168.1.12","TCP","578","443  >  58402 [PSH, ACK] Seq=3712 Ack=713 Win=1219 Len=512 TSval=3600005278 TSecr=4149124507 [TCP segment of a reassembled PDU]"
"78","81.922312796","192.168.1.12","157.240.214.60","TCP","66","58402  >  443 [ACK] Seq=713 Ack=4224 Win=1159 Len=0 TSval=4149134136 TSecr=3600005278"
"79","81.922294781","157.240.214.60","192.168.1.12","TLSv1.2","288","Application Data"
"80","81.922327098","192.168.1.12","157.240.214.60","TCP","66","58402  >  443 [ACK] Seq=713 Ack=4446 Win=1158 Len=0 TSval=4149134136 TSecr=3600005278"
"81","82.279857688","192.168.1.12","157.240.214.60","TLSv1.2","159","Application Data"
"82","82.359080064","157.240.214.60","192.168.1.12","TCP","66","443  >  58402 [ACK] Seq=4446 Ack=806 Win=1219 Len=0 TSval=3600005773 TSecr=4149134494"
"86","85.505508542","157.240.214.60","192.168.1.12","TLSv1.2","159","Application Data"
"87","85.505552669","192.168.1.12","157.240.214.60","TCP","66","58402  >  443 [ACK] Seq=806 Ack=4539 Win=1159 Len=0 TSval=4149137720 TSecr=3600008889"
"88","85.512232250","192.168.1.12","157.240.214.60","TLSv1.2","158","Application Data"
"89","85.591390219","157.240.214.60","192.168.1.12","TCP","66","443  >  58402 [ACK] Seq=4539 Ack=898 Win=1219 Len=0 TSval=3600009005 TSecr=4149137726"
