"No.","Time","Source","Destination","Protocol","Length","Info"
"16","2.359586086","10.0.0.37","140.82.113.25","TLSv1.2","94","Application Data"
"17","2.359606626","10.0.0.37","172.217.22.2","TCP","66","32956  >  443 [FIN, ACK] Seq=1 Ack=1 Win=501 Len=0 TSval=469301378 TSecr=1049010720"
"18","2.359996041","10.0.0.37","140.82.113.25","TCP","94","[TCP Retransmission] 53610  >  443 [PSH, ACK] Seq=1 Ack=1 Win=501 Len=28 TSval=1466019025 TSecr=3318261156"
"19","2.360360764","10.0.0.37","172.217.22.2","TCP","66","[TCP Out-Of-Order] 32956  >  443 [FIN, ACK] Seq=1 Ack=1 Win=501 Len=0 TSval=469302375 TSecr=1049010720"
"20","2.389700410","172.217.22.2","10.0.0.37","TCP","80","443  >  32956 [ACK] Seq=1 Ack=2 Win=261 Len=0 TSval=1049026551 TSecr=469302375 SLE=1 SRE=2"
"21","2.389700750","172.217.22.2","10.0.0.37","TCP","68","443  >  32956 [FIN, ACK] Seq=1 Ack=2 Win=261 Len=0 TSval=1049026551 TSecr=469302375"
"22","2.389784141","10.0.0.37","172.217.22.2","TCP","66","32956  >  443 [ACK] Seq=2 Ack=2 Win=501 Len=0 TSval=469302404 TSecr=1049026551"
"24","2.457670758","2a10:8012:15:af5e:c336:78fe:e399:341e","2a03:2880:f242:c8:face:b00c:0:167","TLSv1.2","114","Application Data"
"25","2.457689082","2a10:8012:15:af5e:c336:78fe:e399:341e","2a00:1450:4028:808::2002","TCP","86","47162  >  443 [FIN, ACK] Seq=1 Ack=1 Win=501 Len=0 TSval=2103319606 TSecr=1030512243"
"26","2.457692718","2a10:8012:15:af5e:c336:78fe:e399:341e","2a00:1450:4028:808::2003","TCP","86","33464  >  443 [FIN, ACK] Seq=1 Ack=1 Win=501 Len=0 TSval=137825961 TSecr=3544310347"
"27","2.457695780","2a10:8012:15:af5e:c336:78fe:e399:341e","2a00:1450:4028:803::200e","TCP","86","56434  >  443 [FIN, ACK] Seq=1 Ack=1 Win=501 Len=0 TSval=2823249409 TSecr=1559433148"
"28","2.457699519","2a10:8012:15:af5e:c336:78fe:e399:341e","2a00:1450:4028:809::2002","TCP","86","46514  >  443 [FIN, ACK] Seq=1 Ack=1 Win=501 Len=0 TSval=3161087835 TSecr=2358493816"
"29","2.457702581","2a10:8012:15:af5e:c336:78fe:e399:341e","2a00:1450:4013:c14::71","TCP","86","54616  >  443 [FIN, ACK] Seq=1 Ack=1 Win=501 Len=0 TSval=481477081 TSecr=3976675187"
"30","2.457705791","2a10:8012:15:af5e:c336:78fe:e399:341e","2a00:1450:4028:801::2016","TCP","86","37796  >  443 [FIN, ACK] Seq=1 Ack=1 Win=501 Len=0 TSval=684818437 TSecr=3767073552"
"31","2.457709358","2a10:8012:15:af5e:c336:78fe:e399:341e","2a00:1450:4028:801::2016","TCP","86","37798  >  443 [FIN, ACK] Seq=1 Ack=1 Win=501 Len=0 TSval=684818437 TSecr=3651604863"
"32","2.457713517","2a10:8012:15:af5e:c336:78fe:e399:341e","2a00:1450:4028:801::2003","TCP","86","51888  >  443 [FIN, ACK] Seq=1 Ack=1 Win=501 Len=0 TSval=518449171 TSecr=3198643436"
"33","2.457716431","2a10:8012:15:af5e:c336:78fe:e399:341e","2a00:1450:4028:809::200a","TCP","86","58102  >  443 [FIN, ACK] Seq=1 Ack=1 Win=501 Len=0 TSval=151470425 TSecr=700662188"
"34","2.457719442","2a10:8012:15:af5e:c336:78fe:e399:341e","2a00:1450:4028:800::2001","TCP","86","57846  >  443 [FIN, ACK] Seq=1 Ack=1 Win=501 Len=0 TSval=601474258 TSecr=2154402837"
"35","2.457722705","2a10:8012:15:af5e:c336:78fe:e399:341e","2a00:1450:4028:802::200e","TCP","86","41082  >  443 [FIN, ACK] Seq=1 Ack=1 Win=501 Len=0 TSval=101099907 TSecr=3708138042"
"36","2.457725930","2a10:8012:15:af5e:c336:78fe:e399:341e","2a00:1450:4028:802::200e","TCP","86","33368  >  443 [FIN, ACK] Seq=1 Ack=1 Win=501 Len=0 TSval=101099907 TSecr=4234779405"
"37","2.457728769","2a10:8012:15:af5e:c336:78fe:e399:341e","2a00:1450:4028:803::200e","TCP","86","51676  >  443 [FIN, ACK] Seq=1 Ack=1 Win=501 Len=0 TSval=2823249409 TSecr=2516647934"
"38","2.457732012","2a10:8012:15:af5e:c336:78fe:e399:341e","2a00:1450:4028:803::200e","TCP","86","59668  >  443 [FIN, ACK] Seq=1 Ack=1 Win=501 Len=0 TSval=2823249409 TSecr=1068993009"
"39","2.457734880","2a10:8012:15:af5e:c336:78fe:e399:341e","2a00:1450:4028:803::200e","TCP","86","60948  >  443 [FIN, ACK] Seq=1 Ack=1 Win=501 Len=0 TSval=2823249409 TSecr=2469962495"
"40","2.457738124","2a10:8012:15:af5e:c336:78fe:e399:341e","2a00:1450:4028:803::200e","TCP","86","59652  >  443 [FIN, ACK] Seq=1 Ack=1 Win=501 Len=0 TSval=2823249409 TSecr=3223754566"
"41","2.457741104","2a10:8012:15:af5e:c336:78fe:e399:341e","2a00:1450:4028:808::2006","TCP","86","53680  >  443 [FIN, ACK] Seq=1 Ack=1 Win=501 Len=0 TSval=1144724955 TSecr=3027534081"
"42","2.457744239","2a10:8012:15:af5e:c336:78fe:e399:341e","2a00:1450:4028:809::2003","TCP","86","37288  >  443 [FIN, ACK] Seq=1 Ack=1 Win=501 Len=0 TSval=1660269908 TSecr=4233298155"
"43","2.457747143","2a10:8012:15:af5e:c336:78fe:e399:341e","2a00:1450:4028:809::2003","TCP","86","37296  >  443 [FIN, ACK] Seq=1 Ack=1 Win=501 Len=0 TSval=1660269908 TSecr=1905797673"
"44","2.457749977","2a10:8012:15:af5e:c336:78fe:e399:341e","2a00:1450:4028:803::200e","TCP","86","60942  >  443 [FIN, ACK] Seq=1 Ack=1 Win=501 Len=0 TSval=2823249409 TSecr=325880260"
"45","2.457752793","2a10:8012:15:af5e:c336:78fe:e399:341e","2a00:1450:4028:802::200e","TCP","86","33352  >  443 [FIN, ACK] Seq=1 Ack=1 Win=501 Len=0 TSval=101099907 TSecr=656094583"
"46","2.457755737","2a10:8012:15:af5e:c336:78fe:e399:341e","2a00:1450:4028:803::200e","TCP","86","60944  >  443 [FIN, ACK] Seq=1 Ack=1 Win=501 Len=0 TSval=2823249409 TSecr=2516660222"
"56","2.458295829","2a10:8012:15:af5e:c336:78fe:e399:341e","2a03:2880:f242:c8:face:b00c:0:167","TCP","114","[TCP Retransmission] 58992  >  443 [PSH, ACK] Seq=1 Ack=1 Win=12369 Len=28 TSval=3290085128 TSecr=4236592723"
"57","2.458598172","2a10:8012:15:af5e:c336:78fe:e399:341e","2a00:1450:4028:808::2002","TCP","86","[TCP Out-Of-Order] 47162  >  443 [FIN, ACK] Seq=1 Ack=1 Win=501 Len=0 TSval=2103320701 TSecr=1030512243"
"58","2.459022622","2a10:8012:15:af5e:c336:78fe:e399:341e","2a00:1450:4028:808::2003","TCP","86","[TCP Out-Of-Order] 33464  >  443 [FIN, ACK] Seq=1 Ack=1 Win=501 Len=0 TSval=137827057 TSecr=3544310347"
"59","2.459313380","2a10:8012:15:af5e:c336:78fe:e399:341e","2a00:1450:4028:803::200e","TCP","86","[TCP Out-Of-Order] 56434  >  443 [FIN, ACK] Seq=1 Ack=1 Win=501 Len=0 TSval=2823250505 TSecr=1559433148"
"60","2.459651007","2a10:8012:15:af5e:c336:78fe:e399:341e","2a00:1450:4028:809::2002","TCP","86","[TCP Out-Of-Order] 46514  >  443 [FIN, ACK] Seq=1 Ack=1 Win=501 Len=0 TSval=3161088931 TSecr=2358493816"
"61","2.460114671","2a10:8012:15:af5e:c336:78fe:e399:341e","2a00:1450:4013:c14::71","TCP","86","[TCP Out-Of-Order] 54616  >  443 [FIN, ACK] Seq=1 Ack=1 Win=501 Len=0 TSval=481478178 TSecr=3976675187"
"62","2.460378394","2a10:8012:15:af5e:c336:78fe:e399:341e","2a00:1450:4028:801::2016","TCP","86","[TCP Out-Of-Order] 37796  >  443 [FIN, ACK] Seq=1 Ack=1 Win=501 Len=0 TSval=684819534 TSecr=3767073552"
"63","2.460815419","2a10:8012:15:af5e:c336:78fe:e399:341e","2a00:1450:4028:801::2016","TCP","86","[TCP Retransmission] 37798  >  443 [FIN, ACK] Seq=1 Ack=1 Win=501 Len=0 TSval=684819534 TSecr=3651604863"
"64","2.461279940","2a10:8012:15:af5e:c336:78fe:e399:341e","2a00:1450:4028:801::2003","TCP","86","[TCP Retransmission] 51888  >  443 [FIN, ACK] Seq=1 Ack=1 Win=501 Len=0 TSval=518450269 TSecr=3198643436"
"65","2.461589954","2a10:8012:15:af5e:c336:78fe:e399:341e","2a00:1450:4028:809::200a","TCP","86","[TCP Retransmission] 58102  >  443 [FIN, ACK] Seq=1 Ack=1 Win=501 Len=0 TSval=151471523 TSecr=700662188"
"66","2.461913544","2a10:8012:15:af5e:c336:78fe:e399:341e","2a00:1450:4028:800::2001","TCP","86","[TCP Retransmission] 57846  >  443 [FIN, ACK] Seq=1 Ack=1 Win=501 Len=0 TSval=601475357 TSecr=2154402837"
"67","2.462274520","2a10:8012:15:af5e:c336:78fe:e399:341e","2a00:1450:4028:802::200e","TCP","86","[TCP Retransmission] 41082  >  443 [FIN, ACK] Seq=1 Ack=1 Win=501 Len=0 TSval=101101006 TSecr=3708138042"
"68","2.462660187","2a10:8012:15:af5e:c336:78fe:e399:341e","2a00:1450:4028:802::200e","TCP","86","[TCP Retransmission] 33368  >  443 [FIN, ACK] Seq=1 Ack=1 Win=501 Len=0 TSval=101101006 TSecr=4234779405"
"69","2.463057632","2a10:8012:15:af5e:c336:78fe:e399:341e","2a00:1450:4028:803::200e","TCP","86","[TCP Retransmission] 51676  >  443 [FIN, ACK] Seq=1 Ack=1 Win=501 Len=0 TSval=2823250509 TSecr=2516647934"
"70","2.463397759","2a10:8012:15:af5e:c336:78fe:e399:341e","2a00:1450:4028:803::200e","TCP","86","[TCP Retransmission] 59668  >  443 [FIN, ACK] Seq=1 Ack=1 Win=501 Len=0 TSval=2823250509 TSecr=1068993009"
"71","2.463735221","2a10:8012:15:af5e:c336:78fe:e399:341e","2a00:1450:4028:803::200e","TCP","86","[TCP Retransmission] 60948  >  443 [FIN, ACK] Seq=1 Ack=1 Win=501 Len=0 TSval=2823250509 TSecr=2469962495"
"72","2.464067925","2a10:8012:15:af5e:c336:78fe:e399:341e","2a00:1450:4028:803::200e","TCP","86","[TCP Retransmission] 59652  >  443 [FIN, ACK] Seq=1 Ack=1 Win=501 Len=0 TSval=2823250510 TSecr=3223754566"
"73","2.464388475","2a10:8012:15:af5e:c336:78fe:e399:341e","2a00:1450:4028:808::2006","TCP","86","[TCP Retransmission] 53680  >  443 [FIN, ACK] Seq=1 Ack=1 Win=501 Len=0 TSval=1144726056 TSecr=3027534081"
"75","2.464884581","2a10:8012:15:af5e:c336:78fe:e399:341e","2a00:1450:4028:809::2003","TCP","86","[TCP Retransmission] 37288  >  443 [FIN, ACK] Seq=1 Ack=1 Win=501 Len=0 TSval=1660271010 TSecr=4233298155"
"76","2.465152604","2a10:8012:15:af5e:c336:78fe:e399:341e","2a00:1450:4028:809::2003","TCP","86","[TCP Retransmission] 37296  >  443 [FIN, ACK] Seq=1 Ack=1 Win=501 Len=0 TSval=1660271010 TSecr=1905797673"
"77","2.465432993","2a10:8012:15:af5e:c336:78fe:e399:341e","2a00:1450:4028:803::200e","TCP","86","[TCP Retransmission] 60942  >  443 [FIN, ACK] Seq=1 Ack=1 Win=501 Len=0 TSval=2823250511 TSecr=325880260"
"78","2.467741091","2a10:8012:15:af5e:c336:78fe:e399:341e","2a00:1450:4028:803::200e","TCP","86","[TCP Retransmission] 60944  >  443 [FIN, ACK] Seq=1 Ack=1 Win=501 Len=0 TSval=2823250513 TSecr=2516660222"
"79","2.467747111","2a10:8012:15:af5e:c336:78fe:e399:341e","2a00:1450:4028:802::200e","TCP","86","[TCP Retransmission] 33352  >  443 [FIN, ACK] Seq=1 Ack=1 Win=501 Len=0 TSval=101101011 TSecr=656094583"
"80","2.469844556","2a00:1450:4028:808::2002","2a10:8012:15:af5e:c336:78fe:e399:341e","TCP","86","443  >  47162 [FIN, ACK] Seq=1 Ack=2 Win=261 Len=0 TSval=1030528172 TSecr=2103319606"
"81","2.469875566","2a10:8012:15:af5e:c336:78fe:e399:341e","2a00:1450:4028:808::2002","TCP","86","47162  >  443 [ACK] Seq=2 Ack=2 Win=501 Len=0 TSval=2103320713 TSecr=1030528172"
"82","2.472236427","2a00:1450:4028:803::200e","2a10:8012:15:af5e:c336:78fe:e399:341e","TCP","86","443  >  56434 [FIN, ACK] Seq=1 Ack=2 Win=261 Len=0 TSval=1559467511 TSecr=2823249409"
"83","2.472240397","2a00:1450:4028:808::2003","2a10:8012:15:af5e:c336:78fe:e399:341e","TCP","86","443  >  33464 [FIN, ACK] Seq=1 Ack=2 Win=261 Len=0 TSval=3544344709 TSecr=137825961"
"84","2.472262837","2a10:8012:15:af5e:c336:78fe:e399:341e","2a00:1450:4028:803::200e","TCP","86","56434  >  443 [ACK] Seq=2 Ack=2 Win=501 Len=0 TSval=2823250518 TSecr=1559467511"
"85","2.472273605","2a10:8012:15:af5e:c336:78fe:e399:341e","2a00:1450:4028:808::2003","TCP","86","33464  >  443 [ACK] Seq=2 Ack=2 Win=501 Len=0 TSval=137827070 TSecr=3544344709"
"87","2.478298905","2a00:1450:4028:809::2002","2a10:8012:15:af5e:c336:78fe:e399:341e","TCP","86","443  >  46514 [FIN, ACK] Seq=1 Ack=2 Win=261 Len=0 TSval=2358509747 TSecr=3161087835"
"88","2.478299255","2a00:1450:4028:801::2016","2a10:8012:15:af5e:c336:78fe:e399:341e","TCP","86","443  >  37798 [FIN, ACK] Seq=1 Ack=2 Win=261 Len=0 TSval=3651620797 TSecr=684818437"
"89","2.478331944","2a00:1450:4028:801::2016","2a10:8012:15:af5e:c336:78fe:e399:341e","TCP","86","443  >  37796 [FIN, ACK] Seq=1 Ack=2 Win=261 Len=0 TSval=3767091533 TSecr=684818437"
"90","2.478331532","2a00:1450:4028:801::2003","2a10:8012:15:af5e:c336:78fe:e399:341e","TCP","86","443  >  51888 [FIN, ACK] Seq=1 Ack=2 Win=261 Len=0 TSval=3198663465 TSecr=518449171"
"91","2.478336320","2a10:8012:15:af5e:c336:78fe:e399:341e","2a00:1450:4028:809::2002","TCP","86","46514  >  443 [ACK] Seq=2 Ack=2 Win=501 Len=0 TSval=3161088950 TSecr=2358509747"
"92","2.478365318","2a10:8012:15:af5e:c336:78fe:e399:341e","2a00:1450:4028:801::2016","TCP","86","37798  >  443 [ACK] Seq=2 Ack=2 Win=501 Len=0 TSval=684819552 TSecr=3651620797"
"93","2.478368402","2a10:8012:15:af5e:c336:78fe:e399:341e","2a00:1450:4028:801::2016","TCP","86","37796  >  443 [ACK] Seq=2 Ack=2 Win=501 Len=0 TSval=684819552 TSecr=3767091533"
"94","2.478382696","2a10:8012:15:af5e:c336:78fe:e399:341e","2a00:1450:4028:801::2003","TCP","86","51888  >  443 [ACK] Seq=2 Ack=2 Win=501 Len=0 TSval=518450286 TSecr=3198663465"
"95","2.478841644","2a00:1450:4028:802::200e","2a10:8012:15:af5e:c336:78fe:e399:341e","TCP","86","443  >  41082 [FIN, ACK] Seq=1 Ack=2 Win=261 Len=0 TSval=3708168309 TSecr=101099907"
"96","2.478841789","2a00:1450:4028:803::200e","2a10:8012:15:af5e:c336:78fe:e399:341e","TCP","86","443  >  59652 [FIN, ACK] Seq=1 Ack=2 Win=261 Len=0 TSval=3223784833 TSecr=2823249409"
"97","2.478863728","2a10:8012:15:af5e:c336:78fe:e399:341e","2a00:1450:4028:802::200e","TCP","86","41082  >  443 [ACK] Seq=2 Ack=2 Win=501 Len=0 TSval=101101023 TSecr=3708168309"
"98","2.478873853","2a10:8012:15:af5e:c336:78fe:e399:341e","2a00:1450:4028:803::200e","TCP","86","59652  >  443 [ACK] Seq=2 Ack=2 Win=501 Len=0 TSval=2823250525 TSecr=3223784833"
"99","2.478911889","2a00:1450:4028:800::2001","2a10:8012:15:af5e:c336:78fe:e399:341e","TCP","86","443  >  57846 [FIN, ACK] Seq=1 Ack=2 Win=261 Len=0 TSval=2154420817 TSecr=601474258"
"100","2.478912327","2a00:1450:4028:809::200a","2a10:8012:15:af5e:c336:78fe:e399:341e","TCP","86","443  >  58102 [FIN, ACK] Seq=1 Ack=2 Win=261 Len=0 TSval=700678120 TSecr=151470425"
"101","2.478915459","2a00:1450:4028:802::200e","2a10:8012:15:af5e:c336:78fe:e399:341e","TCP","86","443  >  33368 [FIN, ACK] Seq=1 Ack=2 Win=261 Len=0 TSval=4234793292 TSecr=101099907"
"102","2.478915985","2a00:1450:4028:803::200e","2a10:8012:15:af5e:c336:78fe:e399:341e","TCP","86","443  >  51676 [FIN, ACK] Seq=1 Ack=2 Win=261 Len=0 TSval=2516676156 TSecr=2823249409"
"103","2.478937079","2a10:8012:15:af5e:c336:78fe:e399:341e","2a00:1450:4028:809::200a","TCP","86","58102  >  443 [ACK] Seq=2 Ack=2 Win=501 Len=0 TSval=151471541 TSecr=700678120"
"104","2.478947871","2a10:8012:15:af5e:c336:78fe:e399:341e","2a00:1450:4028:800::2001","TCP","86","57846  >  443 [ACK] Seq=2 Ack=2 Win=501 Len=0 TSval=601475374 TSecr=2154420817"
"105","2.478958426","2a10:8012:15:af5e:c336:78fe:e399:341e","2a00:1450:4028:802::200e","TCP","86","33368  >  443 [ACK] Seq=2 Ack=2 Win=501 Len=0 TSval=101101023 TSecr=4234793292"
"106","2.478971125","2a10:8012:15:af5e:c336:78fe:e399:341e","2a00:1450:4028:803::200e","TCP","86","51676  >  443 [ACK] Seq=2 Ack=2 Win=501 Len=0 TSval=2823250525 TSecr=2516676156"
"107","2.479628594","2a00:1450:4028:803::200e","2a10:8012:15:af5e:c336:78fe:e399:341e","TCP","86","443  >  60942 [FIN, ACK] Seq=1 Ack=2 Win=261 Len=0 TSval=325898243 TSecr=2823249409"
"108","2.479632253","2a00:1450:4028:808::2006","2a10:8012:15:af5e:c336:78fe:e399:341e","TCP","86","443  >  53680 [FIN, ACK] Seq=1 Ack=2 Win=261 Len=0 TSval=3027550016 TSecr=1144724955"
"109","2.479643460","2a10:8012:15:af5e:c336:78fe:e399:341e","2a00:1450:4028:803::200e","TCP","86","60942  >  443 [ACK] Seq=2 Ack=2 Win=501 Len=0 TSval=2823250525 TSecr=325898243"
"110","2.479648033","2a10:8012:15:af5e:c336:78fe:e399:341e","2a00:1450:4028:808::2006","TCP","86","53680  >  443 [ACK] Seq=2 Ack=2 Win=501 Len=0 TSval=1144726071 TSecr=3027550016"
"111","2.479712504","2a00:1450:4028:803::200e","2a10:8012:15:af5e:c336:78fe:e399:341e","TCP","86","443  >  60948 [FIN, ACK] Seq=1 Ack=2 Win=261 Len=0 TSval=2469978430 TSecr=2823249409"
"112","2.479712696","2a00:1450:4028:803::200e","2a10:8012:15:af5e:c336:78fe:e399:341e","TCP","86","443  >  59668 [FIN, ACK] Seq=1 Ack=2 Win=261 Len=0 TSval=1069023279 TSecr=2823249409"
"113","2.479737248","2a10:8012:15:af5e:c336:78fe:e399:341e","2a00:1450:4028:803::200e","TCP","86","60948  >  443 [ACK] Seq=2 Ack=2 Win=501 Len=0 TSval=2823250525 TSecr=2469978430"
"114","2.479758498","2a10:8012:15:af5e:c336:78fe:e399:341e","2a00:1450:4028:803::200e","TCP","86","59668  >  443 [ACK] Seq=2 Ack=2 Win=501 Len=0 TSval=2823250525 TSecr=1069023279"
"115","2.480452276","2a00:1450:4028:809::2003","2a10:8012:15:af5e:c336:78fe:e399:341e","TCP","86","443  >  37288 [FIN, ACK] Seq=1 Ack=2 Win=261 Len=0 TSval=4233316138 TSecr=1660269908"
"116","2.480484917","2a10:8012:15:af5e:c336:78fe:e399:341e","2a00:1450:4028:809::2003","TCP","86","37288  >  443 [ACK] Seq=2 Ack=2 Win=501 Len=0 TSval=1660271025 TSecr=4233316138"
"117","2.480496796","2a00:1450:4028:809::2003","2a10:8012:15:af5e:c336:78fe:e399:341e","TCP","86","443  >  37296 [FIN, ACK] Seq=1 Ack=2 Win=261 Len=0 TSval=1905813609 TSecr=1660269908"
"118","2.480507228","2a10:8012:15:af5e:c336:78fe:e399:341e","2a00:1450:4028:809::2003","TCP","86","37296  >  443 [ACK] Seq=2 Ack=2 Win=501 Len=0 TSval=1660271025 TSecr=1905813609"
"119","2.481628563","2a00:1450:4028:802::200e","2a10:8012:15:af5e:c336:78fe:e399:341e","TCP","86","443  >  33352 [FIN, ACK] Seq=1 Ack=2 Win=261 Len=0 TSval=656112573 TSecr=101099907"
"120","2.481656154","2a10:8012:15:af5e:c336:78fe:e399:341e","2a00:1450:4028:802::200e","TCP","86","33352  >  443 [ACK] Seq=2 Ack=2 Win=501 Len=0 TSval=101101025 TSecr=656112573"
"121","2.484131988","2a00:1450:4028:809::2002","2a10:8012:15:af5e:c336:78fe:e399:341e","TCP","98","[TCP Dup ACK 87#1] 443  >  46514 [ACK] Seq=2 Ack=2 Win=261 Len=0 TSval=2358509759 TSecr=3161088931 SLE=1 SRE=2"
"122","2.484170624","2a00:1450:4028:803::200e","2a10:8012:15:af5e:c336:78fe:e399:341e","TCP","98","[TCP Dup ACK 82#1] 443  >  56434 [ACK] Seq=2 Ack=2 Win=261 Len=0 TSval=1559467523 TSecr=2823250505 SLE=1 SRE=2"
"123","2.484171025","2a00:1450:4028:808::2002","2a10:8012:15:af5e:c336:78fe:e399:341e","TCP","98","[TCP Dup ACK 80#1] 443  >  47162 [ACK] Seq=2 Ack=2 Win=261 Len=0 TSval=1030528185 TSecr=2103320701 SLE=1 SRE=2"
"124","2.484204187","2a00:1450:4028:803::200e","2a10:8012:15:af5e:c336:78fe:e399:341e","TCP","86","443  >  60944 [FIN, ACK] Seq=1 Ack=2 Win=261 Len=0 TSval=2516676164 TSecr=2823249409"
"125","2.484204492","2a00:1450:4028:808::2003","2a10:8012:15:af5e:c336:78fe:e399:341e","TCP","98","[TCP Dup ACK 83#1] 443  >  33464 [ACK] Seq=2 Ack=2 Win=261 Len=0 TSval=3544344722 TSecr=137827057 SLE=1 SRE=2"
"126","2.484231588","2a10:8012:15:af5e:c336:78fe:e399:341e","2a00:1450:4028:803::200e","TCP","86","60944  >  443 [ACK] Seq=2 Ack=2 Win=501 Len=0 TSval=2823250530 TSecr=2516676164"
"127","2.484727878","2a00:1450:4028:801::2016","2a10:8012:15:af5e:c336:78fe:e399:341e","TCP","98","[TCP Dup ACK 88#1] 443  >  37798 [ACK] Seq=2 Ack=2 Win=261 Len=0 TSval=3651620808 TSecr=684819534 SLE=1 SRE=2"
"128","2.484730268","2a00:1450:4028:801::2003","2a10:8012:15:af5e:c336:78fe:e399:341e","TCP","98","[TCP Dup ACK 90#1] 443  >  51888 [ACK] Seq=2 Ack=2 Win=261 Len=0 TSval=3198663476 TSecr=518450269 SLE=1 SRE=2"
"129","2.484767452","2a00:1450:4028:800::2001","2a10:8012:15:af5e:c336:78fe:e399:341e","TCP","98","[TCP Dup ACK 99#1] 443  >  57846 [ACK] Seq=2 Ack=2 Win=261 Len=0 TSval=2154420828 TSecr=601475357 SLE=1 SRE=2"
"130","2.484767925","2a00:1450:4028:801::2016","2a10:8012:15:af5e:c336:78fe:e399:341e","TCP","98","[TCP Dup ACK 89#1] 443  >  37796 [ACK] Seq=2 Ack=2 Win=261 Len=0 TSval=3767091545 TSecr=684819534 SLE=1 SRE=2"
"131","2.485594072","2a00:1450:4028:803::200e","2a10:8012:15:af5e:c336:78fe:e399:341e","TCP","98","[TCP Dup ACK 96#1] 443  >  59652 [ACK] Seq=2 Ack=2 Win=261 Len=0 TSval=3223784843 TSecr=2823250510 SLE=1 SRE=2"
"132","2.485598747","2a00:1450:4028:809::200a","2a10:8012:15:af5e:c336:78fe:e399:341e","TCP","98","[TCP Dup ACK 100#1] 443  >  58102 [ACK] Seq=2 Ack=2 Win=261 Len=0 TSval=700678131 TSecr=151471523 SLE=1 SRE=2"
"133","2.485598937","2a00:1450:4028:803::200e","2a10:8012:15:af5e:c336:78fe:e399:341e","TCP","98","[TCP Dup ACK 111#1] 443  >  60948 [ACK] Seq=2 Ack=2 Win=261 Len=0 TSval=2469978440 TSecr=2823250509 SLE=1 SRE=2"
"134","2.485609155","2a00:1450:4028:802::200e","2a10:8012:15:af5e:c336:78fe:e399:341e","TCP","98","[TCP Dup ACK 101#1] 443  >  33368 [ACK] Seq=2 Ack=2 Win=261 Len=0 TSval=4234793302 TSecr=101101006 SLE=1 SRE=2"
"135","2.485609718","2a00:1450:4028:803::200e","2a10:8012:15:af5e:c336:78fe:e399:341e","TCP","98","[TCP Dup ACK 102#1] 443  >  51676 [ACK] Seq=2 Ack=2 Win=261 Len=0 TSval=2516676166 TSecr=2823250509 SLE=1 SRE=2"
"136","2.486404839","2a00:1450:4028:808::2006","2a10:8012:15:af5e:c336:78fe:e399:341e","TCP","98","[TCP Dup ACK 108#1] 443  >  53680 [ACK] Seq=2 Ack=2 Win=261 Len=0 TSval=3027550026 TSecr=1144726056 SLE=1 SRE=2"
"137","2.486408044","2a00:1450:4028:809::2003","2a10:8012:15:af5e:c336:78fe:e399:341e","TCP","98","[TCP Dup ACK 117#1] 443  >  37296 [ACK] Seq=2 Ack=2 Win=261 Len=0 TSval=1905813619 TSecr=1660271010 SLE=1 SRE=2"
"138","2.486408699","2a00:1450:4028:803::200e","2a10:8012:15:af5e:c336:78fe:e399:341e","TCP","98","[TCP Dup ACK 107#1] 443  >  60942 [ACK] Seq=2 Ack=2 Win=261 Len=0 TSval=325898253 TSecr=2823250511 SLE=1 SRE=2"
"139","2.486408877","2a00:1450:4028:809::2003","2a10:8012:15:af5e:c336:78fe:e399:341e","TCP","98","[TCP Dup ACK 115#1] 443  >  37288 [ACK] Seq=2 Ack=2 Win=261 Len=0 TSval=4233316148 TSecr=1660271010 SLE=1 SRE=2"
"140","2.486418963","2a00:1450:4028:803::200e","2a10:8012:15:af5e:c336:78fe:e399:341e","TCP","98","[TCP Dup ACK 124#1] 443  >  60944 [ACK] Seq=2 Ack=2 Win=261 Len=0 TSval=2516676167 TSecr=2823250513 SLE=1 SRE=2"
"141","2.486419281","2a00:1450:4028:803::200e","2a10:8012:15:af5e:c336:78fe:e399:341e","TCP","98","[TCP Dup ACK 112#1] 443  >  59668 [ACK] Seq=2 Ack=2 Win=261 Len=0 TSval=1069023289 TSecr=2823250509 SLE=1 SRE=2"
"142","2.486427882","2a00:1450:4028:802::200e","2a10:8012:15:af5e:c336:78fe:e399:341e","TCP","98","[TCP Dup ACK 95#1] 443  >  41082 [ACK] Seq=2 Ack=2 Win=261 Len=0 TSval=3708168320 TSecr=101101006 SLE=1 SRE=2"
"143","2.487293942","2a00:1450:4028:802::200e","2a10:8012:15:af5e:c336:78fe:e399:341e","TCP","98","[TCP Dup ACK 119#1] 443  >  33352 [ACK] Seq=2 Ack=2 Win=261 Len=0 TSval=656112580 TSecr=101101011 SLE=1 SRE=2"
"150","2.494776264","2a10:8012:15:af5e:c336:78fe:e399:341e","2a03:2880:f242:c8:face:b00c:0:167","TCP","94","52164  >  443 [SYN] Seq=0 Win=64800 Len=0 MSS=1440 SACK_PERM=1 TSval=3290085164 TSecr=0 WS=128"
"159","2.507141110","140.82.113.25","10.0.0.37","TCP","68","443  >  53610 [ACK] Seq=1 Ack=29 Win=72 Len=0 TSval=3318264855 TSecr=1466017984"
"160","2.507141928","2a03:2880:f242:c8:face:b00c:0:167","2a10:8012:15:af5e:c336:78fe:e399:341e","TCP","86","443  >  58992 [ACK] Seq=1 Ack=29 Win=2043 Len=0 TSval=4236608002 TSecr=3290083988"
"161","2.507141433","140.82.113.25","10.0.0.37","TCP","80","[TCP Dup ACK 159#1] 443  >  53610 [ACK] Seq=1 Ack=29 Win=72 Len=0 TSval=3318264855 TSecr=1466019025 SLE=1 SRE=29"
"164","2.510008912","140.82.113.25","10.0.0.37","TLSv1.2","92","Application Data"
"165","2.510009125","140.82.113.25","10.0.0.37","TLSv1.2","92","Application Data"
"166","2.510009176","140.82.113.25","10.0.0.37","TCP","68","443  >  53610 [FIN, ACK] Seq=49 Ack=29 Win=72 Len=0 TSval=3318264856 TSecr=1466019025"
"167","2.510209510","10.0.0.37","140.82.113.25","TCP","66","53610  >  443 [ACK] Seq=29 Ack=50 Win=501 Len=0 TSval=1466019175 TSecr=3318264856"
"168","2.510312763","10.0.0.37","140.82.113.25","TCP","66","53610  >  443 [FIN, ACK] Seq=29 Ack=50 Win=501 Len=0 TSval=1466019175 TSecr=3318264856"
"169","2.510709629","10.0.0.37","140.82.113.25","TCP","74","48392  >  443 [SYN] Seq=0 Win=64240 Len=0 MSS=1460 SACK_PERM=1 TSval=1466019175 TSecr=0 WS=128"
"170","2.514976739","2a03:2880:f242:c8:face:b00c:0:167","2a10:8012:15:af5e:c336:78fe:e399:341e","TCP","86","[TCP Dup ACK 160#1] 443  >  58992 [ACK] Seq=1 Ack=29 Win=2043 Len=0 TSval=4236608010 TSecr=3290085128"
"172","2.540380178","2a00:1450:4013:c14::71","2a10:8012:15:af5e:c336:78fe:e399:341e","TCP","86","443  >  54616 [FIN, ACK] Seq=1 Ack=2 Win=261 Len=0 TSval=3976695187 TSecr=481477081"
"173","2.540423356","2a10:8012:15:af5e:c336:78fe:e399:341e","2a00:1450:4013:c14::71","TCP","86","54616  >  443 [ACK] Seq=2 Ack=2 Win=501 Len=0 TSval=481478258 TSecr=3976695187"
"174","2.543869899","2a03:2880:f242:c8:face:b00c:0:167","2a10:8012:15:af5e:c336:78fe:e399:341e","TCP","94","443  >  52164 [SYN, ACK] Seq=0 Ack=1 Win=65535 Len=0 MSS=1392 SACK_PERM=1 TSval=3567667351 TSecr=3290085164 WS=256"
"175","2.543921246","2a10:8012:15:af5e:c336:78fe:e399:341e","2a03:2880:f242:c8:face:b00c:0:167","TCP","86","52164  >  443 [ACK] Seq=1 Ack=1 Win=64896 Len=0 TSval=3290085214 TSecr=3567667351"
"176","2.544399944","2a10:8012:15:af5e:c336:78fe:e399:341e","2a03:2880:f242:c8:face:b00c:0:167","TLSv1.3","603","Client Hello"
"177","2.553521346","2a00:1450:4013:c14::71","2a10:8012:15:af5e:c336:78fe:e399:341e","TCP","98","[TCP Dup ACK 172#1] 443  >  54616 [ACK] Seq=2 Ack=2 Win=261 Len=0 TSval=3976695200 TSecr=481478178 SLE=1 SRE=2"
"192","2.594578119","2a03:2880:f242:c8:face:b00c:0:167","2a10:8012:15:af5e:c336:78fe:e399:341e","TCP","86","443  >  52164 [ACK] Seq=1 Ack=518 Win=66816 Len=0 TSval=3567667402 TSecr=3290085214"
"193","2.596092869","2a03:2880:f242:c8:face:b00c:0:167","2a10:8012:15:af5e:c336:78fe:e399:341e","TLSv1.3","289","Server Hello, Change Cipher Spec, Application Data"
"194","2.596118314","2a10:8012:15:af5e:c336:78fe:e399:341e","2a03:2880:f242:c8:face:b00c:0:167","TCP","86","52164  >  443 [ACK] Seq=518 Ack=204 Win=64768 Len=0 TSval=3290085266 TSecr=3567667404"
"198","2.598909575","2a10:8012:15:af5e:c336:78fe:e399:341e","2a03:2880:f242:c8:face:b00c:0:167","TLSv1.3","150","Change Cipher Spec, Application Data"
"200","2.599180491","2a10:8012:15:af5e:c336:78fe:e399:341e","2a03:2880:f242:c8:face:b00c:0:167","TLSv1.3","578","Application Data"
"206","2.630960558","2a10:8012:15:af5e:c336:78fe:e399:341e","2a00:1450:4028:808::200e","TCP","94","60720  >  443 [SYN] Seq=0 Win=64800 Len=0 MSS=1440 SACK_PERM=1 TSval=3628109387 TSecr=0 WS=128"
"207","2.643902297","2a00:1450:4028:808::200e","2a10:8012:15:af5e:c336:78fe:e399:341e","TCP","94","443  >  60720 [SYN, ACK] Seq=0 Ack=1 Win=65535 Len=0 MSS=1432 SACK_PERM=1 TSval=2061382267 TSecr=3628109387 WS=256"
"208","2.643956190","2a10:8012:15:af5e:c336:78fe:e399:341e","2a00:1450:4028:808::200e","TCP","86","60720  >  443 [ACK] Seq=1 Ack=1 Win=64896 Len=0 TSval=3628109400 TSecr=2061382267"
"209","2.644347969","2a10:8012:15:af5e:c336:78fe:e399:341e","2a00:1450:4028:808::200e","TLSv1.3","603","Client Hello"
"210","2.652184738","2a03:2880:f242:c8:face:b00c:0:167","2a10:8012:15:af5e:c336:78fe:e399:341e","TLSv1.3","255","Application Data"
"212","2.658726545","2a00:1450:4028:808::200e","2a10:8012:15:af5e:c336:78fe:e399:341e","TCP","86","443  >  60720 [ACK] Seq=1 Ack=518 Win=66816 Len=0 TSval=2061382282 TSecr=3628109400"
"213","2.658728125","140.82.113.25","10.0.0.37","TCP","68","443  >  53610 [ACK] Seq=50 Ack=30 Win=72 Len=0 TSval=3318265006 TSecr=1466019175"
"214","2.658727300","140.82.113.25","10.0.0.37","TCP","76","443  >  48392 [SYN, ACK] Seq=0 Ack=1 Win=65535 Len=0 MSS=1400 SACK_PERM=1 TSval=1524331729 TSecr=1466019175 WS=1024"
"215","2.658785842","10.0.0.37","140.82.113.25","TCP","66","48392  >  443 [ACK] Seq=1 Ack=1 Win=64256 Len=0 TSval=1466019323 TSecr=1524331729"
"216","2.659188363","10.0.0.37","140.82.113.25","TLSv1.3","583","Client Hello"
"224","2.689561375","2a03:2880:f242:c8:face:b00c:0:167","2a10:8012:15:af5e:c336:78fe:e399:341e","TCP","86","443  >  52164 [ACK] Seq=373 Ack=1074 Win=67840 Len=0 TSval=3567667498 TSecr=3290085269"
"225","2.689588661","2a10:8012:15:af5e:c336:78fe:e399:341e","2a03:2880:f242:c8:face:b00c:0:167","TCP","86","52164  >  443 [ACK] Seq=1074 Ack=373 Win=64640 Len=0 TSval=3290085359 TSecr=3567667456"
"230","2.694620989","2a03:2880:f242:c8:face:b00c:0:167","2a10:8012:15:af5e:c336:78fe:e399:341e","TLSv1.2","120","Application Data"
"231","2.694621194","2a03:2880:f242:c8:face:b00c:0:167","2a10:8012:15:af5e:c336:78fe:e399:341e","TLSv1.2","110","Application Data"
"232","2.694621253","2a03:2880:f242:c8:face:b00c:0:167","2a10:8012:15:af5e:c336:78fe:e399:341e","TCP","86","443  >  58992 [FIN, ACK] Seq=59 Ack=29 Win=2043 Len=0 TSval=4236608189 TSecr=3290085128"
"233","2.694662523","2a10:8012:15:af5e:c336:78fe:e399:341e","2a03:2880:f242:c8:face:b00c:0:167","TCP","86","58992  >  443 [ACK] Seq=29 Ack=35 Win=12369 Len=0 TSval=3290085364 TSecr=4236608188"
"234","2.694680484","2a10:8012:15:af5e:c336:78fe:e399:341e","2a03:2880:f242:c8:face:b00c:0:167","TCP","86","58992  >  443 [ACK] Seq=29 Ack=59 Win=12369 Len=0 TSval=3290085364 TSecr=4236608189"
"235","2.694782361","2a10:8012:15:af5e:c336:78fe:e399:341e","2a03:2880:f242:c8:face:b00c:0:167","TCP","86","58992  >  443 [FIN, ACK] Seq=29 Ack=60 Win=12369 Len=0 TSval=3290085364 TSecr=4236608189"
"246","2.732548368","2a00:1450:4028:808::200e","2a10:8012:15:af5e:c336:78fe:e399:341e","TLSv1.3","2502","Server Hello, Change Cipher Spec"
"247","2.732548616","2a00:1450:4028:808::200e","2a10:8012:15:af5e:c336:78fe:e399:341e","TCP","2502","443  >  60720 [PSH, ACK] Seq=2417 Ack=518 Win=66816 Len=2416 TSval=2061382353 TSecr=3628109400 [TCP segment of a reassembled PDU]"
"248","2.732548664","2a00:1450:4028:808::200e","2a10:8012:15:af5e:c336:78fe:e399:341e","TLSv1.3","2194","Application Data"
"249","2.732589934","2a10:8012:15:af5e:c336:78fe:e399:341e","2a00:1450:4028:808::200e","TCP","86","60720  >  443 [ACK] Seq=518 Ack=2417 Win=62592 Len=0 TSval=3628109488 TSecr=2061382353"
"250","2.732617393","2a10:8012:15:af5e:c336:78fe:e399:341e","2a00:1450:4028:808::200e","TCP","86","60720  >  443 [ACK] Seq=518 Ack=4833 Win=60288 Len=0 TSval=3628109488 TSecr=2061382353"
"251","2.732624351","2a10:8012:15:af5e:c336:78fe:e399:341e","2a00:1450:4028:808::200e","TCP","86","60720  >  443 [ACK] Seq=518 Ack=6941 Win=58240 Len=0 TSval=3628109488 TSecr=2061382353"
"252","2.733524049","2a10:8012:15:af5e:c336:78fe:e399:341e","2a00:1450:4028:808::200e","TLSv1.3","160","Change Cipher Spec, Application Data"
"254","2.742590100","2a03:2880:f242:c8:face:b00c:0:167","2a10:8012:15:af5e:c336:78fe:e399:341e","TLSv1.3","274","Application Data"
"255","2.743826504","2a00:1450:4028:808::200e","2a10:8012:15:af5e:c336:78fe:e399:341e","TLSv1.3","1052","Application Data, Application Data"
"256","2.743826661","2a03:2880:f242:c8:face:b00c:0:167","2a10:8012:15:af5e:c336:78fe:e399:341e","TCP","86","443  >  58992 [ACK] Seq=60 Ack=30 Win=2043 Len=0 TSval=4236608238 TSecr=3290085364"
"257","2.743826713","2a00:1450:4028:808::200e","2a10:8012:15:af5e:c336:78fe:e399:341e","TCP","86","443  >  60720 [ACK] Seq=6941 Ack=592 Win=66816 Len=0 TSval=2061382368 TSecr=3628109489"
"258","2.749369782","2a10:8012:15:af5e:c336:78fe:e399:341e","2a03:2880:f242:c8:face:b00c:0:167","TLSv1.3","168","Application Data"
"270","2.784631418","2a10:8012:15:af5e:c336:78fe:e399:341e","2a00:1450:4028:808::200e","TCP","86","60720  >  443 [ACK] Seq=592 Ack=7907 Win=64128 Len=0 TSval=3628109540 TSecr=2061382368"
"272","2.797787136","2a03:2880:f242:c8:face:b00c:0:167","2a10:8012:15:af5e:c336:78fe:e399:341e","TCP","86","443  >  52164 [ACK] Seq=561 Ack=1156 Win=67840 Len=0 TSval=3567667605 TSecr=3290085419"
"274","2.807572036","140.82.113.25","10.0.0.37","TLSv1.3","1454","Server Hello, Change Cipher Spec, Application Data"
"275","2.807626138","10.0.0.37","140.82.113.25","TCP","66","48392  >  443 [ACK] Seq=518 Ack=1389 Win=63104 Len=0 TSval=1466019472 TSecr=1524331881"
"276","2.808428613","140.82.113.25","10.0.0.37","TLSv1.3","1454","Application Data, Application Data"
"277","2.808472732","10.0.0.37","140.82.113.25","TCP","66","48392  >  443 [ACK] Seq=518 Ack=2777 Win=63104 Len=0 TSval=1466019473 TSecr=1524331881"
"278","2.809385586","140.82.113.25","10.0.0.37","TLSv1.3","109","Application Data"
"279","2.809409735","10.0.0.37","140.82.113.25","TCP","66","48392  >  443 [ACK] Seq=518 Ack=2820 Win=64128 Len=0 TSval=1466019474 TSecr=1524331881"
"281","2.814655231","10.0.0.37","140.82.113.25","TLSv1.3","130","Change Cipher Spec, Application Data"
"282","2.815036436","10.0.0.37","140.82.113.25","TLSv1.3","1155","Application Data"
"284","2.890692984","2a03:2880:f242:c8:face:b00c:0:167","2a10:8012:15:af5e:c336:78fe:e399:341e","TLSv1.3","462","Application Data"
"289","2.932462573","2a10:8012:15:af5e:c336:78fe:e399:341e","2a03:2880:f242:c8:face:b00c:0:167","TCP","86","52164  >  443 [ACK] Seq=1156 Ack=937 Win=64256 Len=0 TSval=3290085602 TSecr=3567667698"
"293","2.956669808","140.82.113.25","10.0.0.37","TLSv1.3","145","Application Data"
"294","2.959034593","140.82.113.25","10.0.0.37","TLSv1.3","145","Application Data"
"295","2.959183510","10.0.0.37","140.82.113.25","TCP","66","48392  >  443 [ACK] Seq=1671 Ack=2978 Win=64128 Len=0 TSval=1466019624 TSecr=1524332032"
"296","2.961969888","140.82.113.25","10.0.0.37","TLSv1.3","567","Application Data"
"297","2.963316010","10.0.0.37","140.82.113.25","TLSv1.3","270","Application Data"
"301","3.052363659","2a10:8012:15:af5e:c336:78fe:e399:341e","2a03:2880:f242:c8:face:b00c:0:167","TLSv1.3","267","Application Data"
"302","3.057672288","2a10:8012:15:af5e:c336:78fe:e399:341e","2a03:2880:f242:c8:face:b00c:0:167","TLSv1.3","166","Application Data"
"303","3.057718512","2a10:8012:15:af5e:c336:78fe:e399:341e","2a03:2880:f242:c8:face:b00c:0:167","TLSv1.3","181","Application Data"
"304","3.058142139","2a10:8012:15:af5e:c336:78fe:e399:341e","2a03:2880:f242:c8:face:b00c:0:167","TLSv1.3","359","Application Data, Application Data, Application Data"
"312","3.100006278","2a03:2880:f242:c8:face:b00c:0:167","2a10:8012:15:af5e:c336:78fe:e399:341e","TCP","86","443  >  52164 [ACK] Seq=937 Ack=1337 Win=68864 Len=0 TSval=3567667908 TSecr=3290085722"
"315","3.106356132","2a03:2880:f242:c8:face:b00c:0:167","2a10:8012:15:af5e:c336:78fe:e399:341e","TCP","86","443  >  52164 [ACK] Seq=937 Ack=1417 Win=68864 Len=0 TSval=3567667914 TSecr=3290085727"
"316","3.106356476","2a03:2880:f242:c8:face:b00c:0:167","2a10:8012:15:af5e:c336:78fe:e399:341e","TCP","86","443  >  52164 [ACK] Seq=937 Ack=1512 Win=68864 Len=0 TSval=3567667914 TSecr=3290085727"
"317","3.107617225","140.82.113.25","10.0.0.37","TLSv1.3","139","Application Data"
"318","3.107617497","2a03:2880:f242:c8:face:b00c:0:167","2a10:8012:15:af5e:c336:78fe:e399:341e","TCP","86","443  >  52164 [ACK] Seq=937 Ack=1785 Win=69888 Len=0 TSval=3567667915 TSecr=3290085728"
"319","3.148608286","10.0.0.37","140.82.113.25","TCP","66","48392  >  443 [ACK] Seq=1875 Ack=3552 Win=64128 Len=0 TSval=1466019813 TSecr=1524332182"
"326","3.233015542","2a03:2880:f242:c8:face:b00c:0:167","2a10:8012:15:af5e:c336:78fe:e399:341e","TLSv1.3","256","Application Data"
"327","3.233057366","2a10:8012:15:af5e:c336:78fe:e399:341e","2a03:2880:f242:c8:face:b00c:0:167","TCP","86","52164  >  443 [ACK] Seq=1785 Ack=1107 Win=64128 Len=0 TSval=3290085903 TSecr=3567668038"
"330","3.373618890","2a03:2880:f242:c8:face:b00c:0:167","2a10:8012:15:af5e:c336:78fe:e399:341e","TLSv1.3","156","Application Data"
"331","3.373659788","2a10:8012:15:af5e:c336:78fe:e399:341e","2a03:2880:f242:c8:face:b00c:0:167","TCP","86","52164  >  443 [ACK] Seq=1785 Ack=1177 Win=64128 Len=0 TSval=3290086043 TSecr=3567668181"
"332","3.375990111","2a03:2880:f242:c8:face:b00c:0:167","2a10:8012:15:af5e:c336:78fe:e399:341e","TLSv1.3","159","Application Data"
"333","3.375990366","2a03:2880:f242:c8:face:b00c:0:167","2a10:8012:15:af5e:c336:78fe:e399:341e","TLSv1.3","159","Application Data"
"334","3.376022189","2a10:8012:15:af5e:c336:78fe:e399:341e","2a03:2880:f242:c8:face:b00c:0:167","TCP","86","52164  >  443 [ACK] Seq=1785 Ack=1250 Win=64128 Len=0 TSval=3290086046 TSecr=3567668184"
"335","3.376043682","2a10:8012:15:af5e:c336:78fe:e399:341e","2a03:2880:f242:c8:face:b00c:0:167","TCP","86","52164  >  443 [ACK] Seq=1785 Ack=1323 Win=64128 Len=0 TSval=3290086046 TSecr=3567668184"
"336","3.381350933","2a03:2880:f242:c8:face:b00c:0:167","2a10:8012:15:af5e:c336:78fe:e399:341e","TCP","159","[TCP Spurious Retransmission] 443  >  52164 [PSH, ACK] Seq=1250 Ack=1785 Win=69888 Len=73 TSval=3567668190 TSecr=3290085728"
"337","3.381370490","2a10:8012:15:af5e:c336:78fe:e399:341e","2a03:2880:f242:c8:face:b00c:0:167","TCP","98","[TCP Dup ACK 335#1] 52164  >  443 [ACK] Seq=1785 Ack=1323 Win=64128 Len=0 TSval=3290086051 TSecr=3567668190 SLE=1250 SRE=1323"
"342","3.429666836","2a03:2880:f242:c8:face:b00c:0:167","2a10:8012:15:af5e:c336:78fe:e399:341e","TLSv1.3","147","Application Data"
"343","3.429695582","2a10:8012:15:af5e:c336:78fe:e399:341e","2a03:2880:f242:c8:face:b00c:0:167","TCP","86","52164  >  443 [ACK] Seq=1785 Ack=1384 Win=64128 Len=0 TSval=3290086099 TSecr=3567668233"
"344","3.442578269","2a03:2880:f242:c8:face:b00c:0:167","2a10:8012:15:af5e:c336:78fe:e399:341e","TLSv1.3","159","Application Data"
"345","3.442578632","2a03:2880:f242:c8:face:b00c:0:167","2a10:8012:15:af5e:c336:78fe:e399:341e","TLSv1.3","159","Application Data"
"346","3.442611109","2a10:8012:15:af5e:c336:78fe:e399:341e","2a03:2880:f242:c8:face:b00c:0:167","TCP","86","52164  >  443 [ACK] Seq=1785 Ack=1457 Win=64128 Len=0 TSval=3290086112 TSecr=3567668247"
"347","3.442633744","2a10:8012:15:af5e:c336:78fe:e399:341e","2a03:2880:f242:c8:face:b00c:0:167","TCP","86","52164  >  443 [ACK] Seq=1785 Ack=1530 Win=64128 Len=0 TSval=3290086112 TSecr=3567668250"
"352","3.700028287","2a03:2880:f242:c8:face:b00c:0:167","2a10:8012:15:af5e:c336:78fe:e399:341e","TCP","509","[TCP Spurious Retransmission] 443  >  52164 [PSH, ACK] Seq=1107 Ack=1785 Win=69888 Len=423 TSval=3567668432 TSecr=3290085903"
"353","3.700061578","2a10:8012:15:af5e:c336:78fe:e399:341e","2a03:2880:f242:c8:face:b00c:0:167","TCP","98","[TCP Dup ACK 347#1] 52164  >  443 [ACK] Seq=1785 Ack=1530 Win=64128 Len=0 TSval=3290086370 TSecr=3567668432 SLE=1107 SRE=1530"
"380","4.149029623","2a03:2880:f242:c8:face:b00c:0:167","2a10:8012:15:af5e:c336:78fe:e399:341e","TCP","1466","443  >  52164 [ACK] Seq=1530 Ack=1785 Win=69888 Len=1380 TSval=3567668953 TSecr=3290086112 [TCP segment of a reassembled PDU]"
"381","4.149070734","2a10:8012:15:af5e:c336:78fe:e399:341e","2a03:2880:f242:c8:face:b00c:0:167","TCP","86","52164  >  443 [ACK] Seq=1785 Ack=2910 Win=63104 Len=0 TSval=3290086819 TSecr=3567668953"
"382","4.150039787","2a03:2880:f242:c8:face:b00c:0:167","2a10:8012:15:af5e:c336:78fe:e399:341e","TLSv1.3","587","Application Data, Application Data"
"383","4.150076713","2a10:8012:15:af5e:c336:78fe:e399:341e","2a03:2880:f242:c8:face:b00c:0:167","TCP","86","52164  >  443 [ACK] Seq=1785 Ack=3411 Win=63104 Len=0 TSval=3290086820 TSecr=3567668953"
"386","4.227419153","2a10:8012:15:af5e:c336:78fe:e399:341e","2a03:2880:f242:c8:face:b00c:0:167","TLSv1.3","185","Application Data"
"387","4.374247957","2a03:2880:f242:c8:face:b00c:0:167","2a10:8012:15:af5e:c336:78fe:e399:341e","TCP","587","[TCP Spurious Retransmission] 443  >  52164 [PSH, ACK] Seq=2910 Ack=1785 Win=69888 Len=501 TSval=3567669182 TSecr=3290086370"
"388","4.374279833","2a10:8012:15:af5e:c336:78fe:e399:341e","2a03:2880:f242:c8:face:b00c:0:167","TCP","98","[TCP Dup ACK 383#1] 52164  >  443 [ACK] Seq=1884 Ack=3411 Win=64128 Len=0 TSval=3290087044 TSecr=3567669182 SLE=2910 SRE=3411"
"390","4.484470218","2a10:8012:15:af5e:c336:78fe:e399:341e","2a03:2880:f242:c8:face:b00c:0:167","TCP","185","[TCP Retransmission] 52164  >  443 [PSH, ACK] Seq=1785 Ack=3411 Win=64128 Len=99 TSval=3290087154 TSecr=3567669182"
"395","4.692886074","2a03:2880:f242:c8:face:b00c:0:167","2a10:8012:15:af5e:c336:78fe:e399:341e","TCP","86","443  >  52164 [ACK] Seq=3411 Ack=1884 Win=69888 Len=0 TSval=3567669501 TSecr=3290086897"
"396","4.839956357","2a03:2880:f242:c8:face:b00c:0:167","2a10:8012:15:af5e:c336:78fe:e399:341e","TCP","86","[TCP Dup ACK 395#1] 443  >  52164 [ACK] Seq=3411 Ack=1884 Win=69888 Len=0 TSval=3567669646 TSecr=3290087154"
"403","5.910370774","2a03:2880:f242:c8:face:b00c:0:167","2a10:8012:15:af5e:c336:78fe:e399:341e","TLSv1.3","1742","Application Data, Application Data"
"404","5.910408683","2a10:8012:15:af5e:c336:78fe:e399:341e","2a03:2880:f242:c8:face:b00c:0:167","TCP","86","52164  >  443 [ACK] Seq=1884 Ack=5067 Win=62592 Len=0 TSval=3290088580 TSecr=3567670717"
