"No.","Time","Source","Destination","Protocol","Length","Info"
"1","0.000000000","2a03:2880:f258:c8:face:b00c:0:167","2a00:a041:3c5d:4d00:b981:f170:feac:7cf9","TLSv1.2","160","Application Data"
"2","0.000022209","2a00:a041:3c5d:4d00:b981:f170:feac:7cf9","2a03:2880:f258:c8:face:b00c:0:167","TCP","88","39412  >  443 [ACK] Seq=1 Ack=73 Win=4404 Len=0 TSval=3660943979 TSecr=2509215698"
"25","28.952507471","2a00:a041:3c5d:4d00:b981:f170:feac:7cf9","2a03:2880:f258:c8:face:b00c:0:167","TLSv1.2","158","Application Data"
"26","29.038825458","2a03:2880:f258:c8:face:b00c:0:167","2a00:a041:3c5d:4d00:b981:f170:feac:7cf9","TCP","88","443  >  39412 [ACK] Seq=73 Ack=71 Win=1649 Len=0 TSval=2509244738 TSecr=3660972931"
"27","29.121223865","2a03:2880:f258:c8:face:b00c:0:167","2a00:a041:3c5d:4d00:b981:f170:feac:7cf9","TLSv1.2","160","Application Data"
"28","29.121258844","2a00:a041:3c5d:4d00:b981:f170:feac:7cf9","2a03:2880:f258:c8:face:b00c:0:167","TCP","88","39412  >  443 [ACK] Seq=71 Ack=145 Win=4404 Len=0 TSval=3660973100 TSecr=2509244818"
"40","48.680053193","2a03:2880:f258:c8:face:b00c:0:167","2a00:a041:3c5d:4d00:b981:f170:feac:7cf9","TLSv1.2","311","Application Data"
"41","48.680094964","2a00:a041:3c5d:4d00:b981:f170:feac:7cf9","2a03:2880:f258:c8:face:b00c:0:167","TCP","88","39412  >  443 [ACK] Seq=71 Ack=368 Win=4404 Len=0 TSval=3660992659 TSecr=2509264337"
"42","48.713087157","2a00:a041:3c5d:4d00:b981:f170:feac:7cf9","2a03:2880:f258:c8:face:b00c:0:167","TLSv1.2","162","Application Data"
"43","49.042923388","2a00:a041:3c5d:4d00:b981:f170:feac:7cf9","2a03:2880:f258:c8:face:b00c:0:167","TCP","162","[TCP Retransmission] 39412  >  443 [PSH, ACK] Seq=71 Ack=368 Win=4404 Len=74 TSval=3660993022 TSecr=2509264337"
"44","49.065612153","2a03:2880:f258:c8:face:b00c:0:167","2a00:a041:3c5d:4d00:b981:f170:feac:7cf9","TCP","88","443  >  39412 [ACK] Seq=368 Ack=145 Win=1649 Len=0 TSval=2509264719 TSecr=3660992692"
"45","49.499493862","2a03:2880:f258:c8:face:b00c:0:167","2a00:a041:3c5d:4d00:b981:f170:feac:7cf9","TCP","88","[TCP Dup ACK 44#1] 443  >  39412 [ACK] Seq=368 Ack=145 Win=1649 Len=0 TSval=2509265128 TSecr=3660993022"
"47","53.206796475","2a03:2880:f258:c8:face:b00c:0:167","2a00:a041:3c5d:4d00:b981:f170:feac:7cf9","TCP","1468","443  >  39412 [ACK] Seq=368 Ack=145 Win=1649 Len=1380 TSval=2509268832 TSecr=3660993022 [TCP segment of a reassembled PDU]"
"48","53.207005668","2a03:2880:f258:c8:face:b00c:0:167","2a00:a041:3c5d:4d00:b981:f170:feac:7cf9","TLSv1.2","221","Application Data"
"49","53.207005757","2a03:2880:f258:c8:face:b00c:0:167","2a00:a041:3c5d:4d00:b981:f170:feac:7cf9","TLSv1.2","2073","Application Data, Application Data"
"50","53.207029942","2a00:a041:3c5d:4d00:b981:f170:feac:7cf9","2a03:2880:f258:c8:face:b00c:0:167","TCP","88","39412  >  443 [ACK] Seq=145 Ack=1881 Win=4404 Len=0 TSval=3660997186 TSecr=2509268832"
"51","53.207094065","2a00:a041:3c5d:4d00:b981:f170:feac:7cf9","2a03:2880:f258:c8:face:b00c:0:167","TCP","88","39412  >  443 [ACK] Seq=145 Ack=3866 Win=4389 Len=0 TSval=3660997186 TSecr=2509268833"
"52","53.477521400","2a00:a041:3c5d:4d00:b981:f170:feac:7cf9","2a03:2880:f258:c8:face:b00c:0:167","TLSv1.2","181","Application Data"
"53","53.566705929","2a03:2880:f258:c8:face:b00c:0:167","2a00:a041:3c5d:4d00:b981:f170:feac:7cf9","TCP","88","443  >  39412 [ACK] Seq=3866 Ack=238 Win=1649 Len=0 TSval=2509269253 TSecr=3660997456"
"65","56.888001820","2a00:a041:3c5d:4d00:b981:f170:feac:7cf9","2a03:2880:f258:c8:face:b00c:0:167","TLSv1.2","158","Application Data"
"66","56.986598632","2a03:2880:f258:c8:face:b00c:0:167","2a00:a041:3c5d:4d00:b981:f170:feac:7cf9","TCP","88","443  >  39412 [ACK] Seq=3866 Ack=308 Win=1649 Len=0 TSval=2509272673 TSecr=3661000867"
"67","57.055901752","2a03:2880:f258:c8:face:b00c:0:167","2a00:a041:3c5d:4d00:b981:f170:feac:7cf9","TLSv1.2","160","Application Data"
"68","57.098986799","2a00:a041:3c5d:4d00:b981:f170:feac:7cf9","2a03:2880:f258:c8:face:b00c:0:167","TCP","88","39412  >  443 [ACK] Seq=308 Ack=3938 Win=4404 Len=0 TSval=3661001078 TSecr=2509272754"
"69","58.101180067","2a03:2880:f258:c8:face:b00c:0:167","2a00:a041:3c5d:4d00:b981:f170:feac:7cf9","TLSv1.2","181","Application Data"
"70","58.101218744","2a00:a041:3c5d:4d00:b981:f170:feac:7cf9","2a03:2880:f258:c8:face:b00c:0:167","TCP","88","39412  >  443 [ACK] Seq=308 Ack=4031 Win=4404 Len=0 TSval=3661002080 TSecr=2509273755"
"71","58.106955746","2a00:a041:3c5d:4d00:b981:f170:feac:7cf9","2a03:2880:f258:c8:face:b00c:0:167","TLSv1.2","180","Application Data"
"72","58.184365071","2a03:2880:f258:c8:face:b00c:0:167","2a00:a041:3c5d:4d00:b981:f170:feac:7cf9","TCP","88","443  >  39412 [ACK] Seq=4031 Ack=400 Win=1649 Len=0 TSval=2509273882 TSecr=3661002086"
"73","63.407080729","2a00:a041:3c5d:4d00:b981:f170:feac:7cf9","2a03:2880:f258:c8:face:b00c:0:167","TLSv1.2","1688","Application Data"
"74","63.492214808","2a03:2880:f258:c8:face:b00c:0:167","2a00:a041:3c5d:4d00:b981:f170:feac:7cf9","TCP","88","443  >  39412 [ACK] Seq=4031 Ack=2000 Win=1661 Len=0 TSval=2509279189 TSecr=3661007386"
"75","63.571760739","2a03:2880:f258:c8:face:b00c:0:167","2a00:a041:3c5d:4d00:b981:f170:feac:7cf9","TLSv1.2","152","Application Data"
"76","63.614885410","2a00:a041:3c5d:4d00:b981:f170:feac:7cf9","2a03:2880:f258:c8:face:b00c:0:167","TCP","88","39412  >  443 [ACK] Seq=2000 Ack=4095 Win=4404 Len=0 TSval=3661007594 TSecr=2509279269"
"87","70.276730427","2a03:2880:f258:c8:face:b00c:0:167","2a00:a041:3c5d:4d00:b981:f170:feac:7cf9","TLSv1.2","193","Application Data"
"88","70.276778485","2a00:a041:3c5d:4d00:b981:f170:feac:7cf9","2a03:2880:f258:c8:face:b00c:0:167","TCP","88","39412  >  443 [ACK] Seq=2000 Ack=4200 Win=4404 Len=0 TSval=3661014256 TSecr=2509285975"
"89","70.281663441","2a00:a041:3c5d:4d00:b981:f170:feac:7cf9","2a03:2880:f258:c8:face:b00c:0:167","TLSv1.2","168","Application Data"
"91","70.360192372","2a03:2880:f258:c8:face:b00c:0:167","2a00:a041:3c5d:4d00:b981:f170:feac:7cf9","TCP","88","443  >  39412 [ACK] Seq=4200 Ack=2080 Win=1661 Len=0 TSval=2509286059 TSecr=3661014260"
"92","70.455966591","2a03:2880:f258:c8:face:b00c:0:167","2a00:a041:3c5d:4d00:b981:f170:feac:7cf9","TLSv1.2","470","Application Data"
"93","70.498807093","2a00:a041:3c5d:4d00:b981:f170:feac:7cf9","2a03:2880:f258:c8:face:b00c:0:167","TCP","88","39412  >  443 [ACK] Seq=2080 Ack=4582 Win=4404 Len=0 TSval=3661014478 TSecr=2509286154"
"96","70.823857539","2a00:a041:3c5d:4d00:b981:f170:feac:7cf9","2a03:2880:f258:c8:face:b00c:0:167","TLSv1.2","187","Application Data"
"97","70.901525168","2a03:2880:f258:c8:face:b00c:0:167","2a00:a041:3c5d:4d00:b981:f170:feac:7cf9","TCP","88","443  >  39412 [ACK] Seq=4582 Ack=2179 Win=1661 Len=0 TSval=2509286600 TSecr=3661014803"
"105","74.382955279","2a03:2880:f258:c8:face:b00c:0:167","2a00:a041:3c5d:4d00:b981:f170:feac:7cf9","TLSv1.2","665","Application Data"
"106","74.382994846","2a00:a041:3c5d:4d00:b981:f170:feac:7cf9","2a03:2880:f258:c8:face:b00c:0:167","TCP","88","39412  >  443 [ACK] Seq=2179 Ack=5159 Win=4404 Len=0 TSval=3661018362 TSecr=2509289911"
"107","74.383023371","2a03:2880:f258:c8:face:b00c:0:167","2a00:a041:3c5d:4d00:b981:f170:feac:7cf9","TLSv1.2","240","Application Data"
"108","74.383030732","2a00:a041:3c5d:4d00:b981:f170:feac:7cf9","2a03:2880:f258:c8:face:b00c:0:167","TCP","88","39412  >  443 [ACK] Seq=2179 Ack=5311 Win=4403 Len=0 TSval=3661018362 TSecr=2509289920"
"109","74.424339429","2a03:2880:f258:c8:face:b00c:0:167","2a00:a041:3c5d:4d00:b981:f170:feac:7cf9","TCP","240","[TCP Spurious Retransmission] 443  >  39412 [PSH, ACK] Seq=5159 Ack=2179 Win=1661 Len=152 TSval=2509290123 TSecr=3661014803"
"110","74.424365956","2a00:a041:3c5d:4d00:b981:f170:feac:7cf9","2a03:2880:f258:c8:face:b00c:0:167","TCP","100","[TCP Window Update] 39412  >  443 [ACK] Seq=2179 Ack=5311 Win=4404 Len=0 TSval=3661018403 TSecr=2509290123 SLE=5159 SRE=5311"
"111","74.463631335","2a00:a041:3c5d:4d00:b981:f170:feac:7cf9","2a03:2880:f258:c8:face:b00c:0:167","TLSv1.2","162","Application Data"
"112","74.540788252","2a03:2880:f258:c8:face:b00c:0:167","2a00:a041:3c5d:4d00:b981:f170:feac:7cf9","TCP","88","443  >  39412 [ACK] Seq=5311 Ack=2253 Win=1661 Len=0 TSval=2509290239 TSecr=3661018442"
"113","74.822004528","2a00:a041:3c5d:4d00:b981:f170:feac:7cf9","2a03:2880:f258:c8:face:b00c:0:167","TLSv1.2","163","Application Data"
"114","74.899430729","2a03:2880:f258:c8:face:b00c:0:167","2a00:a041:3c5d:4d00:b981:f170:feac:7cf9","TCP","88","443  >  39412 [ACK] Seq=5311 Ack=2328 Win=1661 Len=0 TSval=2509290598 TSecr=3661018801"
"118","78.376332320","2a03:2880:f258:c8:face:b00c:0:167","2a00:a041:3c5d:4d00:b981:f170:feac:7cf9","TLSv1.2","665","Application Data"
"119","78.376369223","2a00:a041:3c5d:4d00:b981:f170:feac:7cf9","2a03:2880:f258:c8:face:b00c:0:167","TCP","88","39412  >  443 [ACK] Seq=2328 Ack=5888 Win=4404 Len=0 TSval=3661022355 TSecr=2509293997"
"120","78.675591953","2a00:a041:3c5d:4d00:b981:f170:feac:7cf9","2a03:2880:f258:c8:face:b00c:0:167","TLSv1.2","163","Application Data"
"121","78.758483255","2a03:2880:f258:c8:face:b00c:0:167","2a00:a041:3c5d:4d00:b981:f170:feac:7cf9","TCP","88","443  >  39412 [ACK] Seq=5888 Ack=2403 Win=1661 Len=0 TSval=2509294457 TSecr=3661022654"
"123","81.095071566","2a00:a041:3c5d:4d00:b981:f170:feac:7cf9","2a03:2880:f258:c8:face:b00c:0:167","TLSv1.2","158","Application Data"
"124","81.174602615","2a03:2880:f258:c8:face:b00c:0:167","2a00:a041:3c5d:4d00:b981:f170:feac:7cf9","TCP","88","443  >  39412 [ACK] Seq=5888 Ack=2473 Win=1661 Len=0 TSval=2509296872 TSecr=3661025074"
"125","81.345969362","2a03:2880:f258:c8:face:b00c:0:167","2a00:a041:3c5d:4d00:b981:f170:feac:7cf9","TLSv1.2","160","Application Data"
"126","81.346007438","2a00:a041:3c5d:4d00:b981:f170:feac:7cf9","2a03:2880:f258:c8:face:b00c:0:167","TCP","88","39412  >  443 [ACK] Seq=2473 Ack=5960 Win=4404 Len=0 TSval=3661025325 TSecr=2509296952"
"127","83.291861565","2a03:2880:f258:c8:face:b00c:0:167","2a00:a041:3c5d:4d00:b981:f170:feac:7cf9","TLSv1.2","633","Application Data"
"128","83.291898988","2a00:a041:3c5d:4d00:b981:f170:feac:7cf9","2a03:2880:f258:c8:face:b00c:0:167","TCP","88","39412  >  443 [ACK] Seq=2473 Ack=6505 Win=4404 Len=0 TSval=3661027271 TSecr=2509298904"
"129","83.662581548","2a00:a041:3c5d:4d00:b981:f170:feac:7cf9","2a03:2880:f258:c8:face:b00c:0:167","TLSv1.2","163","Application Data"
"130","83.741523179","2a03:2880:f258:c8:face:b00c:0:167","2a00:a041:3c5d:4d00:b981:f170:feac:7cf9","TCP","88","443  >  39412 [ACK] Seq=6505 Ack=2548 Win=1661 Len=0 TSval=2509299440 TSecr=3661027641"
"138","89.747754514","2a03:2880:f258:c8:face:b00c:0:167","2a00:a041:3c5d:4d00:b981:f170:feac:7cf9","TLSv1.2","357","Application Data"
"139","89.747795731","2a00:a041:3c5d:4d00:b981:f170:feac:7cf9","2a03:2880:f258:c8:face:b00c:0:167","TCP","88","39412  >  443 [ACK] Seq=2548 Ack=6774 Win=4404 Len=0 TSval=3661033727 TSecr=2509305360"
"140","89.927676295","2a00:a041:3c5d:4d00:b981:f170:feac:7cf9","2a03:2880:f258:c8:face:b00c:0:167","TLSv1.2","187","Application Data"
"141","90.010388178","2a03:2880:f258:c8:face:b00c:0:167","2a00:a041:3c5d:4d00:b981:f170:feac:7cf9","TCP","88","443  >  39412 [ACK] Seq=6774 Ack=2647 Win=1661 Len=0 TSval=2509305708 TSecr=3661033906"
"158","96.818914445","2a00:a041:3c5d:4d00:b981:f170:feac:7cf9","2a03:2880:f258:c8:face:b00c:0:167","TLSv1.2","158","Application Data"
"159","96.899271240","2a03:2880:f258:c8:face:b00c:0:167","2a00:a041:3c5d:4d00:b981:f170:feac:7cf9","TCP","88","443  >  39412 [ACK] Seq=6774 Ack=2717 Win=1661 Len=0 TSval=2509312597 TSecr=3661040798"
"160","96.979408339","2a03:2880:f258:c8:face:b00c:0:167","2a00:a041:3c5d:4d00:b981:f170:feac:7cf9","TLSv1.2","160","Application Data"
"161","96.979442286","2a00:a041:3c5d:4d00:b981:f170:feac:7cf9","2a03:2880:f258:c8:face:b00c:0:167","TCP","88","39412  >  443 [ACK] Seq=2717 Ack=6846 Win=4404 Len=0 TSval=3661040958 TSecr=2509312677"
"170","105.308304494","2a03:2880:f258:c8:face:b00c:0:167","2a00:a041:3c5d:4d00:b981:f170:feac:7cf9","TLSv1.2","183","Application Data"
"171","105.308352889","2a00:a041:3c5d:4d00:b981:f170:feac:7cf9","2a03:2880:f258:c8:face:b00c:0:167","TCP","88","39412  >  443 [ACK] Seq=2717 Ack=6941 Win=4404 Len=0 TSval=3661049287 TSecr=2509320986"
"172","105.313553039","2a00:a041:3c5d:4d00:b981:f170:feac:7cf9","2a03:2880:f258:c8:face:b00c:0:167","TLSv1.2","182","Application Data"
"173","105.394443700","2a03:2880:f258:c8:face:b00c:0:167","2a00:a041:3c5d:4d00:b981:f170:feac:7cf9","TCP","88","443  >  39412 [ACK] Seq=6941 Ack=2811 Win=1661 Len=0 TSval=2509321092 TSecr=3661049292"
"174","109.301613301","2a03:2880:f258:c8:face:b00c:0:167","2a00:a041:3c5d:4d00:b981:f170:feac:7cf9","TLSv1.2","232","Application Data"
"175","109.304870801","2a00:a041:3c5d:4d00:b981:f170:feac:7cf9","2a03:2880:f258:c8:face:b00c:0:167","TLSv1.2","167","Application Data"
"176","109.379232599","2a03:2880:f258:c8:face:b00c:0:167","2a00:a041:3c5d:4d00:b981:f170:feac:7cf9","TCP","88","443  >  39412 [ACK] Seq=7085 Ack=2890 Win=1661 Len=0 TSval=2509325078 TSecr=3661053284"
"179","112.169230132","2a03:2880:f258:c8:face:b00c:0:167","2a00:a041:3c5d:4d00:b981:f170:feac:7cf9","TLSv1.2","368","Application Data"
"180","112.210815556","2a00:a041:3c5d:4d00:b981:f170:feac:7cf9","2a03:2880:f258:c8:face:b00c:0:167","TCP","88","39412  >  443 [ACK] Seq=2890 Ack=7365 Win=4404 Len=0 TSval=3661056190 TSecr=2509327767"
"181","112.258468261","2a03:2880:f258:c8:face:b00c:0:167","2a00:a041:3c5d:4d00:b981:f170:feac:7cf9","TLSv1.2","168","Application Data"
"182","112.258497279","2a00:a041:3c5d:4d00:b981:f170:feac:7cf9","2a03:2880:f258:c8:face:b00c:0:167","TCP","88","39412  >  443 [ACK] Seq=2890 Ack=7445 Win=4404 Len=0 TSval=3661056237 TSecr=2509327956"
"183","112.261489384","2a00:a041:3c5d:4d00:b981:f170:feac:7cf9","2a03:2880:f258:c8:face:b00c:0:167","TLSv1.2","166","Application Data"
"184","112.348978619","2a03:2880:f258:c8:face:b00c:0:167","2a00:a041:3c5d:4d00:b981:f170:feac:7cf9","TCP","88","443  >  39412 [ACK] Seq=7445 Ack=2968 Win=1661 Len=0 TSval=2509328046 TSecr=3661056240"
"185","112.420818822","2a03:2880:f258:c8:face:b00c:0:167","2a00:a041:3c5d:4d00:b981:f170:feac:7cf9","TLSv1.2","167","Application Data"
"186","112.424727558","2a00:a041:3c5d:4d00:b981:f170:feac:7cf9","2a03:2880:f258:c8:face:b00c:0:167","TLSv1.2","165","Application Data"
"187","112.509804438","2a03:2880:f258:c8:face:b00c:0:167","2a00:a041:3c5d:4d00:b981:f170:feac:7cf9","TCP","88","443  >  39412 [ACK] Seq=7524 Ack=3045 Win=1661 Len=0 TSval=2509328200 TSecr=3661056403"
"188","112.523251050","2a00:a041:3c5d:4d00:b981:f170:feac:7cf9","2a03:2880:f258:c8:face:b00c:0:167","TLSv1.2","177","Application Data"
"189","112.628950924","2a03:2880:f258:c8:face:b00c:0:167","2a00:a041:3c5d:4d00:b981:f170:feac:7cf9","TCP","88","443  >  39412 [ACK] Seq=7524 Ack=3134 Win=1661 Len=0 TSval=2509328327 TSecr=3661056502"
"200","126.594833659","2a00:a041:3c5d:4d00:b981:f170:feac:7cf9","2a03:2880:f258:c8:face:b00c:0:167","TLSv1.2","158","Application Data"
"201","126.675184601","2a03:2880:f258:c8:face:b00c:0:167","2a00:a041:3c5d:4d00:b981:f170:feac:7cf9","TCP","88","443  >  39412 [ACK] Seq=7524 Ack=3204 Win=1661 Len=0 TSval=2509342372 TSecr=3661070574"
"202","126.755204211","2a03:2880:f258:c8:face:b00c:0:167","2a00:a041:3c5d:4d00:b981:f170:feac:7cf9","TLSv1.2","160","Application Data"
"203","126.798970961","2a00:a041:3c5d:4d00:b981:f170:feac:7cf9","2a03:2880:f258:c8:face:b00c:0:167","TCP","88","39412  >  443 [ACK] Seq=3204 Ack=7596 Win=4404 Len=0 TSval=3661070778 TSecr=2509342453"
"204","127.328964117","2a03:2880:f258:c8:face:b00c:0:167","2a00:a041:3c5d:4d00:b981:f170:feac:7cf9","TLSv1.2","170","Application Data"
"205","127.329002523","2a00:a041:3c5d:4d00:b981:f170:feac:7cf9","2a03:2880:f258:c8:face:b00c:0:167","TCP","88","39412  >  443 [ACK] Seq=3204 Ack=7678 Win=4404 Len=0 TSval=3661071308 TSecr=2509342952"
"206","127.332748879","2a00:a041:3c5d:4d00:b981:f170:feac:7cf9","2a03:2880:f258:c8:face:b00c:0:167","TLSv1.2","168","Application Data"
"207","127.411625916","2a03:2880:f258:c8:face:b00c:0:167","2a00:a041:3c5d:4d00:b981:f170:feac:7cf9","TCP","88","443  >  39412 [ACK] Seq=7678 Ack=3284 Win=1661 Len=0 TSval=2509343110 TSecr=3661071311"
"211","135.311919490","2a03:2880:f258:c8:face:b00c:0:167","2a00:a041:3c5d:4d00:b981:f170:feac:7cf9","TLSv1.2","649","Application Data"
"212","135.354823576","2a00:a041:3c5d:4d00:b981:f170:feac:7cf9","2a03:2880:f258:c8:face:b00c:0:167","TCP","88","39412  >  443 [ACK] Seq=3284 Ack=8239 Win=4404 Len=0 TSval=3661079334 TSecr=2509350916"
"213","135.556377483","2a00:a041:3c5d:4d00:b981:f170:feac:7cf9","2a03:2880:f258:c8:face:b00c:0:167","TLSv1.2","163","Application Data"
"214","135.635761338","2a03:2880:f258:c8:face:b00c:0:167","2a00:a041:3c5d:4d00:b981:f170:feac:7cf9","TCP","88","443  >  39412 [ACK] Seq=8239 Ack=3359 Win=1661 Len=0 TSval=2509351333 TSecr=3661079535"
"224","150.672613321","2a03:2880:f258:c8:face:b00c:0:167","2a00:a041:3c5d:4d00:b981:f170:feac:7cf9","TCP","1468","443  >  39412 [ACK] Seq=8239 Ack=3359 Win=1661 Len=1380 TSval=2509366308 TSecr=3661079535 [TCP segment of a reassembled PDU]"
"225","150.672651163","2a00:a041:3c5d:4d00:b981:f170:feac:7cf9","2a03:2880:f258:c8:face:b00c:0:167","TCP","88","39412  >  443 [ACK] Seq=3359 Ack=9619 Win=4404 Len=0 TSval=3661094651 TSecr=2509366308"
"226","150.672710991","2a03:2880:f258:c8:face:b00c:0:167","2a00:a041:3c5d:4d00:b981:f170:feac:7cf9","TLSv1.2","221","Application Data"
"227","150.672711064","2a03:2880:f258:c8:face:b00c:0:167","2a00:a041:3c5d:4d00:b981:f170:feac:7cf9","TLSv1.2","1429","Application Data"
"228","150.672721352","2a00:a041:3c5d:4d00:b981:f170:feac:7cf9","2a03:2880:f258:c8:face:b00c:0:167","TCP","88","39412  >  443 [ACK] Seq=3359 Ack=9752 Win=4403 Len=0 TSval=3661094651 TSecr=2509366308"
"229","150.672728809","2a00:a041:3c5d:4d00:b981:f170:feac:7cf9","2a03:2880:f258:c8:face:b00c:0:167","TCP","88","39412  >  443 [ACK] Seq=3359 Ack=11093 Win=4393 Len=0 TSval=3661094651 TSecr=2509366309"
"230","150.902001082","2a00:a041:3c5d:4d00:b981:f170:feac:7cf9","2a03:2880:f258:c8:face:b00c:0:167","TLSv1.2","184","Application Data"
"231","151.218868432","2a00:a041:3c5d:4d00:b981:f170:feac:7cf9","2a03:2880:f258:c8:face:b00c:0:167","TCP","184","[TCP Retransmission] 39412  >  443 [PSH, ACK] Seq=3359 Ack=11093 Win=4404 Len=96 TSval=3661095198 TSecr=2509366309"
"232","151.388196213","2a03:2880:f258:c8:face:b00c:0:167","2a00:a041:3c5d:4d00:b981:f170:feac:7cf9","TCP","88","443  >  39412 [ACK] Seq=11093 Ack=3455 Win=1661 Len=0 TSval=2509367043 TSecr=3661094881"
"233","151.798970302","2a03:2880:f258:c8:face:b00c:0:167","2a00:a041:3c5d:4d00:b981:f170:feac:7cf9","TCP","88","[TCP Dup ACK 232#1] 443  >  39412 [ACK] Seq=11093 Ack=3455 Win=1661 Len=0 TSval=2509367407 TSecr=3661095198"
"234","152.443665336","2a00:a041:3c5d:4d00:b981:f170:feac:7cf9","2a03:2880:f258:c8:face:b00c:0:167","TLSv1.2","158","Application Data"
"235","152.946927593","2a00:a041:3c5d:4d00:b981:f170:feac:7cf9","2a03:2880:f258:c8:face:b00c:0:167","TCP","158","[TCP Retransmission] 39412  >  443 [PSH, ACK] Seq=3455 Ack=11093 Win=4404 Len=70 TSval=3661096926 TSecr=2509367407"
"236","153.051162954","2a03:2880:f258:c8:face:b00c:0:167","2a00:a041:3c5d:4d00:b981:f170:feac:7cf9","TCP","88","443  >  39412 [ACK] Seq=11093 Ack=3525 Win=1661 Len=0 TSval=2509368746 TSecr=3661096422"
"237","153.128775006","2a03:2880:f258:c8:face:b00c:0:167","2a00:a041:3c5d:4d00:b981:f170:feac:7cf9","TLSv1.2","160","Application Data"
"238","153.128797538","2a00:a041:3c5d:4d00:b981:f170:feac:7cf9","2a03:2880:f258:c8:face:b00c:0:167","TCP","88","39412  >  443 [ACK] Seq=3525 Ack=11165 Win=4404 Len=0 TSval=3661097108 TSecr=2509368826"
"239","153.437479595","2a03:2880:f258:c8:face:b00c:0:167","2a00:a041:3c5d:4d00:b981:f170:feac:7cf9","TCP","88","[TCP Dup ACK 236#1] 443  >  39412 [ACK] Seq=11165 Ack=3525 Win=1661 Len=0 TSval=2509369108 TSecr=3661097108"
"243","161.936196824","2a03:2880:f258:c8:face:b00c:0:167","2a00:a041:3c5d:4d00:b981:f170:feac:7cf9","TLSv1.2","602","Application Data"
"244","161.936237353","2a00:a041:3c5d:4d00:b981:f170:feac:7cf9","2a03:2880:f258:c8:face:b00c:0:167","TCP","88","39412  >  443 [ACK] Seq=3525 Ack=11679 Win=4404 Len=0 TSval=3661105915 TSecr=2509377592"
"245","162.170537436","2a00:a041:3c5d:4d00:b981:f170:feac:7cf9","2a03:2880:f258:c8:face:b00c:0:167","TLSv1.2","187","Application Data"
"246","162.755825497","2a03:2880:f258:c8:face:b00c:0:167","2a00:a041:3c5d:4d00:b981:f170:feac:7cf9","TCP","88","443  >  39412 [ACK] Seq=11679 Ack=3624 Win=1661 Len=0 TSval=2509378343 TSecr=3661106149"
"251","174.941070332","2a03:2880:f258:c8:face:b00c:0:167","2a00:a041:3c5d:4d00:b981:f170:feac:7cf9","TLSv1.2","158","Application Data"
"252","174.941111117","2a00:a041:3c5d:4d00:b981:f170:feac:7cf9","2a03:2880:f258:c8:face:b00c:0:167","TCP","88","39412  >  443 [ACK] Seq=3624 Ack=11749 Win=4404 Len=0 TSval=3661118920 TSecr=2509390549"
"253","180.062199639","2a03:2880:f258:c8:face:b00c:0:167","2a00:a041:3c5d:4d00:b981:f170:feac:7cf9","TCP","1468","443  >  39412 [ACK] Seq=11749 Ack=3624 Win=1661 Len=1380 TSval=2509395669 TSecr=3661118920 [TCP segment of a reassembled PDU]"
"254","180.062237606","2a00:a041:3c5d:4d00:b981:f170:feac:7cf9","2a03:2880:f258:c8:face:b00c:0:167","TCP","88","39412  >  443 [ACK] Seq=3624 Ack=13129 Win=4404 Len=0 TSval=3661124041 TSecr=2509395669"
"255","180.062393875","2a03:2880:f258:c8:face:b00c:0:167","2a00:a041:3c5d:4d00:b981:f170:feac:7cf9","TLSv1.2","221","Application Data"
"256","180.062404605","2a00:a041:3c5d:4d00:b981:f170:feac:7cf9","2a03:2880:f258:c8:face:b00c:0:167","TCP","88","39412  >  443 [ACK] Seq=3624 Ack=13262 Win=4403 Len=0 TSval=3661124041 TSecr=2509395669"
"257","180.065875360","2a03:2880:f258:c8:face:b00c:0:167","2a00:a041:3c5d:4d00:b981:f170:feac:7cf9","TLSv1.2","2848","Application Data"
"258","180.065875647","2a03:2880:f258:c8:face:b00c:0:167","2a00:a041:3c5d:4d00:b981:f170:feac:7cf9","TLSv1.2","481","Application Data"
"259","180.065911488","2a00:a041:3c5d:4d00:b981:f170:feac:7cf9","2a03:2880:f258:c8:face:b00c:0:167","TCP","88","39412  >  443 [ACK] Seq=3624 Ack=16022 Win=4388 Len=0 TSval=3661124045 TSecr=2509395671"
"260","180.065934618","2a00:a041:3c5d:4d00:b981:f170:feac:7cf9","2a03:2880:f258:c8:face:b00c:0:167","TCP","88","39412  >  443 [ACK] Seq=3624 Ack=16415 Win=4385 Len=0 TSval=3661124045 TSecr=2509395672"
"263","180.240021660","2a00:a041:3c5d:4d00:b981:f170:feac:7cf9","2a03:2880:f258:c8:face:b00c:0:167","TLSv1.2","181","Application Data"
"265","180.325075065","2a03:2880:f258:c8:face:b00c:0:167","2a00:a041:3c5d:4d00:b981:f170:feac:7cf9","TCP","88","443  >  39412 [ACK] Seq=16415 Ack=3717 Win=1661 Len=0 TSval=2509396023 TSecr=3661124219"
"266","180.716102082","2a00:a041:3c5d:4d00:b981:f170:feac:7cf9","2a03:2880:f258:c8:face:b00c:0:167","TLSv1.2","158","Application Data"
"267","180.797060400","2a03:2880:f258:c8:face:b00c:0:167","2a00:a041:3c5d:4d00:b981:f170:feac:7cf9","TCP","88","443  >  39412 [ACK] Seq=16415 Ack=3787 Win=1661 Len=0 TSval=2509396494 TSecr=3661124695"
"268","180.877095858","2a03:2880:f258:c8:face:b00c:0:167","2a00:a041:3c5d:4d00:b981:f170:feac:7cf9","TLSv1.2","160","Application Data"
"269","180.877138237","2a00:a041:3c5d:4d00:b981:f170:feac:7cf9","2a03:2880:f258:c8:face:b00c:0:167","TCP","88","39412  >  443 [ACK] Seq=3787 Ack=16487 Win=4404 Len=0 TSval=3661124856 TSecr=2509396575"
"270","182.518632137","2a03:2880:f258:c8:face:b00c:0:167","2a00:a041:3c5d:4d00:b981:f170:feac:7cf9","TLSv1.2","438","Application Data"
"271","182.518669094","2a00:a041:3c5d:4d00:b981:f170:feac:7cf9","2a03:2880:f258:c8:face:b00c:0:167","TCP","88","39412  >  443 [ACK] Seq=3787 Ack=16837 Win=4404 Len=0 TSval=3661126497 TSecr=2509398132"
"272","183.021990410","2a00:a041:3c5d:4d00:b981:f170:feac:7cf9","2a03:2880:f258:c8:face:b00c:0:167","TLSv1.2","187","Application Data"
"273","183.101000372","2a03:2880:f258:c8:face:b00c:0:167","2a00:a041:3c5d:4d00:b981:f170:feac:7cf9","TCP","88","443  >  39412 [ACK] Seq=16837 Ack=3886 Win=1661 Len=0 TSval=2509398799 TSecr=3661127001"
"274","184.259681399","2a03:2880:f258:c8:face:b00c:0:167","2a00:a041:3c5d:4d00:b981:f170:feac:7cf9","TLSv1.2","181","Application Data"
"275","184.259720379","2a00:a041:3c5d:4d00:b981:f170:feac:7cf9","2a03:2880:f258:c8:face:b00c:0:167","TCP","88","39412  >  443 [ACK] Seq=3886 Ack=16930 Win=4404 Len=0 TSval=3661128238 TSecr=2509399880"
"276","184.265204874","2a00:a041:3c5d:4d00:b981:f170:feac:7cf9","2a03:2880:f258:c8:face:b00c:0:167","TLSv1.2","180","Application Data"
"277","184.347735931","2a03:2880:f258:c8:face:b00c:0:167","2a00:a041:3c5d:4d00:b981:f170:feac:7cf9","TCP","88","443  >  39412 [ACK] Seq=16930 Ack=3978 Win=1661 Len=0 TSval=2509400046 TSecr=3661128244"
"284","199.148938925","2a00:a041:3c5d:4d00:b981:f170:feac:7cf9","2a03:2880:f258:c8:face:b00c:0:167","TLSv1.2","158","Application Data"
"285","199.311967721","2a03:2880:f258:c8:face:b00c:0:167","2a00:a041:3c5d:4d00:b981:f170:feac:7cf9","TCP","88","443  >  39412 [ACK] Seq=16930 Ack=4048 Win=1661 Len=0 TSval=2509414927 TSecr=3661143128"
"286","199.312375054","2a03:2880:f258:c8:face:b00c:0:167","2a00:a041:3c5d:4d00:b981:f170:feac:7cf9","TLSv1.2","160","Application Data"
"287","199.354803543","2a00:a041:3c5d:4d00:b981:f170:feac:7cf9","2a03:2880:f258:c8:face:b00c:0:167","TCP","88","39412  >  443 [ACK] Seq=4048 Ack=17002 Win=4404 Len=0 TSval=3661143334 TSecr=2509415008"
"291","202.288775145","2a03:2880:f258:c8:face:b00c:0:167","2a00:a041:3c5d:4d00:b981:f170:feac:7cf9","TLSv1.2","222","Application Data"
"292","202.288814310","2a00:a041:3c5d:4d00:b981:f170:feac:7cf9","2a03:2880:f258:c8:face:b00c:0:167","TCP","88","39412  >  443 [ACK] Seq=4048 Ack=17136 Win=4404 Len=0 TSval=3661146268 TSecr=2509417842"
"293","202.291513978","2a00:a041:3c5d:4d00:b981:f170:feac:7cf9","2a03:2880:f258:c8:face:b00c:0:167","TLSv1.2","162","Application Data"
"294","202.307949918","2a03:2880:f258:c8:face:b00c:0:167","2a00:a041:3c5d:4d00:b981:f170:feac:7cf9","TLSv1.2","359","Application Data"
"295","202.350841190","2a00:a041:3c5d:4d00:b981:f170:feac:7cf9","2a03:2880:f258:c8:face:b00c:0:167","TCP","88","39412  >  443 [ACK] Seq=4122 Ack=17407 Win=4404 Len=0 TSval=3661146330 TSecr=2509418004"
"296","202.369115194","2a03:2880:f258:c8:face:b00c:0:167","2a00:a041:3c5d:4d00:b981:f170:feac:7cf9","TCP","88","443  >  39412 [ACK] Seq=17407 Ack=4122 Win=1661 Len=0 TSval=2509418066 TSecr=3661146270"
"297","202.575347829","2a00:a041:3c5d:4d00:b981:f170:feac:7cf9","2a03:2880:f258:c8:face:b00c:0:167","TLSv1.2","187","Application Data"
"298","202.661785472","2a03:2880:f258:c8:face:b00c:0:167","2a00:a041:3c5d:4d00:b981:f170:feac:7cf9","TCP","88","443  >  39412 [ACK] Seq=17407 Ack=4221 Win=1661 Len=0 TSval=2509418359 TSecr=3661146554"
"300","206.481745412","2a03:2880:f258:c8:face:b00c:0:167","2a00:a041:3c5d:4d00:b981:f170:feac:7cf9","TLSv1.2","183","Application Data"
"301","206.481780034","2a00:a041:3c5d:4d00:b981:f170:feac:7cf9","2a03:2880:f258:c8:face:b00c:0:167","TCP","88","39412  >  443 [ACK] Seq=4221 Ack=17502 Win=4404 Len=0 TSval=3661150461 TSecr=2509422147"
"302","206.487191886","2a00:a041:3c5d:4d00:b981:f170:feac:7cf9","2a03:2880:f258:c8:face:b00c:0:167","TLSv1.2","182","Application Data"
"303","206.570787422","2a03:2880:f258:c8:face:b00c:0:167","2a00:a041:3c5d:4d00:b981:f170:feac:7cf9","TCP","88","443  >  39412 [ACK] Seq=17502 Ack=4315 Win=1661 Len=0 TSval=2509422268 TSecr=3661150466"
"307","214.964121185","2a00:a041:3c5d:4d00:b981:f170:feac:7cf9","2a03:2880:f258:c8:face:b00c:0:167","TLSv1.2","158","Application Data"
"308","215.188820087","2a03:2880:f258:c8:face:b00c:0:167","2a00:a041:3c5d:4d00:b981:f170:feac:7cf9","TLSv1.2","160","Application Data"
"309","215.230983099","2a00:a041:3c5d:4d00:b981:f170:feac:7cf9","2a03:2880:f258:c8:face:b00c:0:167","TCP","88","39412  >  443 [ACK] Seq=4385 Ack=17574 Win=4404 Len=0 TSval=3661159210 TSecr=2509430851"
"311","222.762664783","2a03:2880:f258:c8:face:b00c:0:167","2a00:a041:3c5d:4d00:b981:f170:feac:7cf9","TLSv1.2","506","Application Data"
"312","222.762701094","2a00:a041:3c5d:4d00:b981:f170:feac:7cf9","2a03:2880:f258:c8:face:b00c:0:167","TCP","88","39412  >  443 [ACK] Seq=4385 Ack=17992 Win=4404 Len=0 TSval=3661166741 TSecr=2509438426"
"313","222.855824726","2a00:a041:3c5d:4d00:b981:f170:feac:7cf9","2a03:2880:f258:c8:face:b00c:0:167","TLSv1.2","187","Application Data"
"314","222.933539432","2a03:2880:f258:c8:face:b00c:0:167","2a00:a041:3c5d:4d00:b981:f170:feac:7cf9","TCP","88","443  >  39412 [ACK] Seq=17992 Ack=4484 Win=1661 Len=0 TSval=2509438631 TSecr=3661166835"
"334","233.181025791","2a00:a041:3c5d:4d00:b981:f170:feac:7cf9","2a03:2880:f258:c8:face:b00c:0:167","TLSv1.2","158","Application Data"
"335","233.259000517","2a03:2880:f258:c8:face:b00c:0:167","2a00:a041:3c5d:4d00:b981:f170:feac:7cf9","TCP","88","443  >  39412 [ACK] Seq=17992 Ack=4554 Win=1661 Len=0 TSval=2509448957 TSecr=3661177160"
"336","233.339398933","2a03:2880:f258:c8:face:b00c:0:167","2a00:a041:3c5d:4d00:b981:f170:feac:7cf9","TLSv1.2","160","Application Data"
"337","233.339434400","2a00:a041:3c5d:4d00:b981:f170:feac:7cf9","2a03:2880:f258:c8:face:b00c:0:167","TCP","88","39412  >  443 [ACK] Seq=4554 Ack=18064 Win=4404 Len=0 TSval=3661177318 TSecr=2509449037"
"338","237.201289457","2a03:2880:f258:c8:face:b00c:0:167","2a00:a041:3c5d:4d00:b981:f170:feac:7cf9","TLSv1.2","407","Application Data"
"339","237.201338839","2a00:a041:3c5d:4d00:b981:f170:feac:7cf9","2a03:2880:f258:c8:face:b00c:0:167","TCP","88","39412  >  443 [ACK] Seq=4554 Ack=18383 Win=4404 Len=0 TSval=3661181180 TSecr=2509452845"
"340","237.433931115","2a00:a041:3c5d:4d00:b981:f170:feac:7cf9","2a03:2880:f258:c8:face:b00c:0:167","TLSv1.2","187","Application Data"
"341","237.714088321","2a03:2880:f258:c8:face:b00c:0:167","2a00:a041:3c5d:4d00:b981:f170:feac:7cf9","TCP","88","443  >  39412 [ACK] Seq=18383 Ack=4653 Win=1661 Len=0 TSval=2509453368 TSecr=3661181413"
"345","243.755152764","2a03:2880:f258:c8:face:b00c:0:167","2a00:a041:3c5d:4d00:b981:f170:feac:7cf9","TLSv1.2","274","Application Data"
"346","243.755188905","2a00:a041:3c5d:4d00:b981:f170:feac:7cf9","2a03:2880:f258:c8:face:b00c:0:167","TCP","88","39412  >  443 [ACK] Seq=4653 Ack=18569 Win=4404 Len=0 TSval=3661187734 TSecr=2509459445"
"347","243.941475535","2a00:a041:3c5d:4d00:b981:f170:feac:7cf9","2a03:2880:f258:c8:face:b00c:0:167","TLSv1.2","160","Application Data"
"348","244.164094545","2a03:2880:f258:c8:face:b00c:0:167","2a00:a041:3c5d:4d00:b981:f170:feac:7cf9","TCP","88","443  >  39412 [ACK] Seq=18569 Ack=4725 Win=1661 Len=0 TSval=2509459760 TSecr=3661187920"
"353","253.380658682","2a03:2880:f258:c8:face:b00c:0:167","2a00:a041:3c5d:4d00:b981:f170:feac:7cf9","TLSv1.2","176","Application Data"
"354","253.380695051","2a00:a041:3c5d:4d00:b981:f170:feac:7cf9","2a03:2880:f258:c8:face:b00c:0:167","TCP","88","39412  >  443 [ACK] Seq=4725 Ack=18657 Win=4404 Len=0 TSval=3661197359 TSecr=2509468989"
"355","253.418822211","2a00:a041:3c5d:4d00:b981:f170:feac:7cf9","2a03:2880:f258:c8:face:b00c:0:167","TLSv1.2","160","Application Data"
"356","253.782985723","2a00:a041:3c5d:4d00:b981:f170:feac:7cf9","2a03:2880:f258:c8:face:b00c:0:167","TLSv1.2","158","Application Data"
"357","253.994372204","2a03:2880:f258:c8:face:b00c:0:167","2a00:a041:3c5d:4d00:b981:f170:feac:7cf9","TCP","88","443  >  39412 [ACK] Seq=18657 Ack=4797 Win=1661 Len=0 TSval=2509469603 TSecr=3661197398"
"358","254.302041290","2a03:2880:f258:c8:face:b00c:0:167","2a00:a041:3c5d:4d00:b981:f170:feac:7cf9","TCP","88","443  >  39412 [ACK] Seq=18657 Ack=4867 Win=1661 Len=0 TSval=2509469975 TSecr=3661197762"
"359","254.357739477","2a03:2880:f258:c8:face:b00c:0:167","2a00:a041:3c5d:4d00:b981:f170:feac:7cf9","TLSv1.2","160","Application Data"
"360","254.357774747","2a00:a041:3c5d:4d00:b981:f170:feac:7cf9","2a03:2880:f258:c8:face:b00c:0:167","TCP","88","39412  >  443 [ACK] Seq=4867 Ack=18729 Win=4404 Len=0 TSval=3661198337 TSecr=2509470055"
"365","261.265542453","2a03:2880:f258:c8:face:b00c:0:167","2a00:a041:3c5d:4d00:b981:f170:feac:7cf9","TCP","1468","443  >  39412 [ACK] Seq=18729 Ack=4867 Win=1661 Len=1380 TSval=2509476925 TSecr=3661198337 [TCP segment of a reassembled PDU]"
"366","261.265581855","2a00:a041:3c5d:4d00:b981:f170:feac:7cf9","2a03:2880:f258:c8:face:b00c:0:167","TCP","88","39412  >  443 [ACK] Seq=4867 Ack=20109 Win=4404 Len=0 TSval=3661205244 TSecr=2509476925"
"367","261.265609488","2a03:2880:f258:c8:face:b00c:0:167","2a00:a041:3c5d:4d00:b981:f170:feac:7cf9","TLSv1.2","158","Application Data"
"368","261.265613614","2a00:a041:3c5d:4d00:b981:f170:feac:7cf9","2a03:2880:f258:c8:face:b00c:0:167","TCP","88","39412  >  443 [ACK] Seq=4867 Ack=20179 Win=4404 Len=0 TSval=3661205244 TSecr=2509476925"
"369","261.265911949","2a03:2880:f258:c8:face:b00c:0:167","2a00:a041:3c5d:4d00:b981:f170:feac:7cf9","TLSv1.2","1218","Application Data"
"370","261.265934761","2a00:a041:3c5d:4d00:b981:f170:feac:7cf9","2a03:2880:f258:c8:face:b00c:0:167","TCP","88","39412  >  443 [ACK] Seq=4867 Ack=21309 Win=4404 Len=0 TSval=3661205245 TSecr=2509476926"
"371","261.450000435","2a00:a041:3c5d:4d00:b981:f170:feac:7cf9","2a03:2880:f258:c8:face:b00c:0:167","TLSv1.2","181","Application Data"
"372","261.533591807","2a03:2880:f258:c8:face:b00c:0:167","2a00:a041:3c5d:4d00:b981:f170:feac:7cf9","TCP","88","443  >  39412 [ACK] Seq=21309 Ack=4960 Win=1661 Len=0 TSval=2509477225 TSecr=3661205429"
"373","265.361200386","2a03:2880:f258:c8:face:b00c:0:167","2a00:a041:3c5d:4d00:b981:f170:feac:7cf9","TLSv1.2","181","Application Data"
"374","265.361236120","2a00:a041:3c5d:4d00:b981:f170:feac:7cf9","2a03:2880:f258:c8:face:b00c:0:167","TCP","88","39412  >  443 [ACK] Seq=4960 Ack=21402 Win=4404 Len=0 TSval=3661209340 TSecr=2509481047"
"375","265.365854817","2a00:a041:3c5d:4d00:b981:f170:feac:7cf9","2a03:2880:f258:c8:face:b00c:0:167","TLSv1.2","180","Application Data"
"376","265.446534433","2a03:2880:f258:c8:face:b00c:0:167","2a00:a041:3c5d:4d00:b981:f170:feac:7cf9","TCP","88","443  >  39412 [ACK] Seq=21402 Ack=5052 Win=1661 Len=0 TSval=2509481143 TSecr=3661209345"
"377","270.174420582","2a03:2880:f258:c8:face:b00c:0:167","2a00:a041:3c5d:4d00:b981:f170:feac:7cf9","TLSv1.2","471","Application Data"
"378","270.214842858","2a00:a041:3c5d:4d00:b981:f170:feac:7cf9","2a03:2880:f258:c8:face:b00c:0:167","TCP","88","39412  >  443 [ACK] Seq=5052 Ack=21785 Win=4404 Len=0 TSval=3661214194 TSecr=2509485863"
"380","270.539203365","2a00:a041:3c5d:4d00:b981:f170:feac:7cf9","2a03:2880:f258:c8:face:b00c:0:167","TLSv1.2","187","Application Data"
"381","270.630351402","2a03:2880:f258:c8:face:b00c:0:167","2a00:a041:3c5d:4d00:b981:f170:feac:7cf9","TCP","88","443  >  39412 [ACK] Seq=21785 Ack=5151 Win=1661 Len=0 TSval=2509486328 TSecr=3661214518"
"382","275.191823589","2a03:2880:f258:c8:face:b00c:0:167","2a00:a041:3c5d:4d00:b981:f170:feac:7cf9","TLSv1.2","183","Application Data"
"383","275.191860500","2a00:a041:3c5d:4d00:b981:f170:feac:7cf9","2a03:2880:f258:c8:face:b00c:0:167","TCP","88","39412  >  443 [ACK] Seq=5151 Ack=21880 Win=4404 Len=0 TSval=3661219171 TSecr=2509490805"
"384","275.196732593","2a00:a041:3c5d:4d00:b981:f170:feac:7cf9","2a03:2880:f258:c8:face:b00c:0:167","TLSv1.2","182","Application Data"
"385","275.282175009","2a03:2880:f258:c8:face:b00c:0:167","2a00:a041:3c5d:4d00:b981:f170:feac:7cf9","TCP","88","443  >  39412 [ACK] Seq=21880 Ack=5245 Win=1661 Len=0 TSval=2509490973 TSecr=3661219175"
"390","282.053080971","2a03:2880:f258:c8:face:b00c:0:167","2a00:a041:3c5d:4d00:b981:f170:feac:7cf9","TCP","1468","443  >  39412 [ACK] Seq=21880 Ack=5245 Win=1661 Len=1380 TSval=2509497720 TSecr=3661219175 [TCP segment of a reassembled PDU]"
"391","282.053223900","2a03:2880:f258:c8:face:b00c:0:167","2a00:a041:3c5d:4d00:b981:f170:feac:7cf9","TLSv1.2","474","Application Data, Application Data"
"392","282.053331990","2a00:a041:3c5d:4d00:b981:f170:feac:7cf9","2a03:2880:f258:c8:face:b00c:0:167","TCP","88","39412  >  443 [ACK] Seq=5245 Ack=23646 Win=4391 Len=0 TSval=3661226032 TSecr=2509497720"
"393","282.162843450","2a00:a041:3c5d:4d00:b981:f170:feac:7cf9","2a03:2880:f258:c8:face:b00c:0:167","TLSv1.2","158","Application Data"
"394","282.274671599","2a03:2880:f258:c8:face:b00c:0:167","2a00:a041:3c5d:4d00:b981:f170:feac:7cf9","TCP","88","443  >  39412 [ACK] Seq=23646 Ack=5315 Win=1661 Len=0 TSval=2509497955 TSecr=3661226142"
"395","282.331584309","2a00:a041:3c5d:4d00:b981:f170:feac:7cf9","2a03:2880:f258:c8:face:b00c:0:167","TLSv1.2","184","Application Data"
"396","282.337609630","2a03:2880:f258:c8:face:b00c:0:167","2a00:a041:3c5d:4d00:b981:f170:feac:7cf9","TLSv1.2","160","Application Data"
"397","282.378970147","2a00:a041:3c5d:4d00:b981:f170:feac:7cf9","2a03:2880:f258:c8:face:b00c:0:167","TCP","88","39412  >  443 [ACK] Seq=5411 Ack=23718 Win=4404 Len=0 TSval=3661226358 TSecr=2509498035"
"398","282.408811348","2a03:2880:f258:c8:face:b00c:0:167","2a00:a041:3c5d:4d00:b981:f170:feac:7cf9","TCP","88","443  >  39412 [ACK] Seq=23718 Ack=5411 Win=1661 Len=0 TSval=2509498106 TSecr=3661226310"
"399","283.179443654","2a03:2880:f258:c8:face:b00c:0:167","2a00:a041:3c5d:4d00:b981:f170:feac:7cf9","TLSv1.2","276","Application Data"
"400","283.179483383","2a00:a041:3c5d:4d00:b981:f170:feac:7cf9","2a03:2880:f258:c8:face:b00c:0:167","TCP","88","39412  >  443 [ACK] Seq=5411 Ack=23906 Win=4404 Len=0 TSval=3661227158 TSecr=2509498787"
"401","283.181733215","2a00:a041:3c5d:4d00:b981:f170:feac:7cf9","2a03:2880:f258:c8:face:b00c:0:167","TLSv1.2","160","Application Data"
"402","283.275184355","2a03:2880:f258:c8:face:b00c:0:167","2a00:a041:3c5d:4d00:b981:f170:feac:7cf9","TCP","88","443  >  39412 [ACK] Seq=23906 Ack=5483 Win=1661 Len=0 TSval=2509498962 TSecr=3661227160"
"403","287.889826473","2a03:2880:f258:c8:face:b00c:0:167","2a00:a041:3c5d:4d00:b981:f170:feac:7cf9","TLSv1.2","276","Application Data"
"404","287.930918837","2a00:a041:3c5d:4d00:b981:f170:feac:7cf9","2a03:2880:f258:c8:face:b00c:0:167","TCP","88","39412  >  443 [ACK] Seq=5483 Ack=24094 Win=4404 Len=0 TSval=3661231910 TSecr=2509503549"
"405","288.121591270","2a00:a041:3c5d:4d00:b981:f170:feac:7cf9","2a03:2880:f258:c8:face:b00c:0:167","TLSv1.2","160","Application Data"
"406","288.208458061","2a03:2880:f258:c8:face:b00c:0:167","2a00:a041:3c5d:4d00:b981:f170:feac:7cf9","TCP","88","443  >  39412 [ACK] Seq=24094 Ack=5555 Win=1661 Len=0 TSval=2509503906 TSecr=3661232100"
"408","293.112462546","2a03:2880:f258:c8:face:b00c:0:167","2a00:a041:3c5d:4d00:b981:f170:feac:7cf9","TLSv1.2","176","Application Data"
"409","293.112497472","2a00:a041:3c5d:4d00:b981:f170:feac:7cf9","2a03:2880:f258:c8:face:b00c:0:167","TCP","88","39412  >  443 [ACK] Seq=5555 Ack=24182 Win=4404 Len=0 TSval=3661237091 TSecr=2509508792"
"410","293.116433239","2a00:a041:3c5d:4d00:b981:f170:feac:7cf9","2a03:2880:f258:c8:face:b00c:0:167","TLSv1.2","160","Application Data"
"411","293.199951665","2a03:2880:f258:c8:face:b00c:0:167","2a00:a041:3c5d:4d00:b981:f170:feac:7cf9","TCP","88","443  >  39412 [ACK] Seq=24182 Ack=5627 Win=1661 Len=0 TSval=2509508898 TSecr=3661237095"
"412","299.563392195","2a03:2880:f258:c8:face:b00c:0:167","2a00:a041:3c5d:4d00:b981:f170:feac:7cf9","TLSv1.2","423","Application Data"
"413","299.606965820","2a00:a041:3c5d:4d00:b981:f170:feac:7cf9","2a03:2880:f258:c8:face:b00c:0:167","TCP","88","39412  >  443 [ACK] Seq=5627 Ack=24517 Win=4404 Len=0 TSval=3661243586 TSecr=2509515229"
"414","299.967648571","2a00:a041:3c5d:4d00:b981:f170:feac:7cf9","2a03:2880:f258:c8:face:b00c:0:167","TLSv1.2","187","Application Data"
"415","300.048619918","2a03:2880:f258:c8:face:b00c:0:167","2a00:a041:3c5d:4d00:b981:f170:feac:7cf9","TCP","88","443  >  39412 [ACK] Seq=24517 Ack=5726 Win=1661 Len=0 TSval=2509515746 TSecr=3661243946"
"417","301.191320918","2a00:a041:3c5d:4d00:b981:f170:feac:7cf9","2a03:2880:f258:c8:face:b00c:0:167","TLSv1.2","158","Application Data"
"418","301.275049269","2a03:2880:f258:c8:face:b00c:0:167","2a00:a041:3c5d:4d00:b981:f170:feac:7cf9","TCP","88","443  >  39412 [ACK] Seq=24517 Ack=5796 Win=1661 Len=0 TSval=2509516968 TSecr=3661245170"
