"No.","Time","Source","Destination","Protocol","Length","Info"
"2","3.324803323","2a00:a041:3c5d:4d00:424b:6377:a930:43d","2a03:2880:f258:1c3:face:b00c:0:167","TLSv1.2","157","Application Data"
"3","3.420614561","2a03:2880:f258:1c3:face:b00c:0:167","2a00:a041:3c5d:4d00:424b:6377:a930:43d","TCP","88","443  >  41660 [ACK] Seq=1 Ack=70 Win=730 Len=0 TSval=3181525683 TSecr=2766476314"
"4","3.480228558","2a03:2880:f258:1c3:face:b00c:0:167","2a00:a041:3c5d:4d00:424b:6377:a930:43d","TLSv1.2","159","Application Data"
"5","3.480265652","2a00:a041:3c5d:4d00:424b:6377:a930:43d","2a03:2880:f258:1c3:face:b00c:0:167","TCP","88","41660  >  443 [ACK] Seq=70 Ack=72 Win=1174 Len=0 TSval=2766476469 TSecr=3181525763"
"12","17.306491862","2a03:2880:f258:1c3:face:b00c:0:167","2a00:a041:3c5d:4d00:424b:6377:a930:43d","TLSv1.2","364","Application Data"
"13","17.306537819","2a00:a041:3c5d:4d00:424b:6377:a930:43d","2a03:2880:f258:1c3:face:b00c:0:167","TCP","88","41660  >  443 [ACK] Seq=70 Ack=348 Win=1174 Len=0 TSval=2766490295 TSecr=3181539572"
"14","17.343154335","2a00:a041:3c5d:4d00:424b:6377:a930:43d","2a03:2880:f258:1c3:face:b00c:0:167","TLSv1.2","160","Application Data"
"15","17.612250864","2a03:2880:f258:1c3:face:b00c:0:167","2a00:a041:3c5d:4d00:424b:6377:a930:43d","TCP","364","[TCP Spurious Retransmission] 443  >  41660 [PSH, ACK] Seq=72 Ack=70 Win=730 Len=276 TSval=3181539807 TSecr=2766476469"
"16","17.612289220","2a00:a041:3c5d:4d00:424b:6377:a930:43d","2a03:2880:f258:1c3:face:b00c:0:167","TCP","100","[TCP Dup ACK 13#1] 41660  >  443 [ACK] Seq=142 Ack=348 Win=1174 Len=0 TSval=2766490601 TSecr=3181539807 SLE=72 SRE=348"
"17","17.665809683","2a00:a041:3c5d:4d00:424b:6377:a930:43d","2a03:2880:f258:1c3:face:b00c:0:167","TCP","160","[TCP Retransmission] 41660  >  443 [PSH, ACK] Seq=70 Ack=348 Win=1174 Len=72 TSval=2766490655 TSecr=3181539807"
"18","17.740945007","2a03:2880:f258:1c3:face:b00c:0:167","2a00:a041:3c5d:4d00:424b:6377:a930:43d","TCP","88","443  >  41660 [ACK] Seq=348 Ack=142 Win=730 Len=0 TSval=3181540024 TSecr=2766490332"
"19","18.036376977","2a03:2880:f258:1c3:face:b00c:0:167","2a00:a041:3c5d:4d00:424b:6377:a930:43d","TCP","88","[TCP Dup ACK 18#1] 443  >  41660 [ACK] Seq=348 Ack=142 Win=730 Len=0 TSval=3181540276 TSecr=2766490655"
"21","21.510139743","2a00:a041:3c5d:4d00:424b:6377:a930:43d","2a03:2880:f258:1c3:face:b00c:0:167","TLSv1.2","157","Application Data"
"24","21.981699787","2a00:a041:3c5d:4d00:424b:6377:a930:43d","2a03:2880:f258:1c3:face:b00c:0:167","TCP","157","[TCP Retransmission] 41660  >  443 [PSH, ACK] Seq=142 Ack=348 Win=1174 Len=69 TSval=2766494971 TSecr=3181540276"
"25","21.983678291","2a03:2880:f258:1c3:face:b00c:0:167","2a00:a041:3c5d:4d00:424b:6377:a930:43d","TCP","88","443  >  41660 [ACK] Seq=348 Ack=211 Win=730 Len=0 TSval=3181544191 TSecr=2766494499"
"26","21.989115741","2a03:2880:f258:1c3:face:b00c:0:167","2a00:a041:3c5d:4d00:424b:6377:a930:43d","TLSv1.2","159","Application Data"
"27","21.989149174","2a00:a041:3c5d:4d00:424b:6377:a930:43d","2a03:2880:f258:1c3:face:b00c:0:167","TCP","88","41660  >  443 [ACK] Seq=211 Ack=419 Win=1174 Len=0 TSval=2766494978 TSecr=3181544271"
"30","22.426727070","2a03:2880:f258:1c3:face:b00c:0:167","2a00:a041:3c5d:4d00:424b:6377:a930:43d","TCP","88","[TCP Dup ACK 25#1] 443  >  41660 [ACK] Seq=419 Ack=211 Win=730 Len=0 TSval=3181544654 TSecr=2766494978"
"57","46.160484390","2a00:a041:3c5d:4d00:424b:6377:a930:43d","2a03:2880:f258:1c3:face:b00c:0:167","TLSv1.2","157","Application Data"
"58","46.490816601","2a03:2880:f258:1c3:face:b00c:0:167","2a00:a041:3c5d:4d00:424b:6377:a930:43d","TCP","88","443  >  41660 [ACK] Seq=419 Ack=280 Win=730 Len=0 TSval=3181568726 TSecr=2766519149"
"59","46.524172564","2a03:2880:f258:1c3:face:b00c:0:167","2a00:a041:3c5d:4d00:424b:6377:a930:43d","TLSv1.2","159","Application Data"
"60","46.524205097","2a00:a041:3c5d:4d00:424b:6377:a930:43d","2a03:2880:f258:1c3:face:b00c:0:167","TCP","88","41660  >  443 [ACK] Seq=280 Ack=490 Win=1174 Len=0 TSval=2766519513 TSecr=3181568806"
"61","49.766252671","2a03:2880:f258:1c3:face:b00c:0:167","2a00:a041:3c5d:4d00:424b:6377:a930:43d","TCP","1468","443  >  41660 [ACK] Seq=490 Ack=280 Win=730 Len=1380 TSval=3181572025 TSecr=2766519513 [TCP segment of a reassembled PDU]"
"62","49.766292018","2a00:a041:3c5d:4d00:424b:6377:a930:43d","2a03:2880:f258:1c3:face:b00c:0:167","TCP","88","41660  >  443 [ACK] Seq=280 Ack=1870 Win=1174 Len=0 TSval=2766522755 TSecr=3181572025"
"63","49.766523954","2a03:2880:f258:1c3:face:b00c:0:167","2a00:a041:3c5d:4d00:424b:6377:a930:43d","TLSv1.2","221","Application Data"
"64","49.766543898","2a00:a041:3c5d:4d00:424b:6377:a930:43d","2a03:2880:f258:1c3:face:b00c:0:167","TCP","88","41660  >  443 [ACK] Seq=280 Ack=2003 Win=1174 Len=0 TSval=2766522755 TSecr=3181572025"
"65","49.766745796","2a03:2880:f258:1c3:face:b00c:0:167","2a00:a041:3c5d:4d00:424b:6377:a930:43d","TLSv1.2","2848","Application Data"
"66","49.766746166","2a03:2880:f258:1c3:face:b00c:0:167","2a00:a041:3c5d:4d00:424b:6377:a930:43d","TLSv1.2","481","Application Data"
"67","49.766776766","2a00:a041:3c5d:4d00:424b:6377:a930:43d","2a03:2880:f258:1c3:face:b00c:0:167","TCP","88","41660  >  443 [ACK] Seq=280 Ack=4763 Win=1158 Len=0 TSval=2766522756 TSecr=3181572026"
"68","49.766794857","2a00:a041:3c5d:4d00:424b:6377:a930:43d","2a03:2880:f258:1c3:face:b00c:0:167","TCP","88","41660  >  443 [ACK] Seq=280 Ack=5156 Win=1155 Len=0 TSval=2766522756 TSecr=3181572029"
"77","50.019509663","2a00:a041:3c5d:4d00:424b:6377:a930:43d","2a00:a040:0:4:face:b00c:3333:7020","TCP","96","36590  >  443 [SYN] Seq=0 Win=64800 Len=0 MSS=1440 SACK_PERM=1 TSval=3875273180 TSecr=0 WS=128"
"78","50.026829366","2a00:a041:3c5d:4d00:424b:6377:a930:43d","2a03:2880:f258:1c3:face:b00c:0:167","TLSv1.2","181","Application Data"
"79","50.039186742","2a00:a040:0:4:face:b00c:3333:7020","2a00:a041:3c5d:4d00:424b:6377:a930:43d","TCP","96","443  >  36590 [SYN, ACK] Seq=0 Ack=1 Win=31740 Len=0 MSS=1392 SACK_PERM=1 TSval=2944775237 TSecr=3875273180 WS=256"
"80","50.039233220","2a00:a041:3c5d:4d00:424b:6377:a930:43d","2a00:a040:0:4:face:b00c:3333:7020","TCP","88","36590  >  443 [ACK] Seq=1 Ack=1 Win=64896 Len=0 TSval=3875273200 TSecr=2944775237"
"81","50.040088648","2a00:a041:3c5d:4d00:424b:6377:a930:43d","2a00:a040:0:4:face:b00c:3333:7020","TLSv1.3","794","Client Hello"
"82","50.053811222","2a00:a040:0:4:face:b00c:3333:7020","2a00:a041:3c5d:4d00:424b:6377:a930:43d","TCP","88","443  >  36590 [ACK] Seq=1 Ack=707 Win=31232 Len=0 TSval=2944775253 TSecr=3875273201"
"83","50.054279315","2a00:a040:0:4:face:b00c:3333:7020","2a00:a041:3c5d:4d00:424b:6377:a930:43d","TLSv1.3","253","Server Hello, Application Data"
"84","50.054301382","2a00:a041:3c5d:4d00:424b:6377:a930:43d","2a00:a040:0:4:face:b00c:3333:7020","TCP","88","36590  >  443 [ACK] Seq=707 Ack=166 Win=64768 Len=0 TSval=3875273215 TSecr=2944775254"
"85","50.054647354","2a00:a041:3c5d:4d00:424b:6377:a930:43d","2a00:a040:0:4:face:b00c:3333:7020","TLSv1.3","94","Change Cipher Spec"
"86","50.054755405","2a00:a041:3c5d:4d00:424b:6377:a930:43d","2a00:a040:0:4:face:b00c:3333:7020","TLSv1.3","146","Application Data"
"87","50.056108056","2a00:a041:3c5d:4d00:424b:6377:a930:43d","2a00:a040:0:4:face:b00c:3333:7020","TLSv1.3","695","Application Data"
"89","50.073654030","2a00:a040:0:4:face:b00c:3333:7020","2a00:a041:3c5d:4d00:424b:6377:a930:43d","TCP","88","443  >  36590 [ACK] Seq=166 Ack=1378 Win=31488 Len=0 TSval=2944775270 TSecr=3875273216"
"90","50.074428680","2a00:a040:0:4:face:b00c:3333:7020","2a00:a041:3c5d:4d00:424b:6377:a930:43d","TLSv1.3","269","Application Data"
"91","50.103432347","2a03:2880:f258:1c3:face:b00c:0:167","2a00:a041:3c5d:4d00:424b:6377:a930:43d","TCP","88","443  >  41660 [ACK] Seq=5156 Ack=373 Win=730 Len=0 TSval=3181572387 TSecr=2766523016"
"92","50.117703251","2a00:a041:3c5d:4d00:424b:6377:a930:43d","2a00:a040:0:4:face:b00c:3333:7020","TCP","88","36590  >  443 [ACK] Seq=1378 Ack=347 Win=64640 Len=0 TSval=3875273279 TSecr=2944775270"
"93","50.277848868","2a00:a040:0:4:face:b00c:3333:7020","2a00:a041:3c5d:4d00:424b:6377:a930:43d","TLSv1.3","844","Application Data"
"94","50.277896679","2a00:a041:3c5d:4d00:424b:6377:a930:43d","2a00:a040:0:4:face:b00c:3333:7020","TCP","88","36590  >  443 [ACK] Seq=1378 Ack=1103 Win=64000 Len=0 TSval=3875273439 TSecr=2944775435"
"95","50.278124921","2a00:a040:0:4:face:b00c:3333:7020","2a00:a041:3c5d:4d00:424b:6377:a930:43d","TLSv1.3","111","Application Data"
"96","50.278147789","2a00:a041:3c5d:4d00:424b:6377:a930:43d","2a00:a040:0:4:face:b00c:3333:7020","TCP","88","36590  >  443 [ACK] Seq=1378 Ack=1126 Win=64128 Len=0 TSval=3875273439 TSecr=2944775435"
"97","50.279088065","2a00:a040:0:4:face:b00c:3333:7020","2a00:a041:3c5d:4d00:424b:6377:a930:43d","TLSv1.3","2848","Application Data"
"98","50.279088456","2a00:a040:0:4:face:b00c:3333:7020","2a00:a041:3c5d:4d00:424b:6377:a930:43d","TLSv1.3","2848","Application Data, Application Data"
"99","50.279088500","2a00:a040:0:4:face:b00c:3333:7020","2a00:a041:3c5d:4d00:424b:6377:a930:43d","TLSv1.3","2848","Application Data, Application Data"
"100","50.279088549","2a00:a040:0:4:face:b00c:3333:7020","2a00:a041:3c5d:4d00:424b:6377:a930:43d","TLSv1.3","2848","Application Data [TCP segment of a reassembled PDU]"
"101","50.279118742","2a00:a041:3c5d:4d00:424b:6377:a930:43d","2a00:a040:0:4:face:b00c:3333:7020","TCP","88","36590  >  443 [ACK] Seq=1378 Ack=3886 Win=61440 Len=0 TSval=3875273440 TSecr=2944775435"
"102","50.279138437","2a00:a041:3c5d:4d00:424b:6377:a930:43d","2a00:a040:0:4:face:b00c:3333:7020","TCP","88","36590  >  443 [ACK] Seq=1378 Ack=6646 Win=58752 Len=0 TSval=3875273440 TSecr=2944775435"
"103","50.279143268","2a00:a041:3c5d:4d00:424b:6377:a930:43d","2a00:a040:0:4:face:b00c:3333:7020","TCP","88","36590  >  443 [ACK] Seq=1378 Ack=9406 Win=56064 Len=0 TSval=3875273440 TSecr=2944775435"
"104","50.279148145","2a00:a041:3c5d:4d00:424b:6377:a930:43d","2a00:a040:0:4:face:b00c:3333:7020","TCP","88","36590  >  443 [ACK] Seq=1378 Ack=12166 Win=53376 Len=0 TSval=3875273440 TSecr=2944775436"
"105","50.279160239","2a00:a040:0:4:face:b00c:3333:7020","2a00:a041:3c5d:4d00:424b:6377:a930:43d","TLSv1.3","2848","Application Data [TCP segment of a reassembled PDU]"
"106","50.279164128","2a00:a041:3c5d:4d00:424b:6377:a930:43d","2a00:a040:0:4:face:b00c:3333:7020","TCP","88","36590  >  443 [ACK] Seq=1378 Ack=14926 Win=50688 Len=0 TSval=3875273440 TSecr=2944775437"
"107","50.287408226","2a00:a040:0:4:face:b00c:3333:7020","2a00:a041:3c5d:4d00:424b:6377:a930:43d","TCP","1468","443  >  36590 [ACK] Seq=14926 Ack=1378 Win=31488 Len=1380 TSval=2944775485 TSecr=3875273279 [TCP segment of a reassembled PDU]"
"108","50.287445204","2a00:a041:3c5d:4d00:424b:6377:a930:43d","2a00:a040:0:4:face:b00c:3333:7020","TCP","88","36590  >  443 [ACK] Seq=1378 Ack=16306 Win=63104 Len=0 TSval=3875273448 TSecr=2944775485"
"109","50.292586808","2a00:a040:0:4:face:b00c:3333:7020","2a00:a041:3c5d:4d00:424b:6377:a930:43d","TLSv1.3","1468","Application Data [TCP segment of a reassembled PDU]"
"110","50.292630730","2a00:a041:3c5d:4d00:424b:6377:a930:43d","2a00:a040:0:4:face:b00c:3333:7020","TCP","88","36590  >  443 [ACK] Seq=1378 Ack=17686 Win=63104 Len=0 TSval=3875273454 TSecr=2944775492"
"111","50.293014032","2a00:a040:0:4:face:b00c:3333:7020","2a00:a041:3c5d:4d00:424b:6377:a930:43d","TLSv1.3","1468","Application Data"
"112","50.293031376","2a00:a041:3c5d:4d00:424b:6377:a930:43d","2a00:a040:0:4:face:b00c:3333:7020","TCP","88","36590  >  443 [ACK] Seq=1378 Ack=19066 Win=61824 Len=0 TSval=3875273454 TSecr=2944775492"
"113","50.293615346","2a00:a040:0:4:face:b00c:3333:7020","2a00:a041:3c5d:4d00:424b:6377:a930:43d","TLSv1.3","1468","Application Data [TCP segment of a reassembled PDU]"
"114","50.293643169","2a00:a041:3c5d:4d00:424b:6377:a930:43d","2a00:a040:0:4:face:b00c:3333:7020","TCP","88","36590  >  443 [ACK] Seq=1378 Ack=20446 Win=63104 Len=0 TSval=3875273455 TSecr=2944775492"
"115","50.294638261","2a00:a040:0:4:face:b00c:3333:7020","2a00:a041:3c5d:4d00:424b:6377:a930:43d","TCP","1468","443  >  36590 [ACK] Seq=20446 Ack=1378 Win=31488 Len=1380 TSval=2944775493 TSecr=3875273440 [TCP segment of a reassembled PDU]"
"116","50.295654850","2a00:a040:0:4:face:b00c:3333:7020","2a00:a041:3c5d:4d00:424b:6377:a930:43d","TLSv1.3","1468","Application Data [TCP segment of a reassembled PDU]"
"117","50.295655028","2a00:a040:0:4:face:b00c:3333:7020","2a00:a041:3c5d:4d00:424b:6377:a930:43d","TLSv1.3","1468","Application Data [TCP segment of a reassembled PDU]"
"118","50.295673096","2a00:a041:3c5d:4d00:424b:6377:a930:43d","2a00:a040:0:4:face:b00c:3333:7020","TCP","88","36590  >  443 [ACK] Seq=1378 Ack=23206 Win=63104 Len=0 TSval=3875273457 TSecr=2944775493"
"119","50.299911023","2a00:a040:0:4:face:b00c:3333:7020","2a00:a041:3c5d:4d00:424b:6377:a930:43d","TLSv1.3","1468","Application Data [TCP segment of a reassembled PDU]"
"120","50.299911235","2a00:a040:0:4:face:b00c:3333:7020","2a00:a041:3c5d:4d00:424b:6377:a930:43d","TLSv1.3","2848","Application Data [TCP segment of a reassembled PDU]"
"121","50.299911282","2a00:a040:0:4:face:b00c:3333:7020","2a00:a041:3c5d:4d00:424b:6377:a930:43d","TLSv1.3","2848","Application Data [TCP segment of a reassembled PDU]"
"122","50.299911329","2a00:a040:0:4:face:b00c:3333:7020","2a00:a041:3c5d:4d00:424b:6377:a930:43d","TCP","2848","443  >  36590 [PSH, ACK] Seq=31486 Ack=1378 Win=31488 Len=2760 TSval=2944775497 TSecr=3875273440 [TCP segment of a reassembled PDU]"
"123","50.299945176","2a00:a041:3c5d:4d00:424b:6377:a930:43d","2a00:a040:0:4:face:b00c:3333:7020","TCP","88","36590  >  443 [ACK] Seq=1378 Ack=25966 Win=63104 Len=0 TSval=3875273461 TSecr=2944775494"
"124","50.300114185","2a00:a041:3c5d:4d00:424b:6377:a930:43d","2a00:a040:0:4:face:b00c:3333:7020","TCP","88","36590  >  443 [ACK] Seq=1378 Ack=34246 Win=54912 Len=0 TSval=3875273461 TSecr=2944775495"
"125","50.300193137","2a00:a040:0:4:face:b00c:3333:7020","2a00:a041:3c5d:4d00:424b:6377:a930:43d","TLSv1.3","2848","Application Data, Application Data, Application Data"
"126","50.300254092","2a00:a041:3c5d:4d00:424b:6377:a930:43d","2a00:a040:0:4:face:b00c:3333:7020","TCP","88","36590  >  443 [ACK] Seq=1378 Ack=37006 Win=52224 Len=0 TSval=3875273461 TSecr=2944775499"
"127","50.301938976","2a00:a040:0:4:face:b00c:3333:7020","2a00:a041:3c5d:4d00:424b:6377:a930:43d","TCP","1468","443  >  36590 [ACK] Seq=37006 Ack=1378 Win=31488 Len=1380 TSval=2944775501 TSecr=3875273454 [TCP segment of a reassembled PDU]"
"128","50.302418408","2a00:a040:0:4:face:b00c:3333:7020","2a00:a041:3c5d:4d00:424b:6377:a930:43d","TLSv1.3","1468","Application Data, Application Data"
"129","50.302438956","2a00:a041:3c5d:4d00:424b:6377:a930:43d","2a00:a040:0:4:face:b00c:3333:7020","TCP","88","36590  >  443 [ACK] Seq=1378 Ack=39766 Win=63104 Len=0 TSval=3875273463 TSecr=2944775501"
"130","50.303099906","2a00:a040:0:4:face:b00c:3333:7020","2a00:a041:3c5d:4d00:424b:6377:a930:43d","TLSv1.3","1468","Application Data [TCP segment of a reassembled PDU]"
"131","50.307215704","2a00:a040:0:4:face:b00c:3333:7020","2a00:a041:3c5d:4d00:424b:6377:a930:43d","TCP","1468","443  >  36590 [ACK] Seq=41146 Ack=1378 Win=31488 Len=1380 TSval=2944775506 TSecr=3875273461 [TCP segment of a reassembled PDU]"
"132","50.307241452","2a00:a041:3c5d:4d00:424b:6377:a930:43d","2a00:a040:0:4:face:b00c:3333:7020","TCP","88","36590  >  443 [ACK] Seq=1378 Ack=42526 Win=63104 Len=0 TSval=3875273468 TSecr=2944775502"
"133","50.307907070","2a00:a040:0:4:face:b00c:3333:7020","2a00:a041:3c5d:4d00:424b:6377:a930:43d","TLSv1.3","1468","Application Data [TCP segment of a reassembled PDU]"
"134","50.308370202","2a00:a040:0:4:face:b00c:3333:7020","2a00:a041:3c5d:4d00:424b:6377:a930:43d","TCP","1468","443  >  36590 [ACK] Seq=43906 Ack=1378 Win=31488 Len=1380 TSval=2944775507 TSecr=3875273461 [TCP segment of a reassembled PDU]"
"135","50.308388705","2a00:a041:3c5d:4d00:424b:6377:a930:43d","2a00:a040:0:4:face:b00c:3333:7020","TCP","88","36590  >  443 [ACK] Seq=1378 Ack=45286 Win=63104 Len=0 TSval=3875273469 TSecr=2944775506"
"136","50.309080366","2a00:a040:0:4:face:b00c:3333:7020","2a00:a041:3c5d:4d00:424b:6377:a930:43d","TCP","1468","443  >  36590 [PSH, ACK] Seq=45286 Ack=1378 Win=31488 Len=1380 TSval=2944775507 TSecr=3875273461 [TCP segment of a reassembled PDU]"
"137","50.309592736","2a00:a040:0:4:face:b00c:3333:7020","2a00:a041:3c5d:4d00:424b:6377:a930:43d","TLSv1.3","1468","Application Data [TCP segment of a reassembled PDU]"
"138","50.309618384","2a00:a041:3c5d:4d00:424b:6377:a930:43d","2a00:a040:0:4:face:b00c:3333:7020","TCP","88","36590  >  443 [ACK] Seq=1378 Ack=48046 Win=63104 Len=0 TSval=3875273471 TSecr=2944775507"
"139","50.310174114","2a00:a040:0:4:face:b00c:3333:7020","2a00:a041:3c5d:4d00:424b:6377:a930:43d","TCP","1468","443  >  36590 [PSH, ACK] Seq=48046 Ack=1378 Win=31488 Len=1380 TSval=2944775508 TSecr=3875273461 [TCP segment of a reassembled PDU]"
"140","50.311165514","2a00:a040:0:4:face:b00c:3333:7020","2a00:a041:3c5d:4d00:424b:6377:a930:43d","TCP","1468","443  >  36590 [ACK] Seq=49426 Ack=1378 Win=31488 Len=1380 TSval=2944775509 TSecr=3875273461 [TCP segment of a reassembled PDU]"
"141","50.311184246","2a00:a041:3c5d:4d00:424b:6377:a930:43d","2a00:a040:0:4:face:b00c:3333:7020","TCP","88","36590  >  443 [ACK] Seq=1378 Ack=50806 Win=63104 Len=0 TSval=3875273472 TSecr=2944775508"
"142","50.311851672","2a00:a040:0:4:face:b00c:3333:7020","2a00:a041:3c5d:4d00:424b:6377:a930:43d","TLSv1.3","1468","Application Data, Application Data"
"143","50.312470635","2a00:a040:0:4:face:b00c:3333:7020","2a00:a041:3c5d:4d00:424b:6377:a930:43d","TLSv1.3","2848","Application Data [TCP segment of a reassembled PDU]"
"144","50.312525294","2a00:a041:3c5d:4d00:424b:6377:a930:43d","2a00:a040:0:4:face:b00c:3333:7020","TCP","88","36590  >  443 [ACK] Seq=1378 Ack=54946 Win=61056 Len=0 TSval=3875273473 TSecr=2944775509"
"145","50.312918629","2a00:a040:0:4:face:b00c:3333:7020","2a00:a041:3c5d:4d00:424b:6377:a930:43d","TLSv1.3","1468","Application Data [TCP segment of a reassembled PDU]"
"146","50.313800440","2a00:a040:0:4:face:b00c:3333:7020","2a00:a041:3c5d:4d00:424b:6377:a930:43d","TLSv1.3","1468","Application Data [TCP segment of a reassembled PDU]"
"147","50.313817619","2a00:a041:3c5d:4d00:424b:6377:a930:43d","2a00:a040:0:4:face:b00c:3333:7020","TCP","88","36590  >  443 [ACK] Seq=1378 Ack=57706 Win=63104 Len=0 TSval=3875273475 TSecr=2944775511"
"148","50.314224911","2a00:a040:0:4:face:b00c:3333:7020","2a00:a041:3c5d:4d00:424b:6377:a930:43d","TLSv1.3","1468","Application Data [TCP segment of a reassembled PDU]"
"149","50.314940321","2a00:a040:0:4:face:b00c:3333:7020","2a00:a041:3c5d:4d00:424b:6377:a930:43d","TLSv1.3","1468","Application Data [TCP segment of a reassembled PDU]"
"150","50.314950515","2a00:a041:3c5d:4d00:424b:6377:a930:43d","2a00:a040:0:4:face:b00c:3333:7020","TCP","88","36590  >  443 [ACK] Seq=1378 Ack=60466 Win=63104 Len=0 TSval=3875273476 TSecr=2944775513"
"151","50.315639485","2a00:a040:0:4:face:b00c:3333:7020","2a00:a041:3c5d:4d00:424b:6377:a930:43d","TCP","1468","443  >  36590 [PSH, ACK] Seq=60466 Ack=1378 Win=31488 Len=1380 TSval=2944775513 TSecr=3875273469 [TCP segment of a reassembled PDU]"
"152","50.316310606","2a00:a040:0:4:face:b00c:3333:7020","2a00:a041:3c5d:4d00:424b:6377:a930:43d","TLSv1.3","2848","Application Data [TCP segment of a reassembled PDU]"
"153","50.316440843","2a00:a041:3c5d:4d00:424b:6377:a930:43d","2a00:a040:0:4:face:b00c:3333:7020","TCP","88","36590  >  443 [ACK] Seq=1378 Ack=64606 Win=61056 Len=0 TSval=3875273477 TSecr=2944775513"
"154","50.316859602","2a00:a040:0:4:face:b00c:3333:7020","2a00:a041:3c5d:4d00:424b:6377:a930:43d","TCP","1468","443  >  36590 [ACK] Seq=64606 Ack=1378 Win=31488 Len=1380 TSval=2944775515 TSecr=3875273469 [TCP segment of a reassembled PDU]"
"155","50.317517062","2a00:a040:0:4:face:b00c:3333:7020","2a00:a041:3c5d:4d00:424b:6377:a930:43d","TLSv1.3","1468","Application Data [TCP segment of a reassembled PDU]"
"156","50.317530874","2a00:a041:3c5d:4d00:424b:6377:a930:43d","2a00:a040:0:4:face:b00c:3333:7020","TCP","88","36590  >  443 [ACK] Seq=1378 Ack=67366 Win=63104 Len=0 TSval=3875273478 TSecr=2944775515"
"157","50.318289883","2a00:a040:0:4:face:b00c:3333:7020","2a00:a041:3c5d:4d00:424b:6377:a930:43d","TLSv1.3","2848","Application Data"
"158","50.318395350","2a00:a041:3c5d:4d00:424b:6377:a930:43d","2a00:a040:0:4:face:b00c:3333:7020","TCP","88","36590  >  443 [ACK] Seq=1378 Ack=70126 Win=61056 Len=0 TSval=3875273479 TSecr=2944775516"
"159","50.318887615","2a00:a040:0:4:face:b00c:3333:7020","2a00:a041:3c5d:4d00:424b:6377:a930:43d","TLSv1.3","2848","Application Data, Application Data"
"160","50.318894792","2a00:a041:3c5d:4d00:424b:6377:a930:43d","2a00:a040:0:4:face:b00c:3333:7020","TCP","88","36590  >  443 [ACK] Seq=1378 Ack=72886 Win=61056 Len=0 TSval=3875273480 TSecr=2944775516"
"161","50.319569732","2a00:a040:0:4:face:b00c:3333:7020","2a00:a041:3c5d:4d00:424b:6377:a930:43d","TLSv1.3","1468","Application Data [TCP segment of a reassembled PDU]"
"162","50.320153978","2a00:a040:0:4:face:b00c:3333:7020","2a00:a041:3c5d:4d00:424b:6377:a930:43d","TLSv1.3","1468","Application Data [TCP segment of a reassembled PDU]"
"163","50.320158052","2a00:a041:3c5d:4d00:424b:6377:a930:43d","2a00:a040:0:4:face:b00c:3333:7020","TCP","88","36590  >  443 [ACK] Seq=1378 Ack=75646 Win=63104 Len=0 TSval=3875273481 TSecr=2944775517"
"164","50.320924596","2a00:a040:0:4:face:b00c:3333:7020","2a00:a041:3c5d:4d00:424b:6377:a930:43d","TCP","2848","443  >  36590 [PSH, ACK] Seq=75646 Ack=1378 Win=31488 Len=2760 TSval=2944775518 TSecr=3875273469 [TCP segment of a reassembled PDU]"
"165","50.320970097","2a00:a041:3c5d:4d00:424b:6377:a930:43d","2a00:a040:0:4:face:b00c:3333:7020","TCP","88","36590  >  443 [ACK] Seq=1378 Ack=78406 Win=64128 Len=0 TSval=3875273482 TSecr=2944775518"
"166","50.321357007","2a00:a040:0:4:face:b00c:3333:7020","2a00:a041:3c5d:4d00:424b:6377:a930:43d","TLSv1.3","1468","Application Data [TCP segment of a reassembled PDU]"
"167","50.322020438","2a00:a040:0:4:face:b00c:3333:7020","2a00:a041:3c5d:4d00:424b:6377:a930:43d","TCP","1468","443  >  36590 [ACK] Seq=79786 Ack=1378 Win=31488 Len=1380 TSval=2944775519 TSecr=3875273473 [TCP segment of a reassembled PDU]"
"168","50.322085475","2a00:a041:3c5d:4d00:424b:6377:a930:43d","2a00:a040:0:4:face:b00c:3333:7020","TCP","88","36590  >  443 [ACK] Seq=1378 Ack=81166 Win=64128 Len=0 TSval=3875273483 TSecr=2944775519"
"169","50.322772470","2a00:a040:0:4:face:b00c:3333:7020","2a00:a041:3c5d:4d00:424b:6377:a930:43d","TCP","1468","443  >  36590 [PSH, ACK] Seq=81166 Ack=1378 Win=31488 Len=1380 TSval=2944775519 TSecr=3875273473 [TCP segment of a reassembled PDU]"
"170","50.323317003","2a00:a040:0:4:face:b00c:3333:7020","2a00:a041:3c5d:4d00:424b:6377:a930:43d","TLSv1.3","1468","Application Data [TCP segment of a reassembled PDU]"
"171","50.323366887","2a00:a041:3c5d:4d00:424b:6377:a930:43d","2a00:a040:0:4:face:b00c:3333:7020","TCP","88","36590  >  443 [ACK] Seq=1378 Ack=83926 Win=63104 Len=0 TSval=3875273484 TSecr=2944775519"
"172","50.324097969","2a00:a040:0:4:face:b00c:3333:7020","2a00:a041:3c5d:4d00:424b:6377:a930:43d","TLSv1.3","2848","Application Data [TCP segment of a reassembled PDU]"
"173","50.324162887","2a00:a041:3c5d:4d00:424b:6377:a930:43d","2a00:a040:0:4:face:b00c:3333:7020","TCP","88","36590  >  443 [ACK] Seq=1378 Ack=86686 Win=61056 Len=0 TSval=3875273485 TSecr=2944775520"
"174","50.324836542","2a00:a040:0:4:face:b00c:3333:7020","2a00:a041:3c5d:4d00:424b:6377:a930:43d","TLSv1.3","1468","Application Data, Application Data"
"175","50.325454841","2a00:a040:0:4:face:b00c:3333:7020","2a00:a041:3c5d:4d00:424b:6377:a930:43d","TLSv1.3","2848","Application Data [TCP segment of a reassembled PDU]"
"176","50.325460023","2a00:a041:3c5d:4d00:424b:6377:a930:43d","2a00:a040:0:4:face:b00c:3333:7020","TCP","88","36590  >  443 [ACK] Seq=1378 Ack=90826 Win=61056 Len=0 TSval=3875273486 TSecr=2944775521"
"177","50.326129038","2a00:a040:0:4:face:b00c:3333:7020","2a00:a041:3c5d:4d00:424b:6377:a930:43d","TLSv1.3","1468","Application Data [TCP segment of a reassembled PDU]"
"178","50.326796188","2a00:a040:0:4:face:b00c:3333:7020","2a00:a041:3c5d:4d00:424b:6377:a930:43d","TCP","2848","443  >  36590 [PSH, ACK] Seq=92206 Ack=1378 Win=31488 Len=2760 TSval=2944775522 TSecr=3875273473 [TCP segment of a reassembled PDU]"
"179","50.326799837","2a00:a041:3c5d:4d00:424b:6377:a930:43d","2a00:a040:0:4:face:b00c:3333:7020","TCP","88","36590  >  443 [ACK] Seq=1378 Ack=94966 Win=61056 Len=0 TSval=3875273488 TSecr=2944775522"
"180","50.327559856","2a00:a040:0:4:face:b00c:3333:7020","2a00:a041:3c5d:4d00:424b:6377:a930:43d","TLSv1.3","2848","Application Data [TCP segment of a reassembled PDU]"
"181","50.327563658","2a00:a041:3c5d:4d00:424b:6377:a930:43d","2a00:a040:0:4:face:b00c:3333:7020","TCP","88","36590  >  443 [ACK] Seq=1378 Ack=97726 Win=61056 Len=0 TSval=3875273488 TSecr=2944775522"
"182","50.328229379","2a00:a040:0:4:face:b00c:3333:7020","2a00:a041:3c5d:4d00:424b:6377:a930:43d","TCP","1468","443  >  36590 [ACK] Seq=97726 Ack=1378 Win=31488 Len=1380 TSval=2944775526 TSecr=3875273478 [TCP segment of a reassembled PDU]"
"183","50.328724064","2a00:a040:0:4:face:b00c:3333:7020","2a00:a041:3c5d:4d00:424b:6377:a930:43d","TLSv1.3","1468","Application Data [TCP segment of a reassembled PDU]"
"184","50.328727905","2a00:a041:3c5d:4d00:424b:6377:a930:43d","2a00:a040:0:4:face:b00c:3333:7020","TCP","88","36590  >  443 [ACK] Seq=1378 Ack=100486 Win=63104 Len=0 TSval=3875273490 TSecr=2944775526"
"185","50.329498200","2a00:a040:0:4:face:b00c:3333:7020","2a00:a041:3c5d:4d00:424b:6377:a930:43d","TLSv1.3","1468","Application Data [TCP segment of a reassembled PDU]"
"186","50.329498281","2a00:a040:0:4:face:b00c:3333:7020","2a00:a041:3c5d:4d00:424b:6377:a930:43d","TCP","1468","443  >  36590 [ACK] Seq=101866 Ack=1378 Win=31488 Len=1380 TSval=2944775526 TSecr=3875273478 [TCP segment of a reassembled PDU]"
"187","50.329542084","2a00:a041:3c5d:4d00:424b:6377:a930:43d","2a00:a040:0:4:face:b00c:3333:7020","TCP","88","36590  >  443 [ACK] Seq=1378 Ack=103246 Win=61056 Len=0 TSval=3875273490 TSecr=2944775526"
"188","50.330221564","2a00:a040:0:4:face:b00c:3333:7020","2a00:a041:3c5d:4d00:424b:6377:a930:43d","TLSv1.3","1468","Application Data [TCP segment of a reassembled PDU]"
"189","50.330641748","2a00:a040:0:4:face:b00c:3333:7020","2a00:a041:3c5d:4d00:424b:6377:a930:43d","TLSv1.3","1468","Application Data [TCP segment of a reassembled PDU]"
"190","50.330644581","2a00:a041:3c5d:4d00:424b:6377:a930:43d","2a00:a040:0:4:face:b00c:3333:7020","TCP","88","36590  >  443 [ACK] Seq=1378 Ack=106006 Win=63104 Len=0 TSval=3875273492 TSecr=2944775526"
"191","50.331420752","2a00:a040:0:4:face:b00c:3333:7020","2a00:a041:3c5d:4d00:424b:6377:a930:43d","TLSv1.3","2848","Application Data, Application Data"
"192","50.331472505","2a00:a041:3c5d:4d00:424b:6377:a930:43d","2a00:a040:0:4:face:b00c:3333:7020","TCP","88","36590  >  443 [ACK] Seq=1378 Ack=108766 Win=61056 Len=0 TSval=3875273492 TSecr=2944775527"
"193","50.332152050","2a00:a040:0:4:face:b00c:3333:7020","2a00:a041:3c5d:4d00:424b:6377:a930:43d","TLSv1.3","1468","Application Data [TCP segment of a reassembled PDU]"
"194","50.332690060","2a00:a040:0:4:face:b00c:3333:7020","2a00:a041:3c5d:4d00:424b:6377:a930:43d","TCP","1468","443  >  36590 [ACK] Seq=110146 Ack=1378 Win=31488 Len=1380 TSval=2944775528 TSecr=3875273478 [TCP segment of a reassembled PDU]"
"195","50.332693259","2a00:a041:3c5d:4d00:424b:6377:a930:43d","2a00:a040:0:4:face:b00c:3333:7020","TCP","88","36590  >  443 [ACK] Seq=1378 Ack=111526 Win=63104 Len=0 TSval=3875273494 TSecr=2944775527"
"196","50.333165058","2a00:a040:0:4:face:b00c:3333:7020","2a00:a041:3c5d:4d00:424b:6377:a930:43d","TLSv1.3","2848","Application Data [TCP segment of a reassembled PDU]"
"197","50.333220247","2a00:a041:3c5d:4d00:424b:6377:a930:43d","2a00:a040:0:4:face:b00c:3333:7020","TCP","88","36590  >  443 [ACK] Seq=1378 Ack=114286 Win=61056 Len=0 TSval=3875273494 TSecr=2944775528"
"198","50.333832284","2a00:a040:0:4:face:b00c:3333:7020","2a00:a041:3c5d:4d00:424b:6377:a930:43d","TCP","1468","443  >  36590 [ACK] Seq=114286 Ack=1378 Win=31488 Len=1380 TSval=2944775528 TSecr=3875273478 [TCP segment of a reassembled PDU]"
"199","50.334510771","2a00:a040:0:4:face:b00c:3333:7020","2a00:a041:3c5d:4d00:424b:6377:a930:43d","TLSv1.3","1468","Application Data [TCP segment of a reassembled PDU]"
"200","50.334515394","2a00:a041:3c5d:4d00:424b:6377:a930:43d","2a00:a040:0:4:face:b00c:3333:7020","TCP","88","36590  >  443 [ACK] Seq=1378 Ack=117046 Win=63104 Len=0 TSval=3875273495 TSecr=2944775528"
"201","50.335363152","2a00:a040:0:4:face:b00c:3333:7020","2a00:a041:3c5d:4d00:424b:6377:a930:43d","TLSv1.3","1468","Application Data [TCP segment of a reassembled PDU]"
"202","50.336490076","2a00:a040:0:4:face:b00c:3333:7020","2a00:a041:3c5d:4d00:424b:6377:a930:43d","TCP","1468","443  >  36590 [ACK] Seq=118426 Ack=1378 Win=31488 Len=1380 TSval=2944775529 TSecr=3875273478 [TCP segment of a reassembled PDU]"
"203","50.336494757","2a00:a041:3c5d:4d00:424b:6377:a930:43d","2a00:a040:0:4:face:b00c:3333:7020","TCP","88","36590  >  443 [ACK] Seq=1378 Ack=119806 Win=63104 Len=0 TSval=3875273497 TSecr=2944775528"
"204","50.337554237","2a00:a040:0:4:face:b00c:3333:7020","2a00:a041:3c5d:4d00:424b:6377:a930:43d","TLSv1.3","2848","Application Data, Application Data"
"205","50.337554265","2a00:a040:0:4:face:b00c:3333:7020","2a00:a041:3c5d:4d00:424b:6377:a930:43d","TLSv1.3","4228","Application Data, Application Data"
"206","50.337594618","2a00:a041:3c5d:4d00:424b:6377:a930:43d","2a00:a040:0:4:face:b00c:3333:7020","TCP","88","36590  >  443 [ACK] Seq=1378 Ack=126706 Win=56320 Len=0 TSval=3875273499 TSecr=2944775529"
"207","50.338478585","2a00:a040:0:4:face:b00c:3333:7020","2a00:a041:3c5d:4d00:424b:6377:a930:43d","TLSv1.3","4228","Application Data, Application Data"
"208","50.338485120","2a00:a041:3c5d:4d00:424b:6377:a930:43d","2a00:a040:0:4:face:b00c:3333:7020","TCP","88","36590  >  443 [ACK] Seq=1378 Ack=130846 Win=59008 Len=0 TSval=3875273499 TSecr=2944775532"
"209","50.339251976","2a00:a040:0:4:face:b00c:3333:7020","2a00:a041:3c5d:4d00:424b:6377:a930:43d","TLSv1.3","2847","Application Data, Application Data, Application Data"
"210","50.339257393","2a00:a041:3c5d:4d00:424b:6377:a930:43d","2a00:a040:0:4:face:b00c:3333:7020","TCP","88","36590  >  443 [ACK] Seq=1378 Ack=133605 Win=69632 Len=0 TSval=3875273500 TSecr=2944775533"
"211","50.351655791","2a00:a040:0:4:face:b00c:3333:7020","2a00:a041:3c5d:4d00:424b:6377:a930:43d","TCP","88","[TCP Dup ACK 89#1] 443  >  36590 [ACK] Seq=133605 Ack=1378 Win=31488 Len=0 TSval=2944775551 TSecr=3875273500"
"212","54.988566634","2a03:2880:f258:1c3:face:b00c:0:167","2a00:a041:3c5d:4d00:424b:6377:a930:43d","TLSv1.2","181","Application Data"
"213","54.988601638","2a00:a041:3c5d:4d00:424b:6377:a930:43d","2a03:2880:f258:1c3:face:b00c:0:167","TCP","88","41660  >  443 [ACK] Seq=373 Ack=5249 Win=1174 Len=0 TSval=2766527977 TSecr=3181577227"
"214","54.994362827","2a00:a041:3c5d:4d00:424b:6377:a930:43d","2a03:2880:f258:1c3:face:b00c:0:167","TLSv1.2","180","Application Data"
"215","55.073286262","2a03:2880:f258:1c3:face:b00c:0:167","2a00:a041:3c5d:4d00:424b:6377:a930:43d","TCP","88","443  >  41660 [ACK] Seq=5249 Ack=465 Win=730 Len=0 TSval=3181577355 TSecr=2766527983"
"225","69.814850536","2a00:a041:3c5d:4d00:424b:6377:a930:43d","2a03:2880:f258:1c3:face:b00c:0:167","TLSv1.2","157","Application Data"
"226","69.895437694","2a03:2880:f258:1c3:face:b00c:0:167","2a00:a041:3c5d:4d00:424b:6377:a930:43d","TCP","88","443  >  41660 [ACK] Seq=5249 Ack=534 Win=730 Len=0 TSval=3181592177 TSecr=2766542804"
"227","69.975817706","2a03:2880:f258:1c3:face:b00c:0:167","2a00:a041:3c5d:4d00:424b:6377:a930:43d","TLSv1.2","159","Application Data"
"228","70.017717625","2a00:a041:3c5d:4d00:424b:6377:a930:43d","2a03:2880:f258:1c3:face:b00c:0:167","TCP","88","41660  >  443 [ACK] Seq=534 Ack=5320 Win=1174 Len=0 TSval=2766543007 TSecr=3181592257"
"234","74.755085014","2a03:2880:f258:1c3:face:b00c:0:167","2a00:a041:3c5d:4d00:424b:6377:a930:43d","TLSv1.2","276","Application Data"
"235","74.755117442","2a00:a041:3c5d:4d00:424b:6377:a930:43d","2a03:2880:f258:1c3:face:b00c:0:167","TCP","88","41660  >  443 [ACK] Seq=534 Ack=5508 Win=1174 Len=0 TSval=2766547744 TSecr=3181596943"
"236","75.234525165","2a00:a041:3c5d:4d00:424b:6377:a930:43d","2a03:2880:f258:1c3:face:b00c:0:167","TLSv1.2","160","Application Data"
"237","75.311147927","2a03:2880:f258:1c3:face:b00c:0:167","2a00:a041:3c5d:4d00:424b:6377:a930:43d","TCP","88","443  >  41660 [ACK] Seq=5508 Ack=606 Win=730 Len=0 TSval=3181597593 TSecr=2766548223"
"244","86.425819819","2a03:2880:f258:1c3:face:b00c:0:167","2a00:a041:3c5d:4d00:424b:6377:a930:43d","TLSv1.2","411","Application Data"
"245","86.425857466","2a00:a041:3c5d:4d00:424b:6377:a930:43d","2a03:2880:f258:1c3:face:b00c:0:167","TCP","88","41660  >  443 [ACK] Seq=606 Ack=5831 Win=1174 Len=0 TSval=2766559415 TSecr=3181608599"
"248","87.180693072","2a00:a041:3c5d:4d00:424b:6377:a930:43d","2a03:2880:f258:1c3:face:b00c:0:167","TLSv1.2","181","Application Data"
"249","87.255170458","2a03:2880:f258:1c3:face:b00c:0:167","2a00:a041:3c5d:4d00:424b:6377:a930:43d","TCP","88","443  >  41660 [ACK] Seq=5831 Ack=699 Win=730 Len=0 TSval=3181609538 TSecr=2766560170"
"251","92.125119697","2a00:a041:3c5d:4d00:424b:6377:a930:43d","2a03:2880:f258:1c3:face:b00c:0:167","TLSv1.2","157","Application Data"
"252","92.203272628","2a03:2880:f258:1c3:face:b00c:0:167","2a00:a041:3c5d:4d00:424b:6377:a930:43d","TCP","88","443  >  41660 [ACK] Seq=5831 Ack=768 Win=730 Len=0 TSval=3181614486 TSecr=2766565114"
"253","92.282749916","2a03:2880:f258:1c3:face:b00c:0:167","2a00:a041:3c5d:4d00:424b:6377:a930:43d","TLSv1.2","159","Application Data"
"254","92.282796554","2a00:a041:3c5d:4d00:424b:6377:a930:43d","2a03:2880:f258:1c3:face:b00c:0:167","TCP","88","41660  >  443 [ACK] Seq=768 Ack=5902 Win=1174 Len=0 TSval=2766565272 TSecr=3181614566"
"259","107.755053523","2a00:a041:3c5d:4d00:424b:6377:a930:43d","2a03:2880:f258:1c3:face:b00c:0:167","TLSv1.2","157","Application Data"
"260","107.835738849","2a03:2880:f258:1c3:face:b00c:0:167","2a00:a041:3c5d:4d00:424b:6377:a930:43d","TCP","88","443  >  41660 [ACK] Seq=5902 Ack=837 Win=730 Len=0 TSval=3181630118 TSecr=2766580744"
"261","107.915405867","2a03:2880:f258:1c3:face:b00c:0:167","2a00:a041:3c5d:4d00:424b:6377:a930:43d","TLSv1.2","159","Application Data"
"262","107.915441495","2a00:a041:3c5d:4d00:424b:6377:a930:43d","2a03:2880:f258:1c3:face:b00c:0:167","TCP","88","41660  >  443 [ACK] Seq=837 Ack=5973 Win=1174 Len=0 TSval=2766580904 TSecr=3181630198"
"264","110.340325619","2a00:a041:3c5d:4d00:424b:6377:a930:43d","2a00:a040:0:4:face:b00c:3333:7020","TLSv1.3","112","Application Data"
"265","110.340376185","2a00:a041:3c5d:4d00:424b:6377:a930:43d","2a00:a040:0:4:face:b00c:3333:7020","TCP","88","36590  >  443 [FIN, ACK] Seq=1402 Ack=133605 Win=69632 Len=0 TSval=3875333501 TSecr=2944775551"
"266","110.356041889","2a00:a040:0:4:face:b00c:3333:7020","2a00:a041:3c5d:4d00:424b:6377:a930:43d","TLSv1.3","112","Application Data"
"267","110.356092582","2a00:a041:3c5d:4d00:424b:6377:a930:43d","2a00:a040:0:4:face:b00c:3333:7020","TCP","76","36590  >  443 [RST] Seq=1403 Win=0 Len=0"
"268","110.356311386","2a00:a040:0:4:face:b00c:3333:7020","2a00:a041:3c5d:4d00:424b:6377:a930:43d","TCP","88","443  >  36590 [FIN, ACK] Seq=133629 Ack=1403 Win=31488 Len=0 TSval=2944835554 TSecr=3875333501"
"269","110.356328381","2a00:a041:3c5d:4d00:424b:6377:a930:43d","2a00:a040:0:4:face:b00c:3333:7020","TCP","76","36590  >  443 [RST] Seq=1403 Win=0 Len=0"
"285","126.461351634","2a00:a041:3c5d:4d00:424b:6377:a930:43d","2a03:2880:f258:1c3:face:b00c:0:167","TLSv1.2","157","Application Data"
"286","126.537337011","2a03:2880:f258:1c3:face:b00c:0:167","2a00:a041:3c5d:4d00:424b:6377:a930:43d","TCP","88","443  >  41660 [ACK] Seq=5973 Ack=906 Win=730 Len=0 TSval=3181648820 TSecr=2766599450"
"287","126.616965458","2a03:2880:f258:1c3:face:b00c:0:167","2a00:a041:3c5d:4d00:424b:6377:a930:43d","TLSv1.2","159","Application Data"
"288","126.617003169","2a00:a041:3c5d:4d00:424b:6377:a930:43d","2a03:2880:f258:1c3:face:b00c:0:167","TCP","88","41660  >  443 [ACK] Seq=906 Ack=6044 Win=1174 Len=0 TSval=2766599606 TSecr=3181648900"
"292","146.330887096","2a03:2880:f258:1c3:face:b00c:0:167","2a00:a041:3c5d:4d00:424b:6377:a930:43d","TLSv1.2","276","Application Data"
"293","146.330929572","2a00:a041:3c5d:4d00:424b:6377:a930:43d","2a03:2880:f258:1c3:face:b00c:0:167","TCP","88","41660  >  443 [ACK] Seq=906 Ack=6232 Win=1174 Len=0 TSval=2766619320 TSecr=3181668594"
"294","146.519758232","2a00:a041:3c5d:4d00:424b:6377:a930:43d","2a03:2880:f258:1c3:face:b00c:0:167","TLSv1.2","160","Application Data"
"295","146.842190422","2a03:2880:f258:1c3:face:b00c:0:167","2a00:a041:3c5d:4d00:424b:6377:a930:43d","TLSv1.2","277","Application Data"
"296","146.842230010","2a00:a041:3c5d:4d00:424b:6377:a930:43d","2a03:2880:f258:1c3:face:b00c:0:167","TCP","88","41660  >  443 [ACK] Seq=978 Ack=6421 Win=1174 Len=0 TSval=2766619831 TSecr=3181669093"
"297","146.883505125","2a03:2880:f258:1c3:face:b00c:0:167","2a00:a041:3c5d:4d00:424b:6377:a930:43d","TCP","88","443  >  41660 [ACK] Seq=6421 Ack=978 Win=730 Len=0 TSval=3181669167 TSecr=2766619509"
"298","146.953907166","2a00:a041:3c5d:4d00:424b:6377:a930:43d","2a03:2880:f258:1c3:face:b00c:0:167","TLSv1.2","160","Application Data"
"299","147.453790392","2a00:a041:3c5d:4d00:424b:6377:a930:43d","2a03:2880:f258:1c3:face:b00c:0:167","TCP","160","[TCP Retransmission] 41660  >  443 [PSH, ACK] Seq=978 Ack=6421 Win=1174 Len=72 TSval=2766620443 TSecr=3181669167"
"300","147.456557401","2a03:2880:f258:1c3:face:b00c:0:167","2a00:a041:3c5d:4d00:424b:6377:a930:43d","TCP","88","443  >  41660 [ACK] Seq=6421 Ack=1050 Win=730 Len=0 TSval=3181669696 TSecr=2766619943"
"301","147.968542894","2a03:2880:f258:1c3:face:b00c:0:167","2a00:a041:3c5d:4d00:424b:6377:a930:43d","TCP","88","[TCP Dup ACK 300#1] 443  >  41660 [ACK] Seq=6421 Ack=1050 Win=730 Len=0 TSval=3181670189 TSecr=2766620443"
"307","150.088760354","2a00:a041:3c5d:4d00:424b:6377:a930:43d","2a03:2880:f258:1c3:face:b00c:0:167","TLSv1.2","157","Application Data"
"308","150.685687167","2a00:a041:3c5d:4d00:424b:6377:a930:43d","2a03:2880:f258:1c3:face:b00c:0:167","TCP","157","[TCP Retransmission] 41660  >  443 [PSH, ACK] Seq=1050 Ack=6421 Win=1174 Len=69 TSval=2766623675 TSecr=3181670189"
"309","150.938190794","2a03:2880:f258:1c3:face:b00c:0:167","2a00:a041:3c5d:4d00:424b:6377:a930:43d","TCP","88","443  >  41660 [ACK] Seq=6421 Ack=1119 Win=730 Len=0 TSval=3181673111 TSecr=2766623078"
"310","150.938619244","2a03:2880:f258:1c3:face:b00c:0:167","2a00:a041:3c5d:4d00:424b:6377:a930:43d","TLSv1.2","159","Application Data"
"311","150.938644301","2a00:a041:3c5d:4d00:424b:6377:a930:43d","2a03:2880:f258:1c3:face:b00c:0:167","TCP","88","41660  >  443 [ACK] Seq=1119 Ack=6492 Win=1174 Len=0 TSval=2766623928 TSecr=3181673191"
"312","151.449926461","2a03:2880:f258:1c3:face:b00c:0:167","2a00:a041:3c5d:4d00:424b:6377:a930:43d","TCP","88","[TCP Dup ACK 309#1] 443  >  41660 [ACK] Seq=6492 Ack=1119 Win=730 Len=0 TSval=3181673719 TSecr=2766623928"
"328","158.413791190","2a03:2880:f258:1c3:face:b00c:0:167","2a00:a041:3c5d:4d00:424b:6377:a930:43d","TCP","1468","443  >  41660 [ACK] Seq=6492 Ack=1119 Win=730 Len=1380 TSval=3181680668 TSecr=2766623928 [TCP segment of a reassembled PDU]"
"329","158.413831057","2a00:a041:3c5d:4d00:424b:6377:a930:43d","2a03:2880:f258:1c3:face:b00c:0:167","TCP","88","41660  >  443 [ACK] Seq=1119 Ack=7872 Win=1174 Len=0 TSval=2766631403 TSecr=3181680668"
"330","158.414249202","2a03:2880:f258:1c3:face:b00c:0:167","2a00:a041:3c5d:4d00:424b:6377:a930:43d","TLSv1.2","221","Application Data"
"331","158.414273006","2a00:a041:3c5d:4d00:424b:6377:a930:43d","2a03:2880:f258:1c3:face:b00c:0:167","TCP","88","41660  >  443 [ACK] Seq=1119 Ack=8005 Win=1174 Len=0 TSval=2766631403 TSecr=3181680668"
