"No.","Time","Source","Destination","Protocol","Length","Info"
"3","1.126085266","2a03:2880:f242:c8:face:b00c:0:167","2a10:8012:21:4188:cdf4:35bf:f239:2701","TLSv1.2","380","Application Data"
"4","1.126117460","2a10:8012:21:4188:cdf4:35bf:f239:2701","2a03:2880:f242:c8:face:b00c:0:167","TCP","86","55414  >  443 [ACK] Seq=1 Ack=295 Win=1953 Len=0 TSval=2448901846 TSecr=4197480203"
"5","1.465218702","2a10:8012:21:4188:cdf4:35bf:f239:2701","2a03:2880:f242:c8:face:b00c:0:167","TLSv1.2","163","Application Data"
"6","1.508713391","2a03:2880:f242:c8:face:b00c:0:167","2a10:8012:21:4188:cdf4:35bf:f239:2701","TCP","86","443  >  55414 [ACK] Seq=295 Ack=78 Win=1282 Len=0 TSval=4197480677 TSecr=2448902185"
"7","6.860831550","2a03:2880:f242:c8:face:b00c:0:167","2a10:8012:21:4188:cdf4:35bf:f239:2701","TLSv1.2","364","Application Data"
"8","6.860867049","2a10:8012:21:4188:cdf4:35bf:f239:2701","2a03:2880:f242:c8:face:b00c:0:167","TCP","86","55414  >  443 [ACK] Seq=78 Ack=573 Win=1953 Len=0 TSval=2448907581 TSecr=4197486021"
"11","7.284751791","2a10:8012:21:4188:cdf4:35bf:f239:2701","2a03:2880:f242:c8:face:b00c:0:167","TLSv1.2","163","Application Data"
"12","7.326913167","2a03:2880:f242:c8:face:b00c:0:167","2a10:8012:21:4188:cdf4:35bf:f239:2701","TCP","86","443  >  55414 [ACK] Seq=573 Ack=155 Win=1282 Len=0 TSval=4197486495 TSecr=2448908005"
"14","18.549370690","2a10:8012:21:4188:cdf4:35bf:f239:2701","2a03:2880:f242:c8:face:b00c:0:167","TLSv1.2","156","Application Data"
"15","18.593614271","2a03:2880:f242:c8:face:b00c:0:167","2a10:8012:21:4188:cdf4:35bf:f239:2701","TCP","86","443  >  55414 [ACK] Seq=573 Ack=225 Win=1282 Len=0 TSval=4197497761 TSecr=2448919269"
"16","18.679772935","2a03:2880:f242:c8:face:b00c:0:167","2a10:8012:21:4188:cdf4:35bf:f239:2701","TLSv1.2","158","Application Data"
"17","18.679811060","2a10:8012:21:4188:cdf4:35bf:f239:2701","2a03:2880:f242:c8:face:b00c:0:167","TCP","86","55414  >  443 [ACK] Seq=225 Ack=645 Win=1953 Len=0 TSval=2448919400 TSecr=4197497848"
"18","20.481571159","2a03:2880:f242:c8:face:b00c:0:167","2a10:8012:21:4188:cdf4:35bf:f239:2701","TLSv1.2","1599","Application Data"
"19","20.481611214","2a10:8012:21:4188:cdf4:35bf:f239:2701","2a03:2880:f242:c8:face:b00c:0:167","TCP","86","55414  >  443 [ACK] Seq=225 Ack=2158 Win=1942 Len=0 TSval=2448921202 TSecr=4197499605"
"20","20.485774975","2a03:2880:f242:c8:face:b00c:0:167","2a10:8012:21:4188:cdf4:35bf:f239:2701","TLSv1.2","2681","Application Data"
"21","20.485775339","2a03:2880:f242:c8:face:b00c:0:167","2a10:8012:21:4188:cdf4:35bf:f239:2701","TCP","2846","443  >  55414 [PSH, ACK] Seq=4753 Ack=225 Win=1282 Len=2760 TSval=4197499623 TSecr=2448919400 [TCP segment of a reassembled PDU]"
"22","20.485775407","2a03:2880:f242:c8:face:b00c:0:167","2a10:8012:21:4188:cdf4:35bf:f239:2701","TLSv1.2","2846","Application Data [TCP segment of a reassembled PDU]"
"23","20.485814554","2a10:8012:21:4188:cdf4:35bf:f239:2701","2a03:2880:f242:c8:face:b00c:0:167","TCP","86","55414  >  443 [ACK] Seq=225 Ack=4753 Win=1937 Len=0 TSval=2448921206 TSecr=4197499609"
"24","20.485836943","2a10:8012:21:4188:cdf4:35bf:f239:2701","2a03:2880:f242:c8:face:b00c:0:167","TCP","86","55414  >  443 [ACK] Seq=225 Ack=7513 Win=1916 Len=0 TSval=2448921206 TSecr=4197499623"
"25","20.485842603","2a10:8012:21:4188:cdf4:35bf:f239:2701","2a03:2880:f242:c8:face:b00c:0:167","TCP","86","55414  >  443 [ACK] Seq=225 Ack=10273 Win=1895 Len=0 TSval=2448921206 TSecr=4197499637"
"26","20.486808440","2a03:2880:f242:c8:face:b00c:0:167","2a10:8012:21:4188:cdf4:35bf:f239:2701","TLSv1.2","2846","Application Data, Application Data"
"27","20.486841044","2a10:8012:21:4188:cdf4:35bf:f239:2701","2a03:2880:f242:c8:face:b00c:0:167","TCP","86","55414  >  443 [ACK] Seq=225 Ack=13033 Win=1937 Len=0 TSval=2448921207 TSecr=4197499651"
"28","20.496604982","2a03:2880:f242:c8:face:b00c:0:167","2a10:8012:21:4188:cdf4:35bf:f239:2701","TLSv1.2","2846","Application Data [TCP segment of a reassembled PDU]"
"29","20.496641512","2a10:8012:21:4188:cdf4:35bf:f239:2701","2a03:2880:f242:c8:face:b00c:0:167","TCP","86","55414  >  443 [ACK] Seq=225 Ack=15793 Win=1937 Len=0 TSval=2448921217 TSecr=4197499665"
"30","20.510694078","2a03:2880:f242:c8:face:b00c:0:167","2a10:8012:21:4188:cdf4:35bf:f239:2701","TLSv1.2","2846","Application Data [TCP segment of a reassembled PDU]"
"31","20.510729448","2a10:8012:21:4188:cdf4:35bf:f239:2701","2a03:2880:f242:c8:face:b00c:0:167","TCP","86","55414  >  443 [ACK] Seq=225 Ack=18553 Win=1937 Len=0 TSval=2448921231 TSecr=4197499679"
"32","20.525179862","2a03:2880:f242:c8:face:b00c:0:167","2a10:8012:21:4188:cdf4:35bf:f239:2701","TCP","2846","443  >  55414 [PSH, ACK] Seq=18553 Ack=225 Win=1282 Len=2760 TSval=4197499693 TSecr=2448919400 [TCP segment of a reassembled PDU]"
"33","20.525216181","2a10:8012:21:4188:cdf4:35bf:f239:2701","2a03:2880:f242:c8:face:b00c:0:167","TCP","86","55414  >  443 [ACK] Seq=225 Ack=21313 Win=1937 Len=0 TSval=2448921245 TSecr=4197499693"
"34","20.538937416","2a03:2880:f242:c8:face:b00c:0:167","2a10:8012:21:4188:cdf4:35bf:f239:2701","TLSv1.2","2846","Application Data [TCP segment of a reassembled PDU]"
"35","20.538953784","2a10:8012:21:4188:cdf4:35bf:f239:2701","2a03:2880:f242:c8:face:b00c:0:167","TCP","86","55414  >  443 [ACK] Seq=225 Ack=24073 Win=1937 Len=0 TSval=2448921259 TSecr=4197499707"
"36","20.554001642","2a03:2880:f242:c8:face:b00c:0:167","2a10:8012:21:4188:cdf4:35bf:f239:2701","TLSv1.2","2846","Application Data [TCP segment of a reassembled PDU]"
"37","20.554036906","2a10:8012:21:4188:cdf4:35bf:f239:2701","2a03:2880:f242:c8:face:b00c:0:167","TCP","86","55414  >  443 [ACK] Seq=225 Ack=26833 Win=1937 Len=0 TSval=2448921274 TSecr=4197499721"
"38","20.566989735","2a03:2880:f242:c8:face:b00c:0:167","2a10:8012:21:4188:cdf4:35bf:f239:2701","TLSv1.2","1466","Application Data [TCP segment of a reassembled PDU]"
"39","20.567036263","2a10:8012:21:4188:cdf4:35bf:f239:2701","2a03:2880:f242:c8:face:b00c:0:167","TCP","86","55414  >  443 [ACK] Seq=225 Ack=28213 Win=1953 Len=0 TSval=2448921287 TSecr=4197499736"
"40","20.574201034","2a03:2880:f242:c8:face:b00c:0:167","2a10:8012:21:4188:cdf4:35bf:f239:2701","TCP","1466","443  >  55414 [ACK] Seq=28213 Ack=225 Win=1282 Len=1380 TSval=4197499743 TSecr=2448921217 [TCP segment of a reassembled PDU]"
"41","20.574234063","2a10:8012:21:4188:cdf4:35bf:f239:2701","2a03:2880:f242:c8:face:b00c:0:167","TCP","86","55414  >  443 [ACK] Seq=225 Ack=29593 Win=1953 Len=0 TSval=2448921294 TSecr=4197499743"
"42","20.581086831","2a03:2880:f242:c8:face:b00c:0:167","2a10:8012:21:4188:cdf4:35bf:f239:2701","TLSv1.2","2846","Application Data [TCP segment of a reassembled PDU]"
"43","20.581120958","2a10:8012:21:4188:cdf4:35bf:f239:2701","2a03:2880:f242:c8:face:b00c:0:167","TCP","86","55414  >  443 [ACK] Seq=225 Ack=32353 Win=1937 Len=0 TSval=2448921301 TSecr=4197499750"
"44","20.596131744","2a03:2880:f242:c8:face:b00c:0:167","2a10:8012:21:4188:cdf4:35bf:f239:2701","TLSv1.2","2846","Application Data [TCP segment of a reassembled PDU]"
"45","20.596181588","2a10:8012:21:4188:cdf4:35bf:f239:2701","2a03:2880:f242:c8:face:b00c:0:167","TCP","86","55414  >  443 [ACK] Seq=225 Ack=35113 Win=1937 Len=0 TSval=2448921316 TSecr=4197499764"
"46","20.609659543","2a03:2880:f242:c8:face:b00c:0:167","2a10:8012:21:4188:cdf4:35bf:f239:2701","TLSv1.2","1998","Application Data, Application Data"
"47","20.609679905","2a10:8012:21:4188:cdf4:35bf:f239:2701","2a03:2880:f242:c8:face:b00c:0:167","TCP","86","55414  >  443 [ACK] Seq=225 Ack=37025 Win=1937 Len=0 TSval=2448921330 TSecr=4197499778"
"48","21.241001335","2a10:8012:21:4188:cdf4:35bf:f239:2701","2a03:2880:f242:c8:face:b00c:0:167","TLSv1.2","179","Application Data"
"49","21.284892405","2a03:2880:f242:c8:face:b00c:0:167","2a10:8012:21:4188:cdf4:35bf:f239:2701","TCP","86","443  >  55414 [ACK] Seq=37025 Ack=318 Win=1282 Len=0 TSval=4197500453 TSecr=2448921961"
"50","24.473491354","2a03:2880:f242:c8:face:b00c:0:167","2a10:8012:21:4188:cdf4:35bf:f239:2701","TLSv1.2","179","Application Data"
"51","24.473525980","2a10:8012:21:4188:cdf4:35bf:f239:2701","2a03:2880:f242:c8:face:b00c:0:167","TCP","86","55414  >  443 [ACK] Seq=318 Ack=37118 Win=1953 Len=0 TSval=2448925194 TSecr=4197503542"
"52","24.477290287","2a10:8012:21:4188:cdf4:35bf:f239:2701","2a03:2880:f242:c8:face:b00c:0:167","TLSv1.2","178","Application Data"
"53","24.519863162","2a03:2880:f242:c8:face:b00c:0:167","2a10:8012:21:4188:cdf4:35bf:f239:2701","TCP","86","443  >  55414 [ACK] Seq=37118 Ack=410 Win=1282 Len=0 TSval=4197503688 TSecr=2448925197"
"54","27.443894526","2a03:2880:f242:c8:face:b00c:0:167","2a10:8012:21:4188:cdf4:35bf:f239:2701","TLSv1.2","1540","Application Data"
"55","27.444052151","2a10:8012:21:4188:cdf4:35bf:f239:2701","2a03:2880:f242:c8:face:b00c:0:167","TCP","86","55414  >  443 [ACK] Seq=410 Ack=38572 Win=1942 Len=0 TSval=2448928164 TSecr=4197506564"
"56","27.852408072","2a03:2880:f242:c8:face:b00c:0:167","2a10:8012:21:4188:cdf4:35bf:f239:2701","TLSv1.2","1540","Application Data"
"57","27.852526969","2a10:8012:21:4188:cdf4:35bf:f239:2701","2a03:2880:f242:c8:face:b00c:0:167","TCP","86","55414  >  443 [ACK] Seq=410 Ack=40026 Win=1937 Len=0 TSval=2448928573 TSecr=4197506917"
"58","27.890672717","2a03:2880:f242:c8:face:b00c:0:167","2a10:8012:21:4188:cdf4:35bf:f239:2701","TCP","160","[TCP Spurious Retransmission] 443  >  55414 [PSH, ACK] Seq=39952 Ack=410 Win=1282 Len=74 TSval=4197507059 TSecr=2448928164"
"59","27.890699136","2a10:8012:21:4188:cdf4:35bf:f239:2701","2a03:2880:f242:c8:face:b00c:0:167","TCP","98","[TCP Window Update] 55414  >  443 [ACK] Seq=410 Ack=40026 Win=1953 Len=0 TSval=2448928611 TSecr=4197507059 SLE=39952 SRE=40026"
"60","27.930183124","2a10:8012:21:4188:cdf4:35bf:f239:2701","2a03:2880:f242:c8:face:b00c:0:167","TLSv1.2","182","Application Data"
"61","27.971810134","2a03:2880:f242:c8:face:b00c:0:167","2a10:8012:21:4188:cdf4:35bf:f239:2701","TCP","86","443  >  55414 [ACK] Seq=40026 Ack=506 Win=1282 Len=0 TSval=4197507141 TSecr=2448928650"
"62","28.031849814","2a03:2880:f242:c8:face:b00c:0:167","2a10:8012:21:4188:cdf4:35bf:f239:2701","TLSv1.2","1540","Application Data"
"63","28.031886302","2a10:8012:21:4188:cdf4:35bf:f239:2701","2a03:2880:f242:c8:face:b00c:0:167","TCP","86","55414  >  443 [ACK] Seq=506 Ack=41480 Win=1942 Len=0 TSval=2448928752 TSecr=4197507200"
"64","28.468301101","2a03:2880:f242:c8:face:b00c:0:167","2a10:8012:21:4188:cdf4:35bf:f239:2701","TLSv1.2","1540","Application Data"
"65","28.468331091","2a10:8012:21:4188:cdf4:35bf:f239:2701","2a03:2880:f242:c8:face:b00c:0:167","TCP","86","55414  >  443 [ACK] Seq=506 Ack=42934 Win=1937 Len=0 TSval=2448929188 TSecr=4197507530"
"66","28.672692440","2a03:2880:f242:c8:face:b00c:0:167","2a10:8012:21:4188:cdf4:35bf:f239:2701","TLSv1.2","893","Application Data"
"67","28.672738024","2a10:8012:21:4188:cdf4:35bf:f239:2701","2a03:2880:f242:c8:face:b00c:0:167","TCP","86","55414  >  443 [ACK] Seq=506 Ack=43741 Win=1953 Len=0 TSval=2448929393 TSecr=4197507743"
"68","34.429238192","2a10:8012:21:4188:cdf4:35bf:f239:2701","2a03:2880:f242:c8:face:b00c:0:167","TLSv1.2","182","Application Data"
"69","34.474109549","2a03:2880:f242:c8:face:b00c:0:167","2a10:8012:21:4188:cdf4:35bf:f239:2701","TCP","86","443  >  55414 [ACK] Seq=43741 Ack=602 Win=1282 Len=0 TSval=4197513643 TSecr=2448935149"
"70","35.123500499","2a03:2880:f242:c8:face:b00c:0:167","2a10:8012:21:4188:cdf4:35bf:f239:2701","TLSv1.2","295","Application Data"
"71","35.123520251","2a10:8012:21:4188:cdf4:35bf:f239:2701","2a03:2880:f242:c8:face:b00c:0:167","TCP","86","55414  >  443 [ACK] Seq=602 Ack=43950 Win=1953 Len=0 TSval=2448935844 TSecr=4197514207"
"72","35.144302453","2a10:8012:21:4188:cdf4:35bf:f239:2701","2a03:2880:f242:c8:face:b00c:0:167","TLSv1.2","186","Application Data"
"73","35.186238836","2a03:2880:f242:c8:face:b00c:0:167","2a10:8012:21:4188:cdf4:35bf:f239:2701","TCP","86","443  >  55414 [ACK] Seq=43950 Ack=702 Win=1282 Len=0 TSval=4197514355 TSecr=2448935864"
"74","35.390459759","2a10:8012:21:4188:cdf4:35bf:f239:2701","2a03:2880:f242:c8:face:b00c:0:167","TLSv1.2","182","Application Data"
"75","35.435295511","2a03:2880:f242:c8:face:b00c:0:167","2a10:8012:21:4188:cdf4:35bf:f239:2701","TCP","86","443  >  55414 [ACK] Seq=43950 Ack=798 Win=1282 Len=0 TSval=4197514604 TSecr=2448936111"
"76","36.434653936","2a10:8012:21:4188:cdf4:35bf:f239:2701","2a03:2880:f242:c8:face:b00c:0:167","TLSv1.2","182","Application Data"
"77","36.480611908","2a03:2880:f242:c8:face:b00c:0:167","2a10:8012:21:4188:cdf4:35bf:f239:2701","TCP","86","443  >  55414 [ACK] Seq=43950 Ack=894 Win=1282 Len=0 TSval=4197515649 TSecr=2448937155"
"78","37.635229593","2a10:8012:21:4188:cdf4:35bf:f239:2701","2a03:2880:f242:c8:face:b00c:0:167","TLSv1.2","179","Application Data"
"79","37.680250683","2a03:2880:f242:c8:face:b00c:0:167","2a10:8012:21:4188:cdf4:35bf:f239:2701","TCP","86","443  >  55414 [ACK] Seq=43950 Ack=987 Win=1282 Len=0 TSval=4197516849 TSecr=2448938355"
"80","44.346042631","2a10:8012:21:4188:cdf4:35bf:f239:2701","2a03:2880:f242:c8:face:b00c:0:167","TLSv1.2","156","Application Data"
"81","44.390838710","2a03:2880:f242:c8:face:b00c:0:167","2a10:8012:21:4188:cdf4:35bf:f239:2701","TCP","86","443  >  55414 [ACK] Seq=43950 Ack=1057 Win=1282 Len=0 TSval=4197523559 TSecr=2448945066"
"82","44.477133735","2a03:2880:f242:c8:face:b00c:0:167","2a10:8012:21:4188:cdf4:35bf:f239:2701","TLSv1.2","158","Application Data"
"83","44.518681355","2a10:8012:21:4188:cdf4:35bf:f239:2701","2a03:2880:f242:c8:face:b00c:0:167","TCP","86","55414  >  443 [ACK] Seq=1057 Ack=44022 Win=1953 Len=0 TSval=2448945239 TSecr=4197523645"
"88","59.188415111","2a03:2880:f242:c8:face:b00c:0:167","2a10:8012:21:4188:cdf4:35bf:f239:2701","TLSv1.2","274","Application Data"
"89","59.188451927","2a10:8012:21:4188:cdf4:35bf:f239:2701","2a03:2880:f242:c8:face:b00c:0:167","TCP","86","55414  >  443 [ACK] Seq=1057 Ack=44210 Win=1953 Len=0 TSval=2448959909 TSecr=4197538290"
"90","59.329108787","2a10:8012:21:4188:cdf4:35bf:f239:2701","2a03:2880:f242:c8:face:b00c:0:167","TLSv1.2","175","Application Data"
"91","59.372213826","2a03:2880:f242:c8:face:b00c:0:167","2a10:8012:21:4188:cdf4:35bf:f239:2701","TCP","86","443  >  55414 [ACK] Seq=44210 Ack=1146 Win=1282 Len=0 TSval=4197538541 TSecr=2448960049"
"92","59.831708940","2a10:8012:21:4188:cdf4:35bf:f239:2701","2a03:2880:f242:c8:face:b00c:0:167","TLSv1.2","156","Application Data"
"93","59.875790329","2a03:2880:f242:c8:face:b00c:0:167","2a10:8012:21:4188:cdf4:35bf:f239:2701","TCP","86","443  >  55414 [ACK] Seq=44210 Ack=1216 Win=1282 Len=0 TSval=4197539044 TSecr=2448960552"
"94","59.962769015","2a03:2880:f242:c8:face:b00c:0:167","2a10:8012:21:4188:cdf4:35bf:f239:2701","TLSv1.2","158","Application Data"
"95","59.962802278","2a10:8012:21:4188:cdf4:35bf:f239:2701","2a03:2880:f242:c8:face:b00c:0:167","TCP","86","55414  >  443 [ACK] Seq=1216 Ack=44282 Win=1953 Len=0 TSval=2448960683 TSecr=4197539131"
"103","78.994032573","2a10:8012:21:4188:cdf4:35bf:f239:2701","2a03:2880:f242:c8:face:b00c:0:167","TLSv1.2","156","Application Data"
"104","79.038864013","2a03:2880:f242:c8:face:b00c:0:167","2a10:8012:21:4188:cdf4:35bf:f239:2701","TCP","86","443  >  55414 [ACK] Seq=44282 Ack=1286 Win=1282 Len=0 TSval=4197558207 TSecr=2448979714"
"105","79.125582171","2a03:2880:f242:c8:face:b00c:0:167","2a10:8012:21:4188:cdf4:35bf:f239:2701","TLSv1.2","158","Application Data"
"106","79.125619745","2a10:8012:21:4188:cdf4:35bf:f239:2701","2a03:2880:f242:c8:face:b00c:0:167","TCP","86","55414  >  443 [ACK] Seq=1286 Ack=44354 Win=1953 Len=0 TSval=2448979846 TSecr=4197558294"
"109","82.841845211","2a03:2880:f242:c8:face:b00c:0:167","2a10:8012:21:4188:cdf4:35bf:f239:2701","TLSv1.2","2044","Application Data, Application Data"
"110","82.841885972","2a10:8012:21:4188:cdf4:35bf:f239:2701","2a03:2880:f242:c8:face:b00c:0:167","TCP","86","55414  >  443 [ACK] Seq=1286 Ack=46312 Win=1938 Len=0 TSval=2448983562 TSecr=4197561913"
"111","83.048490044","2a03:2880:f242:c8:face:b00c:0:167","2a10:8012:21:4188:cdf4:35bf:f239:2701","TLSv1.2","2444","Application Data, Application Data"
"112","83.048525232","2a10:8012:21:4188:cdf4:35bf:f239:2701","2a03:2880:f242:c8:face:b00c:0:167","TCP","86","55414  >  443 [ACK] Seq=1286 Ack=48670 Win=1937 Len=0 TSval=2448983769 TSecr=4197562148"
"113","83.246418118","2a10:8012:21:4188:cdf4:35bf:f239:2701","2a03:2880:f242:c8:face:b00c:0:167","TLSv1.2","182","Application Data"
"114","83.289692869","2a03:2880:f242:c8:face:b00c:0:167","2a10:8012:21:4188:cdf4:35bf:f239:2701","TCP","86","443  >  55414 [ACK] Seq=48670 Ack=1382 Win=1282 Len=0 TSval=4197562458 TSecr=2448983967"
"115","84.093759515","2a10:8012:21:4188:cdf4:35bf:f239:2701","2a03:2880:f242:c8:face:b00c:0:167","TLSv1.2","182","Application Data"
"116","84.138611643","2a03:2880:f242:c8:face:b00c:0:167","2a10:8012:21:4188:cdf4:35bf:f239:2701","TCP","86","443  >  55414 [ACK] Seq=48670 Ack=1478 Win=1282 Len=0 TSval=4197563306 TSecr=2448984814"
"119","89.498060103","2a03:2880:f242:c8:face:b00c:0:167","2a10:8012:21:4188:cdf4:35bf:f239:2701","TLSv1.2","251","Application Data"
"120","89.498097373","2a10:8012:21:4188:cdf4:35bf:f239:2701","2a03:2880:f242:c8:face:b00c:0:167","TCP","86","55414  >  443 [ACK] Seq=1478 Ack=48835 Win=1953 Len=0 TSval=2448990218 TSecr=4197568577"
"121","89.504006167","2a10:8012:21:4188:cdf4:35bf:f239:2701","2a03:2880:f242:c8:face:b00c:0:167","TLSv1.2","186","Application Data"
"122","89.545992517","2a03:2880:f242:c8:face:b00c:0:167","2a10:8012:21:4188:cdf4:35bf:f239:2701","TCP","86","443  >  55414 [ACK] Seq=48835 Ack=1578 Win=1282 Len=0 TSval=4197568714 TSecr=2448990224"
"143","102.691975918","2a10:8012:21:4188:cdf4:35bf:f239:2701","2a03:2880:f242:c8:face:b00c:0:167","TLSv1.2","156","Application Data"
"144","102.736662617","2a03:2880:f242:c8:face:b00c:0:167","2a10:8012:21:4188:cdf4:35bf:f239:2701","TCP","86","443  >  55414 [ACK] Seq=48835 Ack=1648 Win=1282 Len=0 TSval=4197581904 TSecr=2449003412"
"145","102.822876197","2a03:2880:f242:c8:face:b00c:0:167","2a10:8012:21:4188:cdf4:35bf:f239:2701","TLSv1.2","158","Application Data"
"146","102.866822450","2a10:8012:21:4188:cdf4:35bf:f239:2701","2a03:2880:f242:c8:face:b00c:0:167","TCP","86","55414  >  443 [ACK] Seq=1648 Ack=48907 Win=1953 Len=0 TSval=2449003587 TSecr=4197581991"
"178","131.474464683","2a10:8012:21:4188:cdf4:35bf:f239:2701","2a03:2880:f242:c8:face:b00c:0:167","TLSv1.2","156","Application Data"
"179","131.519031830","2a03:2880:f242:c8:face:b00c:0:167","2a10:8012:21:4188:cdf4:35bf:f239:2701","TCP","86","443  >  55414 [ACK] Seq=48907 Ack=1718 Win=1282 Len=0 TSval=4197610687 TSecr=2449032195"
"180","131.605055913","2a03:2880:f242:c8:face:b00c:0:167","2a10:8012:21:4188:cdf4:35bf:f239:2701","TLSv1.2","158","Application Data"
"181","131.605103679","2a10:8012:21:4188:cdf4:35bf:f239:2701","2a03:2880:f242:c8:face:b00c:0:167","TCP","86","55414  >  443 [ACK] Seq=1718 Ack=48979 Win=1953 Len=0 TSval=2449032325 TSecr=4197610773"
"182","132.405486818","2a03:2880:f242:c8:face:b00c:0:167","2a10:8012:21:4188:cdf4:35bf:f239:2701","TLSv1.2","270","Application Data"
"183","132.405521468","2a10:8012:21:4188:cdf4:35bf:f239:2701","2a03:2880:f242:c8:face:b00c:0:167","TCP","86","55414  >  443 [ACK] Seq=1718 Ack=49163 Win=1953 Len=0 TSval=2449033126 TSecr=4197611486"
"184","132.961444235","2a10:8012:21:4188:cdf4:35bf:f239:2701","2a03:2880:f242:c8:face:b00c:0:167","TLSv1.2","158","Application Data"
"185","133.005651707","2a03:2880:f242:c8:face:b00c:0:167","2a10:8012:21:4188:cdf4:35bf:f239:2701","TCP","86","443  >  55414 [ACK] Seq=49163 Ack=1790 Win=1282 Len=0 TSval=4197612174 TSecr=2449033682"
"188","138.445872640","2a03:2880:f242:c8:face:b00c:0:167","2a10:8012:21:4188:cdf4:35bf:f239:2701","TLSv1.2","273","Application Data"
"189","138.445905987","2a10:8012:21:4188:cdf4:35bf:f239:2701","2a03:2880:f242:c8:face:b00c:0:167","TCP","86","55414  >  443 [ACK] Seq=1790 Ack=49350 Win=1953 Len=0 TSval=2449039166 TSecr=4197617583"
"190","138.894260700","2a10:8012:21:4188:cdf4:35bf:f239:2701","2a03:2880:f242:c8:face:b00c:0:167","TLSv1.2","158","Application Data"
"191","138.939067799","2a03:2880:f242:c8:face:b00c:0:167","2a10:8012:21:4188:cdf4:35bf:f239:2701","TCP","86","443  >  55414 [ACK] Seq=49350 Ack=1862 Win=1282 Len=0 TSval=4197618107 TSecr=2449039614"
"216","152.794187544","2a10:8012:21:4188:cdf4:35bf:f239:2701","2a03:2880:f242:c8:face:b00c:0:167","TLSv1.2","156","Application Data"
"217","152.838866072","2a03:2880:f242:c8:face:b00c:0:167","2a10:8012:21:4188:cdf4:35bf:f239:2701","TCP","86","443  >  55414 [ACK] Seq=49350 Ack=1932 Win=1282 Len=0 TSval=4197632007 TSecr=2449053514"
"221","152.925552169","2a03:2880:f242:c8:face:b00c:0:167","2a10:8012:21:4188:cdf4:35bf:f239:2701","TLSv1.2","158","Application Data"
"222","152.925602125","2a10:8012:21:4188:cdf4:35bf:f239:2701","2a03:2880:f242:c8:face:b00c:0:167","TCP","86","55414  >  443 [ACK] Seq=1932 Ack=49422 Win=1953 Len=0 TSval=2449053646 TSecr=4197632094"
"236","175.668694594","2a10:8012:21:4188:cdf4:35bf:f239:2701","2a03:2880:f242:c8:face:b00c:0:167","TLSv1.2","156","Application Data"
"237","175.713676393","2a03:2880:f242:c8:face:b00c:0:167","2a10:8012:21:4188:cdf4:35bf:f239:2701","TCP","86","443  >  55414 [ACK] Seq=49422 Ack=2002 Win=1282 Len=0 TSval=4197654881 TSecr=2449076389"
"238","175.799863049","2a03:2880:f242:c8:face:b00c:0:167","2a10:8012:21:4188:cdf4:35bf:f239:2701","TLSv1.2","158","Application Data"
"239","175.799911452","2a10:8012:21:4188:cdf4:35bf:f239:2701","2a03:2880:f242:c8:face:b00c:0:167","TCP","86","55414  >  443 [ACK] Seq=2002 Ack=49494 Win=1953 Len=0 TSval=2449076520 TSecr=4197654968"
"243","186.678179748","2a03:2880:f242:c8:face:b00c:0:167","2a10:8012:21:4188:cdf4:35bf:f239:2701","TLSv1.2","1444","Application Data"
"244","186.678219862","2a10:8012:21:4188:cdf4:35bf:f239:2701","2a03:2880:f242:c8:face:b00c:0:167","TCP","86","55414  >  443 [ACK] Seq=2002 Ack=50852 Win=1953 Len=0 TSval=2449087398 TSecr=4197665833"
"245","186.724265785","2a03:2880:f242:c8:face:b00c:0:167","2a10:8012:21:4188:cdf4:35bf:f239:2701","TLSv1.2","1524","Application Data"
"246","186.724298461","2a10:8012:21:4188:cdf4:35bf:f239:2701","2a03:2880:f242:c8:face:b00c:0:167","TCP","86","55414  >  443 [ACK] Seq=2002 Ack=52290 Win=1950 Len=0 TSval=2449087444 TSecr=4197665892"
"247","186.781880273","2a03:2880:f242:c8:face:b00c:0:167","2a10:8012:21:4188:cdf4:35bf:f239:2701","TLSv1.2","1492","Application Data"
"248","186.781913471","2a10:8012:21:4188:cdf4:35bf:f239:2701","2a03:2880:f242:c8:face:b00c:0:167","TCP","86","55414  >  443 [ACK] Seq=2002 Ack=53696 Win=1950 Len=0 TSval=2449087502 TSecr=4197665950"
"249","186.840529496","2a03:2880:f242:c8:face:b00c:0:167","2a10:8012:21:4188:cdf4:35bf:f239:2701","TLSv1.2","1460","Application Data"
"250","186.840563567","2a10:8012:21:4188:cdf4:35bf:f239:2701","2a03:2880:f242:c8:face:b00c:0:167","TCP","86","55414  >  443 [ACK] Seq=2002 Ack=55070 Win=1953 Len=0 TSval=2449087561 TSecr=4197666009"
"251","186.896875281","2a03:2880:f242:c8:face:b00c:0:167","2a10:8012:21:4188:cdf4:35bf:f239:2701","TLSv1.2","1380","Application Data"
"252","186.896908483","2a10:8012:21:4188:cdf4:35bf:f239:2701","2a03:2880:f242:c8:face:b00c:0:167","TCP","86","55414  >  443 [ACK] Seq=2002 Ack=56364 Win=1953 Len=0 TSval=2449087617 TSecr=4197666065"
"253","186.956878973","2a03:2880:f242:c8:face:b00c:0:167","2a10:8012:21:4188:cdf4:35bf:f239:2701","TLSv1.2","1396","Application Data"
"254","186.956920859","2a10:8012:21:4188:cdf4:35bf:f239:2701","2a03:2880:f242:c8:face:b00c:0:167","TCP","86","55414  >  443 [ACK] Seq=2002 Ack=57674 Win=1953 Len=0 TSval=2449087677 TSecr=4197666125"
"255","187.021654663","2a03:2880:f242:c8:face:b00c:0:167","2a10:8012:21:4188:cdf4:35bf:f239:2701","TLSv1.2","1284","Application Data"
"256","187.021685466","2a10:8012:21:4188:cdf4:35bf:f239:2701","2a03:2880:f242:c8:face:b00c:0:167","TCP","86","55414  >  443 [ACK] Seq=2002 Ack=58872 Win=1953 Len=0 TSval=2449087742 TSecr=4197666190"
"257","187.080255350","2a03:2880:f242:c8:face:b00c:0:167","2a10:8012:21:4188:cdf4:35bf:f239:2701","TLSv1.2","1300","Application Data"
"258","187.080286827","2a10:8012:21:4188:cdf4:35bf:f239:2701","2a03:2880:f242:c8:face:b00c:0:167","TCP","86","55414  >  443 [ACK] Seq=2002 Ack=60086 Win=1953 Len=0 TSval=2449087800 TSecr=4197666248"
"259","187.139378615","2a03:2880:f242:c8:face:b00c:0:167","2a10:8012:21:4188:cdf4:35bf:f239:2701","TLSv1.2","1348","Application Data"
"260","187.139408834","2a10:8012:21:4188:cdf4:35bf:f239:2701","2a03:2880:f242:c8:face:b00c:0:167","TCP","86","55414  >  443 [ACK] Seq=2002 Ack=61348 Win=1953 Len=0 TSval=2449087859 TSecr=4197666308"
"261","187.192999729","2a03:2880:f242:c8:face:b00c:0:167","2a10:8012:21:4188:cdf4:35bf:f239:2701","TLSv1.2","1476","Application Data"
"262","187.193029866","2a10:8012:21:4188:cdf4:35bf:f239:2701","2a03:2880:f242:c8:face:b00c:0:167","TCP","86","55414  >  443 [ACK] Seq=2002 Ack=62738 Win=1950 Len=0 TSval=2449087913 TSecr=4197666361"
"263","187.227746360","2a03:2880:f242:c8:face:b00c:0:167","2a10:8012:21:4188:cdf4:35bf:f239:2701","TLSv1.2","1316","Application Data"
"264","187.227779860","2a10:8012:21:4188:cdf4:35bf:f239:2701","2a03:2880:f242:c8:face:b00c:0:167","TCP","86","55414  >  443 [ACK] Seq=2002 Ack=63968 Win=1953 Len=0 TSval=2449087948 TSecr=4197666396"
"265","187.291034337","2a03:2880:f242:c8:face:b00c:0:167","2a10:8012:21:4188:cdf4:35bf:f239:2701","TLSv1.2","1460","Application Data"
"266","187.291059236","2a10:8012:21:4188:cdf4:35bf:f239:2701","2a03:2880:f242:c8:face:b00c:0:167","TCP","86","55414  >  443 [ACK] Seq=2002 Ack=65342 Win=1953 Len=0 TSval=2449088011 TSecr=4197666459"
"267","187.352004925","2a03:2880:f242:c8:face:b00c:0:167","2a10:8012:21:4188:cdf4:35bf:f239:2701","TLSv1.2","1396","Application Data"
"268","187.352038593","2a10:8012:21:4188:cdf4:35bf:f239:2701","2a03:2880:f242:c8:face:b00c:0:167","TCP","86","55414  >  443 [ACK] Seq=2002 Ack=66652 Win=1953 Len=0 TSval=2449088072 TSecr=4197666520"
"269","187.392358957","2a10:8012:21:4188:cdf4:35bf:f239:2701","2a03:2880:f242:c8:face:b00c:0:167","TLSv1.2","161","Application Data"
"272","187.396848857","2a03:2880:f242:c8:face:b00c:0:167","2a10:8012:21:4188:cdf4:35bf:f239:2701","TLSv1.2","1460","Application Data"
"275","187.399205782","2a10:8012:21:4188:cdf4:35bf:f239:2701","2001:4cd0:bc00:d01:face:b00c:3333:7020","TCP","94","47544  >  443 [SYN] Seq=0 Win=64260 Len=0 MSS=1428 SACK_PERM=1 TSval=2970683362 TSecr=0 WS=128"
"276","187.402849834","2001:4cd0:bc00:d01:face:b00c:3333:7020","2a10:8012:21:4188:cdf4:35bf:f239:2701","TCP","94","443  >  47544 [SYN, ACK] Seq=0 Ack=1 Win=31740 Len=0 MSS=1392 SACK_PERM=1 TSval=3805841574 TSecr=2970683362 WS=256"
"277","187.402861513","2a10:8012:21:4188:cdf4:35bf:f239:2701","2001:4cd0:bc00:d01:face:b00c:3333:7020","TCP","86","47544  >  443 [ACK] Seq=1 Ack=1 Win=64384 Len=0 TSval=2970683366 TSecr=3805841574"
"278","187.403286727","2a10:8012:21:4188:cdf4:35bf:f239:2701","2001:4cd0:bc00:d01:face:b00c:3333:7020","TLSv1.3","792","Client Hello"
"279","187.408507153","2001:4cd0:bc00:d01:face:b00c:3333:7020","2a10:8012:21:4188:cdf4:35bf:f239:2701","TCP","86","443  >  47544 [ACK] Seq=1 Ack=707 Win=31232 Len=0 TSval=3805841580 TSecr=2970683366"
"280","187.408847416","2001:4cd0:bc00:d01:face:b00c:3333:7020","2a10:8012:21:4188:cdf4:35bf:f239:2701","TLSv1.3","251","Server Hello, Application Data"
"281","187.408852911","2a10:8012:21:4188:cdf4:35bf:f239:2701","2001:4cd0:bc00:d01:face:b00c:3333:7020","TCP","86","47544  >  443 [ACK] Seq=707 Ack=166 Win=64256 Len=0 TSval=2970683372 TSecr=3805841580"
"282","187.409000145","2a10:8012:21:4188:cdf4:35bf:f239:2701","2001:4cd0:bc00:d01:face:b00c:3333:7020","TLSv1.3","92","Change Cipher Spec"
"283","187.409038143","2a10:8012:21:4188:cdf4:35bf:f239:2701","2001:4cd0:bc00:d01:face:b00c:3333:7020","TLSv1.3","144","Application Data"
"284","187.409917305","2a10:8012:21:4188:cdf4:35bf:f239:2701","2001:4cd0:bc00:d01:face:b00c:3333:7020","TLSv1.3","675","Application Data"
"285","187.412831200","2001:4cd0:bc00:d01:face:b00c:3333:7020","2a10:8012:21:4188:cdf4:35bf:f239:2701","TCP","86","443  >  47544 [ACK] Seq=166 Ack=771 Win=31488 Len=0 TSval=3805841584 TSecr=2970683372"
"286","187.412831353","2001:4cd0:bc00:d01:face:b00c:3333:7020","2a10:8012:21:4188:cdf4:35bf:f239:2701","TLSv1.3","267","Application Data"
"287","187.415321529","2001:4cd0:bc00:d01:face:b00c:3333:7020","2a10:8012:21:4188:cdf4:35bf:f239:2701","TLSv1.3","768","Application Data"
"288","187.415404746","2a10:8012:21:4188:cdf4:35bf:f239:2701","2001:4cd0:bc00:d01:face:b00c:3333:7020","TCP","86","47544  >  443 [ACK] Seq=1360 Ack=1029 Win=63488 Len=0 TSval=2970683378 TSecr=3805841584"
"289","187.416438186","2001:4cd0:bc00:d01:face:b00c:3333:7020","2a10:8012:21:4188:cdf4:35bf:f239:2701","TLSv1.3","109","Application Data"
"290","187.416438280","2001:4cd0:bc00:d01:face:b00c:3333:7020","2a10:8012:21:4188:cdf4:35bf:f239:2701","TLSv1.3","6986","Application Data"
"291","187.416534753","2a10:8012:21:4188:cdf4:35bf:f239:2701","2001:4cd0:bc00:d01:face:b00c:3333:7020","TCP","86","47544  >  443 [ACK] Seq=1360 Ack=7952 Win=56576 Len=0 TSval=2970683380 TSecr=3805841588"
"292","187.419324872","2001:4cd0:bc00:d01:face:b00c:3333:7020","2a10:8012:21:4188:cdf4:35bf:f239:2701","TCP","5606","443  >  47544 [ACK] Seq=7952 Ack=1360 Win=31488 Len=5520 TSval=3805841590 TSecr=2970683378 [TCP segment of a reassembled PDU]"
"293","187.419330308","2a10:8012:21:4188:cdf4:35bf:f239:2701","2001:4cd0:bc00:d01:face:b00c:3333:7020","TCP","86","47544  >  443 [ACK] Seq=1360 Ack=13472 Win=56960 Len=0 TSval=2970683382 TSecr=3805841590"
"294","187.419791481","2001:4cd0:bc00:d01:face:b00c:3333:7020","2a10:8012:21:4188:cdf4:35bf:f239:2701","TCP","2846","443  >  47544 [PSH, ACK] Seq=13472 Ack=1360 Win=31488 Len=2760 TSval=3805841590 TSecr=2970683378 [TCP segment of a reassembled PDU]"
"295","187.419791508","2001:4cd0:bc00:d01:face:b00c:3333:7020","2a10:8012:21:4188:cdf4:35bf:f239:2701","TLSv1.3","5606","Application Data [TCP segment of a reassembled PDU]"
"296","187.419795845","2a10:8012:21:4188:cdf4:35bf:f239:2701","2001:4cd0:bc00:d01:face:b00c:3333:7020","TCP","86","47544  >  443 [ACK] Seq=1360 Ack=16232 Win=61056 Len=0 TSval=2970683383 TSecr=3805841590"
"297","187.419869717","2a10:8012:21:4188:cdf4:35bf:f239:2701","2001:4cd0:bc00:d01:face:b00c:3333:7020","TCP","86","47544  >  443 [ACK] Seq=1360 Ack=21752 Win=55552 Len=0 TSval=2970683383 TSecr=3805841591"
"298","187.420817884","2001:4cd0:bc00:d01:face:b00c:3333:7020","2a10:8012:21:4188:cdf4:35bf:f239:2701","TCP","2846","443  >  47544 [PSH, ACK] Seq=21752 Ack=1360 Win=31488 Len=2760 TSval=3805841591 TSecr=2970683380 [TCP segment of a reassembled PDU]"
"299","187.420817914","2001:4cd0:bc00:d01:face:b00c:3333:7020","2a10:8012:21:4188:cdf4:35bf:f239:2701","TCP","6986","443  >  47544 [ACK] Seq=24512 Ack=1360 Win=31488 Len=6900 TSval=3805841592 TSecr=2970683380 [TCP segment of a reassembled PDU]"
"300","187.420822884","2a10:8012:21:4188:cdf4:35bf:f239:2701","2001:4cd0:bc00:d01:face:b00c:3333:7020","TCP","86","47544  >  443 [ACK] Seq=1360 Ack=24512 Win=61056 Len=0 TSval=2970683384 TSecr=3805841591"
"301","187.420893897","2a10:8012:21:4188:cdf4:35bf:f239:2701","2001:4cd0:bc00:d01:face:b00c:3333:7020","TCP","86","47544  >  443 [ACK] Seq=1360 Ack=31412 Win=64128 Len=0 TSval=2970683384 TSecr=3805841592"
"302","187.421260159","2001:4cd0:bc00:d01:face:b00c:3333:7020","2a10:8012:21:4188:cdf4:35bf:f239:2701","TCP","1466","443  >  47544 [PSH, ACK] Seq=31412 Ack=1360 Win=31488 Len=1380 TSval=3805841592 TSecr=2970683380 [TCP segment of a reassembled PDU]"
"303","187.422021952","2001:4cd0:bc00:d01:face:b00c:3333:7020","2a10:8012:21:4188:cdf4:35bf:f239:2701","TCP","1466","443  >  47544 [ACK] Seq=32792 Ack=1360 Win=31488 Len=1380 TSval=3805841593 TSecr=2970683380 [TCP segment of a reassembled PDU]"
"304","187.422026731","2a10:8012:21:4188:cdf4:35bf:f239:2701","2001:4cd0:bc00:d01:face:b00c:3333:7020","TCP","86","47544  >  443 [ACK] Seq=1360 Ack=34172 Win=69760 Len=0 TSval=2970683385 TSecr=3805841592"
"305","187.425487426","2001:4cd0:bc00:d01:face:b00c:3333:7020","2a10:8012:21:4188:cdf4:35bf:f239:2701","TLSv1.3","8366","Application Data [TCP segment of a reassembled PDU]"
"306","187.425492441","2a10:8012:21:4188:cdf4:35bf:f239:2701","2001:4cd0:bc00:d01:face:b00c:3333:7020","TCP","86","47544  >  443 [ACK] Seq=1360 Ack=42452 Win=86272 Len=0 TSval=2970683389 TSecr=3805841597"
"307","187.426539081","2001:4cd0:bc00:d01:face:b00c:3333:7020","2a10:8012:21:4188:cdf4:35bf:f239:2701","TCP","8366","443  >  47544 [PSH, ACK] Seq=42452 Ack=1360 Win=31488 Len=8280 TSval=3805841598 TSecr=2970683383 [TCP segment of a reassembled PDU]"
"308","187.426545902","2a10:8012:21:4188:cdf4:35bf:f239:2701","2001:4cd0:bc00:d01:face:b00c:3333:7020","TCP","86","47544  >  443 [ACK] Seq=1360 Ack=50732 Win=102784 Len=0 TSval=2970683390 TSecr=3805841598"
"309","187.428129860","2001:4cd0:bc00:d01:face:b00c:3333:7020","2a10:8012:21:4188:cdf4:35bf:f239:2701","TLSv1.3","8366","Application Data [TCP segment of a reassembled PDU]"
"310","187.428134723","2a10:8012:21:4188:cdf4:35bf:f239:2701","2001:4cd0:bc00:d01:face:b00c:3333:7020","TCP","86","47544  >  443 [ACK] Seq=1360 Ack=59012 Win=119424 Len=0 TSval=2970683391 TSecr=3805841598"
"311","187.429106027","2001:4cd0:bc00:d01:face:b00c:3333:7020","2a10:8012:21:4188:cdf4:35bf:f239:2701","TCP","5606","443  >  47544 [PSH, ACK] Seq=59012 Ack=1360 Win=31488 Len=5520 TSval=3805841599 TSecr=2970683385 [TCP segment of a reassembled PDU]"
"312","187.429106059","2001:4cd0:bc00:d01:face:b00c:3333:7020","2a10:8012:21:4188:cdf4:35bf:f239:2701","TLSv1.3","13886","Application Data, Application Data"
"313","187.429113344","2a10:8012:21:4188:cdf4:35bf:f239:2701","2001:4cd0:bc00:d01:face:b00c:3333:7020","TCP","86","47544  >  443 [ACK] Seq=1360 Ack=64532 Win=130432 Len=0 TSval=2970683392 TSecr=3805841599"
"314","187.429119370","2a10:8012:21:4188:cdf4:35bf:f239:2701","2001:4cd0:bc00:d01:face:b00c:3333:7020","TCP","86","47544  >  443 [ACK] Seq=1360 Ack=78332 Win=158080 Len=0 TSval=2970683392 TSecr=3805841600"
"315","187.430789681","2001:4cd0:bc00:d01:face:b00c:3333:7020","2a10:8012:21:4188:cdf4:35bf:f239:2701","TLSv1.3","8366","Application Data [TCP segment of a reassembled PDU]"
"316","187.430794706","2a10:8012:21:4188:cdf4:35bf:f239:2701","2001:4cd0:bc00:d01:face:b00c:3333:7020","TCP","86","47544  >  443 [ACK] Seq=1360 Ack=86612 Win=174592 Len=0 TSval=2970683394 TSecr=3805841601"
"317","187.431318756","2001:4cd0:bc00:d01:face:b00c:3333:7020","2a10:8012:21:4188:cdf4:35bf:f239:2701","TLSv1.3","8247","Application Data"
"318","187.431322682","2a10:8012:21:4188:cdf4:35bf:f239:2701","2001:4cd0:bc00:d01:face:b00c:3333:7020","TCP","86","47544  >  443 [ACK] Seq=1360 Ack=94773 Win=190848 Len=0 TSval=2970683394 TSecr=3805841601"
"319","187.434416176","2a03:2880:f242:c8:face:b00c:0:167","2a10:8012:21:4188:cdf4:35bf:f239:2701","TCP","86","443  >  55414 [ACK] Seq=68026 Ack=2077 Win=1282 Len=0 TSval=4197666603 TSecr=2449088112"
"320","187.446737987","2a10:8012:21:4188:cdf4:35bf:f239:2701","2a03:2880:f242:c8:face:b00c:0:167","TCP","86","55414  >  443 [ACK] Seq=2077 Ack=68026 Win=1953 Len=0 TSval=2449088167 TSecr=4197666565"
"321","187.455472743","2a03:2880:f242:c8:face:b00c:0:167","2a10:8012:21:4188:cdf4:35bf:f239:2701","TLSv1.2","1524","Application Data"
"322","187.455484771","2a10:8012:21:4188:cdf4:35bf:f239:2701","2a03:2880:f242:c8:face:b00c:0:167","TCP","86","55414  >  443 [ACK] Seq=2077 Ack=69464 Win=1950 Len=0 TSval=2449088176 TSecr=4197666624"
"323","187.482031165","2a03:2880:f242:c8:face:b00c:0:167","2a10:8012:21:4188:cdf4:35bf:f239:2701","TLSv1.2","1508","Application Data"
"324","187.482049959","2a10:8012:21:4188:cdf4:35bf:f239:2701","2a03:2880:f242:c8:face:b00c:0:167","TCP","86","55414  >  443 [ACK] Seq=2077 Ack=70886 Win=1950 Len=0 TSval=2449088202 TSecr=4197666650"
"325","187.505772098","2a10:8012:21:4188:cdf4:35bf:f239:2701","2a03:2880:f242:c8:face:b00c:0:167","TLSv1.2","179","Application Data"
"326","187.545670574","2a03:2880:f242:c8:face:b00c:0:167","2a10:8012:21:4188:cdf4:35bf:f239:2701","TLSv1.2","1107","Application Data"
"327","187.588755529","2a03:2880:f242:c8:face:b00c:0:167","2a10:8012:21:4188:cdf4:35bf:f239:2701","TCP","86","443  >  55414 [ACK] Seq=71907 Ack=2170 Win=1282 Len=0 TSval=4197666757 TSecr=2449088226"
"328","187.590696028","2a10:8012:21:4188:cdf4:35bf:f239:2701","2a03:2880:f242:c8:face:b00c:0:167","TCP","86","55414  >  443 [ACK] Seq=2170 Ack=71907 Win=1953 Len=0 TSval=2449088311 TSecr=4197666714"
"329","187.851989983","2a10:8012:21:4188:cdf4:35bf:f239:2701","2001:4cd0:bc00:d01:face:b00c:3333:7020","TLSv1.3","675","Application Data"
"330","187.859958061","2001:4cd0:bc00:d01:face:b00c:3333:7020","2a10:8012:21:4188:cdf4:35bf:f239:2701","TLSv1.3","783","Application Data"
"331","187.863374635","2001:4cd0:bc00:d01:face:b00c:3333:7020","2a10:8012:21:4188:cdf4:35bf:f239:2701","TLSv1.3","109","Application Data"
"332","187.863374913","2001:4cd0:bc00:d01:face:b00c:3333:7020","2a10:8012:21:4188:cdf4:35bf:f239:2701","TLSv1.3","15266","Application Data"
"333","187.863400953","2a10:8012:21:4188:cdf4:35bf:f239:2701","2001:4cd0:bc00:d01:face:b00c:3333:7020","TCP","86","47544  >  443 [ACK] Seq=1949 Ack=110673 Win=224000 Len=0 TSval=2970683826 TSecr=3805842030"
"334","187.866350700","2001:4cd0:bc00:d01:face:b00c:3333:7020","2a10:8012:21:4188:cdf4:35bf:f239:2701","TLSv1.3","9746","Application Data [TCP segment of a reassembled PDU]"
"335","187.866350815","2001:4cd0:bc00:d01:face:b00c:3333:7020","2a10:8012:21:4188:cdf4:35bf:f239:2701","TLSv1.3","24926","Application Data [TCP segment of a reassembled PDU]"
"336","187.866367080","2a10:8012:21:4188:cdf4:35bf:f239:2701","2001:4cd0:bc00:d01:face:b00c:3333:7020","TCP","86","47544  >  443 [ACK] Seq=1949 Ack=120333 Win=243328 Len=0 TSval=2970683829 TSecr=3805842031"
"337","187.866375833","2a10:8012:21:4188:cdf4:35bf:f239:2701","2001:4cd0:bc00:d01:face:b00c:3333:7020","TCP","86","47544  >  443 [ACK] Seq=1949 Ack=145173 Win=245888 Len=0 TSval=2970683829 TSecr=3805842032"
"338","187.866403149","2001:4cd0:bc00:d01:face:b00c:3333:7020","2a10:8012:21:4188:cdf4:35bf:f239:2701","TLSv1.3","15266","Application Data [TCP segment of a reassembled PDU]"
"339","187.866413880","2001:4cd0:bc00:d01:face:b00c:3333:7020","2a10:8012:21:4188:cdf4:35bf:f239:2701","TLSv1.3","6461","Application Data, Application Data, Application Data"
"340","187.866448756","2a10:8012:21:4188:cdf4:35bf:f239:2701","2001:4cd0:bc00:d01:face:b00c:3333:7020","TCP","86","47544  >  443 [ACK] Seq=1949 Ack=166728 Win=224384 Len=0 TSval=2970683830 TSecr=3805842033"
"341","187.874298738","2a10:8012:21:4188:cdf4:35bf:f239:2701","2a03:2880:f242:c8:face:b00c:0:167","TLSv1.2","179","Application Data"
"342","187.916366635","2a03:2880:f242:c8:face:b00c:0:167","2a10:8012:21:4188:cdf4:35bf:f239:2701","TCP","86","443  >  55414 [ACK] Seq=71907 Ack=2263 Win=1282 Len=0 TSval=4197667085 TSecr=2449088594"
"343","188.004076724","2a10:8012:21:4188:cdf4:35bf:f239:2701","2001:4cd0:bc00:d01:face:b00c:3333:7020","TLSv1.3","675","Application Data"
"344","188.008903651","2001:4cd0:bc00:d01:face:b00c:3333:7020","2a10:8012:21:4188:cdf4:35bf:f239:2701","TLSv1.3","820","Application Data"
"345","188.008903889","2001:4cd0:bc00:d01:face:b00c:3333:7020","2a10:8012:21:4188:cdf4:35bf:f239:2701","TLSv1.3","15266","Application Data"
"346","188.008933637","2a10:8012:21:4188:cdf4:35bf:f239:2701","2001:4cd0:bc00:d01:face:b00c:3333:7020","TCP","86","47544  >  443 [ACK] Seq=2538 Ack=182642 Win=273280 Len=0 TSval=2970683972 TSecr=3805842180"
"347","188.009167273","2001:4cd0:bc00:d01:face:b00c:3333:7020","2a10:8012:21:4188:cdf4:35bf:f239:2701","TCP","9746","443  >  47544 [PSH, ACK] Seq=182642 Ack=2538 Win=31488 Len=9660 TSval=3805842180 TSecr=2970683967 [TCP segment of a reassembled PDU]"
"348","188.009205439","2a10:8012:21:4188:cdf4:35bf:f239:2701","2001:4cd0:bc00:d01:face:b00c:3333:7020","TCP","86","47544  >  443 [ACK] Seq=2538 Ack=192302 Win=263680 Len=0 TSval=2970683972 TSecr=3805842180"
