"No.","Time","Source","Destination","Protocol","Length","Info"
"2","2.661956899","2a03:2880:f258:1c3:face:b00c:0:167","2a00:a041:3c5d:4d00:424b:6377:a930:43d","TLSv1.2","184","Application Data"
"3","2.670534157","2a00:a041:3c5d:4d00:424b:6377:a930:43d","2a03:2880:f258:1c3:face:b00c:0:167","TLSv1.2","183","Application Data"
"4","2.866356231","2a03:2880:f258:1c3:face:b00c:0:167","2a00:a041:3c5d:4d00:424b:6377:a930:43d","TCP","88","443  >  41660 [ACK] Seq=97 Ack=96 Win=1242 Len=0 TSval=3187295350 TSecr=2772245951"
"5","8.010972020","2a00:a041:3c5d:4d00:424b:6377:a930:43d","2a03:2880:f258:1c3:face:b00c:0:167","TLSv1.2","154","Application Data"
"6","8.088280391","2a03:2880:f258:1c3:face:b00c:0:167","2a00:a041:3c5d:4d00:424b:6377:a930:43d","TCP","88","443  >  41660 [ACK] Seq=97 Ack=162 Win=1242 Len=0 TSval=3187300661 TSecr=2772251291"
"13","11.194593654","2a00:a041:3c5d:4d00:424b:6377:a930:43d","2a03:2880:f258:c8:face:b00c:0:167","TLSv1.2","112","Application Data"
"14","11.194645090","2a00:a041:3c5d:4d00:424b:6377:a930:43d","2a03:2880:f258:c8:face:b00c:0:167","TCP","88","56472  >  443 [FIN, ACK] Seq=25 Ack=1 Win=501 Len=0 TSval=1656140785 TSecr=669822982"
"15","11.209049191","2a00:a041:3c5d:4d00:424b:6377:a930:43d","2a03:2880:f258:c8:face:b00c:0:167","TLSv1.2","112","Application Data"
"16","11.209093456","2a00:a041:3c5d:4d00:424b:6377:a930:43d","2a03:2880:f258:c8:face:b00c:0:167","TCP","88","56458  >  443 [FIN, ACK] Seq=25 Ack=1 Win=501 Len=0 TSval=1656140799 TSecr=40570693"
"17","11.297002269","2a03:2880:f258:c8:face:b00c:0:167","2a00:a041:3c5d:4d00:424b:6377:a930:43d","TCP","100","443  >  56472 [ACK] Seq=1 Ack=1 Win=274 Len=0 TSval=669883086 TSecr=1656080782 SLE=25 SRE=26"
"18","11.297270588","2a03:2880:f258:c8:face:b00c:0:167","2a00:a041:3c5d:4d00:424b:6377:a930:43d","TCP","88","443  >  56472 [ACK] Seq=1 Ack=26 Win=274 Len=0 TSval=669883086 TSecr=1656140785"
"19","11.297270766","2a03:2880:f258:c8:face:b00c:0:167","2a00:a041:3c5d:4d00:424b:6377:a930:43d","TLSv1.2","112","Application Data"
"20","11.297270813","2a03:2880:f258:c8:face:b00c:0:167","2a00:a041:3c5d:4d00:424b:6377:a930:43d","TCP","88","443  >  56472 [FIN, ACK] Seq=25 Ack=26 Win=274 Len=0 TSval=669883086 TSecr=1656140785"
"21","11.297318598","2a00:a041:3c5d:4d00:424b:6377:a930:43d","2a03:2880:f258:c8:face:b00c:0:167","TCP","76","56472  >  443 [RST] Seq=26 Win=0 Len=0"
"22","11.297341749","2a00:a041:3c5d:4d00:424b:6377:a930:43d","2a03:2880:f258:c8:face:b00c:0:167","TCP","76","56472  >  443 [RST] Seq=26 Win=0 Len=0"
"23","11.301116276","2a03:2880:f258:c8:face:b00c:0:167","2a00:a041:3c5d:4d00:424b:6377:a930:43d","TCP","100","443  >  56458 [ACK] Seq=1 Ack=1 Win=274 Len=0 TSval=40630785 TSecr=1656080798 SLE=25 SRE=26"
"24","11.310057089","2a03:2880:f258:c8:face:b00c:0:167","2a00:a041:3c5d:4d00:424b:6377:a930:43d","TCP","88","443  >  56458 [ACK] Seq=1 Ack=26 Win=274 Len=0 TSval=40630785 TSecr=1656140799"
"25","11.310057354","2a03:2880:f258:c8:face:b00c:0:167","2a00:a041:3c5d:4d00:424b:6377:a930:43d","TLSv1.2","112","Application Data"
"26","11.310057401","2a03:2880:f258:c8:face:b00c:0:167","2a00:a041:3c5d:4d00:424b:6377:a930:43d","TCP","88","443  >  56458 [FIN, ACK] Seq=25 Ack=26 Win=274 Len=0 TSval=40630785 TSecr=1656140799"
"27","11.310118584","2a00:a041:3c5d:4d00:424b:6377:a930:43d","2a03:2880:f258:c8:face:b00c:0:167","TCP","76","56458  >  443 [RST] Seq=26 Win=0 Len=0"
"28","11.310142824","2a00:a041:3c5d:4d00:424b:6377:a930:43d","2a03:2880:f258:c8:face:b00c:0:167","TCP","76","56458  >  443 [RST] Seq=26 Win=0 Len=0"
"29","12.548543245","2a00:a041:3c5d:4d00:424b:6377:a930:43d","2a03:2880:f258:1c3:face:b00c:0:167","TLSv1.2","158","Application Data"
"30","12.799190270","2a03:2880:f258:1c3:face:b00c:0:167","2a00:a041:3c5d:4d00:424b:6377:a930:43d","TLSv1.2","160","Application Data"
"31","12.846535624","2a00:a041:3c5d:4d00:424b:6377:a930:43d","2a03:2880:f258:1c3:face:b00c:0:167","TCP","88","41660  >  443 [ACK] Seq=232 Ack=169 Win=1193 Len=0 TSval=2772256127 TSecr=3187305280"
"34","18.533996391","2a03:2880:f258:1c3:face:b00c:0:167","2a00:a041:3c5d:4d00:424b:6377:a930:43d","TLSv1.2","242","Application Data"
"35","18.534033802","2a00:a041:3c5d:4d00:424b:6377:a930:43d","2a03:2880:f258:1c3:face:b00c:0:167","TCP","88","41660  >  443 [ACK] Seq=232 Ack=323 Win=1192 Len=0 TSval=2772261814 TSecr=3187311089"
"36","18.538466771","2a00:a041:3c5d:4d00:424b:6377:a930:43d","2a03:2880:f258:1c3:face:b00c:0:167","TLSv1.2","169","Application Data"
"37","18.613283265","2a03:2880:f258:1c3:face:b00c:0:167","2a00:a041:3c5d:4d00:424b:6377:a930:43d","TCP","88","443  >  41660 [ACK] Seq=323 Ack=313 Win=1242 Len=0 TSval=3187311186 TSecr=2772261818"
"44","26.419072913","2a03:2880:f258:1c3:face:b00c:0:167","2a00:a041:3c5d:4d00:424b:6377:a930:43d","TLSv1.2","645","Application Data"
"45","26.462634702","2a00:a041:3c5d:4d00:424b:6377:a930:43d","2a03:2880:f258:1c3:face:b00c:0:167","TCP","88","41660  >  443 [ACK] Seq=313 Ack=880 Win=1193 Len=0 TSval=2772269743 TSecr=3187318936"
"46","27.010470674","2a00:a041:3c5d:4d00:424b:6377:a930:43d","2a03:2880:f258:1c3:face:b00c:0:167","TLSv1.2","184","Application Data"
"47","27.099873054","2a03:2880:f258:1c3:face:b00c:0:167","2a00:a041:3c5d:4d00:424b:6377:a930:43d","TCP","88","443  >  41660 [ACK] Seq=880 Ack=409 Win=1242 Len=0 TSval=3187319664 TSecr=2772270290"
"52","34.093392051","2a00:a041:3c5d:4d00:424b:6377:a930:43d","2a03:2880:f258:1c3:face:b00c:0:167","TLSv1.2","158","Application Data"
"55","34.171924814","2a03:2880:f258:1c3:face:b00c:0:167","2a00:a041:3c5d:4d00:424b:6377:a930:43d","TCP","88","443  >  41660 [ACK] Seq=880 Ack=479 Win=1242 Len=0 TSval=3187326746 TSecr=2772277373"
"56","34.251176267","2a03:2880:f258:1c3:face:b00c:0:167","2a00:a041:3c5d:4d00:424b:6377:a930:43d","TLSv1.2","160","Application Data"
"57","34.251223429","2a00:a041:3c5d:4d00:424b:6377:a930:43d","2a03:2880:f258:1c3:face:b00c:0:167","TCP","88","41660  >  443 [ACK] Seq=479 Ack=952 Win=1193 Len=0 TSval=2772277531 TSecr=3187326826"
"63","39.731039569","2a03:2880:f258:1c3:face:b00c:0:167","2a00:a041:3c5d:4d00:424b:6377:a930:43d","TLSv1.2","403","Application Data"
"64","39.731076885","2a00:a041:3c5d:4d00:424b:6377:a930:43d","2a03:2880:f258:1c3:face:b00c:0:167","TCP","88","41660  >  443 [ACK] Seq=479 Ack=1267 Win=1191 Len=0 TSval=2772283011 TSecr=3187332255"
"66","40.212410714","2a00:a041:3c5d:4d00:424b:6377:a930:43d","2a03:2880:f258:1c3:face:b00c:0:167","TLSv1.2","184","Application Data"
"67","40.294762216","2a03:2880:f258:1c3:face:b00c:0:167","2a00:a041:3c5d:4d00:424b:6377:a930:43d","TCP","88","443  >  41660 [ACK] Seq=1267 Ack=575 Win=1242 Len=0 TSval=3187332869 TSecr=2772283492"
"80","45.670329685","2a03:2880:f258:1c3:face:b00c:0:167","2a00:a041:3c5d:4d00:424b:6377:a930:43d","TCP","1468","443  >  41660 [ACK] Seq=1267 Ack=575 Win=1242 Len=1380 TSval=3187338161 TSecr=2772283492 [TCP segment of a reassembled PDU]"
"81","45.670364817","2a00:a041:3c5d:4d00:424b:6377:a930:43d","2a03:2880:f258:1c3:face:b00c:0:167","TCP","88","41660  >  443 [ACK] Seq=575 Ack=2647 Win=1183 Len=0 TSval=2772288950 TSecr=3187338161"
"82","45.670795178","2a03:2880:f258:1c3:face:b00c:0:167","2a00:a041:3c5d:4d00:424b:6377:a930:43d","TLSv1.2","221","Application Data"
"83","45.670795437","2a03:2880:f258:1c3:face:b00c:0:167","2a00:a041:3c5d:4d00:424b:6377:a930:43d","TLSv1.2","2059","Application Data, Application Data"
"84","45.670817349","2a00:a041:3c5d:4d00:424b:6377:a930:43d","2a03:2880:f258:1c3:face:b00c:0:167","TCP","88","41660  >  443 [ACK] Seq=575 Ack=2780 Win=1182 Len=0 TSval=2772288951 TSecr=3187338161"
"85","45.670835584","2a00:a041:3c5d:4d00:424b:6377:a930:43d","2a03:2880:f258:1c3:face:b00c:0:167","TCP","88","41660  >  443 [ACK] Seq=575 Ack=4751 Win=1167 Len=0 TSval=2772288951 TSecr=3187338164"
"86","45.862036377","2a00:a041:3c5d:4d00:424b:6377:a930:43d","2a00:a040:0:4:face:b00c:3333:7020","TLSv1.2","694","Application Data"
"87","45.893329417","2a00:a041:3c5d:4d00:424b:6377:a930:43d","2a03:2880:f258:1c3:face:b00c:0:167","TLSv1.2","184","Application Data"
"88","45.933599582","2a00:a040:0:4:face:b00c:3333:7020","2a00:a041:3c5d:4d00:424b:6377:a930:43d","TCP","88","443  >  32854 [ACK] Seq=1 Ack=607 Win=123 Len=0 TSval=564379261 TSecr=3881039314"
"89","45.969159034","2a03:2880:f258:1c3:face:b00c:0:167","2a00:a041:3c5d:4d00:424b:6377:a930:43d","TCP","88","443  >  41660 [ACK] Seq=4751 Ack=671 Win=1242 Len=0 TSval=3187338544 TSecr=2772289173"
"90","46.294290297","2a00:a040:0:4:face:b00c:3333:7020","2a00:a041:3c5d:4d00:424b:6377:a930:43d","TLSv1.2","806","Application Data"
"92","46.294290555","2a00:a040:0:4:face:b00c:3333:7020","2a00:a041:3c5d:4d00:424b:6377:a930:43d","TLSv1.2","111","Application Data"
"95","46.294326954","2a00:a041:3c5d:4d00:424b:6377:a930:43d","2a00:a040:0:4:face:b00c:3333:7020","TCP","88","32854  >  443 [ACK] Seq=607 Ack=719 Win=496 Len=0 TSval=3881039746 TSecr=564379409"
"96","46.294350649","2a00:a041:3c5d:4d00:424b:6377:a930:43d","2a00:a040:0:4:face:b00c:3333:7020","TCP","88","32854  >  443 [ACK] Seq=607 Ack=742 Win=496 Len=0 TSval=3881039746 TSecr=564379410"
"97","46.294360098","2a00:a040:0:4:face:b00c:3333:7020","2a00:a041:3c5d:4d00:424b:6377:a930:43d","TCP","1468","443  >  32854 [ACK] Seq=742 Ack=607 Win=123 Len=1380 TSval=564379410 TSecr=3881039314 [TCP segment of a reassembled PDU]"
"98","46.294366149","2a00:a041:3c5d:4d00:424b:6377:a930:43d","2a00:a040:0:4:face:b00c:3333:7020","TCP","88","32854  >  443 [ACK] Seq=607 Ack=2122 Win=486 Len=0 TSval=3881039746 TSecr=564379410"
"99","46.297226672","2a00:a040:0:4:face:b00c:3333:7020","2a00:a041:3c5d:4d00:424b:6377:a930:43d","TLSv1.2","1468","Application Data [TCP segment of a reassembled PDU]"
"100","46.297227031","2a00:a040:0:4:face:b00c:3333:7020","2a00:a041:3c5d:4d00:424b:6377:a930:43d","TLSv1.2","2848","Application Data [TCP segment of a reassembled PDU]"
"101","46.297227075","2a00:a040:0:4:face:b00c:3333:7020","2a00:a041:3c5d:4d00:424b:6377:a930:43d","TLSv1.2","2848","Application Data [TCP segment of a reassembled PDU]"
"102","46.297227125","2a00:a040:0:4:face:b00c:3333:7020","2a00:a041:3c5d:4d00:424b:6377:a930:43d","TLSv1.2","2848","Application Data [TCP segment of a reassembled PDU]"
"103","46.297227172","2a00:a040:0:4:face:b00c:3333:7020","2a00:a041:3c5d:4d00:424b:6377:a930:43d","TLSv1.2","2848","Application Data [TCP segment of a reassembled PDU]"
"104","46.297258917","2a00:a041:3c5d:4d00:424b:6377:a930:43d","2a00:a040:0:4:face:b00c:3333:7020","TCP","88","32854  >  443 [ACK] Seq=607 Ack=3502 Win=493 Len=0 TSval=3881039749 TSecr=564379410"
"105","46.297280756","2a00:a041:3c5d:4d00:424b:6377:a930:43d","2a00:a040:0:4:face:b00c:3333:7020","TCP","88","32854  >  443 [ACK] Seq=607 Ack=6262 Win=472 Len=0 TSval=3881039749 TSecr=564379411"
"106","46.297286396","2a00:a041:3c5d:4d00:424b:6377:a930:43d","2a00:a040:0:4:face:b00c:3333:7020","TCP","88","32854  >  443 [ACK] Seq=607 Ack=9022 Win=451 Len=0 TSval=3881039749 TSecr=564379413"
"107","46.297291297","2a00:a041:3c5d:4d00:424b:6377:a930:43d","2a00:a040:0:4:face:b00c:3333:7020","TCP","88","32854  >  443 [ACK] Seq=607 Ack=11782 Win=430 Len=0 TSval=3881039749 TSecr=564379414"
"108","46.297296023","2a00:a041:3c5d:4d00:424b:6377:a930:43d","2a00:a040:0:4:face:b00c:3333:7020","TCP","88","32854  >  443 [ACK] Seq=607 Ack=14542 Win=409 Len=0 TSval=3881039749 TSecr=564379415"
"109","46.297311678","2a00:a040:0:4:face:b00c:3333:7020","2a00:a041:3c5d:4d00:424b:6377:a930:43d","TLSv1.2","2848","Application Data [TCP segment of a reassembled PDU]"
"110","46.297311740","2a00:a040:0:4:face:b00c:3333:7020","2a00:a041:3c5d:4d00:424b:6377:a930:43d","TLSv1.2","2848","Application Data [TCP segment of a reassembled PDU]"
"111","46.297311797","2a00:a040:0:4:face:b00c:3333:7020","2a00:a041:3c5d:4d00:424b:6377:a930:43d","TLSv1.2","1468","Application Data [TCP segment of a reassembled PDU]"
"112","46.297317151","2a00:a041:3c5d:4d00:424b:6377:a930:43d","2a00:a040:0:4:face:b00c:3333:7020","TCP","88","32854  >  443 [ACK] Seq=607 Ack=17302 Win=388 Len=0 TSval=3881039749 TSecr=564379417"
"113","46.297322196","2a00:a041:3c5d:4d00:424b:6377:a930:43d","2a00:a040:0:4:face:b00c:3333:7020","TCP","88","32854  >  443 [ACK] Seq=607 Ack=20062 Win=367 Len=0 TSval=3881039749 TSecr=564379418"
"114","46.297327205","2a00:a041:3c5d:4d00:424b:6377:a930:43d","2a00:a040:0:4:face:b00c:3333:7020","TCP","88","32854  >  443 [ACK] Seq=607 Ack=21442 Win=357 Len=0 TSval=3881039749 TSecr=564379470"
"115","46.298337900","2a00:a040:0:4:face:b00c:3333:7020","2a00:a041:3c5d:4d00:424b:6377:a930:43d","TCP","829","[TCP Spurious Retransmission] 443  >  32854 [PSH, ACK] Seq=1 Ack=607 Win=123 Len=741 TSval=564379560 TSecr=3881039314"
"116","46.298351404","2a00:a041:3c5d:4d00:424b:6377:a930:43d","2a00:a040:0:4:face:b00c:3333:7020","TCP","100","[TCP Window Update] 32854  >  443 [ACK] Seq=607 Ack=21442 Win=501 Len=0 TSval=3881039750 TSecr=564379470 SLE=1 SRE=742"
"117","46.313303872","2a00:a040:0:4:face:b00c:3333:7020","2a00:a041:3c5d:4d00:424b:6377:a930:43d","TCP","1468","443  >  32854 [ACK] Seq=21442 Ack=607 Win=123 Len=1380 TSval=564379641 TSecr=3881039746 [TCP segment of a reassembled PDU]"
"118","46.313334298","2a00:a041:3c5d:4d00:424b:6377:a930:43d","2a00:a040:0:4:face:b00c:3333:7020","TCP","88","32854  >  443 [ACK] Seq=607 Ack=22822 Win=493 Len=0 TSval=3881039765 TSecr=564379641"
"119","46.313722297","2a00:a040:0:4:face:b00c:3333:7020","2a00:a041:3c5d:4d00:424b:6377:a930:43d","TLSv1.2","1468","Application Data [TCP segment of a reassembled PDU]"
"120","46.313746831","2a00:a041:3c5d:4d00:424b:6377:a930:43d","2a00:a040:0:4:face:b00c:3333:7020","TCP","88","32854  >  443 [ACK] Seq=607 Ack=24202 Win=523 Len=0 TSval=3881039766 TSecr=564379641"
"121","46.314666580","2a00:a040:0:4:face:b00c:3333:7020","2a00:a041:3c5d:4d00:424b:6377:a930:43d","TCP","2848","443  >  32854 [PSH, ACK] Seq=24202 Ack=607 Win=123 Len=2760 TSval=564379642 TSecr=3881039746 [TCP segment of a reassembled PDU]"
"122","46.314698715","2a00:a041:3c5d:4d00:424b:6377:a930:43d","2a00:a040:0:4:face:b00c:3333:7020","TCP","88","32854  >  443 [ACK] Seq=607 Ack=26962 Win=566 Len=0 TSval=3881039767 TSecr=564379642"
"123","46.321173747","2a00:a040:0:4:face:b00c:3333:7020","2a00:a041:3c5d:4d00:424b:6377:a930:43d","TLSv1.2","1468","Application Data [TCP segment of a reassembled PDU]"
"124","46.321207590","2a00:a041:3c5d:4d00:424b:6377:a930:43d","2a00:a040:0:4:face:b00c:3333:7020","TCP","88","32854  >  443 [ACK] Seq=607 Ack=28342 Win=588 Len=0 TSval=3881039773 TSecr=564379648"
"125","46.322571928","2a00:a040:0:4:face:b00c:3333:7020","2a00:a041:3c5d:4d00:424b:6377:a930:43d","TCP","1468","443  >  32854 [PSH, ACK] Seq=28342 Ack=607 Win=123 Len=1380 TSval=564379648 TSecr=3881039749 [TCP segment of a reassembled PDU]"
"126","46.322572255","2a00:a040:0:4:face:b00c:3333:7020","2a00:a041:3c5d:4d00:424b:6377:a930:43d","TLSv1.2","2848","Application Data [TCP segment of a reassembled PDU]"
"127","46.322572304","2a00:a040:0:4:face:b00c:3333:7020","2a00:a041:3c5d:4d00:424b:6377:a930:43d","TLSv1.2","1468","Application Data [TCP segment of a reassembled PDU]"
"128","46.322595268","2a00:a041:3c5d:4d00:424b:6377:a930:43d","2a00:a040:0:4:face:b00c:3333:7020","TCP","88","32854  >  443 [ACK] Seq=607 Ack=29722 Win=609 Len=0 TSval=3881039775 TSecr=564379648"
"129","46.322611829","2a00:a041:3c5d:4d00:424b:6377:a930:43d","2a00:a040:0:4:face:b00c:3333:7020","TCP","88","32854  >  443 [ACK] Seq=607 Ack=32482 Win=652 Len=0 TSval=3881039775 TSecr=564379648"
"130","46.322616953","2a00:a041:3c5d:4d00:424b:6377:a930:43d","2a00:a040:0:4:face:b00c:3333:7020","TCP","88","32854  >  443 [ACK] Seq=607 Ack=33862 Win=674 Len=0 TSval=3881039775 TSecr=564379649"
"131","46.323570472","2a00:a040:0:4:face:b00c:3333:7020","2a00:a041:3c5d:4d00:424b:6377:a930:43d","TCP","1468","443  >  32854 [PSH, ACK] Seq=33862 Ack=607 Win=123 Len=1380 TSval=564379649 TSecr=3881039749 [TCP segment of a reassembled PDU]"
"132","46.323570726","2a00:a040:0:4:face:b00c:3333:7020","2a00:a041:3c5d:4d00:424b:6377:a930:43d","TLSv1.2","1468","Application Data [TCP segment of a reassembled PDU]"
"133","46.323602838","2a00:a041:3c5d:4d00:424b:6377:a930:43d","2a00:a040:0:4:face:b00c:3333:7020","TCP","88","32854  >  443 [ACK] Seq=607 Ack=35242 Win=695 Len=0 TSval=3881039776 TSecr=564379649"
"134","46.323620848","2a00:a041:3c5d:4d00:424b:6377:a930:43d","2a00:a040:0:4:face:b00c:3333:7020","TCP","88","32854  >  443 [ACK] Seq=607 Ack=36622 Win=717 Len=0 TSval=3881039776 TSecr=564379651"
"135","46.324370249","2a00:a040:0:4:face:b00c:3333:7020","2a00:a041:3c5d:4d00:424b:6377:a930:43d","TLSv1.2","1468","Application Data [TCP segment of a reassembled PDU]"
"136","46.324389894","2a00:a041:3c5d:4d00:424b:6377:a930:43d","2a00:a040:0:4:face:b00c:3333:7020","TCP","88","32854  >  443 [ACK] Seq=607 Ack=38002 Win=739 Len=0 TSval=3881039776 TSecr=564379651"
"137","46.325159746","2a00:a040:0:4:face:b00c:3333:7020","2a00:a041:3c5d:4d00:424b:6377:a930:43d","TCP","1468","443  >  32854 [ACK] Seq=38002 Ack=607 Win=123 Len=1380 TSval=564379652 TSecr=3881039749 [TCP segment of a reassembled PDU]"
"138","46.325185792","2a00:a041:3c5d:4d00:424b:6377:a930:43d","2a00:a040:0:4:face:b00c:3333:7020","TCP","88","32854  >  443 [ACK] Seq=607 Ack=39382 Win=760 Len=0 TSval=3881039777 TSecr=564379652"
"139","46.326261952","2a00:a040:0:4:face:b00c:3333:7020","2a00:a041:3c5d:4d00:424b:6377:a930:43d","TLSv1.2","1468","Application Data [TCP segment of a reassembled PDU]"
"140","46.326276064","2a00:a041:3c5d:4d00:424b:6377:a930:43d","2a00:a040:0:4:face:b00c:3333:7020","TCP","88","32854  >  443 [ACK] Seq=607 Ack=40762 Win=782 Len=0 TSval=3881039778 TSecr=564379652"
"141","46.327264194","2a00:a040:0:4:face:b00c:3333:7020","2a00:a041:3c5d:4d00:424b:6377:a930:43d","TLSv1.2","2848","Application Data [TCP segment of a reassembled PDU]"
"142","46.327282586","2a00:a041:3c5d:4d00:424b:6377:a930:43d","2a00:a040:0:4:face:b00c:3333:7020","TCP","88","32854  >  443 [ACK] Seq=607 Ack=43522 Win=825 Len=0 TSval=3881039779 TSecr=564379653"
"143","46.328294517","2a00:a040:0:4:face:b00c:3333:7020","2a00:a041:3c5d:4d00:424b:6377:a930:43d","TCP","2848","443  >  32854 [PSH, ACK] Seq=43522 Ack=607 Win=123 Len=2760 TSval=564379655 TSecr=3881039749 [TCP segment of a reassembled PDU]"
"144","46.328312342","2a00:a041:3c5d:4d00:424b:6377:a930:43d","2a00:a040:0:4:face:b00c:3333:7020","TCP","88","32854  >  443 [ACK] Seq=607 Ack=46282 Win=868 Len=0 TSval=3881039780 TSecr=564379655"
"145","46.329056174","2a00:a040:0:4:face:b00c:3333:7020","2a00:a041:3c5d:4d00:424b:6377:a930:43d","TLSv1.2","2848","Application Data [TCP segment of a reassembled PDU]"
"146","46.329083506","2a00:a041:3c5d:4d00:424b:6377:a930:43d","2a00:a040:0:4:face:b00c:3333:7020","TCP","88","32854  >  443 [ACK] Seq=607 Ack=49042 Win=911 Len=0 TSval=3881039781 TSecr=564379656"
"147","46.329747296","2a00:a040:0:4:face:b00c:3333:7020","2a00:a041:3c5d:4d00:424b:6377:a930:43d","TLSv1.2","1468","Application Data [TCP segment of a reassembled PDU]"
"148","46.329764529","2a00:a041:3c5d:4d00:424b:6377:a930:43d","2a00:a040:0:4:face:b00c:3333:7020","TCP","88","32854  >  443 [ACK] Seq=607 Ack=50422 Win=933 Len=0 TSval=3881039782 TSecr=564379657"
"149","46.330751689","2a00:a040:0:4:face:b00c:3333:7020","2a00:a041:3c5d:4d00:424b:6377:a930:43d","TCP","1468","443  >  32854 [PSH, ACK] Seq=50422 Ack=607 Win=123 Len=1380 TSval=564379657 TSecr=3881039750 [TCP segment of a reassembled PDU]"
"150","46.330768925","2a00:a041:3c5d:4d00:424b:6377:a930:43d","2a00:a040:0:4:face:b00c:3333:7020","TCP","88","32854  >  443 [ACK] Seq=607 Ack=51802 Win=954 Len=0 TSval=3881039783 TSecr=564379657"
"151","46.331821383","2a00:a040:0:4:face:b00c:3333:7020","2a00:a041:3c5d:4d00:424b:6377:a930:43d","TLSv1.2","2848","Application Data, Application Data"
"152","46.331848586","2a00:a041:3c5d:4d00:424b:6377:a930:43d","2a00:a040:0:4:face:b00c:3333:7020","TCP","88","32854  >  443 [ACK] Seq=607 Ack=54562 Win=997 Len=0 TSval=3881039784 TSecr=564379659"
"153","46.332545117","2a00:a040:0:4:face:b00c:3333:7020","2a00:a041:3c5d:4d00:424b:6377:a930:43d","TLSv1.2","2848","Application Data [TCP segment of a reassembled PDU]"
"154","46.332562241","2a00:a041:3c5d:4d00:424b:6377:a930:43d","2a00:a040:0:4:face:b00c:3333:7020","TCP","88","32854  >  443 [ACK] Seq=607 Ack=57322 Win=1040 Len=0 TSval=3881039785 TSecr=564379660"
"155","46.333588578","2a00:a040:0:4:face:b00c:3333:7020","2a00:a041:3c5d:4d00:424b:6377:a930:43d","TCP","1468","443  >  32854 [ACK] Seq=57322 Ack=607 Win=123 Len=1380 TSval=564379661 TSecr=3881039750 [TCP segment of a reassembled PDU]"
"156","46.333606254","2a00:a041:3c5d:4d00:424b:6377:a930:43d","2a00:a040:0:4:face:b00c:3333:7020","TCP","88","32854  >  443 [ACK] Seq=607 Ack=58702 Win=1062 Len=0 TSval=3881039786 TSecr=564379661"
"157","46.334469277","2a00:a040:0:4:face:b00c:3333:7020","2a00:a041:3c5d:4d00:424b:6377:a930:43d","TLSv1.2","1468","Application Data [TCP segment of a reassembled PDU]"
"158","46.334487094","2a00:a041:3c5d:4d00:424b:6377:a930:43d","2a00:a040:0:4:face:b00c:3333:7020","TCP","88","32854  >  443 [ACK] Seq=607 Ack=60082 Win=1084 Len=0 TSval=3881039786 TSecr=564379661"
"159","46.335283309","2a00:a040:0:4:face:b00c:3333:7020","2a00:a041:3c5d:4d00:424b:6377:a930:43d","TCP","1468","443  >  32854 [ACK] Seq=60082 Ack=607 Win=123 Len=1380 TSval=564379663 TSecr=3881039767 [TCP segment of a reassembled PDU]"
"160","46.335299074","2a00:a041:3c5d:4d00:424b:6377:a930:43d","2a00:a040:0:4:face:b00c:3333:7020","TCP","88","32854  >  443 [ACK] Seq=607 Ack=61462 Win=1105 Len=0 TSval=3881039787 TSecr=564379663"
"161","46.336158561","2a00:a040:0:4:face:b00c:3333:7020","2a00:a041:3c5d:4d00:424b:6377:a930:43d","TLSv1.2","1468","Application Data [TCP segment of a reassembled PDU]"
"162","46.336176446","2a00:a041:3c5d:4d00:424b:6377:a930:43d","2a00:a040:0:4:face:b00c:3333:7020","TCP","88","32854  >  443 [ACK] Seq=607 Ack=62842 Win=1127 Len=0 TSval=3881039788 TSecr=564379663"
"163","46.337230891","2a00:a040:0:4:face:b00c:3333:7020","2a00:a041:3c5d:4d00:424b:6377:a930:43d","TLSv1.2","2848","Application Data [TCP segment of a reassembled PDU]"
"164","46.337250576","2a00:a041:3c5d:4d00:424b:6377:a930:43d","2a00:a040:0:4:face:b00c:3333:7020","TCP","88","32854  >  443 [ACK] Seq=607 Ack=65602 Win=1170 Len=0 TSval=3881039789 TSecr=564379664"
"165","46.338028488","2a00:a040:0:4:face:b00c:3333:7020","2a00:a041:3c5d:4d00:424b:6377:a930:43d","TLSv1.2","1468","Application Data [TCP segment of a reassembled PDU]"
"166","46.338046139","2a00:a041:3c5d:4d00:424b:6377:a930:43d","2a00:a040:0:4:face:b00c:3333:7020","TCP","88","32854  >  443 [ACK] Seq=607 Ack=66982 Win=1191 Len=0 TSval=3881039790 TSecr=564379665"
"167","46.338890612","2a00:a040:0:4:face:b00c:3333:7020","2a00:a041:3c5d:4d00:424b:6377:a930:43d","TLSv1.2","1468","Application Data [TCP segment of a reassembled PDU]"
"168","46.338909002","2a00:a041:3c5d:4d00:424b:6377:a930:43d","2a00:a040:0:4:face:b00c:3333:7020","TCP","88","32854  >  443 [ACK] Seq=607 Ack=68362 Win=1213 Len=0 TSval=3881039791 TSecr=564379665"
"169","46.339882945","2a00:a040:0:4:face:b00c:3333:7020","2a00:a041:3c5d:4d00:424b:6377:a930:43d","TLSv1.2","2848","Application Data, Application Data"
"170","46.339906687","2a00:a041:3c5d:4d00:424b:6377:a930:43d","2a00:a040:0:4:face:b00c:3333:7020","TCP","88","32854  >  443 [ACK] Seq=607 Ack=71122 Win=1256 Len=0 TSval=3881039792 TSecr=564379667"
"171","46.340750452","2a00:a040:0:4:face:b00c:3333:7020","2a00:a041:3c5d:4d00:424b:6377:a930:43d","TLSv1.2","1468","Application Data [TCP segment of a reassembled PDU]"
"172","46.340756967","2a00:a041:3c5d:4d00:424b:6377:a930:43d","2a00:a040:0:4:face:b00c:3333:7020","TCP","88","32854  >  443 [ACK] Seq=607 Ack=72502 Win=1278 Len=0 TSval=3881039793 TSecr=564379668"
"173","46.341573918","2a00:a040:0:4:face:b00c:3333:7020","2a00:a041:3c5d:4d00:424b:6377:a930:43d","TCP","1468","443  >  32854 [ACK] Seq=72502 Ack=607 Win=123 Len=1380 TSval=564379669 TSecr=3881039775 [TCP segment of a reassembled PDU]"
"174","46.341580573","2a00:a041:3c5d:4d00:424b:6377:a930:43d","2a00:a040:0:4:face:b00c:3333:7020","TCP","88","32854  >  443 [ACK] Seq=607 Ack=73882 Win=1299 Len=0 TSval=3881039794 TSecr=564379669"
"175","46.342409016","2a00:a040:0:4:face:b00c:3333:7020","2a00:a041:3c5d:4d00:424b:6377:a930:43d","TCP","1468","443  >  32854 [PSH, ACK] Seq=73882 Ack=607 Win=123 Len=1380 TSval=564379669 TSecr=3881039775 [TCP segment of a reassembled PDU]"
"176","46.342416539","2a00:a041:3c5d:4d00:424b:6377:a930:43d","2a00:a040:0:4:face:b00c:3333:7020","TCP","88","32854  >  443 [ACK] Seq=607 Ack=75262 Win=1321 Len=0 TSval=3881039794 TSecr=564379669"
"177","46.343420069","2a00:a040:0:4:face:b00c:3333:7020","2a00:a041:3c5d:4d00:424b:6377:a930:43d","TLSv1.2","2848","Application Data [TCP segment of a reassembled PDU]"
"178","46.343426339","2a00:a041:3c5d:4d00:424b:6377:a930:43d","2a00:a040:0:4:face:b00c:3333:7020","TCP","88","32854  >  443 [ACK] Seq=607 Ack=78022 Win=1364 Len=0 TSval=3881039795 TSecr=564379670"
"179","46.346382040","2a00:a040:0:4:face:b00c:3333:7020","2a00:a041:3c5d:4d00:424b:6377:a930:43d","TCP","1468","443  >  32854 [ACK] Seq=78022 Ack=607 Win=123 Len=1380 TSval=564379671 TSecr=3881039780 [TCP segment of a reassembled PDU]"
"180","46.346389226","2a00:a041:3c5d:4d00:424b:6377:a930:43d","2a00:a040:0:4:face:b00c:3333:7020","TCP","88","32854  >  443 [ACK] Seq=607 Ack=79402 Win=1385 Len=0 TSval=3881039798 TSecr=564379671"
"181","46.348016355","2a00:a040:0:4:face:b00c:3333:7020","2a00:a041:3c5d:4d00:424b:6377:a930:43d","TLSv1.2","1468","Application Data [TCP segment of a reassembled PDU]"
"182","46.348016530","2a00:a040:0:4:face:b00c:3333:7020","2a00:a041:3c5d:4d00:424b:6377:a930:43d","TLSv1.2","2848","Application Data [TCP segment of a reassembled PDU]"
"183","46.348016578","2a00:a040:0:4:face:b00c:3333:7020","2a00:a041:3c5d:4d00:424b:6377:a930:43d","TLSv1.2","2848","Application Data, Application Data"
"184","46.348036087","2a00:a041:3c5d:4d00:424b:6377:a930:43d","2a00:a040:0:4:face:b00c:3333:7020","TCP","88","32854  >  443 [ACK] Seq=607 Ack=80782 Win=1407 Len=0 TSval=3881039800 TSecr=564379671"
"185","46.348083538","2a00:a041:3c5d:4d00:424b:6377:a930:43d","2a00:a040:0:4:face:b00c:3333:7020","TCP","88","32854  >  443 [ACK] Seq=607 Ack=83542 Win=1450 Len=0 TSval=3881039800 TSecr=564379673"
"186","46.348088699","2a00:a041:3c5d:4d00:424b:6377:a930:43d","2a00:a040:0:4:face:b00c:3333:7020","TCP","88","32854  >  443 [ACK] Seq=607 Ack=86302 Win=1493 Len=0 TSval=3881039800 TSecr=564379674"
"187","46.349083680","2a00:a040:0:4:face:b00c:3333:7020","2a00:a041:3c5d:4d00:424b:6377:a930:43d","TLSv1.2","2848","Application Data, Application Data"
"188","46.349101882","2a00:a041:3c5d:4d00:424b:6377:a930:43d","2a00:a040:0:4:face:b00c:3333:7020","TCP","88","32854  >  443 [ACK] Seq=607 Ack=89062 Win=1536 Len=0 TSval=3881039801 TSecr=564379675"
"189","46.350884767","2a00:a040:0:4:face:b00c:3333:7020","2a00:a041:3c5d:4d00:424b:6377:a930:43d","TCP","2848","443  >  32854 [PSH, ACK] Seq=89062 Ack=607 Win=123 Len=2760 TSval=564379677 TSecr=3881039786 [TCP segment of a reassembled PDU]"
"190","46.350901410","2a00:a041:3c5d:4d00:424b:6377:a930:43d","2a00:a040:0:4:face:b00c:3333:7020","TCP","88","32854  >  443 [ACK] Seq=607 Ack=91822 Win=1579 Len=0 TSval=3881039803 TSecr=564379677"
"191","46.352323937","2a00:a040:0:4:face:b00c:3333:7020","2a00:a041:3c5d:4d00:424b:6377:a930:43d","TLSv1.2","2848","Application Data [TCP segment of a reassembled PDU]"
"192","46.352324109","2a00:a040:0:4:face:b00c:3333:7020","2a00:a041:3c5d:4d00:424b:6377:a930:43d","TLSv1.2","2848","Application Data [TCP segment of a reassembled PDU]"
"193","46.352342606","2a00:a041:3c5d:4d00:424b:6377:a930:43d","2a00:a040:0:4:face:b00c:3333:7020","TCP","88","32854  >  443 [ACK] Seq=607 Ack=94582 Win=1623 Len=0 TSval=3881039804 TSecr=564379678"
"194","46.352356204","2a00:a041:3c5d:4d00:424b:6377:a930:43d","2a00:a040:0:4:face:b00c:3333:7020","TCP","88","32854  >  443 [ACK] Seq=607 Ack=97342 Win=1666 Len=0 TSval=3881039804 TSecr=564379679"
"195","46.353142957","2a00:a040:0:4:face:b00c:3333:7020","2a00:a041:3c5d:4d00:424b:6377:a930:43d","TLSv1.2","1468","Application Data [TCP segment of a reassembled PDU]"
"196","46.353158666","2a00:a041:3c5d:4d00:424b:6377:a930:43d","2a00:a040:0:4:face:b00c:3333:7020","TCP","88","32854  >  443 [ACK] Seq=607 Ack=98722 Win=1687 Len=0 TSval=3881039805 TSecr=564379681"
"197","46.354170051","2a00:a040:0:4:face:b00c:3333:7020","2a00:a041:3c5d:4d00:424b:6377:a930:43d","TCP","1468","443  >  32854 [PSH, ACK] Seq=98722 Ack=607 Win=123 Len=1380 TSval=564379681 TSecr=3881039786 [TCP segment of a reassembled PDU]"
"198","46.354170271","2a00:a040:0:4:face:b00c:3333:7020","2a00:a041:3c5d:4d00:424b:6377:a930:43d","TLSv1.2","1468","Application Data [TCP segment of a reassembled PDU]"
"199","46.354179853","2a00:a041:3c5d:4d00:424b:6377:a930:43d","2a00:a040:0:4:face:b00c:3333:7020","TCP","88","32854  >  443 [ACK] Seq=607 Ack=100102 Win=1709 Len=0 TSval=3881039806 TSecr=564379681"
"200","46.354190273","2a00:a041:3c5d:4d00:424b:6377:a930:43d","2a00:a040:0:4:face:b00c:3333:7020","TCP","88","32854  >  443 [ACK] Seq=607 Ack=101482 Win=1730 Len=0 TSval=3881039806 TSecr=564379682"
"201","46.355209882","2a00:a040:0:4:face:b00c:3333:7020","2a00:a041:3c5d:4d00:424b:6377:a930:43d","TLSv1.2","1468","Application Data [TCP segment of a reassembled PDU]"
"202","46.355210052","2a00:a040:0:4:face:b00c:3333:7020","2a00:a041:3c5d:4d00:424b:6377:a930:43d","TLSv1.2","1468","Application Data [TCP segment of a reassembled PDU]"
"203","46.355226577","2a00:a041:3c5d:4d00:424b:6377:a930:43d","2a00:a040:0:4:face:b00c:3333:7020","TCP","88","32854  >  443 [ACK] Seq=607 Ack=102862 Win=1752 Len=0 TSval=3881039807 TSecr=564379682"
"204","46.355240060","2a00:a041:3c5d:4d00:424b:6377:a930:43d","2a00:a040:0:4:face:b00c:3333:7020","TCP","88","32854  >  443 [ACK] Seq=607 Ack=104242 Win=1772 Len=0 TSval=3881039807 TSecr=564379682"
"205","46.356481420","2a00:a040:0:4:face:b00c:3333:7020","2a00:a041:3c5d:4d00:424b:6377:a930:43d","TLSv1.2","2848","Application Data, Application Data"
"206","46.356481581","2a00:a040:0:4:face:b00c:3333:7020","2a00:a041:3c5d:4d00:424b:6377:a930:43d","TLSv1.2","1468","Application Data [TCP segment of a reassembled PDU]"
"207","46.356497792","2a00:a041:3c5d:4d00:424b:6377:a930:43d","2a00:a040:0:4:face:b00c:3333:7020","TCP","88","32854  >  443 [ACK] Seq=607 Ack=107002 Win=1772 Len=0 TSval=3881039808 TSecr=564379682"
"208","46.356511529","2a00:a041:3c5d:4d00:424b:6377:a930:43d","2a00:a040:0:4:face:b00c:3333:7020","TCP","88","32854  >  443 [ACK] Seq=607 Ack=108382 Win=1762 Len=0 TSval=3881039809 TSecr=564379683"
"209","46.359910799","2a00:a040:0:4:face:b00c:3333:7020","2a00:a041:3c5d:4d00:424b:6377:a930:43d","TLSv1.2","2848","Application Data [TCP segment of a reassembled PDU]"
"210","46.359911006","2a00:a040:0:4:face:b00c:3333:7020","2a00:a041:3c5d:4d00:424b:6377:a930:43d","TLSv1.2","4228","Application Data [TCP segment of a reassembled PDU]"
"211","46.359911051","2a00:a040:0:4:face:b00c:3333:7020","2a00:a041:3c5d:4d00:424b:6377:a930:43d","TLSv1.2","1468","Application Data [TCP segment of a reassembled PDU]"
"212","46.359931283","2a00:a041:3c5d:4d00:424b:6377:a930:43d","2a00:a040:0:4:face:b00c:3333:7020","TCP","88","32854  >  443 [ACK] Seq=607 Ack=111142 Win=1772 Len=0 TSval=3881039812 TSecr=564379683"
"213","46.359948464","2a00:a041:3c5d:4d00:424b:6377:a930:43d","2a00:a040:0:4:face:b00c:3333:7020","TCP","88","32854  >  443 [ACK] Seq=607 Ack=115282 Win=1740 Len=0 TSval=3881039812 TSecr=564379684"
"214","46.359956665","2a00:a041:3c5d:4d00:424b:6377:a930:43d","2a00:a040:0:4:face:b00c:3333:7020","TCP","88","32854  >  443 [ACK] Seq=607 Ack=116662 Win=1730 Len=0 TSval=3881039812 TSecr=564379685"
"215","46.361749152","2a00:a040:0:4:face:b00c:3333:7020","2a00:a041:3c5d:4d00:424b:6377:a930:43d","TLSv1.2","2848","Application Data [TCP segment of a reassembled PDU]"
"216","46.361749317","2a00:a040:0:4:face:b00c:3333:7020","2a00:a041:3c5d:4d00:424b:6377:a930:43d","TLSv1.2","4228","Application Data, Application Data"
"217","46.361749362","2a00:a040:0:4:face:b00c:3333:7020","2a00:a041:3c5d:4d00:424b:6377:a930:43d","TLSv1.2","1468","Application Data [TCP segment of a reassembled PDU]"
"218","46.361766681","2a00:a041:3c5d:4d00:424b:6377:a930:43d","2a00:a040:0:4:face:b00c:3333:7020","TCP","88","32854  >  443 [ACK] Seq=607 Ack=119422 Win=1772 Len=0 TSval=3881039814 TSecr=564379685"
"219","46.361779892","2a00:a041:3c5d:4d00:424b:6377:a930:43d","2a00:a040:0:4:face:b00c:3333:7020","TCP","88","32854  >  443 [ACK] Seq=607 Ack=123562 Win=1740 Len=0 TSval=3881039814 TSecr=564379686"
"220","46.361785388","2a00:a041:3c5d:4d00:424b:6377:a930:43d","2a00:a040:0:4:face:b00c:3333:7020","TCP","88","32854  >  443 [ACK] Seq=607 Ack=124942 Win=1730 Len=0 TSval=3881039814 TSecr=564379687"
"221","46.363038343","2a00:a040:0:4:face:b00c:3333:7020","2a00:a041:3c5d:4d00:424b:6377:a930:43d","TLSv1.2","2848","Application Data [TCP segment of a reassembled PDU]"
"222","46.363038517","2a00:a040:0:4:face:b00c:3333:7020","2a00:a041:3c5d:4d00:424b:6377:a930:43d","TCP","1468","443  >  32854 [ACK] Seq=127702 Ack=607 Win=123 Len=1380 TSval=564379687 TSecr=3881039800 [TCP segment of a reassembled PDU]"
"223","46.363055199","2a00:a041:3c5d:4d00:424b:6377:a930:43d","2a00:a040:0:4:face:b00c:3333:7020","TCP","88","32854  >  443 [ACK] Seq=607 Ack=127702 Win=1772 Len=0 TSval=3881039815 TSecr=564379687"
"224","46.363068871","2a00:a041:3c5d:4d00:424b:6377:a930:43d","2a00:a040:0:4:face:b00c:3333:7020","TCP","88","32854  >  443 [ACK] Seq=607 Ack=129082 Win=1762 Len=0 TSval=3881039815 TSecr=564379687"
"225","46.364107788","2a00:a040:0:4:face:b00c:3333:7020","2a00:a041:3c5d:4d00:424b:6377:a930:43d","TLSv1.2","1468","Application Data [TCP segment of a reassembled PDU]"
"226","46.364107945","2a00:a040:0:4:face:b00c:3333:7020","2a00:a041:3c5d:4d00:424b:6377:a930:43d","TLSv1.2","1468","Application Data [TCP segment of a reassembled PDU]"
"227","46.364133510","2a00:a041:3c5d:4d00:424b:6377:a930:43d","2a00:a040:0:4:face:b00c:3333:7020","TCP","88","32854  >  443 [ACK] Seq=607 Ack=130462 Win=1788 Len=0 TSval=3881039816 TSecr=564379687"
"228","46.364147060","2a00:a041:3c5d:4d00:424b:6377:a930:43d","2a00:a040:0:4:face:b00c:3333:7020","TCP","88","32854  >  443 [ACK] Seq=607 Ack=131842 Win=1778 Len=0 TSval=3881039816 TSecr=564379688"
"229","46.365559537","2a00:a040:0:4:face:b00c:3333:7020","2a00:a041:3c5d:4d00:424b:6377:a930:43d","TLSv1.2","1291","Application Data"
"230","46.365574713","2a00:a041:3c5d:4d00:424b:6377:a930:43d","2a00:a040:0:4:face:b00c:3333:7020","TCP","88","32854  >  443 [ACK] Seq=607 Ack=133045 Win=1788 Len=0 TSval=3881039818 TSecr=564379688"
"231","46.380322773","2a03:2880:f258:1c3:face:b00c:0:167","2a00:a041:3c5d:4d00:424b:6377:a930:43d","TLSv1.2","356","Application Data"
"232","46.380355485","2a00:a041:3c5d:4d00:424b:6377:a930:43d","2a03:2880:f258:1c3:face:b00c:0:167","TCP","88","41660  >  443 [ACK] Seq=671 Ack=5019 Win=1191 Len=0 TSval=2772289660 TSecr=3187338947"
"233","46.862495487","2a00:a041:3c5d:4d00:424b:6377:a930:43d","2a03:2880:f258:1c3:face:b00c:0:167","TLSv1.2","179","Application Data"
"234","46.936730781","2a03:2880:f258:1c3:face:b00c:0:167","2a00:a041:3c5d:4d00:424b:6377:a930:43d","TCP","88","443  >  41660 [ACK] Seq=5019 Ack=762 Win=1242 Len=0 TSval=3187339511 TSecr=2772290142"
"240","59.595848204","2a00:a041:3c5d:4d00:424b:6377:a930:43d","2a03:2880:f258:1c3:face:b00c:0:167","TLSv1.2","158","Application Data"
"241","59.674157838","2a03:2880:f258:1c3:face:b00c:0:167","2a00:a041:3c5d:4d00:424b:6377:a930:43d","TCP","88","443  >  41660 [ACK] Seq=5019 Ack=832 Win=1242 Len=0 TSval=3187352246 TSecr=2772302876"
"242","59.754590956","2a03:2880:f258:1c3:face:b00c:0:167","2a00:a041:3c5d:4d00:424b:6377:a930:43d","TLSv1.2","160","Application Data"
"243","59.754626913","2a00:a041:3c5d:4d00:424b:6377:a930:43d","2a03:2880:f258:1c3:face:b00c:0:167","TCP","88","41660  >  443 [ACK] Seq=832 Ack=5091 Win=1193 Len=0 TSval=2772303035 TSecr=3187352327"
"262","83.007360606","2a00:a041:3c5d:4d00:424b:6377:a930:43d","2a03:2880:f258:1c3:face:b00c:0:167","TLSv1.2","158","Application Data"
"263","83.092524256","2a03:2880:f258:1c3:face:b00c:0:167","2a00:a041:3c5d:4d00:424b:6377:a930:43d","TCP","88","443  >  41660 [ACK] Seq=5091 Ack=902 Win=1242 Len=0 TSval=3187375665 TSecr=2772326287"
"264","83.172073570","2a03:2880:f258:1c3:face:b00c:0:167","2a00:a041:3c5d:4d00:424b:6377:a930:43d","TLSv1.2","160","Application Data"
"265","83.172108554","2a00:a041:3c5d:4d00:424b:6377:a930:43d","2a03:2880:f258:1c3:face:b00c:0:167","TCP","88","41660  >  443 [ACK] Seq=902 Ack=5163 Win=1193 Len=0 TSval=2772326452 TSecr=3187375745"
"266","89.804961164","2a03:2880:f258:1c3:face:b00c:0:167","2a00:a041:3c5d:4d00:424b:6377:a930:43d","TLSv1.2","1430","Application Data"
"267","89.805000003","2a00:a041:3c5d:4d00:424b:6377:a930:43d","2a03:2880:f258:1c3:face:b00c:0:167","TCP","88","41660  >  443 [ACK] Seq=902 Ack=6505 Win=1183 Len=0 TSval=2772333085 TSecr=3187382276"
"268","89.886564101","2a03:2880:f258:1c3:face:b00c:0:167","2a00:a041:3c5d:4d00:424b:6377:a930:43d","TLSv1.2","182","Application Data"
"269","89.886593226","2a00:a041:3c5d:4d00:424b:6377:a930:43d","2a03:2880:f258:1c3:face:b00c:0:167","TCP","88","41660  >  443 [ACK] Seq=902 Ack=6599 Win=1183 Len=0 TSval=2772333167 TSecr=3187382461"
"270","89.896274927","2a00:a041:3c5d:4d00:424b:6377:a930:43d","2a03:2880:f258:1c3:face:b00c:0:167","TLSv1.2","180","Application Data"
"271","89.974662364","2a03:2880:f258:1c3:face:b00c:0:167","2a00:a041:3c5d:4d00:424b:6377:a930:43d","TLSv1.2","181","Application Data"
"272","89.980689749","2a03:2880:f258:1c3:face:b00c:0:167","2a00:a041:3c5d:4d00:424b:6377:a930:43d","TCP","88","443  >  41660 [ACK] Seq=6692 Ack=994 Win=1242 Len=0 TSval=3187382554 TSecr=2772333176"
"273","90.018618813","2a00:a041:3c5d:4d00:424b:6377:a930:43d","2a03:2880:f258:1c3:face:b00c:0:167","TCP","88","41660  >  443 [ACK] Seq=994 Ack=6692 Win=1193 Len=0 TSval=2772333299 TSecr=3187382541"
"275","90.054455929","2a00:a041:3c5d:4d00:424b:6377:a930:43d","2a03:2880:f258:1c3:face:b00c:0:167","TLSv1.2","181","Application Data"
"276","90.106450713","2a00:a041:3c5d:4d00:424b:6377:a930:43d","2a03:2880:f258:1c3:face:b00c:0:167","TLSv1.2","180","Application Data"
"277","90.127541318","2a03:2880:f258:1c3:face:b00c:0:167","2a00:a041:3c5d:4d00:424b:6377:a930:43d","TCP","88","443  >  41660 [ACK] Seq=6692 Ack=1087 Win=1242 Len=0 TSval=3187382702 TSecr=2772333334"
"278","90.223040344","2a03:2880:f258:1c3:face:b00c:0:167","2a00:a041:3c5d:4d00:424b:6377:a930:43d","TCP","88","443  >  41660 [ACK] Seq=6692 Ack=1179 Win=1242 Len=0 TSval=3187382753 TSecr=2772333386"
"292","106.382805904","2a00:a041:3c5d:4d00:424b:6377:a930:43d","2a00:a040:0:4:face:b00c:3333:7020","TLSv1.2","112","Application Data"
"293","106.382854174","2a00:a041:3c5d:4d00:424b:6377:a930:43d","2a00:a040:0:4:face:b00c:3333:7020","TCP","88","32854  >  443 [FIN, ACK] Seq=631 Ack=133045 Win=1788 Len=0 TSval=3881099835 TSecr=564379688"
"294","106.429424125","2a00:a040:0:4:face:b00c:3333:7020","2a00:a041:3c5d:4d00:424b:6377:a930:43d","TCP","88","443  >  32854 [ACK] Seq=133045 Ack=631 Win=123 Len=0 TSval=564439755 TSecr=3881099835"
"295","106.429613628","2a00:a040:0:4:face:b00c:3333:7020","2a00:a041:3c5d:4d00:424b:6377:a930:43d","TLSv1.2","112","Application Data"
"296","106.429613711","2a00:a040:0:4:face:b00c:3333:7020","2a00:a041:3c5d:4d00:424b:6377:a930:43d","TCP","88","443  >  32854 [FIN, ACK] Seq=133069 Ack=632 Win=123 Len=0 TSval=564439755 TSecr=3881099835"
"297","106.429646909","2a00:a041:3c5d:4d00:424b:6377:a930:43d","2a00:a040:0:4:face:b00c:3333:7020","TCP","76","32854  >  443 [RST] Seq=632 Win=0 Len=0"
"298","106.429676639","2a00:a041:3c5d:4d00:424b:6377:a930:43d","2a00:a040:0:4:face:b00c:3333:7020","TCP","76","32854  >  443 [RST] Seq=632 Win=0 Len=0"
"299","107.370630388","2a00:a041:3c5d:4d00:424b:6377:a930:43d","2a03:2880:f258:1c3:face:b00c:0:167","TLSv1.2","158","Application Data"
