"No.","Time","Source","Destination","Protocol","Length","Info"
"1","0.000000000","2a03:2880:f258:1c3:face:b00c:0:167","2a00:a041:3c5d:4d00:b981:f170:feac:7cf9","TLSv1.2","230","Application Data"
"2","0.000040804","2a00:a041:3c5d:4d00:b981:f170:feac:7cf9","2a03:2880:f258:1c3:face:b00c:0:167","TCP","88","44122  >  443 [ACK] Seq=1 Ack=143 Win=2536 Len=0 TSval=2672802423 TSecr=1976553888"
"3","0.413747435","2a00:a041:3c5d:4d00:b981:f170:feac:7cf9","2a03:2880:f258:1c3:face:b00c:0:167","TLSv1.2","163","Application Data"
"4","0.520911889","2a03:2880:f258:1c3:face:b00c:0:167","2a00:a041:3c5d:4d00:b981:f170:feac:7cf9","TCP","88","443  >  44122 [ACK] Seq=143 Ack=76 Win=866 Len=0 TSval=1976554424 TSecr=2672802836"
"7","6.629572319","2a00:a041:3c5d:4d00:b981:f170:feac:7cf9","2a03:2880:f258:1c3:face:b00c:0:167","TLSv1.2","158","Application Data"
"8","6.710473247","2a03:2880:f258:1c3:face:b00c:0:167","2a00:a041:3c5d:4d00:b981:f170:feac:7cf9","TCP","88","443  >  44122 [ACK] Seq=143 Ack=146 Win=866 Len=0 TSval=1976560613 TSecr=2672809052"
"9","6.790799198","2a03:2880:f258:1c3:face:b00c:0:167","2a00:a041:3c5d:4d00:b981:f170:feac:7cf9","TLSv1.2","160","Application Data"
"10","6.790835934","2a00:a041:3c5d:4d00:b981:f170:feac:7cf9","2a03:2880:f258:1c3:face:b00c:0:167","TCP","88","44122  >  443 [ACK] Seq=146 Ack=215 Win=2536 Len=0 TSval=2672809213 TSecr=1976560693"
"21","21.606103071","2a03:2880:f258:1c3:face:b00c:0:167","2a00:a041:3c5d:4d00:b981:f170:feac:7cf9","TLSv1.2","891","Application Data"
"22","21.606144614","2a00:a041:3c5d:4d00:b981:f170:feac:7cf9","2a03:2880:f258:1c3:face:b00c:0:167","TCP","88","44122  >  443 [ACK] Seq=146 Ack=1018 Win=2558 Len=0 TSval=2672824029 TSecr=1976575429"
"27","22.083612186","2a00:a041:3c5d:4d00:b981:f170:feac:7cf9","2a03:2880:f258:1c3:face:b00c:0:167","TLSv1.2","187","Application Data"
"28","22.171767492","2a03:2880:f258:1c3:face:b00c:0:167","2a00:a041:3c5d:4d00:b981:f170:feac:7cf9","TCP","88","443  >  44122 [ACK] Seq=1018 Ack=245 Win=866 Len=0 TSval=1976576076 TSecr=2672824506"
"32","23.590837410","2a00:a041:3c5d:4d00:b981:f170:feac:7cf9","2a03:2880:f258:1c3:face:b00c:0:167","TLSv1.2","158","Application Data"
"33","23.669960730","2a03:2880:f258:1c3:face:b00c:0:167","2a00:a041:3c5d:4d00:b981:f170:feac:7cf9","TCP","88","443  >  44122 [ACK] Seq=1018 Ack=315 Win=866 Len=0 TSval=1976577573 TSecr=2672826013"
"34","23.752947864","2a03:2880:f258:1c3:face:b00c:0:167","2a00:a041:3c5d:4d00:b981:f170:feac:7cf9","TLSv1.2","160","Application Data"
"35","23.752981585","2a00:a041:3c5d:4d00:b981:f170:feac:7cf9","2a03:2880:f258:1c3:face:b00c:0:167","TCP","88","44122  >  443 [ACK] Seq=315 Ack=1090 Win=2558 Len=0 TSval=2672826176 TSecr=1976577653"
"42","43.106798860","2a03:2880:f258:1c3:face:b00c:0:167","2a00:a041:3c5d:4d00:b981:f170:feac:7cf9","TLSv1.2","390","Application Data"
"43","43.106840558","2a00:a041:3c5d:4d00:b981:f170:feac:7cf9","2a03:2880:f258:1c3:face:b00c:0:167","TCP","88","44122  >  443 [ACK] Seq=315 Ack=1392 Win=2579 Len=0 TSval=2672845529 TSecr=1976596991"
"44","43.516025855","2a03:2880:f258:1c3:face:b00c:0:167","2a00:a041:3c5d:4d00:b981:f170:feac:7cf9","TLSv1.2","207","Application Data"
"45","43.516058819","2a00:a041:3c5d:4d00:b981:f170:feac:7cf9","2a03:2880:f258:1c3:face:b00c:0:167","TCP","88","44122  >  443 [ACK] Seq=315 Ack=1511 Win=2579 Len=0 TSval=2672845939 TSecr=1976597312"
"46","43.521648486","2a00:a041:3c5d:4d00:b981:f170:feac:7cf9","2a03:2880:f258:1c3:face:b00c:0:167","TLSv1.2","182","Application Data"
"47","43.530974744","2a00:a041:3c5d:4d00:b981:f170:feac:7cf9","2a03:2880:f258:1c3:face:b00c:0:167","TLSv1.2","187","Application Data"
"48","43.599986445","2a03:2880:f258:1c3:face:b00c:0:167","2a00:a041:3c5d:4d00:b981:f170:feac:7cf9","TCP","88","443  >  44122 [ACK] Seq=1511 Ack=409 Win=866 Len=0 TSval=1976597502 TSecr=2672845944"
"49","43.612349651","2a03:2880:f258:1c3:face:b00c:0:167","2a00:a041:3c5d:4d00:b981:f170:feac:7cf9","TCP","88","443  >  44122 [ACK] Seq=1511 Ack=508 Win=866 Len=0 TSval=1976597515 TSecr=2672845954"
"51","47.509898312","2a03:2880:f258:1c3:face:b00c:0:167","2a00:a041:3c5d:4d00:b981:f170:feac:7cf9","TLSv1.2","364","Application Data"
"52","47.554010234","2a00:a041:3c5d:4d00:b981:f170:feac:7cf9","2a03:2880:f258:1c3:face:b00c:0:167","TCP","88","44122  >  443 [ACK] Seq=508 Ack=1787 Win=2601 Len=0 TSval=2672849977 TSecr=1976601346"
"53","47.674237508","2a00:a041:3c5d:4d00:b981:f170:feac:7cf9","2a03:2880:f258:1c3:face:b00c:0:167","TLSv1.2","160","Application Data"
"54","47.763794268","2a03:2880:f258:1c3:face:b00c:0:167","2a00:a041:3c5d:4d00:b981:f170:feac:7cf9","TCP","88","443  >  44122 [ACK] Seq=1787 Ack=580 Win=866 Len=0 TSval=1976601666 TSecr=2672850097"
"58","49.662437164","2a03:2880:f258:1c3:face:b00c:0:167","2a00:a041:3c5d:4d00:b981:f170:feac:7cf9","TCP","1468","443  >  44122 [ACK] Seq=1787 Ack=580 Win=866 Len=1380 TSval=1976603515 TSecr=2672850097 [TCP segment of a reassembled PDU]"
"59","49.662479564","2a00:a041:3c5d:4d00:b981:f170:feac:7cf9","2a03:2880:f258:1c3:face:b00c:0:167","TCP","88","44122  >  443 [ACK] Seq=580 Ack=3167 Win=2622 Len=0 TSval=2672852085 TSecr=1976603515"
"60","49.663087047","2a03:2880:f258:1c3:face:b00c:0:167","2a00:a041:3c5d:4d00:b981:f170:feac:7cf9","TLSv1.2","221","Application Data"
"61","49.663087345","2a03:2880:f258:1c3:face:b00c:0:167","2a00:a041:3c5d:4d00:b981:f170:feac:7cf9","TLSv1.2","2848","Application Data"
"62","49.663087396","2a03:2880:f258:1c3:face:b00c:0:167","2a00:a041:3c5d:4d00:b981:f170:feac:7cf9","TLSv1.2","497","Application Data"
"63","49.663118346","2a00:a041:3c5d:4d00:b981:f170:feac:7cf9","2a03:2880:f258:1c3:face:b00c:0:167","TCP","88","44122  >  443 [ACK] Seq=580 Ack=3300 Win=2622 Len=0 TSval=2672852086 TSecr=1976603515"
"64","49.663147713","2a00:a041:3c5d:4d00:b981:f170:feac:7cf9","2a03:2880:f258:1c3:face:b00c:0:167","TCP","88","44122  >  443 [ACK] Seq=580 Ack=6060 Win=2665 Len=0 TSval=2672852086 TSecr=1976603516"
"65","49.663156624","2a00:a041:3c5d:4d00:b981:f170:feac:7cf9","2a03:2880:f258:1c3:face:b00c:0:167","TCP","88","44122  >  443 [ACK] Seq=580 Ack=6469 Win=2687 Len=0 TSval=2672852086 TSecr=1976603519"
"66","50.055224686","2a00:a041:3c5d:4d00:b981:f170:feac:7cf9","2a03:2880:f258:1c3:face:b00c:0:167","TLSv1.2","181","Application Data"
"67","50.136010948","2a03:2880:f258:1c3:face:b00c:0:167","2a00:a041:3c5d:4d00:b981:f170:feac:7cf9","TCP","88","443  >  44122 [ACK] Seq=6469 Ack=673 Win=866 Len=0 TSval=1976604037 TSecr=2672852478"
"68","50.246447317","2a00:a041:3c5d:4d00:b981:f170:feac:7cf9","2a03:2880:f258:1c3:face:b00c:0:167","TLSv1.2","158","Application Data"
"69","50.327933990","2a03:2880:f258:1c3:face:b00c:0:167","2a00:a041:3c5d:4d00:b981:f170:feac:7cf9","TCP","88","443  >  44122 [ACK] Seq=6469 Ack=743 Win=866 Len=0 TSval=1976604230 TSecr=2672852669"
"70","50.408770767","2a03:2880:f258:1c3:face:b00c:0:167","2a00:a041:3c5d:4d00:b981:f170:feac:7cf9","TLSv1.2","160","Application Data"
"71","50.408805495","2a00:a041:3c5d:4d00:b981:f170:feac:7cf9","2a03:2880:f258:1c3:face:b00c:0:167","TCP","88","44122  >  443 [ACK] Seq=743 Ack=6541 Win=2687 Len=0 TSval=2672852831 TSecr=1976604310"
"72","52.937279666","2a03:2880:f258:1c3:face:b00c:0:167","2a00:a041:3c5d:4d00:b981:f170:feac:7cf9","TLSv1.2","304","Application Data"
"73","52.937329375","2a00:a041:3c5d:4d00:b981:f170:feac:7cf9","2a03:2880:f258:1c3:face:b00c:0:167","TCP","88","44122  >  443 [ACK] Seq=743 Ack=6757 Win=2687 Len=0 TSval=2672855360 TSecr=1976606808"
"74","53.056698082","2a00:a041:3c5d:4d00:b981:f170:feac:7cf9","2a03:2880:f258:1c3:face:b00c:0:167","TLSv1.2","182","Application Data"
"75","53.124558163","2a00:a041:3c5d:4d00:b981:f170:feac:7cf9","2a03:2880:f258:1c3:face:b00c:0:167","TLSv1.2","163","Application Data"
"76","53.140995131","2a03:2880:f258:1c3:face:b00c:0:167","2a00:a041:3c5d:4d00:b981:f170:feac:7cf9","TCP","88","443  >  44122 [ACK] Seq=6757 Ack=837 Win=866 Len=0 TSval=1976607044 TSecr=2672855479"
"77","53.213138223","2a03:2880:f258:1c3:face:b00c:0:167","2a00:a041:3c5d:4d00:b981:f170:feac:7cf9","TCP","88","443  >  44122 [ACK] Seq=6757 Ack=912 Win=866 Len=0 TSval=1976607105 TSecr=2672855547"
"99","69.525801924","2a03:2880:f258:1c3:face:b00c:0:167","2a00:a041:3c5d:4d00:b981:f170:feac:7cf9","TLSv1.2","388","Application Data"
"100","69.525846126","2a00:a041:3c5d:4d00:b981:f170:feac:7cf9","2a03:2880:f258:1c3:face:b00c:0:167","TCP","88","44122  >  443 [ACK] Seq=912 Ack=7057 Win=2709 Len=0 TSval=2672871948 TSecr=1976623396"
"101","69.961535926","2a00:a041:3c5d:4d00:b981:f170:feac:7cf9","2a03:2880:f258:1c3:face:b00c:0:167","TLSv1.2","187","Application Data"
"102","70.045461261","2a03:2880:f258:1c3:face:b00c:0:167","2a00:a041:3c5d:4d00:b981:f170:feac:7cf9","TCP","88","443  >  44122 [ACK] Seq=7057 Ack=1011 Win=866 Len=0 TSval=1976623944 TSecr=2672872384"
"114","77.359288513","2a00:a041:3c5d:4d00:b981:f170:feac:7cf9","2a03:2880:f258:1c3:face:b00c:0:167","TLSv1.2","158","Application Data"
"115","77.437706192","2a03:2880:f258:1c3:face:b00c:0:167","2a00:a041:3c5d:4d00:b981:f170:feac:7cf9","TCP","88","443  >  44122 [ACK] Seq=7057 Ack=1081 Win=866 Len=0 TSval=1976631341 TSecr=2672879782"
"117","77.517717904","2a03:2880:f258:1c3:face:b00c:0:167","2a00:a041:3c5d:4d00:b981:f170:feac:7cf9","TLSv1.2","160","Application Data"
"118","77.517755266","2a00:a041:3c5d:4d00:b981:f170:feac:7cf9","2a03:2880:f258:1c3:face:b00c:0:167","TCP","88","44122  >  443 [ACK] Seq=1081 Ack=7129 Win=2709 Len=0 TSval=2672879940 TSecr=1976631422"
"144","87.556440756","2a03:2880:f258:1c3:face:b00c:0:167","2a00:a041:3c5d:4d00:b981:f170:feac:7cf9","TLSv1.2","505","Application Data"
"145","87.556479104","2a00:a041:3c5d:4d00:b981:f170:feac:7cf9","2a03:2880:f258:1c3:face:b00c:0:167","TCP","88","44122  >  443 [ACK] Seq=1081 Ack=7546 Win=2730 Len=0 TSval=2672889979 TSecr=1976641387"
"146","87.912897977","2a00:a041:3c5d:4d00:b981:f170:feac:7cf9","2a03:2880:f258:1c3:face:b00c:0:167","TLSv1.2","187","Application Data"
"147","87.992970421","2a03:2880:f258:1c3:face:b00c:0:167","2a00:a041:3c5d:4d00:b981:f170:feac:7cf9","TCP","88","443  >  44122 [ACK] Seq=7546 Ack=1180 Win=866 Len=0 TSval=1976641895 TSecr=2672890336"
"148","91.442189997","2a03:2880:f258:1c3:face:b00c:0:167","2a00:a041:3c5d:4d00:b981:f170:feac:7cf9","TLSv1.2","750","Application Data"
"149","91.442226973","2a00:a041:3c5d:4d00:b981:f170:feac:7cf9","2a03:2880:f258:1c3:face:b00c:0:167","TCP","88","44122  >  443 [ACK] Seq=1180 Ack=8208 Win=2752 Len=0 TSval=2672893865 TSecr=1976645324"
"150","92.137668101","2a00:a041:3c5d:4d00:b981:f170:feac:7cf9","2a03:2880:f258:1c3:face:b00c:0:167","TLSv1.2","181","Application Data"
"151","92.214794131","2a03:2880:f258:1c3:face:b00c:0:167","2a00:a041:3c5d:4d00:b981:f170:feac:7cf9","TCP","88","443  >  44122 [ACK] Seq=8208 Ack=1273 Win=866 Len=0 TSval=1976646118 TSecr=2672894560"
"153","97.563398557","2a00:a041:3c5d:4d00:b981:f170:feac:7cf9","2a03:2880:f258:1c3:face:b00c:0:167","TLSv1.2","158","Application Data"
"154","97.642096100","2a03:2880:f258:1c3:face:b00c:0:167","2a00:a041:3c5d:4d00:b981:f170:feac:7cf9","TCP","88","443  >  44122 [ACK] Seq=8208 Ack=1343 Win=866 Len=0 TSval=1976651545 TSecr=2672899986"
"155","97.721742838","2a03:2880:f258:1c3:face:b00c:0:167","2a00:a041:3c5d:4d00:b981:f170:feac:7cf9","TLSv1.2","160","Application Data"
"156","97.721777463","2a00:a041:3c5d:4d00:b981:f170:feac:7cf9","2a03:2880:f258:1c3:face:b00c:0:167","TCP","88","44122  >  443 [ACK] Seq=1343 Ack=8280 Win=2752 Len=0 TSval=2672900144 TSecr=1976651625"
"157","99.125624010","2a03:2880:f258:1c3:face:b00c:0:167","2a00:a041:3c5d:4d00:b981:f170:feac:7cf9","TLSv1.2","275","Application Data"
"158","99.125667238","2a00:a041:3c5d:4d00:b981:f170:feac:7cf9","2a03:2880:f258:1c3:face:b00c:0:167","TCP","88","44122  >  443 [ACK] Seq=1343 Ack=8467 Win=2752 Len=0 TSval=2672901548 TSecr=1976652866"
"159","99.176759070","2a03:2880:f258:1c3:face:b00c:0:167","2a00:a041:3c5d:4d00:b981:f170:feac:7cf9","TCP","275","[TCP Spurious Retransmission] 443  >  44122 [PSH, ACK] Seq=8280 Ack=1343 Win=866 Len=187 TSval=1976653078 TSecr=2672900144"
"160","99.176794565","2a00:a041:3c5d:4d00:b981:f170:feac:7cf9","2a03:2880:f258:1c3:face:b00c:0:167","TCP","100","[TCP Dup ACK 158#1] 44122  >  443 [ACK] Seq=1343 Ack=8467 Win=2752 Len=0 TSval=2672901599 TSecr=1976653078 SLE=8280 SRE=8467"
"161","99.974660486","2a00:a041:3c5d:4d00:b981:f170:feac:7cf9","2a03:2880:f258:1c3:face:b00c:0:167","TLSv1.2","160","Application Data"
"162","100.143422959","2a03:2880:f258:1c3:face:b00c:0:167","2a00:a041:3c5d:4d00:b981:f170:feac:7cf9","TCP","88","443  >  44122 [ACK] Seq=8467 Ack=1415 Win=866 Len=0 TSval=1976654019 TSecr=2672902397"
"175","105.161453090","2a03:2880:f258:1c3:face:b00c:0:167","2a00:a041:3c5d:4d00:b981:f170:feac:7cf9","TLSv1.2","827","Application Data"
"176","105.161493504","2a00:a041:3c5d:4d00:b981:f170:feac:7cf9","2a03:2880:f258:1c3:face:b00c:0:167","TCP","88","44122  >  443 [ACK] Seq=1415 Ack=9206 Win=2773 Len=0 TSval=2672907584 TSecr=1976659055"
"183","105.676052671","2a00:a041:3c5d:4d00:b981:f170:feac:7cf9","2a03:2880:f258:1c3:face:b00c:0:167","TLSv1.2","187","Application Data"
"184","105.754525316","2a03:2880:f258:1c3:face:b00c:0:167","2a00:a041:3c5d:4d00:b981:f170:feac:7cf9","TCP","88","443  >  44122 [ACK] Seq=9206 Ack=1514 Win=866 Len=0 TSval=1976659657 TSecr=2672908099"
"211","114.474516529","2a00:a041:3c5d:4d00:b981:f170:feac:7cf9","2a03:2880:f258:1c3:face:b00c:0:167","TLSv1.2","158","Application Data"
"212","114.553532019","2a03:2880:f258:1c3:face:b00c:0:167","2a00:a041:3c5d:4d00:b981:f170:feac:7cf9","TCP","88","443  >  44122 [ACK] Seq=9206 Ack=1584 Win=866 Len=0 TSval=1976668456 TSecr=2672916897"
"213","114.634106639","2a03:2880:f258:1c3:face:b00c:0:167","2a00:a041:3c5d:4d00:b981:f170:feac:7cf9","TLSv1.2","160","Application Data"
"214","114.634140944","2a00:a041:3c5d:4d00:b981:f170:feac:7cf9","2a03:2880:f258:1c3:face:b00c:0:167","TCP","88","44122  >  443 [ACK] Seq=1584 Ack=9278 Win=2773 Len=0 TSval=2672917057 TSecr=1976668536"
"219","116.528092912","2a03:2880:f258:1c3:face:b00c:0:167","2a00:a041:3c5d:4d00:b981:f170:feac:7cf9","TLSv1.2","654","Application Data"
"220","116.528126319","2a00:a041:3c5d:4d00:b981:f170:feac:7cf9","2a03:2880:f258:1c3:face:b00c:0:167","TCP","88","44122  >  443 [ACK] Seq=1584 Ack=9844 Win=2795 Len=0 TSval=2672918951 TSecr=1976670386"
"221","116.870033099","2a00:a041:3c5d:4d00:b981:f170:feac:7cf9","2a03:2880:f258:1c3:face:b00c:0:167","TLSv1.2","181","Application Data"
"222","116.949139229","2a03:2880:f258:1c3:face:b00c:0:167","2a00:a041:3c5d:4d00:b981:f170:feac:7cf9","TCP","88","443  >  44122 [ACK] Seq=9844 Ack=1677 Win=866 Len=0 TSval=1976670853 TSecr=2672919293"
"233","120.634020153","2a03:2880:f258:1c3:face:b00c:0:167","2a00:a041:3c5d:4d00:b981:f170:feac:7cf9","TLSv1.2","842","Application Data"
"234","120.634069168","2a00:a041:3c5d:4d00:b981:f170:feac:7cf9","2a03:2880:f258:1c3:face:b00c:0:167","TCP","88","44122  >  443 [ACK] Seq=1677 Ack=10598 Win=2816 Len=0 TSval=2672923057 TSecr=1976674518"
"235","121.005081862","2a00:a041:3c5d:4d00:b981:f170:feac:7cf9","2a03:2880:f258:1c3:face:b00c:0:167","TLSv1.2","187","Application Data"
"236","121.138447654","2a03:2880:f258:1c3:face:b00c:0:167","2a00:a041:3c5d:4d00:b981:f170:feac:7cf9","TCP","88","443  >  44122 [ACK] Seq=10598 Ack=1776 Win=866 Len=0 TSval=1976675041 TSecr=2672923428"
"237","122.877115311","2a03:2880:f258:1c3:face:b00c:0:167","2a00:a041:3c5d:4d00:b981:f170:feac:7cf9","TLSv1.2","414","Application Data"
"238","122.877160258","2a00:a041:3c5d:4d00:b981:f170:feac:7cf9","2a03:2880:f258:1c3:face:b00c:0:167","TCP","88","44122  >  443 [ACK] Seq=1776 Ack=10924 Win=2838 Len=0 TSval=2672925300 TSecr=1976676752"
"239","123.384580642","2a00:a041:3c5d:4d00:b981:f170:feac:7cf9","2a03:2880:f258:1c3:face:b00c:0:167","TLSv1.2","181","Application Data"
"240","123.482527618","2a03:2880:f258:1c3:face:b00c:0:167","2a00:a041:3c5d:4d00:b981:f170:feac:7cf9","TCP","88","443  >  44122 [ACK] Seq=10924 Ack=1869 Win=866 Len=0 TSval=1976677379 TSecr=2672925807"
"248","126.665741716","2a03:2880:f258:1c3:face:b00c:0:167","2a00:a041:3c5d:4d00:b981:f170:feac:7cf9","TLSv1.2","455","Application Data"
"249","126.665780863","2a00:a041:3c5d:4d00:b981:f170:feac:7cf9","2a03:2880:f258:1c3:face:b00c:0:167","TCP","88","44122  >  443 [ACK] Seq=1869 Ack=11291 Win=2859 Len=0 TSval=2672929088 TSecr=1976680556"
"250","127.220576057","2a00:a041:3c5d:4d00:b981:f170:feac:7cf9","2a03:2880:f258:1c3:face:b00c:0:167","TLSv1.2","187","Application Data"
"251","127.300060422","2a03:2880:f258:1c3:face:b00c:0:167","2a00:a041:3c5d:4d00:b981:f170:feac:7cf9","TCP","88","443  >  44122 [ACK] Seq=11291 Ack=1968 Win=866 Len=0 TSval=1976681203 TSecr=2672929643"
"254","128.611645228","2a03:2880:f258:1c3:face:b00c:0:167","2a00:a041:3c5d:4d00:b981:f170:feac:7cf9","TLSv1.2","1382","Application Data"
"255","128.611685466","2a00:a041:3c5d:4d00:b981:f170:feac:7cf9","2a03:2880:f258:1c3:face:b00c:0:167","TCP","88","44122  >  443 [ACK] Seq=1968 Ack=12585 Win=2881 Len=0 TSval=2672931034 TSecr=1976682440"
"256","128.628270152","2a03:2880:f258:1c3:face:b00c:0:167","2a00:a041:3c5d:4d00:b981:f170:feac:7cf9","TLSv1.2","1446","Application Data"
"257","128.628304162","2a00:a041:3c5d:4d00:b981:f170:feac:7cf9","2a03:2880:f258:1c3:face:b00c:0:167","TCP","88","44122  >  443 [ACK] Seq=1968 Ack=13943 Win=2903 Len=0 TSval=2672931051 TSecr=1976682532"
"258","128.679923653","2a03:2880:f258:1c3:face:b00c:0:167","2a00:a041:3c5d:4d00:b981:f170:feac:7cf9","TLSv1.2","1462","Application Data"
"259","128.679956354","2a00:a041:3c5d:4d00:b981:f170:feac:7cf9","2a03:2880:f258:1c3:face:b00c:0:167","TCP","88","44122  >  443 [ACK] Seq=1968 Ack=15317 Win=2924 Len=0 TSval=2672931103 TSecr=1976682582"
"260","128.770147992","2a03:2880:f258:1c3:face:b00c:0:167","2a00:a041:3c5d:4d00:b981:f170:feac:7cf9","TLSv1.2","1430","Application Data"
"261","128.770184617","2a00:a041:3c5d:4d00:b981:f170:feac:7cf9","2a03:2880:f258:1c3:face:b00c:0:167","TCP","88","44122  >  443 [ACK] Seq=1968 Ack=16659 Win=2946 Len=0 TSval=2672931193 TSecr=1976682672"
"262","128.799874766","2a00:a041:3c5d:4d00:b981:f170:feac:7cf9","2a03:2880:f258:1c3:face:b00c:0:167","TLSv1.2","163","Application Data"
"271","128.823667672","2a00:a041:3c5d:4d00:b981:f170:feac:7cf9","2a00:a040:0:4:face:b00c:3333:7020","TCP","96","40466  >  443 [SYN] Seq=0 Win=64800 Len=0 MSS=1440 SACK_PERM=1 TSval=1302927086 TSecr=0 WS=128"
"272","128.839779448","2a00:a040:0:4:face:b00c:3333:7020","2a00:a041:3c5d:4d00:b981:f170:feac:7cf9","TCP","96","443  >  40466 [SYN, ACK] Seq=0 Ack=1 Win=31740 Len=0 MSS=1392 SACK_PERM=1 TSval=2879172909 TSecr=1302927086 WS=256"
"273","128.839795862","2a00:a041:3c5d:4d00:b981:f170:feac:7cf9","2a00:a040:0:4:face:b00c:3333:7020","TCP","88","40466  >  443 [ACK] Seq=1 Ack=1 Win=64896 Len=0 TSval=1302927102 TSecr=2879172909"
"274","128.840255857","2a00:a041:3c5d:4d00:b981:f170:feac:7cf9","2a00:a040:0:4:face:b00c:3333:7020","TLSv1.3","794","Client Hello"
"275","128.859323450","2a03:2880:f258:1c3:face:b00c:0:167","2a00:a041:3c5d:4d00:b981:f170:feac:7cf9","TLSv1.2","1430","Application Data"
"276","128.864190500","2a00:a040:0:4:face:b00c:3333:7020","2a00:a041:3c5d:4d00:b981:f170:feac:7cf9","TCP","88","443  >  40466 [ACK] Seq=1 Ack=707 Win=31232 Len=0 TSval=2879172935 TSecr=1302927103"
"277","128.866582417","2a00:a040:0:4:face:b00c:3333:7020","2a00:a041:3c5d:4d00:b981:f170:feac:7cf9","TLSv1.3","253","Server Hello, Application Data"
"278","128.866591754","2a00:a041:3c5d:4d00:b981:f170:feac:7cf9","2a00:a040:0:4:face:b00c:3333:7020","TCP","88","40466  >  443 [ACK] Seq=707 Ack=166 Win=64768 Len=0 TSval=1302927129 TSecr=2879172935"
"279","128.866813513","2a00:a041:3c5d:4d00:b981:f170:feac:7cf9","2a00:a040:0:4:face:b00c:3333:7020","TLSv1.3","94","Change Cipher Spec"
"280","128.866854488","2a00:a041:3c5d:4d00:b981:f170:feac:7cf9","2a00:a040:0:4:face:b00c:3333:7020","TLSv1.3","146","Application Data"
"281","128.867505094","2a00:a041:3c5d:4d00:b981:f170:feac:7cf9","2a00:a040:0:4:face:b00c:3333:7020","TLSv1.3","678","Application Data"
"282","128.877293610","2a03:2880:f258:1c3:face:b00c:0:167","2a00:a041:3c5d:4d00:b981:f170:feac:7cf9","TCP","88","443  >  44122 [ACK] Seq=18001 Ack=2043 Win=866 Len=0 TSval=1976682780 TSecr=2672931222"
"283","128.880773601","2a00:a041:3c5d:4d00:b981:f170:feac:7cf9","2a03:2880:f258:1c3:face:b00c:0:167","TLSv1.2","181","Application Data"
"284","128.882172668","2a00:a040:0:4:face:b00c:3333:7020","2a00:a041:3c5d:4d00:b981:f170:feac:7cf9","TCP","88","443  >  40466 [ACK] Seq=166 Ack=771 Win=31488 Len=0 TSval=2879172951 TSecr=1302927129"
"285","128.882565628","2a00:a040:0:4:face:b00c:3333:7020","2a00:a041:3c5d:4d00:b981:f170:feac:7cf9","TLSv1.3","269","Application Data"
"286","128.926010811","2a00:a041:3c5d:4d00:b981:f170:feac:7cf9","2a00:a040:0:4:face:b00c:3333:7020","TCP","88","40466  >  443 [ACK] Seq=1361 Ack=347 Win=64640 Len=0 TSval=1302927189 TSecr=2879172951"
"287","128.928951671","2a00:a040:0:4:face:b00c:3333:7020","2a00:a041:3c5d:4d00:b981:f170:feac:7cf9","TCP","88","443  >  40466 [ACK] Seq=347 Ack=1361 Win=31488 Len=0 TSval=2879172997 TSecr=1302927130"
"288","128.950376166","2a03:2880:f258:1c3:face:b00c:0:167","2a00:a041:3c5d:4d00:b981:f170:feac:7cf9","TLSv1.2","1350","Application Data"
"289","128.955541993","2a00:a040:0:4:face:b00c:3333:7020","2a00:a041:3c5d:4d00:b981:f170:feac:7cf9","TLSv1.3","418","Application Data"
"290","128.955554583","2a00:a041:3c5d:4d00:b981:f170:feac:7cf9","2a00:a040:0:4:face:b00c:3333:7020","TCP","88","40466  >  443 [ACK] Seq=1361 Ack=677 Win=64384 Len=0 TSval=1302927218 TSecr=2879173023"
"291","128.956252794","2a00:a040:0:4:face:b00c:3333:7020","2a00:a041:3c5d:4d00:b981:f170:feac:7cf9","TLSv1.3","111","Application Data"
"292","128.956252864","2a00:a040:0:4:face:b00c:3333:7020","2a00:a041:3c5d:4d00:b981:f170:feac:7cf9","TCP","1468","443  >  40466 [ACK] Seq=700 Ack=1361 Win=31488 Len=1380 TSval=2879173024 TSecr=1302927189 [TCP segment of a reassembled PDU]"
"293","128.956260346","2a00:a041:3c5d:4d00:b981:f170:feac:7cf9","2a00:a040:0:4:face:b00c:3333:7020","TCP","88","40466  >  443 [ACK] Seq=1361 Ack=700 Win=64384 Len=0 TSval=1302927219 TSecr=2879173024"
"294","128.956268313","2a00:a041:3c5d:4d00:b981:f170:feac:7cf9","2a00:a040:0:4:face:b00c:3333:7020","TCP","88","40466  >  443 [ACK] Seq=1361 Ack=2080 Win=63104 Len=0 TSval=1302927219 TSecr=2879173024"
"295","128.958948394","2a00:a040:0:4:face:b00c:3333:7020","2a00:a041:3c5d:4d00:b981:f170:feac:7cf9","TLSv1.3","1468","Application Data [TCP segment of a reassembled PDU]"
"296","128.958955481","2a00:a041:3c5d:4d00:b981:f170:feac:7cf9","2a00:a040:0:4:face:b00c:3333:7020","TCP","88","40466  >  443 [ACK] Seq=1361 Ack=3460 Win=63104 Len=0 TSval=1302927222 TSecr=2879173024"
"297","128.961876112","2a00:a040:0:4:face:b00c:3333:7020","2a00:a041:3c5d:4d00:b981:f170:feac:7cf9","TCP","1468","443  >  40466 [ACK] Seq=3460 Ack=1361 Win=31488 Len=1380 TSval=2879173024 TSecr=1302927189 [TCP segment of a reassembled PDU]"
"298","128.961882327","2a00:a041:3c5d:4d00:b981:f170:feac:7cf9","2a00:a040:0:4:face:b00c:3333:7020","TCP","88","40466  >  443 [ACK] Seq=1361 Ack=4840 Win=63104 Len=0 TSval=1302927225 TSecr=2879173024"
"299","128.964453615","2a00:a040:0:4:face:b00c:3333:7020","2a00:a041:3c5d:4d00:b981:f170:feac:7cf9","TCP","1468","443  >  40466 [PSH, ACK] Seq=4840 Ack=1361 Win=31488 Len=1380 TSval=2879173024 TSecr=1302927189 [TCP segment of a reassembled PDU]"
"300","128.964491710","2a00:a041:3c5d:4d00:b981:f170:feac:7cf9","2a00:a040:0:4:face:b00c:3333:7020","TCP","88","40466  >  443 [ACK] Seq=1361 Ack=6220 Win=63104 Len=0 TSval=1302927227 TSecr=2879173024"
"301","128.965222644","2a00:a040:0:4:face:b00c:3333:7020","2a00:a041:3c5d:4d00:b981:f170:feac:7cf9","TCP","1468","443  >  40466 [ACK] Seq=6220 Ack=1361 Win=31488 Len=1380 TSval=2879173024 TSecr=1302927189 [TCP segment of a reassembled PDU]"
"302","128.965226999","2a00:a041:3c5d:4d00:b981:f170:feac:7cf9","2a00:a040:0:4:face:b00c:3333:7020","TCP","88","40466  >  443 [ACK] Seq=1361 Ack=7600 Win=63104 Len=0 TSval=1302927228 TSecr=2879173024"
"303","128.968639002","2a00:a040:0:4:face:b00c:3333:7020","2a00:a041:3c5d:4d00:b981:f170:feac:7cf9","TCP","1468","443  >  40466 [PSH, ACK] Seq=7600 Ack=1361 Win=31488 Len=1380 TSval=2879173024 TSecr=1302927189 [TCP segment of a reassembled PDU]"
"304","128.968646128","2a00:a041:3c5d:4d00:b981:f170:feac:7cf9","2a00:a040:0:4:face:b00c:3333:7020","TCP","88","40466  >  443 [ACK] Seq=1361 Ack=8980 Win=63104 Len=0 TSval=1302927231 TSecr=2879173024"
"305","128.969350158","2a00:a040:0:4:face:b00c:3333:7020","2a00:a041:3c5d:4d00:b981:f170:feac:7cf9","TCP","1468","443  >  40466 [ACK] Seq=8980 Ack=1361 Win=31488 Len=1380 TSval=2879173026 TSecr=1302927189 [TCP segment of a reassembled PDU]"
"306","128.969366495","2a00:a041:3c5d:4d00:b981:f170:feac:7cf9","2a00:a040:0:4:face:b00c:3333:7020","TCP","88","40466  >  443 [ACK] Seq=1361 Ack=10360 Win=63104 Len=0 TSval=1302927232 TSecr=2879173026"
"307","128.970289216","2a00:a040:0:4:face:b00c:3333:7020","2a00:a041:3c5d:4d00:b981:f170:feac:7cf9","TCP","1468","443  >  40466 [PSH, ACK] Seq=10360 Ack=1361 Win=31488 Len=1380 TSval=2879173026 TSecr=1302927189 [TCP segment of a reassembled PDU]"
"308","128.970301730","2a00:a041:3c5d:4d00:b981:f170:feac:7cf9","2a00:a040:0:4:face:b00c:3333:7020","TCP","88","40466  >  443 [ACK] Seq=1361 Ack=11740 Win=63104 Len=0 TSval=1302927233 TSecr=2879173026"
"309","128.971040645","2a00:a040:0:4:face:b00c:3333:7020","2a00:a041:3c5d:4d00:b981:f170:feac:7cf9","TCP","1468","443  >  40466 [ACK] Seq=11740 Ack=1361 Win=31488 Len=1380 TSval=2879173027 TSecr=1302927189 [TCP segment of a reassembled PDU]"
"310","128.971052974","2a00:a041:3c5d:4d00:b981:f170:feac:7cf9","2a00:a040:0:4:face:b00c:3333:7020","TCP","88","40466  >  443 [ACK] Seq=1361 Ack=13120 Win=63104 Len=0 TSval=1302927234 TSecr=2879173027"
"311","128.973570836","2a00:a040:0:4:face:b00c:3333:7020","2a00:a041:3c5d:4d00:b981:f170:feac:7cf9","TCP","1468","443  >  40466 [PSH, ACK] Seq=13120 Ack=1361 Win=31488 Len=1380 TSval=2879173027 TSecr=1302927189 [TCP segment of a reassembled PDU]"
"312","128.974059859","2a03:2880:f258:1c3:face:b00c:0:167","2a00:a041:3c5d:4d00:b981:f170:feac:7cf9","TCP","88","443  >  44122 [ACK] Seq=19263 Ack=2136 Win=866 Len=0 TSval=1976682862 TSecr=2672931303"
"313","128.974060035","2a03:2880:f258:1c3:face:b00c:0:167","2a00:a041:3c5d:4d00:b981:f170:feac:7cf9","TLSv1.2","1094","Application Data"
"314","128.974083661","2a00:a041:3c5d:4d00:b981:f170:feac:7cf9","2a03:2880:f258:1c3:face:b00c:0:167","TCP","88","44122  >  443 [ACK] Seq=2136 Ack=20269 Win=3009 Len=0 TSval=2672931397 TSecr=1976682852"
"315","128.994350095","2a00:a040:0:4:face:b00c:3333:7020","2a00:a041:3c5d:4d00:b981:f170:feac:7cf9","TCP","1468","443  >  40466 [ACK] Seq=14500 Ack=1361 Win=31488 Len=1380 TSval=2879173061 TSecr=1302927218 [TCP segment of a reassembled PDU]"
"316","128.994381363","2a00:a041:3c5d:4d00:b981:f170:feac:7cf9","2a00:a040:0:4:face:b00c:3333:7020","TCP","88","40466  >  443 [ACK] Seq=1361 Ack=15880 Win=63104 Len=0 TSval=1302927257 TSecr=2879173027"
"317","128.994825100","2a00:a040:0:4:face:b00c:3333:7020","2a00:a041:3c5d:4d00:b981:f170:feac:7cf9","TLSv1.3","1468","Application Data [TCP segment of a reassembled PDU]"
"318","128.994845807","2a00:a041:3c5d:4d00:b981:f170:feac:7cf9","2a00:a040:0:4:face:b00c:3333:7020","TCP","88","40466  >  443 [ACK] Seq=1361 Ack=17260 Win=65792 Len=0 TSval=1302927257 TSecr=2879173061"
"319","128.996610771","2a00:a040:0:4:face:b00c:3333:7020","2a00:a041:3c5d:4d00:b981:f170:feac:7cf9","TCP","1468","443  >  40466 [ACK] Seq=17260 Ack=1361 Win=31488 Len=1380 TSval=2879173062 TSecr=1302927219 [TCP segment of a reassembled PDU]"
"320","128.997051821","2a00:a040:0:4:face:b00c:3333:7020","2a00:a041:3c5d:4d00:b981:f170:feac:7cf9","TLSv1.3","1468","Application Data [TCP segment of a reassembled PDU]"
"321","128.997080143","2a00:a041:3c5d:4d00:b981:f170:feac:7cf9","2a00:a040:0:4:face:b00c:3333:7020","TCP","88","40466  >  443 [ACK] Seq=1361 Ack=20020 Win=65792 Len=0 TSval=1302927260 TSecr=2879173062"
"322","128.999602918","2a00:a040:0:4:face:b00c:3333:7020","2a00:a041:3c5d:4d00:b981:f170:feac:7cf9","TLSv1.3","1468","Application Data [TCP segment of a reassembled PDU]"
"323","129.002396544","2a00:a040:0:4:face:b00c:3333:7020","2a00:a041:3c5d:4d00:b981:f170:feac:7cf9","TCP","1468","443  >  40466 [PSH, ACK] Seq=21400 Ack=1361 Win=31488 Len=1380 TSval=2879173064 TSecr=1302927219 [TCP segment of a reassembled PDU]"
"324","129.002413928","2a00:a041:3c5d:4d00:b981:f170:feac:7cf9","2a00:a040:0:4:face:b00c:3333:7020","TCP","88","40466  >  443 [ACK] Seq=1361 Ack=22780 Win=65792 Len=0 TSval=1302927265 TSecr=2879173064"
"325","129.005546989","2a00:a040:0:4:face:b00c:3333:7020","2a00:a041:3c5d:4d00:b981:f170:feac:7cf9","TCP","1468","443  >  40466 [ACK] Seq=22780 Ack=1361 Win=31488 Len=1380 TSval=2879173068 TSecr=1302927227 [TCP segment of a reassembled PDU]"
"326","129.005733589","2a00:a040:0:4:face:b00c:3333:7020","2a00:a041:3c5d:4d00:b981:f170:feac:7cf9","TLSv1.3","1468","Application Data [TCP segment of a reassembled PDU]"
"327","129.005760334","2a00:a041:3c5d:4d00:b981:f170:feac:7cf9","2a00:a040:0:4:face:b00c:3333:7020","TCP","88","40466  >  443 [ACK] Seq=1361 Ack=25540 Win=63744 Len=0 TSval=1302927268 TSecr=2879173068"
"328","129.008706569","2a00:a040:0:4:face:b00c:3333:7020","2a00:a041:3c5d:4d00:b981:f170:feac:7cf9","TCP","1468","443  >  40466 [ACK] Seq=25540 Ack=1361 Win=31488 Len=1380 TSval=2879173069 TSecr=1302927227 [TCP segment of a reassembled PDU]"
"329","129.011897358","2a00:a040:0:4:face:b00c:3333:7020","2a00:a041:3c5d:4d00:b981:f170:feac:7cf9","TCP","1468","443  >  40466 [PSH, ACK] Seq=26920 Ack=1361 Win=31488 Len=1380 TSval=2879173069 TSecr=1302927227 [TCP segment of a reassembled PDU]"
"330","129.011919084","2a00:a041:3c5d:4d00:b981:f170:feac:7cf9","2a00:a040:0:4:face:b00c:3333:7020","TCP","88","40466  >  443 [ACK] Seq=1361 Ack=28300 Win=65792 Len=0 TSval=1302927275 TSecr=2879173069"
"331","129.014806991","2a00:a040:0:4:face:b00c:3333:7020","2a00:a041:3c5d:4d00:b981:f170:feac:7cf9","TLSv1.3","1468","Application Data [TCP segment of a reassembled PDU]"
"332","129.015357754","2a00:a040:0:4:face:b00c:3333:7020","2a00:a041:3c5d:4d00:b981:f170:feac:7cf9","TCP","1468","443  >  40466 [PSH, ACK] Seq=29680 Ack=1361 Win=31488 Len=1380 TSval=2879173071 TSecr=1302927234 [TCP segment of a reassembled PDU]"
"333","129.015377121","2a00:a041:3c5d:4d00:b981:f170:feac:7cf9","2a00:a040:0:4:face:b00c:3333:7020","TCP","88","40466  >  443 [ACK] Seq=1361 Ack=31060 Win=65792 Len=0 TSval=1302927278 TSecr=2879173071"
"334","129.020259749","2a00:a040:0:4:face:b00c:3333:7020","2a00:a041:3c5d:4d00:b981:f170:feac:7cf9","TLSv1.3","467","Application Data"
"335","129.020487172","2a00:a041:3c5d:4d00:b981:f170:feac:7cf9","2a00:a040:0:4:face:b00c:3333:7020","TCP","88","40466  >  443 [ACK] Seq=1361 Ack=31439 Win=65792 Len=0 TSval=1302927283 TSecr=2879173073"
"336","129.044986527","2a00:a041:3c5d:4d00:b981:f170:feac:7cf9","2a00:a040:0:4:face:b00c:3333:7020","TLSv1.3","678","Application Data"
"337","129.054516953","2a03:2880:f258:1c3:face:b00c:0:167","2a00:a041:3c5d:4d00:b981:f170:feac:7cf9","TLSv1.2","1382","Application Data"
"338","129.070582810","2a00:a040:0:4:face:b00c:3333:7020","2a00:a041:3c5d:4d00:b981:f170:feac:7cf9","TCP","88","443  >  40466 [ACK] Seq=31439 Ack=1951 Win=30976 Len=0 TSval=2879173138 TSecr=1302927308"
"339","129.082998532","2a00:a041:3c5d:4d00:b981:f170:feac:7cf9","2a03:2880:f258:1c3:face:b00c:0:167","TLSv1.2","181","Application Data"
"340","129.137096627","2a00:a040:0:4:face:b00c:3333:7020","2a00:a041:3c5d:4d00:b981:f170:feac:7cf9","TLSv1.3","418","Application Data"
"341","129.137503542","2a00:a040:0:4:face:b00c:3333:7020","2a00:a041:3c5d:4d00:b981:f170:feac:7cf9","TLSv1.3","111","Application Data"
"342","129.137612475","2a00:a041:3c5d:4d00:b981:f170:feac:7cf9","2a00:a040:0:4:face:b00c:3333:7020","TCP","88","40466  >  443 [ACK] Seq=1951 Ack=31792 Win=65792 Len=0 TSval=1302927400 TSecr=2879173205"
"343","129.137628252","2a00:a040:0:4:face:b00c:3333:7020","2a00:a041:3c5d:4d00:b981:f170:feac:7cf9","TCP","1468","443  >  40466 [ACK] Seq=31792 Ack=1951 Win=31488 Len=1380 TSval=2879173205 TSecr=1302927308 [TCP segment of a reassembled PDU]"
"344","129.140790580","2a00:a040:0:4:face:b00c:3333:7020","2a00:a041:3c5d:4d00:b981:f170:feac:7cf9","TLSv1.3","1468","Application Data [TCP segment of a reassembled PDU]"
"345","129.140816077","2a00:a041:3c5d:4d00:b981:f170:feac:7cf9","2a00:a040:0:4:face:b00c:3333:7020","TCP","88","40466  >  443 [ACK] Seq=1951 Ack=34552 Win=65792 Len=0 TSval=1302927403 TSecr=2879173205"
"346","129.141498194","2a00:a040:0:4:face:b00c:3333:7020","2a00:a041:3c5d:4d00:b981:f170:feac:7cf9","TCP","1468","443  >  40466 [ACK] Seq=34552 Ack=1951 Win=31488 Len=1380 TSval=2879173207 TSecr=1302927308 [TCP segment of a reassembled PDU]"
"347","129.143413221","2a00:a040:0:4:face:b00c:3333:7020","2a00:a041:3c5d:4d00:b981:f170:feac:7cf9","TCP","1468","443  >  40466 [PSH, ACK] Seq=35932 Ack=1951 Win=31488 Len=1380 TSval=2879173207 TSecr=1302927308 [TCP segment of a reassembled PDU]"
"348","129.143432755","2a00:a041:3c5d:4d00:b981:f170:feac:7cf9","2a00:a040:0:4:face:b00c:3333:7020","TCP","88","40466  >  443 [ACK] Seq=1951 Ack=37312 Win=65792 Len=0 TSval=1302927406 TSecr=2879173207"
"349","129.144101116","2a00:a040:0:4:face:b00c:3333:7020","2a00:a041:3c5d:4d00:b981:f170:feac:7cf9","TCP","1468","443  >  40466 [ACK] Seq=37312 Ack=1951 Win=31488 Len=1380 TSval=2879173209 TSecr=1302927308 [TCP segment of a reassembled PDU]"
"350","129.146305987","2a00:a040:0:4:face:b00c:3333:7020","2a00:a041:3c5d:4d00:b981:f170:feac:7cf9","TCP","1468","443  >  40466 [PSH, ACK] Seq=38692 Ack=1951 Win=31488 Len=1380 TSval=2879173209 TSecr=1302927308 [TCP segment of a reassembled PDU]"
"351","129.146324299","2a00:a041:3c5d:4d00:b981:f170:feac:7cf9","2a00:a040:0:4:face:b00c:3333:7020","TCP","88","40466  >  443 [ACK] Seq=1951 Ack=40072 Win=65792 Len=0 TSval=1302927409 TSecr=2879173209"
"352","129.146746174","2a00:a040:0:4:face:b00c:3333:7020","2a00:a041:3c5d:4d00:b981:f170:feac:7cf9","TCP","1468","443  >  40466 [ACK] Seq=40072 Ack=1951 Win=31488 Len=1380 TSval=2879173211 TSecr=1302927308 [TCP segment of a reassembled PDU]"
"353","129.149628550","2a00:a040:0:4:face:b00c:3333:7020","2a00:a041:3c5d:4d00:b981:f170:feac:7cf9","TCP","1468","443  >  40466 [PSH, ACK] Seq=41452 Ack=1951 Win=31488 Len=1380 TSval=2879173211 TSecr=1302927308 [TCP segment of a reassembled PDU]"
"354","129.149645361","2a00:a041:3c5d:4d00:b981:f170:feac:7cf9","2a00:a040:0:4:face:b00c:3333:7020","TCP","88","40466  >  443 [ACK] Seq=1951 Ack=42832 Win=65792 Len=0 TSval=1302927412 TSecr=2879173211"
"355","129.150654782","2a00:a040:0:4:face:b00c:3333:7020","2a00:a041:3c5d:4d00:b981:f170:feac:7cf9","TCP","1468","443  >  40466 [ACK] Seq=42832 Ack=1951 Win=31488 Len=1380 TSval=2879173213 TSecr=1302927308 [TCP segment of a reassembled PDU]"
"356","129.151979888","2a00:a040:0:4:face:b00c:3333:7020","2a00:a041:3c5d:4d00:b981:f170:feac:7cf9","TCP","1468","443  >  40466 [PSH, ACK] Seq=44212 Ack=1951 Win=31488 Len=1380 TSval=2879173213 TSecr=1302927308 [TCP segment of a reassembled PDU]"
"357","129.151998083","2a00:a041:3c5d:4d00:b981:f170:feac:7cf9","2a00:a040:0:4:face:b00c:3333:7020","TCP","88","40466  >  443 [ACK] Seq=1951 Ack=45592 Win=65792 Len=0 TSval=1302927415 TSecr=2879173213"
"358","129.152725342","2a03:2880:f258:1c3:face:b00c:0:167","2a00:a041:3c5d:4d00:b981:f170:feac:7cf9","TLSv1.2","1318","Application Data"
"359","129.156497903","2a00:a040:0:4:face:b00c:3333:7020","2a00:a041:3c5d:4d00:b981:f170:feac:7cf9","TCP","1468","443  >  40466 [ACK] Seq=45592 Ack=1951 Win=31488 Len=1380 TSval=2879173214 TSecr=1302927308 [TCP segment of a reassembled PDU]"
"360","129.156727806","2a00:a040:0:4:face:b00c:3333:7020","2a00:a041:3c5d:4d00:b981:f170:feac:7cf9","TLSv1.3","1468","Application Data [TCP segment of a reassembled PDU]"
"361","129.156746691","2a00:a041:3c5d:4d00:b981:f170:feac:7cf9","2a00:a040:0:4:face:b00c:3333:7020","TCP","88","40466  >  443 [ACK] Seq=1951 Ack=48352 Win=65792 Len=0 TSval=1302927419 TSecr=2879173214"
"362","129.158943519","2a00:a040:0:4:face:b00c:3333:7020","2a00:a041:3c5d:4d00:b981:f170:feac:7cf9","TCP","1468","443  >  40466 [ACK] Seq=48352 Ack=1951 Win=31488 Len=1380 TSval=2879173216 TSecr=1302927308 [TCP segment of a reassembled PDU]"
"363","129.159497250","2a00:a040:0:4:face:b00c:3333:7020","2a00:a041:3c5d:4d00:b981:f170:feac:7cf9","TLSv1.3","1157","Application Data, Application Data"
"364","129.159517037","2a00:a041:3c5d:4d00:b981:f170:feac:7cf9","2a00:a040:0:4:face:b00c:3333:7020","TCP","88","40466  >  443 [ACK] Seq=1951 Ack=50801 Win=65792 Len=0 TSval=1302927422 TSecr=2879173216"
"365","129.198069404","2a00:a041:3c5d:4d00:b981:f170:feac:7cf9","2a03:2880:f258:1c3:face:b00c:0:167","TCP","88","44122  >  443 [ACK] Seq=2229 Ack=22793 Win=3051 Len=0 TSval=2672931621 TSecr=1976683047"
"366","129.216951981","2a03:2880:f258:1c3:face:b00c:0:167","2a00:a041:3c5d:4d00:b981:f170:feac:7cf9","TCP","88","443  >  44122 [ACK] Seq=22793 Ack=2229 Win=866 Len=0 TSval=1976683119 TSecr=2672931506"
"367","129.246633719","2a03:2880:f258:1c3:face:b00c:0:167","2a00:a041:3c5d:4d00:b981:f170:feac:7cf9","TCP","1468","443  >  44122 [ACK] Seq=22793 Ack=2229 Win=866 Len=1380 TSval=1976683149 TSecr=2672931506 [TCP segment of a reassembled PDU]"
"368","129.246666607","2a00:a041:3c5d:4d00:b981:f170:feac:7cf9","2a03:2880:f258:1c3:face:b00c:0:167","TCP","88","44122  >  443 [ACK] Seq=2229 Ack=24173 Win=3072 Len=0 TSval=2672931669 TSecr=1976683149"
"369","129.247360370","2a03:2880:f258:1c3:face:b00c:0:167","2a00:a041:3c5d:4d00:b981:f170:feac:7cf9","TLSv1.2","130","Application Data"
"370","129.247380521","2a00:a041:3c5d:4d00:b981:f170:feac:7cf9","2a03:2880:f258:1c3:face:b00c:0:167","TCP","88","44122  >  443 [ACK] Seq=2229 Ack=24215 Win=3072 Len=0 TSval=2672931670 TSecr=1976683149"
"371","129.283068817","2a00:a041:3c5d:4d00:b981:f170:feac:7cf9","2a00:a040:0:4:face:b00c:3333:7020","TLSv1.3","677","Application Data"
"372","129.307808947","2a00:a040:0:4:face:b00c:3333:7020","2a00:a041:3c5d:4d00:b981:f170:feac:7cf9","TCP","88","443  >  40466 [ACK] Seq=50801 Ack=2540 Win=30976 Len=0 TSval=2879173377 TSecr=1302927546"
"373","129.328319051","2a00:a041:3c5d:4d00:b981:f170:feac:7cf9","2a03:2880:f258:1c3:face:b00c:0:167","TLSv1.2","181","Application Data"
"374","129.374405362","2a00:a040:0:4:face:b00c:3333:7020","2a00:a041:3c5d:4d00:b981:f170:feac:7cf9","TLSv1.3","418","Application Data"
"375","129.374898705","2a00:a040:0:4:face:b00c:3333:7020","2a00:a041:3c5d:4d00:b981:f170:feac:7cf9","TLSv1.3","111","Application Data"
"376","129.374898806","2a00:a040:0:4:face:b00c:3333:7020","2a00:a041:3c5d:4d00:b981:f170:feac:7cf9","TCP","1468","443  >  40466 [ACK] Seq=51154 Ack=2540 Win=31488 Len=1380 TSval=2879173444 TSecr=1302927546 [TCP segment of a reassembled PDU]"
"377","129.374912231","2a00:a041:3c5d:4d00:b981:f170:feac:7cf9","2a00:a040:0:4:face:b00c:3333:7020","TCP","88","40466  >  443 [ACK] Seq=2540 Ack=52534 Win=68608 Len=0 TSval=1302927638 TSecr=2879173444"
"378","129.376129636","2a00:a040:0:4:face:b00c:3333:7020","2a00:a041:3c5d:4d00:b981:f170:feac:7cf9","TLSv1.3","1468","Application Data [TCP segment of a reassembled PDU]"
"379","129.376587461","2a00:a040:0:4:face:b00c:3333:7020","2a00:a041:3c5d:4d00:b981:f170:feac:7cf9","TCP","1468","443  >  40466 [ACK] Seq=53914 Ack=2540 Win=31488 Len=1380 TSval=2879173445 TSecr=1302927546 [TCP segment of a reassembled PDU]"
"380","129.376596875","2a00:a041:3c5d:4d00:b981:f170:feac:7cf9","2a00:a040:0:4:face:b00c:3333:7020","TCP","88","40466  >  443 [ACK] Seq=2540 Ack=55294 Win=74112 Len=0 TSval=1302927639 TSecr=2879173444"
"381","129.377635994","2a00:a040:0:4:face:b00c:3333:7020","2a00:a041:3c5d:4d00:b981:f170:feac:7cf9","TCP","1468","443  >  40466 [PSH, ACK] Seq=55294 Ack=2540 Win=31488 Len=1380 TSval=2879173445 TSecr=1302927546 [TCP segment of a reassembled PDU]"
