"No.","Time","Source","Destination","Protocol","Length","Info"
"4","1.551100103","2a00:a041:3c5d:4d00:f026:68a8:26d8:6e81","2a00:a040:3:6::d539:18db","TCP","88","42656  >  443 [ACK] Seq=1 Ack=1 Win=8260 Len=0 TSval=2688268902 TSecr=731291186"
"5","1.567169751","2a00:a040:3:6::d539:18db","2a00:a041:3c5d:4d00:f026:68a8:26d8:6e81","TCP","88","[TCP ACKed unseen segment] 443  >  42656 [ACK] Seq=1 Ack=2 Win=501 Len=0 TSval=731336734 TSecr=2688178087"
"6","3.787618102","2a03:2880:f258:1c3:face:b00c:0:167","2a00:a041:3c5d:4d00:f026:68a8:26d8:6e81","TLSv1.2","337","Application Data"
"7","3.787638268","2a00:a041:3c5d:4d00:f026:68a8:26d8:6e81","2a03:2880:f258:1c3:face:b00c:0:167","TCP","88","50558  >  443 [ACK] Seq=1 Ack=250 Win=2193 Len=0 TSval=2406599792 TSecr=3064083458"
"8","4.094781917","2a03:2880:f258:1c3:face:b00c:0:167","2a00:a041:3c5d:4d00:f026:68a8:26d8:6e81","TLSv1.2","337","Application Data"
"9","4.094801268","2a00:a041:3c5d:4d00:f026:68a8:26d8:6e81","2a03:2880:f258:1c3:face:b00c:0:167","TCP","88","50558  >  443 [ACK] Seq=1 Ack=499 Win=2193 Len=0 TSval=2406600099 TSecr=3064083738"
"10","4.299316750","2a03:2880:f258:1c3:face:b00c:0:167","2a00:a041:3c5d:4d00:f026:68a8:26d8:6e81","TLSv1.2","385","Application Data"
"11","4.299335969","2a00:a041:3c5d:4d00:f026:68a8:26d8:6e81","2a03:2880:f258:1c3:face:b00c:0:167","TCP","88","50558  >  443 [ACK] Seq=1 Ack=796 Win=2215 Len=0 TSval=2406600304 TSecr=3064083945"
"12","4.504090299","2a03:2880:f258:1c3:face:b00c:0:167","2a00:a041:3c5d:4d00:f026:68a8:26d8:6e81","TLSv1.2","353","Application Data"
"13","4.504111120","2a00:a041:3c5d:4d00:f026:68a8:26d8:6e81","2a03:2880:f258:1c3:face:b00c:0:167","TCP","88","50558  >  443 [ACK] Seq=1 Ack=1061 Win=2236 Len=0 TSval=2406600509 TSecr=3064084178"
"14","4.811556843","2a03:2880:f258:1c3:face:b00c:0:167","2a00:a041:3c5d:4d00:f026:68a8:26d8:6e81","TLSv1.2","385","Application Data"
"15","4.811585903","2a00:a041:3c5d:4d00:f026:68a8:26d8:6e81","2a03:2880:f258:1c3:face:b00c:0:167","TCP","88","50558  >  443 [ACK] Seq=1 Ack=1358 Win=2258 Len=0 TSval=2406600816 TSecr=3064084437"
"16","5.119106636","2a03:2880:f258:1c3:face:b00c:0:167","2a00:a041:3c5d:4d00:f026:68a8:26d8:6e81","TLSv1.2","369","Application Data"
"17","5.119128726","2a00:a041:3c5d:4d00:f026:68a8:26d8:6e81","2a03:2880:f258:1c3:face:b00c:0:167","TCP","88","50558  >  443 [ACK] Seq=1 Ack=1639 Win=2280 Len=0 TSval=2406601124 TSecr=3064084797"
"18","5.323303854","2a03:2880:f258:1c3:face:b00c:0:167","2a00:a041:3c5d:4d00:f026:68a8:26d8:6e81","TLSv1.2","369","Application Data"
"19","5.323370694","2a00:a041:3c5d:4d00:f026:68a8:26d8:6e81","2a03:2880:f258:1c3:face:b00c:0:167","TCP","88","50558  >  443 [ACK] Seq=1 Ack=1920 Win=2301 Len=0 TSval=2406601328 TSecr=3064085033"
"20","7.269288587","2a03:2880:f258:1c3:face:b00c:0:167","2a00:a041:3c5d:4d00:f026:68a8:26d8:6e81","TLSv1.2","369","Application Data"
"21","7.269320944","2a00:a041:3c5d:4d00:f026:68a8:26d8:6e81","2a03:2880:f258:1c3:face:b00c:0:167","TCP","88","50558  >  443 [ACK] Seq=1 Ack=2201 Win=2323 Len=0 TSval=2406603274 TSecr=3064086981"
"23","7.576699669","2a03:2880:f258:1c3:face:b00c:0:167","2a00:a041:3c5d:4d00:f026:68a8:26d8:6e81","TLSv1.2","353","Application Data"
"24","7.576734691","2a00:a041:3c5d:4d00:f026:68a8:26d8:6e81","2a03:2880:f258:1c3:face:b00c:0:167","TCP","88","50558  >  443 [ACK] Seq=1 Ack=2466 Win=2344 Len=0 TSval=2406603581 TSecr=3064087219"
"25","8.088498071","2a03:2880:f258:1c3:face:b00c:0:167","2a00:a041:3c5d:4d00:f026:68a8:26d8:6e81","TLSv1.2","369","Application Data"
"26","8.088530502","2a00:a041:3c5d:4d00:f026:68a8:26d8:6e81","2a03:2880:f258:1c3:face:b00c:0:167","TCP","88","50558  >  443 [ACK] Seq=1 Ack=2747 Win=2366 Len=0 TSval=2406604093 TSecr=3064087780"
"27","8.310488615","2a00:a041:3c5d:4d00:f026:68a8:26d8:6e81","2a03:2880:f258:1c3:face:b00c:0:167","TLSv1.2","157","Application Data"
"28","8.312182330","2a03:2880:f258:1c3:face:b00c:0:167","2a00:a041:3c5d:4d00:f026:68a8:26d8:6e81","TLSv1.2","401","Application Data"
"29","8.312207275","2a00:a041:3c5d:4d00:f026:68a8:26d8:6e81","2a03:2880:f258:1c3:face:b00c:0:167","TCP","88","50558  >  443 [ACK] Seq=70 Ack=3060 Win=2387 Len=0 TSval=2406604317 TSecr=3064088033"
"30","8.503523833","2a03:2880:f258:1c3:face:b00c:0:167","2a00:a041:3c5d:4d00:f026:68a8:26d8:6e81","TCP","88","443  >  50558 [ACK] Seq=3060 Ack=70 Win=839 Len=0 TSval=3064088141 TSecr=2406604315"
"31","8.503927381","2a03:2880:f258:1c3:face:b00c:0:167","2a00:a041:3c5d:4d00:f026:68a8:26d8:6e81","TLSv1.2","159","Application Data"
"32","8.503941512","2a00:a041:3c5d:4d00:f026:68a8:26d8:6e81","2a03:2880:f258:1c3:face:b00c:0:167","TCP","88","50558  >  443 [ACK] Seq=70 Ack=3131 Win=2387 Len=0 TSval=2406604509 TSecr=3064088217"
"37","10.624961433","192.168.1.12","35.186.224.47","TLSv1.2","103","Application Data"
"38","10.643246133","35.186.224.47","192.168.1.12","TCP","68","443  >  55384 [ACK] Seq=1 Ack=36 Win=267 Len=0 TSval=3864455904 TSecr=509809795"
"39","10.715163882","35.186.224.47","192.168.1.12","TLSv1.2","99","Application Data"
"40","10.715211755","192.168.1.12","35.186.224.47","TCP","68","55384  >  443 [ACK] Seq=36 Ack=32 Win=501 Len=0 TSval=509809885 TSecr=3864455975"
"41","11.011656577","2a00:a041:3c5d:4d00:f026:68a8:26d8:6e81","2a03:2880:f258:1c3:face:b00c:0:167","TLSv1.2","154","Application Data"
"42","11.096876594","2a03:2880:f258:1c3:face:b00c:0:167","2a00:a041:3c5d:4d00:f026:68a8:26d8:6e81","TCP","88","443  >  50558 [ACK] Seq=3131 Ack=136 Win=839 Len=0 TSval=3064090825 TSecr=2406607016"
"44","13.008680768","2a00:a041:3c5d:4d00:f026:68a8:26d8:6e81","2a03:2880:f258:1c3:face:b00c:0:167","TLSv1.2","169","Application Data"
"45","13.010625589","2a00:a041:3c5d:4d00:f026:68a8:26d8:6e81","2a03:2880:f258:1c3:face:b00c:0:167","TLSv1.2","169","Application Data"
"47","13.088961572","2a03:2880:f258:1c3:face:b00c:0:167","2a00:a041:3c5d:4d00:f026:68a8:26d8:6e81","TCP","88","443  >  50558 [ACK] Seq=3131 Ack=217 Win=839 Len=0 TSval=3064092815 TSecr=2406609013"
"48","13.089295425","2a03:2880:f258:1c3:face:b00c:0:167","2a00:a041:3c5d:4d00:f026:68a8:26d8:6e81","TCP","88","443  >  50558 [ACK] Seq=3131 Ack=298 Win=839 Len=0 TSval=3064092815 TSecr=2406609015"
"49","13.426296936","2a00:a041:3c5d:4d00:f026:68a8:26d8:6e81","2a03:2880:f258:1c3:face:b00c:0:167","TLSv1.2","181","Application Data"
"50","13.503092700","2a03:2880:f258:1c3:face:b00c:0:167","2a00:a041:3c5d:4d00:f026:68a8:26d8:6e81","TCP","88","443  >  50558 [ACK] Seq=3131 Ack=391 Win=839 Len=0 TSval=3064093231 TSecr=2406609431"
"52","13.863705514","2a00:a041:3c5d:4d00:f026:68a8:26d8:6e81","2a03:2880:f258:1c3:face:b00c:0:167","TLSv1.2","181","Application Data"
"53","13.942704199","2a03:2880:f258:1c3:face:b00c:0:167","2a00:a041:3c5d:4d00:f026:68a8:26d8:6e81","TCP","88","443  >  50558 [ACK] Seq=3131 Ack=484 Win=839 Len=0 TSval=3064093670 TSecr=2406609868"
"58","15.886961249","2a00:a041:3c5d:4d00:f026:68a8:26d8:6e81","2600:1901:1:c36::","TCP","88","58024  >  443 [ACK] Seq=1 Ack=1 Win=501 Len=0 TSval=3604480944 TSecr=1010194375"
"59","15.904503988","2600:1901:1:c36::","2a00:a041:3c5d:4d00:f026:68a8:26d8:6e81","TCP","88","[TCP ACKed unseen segment] 443  >  58024 [ACK] Seq=1 Ack=2 Win=470 Len=0 TSval=1010239426 TSecr=3604300412"
"61","16.565844980","2a00:a041:3c5d:4d00:f026:68a8:26d8:6e81","2a03:2880:f258:c8:face:b00c:0:167","TLSv1.2","692","Application Data"
"62","16.644721338","2a03:2880:f258:c8:face:b00c:0:167","2a00:a041:3c5d:4d00:f026:68a8:26d8:6e81","TLSv1.2","1010","Application Data"
"63","16.644755994","2a00:a041:3c5d:4d00:f026:68a8:26d8:6e81","2a03:2880:f258:c8:face:b00c:0:167","TCP","88","46676  >  443 [ACK] Seq=605 Ack=923 Win=4427 Len=0 TSval=3109505798 TSecr=3897937523"
"64","16.645068580","2a03:2880:f258:c8:face:b00c:0:167","2a00:a041:3c5d:4d00:f026:68a8:26d8:6e81","TCP","88","443  >  46676 [ACK] Seq=1 Ack=605 Win=280 Len=0 TSval=3897937523 TSecr=3109505719"
"65","16.645072518","2a00:a041:3c5d:4d00:f026:68a8:26d8:6e81","2a03:2880:f258:c8:face:b00c:0:167","TCP","88","[TCP Dup ACK 63#1] 46676  >  443 [ACK] Seq=605 Ack=923 Win=4427 Len=0 TSval=3109505799 TSecr=3897937523"
"69","20.134060975","2a00:a041:3c5d:4d00:f026:68a8:26d8:6e81","2a03:2880:f258:1c3:face:b00c:0:167","TLSv1.2","181","Application Data"
"70","20.215978771","2a03:2880:f258:1c3:face:b00c:0:167","2a00:a041:3c5d:4d00:f026:68a8:26d8:6e81","TCP","88","443  >  50558 [ACK] Seq=3131 Ack=577 Win=839 Len=0 TSval=3064099944 TSecr=2406616139"
"71","20.653318657","2a00:a041:3c5d:4d00:f026:68a8:26d8:6e81","2a03:2880:f258:1c3:face:b00c:0:167","TLSv1.2","181","Application Data"
"72","20.732596463","2a03:2880:f258:1c3:face:b00c:0:167","2a00:a041:3c5d:4d00:f026:68a8:26d8:6e81","TCP","88","443  >  50558 [ACK] Seq=3131 Ack=670 Win=839 Len=0 TSval=3064100460 TSecr=2406616658"
"73","21.209162373","2a00:a041:3c5d:4d00:f026:68a8:26d8:6e81","2a03:2880:f258:1c3:face:b00c:0:167","TLSv1.2","181","Application Data"
"74","21.277147325","192.168.1.12","35.186.224.47","TLSv1.2","111","Application Data"
"75","21.286736518","2a03:2880:f258:1c3:face:b00c:0:167","2a00:a041:3c5d:4d00:f026:68a8:26d8:6e81","TCP","88","443  >  50558 [ACK] Seq=3131 Ack=763 Win=839 Len=0 TSval=3064101015 TSecr=2406617214"
"76","21.294687505","35.186.224.47","192.168.1.12","TCP","68","443  >  56432 [ACK] Seq=1 Ack=44 Win=268 Len=0 TSval=3401075166 TSecr=509820447"
"77","21.356515026","35.186.224.47","192.168.1.12","TLSv1.2","108","Application Data"
"78","21.356539003","192.168.1.12","35.186.224.47","TCP","68","56432  >  443 [ACK] Seq=44 Ack=41 Win=501 Len=0 TSval=509820526 TSecr=3401075228"
"79","22.168008883","2a00:a041:3c5d:4d00:f026:68a8:26d8:6e81","2a03:2880:f258:1c3:face:b00c:0:167","TLSv1.2","181","Application Data"
"81","22.245316475","2a03:2880:f258:1c3:face:b00c:0:167","2a00:a041:3c5d:4d00:f026:68a8:26d8:6e81","TCP","88","443  >  50558 [ACK] Seq=3131 Ack=856 Win=839 Len=0 TSval=3064101974 TSecr=2406618173"
"82","22.872836683","2a00:a041:3c5d:4d00:f026:68a8:26d8:6e81","2a03:2880:f258:1c3:face:b00c:0:167","TLSv1.2","181","Application Data"
"83","22.950053344","2a03:2880:f258:1c3:face:b00c:0:167","2a00:a041:3c5d:4d00:f026:68a8:26d8:6e81","TCP","88","443  >  50558 [ACK] Seq=3131 Ack=949 Win=839 Len=0 TSval=3064102679 TSecr=2406618877"
"84","23.154555608","2a00:a041:3c5d:4d00:f026:68a8:26d8:6e81","2a03:2880:f258:1c3:face:b00c:0:167","TLSv1.2","181","Application Data"
"85","23.239793111","2a03:2880:f258:1c3:face:b00c:0:167","2a00:a041:3c5d:4d00:f026:68a8:26d8:6e81","TCP","88","443  >  50558 [ACK] Seq=3131 Ack=1042 Win=839 Len=0 TSval=3064102969 TSecr=2406619159"
"86","23.414916299","2a00:a041:3c5d:4d00:f026:68a8:26d8:6e81","2a03:2880:f258:1c3:face:b00c:0:167","TLSv1.2","181","Application Data"
"89","23.493676695","2a03:2880:f258:1c3:face:b00c:0:167","2a00:a041:3c5d:4d00:f026:68a8:26d8:6e81","TCP","88","443  >  50558 [ACK] Seq=3131 Ack=1135 Win=839 Len=0 TSval=3064103222 TSecr=2406619419"
"90","23.672901791","2a00:a041:3c5d:4d00:f026:68a8:26d8:6e81","2a03:2880:f258:1c3:face:b00c:0:167","TLSv1.2","181","Application Data"
"91","23.751075523","2a03:2880:f258:1c3:face:b00c:0:167","2a00:a041:3c5d:4d00:f026:68a8:26d8:6e81","TCP","88","443  >  50558 [ACK] Seq=3131 Ack=1228 Win=839 Len=0 TSval=3064103480 TSecr=2406619677"
"92","24.511850425","2a00:a041:3c5d:4d00:f026:68a8:26d8:6e81","2a03:2880:f258:1c3:face:b00c:0:167","TLSv1.2","181","Application Data"
"93","24.588502568","2a03:2880:f258:1c3:face:b00c:0:167","2a00:a041:3c5d:4d00:f026:68a8:26d8:6e81","TCP","88","443  >  50558 [ACK] Seq=3131 Ack=1321 Win=839 Len=0 TSval=3064104317 TSecr=2406620516"
"100","26.131017041","2a00:a041:3c5d:4d00:f026:68a8:26d8:6e81","2600:1901:1:c36::","TCP","88","45392  >  443 [ACK] Seq=1 Ack=1 Win=501 Len=0 TSval=3604491188 TSecr=1389140273"
"101","26.154042573","2600:1901:1:c36::","2a00:a041:3c5d:4d00:f026:68a8:26d8:6e81","TCP","88","[TCP ACKed unseen segment] 443  >  45392 [ACK] Seq=1 Ack=2 Win=313 Len=0 TSval=1389185315 TSecr=3604354339"
"115","30.571147415","2a00:a041:3c5d:4d00:f026:68a8:26d8:6e81","2a03:2880:f276:1c2:face:b00c:0:167","TLSv1.2","112","Application Data"
"116","30.571190844","2a00:a041:3c5d:4d00:f026:68a8:26d8:6e81","2a03:2880:f276:1c2:face:b00c:0:167","TCP","88","51680  >  443 [FIN, ACK] Seq=25 Ack=1 Win=501 Len=0 TSval=2414035632 TSecr=2485985226"
"118","30.637798427","2a03:2880:f276:1c2:face:b00c:0:167","2a00:a041:3c5d:4d00:f026:68a8:26d8:6e81","TLSv1.2","112","Application Data"
"119","30.637827405","2a00:a041:3c5d:4d00:f026:68a8:26d8:6e81","2a03:2880:f276:1c2:face:b00c:0:167","TCP","76","51680  >  443 [RST] Seq=26 Win=0 Len=0"
"120","30.638420195","2a03:2880:f276:1c2:face:b00c:0:167","2a00:a041:3c5d:4d00:f026:68a8:26d8:6e81","TCP","88","443  >  51680 [FIN, ACK] Seq=25 Ack=26 Win=287 Len=0 TSval=2486045302 TSecr=2414035632"
"121","30.638426225","2a00:a041:3c5d:4d00:f026:68a8:26d8:6e81","2a03:2880:f276:1c2:face:b00c:0:167","TCP","76","51680  >  443 [RST] Seq=26 Win=0 Len=0"
"122","31.592561834","2a00:a041:3c5d:4d00:f026:68a8:26d8:6e81","2a03:2880:f258:1c3:face:b00c:0:167","TLSv1.2","157","Application Data"
"123","31.669052302","2a03:2880:f258:1c3:face:b00c:0:167","2a00:a041:3c5d:4d00:f026:68a8:26d8:6e81","TCP","88","443  >  50558 [ACK] Seq=3131 Ack=1390 Win=839 Len=0 TSval=3064111398 TSecr=2406627597"
"124","31.749347018","2a03:2880:f258:1c3:face:b00c:0:167","2a00:a041:3c5d:4d00:f026:68a8:26d8:6e81","TLSv1.2","159","Application Data"
"125","31.749382185","2a00:a041:3c5d:4d00:f026:68a8:26d8:6e81","2a03:2880:f258:1c3:face:b00c:0:167","TCP","88","50558  >  443 [ACK] Seq=1390 Ack=3202 Win=2387 Len=0 TSval=2406627754 TSecr=3064111478"
"127","40.510973415","192.168.1.12","146.75.122.248","TCP","68","47974  >  443 [ACK] Seq=1 Ack=1 Win=501 Len=0 TSval=859853230 TSecr=3141059529"
"128","40.515039130","192.168.1.12","146.75.122.248","TCP","68","47978  >  443 [ACK] Seq=1 Ack=1 Win=501 Len=0 TSval=859853234 TSecr=3845830832"
"129","40.592623064","146.75.122.248","192.168.1.12","TCP","68","[TCP ACKed unseen segment] 443  >  47974 [ACK] Seq=1 Ack=2 Win=287 Len=0 TSval=3141104613 TSecr=859717999"
"130","40.595630560","146.75.122.248","192.168.1.12","TCP","68","[TCP ACKed unseen segment] 443  >  47978 [ACK] Seq=1 Ack=2 Win=285 Len=0 TSval=3845875915 TSecr=859718074"
"131","41.598707660","192.168.1.12","35.186.224.47","TLSv1.2","103","Application Data"
"132","41.620051250","35.186.224.47","192.168.1.12","TCP","68","443  >  55384 [ACK] Seq=32 Ack=71 Win=267 Len=0 TSval=3864486879 TSecr=509840768"
"133","41.691748155","35.186.224.47","192.168.1.12","TLSv1.2","99","Application Data"
"134","41.691788793","192.168.1.12","35.186.224.47","TCP","68","55384  >  443 [ACK] Seq=71 Ack=63 Win=501 Len=0 TSval=509840861 TSecr=3864486951"
"135","46.607058977","2a00:a041:3c5d:4d00:f026:68a8:26d8:6e81","2a00:a040:3:6::d539:18db","TCP","88","[TCP Dup ACK 4#1] 42656  >  443 [ACK] Seq=1 Ack=1 Win=8260 Len=0 TSval=2688313958 TSecr=731336734"
"136","46.624103789","2a00:a040:3:6::d539:18db","2a00:a041:3c5d:4d00:f026:68a8:26d8:6e81","TCP","88","[TCP Dup ACK 5#1] [TCP ACKed unseen segment] 443  >  42656 [ACK] Seq=1 Ack=2 Win=501 Len=0 TSval=731381790 TSecr=2688178087"
"137","46.996765474","2a00:a041:3c5d:4d00:f026:68a8:26d8:6e81","2a03:2880:f258:1c3:face:b00c:0:167","TLSv1.2","157","Application Data"
"138","47.079185409","2a03:2880:f258:1c3:face:b00c:0:167","2a00:a041:3c5d:4d00:f026:68a8:26d8:6e81","TCP","88","443  >  50558 [ACK] Seq=3202 Ack=1459 Win=839 Len=0 TSval=3064126806 TSecr=2406643001"
"139","47.157903924","2a03:2880:f258:1c3:face:b00c:0:167","2a00:a041:3c5d:4d00:f026:68a8:26d8:6e81","TLSv1.2","159","Application Data"
"140","47.157936233","2a00:a041:3c5d:4d00:f026:68a8:26d8:6e81","2a03:2880:f258:1c3:face:b00c:0:167","TCP","88","50558  >  443 [ACK] Seq=1459 Ack=3273 Win=2387 Len=0 TSval=2406643162 TSecr=3064126885"
"145","51.357258651","192.168.1.12","35.186.224.47","TLSv1.2","111","Application Data"
"146","51.376743441","35.186.224.47","192.168.1.12","TCP","68","443  >  56432 [ACK] Seq=41 Ack=87 Win=268 Len=0 TSval=3401105247 TSecr=509850527"
"147","51.439113396","35.186.224.47","192.168.1.12","TLSv1.2","108","Application Data"
"148","51.439157083","192.168.1.12","35.186.224.47","TCP","68","56432  >  443 [ACK] Seq=87 Ack=81 Win=501 Len=0 TSval=509850609 TSecr=3401105309"
"163","60.943138589","2a00:a041:3c5d:4d00:f026:68a8:26d8:6e81","2600:1901:1:c36::","TCP","88","[TCP Dup ACK 58#1] 58024  >  443 [ACK] Seq=1 Ack=1 Win=501 Len=0 TSval=3604526000 TSecr=1010239426"
"164","60.959136733","2600:1901:1:c36::","2a00:a041:3c5d:4d00:f026:68a8:26d8:6e81","TCP","88","[TCP Dup ACK 59#1] [TCP ACKed unseen segment] 443  >  58024 [ACK] Seq=1 Ack=2 Win=470 Len=0 TSval=1010284481 TSecr=3604300412"
"165","62.054123513","2a03:2880:f258:1c3:face:b00c:0:167","2a00:a041:3c5d:4d00:f026:68a8:26d8:6e81","TCP","1468","443  >  50558 [ACK] Seq=3273 Ack=1459 Win=839 Len=1380 TSval=3064141685 TSecr=2406643162 [TCP segment of a reassembled PDU]"
"166","62.054155749","2a00:a041:3c5d:4d00:f026:68a8:26d8:6e81","2a03:2880:f258:1c3:face:b00c:0:167","TCP","88","50558  >  443 [ACK] Seq=1459 Ack=4653 Win=2409 Len=0 TSval=2406658059 TSecr=3064141685"
"167","62.054853870","2a03:2880:f258:1c3:face:b00c:0:167","2a00:a041:3c5d:4d00:f026:68a8:26d8:6e81","TLSv1.2","221","Application Data"
"168","62.054853950","2a03:2880:f258:1c3:face:b00c:0:167","2a00:a041:3c5d:4d00:f026:68a8:26d8:6e81","TLSv1.2","1345","Application Data"
"169","62.054863857","2a00:a041:3c5d:4d00:f026:68a8:26d8:6e81","2a03:2880:f258:1c3:face:b00c:0:167","TCP","88","50558  >  443 [ACK] Seq=1459 Ack=4786 Win=2409 Len=0 TSval=2406658059 TSecr=3064141685"
"170","62.054874335","2a00:a041:3c5d:4d00:f026:68a8:26d8:6e81","2a03:2880:f258:1c3:face:b00c:0:167","TCP","88","50558  >  443 [ACK] Seq=1459 Ack=6043 Win=2430 Len=0 TSval=2406658059 TSecr=3064141685"
"171","62.659103449","2a00:a041:3c5d:4d00:f026:68a8:26d8:6e81","2a03:2880:f258:1c3:face:b00c:0:167","TLSv1.2","181","Application Data"
"172","62.962976509","2a00:a041:3c5d:4d00:f026:68a8:26d8:6e81","2a03:2880:f258:1c3:face:b00c:0:167","TCP","181","[TCP Retransmission] 50558  >  443 [PSH, ACK] Seq=1459 Ack=6043 Win=2430 Len=93 TSval=2406658968 TSecr=3064141685"
"173","63.041970741","2a03:2880:f258:1c3:face:b00c:0:167","2a00:a041:3c5d:4d00:f026:68a8:26d8:6e81","TCP","88","443  >  50558 [ACK] Seq=6043 Ack=1552 Win=839 Len=0 TSval=3064142768 TSecr=2406658968"
"177","68.892492627","2a00:a041:3c5d:4d00:f026:68a8:26d8:6e81","2a03:2880:f258:1c3:face:b00c:0:167","TLSv1.2","157","Application Data"
"178","68.972025162","2a03:2880:f258:1c3:face:b00c:0:167","2a00:a041:3c5d:4d00:f026:68a8:26d8:6e81","TCP","88","443  >  50558 [ACK] Seq=6043 Ack=1621 Win=839 Len=0 TSval=3064148698 TSecr=2406664897"
"179","69.052609906","2a03:2880:f258:1c3:face:b00c:0:167","2a00:a041:3c5d:4d00:f026:68a8:26d8:6e81","TLSv1.2","159","Application Data"
"180","69.052640850","2a00:a041:3c5d:4d00:f026:68a8:26d8:6e81","2a03:2880:f258:1c3:face:b00c:0:167","TCP","88","50558  >  443 [ACK] Seq=1621 Ack=6114 Win=2430 Len=0 TSval=2406665057 TSecr=3064148777"
"189","69.687757507","2a00:a041:3c5d:4d00:f026:68a8:26d8:6e81","2600:1901:1:c36::","QUIC","1294","Initial, DCID=e6521b650fd2a510, PKN: 1, PING, CRYPTO, PING, PING, CRYPTO, PADDING, PING, PADDING, CRYPTO, CRYPTO, PING, CRYPTO, PING, CRYPTO, PADDING, PING, PADDING, CRYPTO, CRYPTO, PING, PADDING, PING, PADDING"
"190","69.687882818","2a00:a041:3c5d:4d00:f026:68a8:26d8:6e81","2600:1901:1:c36::","TLSv1.2","172","[TCP Previous segment not captured] , Application Data"
"191","69.687903155","2a00:a041:3c5d:4d00:f026:68a8:26d8:6e81","2600:1901:1:c36::","TLSv1.2","1450","Application Data, Application Data"
"192","69.717923182","2600:1901:1:c36::","2a00:a041:3c5d:4d00:f026:68a8:26d8:6e81","TCP","88","[TCP ACKed unseen segment] 443  >  45392 [ACK] Seq=1 Ack=1448 Win=324 Len=0 TSval=1389228883 TSecr=3604534744"
"193","69.718363828","2600:1901:1:c36::","2a00:a041:3c5d:4d00:f026:68a8:26d8:6e81","TLSv1.2","127","Application Data"
"194","69.744010119","2600:1901:1:c36::","2a00:a041:3c5d:4d00:f026:68a8:26d8:6e81","QUIC","1294","Initial, SCID=e6521b650fd2a510, PKN: 1, ACK, PADDING"
"195","69.763015046","2a00:a041:3c5d:4d00:f026:68a8:26d8:6e81","2600:1901:1:c36::","TCP","88","45392  >  443 [ACK] Seq=1448 Ack=40 Win=501 Len=0 TSval=3604534820 TSecr=1389228883"
"196","69.781578997","2a00:a041:3c5d:4d00:f026:68a8:26d8:6e81","2600:1901:1:c36::","QUIC","1294","Initial, DCID=e6521b650fd2a510, PKN: 3, PADDING, PING, PADDING"
"197","69.785713388","2600:1901:1:c36::","2a00:a041:3c5d:4d00:f026:68a8:26d8:6e81","QUIC","1294","Protected Payload (KP0)"
"198","69.786496811","2a00:a041:3c5d:4d00:f026:68a8:26d8:6e81","2600:1901:1:c36::","QUIC","226","Protected Payload (KP0), DCID=e6521b650fd2a510"
"199","69.801714628","2600:1901:1:c36::","2a00:a041:3c5d:4d00:f026:68a8:26d8:6e81","QUIC","1294","Protected Payload (KP0)"
"200","69.801993079","2a00:a041:3c5d:4d00:f026:68a8:26d8:6e81","2600:1901:1:c36::","QUIC","228","Protected Payload (KP0), DCID=e6521b650fd2a510"
"201","69.806736956","2600:1901:1:c36::","2a00:a041:3c5d:4d00:f026:68a8:26d8:6e81","QUIC","582","Protected Payload (KP0)"
"202","69.806840507","2a00:a041:3c5d:4d00:f026:68a8:26d8:6e81","2600:1901:1:c36::","QUIC","97","Protected Payload (KP0), DCID=e6521b650fd2a510"
"203","69.807376505","2600:1901:1:c36::","2a00:a041:3c5d:4d00:f026:68a8:26d8:6e81","QUIC","185","Protected Payload (KP0)"
"204","69.807437421","2a00:a041:3c5d:4d00:f026:68a8:26d8:6e81","2600:1901:1:c36::","QUIC","97","Protected Payload (KP0), DCID=e6521b650fd2a510"
"205","69.818311573","2600:1901:1:c36::","2a00:a041:3c5d:4d00:f026:68a8:26d8:6e81","QUIC","89","Protected Payload (KP0)"
"206","69.836670369","2600:1901:1:c36::","2a00:a041:3c5d:4d00:f026:68a8:26d8:6e81","TLSv1.2","156","Application Data"
"207","69.836700000","2a00:a041:3c5d:4d00:f026:68a8:26d8:6e81","2600:1901:1:c36::","TCP","88","45392  >  443 [ACK] Seq=1448 Ack=108 Win=501 Len=0 TSval=3604534893 TSecr=1389229002"
"208","69.837350071","2600:1901:1:c36::","2a00:a041:3c5d:4d00:f026:68a8:26d8:6e81","TLSv1.2","302","Application Data"
"209","69.837350240","2600:1901:1:c36::","2a00:a041:3c5d:4d00:f026:68a8:26d8:6e81","TLSv1.2","173","Application Data"
"210","69.837350289","2600:1901:1:c36::","2a00:a041:3c5d:4d00:f026:68a8:26d8:6e81","TLSv1.2","127","Application Data"
"211","69.837365753","2a00:a041:3c5d:4d00:f026:68a8:26d8:6e81","2600:1901:1:c36::","TCP","88","45392  >  443 [ACK] Seq=1448 Ack=322 Win=500 Len=0 TSval=3604534894 TSecr=1389229002"
"212","69.837379008","2a00:a041:3c5d:4d00:f026:68a8:26d8:6e81","2600:1901:1:c36::","TCP","88","45392  >  443 [ACK] Seq=1448 Ack=407 Win=500 Len=0 TSval=3604534894 TSecr=1389229002"
"213","69.837383386","2a00:a041:3c5d:4d00:f026:68a8:26d8:6e81","2600:1901:1:c36::","TCP","88","45392  >  443 [ACK] Seq=1448 Ack=446 Win=500 Len=0 TSval=3604534894 TSecr=1389229002"
"214","69.838824492","2a00:a041:3c5d:4d00:f026:68a8:26d8:6e81","2600:1901:1:c36::","TLSv1.2","123","Application Data"
"215","69.838858584","2a00:a041:3c5d:4d00:f026:68a8:26d8:6e81","2600:1901:1:c36::","TLSv1.2","127","Application Data"
"216","69.859317159","2600:1901:1:c36::","2a00:a041:3c5d:4d00:f026:68a8:26d8:6e81","TCP","88","443  >  45392 [ACK] Seq=446 Ack=1522 Win=324 Len=0 TSval=1389229025 TSecr=3604534895"
"217","72.634101712","192.168.1.12","35.186.224.47","TLSv1.2","103","Application Data"
"218","72.656343056","35.186.224.47","192.168.1.12","TCP","68","443  >  55384 [ACK] Seq=63 Ack=106 Win=267 Len=0 TSval=3864517916 TSecr=509871804"
"219","72.727811851","35.186.224.47","192.168.1.12","TLSv1.2","99","Application Data"
"220","72.727850258","192.168.1.12","35.186.224.47","TCP","68","55384  >  443 [ACK] Seq=106 Ack=94 Win=501 Len=0 TSval=509871897 TSecr=3864517987"
"221","76.649960090","2a00:a041:3c5d:4d00:f026:68a8:26d8:6e81","2a03:2880:f258:c8:face:b00c:0:167","TLSv1.2","112","Application Data"
"222","76.650009661","2a00:a041:3c5d:4d00:f026:68a8:26d8:6e81","2a03:2880:f258:c8:face:b00c:0:167","TCP","88","46676  >  443 [FIN, ACK] Seq=629 Ack=923 Win=4427 Len=0 TSval=3109565804 TSecr=3897937523"
"223","76.730361304","2a03:2880:f258:c8:face:b00c:0:167","2a00:a041:3c5d:4d00:f026:68a8:26d8:6e81","TCP","100","[TCP Dup ACK 62#1] 443  >  46676 [ACK] Seq=923 Ack=605 Win=280 Len=0 TSval=3897997606 TSecr=3109505799 SLE=629 SRE=630"
"224","76.730779834","2a03:2880:f258:c8:face:b00c:0:167","2a00:a041:3c5d:4d00:f026:68a8:26d8:6e81","TCP","88","443  >  46676 [ACK] Seq=923 Ack=630 Win=280 Len=0 TSval=3897997606 TSecr=3109565804"
"225","76.730779861","2a03:2880:f258:c8:face:b00c:0:167","2a00:a041:3c5d:4d00:f026:68a8:26d8:6e81","TLSv1.2","112","Application Data"
"226","76.730779881","2a03:2880:f258:c8:face:b00c:0:167","2a00:a041:3c5d:4d00:f026:68a8:26d8:6e81","TCP","88","443  >  46676 [FIN, ACK] Seq=947 Ack=630 Win=280 Len=0 TSval=3897997606 TSecr=3109565804"
"227","76.730805329","2a00:a041:3c5d:4d00:f026:68a8:26d8:6e81","2a03:2880:f258:c8:face:b00c:0:167","TCP","76","46676  >  443 [RST] Seq=630 Win=0 Len=0"
"228","76.730818113","2a00:a041:3c5d:4d00:f026:68a8:26d8:6e81","2a03:2880:f258:c8:face:b00c:0:167","TCP","76","46676  >  443 [RST] Seq=630 Win=0 Len=0"
"233","81.440161159","192.168.1.12","35.186.224.47","TLSv1.2","111","Application Data"
"234","81.496965438","35.186.224.47","192.168.1.12","TCP","68","443  >  56432 [ACK] Seq=81 Ack=130 Win=268 Len=0 TSval=3401135330 TSecr=509880610"
"235","81.520690704","35.186.224.47","192.168.1.12","TLSv1.2","108","Application Data"
"236","81.520732932","192.168.1.12","35.186.224.47","TCP","68","56432  >  443 [ACK] Seq=130 Ack=121 Win=501 Len=0 TSval=509880690 TSecr=3401135392"
"245","85.595102030","192.168.1.12","146.75.122.248","TCP","68","[TCP Dup ACK 127#1] 47974  >  443 [ACK] Seq=1 Ack=1 Win=501 Len=0 TSval=859898314 TSecr=3141104613"
"246","85.596887026","2a03:2880:f258:1c3:face:b00c:0:167","2a00:a041:3c5d:4d00:f026:68a8:26d8:6e81","TLSv1.2","286","Application Data"
"247","85.596918213","2a00:a041:3c5d:4d00:f026:68a8:26d8:6e81","2a03:2880:f258:1c3:face:b00c:0:167","TCP","88","50558  >  443 [ACK] Seq=1621 Ack=6312 Win=2430 Len=0 TSval=2406681601 TSecr=3064165264"
"248","85.597344515","2a03:2880:f258:1c3:face:b00c:0:167","2a00:a041:3c5d:4d00:f026:68a8:26d8:6e81","TLSv1.2","232","Application Data"
"249","85.597344700","2a03:2880:f258:1c3:face:b00c:0:167","2a00:a041:3c5d:4d00:f026:68a8:26d8:6e81","TLSv1.2","270","Application Data"
"250","85.597364867","2a00:a041:3c5d:4d00:f026:68a8:26d8:6e81","2a03:2880:f258:1c3:face:b00c:0:167","TCP","88","50558  >  443 [ACK] Seq=1621 Ack=6456 Win=2430 Len=0 TSval=2406681602 TSecr=3064165266"
"251","85.597382910","2a00:a041:3c5d:4d00:f026:68a8:26d8:6e81","2a03:2880:f258:1c3:face:b00c:0:167","TCP","88","50558  >  443 [ACK] Seq=1621 Ack=6638 Win=2430 Len=0 TSval=2406681602 TSecr=3064165267"
"252","85.603012808","192.168.1.12","146.75.122.248","TCP","68","[TCP Dup ACK 128#1] 47978  >  443 [ACK] Seq=1 Ack=1 Win=501 Len=0 TSval=859898322 TSecr=3845875915"
"253","85.612993315","2a00:a041:3c5d:4d00:f026:68a8:26d8:6e81","2a03:2880:f258:1c3:face:b00c:0:167","TLSv1.2","185","Application Data"
"254","85.613603764","2a00:a041:3c5d:4d00:f026:68a8:26d8:6e81","2a03:2880:f258:1c3:face:b00c:0:167","TLSv1.2","191","Application Data"
"255","85.613929167","2a00:a041:3c5d:4d00:f026:68a8:26d8:6e81","2a03:2880:f258:1c3:face:b00c:0:167","TLSv1.2","185","Application Data"
"256","85.673057401","146.75.122.248","192.168.1.12","TCP","68","[TCP Dup ACK 129#1] [TCP ACKed unseen segment] 443  >  47974 [ACK] Seq=1 Ack=2 Win=287 Len=0 TSval=3141149693 TSecr=859717999"
"257","85.695973948","146.75.122.248","192.168.1.12","TCP","68","[TCP Dup ACK 130#1] [TCP ACKed unseen segment] 443  >  47978 [ACK] Seq=1 Ack=2 Win=285 Len=0 TSval=3845921015 TSecr=859718074"
"258","85.699607583","2a03:2880:f258:1c3:face:b00c:0:167","2a00:a041:3c5d:4d00:f026:68a8:26d8:6e81","TCP","88","443  >  50558 [ACK] Seq=6638 Ack=1718 Win=839 Len=0 TSval=3064165427 TSecr=2406681618"
"259","85.699993496","2a03:2880:f258:1c3:face:b00c:0:167","2a00:a041:3c5d:4d00:f026:68a8:26d8:6e81","TCP","88","443  >  50558 [ACK] Seq=6638 Ack=1821 Win=839 Len=0 TSval=3064165427 TSecr=2406681618"
"260","85.699993563","2a03:2880:f258:1c3:face:b00c:0:167","2a00:a041:3c5d:4d00:f026:68a8:26d8:6e81","TCP","88","443  >  50558 [ACK] Seq=6638 Ack=1918 Win=839 Len=0 TSval=3064165427 TSecr=2406681619"
"261","86.118182197","2a03:2880:f258:1c3:face:b00c:0:167","2a00:a041:3c5d:4d00:f026:68a8:26d8:6e81","TLSv1.2","233","Application Data"
"262","86.118677871","2a03:2880:f258:1c3:face:b00c:0:167","2a00:a041:3c5d:4d00:f026:68a8:26d8:6e81","TLSv1.2","270","Application Data"
"263","86.118678074","2a03:2880:f258:1c3:face:b00c:0:167","2a00:a041:3c5d:4d00:f026:68a8:26d8:6e81","TLSv1.2","256","Application Data"
"264","86.118845356","2a00:a041:3c5d:4d00:f026:68a8:26d8:6e81","2a03:2880:f258:1c3:face:b00c:0:167","TCP","88","50558  >  443 [ACK] Seq=1918 Ack=7133 Win=2430 Len=0 TSval=2406682123 TSecr=3064165835"
"265","86.119092318","2a03:2880:f258:1c3:face:b00c:0:167","2a00:a041:3c5d:4d00:f026:68a8:26d8:6e81","TLSv1.2","318","Application Data"
"266","86.119092501","2a03:2880:f258:1c3:face:b00c:0:167","2a00:a041:3c5d:4d00:f026:68a8:26d8:6e81","TLSv1.2","233","Application Data"
"267","86.119274481","2a00:a041:3c5d:4d00:f026:68a8:26d8:6e81","2a03:2880:f258:1c3:face:b00c:0:167","TCP","88","50558  >  443 [ACK] Seq=1918 Ack=7508 Win=2430 Len=0 TSval=2406682124 TSecr=3064165842"
"268","86.119370907","2a03:2880:f258:1c3:face:b00c:0:167","2a00:a041:3c5d:4d00:f026:68a8:26d8:6e81","TLSv1.2","278","Application Data"
"269","86.119371085","2a03:2880:f258:1c3:face:b00c:0:167","2a00:a041:3c5d:4d00:f026:68a8:26d8:6e81","TLSv1.2","414","Application Data"
"270","86.119479282","2a00:a041:3c5d:4d00:f026:68a8:26d8:6e81","2a03:2880:f258:1c3:face:b00c:0:167","TCP","88","50558  >  443 [ACK] Seq=1918 Ack=8024 Win=2452 Len=0 TSval=2406682124 TSecr=3064165845"
"271","86.123692713","2a00:a041:3c5d:4d00:f026:68a8:26d8:6e81","2a03:2880:f258:1c3:face:b00c:0:167","TLSv1.2","184","Application Data"
"272","86.124867137","2a00:a041:3c5d:4d00:f026:68a8:26d8:6e81","2a03:2880:f258:1c3:face:b00c:0:167","TLSv1.2","185","Application Data"
"273","86.126311193","2a00:a041:3c5d:4d00:f026:68a8:26d8:6e81","2a03:2880:f258:1c3:face:b00c:0:167","TLSv1.2","191","Application Data"
"274","86.130864379","2a00:a041:3c5d:4d00:f026:68a8:26d8:6e81","2a03:2880:f258:1c3:face:b00c:0:167","TLSv1.2","185","Application Data"
"275","86.130970287","2a00:a041:3c5d:4d00:f026:68a8:26d8:6e81","2a03:2880:f258:1c3:face:b00c:0:167","TLSv1.2","287","Application Data, Application Data"
"276","86.131230726","2a00:a041:3c5d:4d00:f026:68a8:26d8:6e81","2a03:2880:f258:1c3:face:b00c:0:167","TLSv1.2","185","Application Data"
"277","86.203915751","2a03:2880:f258:1c3:face:b00c:0:167","2a00:a041:3c5d:4d00:f026:68a8:26d8:6e81","TCP","88","443  >  50558 [ACK] Seq=8024 Ack=2014 Win=839 Len=0 TSval=3064165931 TSecr=2406682128"
"278","86.204748328","2a03:2880:f258:1c3:face:b00c:0:167","2a00:a041:3c5d:4d00:f026:68a8:26d8:6e81","TCP","88","443  >  50558 [ACK] Seq=8024 Ack=2111 Win=839 Len=0 TSval=3064165931 TSecr=2406682129"
"279","86.204748397","2a03:2880:f258:1c3:face:b00c:0:167","2a00:a041:3c5d:4d00:f026:68a8:26d8:6e81","TCP","88","443  >  50558 [ACK] Seq=8024 Ack=2214 Win=839 Len=0 TSval=3064165931 TSecr=2406682131"
"280","86.209598987","2a03:2880:f258:1c3:face:b00c:0:167","2a00:a041:3c5d:4d00:f026:68a8:26d8:6e81","TCP","88","443  >  50558 [ACK] Seq=8024 Ack=2311 Win=839 Len=0 TSval=3064165937 TSecr=2406682135"
"281","86.210029153","2a03:2880:f258:1c3:face:b00c:0:167","2a00:a041:3c5d:4d00:f026:68a8:26d8:6e81","TCP","88","443  >  50558 [ACK] Seq=8024 Ack=2510 Win=850 Len=0 TSval=3064165937 TSecr=2406682136"
"282","86.210029193","2a03:2880:f258:1c3:face:b00c:0:167","2a00:a041:3c5d:4d00:f026:68a8:26d8:6e81","TCP","88","443  >  50558 [ACK] Seq=8024 Ack=2607 Win=850 Len=0 TSval=3064165937 TSecr=2406682136"
"293","86.834990903","2a03:2880:f258:1c3:face:b00c:0:167","2a00:a041:3c5d:4d00:f026:68a8:26d8:6e81","TLSv1.2","270","Application Data"
"294","86.835347455","2a03:2880:f258:1c3:face:b00c:0:167","2a00:a041:3c5d:4d00:f026:68a8:26d8:6e81","TLSv1.2","254","Application Data"
"295","86.835526394","2a00:a041:3c5d:4d00:f026:68a8:26d8:6e81","2a03:2880:f258:1c3:face:b00c:0:167","TCP","88","50558  >  443 [ACK] Seq=2607 Ack=8372 Win=2452 Len=0 TSval=2406682840 TSecr=3064166496"
"296","86.838306535","2a00:a041:3c5d:4d00:f026:68a8:26d8:6e81","2a03:2880:f258:1c3:face:b00c:0:167","TLSv1.2","185","Application Data"
"297","86.839800798","2a00:a041:3c5d:4d00:f026:68a8:26d8:6e81","2a03:2880:f258:1c3:face:b00c:0:167","TLSv1.2","185","Application Data"
"298","86.918811017","2a03:2880:f258:1c3:face:b00c:0:167","2a00:a041:3c5d:4d00:f026:68a8:26d8:6e81","TCP","88","443  >  50558 [ACK] Seq=8372 Ack=2704 Win=850 Len=0 TSval=3064166646 TSecr=2406682843"
"299","86.919226174","2a03:2880:f258:1c3:face:b00c:0:167","2a00:a041:3c5d:4d00:f026:68a8:26d8:6e81","TCP","88","443  >  50558 [ACK] Seq=8372 Ack=2801 Win=850 Len=0 TSval=3064166646 TSecr=2406682844"
"312","91.663080250","2a00:a041:3c5d:4d00:f026:68a8:26d8:6e81","2a00:a040:3:6::d539:18db","TCP","88","[TCP Dup ACK 4#2] 42656  >  443 [ACK] Seq=1 Ack=1 Win=8260 Len=0 TSval=2688359014 TSecr=731381790"
"313","91.683697680","2a00:a040:3:6::d539:18db","2a00:a041:3c5d:4d00:f026:68a8:26d8:6e81","TCP","88","[TCP Dup ACK 5#2] [TCP ACKed unseen segment] 443  >  42656 [ACK] Seq=1 Ack=2 Win=501 Len=0 TSval=731426851 TSecr=2688178087"
"314","94.912268475","2a00:a041:3c5d:4d00:f026:68a8:26d8:6e81","2a03:2880:f258:1c3:face:b00c:0:167","TLSv1.2","157","Application Data"
"315","94.988856715","2a03:2880:f258:1c3:face:b00c:0:167","2a00:a041:3c5d:4d00:f026:68a8:26d8:6e81","TCP","88","443  >  50558 [ACK] Seq=8372 Ack=2870 Win=850 Len=0 TSval=3064174717 TSecr=2406690917"
"316","95.068734695","2a03:2880:f258:1c3:face:b00c:0:167","2a00:a041:3c5d:4d00:f026:68a8:26d8:6e81","TLSv1.2","159","Application Data"
"317","95.111022985","2a00:a041:3c5d:4d00:f026:68a8:26d8:6e81","2a03:2880:f258:1c3:face:b00c:0:167","TCP","88","50558  >  443 [ACK] Seq=2870 Ack=8443 Win=2452 Len=0 TSval=2406691116 TSecr=3064174797"
"325","102.195548598","2a03:2880:f258:1c3:face:b00c:0:167","2a00:a041:3c5d:4d00:f026:68a8:26d8:6e81","TLSv1.2","353","Application Data"
"326","102.195585089","2a00:a041:3c5d:4d00:f026:68a8:26d8:6e81","2a03:2880:f258:1c3:face:b00c:0:167","TCP","88","50558  >  443 [ACK] Seq=2870 Ack=8708 Win=2474 Len=0 TSval=2406698200 TSecr=3064181839"
"327","102.423008055","2a03:2880:f258:1c3:face:b00c:0:167","2a00:a041:3c5d:4d00:f026:68a8:26d8:6e81","TLSv1.2","369","Application Data"
"328","102.423028328","2a00:a041:3c5d:4d00:f026:68a8:26d8:6e81","2a03:2880:f258:1c3:face:b00c:0:167","TCP","88","50558  >  443 [ACK] Seq=2870 Ack=8989 Win=2495 Len=0 TSval=2406698428 TSecr=3064182063"
"329","102.573140096","2a00:a041:3c5d:4d00:f026:68a8:26d8:6e81","2a03:2880:f258:1c3:face:b00c:0:167","TLSv1.2","181","Application Data"
"330","102.574780728","2a03:2880:f258:1c3:face:b00c:0:167","2a00:a041:3c5d:4d00:f026:68a8:26d8:6e81","TLSv1.2","337","Application Data"
"331","102.574795605","2a00:a041:3c5d:4d00:f026:68a8:26d8:6e81","2a03:2880:f258:1c3:face:b00c:0:167","TCP","88","50558  >  443 [ACK] Seq=2963 Ack=9238 Win=2495 Len=0 TSval=2406698579 TSecr=3064182276"
"332","102.661590428","2a03:2880:f258:1c3:face:b00c:0:167","2a00:a041:3c5d:4d00:f026:68a8:26d8:6e81","TCP","88","443  >  50558 [ACK] Seq=9238 Ack=2963 Win=850 Len=0 TSval=3064182390 TSecr=2406698428"
"333","102.845825959","2a00:a041:3c5d:4d00:f026:68a8:26d8:6e81","2a03:2880:f258:1c3:face:b00c:0:167","TLSv1.2","181","Application Data"
"334","102.889062333","2a03:2880:f258:1c3:face:b00c:0:167","2a00:a041:3c5d:4d00:f026:68a8:26d8:6e81","TLSv1.2","369","Application Data"
"335","102.889085499","2a00:a041:3c5d:4d00:f026:68a8:26d8:6e81","2a03:2880:f258:1c3:face:b00c:0:167","TCP","88","50558  >  443 [ACK] Seq=3056 Ack=9519 Win=2517 Len=0 TSval=2406698894 TSecr=3064182617"
"336","102.923269245","2a03:2880:f258:1c3:face:b00c:0:167","2a00:a041:3c5d:4d00:f026:68a8:26d8:6e81","TCP","88","443  >  50558 [ACK] Seq=9519 Ack=3056 Win=850 Len=0 TSval=3064182651 TSecr=2406698850"
"337","103.085388529","2a00:a041:3c5d:4d00:f026:68a8:26d8:6e81","2a03:2880:f258:1c3:face:b00c:0:167","TLSv1.2","181","Application Data"
"338","103.151314948","2a03:2880:f258:1c3:face:b00c:0:167","2a00:a041:3c5d:4d00:f026:68a8:26d8:6e81","TLSv1.2","369","Application Data"
"339","103.151346881","2a00:a041:3c5d:4d00:f026:68a8:26d8:6e81","2a03:2880:f258:1c3:face:b00c:0:167","TCP","88","50558  >  443 [ACK] Seq=3149 Ack=9800 Win=2538 Len=0 TSval=2406699156 TSecr=3064182879"
"340","103.163115974","2a03:2880:f258:1c3:face:b00c:0:167","2a00:a041:3c5d:4d00:f026:68a8:26d8:6e81","TCP","88","443  >  50558 [ACK] Seq=9800 Ack=3149 Win=850 Len=0 TSval=3064182891 TSecr=2406699090"
"341","103.287812261","2a00:a041:3c5d:4d00:f026:68a8:26d8:6e81","2a03:2880:f258:1c3:face:b00c:0:167","TLSv1.2","181","Application Data"
"342","103.366847507","2a03:2880:f258:1c3:face:b00c:0:167","2a00:a041:3c5d:4d00:f026:68a8:26d8:6e81","TCP","88","443  >  50558 [ACK] Seq=9800 Ack=3242 Win=850 Len=0 TSval=3064183095 TSecr=2406699292"
"343","103.432272448","2a03:2880:f258:1c3:face:b00c:0:167","2a00:a041:3c5d:4d00:f026:68a8:26d8:6e81","TLSv1.2","337","Application Data"
"344","103.432302688","2a00:a041:3c5d:4d00:f026:68a8:26d8:6e81","2a03:2880:f258:1c3:face:b00c:0:167","TCP","88","50558  >  443 [ACK] Seq=3242 Ack=10049 Win=2538 Len=0 TSval=2406699437 TSecr=3064183145"
"345","103.615217665","2a00:a041:3c5d:4d00:f026:68a8:26d8:6e81","2a03:2880:f258:1c3:face:b00c:0:167","TLSv1.2","181","Application Data"
"346","103.617030796","192.168.1.12","35.186.224.47","TLSv1.2","103","Application Data"
"347","103.633132080","35.186.224.47","192.168.1.12","TCP","68","443  >  55384 [ACK] Seq=94 Ack=141 Win=267 Len=0 TSval=3864548895 TSecr=509902787"
"348","103.695901876","2a03:2880:f258:1c3:face:b00c:0:167","2a00:a041:3c5d:4d00:f026:68a8:26d8:6e81","TCP","88","443  >  50558 [ACK] Seq=10049 Ack=3335 Win=850 Len=0 TSval=3064183421 TSecr=2406699620"
"349","103.704989202","35.186.224.47","192.168.1.12","TLSv1.2","99","Application Data"
"350","103.705014103","192.168.1.12","35.186.224.47","TCP","68","55384  >  443 [ACK] Seq=141 Ack=125 Win=501 Len=0 TSval=509902875 TSecr=3864548966"
"351","103.773171546","2a00:a041:3c5d:4d00:f026:68a8:26d8:6e81","2a03:2880:f258:1c3:face:b00c:0:167","TLSv1.2","181","Application Data"
"352","103.849417918","2a03:2880:f258:1c3:face:b00c:0:167","2a00:a041:3c5d:4d00:f026:68a8:26d8:6e81","TCP","88","443  >  50558 [ACK] Seq=10049 Ack=3428 Win=850 Len=0 TSval=3064183577 TSecr=2406699778"
"353","106.003029818","2a00:a041:3c5d:4d00:f026:68a8:26d8:6e81","2600:1901:1:c36::","TCP","88","[TCP Dup ACK 58#2] 58024  >  443 [ACK] Seq=1 Ack=1 Win=501 Len=0 TSval=3604571060 TSecr=1010284481"
"354","106.021493608","2600:1901:1:c36::","2a00:a041:3c5d:4d00:f026:68a8:26d8:6e81","TCP","88","[TCP Dup ACK 59#2] [TCP ACKed unseen segment] 443  >  58024 [ACK] Seq=1 Ack=2 Win=470 Len=0 TSval=1010329543 TSecr=3604300412"
"355","107.315355389","2a03:2880:f258:1c3:face:b00c:0:167","2a00:a041:3c5d:4d00:f026:68a8:26d8:6e81","TLSv1.2","369","Application Data"
"356","107.315393650","2a00:a041:3c5d:4d00:f026:68a8:26d8:6e81","2a03:2880:f258:1c3:face:b00c:0:167","TCP","88","50558  >  443 [ACK] Seq=3428 Ack=10330 Win=2560 Len=0 TSval=2406703320 TSecr=3064187003"
"358","107.633731863","2a03:2880:f258:1c3:face:b00c:0:167","2a00:a041:3c5d:4d00:f026:68a8:26d8:6e81","TLSv1.2","337","Application Data"
"359","107.633750036","2a00:a041:3c5d:4d00:f026:68a8:26d8:6e81","2a03:2880:f258:1c3:face:b00c:0:167","TCP","88","50558  >  443 [ACK] Seq=3428 Ack=10579 Win=2560 Len=0 TSval=2406703638 TSecr=3064187297"
"360","107.663033240","2a00:a041:3c5d:4d00:f026:68a8:26d8:6e81","2a03:2880:f258:1c3:face:b00c:0:167","TLSv1.2","181","Application Data"
"361","107.739094174","2a03:2880:f258:1c3:face:b00c:0:167","2a00:a041:3c5d:4d00:f026:68a8:26d8:6e81","TCP","88","443  >  50558 [ACK] Seq=10579 Ack=3521 Win=850 Len=0 TSval=3064187467 TSecr=2406703668"
