"No.","Time","Source","Destination","Protocol","Length","Info"
"1","0.000000000","192.168.1.18","224.0.0.251","MDNS","101","Standard query 0x0000 SRV Roku 3   1GJ37V014681._airplay._tcp.local, ""QU"" question"
"2","0.000000452","192.168.1.18","224.0.0.251","MDNS","182","Standard query response 0x0000 SRV, cache flush 0 0 7000 1GJ37V014681.local A, cache flush 192.168.1.18 NSEC, cache flush Roku 3   1GJ37V014681._airplay._tcp.local NSEC, cache flush 1GJ37V014681.local"
"3","6.756179309","192.168.1.10","224.0.0.251","MDNS","91","Standard query 0x0000 PTR _raop._tcp.local, ""QU"" question PTR _airplay._tcp.local, ""QU"" question"
"4","8.029799724","192.168.1.12","157.240.221.60","TLSv1.2","135","Application Data"
"5","8.109784704","157.240.221.60","192.168.1.12","TCP","66","443  >  45474 [ACK] Seq=1 Ack=70 Win=325 Len=0 TSval=2015792411 TSecr=2063530553"
"6","8.292459927","157.240.221.60","192.168.1.12","TLSv1.2","137","Application Data"
"7","8.292496506","192.168.1.12","157.240.221.60","TCP","66","45474  >  443 [ACK] Seq=70 Ack=72 Win=501 Len=0 TSval=2063530816 TSecr=2015792526"
"8","9.101839674","192.168.1.12","157.240.221.60","TLSv1.2","132","Application Data"
"9","9.178415252","157.240.221.60","192.168.1.12","TCP","66","443  >  45474 [ACK] Seq=72 Ack=136 Win=325 Len=0 TSval=2015793480 TSecr=2063531626"
"10","9.278210657","157.240.221.60","192.168.1.12","TCP","1446","443  >  45474 [ACK] Seq=72 Ack=136 Win=325 Len=1380 TSval=2015793580 TSecr=2063531626 [TCP segment of a reassembled PDU]"
"11","9.278257243","192.168.1.12","157.240.221.60","TCP","66","45474  >  443 [ACK] Seq=136 Ack=1452 Win=493 Len=0 TSval=2063531802 TSecr=2015793580"
"12","9.278651205","157.240.221.60","192.168.1.12","TLSv1.2","416","Application Data, Application Data"
"13","9.278675077","192.168.1.12","157.240.221.60","TCP","66","45474  >  443 [ACK] Seq=136 Ack=1802 Win=493 Len=0 TSval=2063531802 TSecr=2015793580"
"14","9.730970747","192.168.1.12","157.240.221.60","TLSv1.2","162","Application Data"
"15","9.808792725","157.240.221.60","192.168.1.12","TCP","66","443  >  45474 [ACK] Seq=1802 Ack=232 Win=325 Len=0 TSval=2015794111 TSecr=2063532255"
"16","14.743223953","20.199.120.85","192.168.1.12","TCP","60","443  >  55954 [FIN, ACK] Seq=1 Ack=1 Win=7969 Len=0"
"17","14.743998918","192.168.1.12","20.199.120.85","TCP","54","55954  >  443 [FIN, ACK] Seq=1 Ack=2 Win=501 Len=0"
"18","14.825939814","20.199.120.85","192.168.1.12","TCP","60","443  >  55954 [ACK] Seq=2 Ack=2 Win=7969 Len=0"
"19","15.748354294","192.168.1.12","213.57.2.5","DNS","93","Standard query 0xc52f AAAA client.wns.windows.com OPT"
"20","15.748481054","192.168.1.12","213.57.2.5","DNS","93","Standard query 0x8c02 A client.wns.windows.com OPT"
"21","15.769169421","213.57.2.5","192.168.1.12","DNS","152","Standard query response 0x8c02 A client.wns.windows.com CNAME wns.notify.trafficmanager.net A 20.199.120.85 OPT"
"22","15.769655672","213.57.2.5","192.168.1.12","DNS","194","Standard query response 0xc52f AAAA client.wns.windows.com CNAME wns.notify.trafficmanager.net SOA tm1.dns-tm.com OPT"
"23","15.769962093","192.168.1.12","213.57.2.5","DNS","100","Standard query 0x1c2e AAAA wns.notify.trafficmanager.net OPT"
"24","15.828120100","213.57.2.5","192.168.1.12","DNS","161","Standard query response 0x1c2e AAAA wns.notify.trafficmanager.net SOA tm1.dns-tm.com OPT"
"25","15.828674652","192.168.1.12","20.199.120.85","TCP","74","43642  >  443 [SYN] Seq=0 Win=64240 Len=0 MSS=1460 SACK_PERM=1 TSval=2688765495 TSecr=0 WS=128"
"26","15.910774428","20.199.120.85","192.168.1.12","TCP","66","443  >  43642 [SYN, ACK] Seq=0 Ack=1 Win=8192 Len=0 MSS=1440 WS=1 SACK_PERM=1"
"27","15.910826858","192.168.1.12","20.199.120.85","TCP","54","43642  >  443 [ACK] Seq=1 Ack=1 Win=64256 Len=0"
"28","15.911231592","192.168.1.12","20.199.120.85","TLSv1.2","571","Client Hello"
"29","15.990789377","20.199.120.85","192.168.1.12","TCP","60","443  >  43642 [ACK] Seq=1 Ack=518 Win=7675 Len=0"
"30","15.991524223","20.199.120.85","192.168.1.12","TCP","1514","443  >  43642 [PSH, ACK] Seq=1 Ack=518 Win=7675 Len=1460 [TCP segment of a reassembled PDU]"
"31","15.991562299","192.168.1.12","20.199.120.85","TCP","54","43642  >  443 [ACK] Seq=518 Ack=1461 Win=63104 Len=0"
"32","15.992117300","20.199.120.85","192.168.1.12","TCP","1514","443  >  43642 [PSH, ACK] Seq=1461 Ack=518 Win=7675 Len=1460 [TCP segment of a reassembled PDU]"
"33","15.992131840","192.168.1.12","20.199.120.85","TCP","54","43642  >  443 [ACK] Seq=518 Ack=2921 Win=63104 Len=0"
"34","15.993640189","20.199.120.85","192.168.1.12","TCP","1514","443  >  43642 [PSH, ACK] Seq=2921 Ack=518 Win=7675 Len=1460 [TCP segment of a reassembled PDU]"
"35","15.993657037","192.168.1.12","20.199.120.85","TCP","54","43642  >  443 [ACK] Seq=518 Ack=4381 Win=63104 Len=0"
"36","15.994484775","20.199.120.85","192.168.1.12","TCP","1514","443  >  43642 [PSH, ACK] Seq=4381 Ack=518 Win=7675 Len=1460 [TCP segment of a reassembled PDU]"
"37","15.994498937","192.168.1.12","20.199.120.85","TCP","54","43642  >  443 [ACK] Seq=518 Ack=5841 Win=63104 Len=0"
"38","16.035533048","192.168.1.12","239.255.255.250","SSDP","215","M-SEARCH * HTTP/1.1 "
"39","16.075887996","20.199.120.85","192.168.1.12","TLSv1.2","141","Server Hello, Certificate, Certificate Status, Server Key Exchange, Server Hello Done"
"40","16.075920301","192.168.1.12","20.199.120.85","TCP","54","43642  >  443 [ACK] Seq=518 Ack=5928 Win=64128 Len=0"
"41","16.079216693","192.168.1.12","20.199.120.85","TLSv1.2","212","Client Key Exchange, Change Cipher Spec, Encrypted Handshake Message"
"42","16.165403454","192.168.1.18","192.168.1.12","SSDP","321","HTTP/1.1 200 OK "
"43","16.170992326","20.199.120.85","192.168.1.12","TLSv1.2","105","Change Cipher Spec, Encrypted Handshake Message"
"44","16.172458086","192.168.1.12","20.199.120.85","TLSv1.2","329","Application Data"
"45","16.250900969","20.199.120.85","192.168.1.12","TLSv1.2","334","Application Data"
"46","16.251807731","192.168.1.12","20.199.120.85","TLSv1.2","208","Application Data"
"47","16.333237608","20.199.120.85","192.168.1.12","TLSv1.2","157","Application Data"
"48","16.334089618","192.168.1.12","20.199.120.85","TLSv1.2","538","Application Data"
"49","16.490867217","20.199.120.85","192.168.1.12","TCP","60","443  >  43642 [ACK] Seq=6362 Ack=1589 Win=8192 Len=0"
"50","16.781541631","2a00:a041:3c5d:4d00:605e:f34d:a502:2044","2606:4700::6812:3a2","TCP","86","33082  >  443 [ACK] Seq=1 Ack=1 Win=501 Len=0 TSval=3512311952 TSecr=1346779302"
"51","16.821359779","20.199.120.85","192.168.1.12","TLSv1.2","407","Application Data"
"52","16.822287636","192.168.1.12","20.199.120.85","TLSv1.2","277","Application Data"
"53","16.831012077","192.168.1.10","224.0.0.251","MDNS","91","Standard query 0x0000 PTR _raop._tcp.local, ""QU"" question PTR _airplay._tcp.local, ""QU"" question"
"54","16.837138786","2606:4700::6812:3a2","2a00:a041:3c5d:4d00:605e:f34d:a502:2044","TCP","86","[TCP ACKed unseen segment] 443  >  33082 [ACK] Seq=1 Ack=2 Win=8 Len=0 TSval=1346824395 TSecr=3512131534"
"55","16.901201228","20.199.120.85","192.168.1.12","TLSv1.2","157","Application Data"
"56","16.941587051","192.168.1.12","20.199.120.85","TCP","54","43642  >  443 [ACK] Seq=1812 Ack=6818 Win=64128 Len=0"
"57","17.042922677","192.168.1.12","239.255.255.250","SSDP","215","M-SEARCH * HTTP/1.1 "
"58","18.020239070","192.168.1.18","192.168.1.12","SSDP","321","HTTP/1.1 200 OK "
"59","18.050604496","192.168.1.12","239.255.255.250","SSDP","215","M-SEARCH * HTTP/1.1 "
"60","18.646676551","192.168.1.12","157.240.251.60","TLSv1.2","90","Application Data"
"61","18.646735557","192.168.1.12","157.240.251.60","TCP","66","56688  >  443 [FIN, ACK] Seq=25 Ack=1 Win=566 Len=0 TSval=818599746 TSecr=305098878"
"62","18.713883163","192.168.1.18","192.168.1.12","SSDP","321","HTTP/1.1 200 OK "
"63","18.718920260","157.240.251.60","192.168.1.12","TCP","78","443  >  56688 [ACK] Seq=1 Ack=1 Win=270 Len=0 TSval=305158961 TSecr=818539736 SLE=25 SRE=26"
"64","18.719191331","157.240.251.60","192.168.1.12","TCP","66","443  >  56688 [ACK] Seq=1 Ack=26 Win=270 Len=0 TSval=305158961 TSecr=818599746"
"65","18.719191516","157.240.251.60","192.168.1.12","TLSv1.2","90","Application Data"
"66","18.719257764","192.168.1.12","157.240.251.60","TCP","54","56688  >  443 [RST] Seq=26 Win=0 Len=0"
"67","18.719588946","157.240.251.60","192.168.1.12","TCP","66","443  >  56688 [FIN, ACK] Seq=25 Ack=26 Win=270 Len=0 TSval=305158961 TSecr=818599746"
"68","18.719612964","192.168.1.12","157.240.251.60","TCP","54","56688  >  443 [RST] Seq=26 Win=0 Len=0"
"69","19.058668775","192.168.1.12","239.255.255.250","SSDP","215","M-SEARCH * HTTP/1.1 "
"70","20.067845327","192.168.1.18","192.168.1.12","SSDP","321","HTTP/1.1 200 OK "
"71","20.850394393","192.168.1.12","34.237.73.95","TLSv1.2","314","Application Data"
"72","21.091911517","34.237.73.95","192.168.1.12","TLSv1.2","335","Application Data"
"73","21.091964538","192.168.1.12","34.237.73.95","TCP","66","47150  >  443 [ACK] Seq=249 Ack=270 Win=499 Len=0 TSval=2581009143 TSecr=2964730002"
"74","21.167637739","Roku_83:14:62","IntelCor_eb:49:20","ARP","60","Who has 192.168.1.12? Tell 192.168.1.18"
"75","21.167655280","IntelCor_eb:49:20","Roku_83:14:62","ARP","42","192.168.1.12 is at b0:7d:64:eb:49:20"
"76","22.424156575","fe80::e2ce:c3ff:fe1a:1978","ff02::1","ICMPv6","174","Router Advertisement from e0:ce:c3:1a:19:78"
"77","22.433642730","fe80::a8c:14f0:c17c:d903","ff02::16","ICMPv6","150","Multicast Listener Report Message v2"
"78","22.732240171","192.168.1.15","224.0.0.251","MDNS","76","Standard query 0x0000 PTR _raop._tcp.local, ""QM"" question"
"79","22.732240378","fe80::1493:c5c7:83b:523d","ff02::fb","MDNS","96","Standard query 0x0000 PTR _raop._tcp.local, ""QM"" question"
"80","22.829550087","fe80::a8c:14f0:c17c:d903","ff02::16","ICMPv6","150","Multicast Listener Report Message v2"
"81","23.242284641","157.240.221.60","192.168.1.12","TCP","1446","443  >  45474 [ACK] Seq=1802 Ack=232 Win=325 Len=1380 TSval=2015807461 TSecr=2063532255 [TCP segment of a reassembled PDU]"
"82","23.242330613","192.168.1.12","157.240.221.60","TCP","66","45474  >  443 [ACK] Seq=232 Ack=3182 Win=493 Len=0 TSval=2063545766 TSecr=2015807461"
"83","23.242707615","157.240.221.60","192.168.1.12","TLSv1.2","292","Application Data, Application Data"
"84","23.242743041","192.168.1.12","157.240.221.60","TCP","66","45474  >  443 [ACK] Seq=232 Ack=3408 Win=493 Len=0 TSval=2063545766 TSecr=2015807461"
"85","23.586762467","192.168.1.12","157.240.221.60","TLSv1.2","162","Application Data"
"86","23.664287079","157.240.221.60","192.168.1.12","TCP","66","443  >  45474 [ACK] Seq=3408 Ack=328 Win=325 Len=0 TSval=2015807966 TSecr=2063546110"
"87","24.850910661","fe80::a8c:14f0:c17c:d903","ff02::2","ICMPv6","62","Router Solicitation"
"88","25.496214019","fe80::e2ce:c3ff:fe1a:1978","ff02::1","ICMPv6","174","Router Advertisement from e0:ce:c3:1a:19:78"
"89","25.505648535","fe80::a8c:14f0:c17c:d903","ff02::16","ICMPv6","150","Multicast Listener Report Message v2"
"90","26.509650301","fe80::a8c:14f0:c17c:d903","ff02::16","ICMPv6","150","Multicast Listener Report Message v2"
"91","26.724293440","192.168.1.10","224.0.0.251","MDNS","91","Standard query 0x0000 PTR _raop._tcp.local, ""QU"" question PTR _airplay._tcp.local, ""QU"" question"
"92","27.045498390","192.168.1.12","140.82.121.3","TCP","66","50876  >  443 [ACK] Seq=1 Ack=1 Win=501 Len=0 TSval=3270376001 TSecr=1114360173"
"93","27.133789893","140.82.121.3","192.168.1.12","TCP","66","[TCP ACKed unseen segment] 443  >  50876 [ACK] Seq=1 Ack=2 Win=72 Len=0 TSval=1114405257 TSecr=3270284479"
"94","29.898464778","157.240.221.60","192.168.1.12","TLSv1.2","944","Application Data"
"95","29.898508068","192.168.1.12","157.240.221.60","TCP","66","45474  >  443 [ACK] Seq=328 Ack=4286 Win=495 Len=0 TSval=2063552422 TSecr=2015813999"
"96","29.952231489","157.240.221.60","192.168.1.12","TCP","944","[TCP Spurious Retransmission] 443  >  45474 [PSH, ACK] Seq=3408 Ack=328 Win=325 Len=878 TSval=2015814253 TSecr=2063546110"
"97","29.952269218","192.168.1.12","157.240.221.60","TCP","78","[TCP Window Update] 45474  >  443 [ACK] Seq=328 Ack=4286 Win=501 Len=0 TSval=2063552476 TSecr=2015814253 SLE=3408 SRE=4286"
"98","30.005671178","192.168.1.12","157.240.221.60","TLSv1.2","135","Application Data"
"99","30.080008643","157.240.221.60","192.168.1.12","TCP","66","443  >  45474 [ACK] Seq=4286 Ack=397 Win=325 Len=0 TSval=2015814383 TSecr=2063552529"
"100","30.205001175","157.240.221.60","192.168.1.12","TLSv1.2","137","Application Data"
"101","30.205035727","192.168.1.12","157.240.221.60","TCP","66","45474  >  443 [ACK] Seq=397 Ack=4357 Win=501 Len=0 TSval=2063552729 TSecr=2015814497"
"102","30.295966443","192.168.1.12","157.240.221.60","TLSv1.2","160","Application Data"
"103","30.371684895","157.240.221.60","192.168.1.12","TCP","66","443  >  45474 [ACK] Seq=4357 Ack=491 Win=325 Len=0 TSval=2015814672 TSecr=2063552820"
"104","34.506378774","157.240.221.60","192.168.1.12","TLSv1.2","154","Application Data"
"105","34.506424383","192.168.1.12","157.240.221.60","TCP","66","45474  >  443 [ACK] Seq=491 Ack=4445 Win=501 Len=0 TSval=2063557030 TSecr=2015818713"
"106","34.510614265","192.168.1.12","157.240.221.60","TLSv1.2","147","Application Data"
"107","34.590097250","157.240.221.60","192.168.1.12","TCP","66","443  >  45474 [ACK] Seq=4445 Ack=572 Win=325 Len=0 TSval=2015818893 TSecr=2063557034"
"108","36.349652842","157.240.221.60","192.168.1.12","TLSv1.2","171","Application Data"
"109","36.372572578","192.168.1.12","157.240.221.60","TLSv1.2","140","Application Data"
"110","36.451033596","157.240.221.60","192.168.1.12","TCP","66","443  >  45474 [ACK] Seq=4550 Ack=646 Win=325 Len=0 TSval=2015820752 TSecr=2063558896"
"111","36.759655736","192.168.1.10","224.0.0.251","MDNS","91","Standard query 0x0000 PTR _raop._tcp.local, ""QU"" question PTR _airplay._tcp.local, ""QU"" question"
"112","41.613539971","192.168.1.12","140.82.113.26","TCP","66","48184  >  443 [ACK] Seq=1 Ack=1 Win=501 Len=0 TSval=3821721415 TSecr=1908966015"
"113","41.776588225","140.82.113.26","192.168.1.12","TCP","66","[TCP ACKed unseen segment] 443  >  48184 [ACK] Seq=1 Ack=2 Win=70 Len=0 TSval=1909011378 TSecr=3821676010"
"114","43.547303279","2a00:a041:3c5d:4d00:605e:f34d:a502:2044","2a00:a040:3:4:face:b00c:3333:7020","TLSv1.2","110","Application Data"
"115","43.547345311","2a00:a041:3c5d:4d00:605e:f34d:a502:2044","2a00:a040:3:4:face:b00c:3333:7020","TCP","86","46558  >  443 [FIN, ACK] Seq=25 Ack=1 Win=1444 Len=0 TSval=3909816727 TSecr=1775879275"
"116","43.564862783","2a00:a040:3:4:face:b00c:3333:7020","2a00:a041:3c5d:4d00:605e:f34d:a502:2044","TLSv1.2","110","Application Data"
"117","43.564911345","2a00:a041:3c5d:4d00:605e:f34d:a502:2044","2a00:a040:3:4:face:b00c:3333:7020","TCP","74","46558  >  443 [RST] Seq=26 Win=0 Len=0"
"118","43.564978675","2a00:a040:3:4:face:b00c:3333:7020","2a00:a041:3c5d:4d00:605e:f34d:a502:2044","TCP","86","443  >  46558 [FIN, ACK] Seq=25 Ack=26 Win=123 Len=0 TSval=1775939339 TSecr=3909816727"
"119","43.564986344","2a00:a041:3c5d:4d00:605e:f34d:a502:2044","2a00:a040:3:4:face:b00c:3333:7020","TCP","74","46558  >  443 [RST] Seq=26 Win=0 Len=0"
"120","46.691369293","192.168.1.12","157.240.221.60","TLSv1.2","135","Application Data"
"121","46.768143785","157.240.221.60","192.168.1.12","TCP","66","443  >  45474 [ACK] Seq=4550 Ack=715 Win=325 Len=0 TSval=2015831071 TSecr=2063569215"
"122","46.831666178","192.168.1.10","224.0.0.251","MDNS","91","Standard query 0x0000 PTR _raop._tcp.local, ""QU"" question PTR _airplay._tcp.local, ""QU"" question"
"123","46.896379865","157.240.221.60","192.168.1.12","TLSv1.2","137","Application Data"
"124","46.937553053","192.168.1.12","157.240.221.60","TCP","66","45474  >  443 [ACK] Seq=715 Ack=4621 Win=501 Len=0 TSval=2063569461 TSecr=2015831185"
"125","48.781498816","fe80::a8c:14f0:c17c:d903","fe80::e2ce:c3ff:fe1a:1978","ICMPv6","86","Neighbor Solicitation for fe80::e2ce:c3ff:fe1a:1978 from b0:7d:64:eb:49:20"
"126","48.828550005","fe80::e2ce:c3ff:fe1a:1978","fe80::a8c:14f0:c17c:d903","ICMPv6","78","Neighbor Advertisement fe80::e2ce:c3ff:fe1a:1978 (rtr, sol)"
"127","49.866552194","157.240.221.60","192.168.1.12","TLSv1.2","231","Application Data"
"128","49.866599499","192.168.1.12","157.240.221.60","TCP","66","45474  >  443 [ACK] Seq=715 Ack=4786 Win=500 Len=0 TSval=2063572390 TSecr=2015834079"
"129","49.871249919","192.168.1.12","157.240.221.60","TLSv1.2","166","Application Data"
"130","49.948849862","157.240.221.60","192.168.1.12","TCP","66","443  >  45474 [ACK] Seq=4786 Ack=815 Win=325 Len=0 TSval=2015834251 TSecr=2063572395"
"131","50.072361822","fe80::e2ce:c3ff:fe1a:1978","ff02::1","ICMPv6","174","Router Advertisement from e0:ce:c3:1a:19:78"
"132","50.081580174","fe80::a8c:14f0:c17c:d903","ff02::16","ICMPv6","150","Multicast Listener Report Message v2"
"133","50.541542458","fe80::a8c:14f0:c17c:d903","ff02::16","ICMPv6","150","Multicast Listener Report Message v2"
"134","53.655450295","fe80::e2ce:c3ff:fe1a:1978","fe80::a8c:14f0:c17c:d903","ICMPv6","86","Neighbor Solicitation for fe80::a8c:14f0:c17c:d903 from e0:ce:c3:1a:19:78"
"135","53.655486809","fe80::a8c:14f0:c17c:d903","fe80::e2ce:c3ff:fe1a:1978","ICMPv6","78","Neighbor Advertisement fe80::a8c:14f0:c17c:d903 (sol)"
"136","55.600824677","140.82.121.3","192.168.1.12","TLSv1.2","105","[TCP ACKed unseen segment] , Application Data"
"137","55.601212133","140.82.121.3","192.168.1.12","TLSv1.2","90","[TCP ACKed unseen segment] , Application Data"
"138","55.601212208","140.82.121.3","192.168.1.12","TCP","66","[TCP ACKed unseen segment] 443  >  50876 [FIN, ACK] Seq=64 Ack=2 Win=72 Len=0 TSval=1114433649 TSecr=3270284479"
"139","55.601270243","192.168.1.12","140.82.121.3","TCP","66","50876  >  443 [RST, ACK] Seq=2 Ack=65 Win=501 Len=0 TSval=3270404557 TSecr=1114433649"
"140","56.215070154","140.82.113.26","192.168.1.12","TLSv1.2","91","[TCP ACKed unseen segment] , Application Data"
"141","56.215288369","192.168.1.12","140.82.113.26","TLSv1.2","95","[TCP Previous segment not captured] , Application Data"
"142","56.419650454","140.82.113.26","192.168.1.12","TCP","66","[TCP ACKed unseen segment] 443  >  48184 [ACK] Seq=26 Ack=31 Win=70 Len=0 TSval=1909025972 TSecr=3821736017"
"143","56.727949437","192.168.1.10","224.0.0.251","MDNS","91","Standard query 0x0000 PTR _raop._tcp.local, ""QU"" question PTR _airplay._tcp.local, ""QU"" question"
"144","57.547274939","157.240.221.60","192.168.1.12","TCP","1446","443  >  45474 [ACK] Seq=4786 Ack=815 Win=325 Len=1380 TSval=2015841759 TSecr=2063572395 [TCP segment of a reassembled PDU]"
"145","57.548512621","157.240.221.60","192.168.1.12","TLSv1.2","548","Application Data, Application Data"
"146","57.548687233","192.168.1.12","157.240.221.60","TCP","66","45474  >  443 [ACK] Seq=815 Ack=6648 Win=493 Len=0 TSval=2063580072 TSecr=2015841759"
"147","57.853613580","157.240.221.60","192.168.1.12","TLSv1.2","1378","Application Data"
"148","57.896565704","157.240.221.60","192.168.1.12","TLSv1.2","207","Application Data"
"149","57.896601579","192.168.1.12","157.240.221.60","TCP","66","45474  >  443 [ACK] Seq=815 Ack=8101 Win=493 Len=0 TSval=2063580420 TSecr=2015842053"
"150","57.899760299","192.168.1.12","157.240.221.60","TLSv1.2","166","Application Data"
"151","57.978821370","157.240.221.60","192.168.1.12","TCP","66","443  >  45474 [ACK] Seq=8101 Ack=915 Win=325 Len=0 TSval=2015842281 TSecr=2063580423"
"152","58.001787566","192.168.1.12","157.240.221.60","TLSv1.2","162","Application Data"
"153","58.037304652","157.240.221.60","192.168.1.12","TLSv1.2","207","Application Data"
"154","58.041318322","192.168.1.12","157.240.221.60","TLSv1.2","166","Application Data"
"155","58.078408541","157.240.221.60","192.168.1.12","TCP","66","443  >  45474 [ACK] Seq=8242 Ack=1011 Win=325 Len=0 TSval=2015842380 TSecr=2063580525"
"156","58.123271592","157.240.221.60","192.168.1.12","TCP","66","443  >  45474 [ACK] Seq=8242 Ack=1111 Win=325 Len=0 TSval=2015842419 TSecr=2063580565"
"157","58.980166420","157.240.221.60","192.168.1.12","TCP","1446","443  >  45474 [ACK] Seq=8242 Ack=1111 Win=325 Len=1380 TSval=2015843217 TSecr=2063580565 [TCP segment of a reassembled PDU]"
"158","58.980636493","157.240.221.60","192.168.1.12","TLSv1.2","516","Application Data, Application Data"
"159","58.980770178","192.168.1.12","157.240.221.60","TCP","66","45474  >  443 [ACK] Seq=1111 Ack=10072 Win=493 Len=0 TSval=2063581504 TSecr=2015843217"
"160","59.390897336","157.240.221.60","192.168.1.12","TLSv1.2","207","Application Data"
"161","59.433483883","192.168.1.12","157.240.221.60","TCP","66","45474  >  443 [ACK] Seq=1111 Ack=10213 Win=501 Len=0 TSval=2063581957 TSecr=2015843586"
"162","59.696844771","157.240.221.60","192.168.1.12","TCP","1446","443  >  45474 [ACK] Seq=10213 Ack=1111 Win=325 Len=1380 TSval=2015843937 TSecr=2063581957 [TCP segment of a reassembled PDU]"
"163","59.696892309","192.168.1.12","157.240.221.60","TCP","66","45474  >  443 [ACK] Seq=1111 Ack=11593 Win=493 Len=0 TSval=2063582221 TSecr=2015843937"
"164","59.697364904","157.240.221.60","192.168.1.12","TLSv1.2","190","Application Data"
"165","59.697380555","192.168.1.12","157.240.221.60","TCP","66","45474  >  443 [ACK] Seq=1111 Ack=11717 Win=501 Len=0 TSval=2063582221 TSecr=2015843937"
"166","60.130719856","157.240.221.60","192.168.1.12","TLSv1.2","207","Application Data"
"167","60.130751106","192.168.1.12","157.240.221.60","TCP","66","45474  >  443 [ACK] Seq=1111 Ack=11858 Win=523 Len=0 TSval=2063582654 TSecr=2015844323"
"168","60.394526306","192.168.1.12","157.240.221.60","TLSv1.2","166","Application Data"
"169","60.396536921","192.168.1.12","157.240.221.60","TLSv1.2","166","Application Data"
"170","60.452686946","34.237.73.95","192.168.1.12","TLSv1.2","104","Application Data"
"171","60.452719395","192.168.1.12","34.237.73.95","TCP","66","47150  >  443 [ACK] Seq=249 Ack=308 Win=501 Len=0 TSval=2581048503 TSecr=2964769433"
"172","60.472695801","157.240.221.60","192.168.1.12","TCP","66","443  >  45474 [ACK] Seq=11858 Ack=1211 Win=325 Len=0 TSval=2015844774 TSecr=2063582918"
"173","60.473156908","157.240.221.60","192.168.1.12","TCP","66","443  >  45474 [ACK] Seq=11858 Ack=1311 Win=325 Len=0 TSval=2015844774 TSecr=2063582920"
"174","61.837472682","2a00:a041:3c5d:4d00:605e:f34d:a502:2044","2606:4700::6812:3a2","TCP","86","[TCP Dup ACK 50#1] 33082  >  443 [ACK] Seq=1 Ack=1 Win=501 Len=0 TSval=3512357008 TSecr=1346824395"
"175","61.854372363","2606:4700::6812:3a2","2a00:a041:3c5d:4d00:605e:f34d:a502:2044","TCP","86","[TCP Dup ACK 54#1] [TCP ACKed unseen segment] 443  >  33082 [ACK] Seq=1 Ack=2 Win=8 Len=0 TSval=1346869412 TSecr=3512131534"
"176","61.901557289","192.168.1.12","20.199.120.85","TCP","54","[TCP Keep-Alive] 43642  >  443 [ACK] Seq=1811 Ack=6818 Win=64128 Len=0"
"177","61.982802353","20.199.120.85","192.168.1.12","TCP","60","[TCP Keep-Alive ACK] 443  >  43642 [ACK] Seq=6818 Ack=1812 Win=7969 Len=0"
"178","64.441932605","192.168.1.12","157.240.221.60","TLSv1.2","162","Application Data"
"179","64.517902932","157.240.221.60","192.168.1.12","TCP","66","443  >  45474 [ACK] Seq=11858 Ack=1407 Win=325 Len=0 TSval=2015848821 TSecr=2063586966"
"180","64.622437965","192.168.1.12","157.240.221.60","TLSv1.2","162","Application Data"
"181","64.706739655","157.240.221.60","192.168.1.12","TCP","66","443  >  45474 [ACK] Seq=11858 Ack=1503 Win=325 Len=0 TSval=2015849008 TSecr=2063587146"
"182","64.826629276","192.168.1.12","157.240.221.60","TLSv1.2","162","Application Data"
"183","64.903673307","157.240.221.60","192.168.1.12","TCP","66","443  >  45474 [ACK] Seq=11858 Ack=1599 Win=325 Len=0 TSval=2015849206 TSecr=2063587350"
"184","66.763188405","192.168.1.10","224.0.0.251","MDNS","91","Standard query 0x0000 PTR _raop._tcp.local, ""QU"" question PTR _airplay._tcp.local, ""QU"" question"
"185","66.850381072","192.168.1.12","34.237.73.95","TLSv1.2","313","Application Data"
"186","67.069583454","34.237.73.95","192.168.1.12","TLSv1.2","336","Application Data"
"187","67.069629259","192.168.1.12","34.237.73.95","TCP","66","47150  >  443 [ACK] Seq=496 Ack=578 Win=499 Len=0 TSval=2581055120 TSecr=2964775994"
"188","71.785343234","192.168.1.12","157.240.221.60","TLSv1.2","135","Application Data"
"189","71.866152966","157.240.221.60","192.168.1.12","TCP","66","443  >  45474 [ACK] Seq=11858 Ack=1668 Win=325 Len=0 TSval=2015856168 TSecr=2063594309"
"190","72.087121246","157.240.221.60","192.168.1.12","TLSv1.2","137","Application Data"
"191","72.087194487","192.168.1.12","157.240.221.60","TCP","66","45474  >  443 [ACK] Seq=1668 Ack=11929 Win=523 Len=0 TSval=2063594611 TSecr=2015856282"
"192","73.112555984","fe80::e2ce:c3ff:fe1a:1978","ff02::1","ICMPv6","174","Router Advertisement from e0:ce:c3:1a:19:78"
"193","73.121687785","fe80::a8c:14f0:c17c:d903","ff02::16","ICMPv6","150","Multicast Listener Report Message v2"
"194","74.125594750","fe80::a8c:14f0:c17c:d903","ff02::16","ICMPv6","150","Multicast Listener Report Message v2"
"195","79.879511417","192.168.1.1","224.0.0.1","IGMPv2","42","Membership Query, general"
"196","79.879511672","192.168.1.1","224.0.0.1","IGMPv3","46","Membership Query, general"
"197","79.879511719","fe80::e2ce:c3ff:fe1a:1978","ff02::1","ICMPv6","90","Multicast Listener Query"
"198","80.279590557","192.168.1.18","224.0.0.251","IGMPv2","60","Membership Report group 224.0.0.251"
"199","86.157690433","fe80::a8c:14f0:c17c:d903","ff02::16","ICMPv6","150","Multicast Listener Report Message v2"
"200","86.731271360","192.168.1.10","224.0.0.251","MDNS","91","Standard query 0x0000 PTR _raop._tcp.local, ""QU"" question PTR _airplay._tcp.local, ""QU"" question"
"201","92.158051874","20.199.120.85","192.168.1.12","TCP","60","443  >  43642 [FIN, ACK] Seq=6818 Ack=1812 Win=7969 Len=0"
"202","92.158717193","192.168.1.12","20.199.120.85","TCP","54","43642  >  443 [FIN, ACK] Seq=1812 Ack=6819 Win=64128 Len=0"
"203","92.240149740","20.199.120.85","192.168.1.12","TCP","60","443  >  43642 [ACK] Seq=6819 Ack=1813 Win=7969 Len=0"
"204","93.163943301","192.168.1.12","20.199.120.85","TCP","74","59308  >  443 [SYN] Seq=0 Win=64240 Len=0 MSS=1460 SACK_PERM=1 TSval=2688842831 TSecr=0 WS=128"
"205","93.269214695","20.199.120.85","192.168.1.12","TCP","66","443  >  59308 [SYN, ACK] Seq=0 Ack=1 Win=8192 Len=0 MSS=1440 WS=1 SACK_PERM=1"
"206","93.269293207","192.168.1.12","20.199.120.85","TCP","54","59308  >  443 [ACK] Seq=1 Ack=1 Win=64256 Len=0"
"207","93.269827630","192.168.1.12","20.199.120.85","TLSv1.2","571","Client Hello"
"208","93.340014989","192.168.1.12","157.240.221.60","TLSv1.2","135","Application Data"
"209","93.350409667","20.199.120.85","192.168.1.12","TCP","60","443  >  59308 [ACK] Seq=1 Ack=518 Win=7675 Len=0"
"210","93.350999640","20.199.120.85","192.168.1.12","TCP","1514","443  >  59308 [PSH, ACK] Seq=1 Ack=518 Win=7675 Len=1460 [TCP segment of a reassembled PDU]"
"211","93.351033121","192.168.1.12","20.199.120.85","TCP","54","59308  >  443 [ACK] Seq=518 Ack=1461 Win=63104 Len=0"
"212","93.351746921","20.199.120.85","192.168.1.12","TCP","1514","443  >  59308 [PSH, ACK] Seq=1461 Ack=518 Win=7675 Len=1460 [TCP segment of a reassembled PDU]"
"213","93.351764775","192.168.1.12","20.199.120.85","TCP","54","59308  >  443 [ACK] Seq=518 Ack=2921 Win=63104 Len=0"
"214","93.354082593","20.199.120.85","192.168.1.12","TCP","1514","443  >  59308 [PSH, ACK] Seq=2921 Ack=518 Win=7675 Len=1460 [TCP segment of a reassembled PDU]"
"215","93.354100311","192.168.1.12","20.199.120.85","TCP","54","59308  >  443 [ACK] Seq=518 Ack=4381 Win=63104 Len=0"
"216","93.354876901","20.199.120.85","192.168.1.12","TCP","1514","443  >  59308 [PSH, ACK] Seq=4381 Ack=518 Win=7675 Len=1460 [TCP segment of a reassembled PDU]"
"217","93.354894585","192.168.1.12","20.199.120.85","TCP","54","59308  >  443 [ACK] Seq=518 Ack=5841 Win=63104 Len=0"
"218","93.418382789","157.240.221.60","192.168.1.12","TCP","66","443  >  45474 [ACK] Seq=11929 Ack=1737 Win=325 Len=0 TSval=2015877719 TSecr=2063615864"
"219","93.431426364","20.199.120.85","192.168.1.12","TLSv1.2","141","Server Hello, Certificate, Certificate Status, Server Key Exchange, Server Hello Done"
"220","93.431460201","192.168.1.12","20.199.120.85","TCP","54","59308  >  443 [ACK] Seq=518 Ack=5928 Win=64128 Len=0"
"221","93.434824681","192.168.1.12","20.199.120.85","TLSv1.2","212","Client Key Exchange, Change Cipher Spec, Encrypted Handshake Message"
"222","93.522088427","20.199.120.85","192.168.1.12","TLSv1.2","105","Change Cipher Spec, Encrypted Handshake Message"
"223","93.523382677","192.168.1.12","20.199.120.85","TLSv1.2","329","Application Data"
"224","93.531317299","157.240.221.60","192.168.1.12","TLSv1.2","137","Application Data"
"225","93.531352021","192.168.1.12","157.240.221.60","TCP","66","45474  >  443 [ACK] Seq=1737 Ack=12000 Win=523 Len=0 TSval=2063616055 TSecr=2015877834"
"226","93.602858138","20.199.120.85","192.168.1.12","TLSv1.2","336","Application Data"
"227","93.603689146","192.168.1.12","20.199.120.85","TLSv1.2","208","Application Data"
"228","93.898747516","20.199.120.85","192.168.1.12","TLSv1.2","157","Application Data"
"229","93.899533293","192.168.1.12","20.199.120.85","TLSv1.2","538","Application Data"
"230","94.103269623","20.199.120.85","192.168.1.12","TCP","60","443  >  59308 [ACK] Seq=6364 Ack=1589 Win=8192 Len=0"
"231","94.410589586","20.199.120.85","192.168.1.12","TLSv1.2","407","Application Data"
"232","94.411482878","192.168.1.12","20.199.120.85","TLSv1.2","277","Application Data"
"233","94.494997342","20.199.120.85","192.168.1.12","TLSv1.2","157","Application Data"
"234","94.541480731","192.168.1.12","20.199.120.85","TCP","54","59308  >  443 [ACK] Seq=1812 Ack=6820 Win=64128 Len=0"
"235","96.766608765","192.168.1.10","224.0.0.251","MDNS","91","Standard query 0x0000 PTR _raop._tcp.local, ""QU"" question PTR _airplay._tcp.local, ""QU"" question"
"236","101.517495555","192.168.1.12","140.82.113.26","TCP","66","[TCP Keep-Alive] 48184  >  443 [ACK] Seq=30 Ack=26 Win=501 Len=0 TSval=3821781319 TSecr=1909025972"
"237","101.885642500","140.82.113.26","192.168.1.12","TCP","66","[TCP Keep-Alive ACK] 443  >  48184 [ACK] Seq=26 Ack=31 Win=70 Len=0 TSval=1909071290 TSecr=3821736017"
"238","102.501505751","fe80::e2ce:c3ff:fe1a:1978","ff02::1","ICMPv6","174","Router Advertisement from e0:ce:c3:1a:19:78"
"239","102.513641031","fe80::a8c:14f0:c17c:d903","ff02::16","ICMPv6","150","Multicast Listener Report Message v2"
"240","102.850405185","fe80::a8c:14f0:c17c:d903","ff02::2","ICMPv6","62","Router Solicitation"
"241","102.957496427","fe80::a8c:14f0:c17c:d903","ff02::16","ICMPv6","150","Multicast Listener Report Message v2"
"242","103.935824249","192.168.1.15","224.0.0.251","MDNS","76","Standard query 0x0000 PTR _raop._tcp.local, ""QM"" question"
"243","103.935824470","fe80::1493:c5c7:83b:523d","ff02::fb","MDNS","96","Standard query 0x0000 PTR _raop._tcp.local, ""QM"" question"
"244","105.471388864","fe80::e2ce:c3ff:fe1a:1978","ff02::1","ICMPv6","174","Router Advertisement from e0:ce:c3:1a:19:78"
"245","105.481639205","fe80::a8c:14f0:c17c:d903","ff02::16","ICMPv6","150","Multicast Listener Report Message v2"
"246","105.773495296","fe80::a8c:14f0:c17c:d903","ff02::16","ICMPv6","150","Multicast Listener Report Message v2"
"247","106.596525115","157.240.221.60","192.168.1.12","TLSv1.2","154","Application Data"
"248","106.596566771","192.168.1.12","157.240.221.60","TCP","66","45474  >  443 [ACK] Seq=1737 Ack=12088 Win=523 Len=0 TSval=2063629120 TSecr=2015890867"
"249","106.629605000","192.168.1.12","157.240.221.60","TLSv1.2","219","Application Data"
"250","106.711117457","157.240.221.60","192.168.1.12","TCP","66","443  >  45474 [ACK] Seq=12088 Ack=1890 Win=336 Len=0 TSval=2015891014 TSecr=2063629153"
"251","106.803451817","192.168.1.10","224.0.0.251","MDNS","91","Standard query 0x0000 PTR _raop._tcp.local, ""QU"" question PTR _airplay._tcp.local, ""QU"" question"
"252","106.893574988","2a00:a041:3c5d:4d00:605e:f34d:a502:2044","2606:4700::6812:3a2","TCP","86","[TCP Dup ACK 50#2] 33082  >  443 [ACK] Seq=1 Ack=1 Win=501 Len=0 TSval=3512402064 TSecr=1346869412"
"253","106.896144803","157.240.221.60","192.168.1.12","TLSv1.2","230","Application Data"
"254","106.908695067","2606:4700::6812:3a2","2a00:a041:3c5d:4d00:605e:f34d:a502:2044","TCP","86","[TCP Dup ACK 54#2] [TCP ACKed unseen segment] 443  >  33082 [ACK] Seq=1 Ack=2 Win=8 Len=0 TSval=1346914469 TSecr=3512131534"
"255","106.937554875","192.168.1.12","157.240.221.60","TCP","66","45474  >  443 [ACK] Seq=1890 Ack=12252 Win=544 Len=0 TSval=2063629461 TSecr=2015891130"
"256","106.973223848","192.168.1.12","157.240.221.60","TLSv1.2","138","Application Data"
"257","107.070075020","157.240.221.60","192.168.1.12","TCP","66","443  >  45474 [ACK] Seq=12252 Ack=1962 Win=336 Len=0 TSval=2015891372 TSecr=2063629497"
"258","112.013649907","fe80::a8c:14f0:c17c:d903","fe80::e2ce:c3ff:fe1a:1978","ICMPv6","86","Neighbor Solicitation for fe80::e2ce:c3ff:fe1a:1978 from b0:7d:64:eb:49:20"
"259","112.017293420","fe80::e2ce:c3ff:fe1a:1978","fe80::a8c:14f0:c17c:d903","ICMPv6","78","Neighbor Advertisement fe80::e2ce:c3ff:fe1a:1978 (rtr, sol)"
"260","112.273657970","192.168.1.12","34.237.73.95","TCP","66","[TCP Keep-Alive] 47150  >  443 [ACK] Seq=495 Ack=578 Win=501 Len=0 TSval=2581100324 TSecr=2964775994"
"261","112.536955082","34.237.73.95","192.168.1.12","TCP","66","[TCP Keep-Alive ACK] 443  >  47150 [ACK] Seq=578 Ack=496 Win=183 Len=0 TSval=2964821420 TSecr=2581055120"
"262","116.222947798","140.82.113.26","192.168.1.12","TLSv1.2","91","Application Data"
"263","116.223254110","192.168.1.12","140.82.113.26","TLSv1.2","95","Application Data"
"264","116.427038046","140.82.113.26","192.168.1.12","TCP","66","443  >  48184 [ACK] Seq=51 Ack=60 Win=70 Len=0 TSval=1909085979 TSecr=3821796025"
"265","116.631743310","fe80::e2ce:c3ff:fe1a:1978","fe80::a8c:14f0:c17c:d903","ICMPv6","86","Neighbor Solicitation for fe80::a8c:14f0:c17c:d903 from e0:ce:c3:1a:19:78"
"266","116.631778300","fe80::a8c:14f0:c17c:d903","fe80::e2ce:c3ff:fe1a:1978","ICMPv6","78","Neighbor Advertisement fe80::a8c:14f0:c17c:d903 (sol)"
"267","116.736265271","192.168.1.10","224.0.0.251","MDNS","91","Standard query 0x0000 PTR _raop._tcp.local, ""QU"" question PTR _airplay._tcp.local, ""QU"" question"
"268","121.850815453","192.168.1.12","34.237.73.95","TLSv1.2","314","Application Data"
"269","122.058447398","34.237.73.95","192.168.1.12","TLSv1.2","335","Application Data"
"270","122.058494559","192.168.1.12","34.237.73.95","TCP","66","47150  >  443 [ACK] Seq=744 Ack=847 Win=499 Len=0 TSval=2581110109 TSecr=2964830994"
"271","126.771942731","fe80::e2ce:c3ff:fe1a:1978","ff02::1","ICMPv6","174","Router Advertisement from e0:ce:c3:1a:19:78"
"272","126.771943440","192.168.1.10","224.0.0.251","MDNS","91","Standard query 0x0000 PTR _raop._tcp.local, ""QU"" question PTR _airplay._tcp.local, ""QU"" question"
"273","126.781647714","fe80::a8c:14f0:c17c:d903","ff02::16","ICMPv6","150","Multicast Listener Report Message v2"
"274","127.469585445","fe80::a8c:14f0:c17c:d903","ff02::16","ICMPv6","150","Multicast Listener Report Message v2"
"275","127.896515211","157.240.221.60","192.168.1.12","TLSv1.2","344","Application Data"
"276","127.896555452","192.168.1.12","157.240.221.60","TCP","66","45474  >  443 [ACK] Seq=1962 Ack=12530 Win=566 Len=0 TSval=2063650420 TSecr=2015912026"
"277","128.232196861","192.168.1.12","157.240.221.60","TLSv1.2","138","Application Data"
"278","128.309216140","157.240.221.60","192.168.1.12","TCP","66","443  >  45474 [ACK] Seq=12530 Ack=2034 Win=336 Len=0 TSval=2015912611 TSecr=2063650756"
"279","133.480244644","192.168.1.12","157.240.221.60","TLSv1.2","135","Application Data"
"280","133.560690999","157.240.221.60","192.168.1.12","TCP","66","443  >  45474 [ACK] Seq=12530 Ack=2103 Win=336 Len=0 TSval=2015917864 TSecr=2063656004"
"281","133.732313697","157.240.221.60","192.168.1.12","TLSv1.2","137","Application Data"
"282","133.732350650","192.168.1.12","157.240.221.60","TCP","66","45474  >  443 [ACK] Seq=2103 Ack=12601 Win=566 Len=0 TSval=2063656256 TSecr=2015917978"
"283","136.052632630","192.168.1.12","239.255.255.250","SSDP","215","M-SEARCH * HTTP/1.1 "
"284","136.599643286","192.168.1.18","192.168.1.12","SSDP","321","HTTP/1.1 200 OK "
"285","136.704686617","192.168.1.10","224.0.0.251","MDNS","91","Standard query 0x0000 PTR _raop._tcp.local, ""QU"" question PTR _airplay._tcp.local, ""QU"" question"
"286","137.058364633","192.168.1.12","239.255.255.250","SSDP","215","M-SEARCH * HTTP/1.1 "
"287","138.033381653","192.168.1.18","192.168.1.12","SSDP","321","HTTP/1.1 200 OK "
"288","138.066781497","192.168.1.12","239.255.255.250","SSDP","215","M-SEARCH * HTTP/1.1 "
"289","138.340568531","192.168.1.18","192.168.1.12","SSDP","321","HTTP/1.1 200 OK "
"290","139.074708765","192.168.1.12","239.255.255.250","SSDP","215","M-SEARCH * HTTP/1.1 "
"291","139.467638118","192.168.1.18","192.168.1.12","SSDP","321","HTTP/1.1 200 OK "
"292","139.661482531","192.168.1.12","20.199.120.85","TCP","54","[TCP Keep-Alive] 59308  >  443 [ACK] Seq=1811 Ack=6820 Win=64128 Len=0"
"293","139.749009148","20.199.120.85","192.168.1.12","TCP","60","[TCP Keep-Alive ACK] 443  >  59308 [ACK] Seq=6820 Ack=1812 Win=7969 Len=0"
"294","141.618740001","Roku_83:14:62","IntelCor_eb:49:20","ARP","60","Who has 192.168.1.12? Tell 192.168.1.18"
"295","141.618756916","IntelCor_eb:49:20","Roku_83:14:62","ARP","42","192.168.1.12 is at b0:7d:64:eb:49:20"
"296","144.383391010","fe80::e2ce:c3ff:fe1a:1978","ff02::1","ICMPv6","174","Router Advertisement from e0:ce:c3:1a:19:78"
"297","144.393573173","fe80::a8c:14f0:c17c:d903","ff02::16","ICMPv6","150","Multicast Listener Report Message v2"
"298","145.325531821","fe80::a8c:14f0:c17c:d903","ff02::16","ICMPv6","150","Multicast Listener Report Message v2"
"299","146.737877048","192.168.1.10","224.0.0.251","MDNS","91","Standard query 0x0000 PTR _raop._tcp.local, ""QU"" question PTR _airplay._tcp.local, ""QU"" question"
"300","150.238215817","192.168.1.12","157.240.221.60","TLSv1.2","135","Application Data"
"301","150.323880460","157.240.221.60","192.168.1.12","TCP","66","443  >  45474 [ACK] Seq=12601 Ack=2172 Win=336 Len=0 TSval=2015934627 TSecr=2063672762"
"302","150.553032838","157.240.221.60","192.168.1.12","TLSv1.2","137","Application Data"
"303","150.553067750","192.168.1.12","157.240.221.60","TCP","66","45474  >  443 [ACK] Seq=2172 Ack=12672 Win=566 Len=0 TSval=2063673077 TSecr=2015934741"
"304","151.949500016","2a00:a041:3c5d:4d00:605e:f34d:a502:2044","2606:4700::6812:3a2","TCP","86","[TCP Dup ACK 50#3] 33082  >  443 [ACK] Seq=1 Ack=1 Win=501 Len=0 TSval=3512447120 TSecr=1346914469"
"305","151.967310621","2606:4700::6812:3a2","2a00:a041:3c5d:4d00:605e:f34d:a502:2044","TCP","86","[TCP Dup ACK 54#3] [TCP ACKed unseen segment] 443  >  33082 [ACK] Seq=1 Ack=2 Win=8 Len=0 TSval=1346959527 TSecr=3512131534"
"306","156.158374815","157.240.221.60","192.168.1.12","TLSv1.2","767","Application Data"
"307","156.158416427","192.168.1.12","157.240.221.60","TCP","66","45474  >  443 [ACK] Seq=2172 Ack=13373 Win=587 Len=0 TSval=2063678682 TSecr=2015940419"
"308","156.401305133","192.168.1.12","157.240.221.60","TLSv1.2","165","Application Data"
"309","156.477953585","157.240.221.60","192.168.1.12","TCP","66","443  >  45474 [ACK] Seq=13373 Ack=2271 Win=336 Len=0 TSval=2015940780 TSecr=2063678925"
"310","156.773496826","192.168.1.10","224.0.0.251","MDNS","91","Standard query 0x0000 PTR _raop._tcp.local, ""QU"" question PTR _airplay._tcp.local, ""QU"" question"
"311","157.069574799","fe80::a8c:14f0:c17c:d903","fe80::e2ce:c3ff:fe1a:1978","ICMPv6","86","Neighbor Solicitation for fe80::e2ce:c3ff:fe1a:1978 from b0:7d:64:eb:49:20"
"312","157.072963255","fe80::e2ce:c3ff:fe1a:1978","fe80::a8c:14f0:c17c:d903","ICMPv6","78","Neighbor Advertisement fe80::e2ce:c3ff:fe1a:1978 (rtr, sol)"
"313","161.677669729","192.168.1.12","140.82.113.26","TCP","66","[TCP Keep-Alive] 48184  >  443 [ACK] Seq=59 Ack=51 Win=501 Len=0 TSval=3821841479 TSecr=1909085979"
"314","161.682343001","fe80::e2ce:c3ff:fe1a:1978","fe80::a8c:14f0:c17c:d903","ICMPv6","86","Neighbor Solicitation for fe80::a8c:14f0:c17c:d903 from e0:ce:c3:1a:19:78"
"315","161.682377975","fe80::a8c:14f0:c17c:d903","fe80::e2ce:c3ff:fe1a:1978","ICMPv6","78","Neighbor Advertisement fe80::a8c:14f0:c17c:d903 (sol)"
"316","161.894057181","140.82.113.26","192.168.1.12","TCP","66","[TCP Keep-Alive ACK] 443  >  48184 [ACK] Seq=51 Ack=60 Win=70 Len=0 TSval=1909131437 TSecr=3821796025"
"317","162.916741340","157.240.221.60","192.168.1.12","TCP","1446","443  >  45474 [ACK] Seq=13373 Ack=2271 Win=336 Len=1380 TSval=2015947008 TSecr=2063678925 [TCP segment of a reassembled PDU]"
"318","162.916790126","192.168.1.12","157.240.221.60","TCP","66","45474  >  443 [ACK] Seq=2271 Ack=14753 Win=609 Len=0 TSval=2063685440 TSecr=2015947008"
"319","162.916941689","157.240.221.60","192.168.1.12","TLSv1.2","199","Application Data"
"320","162.916948520","192.168.1.12","157.240.221.60","TCP","66","45474  >  443 [ACK] Seq=2271 Ack=14886 Win=631 Len=0 TSval=2063685441 TSecr=2015947008"
"321","162.917846187","157.240.221.60","192.168.1.12","TCP","1446","443  >  45474 [ACK] Seq=14886 Ack=2271 Win=336 Len=1380 TSval=2015947013 TSecr=2063678925 [TCP segment of a reassembled PDU]"
"322","162.917865159","192.168.1.12","157.240.221.60","TCP","66","45474  >  443 [ACK] Seq=2271 Ack=16266 Win=652 Len=0 TSval=2063685442 TSecr=2015947013"
"323","162.918096145","157.240.221.60","192.168.1.12","TLSv1.2","337","Application Data, Application Data"
"324","162.918115346","192.168.1.12","157.240.221.60","TCP","66","45474  >  443 [ACK] Seq=2271 Ack=16537 Win=674 Len=0 TSval=2063685442 TSecr=2015947013"
"325","163.118628199","192.168.1.12","213.57.2.5","DNS","101","Standard query 0x4e20 A media.fhfa1-1.fna.whatsapp.net OPT"
"326","163.118777070","192.168.1.12","213.57.2.5","DNS","101","Standard query 0xa85c AAAA media.fhfa1-1.fna.whatsapp.net OPT"
"327","163.138475878","213.57.2.5","192.168.1.12","DNS","129","Standard query response 0xa85c AAAA media.fhfa1-1.fna.whatsapp.net AAAA 2a00:a040:3:4:face:b00c:3333:7020 OPT"
"328","163.138980650","213.57.2.5","192.168.1.12","DNS","117","Standard query response 0x4e20 A media.fhfa1-1.fna.whatsapp.net A 213.57.24.97 OPT"
"329","163.139620672","2a00:a041:3c5d:4d00:605e:f34d:a502:2044","2a00:a040:3:4:face:b00c:3333:7020","TCP","94","50822  >  443 [SYN] Seq=0 Win=64800 Len=0 MSS=1440 SACK_PERM=1 TSval=3909936319 TSecr=0 WS=128"
"330","163.157194735","2a00:a040:3:4:face:b00c:3333:7020","2a00:a041:3c5d:4d00:605e:f34d:a502:2044","TCP","94","443  >  50822 [SYN, ACK] Seq=0 Ack=1 Win=31740 Len=0 MSS=1392 SACK_PERM=1 TSval=1756325955 TSecr=3909936319 WS=256"
"331","163.157232740","2a00:a041:3c5d:4d00:605e:f34d:a502:2044","2a00:a040:3:4:face:b00c:3333:7020","TCP","86","50822  >  443 [ACK] Seq=1 Ack=1 Win=64896 Len=0 TSval=3909936337 TSecr=1756325955"
"332","163.157959547","2a00:a041:3c5d:4d00:605e:f34d:a502:2044","2a00:a040:3:4:face:b00c:3333:7020","TLSv1.3","792","Client Hello"
"333","163.173656569","2a00:a040:3:4:face:b00c:3333:7020","2a00:a041:3c5d:4d00:605e:f34d:a502:2044","TCP","86","443  >  50822 [ACK] Seq=1 Ack=707 Win=31232 Len=0 TSval=1756325972 TSecr=3909936338"
"334","163.174069812","2a00:a040:3:4:face:b00c:3333:7020","2a00:a041:3c5d:4d00:605e:f34d:a502:2044","TLSv1.3","251","Server Hello, Application Data"
"335","163.174089821","2a00:a041:3c5d:4d00:605e:f34d:a502:2044","2a00:a040:3:4:face:b00c:3333:7020","TCP","86","50822  >  443 [ACK] Seq=707 Ack=166 Win=64768 Len=0 TSval=3909936354 TSecr=1756325972"
"336","163.174410474","2a00:a041:3c5d:4d00:605e:f34d:a502:2044","2a00:a040:3:4:face:b00c:3333:7020","TLSv1.3","92","Change Cipher Spec"
"337","163.174505615","2a00:a041:3c5d:4d00:605e:f34d:a502:2044","2a00:a040:3:4:face:b00c:3333:7020","TLSv1.3","144","Application Data"
"338","163.175778532","2a00:a041:3c5d:4d00:605e:f34d:a502:2044","2a00:a040:3:4:face:b00c:3333:7020","TLSv1.3","674","Application Data"
"339","163.193337533","2a00:a040:3:4:face:b00c:3333:7020","2a00:a041:3c5d:4d00:605e:f34d:a502:2044","TCP","86","443  >  50822 [ACK] Seq=166 Ack=1359 Win=31488 Len=0 TSval=1756325991 TSecr=3909936354"
"340","163.193907360","2a00:a040:3:4:face:b00c:3333:7020","2a00:a041:3c5d:4d00:605e:f34d:a502:2044","TLSv1.3","267","Application Data"
"341","163.237489448","2a00:a041:3c5d:4d00:605e:f34d:a502:2044","2a00:a040:3:4:face:b00c:3333:7020","TCP","86","50822  >  443 [ACK] Seq=1359 Ack=347 Win=64640 Len=0 TSval=3909936417 TSecr=1756325991"
"342","163.293356723","157.240.221.60","192.168.1.12","TLSv1.2","207","Application Data"
"343","163.293389564","192.168.1.12","157.240.221.60","TCP","66","45474  >  443 [ACK] Seq=2271 Ack=16678 Win=695 Len=0 TSval=2063685817 TSecr=2015947595"
"344","163.297816124","192.168.1.12","157.240.221.60","TLSv1.2","166","Application Data"
"345","163.299167154","192.168.1.12","157.240.221.60","TLSv1.2","162","Application Data"
"346","163.373978013","157.240.221.60","192.168.1.12","TCP","66","443  >  45474 [ACK] Seq=16678 Ack=2371 Win=336 Len=0 TSval=2015947676 TSecr=2063685822"
"347","163.379699944","2a00:a040:3:4:face:b00c:3333:7020","2a00:a041:3c5d:4d00:605e:f34d:a502:2044","TLSv1.3","732","Application Data"
"348","163.379730457","2a00:a041:3c5d:4d00:605e:f34d:a502:2044","2a00:a040:3:4:face:b00c:3333:7020","TCP","86","50822  >  443 [ACK] Seq=1359 Ack=993 Win=64000 Len=0 TSval=3909936559 TSecr=1756326177"
"349","163.380012330","2a00:a040:3:4:face:b00c:3333:7020","2a00:a041:3c5d:4d00:605e:f34d:a502:2044","TLSv1.3","109","Application Data"
"350","163.380012458","2a00:a040:3:4:face:b00c:3333:7020","2a00:a041:3c5d:4d00:605e:f34d:a502:2044","TCP","1466","443  >  50822 [ACK] Seq=1016 Ack=1359 Win=31488 Len=1380 TSval=1756326178 TSecr=3909936417 [TCP segment of a reassembled PDU]"
"351","163.380028530","2a00:a041:3c5d:4d00:605e:f34d:a502:2044","2a00:a040:3:4:face:b00c:3333:7020","TCP","86","50822  >  443 [ACK] Seq=1359 Ack=1016 Win=64128 Len=0 TSval=3909936560 TSecr=1756326178"
"352","163.380042211","2a00:a041:3c5d:4d00:605e:f34d:a502:2044","2a00:a040:3:4:face:b00c:3333:7020","TCP","86","50822  >  443 [ACK] Seq=1359 Ack=2396 Win=63104 Len=0 TSval=3909936560 TSecr=1756326178"
"353","163.381415844","2a00:a040:3:4:face:b00c:3333:7020","2a00:a041:3c5d:4d00:605e:f34d:a502:2044","TLSv1.3","218","Application Data"
"354","163.381440719","2a00:a041:3c5d:4d00:605e:f34d:a502:2044","2a00:a040:3:4:face:b00c:3333:7020","TCP","86","50822  >  443 [ACK] Seq=1359 Ack=2528 Win=63104 Len=0 TSval=3909936561 TSecr=1756326178"
"355","163.382182774","2a00:a040:3:4:face:b00c:3333:7020","2a00:a041:3c5d:4d00:605e:f34d:a502:2044","TCP","1466","443  >  50822 [ACK] Seq=2528 Ack=1359 Win=31488 Len=1380 TSval=1756326179 TSecr=3909936417 [TCP segment of a reassembled PDU]"
"356","163.382196195","2a00:a041:3c5d:4d00:605e:f34d:a502:2044","2a00:a040:3:4:face:b00c:3333:7020","TCP","86","50822  >  443 [ACK] Seq=1359 Ack=3908 Win=63104 Len=0 TSval=3909936562 TSecr=1756326179"
"357","163.384290503","2a00:a040:3:4:face:b00c:3333:7020","2a00:a041:3c5d:4d00:605e:f34d:a502:2044","TLSv1.3","1466","Application Data [TCP segment of a reassembled PDU]"
"358","163.384303560","2a00:a041:3c5d:4d00:605e:f34d:a502:2044","2a00:a040:3:4:face:b00c:3333:7020","TCP","86","50822  >  443 [ACK] Seq=1359 Ack=5288 Win=63104 Len=0 TSval=3909936564 TSecr=1756326179"
"359","163.385089402","2a00:a040:3:4:face:b00c:3333:7020","2a00:a041:3c5d:4d00:605e:f34d:a502:2044","TLSv1.3","1466","Application Data [TCP segment of a reassembled PDU]"
"360","163.385107538","2a00:a041:3c5d:4d00:605e:f34d:a502:2044","2a00:a040:3:4:face:b00c:3333:7020","TCP","86","50822  >  443 [ACK] Seq=1359 Ack=6668 Win=63104 Len=0 TSval=3909936565 TSecr=1756326179"
"361","163.387518956","2a00:a040:3:4:face:b00c:3333:7020","2a00:a041:3c5d:4d00:605e:f34d:a502:2044","TCP","1466","443  >  50822 [PSH, ACK] Seq=6668 Ack=1359 Win=31488 Len=1380 TSval=1756326179 TSecr=3909936417 [TCP segment of a reassembled PDU]"
"362","163.387540314","2a00:a041:3c5d:4d00:605e:f34d:a502:2044","2a00:a040:3:4:face:b00c:3333:7020","TCP","86","50822  >  443 [ACK] Seq=1359 Ack=8048 Win=63104 Len=0 TSval=3909936567 TSecr=1756326179"
"363","163.388261445","AskeyCom_1a:19:78","IntelCor_eb:49:20","0x86dd","66","IPv6"
"364","163.388311872","2a00:a040:3:4:face:b00c:3333:7020","2a00:a041:3c5d:4d00:605e:f34d:a502:2044","TLSv1.3","1466","Application Data [TCP segment of a reassembled PDU]"
"365","163.388326137","2a00:a041:3c5d:4d00:605e:f34d:a502:2044","2a00:a040:3:4:face:b00c:3333:7020","TCP","86","50822  >  443 [ACK] Seq=1359 Ack=9428 Win=63104 Len=0 TSval=3909936568 TSecr=1756326180"
"366","163.390653241","2a00:a040:3:4:face:b00c:3333:7020","2a00:a041:3c5d:4d00:605e:f34d:a502:2044","TLSv1.3","1466","Application Data [TCP segment of a reassembled PDU]"
"367","163.390669336","2a00:a041:3c5d:4d00:605e:f34d:a502:2044","2a00:a040:3:4:face:b00c:3333:7020","TCP","86","50822  >  443 [ACK] Seq=1359 Ack=10808 Win=63104 Len=0 TSval=3909936570 TSecr=1756326180"
"368","163.391391636","2a00:a040:3:4:face:b00c:3333:7020","2a00:a041:3c5d:4d00:605e:f34d:a502:2044","TCP","1466","443  >  50822 [ACK] Seq=10808 Ack=1359 Win=31488 Len=1380 TSval=1756326181 TSecr=3909936417 [TCP segment of a reassembled PDU]"
"369","163.391404760","2a00:a041:3c5d:4d00:605e:f34d:a502:2044","2a00:a040:3:4:face:b00c:3333:7020","TCP","86","50822  >  443 [ACK] Seq=1359 Ack=12188 Win=63104 Len=0 TSval=3909936571 TSecr=1756326181"
"370","163.394277533","2a00:a040:3:4:face:b00c:3333:7020","2a00:a041:3c5d:4d00:605e:f34d:a502:2044","TCP","1466","443  >  50822 [PSH, ACK] Seq=12188 Ack=1359 Win=31488 Len=1380 TSval=1756326181 TSecr=3909936417 [TCP segment of a reassembled PDU]"
"371","163.405156236","2a00:a040:3:4:face:b00c:3333:7020","2a00:a041:3c5d:4d00:605e:f34d:a502:2044","TLSv1.3","1466","Application Data [TCP segment of a reassembled PDU]"
"372","163.405181030","2a00:a041:3c5d:4d00:605e:f34d:a502:2044","2a00:a040:3:4:face:b00c:3333:7020","TCP","86","50822  >  443 [ACK] Seq=1359 Ack=14948 Win=63104 Len=0 TSval=3909936585 TSecr=1756326181"
"373","163.405605529","2a00:a040:3:4:face:b00c:3333:7020","2a00:a041:3c5d:4d00:605e:f34d:a502:2044","TCP","1466","443  >  50822 [PSH, ACK] Seq=14948 Ack=1359 Win=31488 Len=1380 TSval=1756326202 TSecr=3909936559 [TCP segment of a reassembled PDU]"
"374","163.406344609","2a00:a040:3:4:face:b00c:3333:7020","2a00:a041:3c5d:4d00:605e:f34d:a502:2044","TLSv1.3","1466","Application Data [TCP segment of a reassembled PDU]"
"375","163.406359440","2a00:a041:3c5d:4d00:605e:f34d:a502:2044","2a00:a040:3:4:face:b00c:3333:7020","TCP","86","50822  >  443 [ACK] Seq=1359 Ack=17708 Win=63104 Len=0 TSval=3909936586 TSecr=1756326202"
"376","163.407085445","2a00:a040:3:4:face:b00c:3333:7020","2a00:a041:3c5d:4d00:605e:f34d:a502:2044","TLSv1.3","1466","Application Data [TCP segment of a reassembled PDU]"
"377","163.409211126","2a00:a040:3:4:face:b00c:3333:7020","2a00:a041:3c5d:4d00:605e:f34d:a502:2044","TCP","1466","443  >  50822 [ACK] Seq=19088 Ack=1359 Win=31488 Len=1380 TSval=1756326203 TSecr=3909936560 [TCP segment of a reassembled PDU]"
"378","163.409219878","2a00:a041:3c5d:4d00:605e:f34d:a502:2044","2a00:a040:3:4:face:b00c:3333:7020","TCP","86","50822  >  443 [ACK] Seq=1359 Ack=20468 Win=63104 Len=0 TSval=3909936589 TSecr=1756326202"
"379","163.412456136","2a00:a040:3:4:face:b00c:3333:7020","2a00:a041:3c5d:4d00:605e:f34d:a502:2044","TLSv1.3","1466","Application Data [TCP segment of a reassembled PDU]"
"380","163.415878222","2a00:a040:3:4:face:b00c:3333:7020","2a00:a041:3c5d:4d00:605e:f34d:a502:2044","TLSv1.3","1466","Application Data [TCP segment of a reassembled PDU]"
"381","163.415901562","2a00:a041:3c5d:4d00:605e:f34d:a502:2044","2a00:a040:3:4:face:b00c:3333:7020","TCP","86","50822  >  443 [ACK] Seq=1359 Ack=23228 Win=63104 Len=0 TSval=3909936596 TSecr=1756326203"
"382","163.418270171","2a00:a040:3:4:face:b00c:3333:7020","2a00:a041:3c5d:4d00:605e:f34d:a502:2044","TCP","1466","443  >  50822 [PSH, ACK] Seq=23228 Ack=1359 Win=31488 Len=1380 TSval=1756326208 TSecr=3909936564 [TCP segment of a reassembled PDU]"
"383","163.421199829","2a00:a040:3:4:face:b00c:3333:7020","2a00:a041:3c5d:4d00:605e:f34d:a502:2044","TCP","1466","443  >  50822 [ACK] Seq=24608 Ack=1359 Win=31488 Len=1380 TSval=1756326209 TSecr=3909936564 [TCP segment of a reassembled PDU]"
"384","163.421223393","2a00:a041:3c5d:4d00:605e:f34d:a502:2044","2a00:a040:3:4:face:b00c:3333:7020","TCP","86","50822  >  443 [ACK] Seq=1359 Ack=25988 Win=63104 Len=0 TSval=3909936601 TSecr=1756326208"
"385","163.421953318","2a00:a040:3:4:face:b00c:3333:7020","2a00:a041:3c5d:4d00:605e:f34d:a502:2044","TLSv1.3","1466","Application Data [TCP segment of a reassembled PDU]"
"386","163.424993208","2a00:a040:3:4:face:b00c:3333:7020","2a00:a041:3c5d:4d00:605e:f34d:a502:2044","TCP","1466","443  >  50822 [ACK] Seq=27368 Ack=1359 Win=31488 Len=1380 TSval=1756326210 TSecr=3909936571 [TCP segment of a reassembled PDU]"
"387","163.425012571","2a00:a041:3c5d:4d00:605e:f34d:a502:2044","2a00:a040:3:4:face:b00c:3333:7020","TCP","86","50822  >  443 [ACK] Seq=1359 Ack=28748 Win=63104 Len=0 TSval=3909936605 TSecr=1756326209"
"388","163.427996200","2a00:a040:3:4:face:b00c:3333:7020","2a00:a041:3c5d:4d00:605e:f34d:a502:2044","TCP","1466","443  >  50822 [PSH, ACK] Seq=28748 Ack=1359 Win=31488 Len=1380 TSval=1756326210 TSecr=3909936571 [TCP segment of a reassembled PDU]"
"389","163.428810634","2a00:a040:3:4:face:b00c:3333:7020","2a00:a041:3c5d:4d00:605e:f34d:a502:2044","TLSv1.3","1466","Application Data [TCP segment of a reassembled PDU]"
"390","163.428823780","2a00:a041:3c5d:4d00:605e:f34d:a502:2044","2a00:a040:3:4:face:b00c:3333:7020","TCP","86","50822  >  443 [ACK] Seq=1359 Ack=31508 Win=63104 Len=0 TSval=3909936609 TSecr=1756326210"
"391","163.429625094","2a00:a040:3:4:face:b00c:3333:7020","2a00:a041:3c5d:4d00:605e:f34d:a502:2044","TCP","1466","443  >  50822 [PSH, ACK] Seq=31508 Ack=1359 Win=31488 Len=1380 TSval=1756326211 TSecr=3909936571 [TCP segment of a reassembled PDU]"
"392","163.433162046","2a00:a040:3:4:face:b00c:3333:7020","2a00:a041:3c5d:4d00:605e:f34d:a502:2044","TLSv1.3","1466","Application Data [TCP segment of a reassembled PDU]"
"393","163.433187432","2a00:a041:3c5d:4d00:605e:f34d:a502:2044","2a00:a040:3:4:face:b00c:3333:7020","TCP","86","50822  >  443 [ACK] Seq=1359 Ack=34268 Win=63104 Len=0 TSval=3909936613 TSecr=1756326211"
"394","163.435716026","2a00:a040:3:4:face:b00c:3333:7020","2a00:a041:3c5d:4d00:605e:f34d:a502:2044","TLSv1.3","1466","Application Data [TCP segment of a reassembled PDU]"
"395","163.439264574","2a00:a040:3:4:face:b00c:3333:7020","2a00:a041:3c5d:4d00:605e:f34d:a502:2044","TCP","1466","443  >  50822 [ACK] Seq=35648 Ack=1359 Win=31488 Len=1380 TSval=1756326214 TSecr=3909936571 [TCP segment of a reassembled PDU]"
"396","163.439281345","2a00:a041:3c5d:4d00:605e:f34d:a502:2044","2a00:a040:3:4:face:b00c:3333:7020","TCP","86","50822  >  443 [ACK] Seq=1359 Ack=37028 Win=63104 Len=0 TSval=3909936619 TSecr=1756326212"
"397","163.442508024","2a00:a040:3:4:face:b00c:3333:7020","2a00:a041:3c5d:4d00:605e:f34d:a502:2044","TLSv1.3","1466","Application Data [TCP segment of a reassembled PDU]"
"398","163.445715418","2a00:a040:3:4:face:b00c:3333:7020","2a00:a041:3c5d:4d00:605e:f34d:a502:2044","TLSv1.3","1466","Application Data [TCP segment of a reassembled PDU]"
"399","163.445742844","2a00:a041:3c5d:4d00:605e:f34d:a502:2044","2a00:a040:3:4:face:b00c:3333:7020","TCP","86","50822  >  443 [ACK] Seq=1359 Ack=39788 Win=63104 Len=0 TSval=3909936625 TSecr=1756326214"
"400","163.446429996","2a00:a040:3:4:face:b00c:3333:7020","2a00:a041:3c5d:4d00:605e:f34d:a502:2044","TCP","1466","443  >  50822 [PSH, ACK] Seq=39788 Ack=1359 Win=31488 Len=1380 TSval=1756326215 TSecr=3909936571 [TCP segment of a reassembled PDU]"
"401","163.448867393","2a00:a040:3:4:face:b00c:3333:7020","2a00:a041:3c5d:4d00:605e:f34d:a502:2044","TCP","1466","443  >  50822 [ACK] Seq=41168 Ack=1359 Win=31488 Len=1380 TSval=1756326216 TSecr=3909936571 [TCP segment of a reassembled PDU]"
"402","163.448884274","2a00:a041:3c5d:4d00:605e:f34d:a502:2044","2a00:a040:3:4:face:b00c:3333:7020","TCP","86","50822  >  443 [ACK] Seq=1359 Ack=42548 Win=63104 Len=0 TSval=3909936629 TSecr=1756326215"
"403","163.449546795","2a00:a040:3:4:face:b00c:3333:7020","2a00:a041:3c5d:4d00:605e:f34d:a502:2044","TLSv1.3","1466","Application Data [TCP segment of a reassembled PDU]"
"404","163.452427481","2a00:a040:3:4:face:b00c:3333:7020","2a00:a041:3c5d:4d00:605e:f34d:a502:2044","TCP","1466","443  >  50822 [ACK] Seq=43928 Ack=1359 Win=31488 Len=1380 TSval=1756326217 TSecr=3909936589 [TCP segment of a reassembled PDU]"
"405","163.452450575","2a00:a041:3c5d:4d00:605e:f34d:a502:2044","2a00:a040:3:4:face:b00c:3333:7020","TCP","86","50822  >  443 [ACK] Seq=1359 Ack=45308 Win=63104 Len=0 TSval=3909936632 TSecr=1756326216"
"406","163.453150968","2a00:a040:3:4:face:b00c:3333:7020","2a00:a041:3c5d:4d00:605e:f34d:a502:2044","TCP","1466","443  >  50822 [ACK] Seq=45308 Ack=1359 Win=31488 Len=1380 TSval=1756326218 TSecr=3909936589 [TCP segment of a reassembled PDU]"
"407","163.455268904","2a00:a040:3:4:face:b00c:3333:7020","2a00:a041:3c5d:4d00:605e:f34d:a502:2044","TLSv1.3","1466","Application Data [TCP segment of a reassembled PDU]"
"408","163.455292962","2a00:a041:3c5d:4d00:605e:f34d:a502:2044","2a00:a040:3:4:face:b00c:3333:7020","TCP","86","50822  >  443 [ACK] Seq=1359 Ack=48068 Win=63104 Len=0 TSval=3909936635 TSecr=1756326218"
"409","163.457863769","2a00:a040:3:4:face:b00c:3333:7020","2a00:a041:3c5d:4d00:605e:f34d:a502:2044","TCP","1466","443  >  50822 [ACK] Seq=48068 Ack=1359 Win=31488 Len=1380 TSval=1756326219 TSecr=3909936589 [TCP segment of a reassembled PDU]"
"410","163.461420831","2a00:a040:3:4:face:b00c:3333:7020","2a00:a041:3c5d:4d00:605e:f34d:a502:2044","TLSv1.3","1466","Application Data [TCP segment of a reassembled PDU]"
"411","163.461446305","2a00:a041:3c5d:4d00:605e:f34d:a502:2044","2a00:a040:3:4:face:b00c:3333:7020","TCP","86","50822  >  443 [ACK] Seq=1359 Ack=50828 Win=63104 Len=0 TSval=3909936641 TSecr=1756326219"
"412","163.461879489","2a00:a040:3:4:face:b00c:3333:7020","2a00:a041:3c5d:4d00:605e:f34d:a502:2044","TLSv1.3","1466","Application Data [TCP segment of a reassembled PDU]"
"413","163.464841998","2a00:a040:3:4:face:b00c:3333:7020","2a00:a041:3c5d:4d00:605e:f34d:a502:2044","TCP","1466","443  >  50822 [PSH, ACK] Seq=52208 Ack=1359 Win=31488 Len=1380 TSval=1756326220 TSecr=3909936589 [TCP segment of a reassembled PDU]"
"414","163.464859034","2a00:a041:3c5d:4d00:605e:f34d:a502:2044","2a00:a040:3:4:face:b00c:3333:7020","TCP","86","50822  >  443 [ACK] Seq=1359 Ack=53588 Win=63104 Len=0 TSval=3909936645 TSecr=1756326220"
"415","163.465597892","2a00:a040:3:4:face:b00c:3333:7020","2a00:a041:3c5d:4d00:605e:f34d:a502:2044","TLSv1.3","1466","Application Data [TCP segment of a reassembled PDU]"
"416","163.468553387","2a00:a040:3:4:face:b00c:3333:7020","2a00:a041:3c5d:4d00:605e:f34d:a502:2044","TLSv1.3","1466","Application Data [TCP segment of a reassembled PDU]"
"417","163.468566994","2a00:a041:3c5d:4d00:605e:f34d:a502:2044","2a00:a040:3:4:face:b00c:3333:7020","TCP","86","50822  >  443 [ACK] Seq=1359 Ack=56348 Win=63104 Len=0 TSval=3909936648 TSecr=1756326221"
"418","163.469242120","2a00:a040:3:4:face:b00c:3333:7020","2a00:a041:3c5d:4d00:605e:f34d:a502:2044","TLSv1.3","1466","Application Data [TCP segment of a reassembled PDU]"
"419","163.472112405","2a00:a040:3:4:face:b00c:3333:7020","2a00:a041:3c5d:4d00:605e:f34d:a502:2044","TCP","1466","443  >  50822 [PSH, ACK] Seq=57728 Ack=1359 Win=31488 Len=1380 TSval=1756326223 TSecr=3909936589 [TCP segment of a reassembled PDU]"
"420","163.472130258","2a00:a041:3c5d:4d00:605e:f34d:a502:2044","2a00:a040:3:4:face:b00c:3333:7020","TCP","86","50822  >  443 [ACK] Seq=1359 Ack=59108 Win=66944 Len=0 TSval=3909936652 TSecr=1756326223"
"421","163.475684405","2a00:a040:3:4:face:b00c:3333:7020","2a00:a041:3c5d:4d00:605e:f34d:a502:2044","TLSv1.3","1466","Application Data [TCP segment of a reassembled PDU]"
"422","163.475701105","2a00:a041:3c5d:4d00:605e:f34d:a502:2044","2a00:a040:3:4:face:b00c:3333:7020","TCP","86","50822  >  443 [ACK] Seq=1359 Ack=60488 Win=69632 Len=0 TSval=3909936655 TSecr=1756326224"
"423","163.482733873","2a00:a040:3:4:face:b00c:3333:7020","2a00:a041:3c5d:4d00:605e:f34d:a502:2044","TCP","1466","443  >  50822 [PSH, ACK] Seq=60488 Ack=1359 Win=31488 Len=1380 TSval=1756326224 TSecr=3909936596 [TCP segment of a reassembled PDU]"
"424","163.482765473","2a00:a041:3c5d:4d00:605e:f34d:a502:2044","2a00:a040:3:4:face:b00c:3333:7020","TCP","86","50822  >  443 [ACK] Seq=1359 Ack=61868 Win=72448 Len=0 TSval=3909936662 TSecr=1756326224"
"425","163.483729115","2a00:a040:3:4:face:b00c:3333:7020","2a00:a041:3c5d:4d00:605e:f34d:a502:2044","TLSv1.3","2846","Application Data [TCP segment of a reassembled PDU]"
"426","163.483729284","2a00:a040:3:4:face:b00c:3333:7020","2a00:a041:3c5d:4d00:605e:f34d:a502:2044","TCP","1466","443  >  50822 [ACK] Seq=64628 Ack=1359 Win=31488 Len=1380 TSval=1756326230 TSecr=3909936601 [TCP segment of a reassembled PDU]"
"427","163.483744701","2a00:a041:3c5d:4d00:605e:f34d:a502:2044","2a00:a040:3:4:face:b00c:3333:7020","TCP","86","50822  >  443 [ACK] Seq=1359 Ack=64628 Win=77952 Len=0 TSval=3909936663 TSecr=1756326225"
"428","163.483765154","2a00:a041:3c5d:4d00:605e:f34d:a502:2044","2a00:a040:3:4:face:b00c:3333:7020","TCP","86","50822  >  443 [ACK] Seq=1359 Ack=66008 Win=80768 Len=0 TSval=3909936663 TSecr=1756326230"
"429","163.485247707","2a00:a040:3:4:face:b00c:3333:7020","2a00:a041:3c5d:4d00:605e:f34d:a502:2044","TLSv1.3","1466","Application Data [TCP segment of a reassembled PDU]"
"430","163.485262408","2a00:a041:3c5d:4d00:605e:f34d:a502:2044","2a00:a040:3:4:face:b00c:3333:7020","TCP","86","50822  >  443 [ACK] Seq=1359 Ack=67388 Win=83456 Len=0 TSval=3909936665 TSecr=1756326230"
"431","163.485742891","2a00:a040:3:4:face:b00c:3333:7020","2a00:a041:3c5d:4d00:605e:f34d:a502:2044","TLSv1.3","1466","Application Data, Application Data"
"432","163.485756693","2a00:a041:3c5d:4d00:605e:f34d:a502:2044","2a00:a040:3:4:face:b00c:3333:7020","TCP","86","50822  >  443 [ACK] Seq=1359 Ack=68768 Win=86272 Len=0 TSval=3909936665 TSecr=1756326237"
"433","163.488876003","2a00:a040:3:4:face:b00c:3333:7020","2a00:a041:3c5d:4d00:605e:f34d:a502:2044","TCP","1466","443  >  50822 [PSH, ACK] Seq=68768 Ack=1359 Win=31488 Len=1380 TSval=1756326237 TSecr=3909936609 [TCP segment of a reassembled PDU]"
"434","163.488904555","2a00:a041:3c5d:4d00:605e:f34d:a502:2044","2a00:a040:3:4:face:b00c:3333:7020","TCP","86","50822  >  443 [ACK] Seq=1359 Ack=70148 Win=88960 Len=0 TSval=3909936669 TSecr=1756326237"
"435","163.489942575","2a00:a040:3:4:face:b00c:3333:7020","2a00:a041:3c5d:4d00:605e:f34d:a502:2044","TLSv1.3","1466","Application Data [TCP segment of a reassembled PDU]"
"436","163.489968746","2a00:a041:3c5d:4d00:605e:f34d:a502:2044","2a00:a040:3:4:face:b00c:3333:7020","TCP","86","50822  >  443 [ACK] Seq=1359 Ack=71528 Win=91776 Len=0 TSval=3909936670 TSecr=1756326237"
"437","163.492279562","2a00:a040:3:4:face:b00c:3333:7020","2a00:a041:3c5d:4d00:605e:f34d:a502:2044","TLSv1.3","1466","Application Data [TCP segment of a reassembled PDU]"
"438","163.492293794","2a00:a041:3c5d:4d00:605e:f34d:a502:2044","2a00:a040:3:4:face:b00c:3333:7020","TCP","86","50822  >  443 [ACK] Seq=1359 Ack=72908 Win=94592 Len=0 TSval=3909936672 TSecr=1756326237"
"439","163.492686335","2a00:a040:3:4:face:b00c:3333:7020","2a00:a041:3c5d:4d00:605e:f34d:a502:2044","TLSv1.3","1466","Application Data"
"440","163.492700013","2a00:a041:3c5d:4d00:605e:f34d:a502:2044","2a00:a040:3:4:face:b00c:3333:7020","TCP","86","50822  >  443 [ACK] Seq=1359 Ack=74288 Win=97280 Len=0 TSval=3909936672 TSecr=1756326243"
"441","163.494735934","2a00:a040:3:4:face:b00c:3333:7020","2a00:a041:3c5d:4d00:605e:f34d:a502:2044","TCP","1466","443  >  50822 [PSH, ACK] Seq=74288 Ack=1359 Win=31488 Len=1380 TSval=1756326243 TSecr=3909936613 [TCP segment of a reassembled PDU]"
"442","163.494762804","2a00:a041:3c5d:4d00:605e:f34d:a502:2044","2a00:a040:3:4:face:b00c:3333:7020","TCP","86","50822  >  443 [ACK] Seq=1359 Ack=75668 Win=100096 Len=0 TSval=3909936674 TSecr=1756326243"
"443","163.495076984","2a00:a040:3:4:face:b00c:3333:7020","2a00:a041:3c5d:4d00:605e:f34d:a502:2044","TLSv1.3","1466","Application Data [TCP segment of a reassembled PDU]"
"444","163.495094123","2a00:a041:3c5d:4d00:605e:f34d:a502:2044","2a00:a040:3:4:face:b00c:3333:7020","TCP","86","50822  >  443 [ACK] Seq=1359 Ack=77048 Win=102784 Len=0 TSval=3909936675 TSecr=1756326244"
"445","163.497911829","2a00:a040:3:4:face:b00c:3333:7020","2a00:a041:3c5d:4d00:605e:f34d:a502:2044","TCP","1466","443  >  50822 [ACK] Seq=77048 Ack=1359 Win=31488 Len=1380 TSval=1756326249 TSecr=3909936619 [TCP segment of a reassembled PDU]"
"446","163.497939183","2a00:a041:3c5d:4d00:605e:f34d:a502:2044","2a00:a040:3:4:face:b00c:3333:7020","TCP","86","50822  >  443 [ACK] Seq=1359 Ack=78428 Win=105600 Len=0 TSval=3909936678 TSecr=1756326249"
"447","163.498648857","2a00:a040:3:4:face:b00c:3333:7020","2a00:a041:3c5d:4d00:605e:f34d:a502:2044","TCP","1466","443  >  50822 [PSH, ACK] Seq=78428 Ack=1359 Win=31488 Len=1380 TSval=1756326249 TSecr=3909936619 [TCP segment of a reassembled PDU]"
"448","163.498668608","2a00:a041:3c5d:4d00:605e:f34d:a502:2044","2a00:a040:3:4:face:b00c:3333:7020","TCP","86","50822  >  443 [ACK] Seq=1359 Ack=79808 Win=108288 Len=0 TSval=3909936678 TSecr=1756326249"
"449","163.501033434","2a00:a040:3:4:face:b00c:3333:7020","2a00:a041:3c5d:4d00:605e:f34d:a502:2044","TLSv1.3","1466","Application Data [TCP segment of a reassembled PDU]"
"450","163.501060082","2a00:a041:3c5d:4d00:605e:f34d:a502:2044","2a00:a040:3:4:face:b00c:3333:7020","TCP","86","50822  >  443 [ACK] Seq=1359 Ack=81188 Win=111104 Len=0 TSval=3909936681 TSecr=1756326256"
"451","163.501237109","2a00:a040:3:4:face:b00c:3333:7020","2a00:a041:3c5d:4d00:605e:f34d:a502:2044","TCP","1466","443  >  50822 [PSH, ACK] Seq=81188 Ack=1359 Win=31488 Len=1380 TSval=1756326256 TSecr=3909936629 [TCP segment of a reassembled PDU]"
"452","163.501242460","2a00:a041:3c5d:4d00:605e:f34d:a502:2044","2a00:a040:3:4:face:b00c:3333:7020","TCP","86","50822  >  443 [ACK] Seq=1359 Ack=82568 Win=113792 Len=0 TSval=3909936681 TSecr=1756326256"
"453","163.503990436","2a00:a040:3:4:face:b00c:3333:7020","2a00:a041:3c5d:4d00:605e:f34d:a502:2044","TLSv1.3","1466","Application Data [TCP segment of a reassembled PDU]"
"454","163.504013370","2a00:a041:3c5d:4d00:605e:f34d:a502:2044","2a00:a040:3:4:face:b00c:3333:7020","TCP","86","50822  >  443 [ACK] Seq=1359 Ack=83948 Win=116608 Len=0 TSval=3909936684 TSecr=1756326256"
"455","163.504396831","2a00:a040:3:4:face:b00c:3333:7020","2a00:a041:3c5d:4d00:605e:f34d:a502:2044","TLSv1.3","157","Application Data"
"456","163.504494519","2a00:a041:3c5d:4d00:605e:f34d:a502:2044","2a00:a040:3:4:face:b00c:3333:7020","TCP","86","50822  >  443 [ACK] Seq=1359 Ack=84019 Win=116608 Len=0 TSval=3909936684 TSecr=1756326256"
"457","163.520573952","2a00:a040:3:4:face:b00c:3333:7020","2a00:a041:3c5d:4d00:605e:f34d:a502:2044","TCP","86","[TCP Dup ACK 339#1] 443  >  50822 [ACK] Seq=84019 Ack=1359 Win=31488 Len=0 TSval=1756326320 TSecr=3909936684"
"458","163.661531990","192.168.1.12","157.240.221.60","TCP","162","[TCP Retransmission] 45474  >  443 [PSH, ACK] Seq=2371 Ack=16678 Win=695 Len=96 TSval=2063686185 TSecr=2015947676"
"459","163.739277914","157.240.221.60","192.168.1.12","TCP","66","443  >  45474 [ACK] Seq=16678 Ack=2467 Win=336 Len=0 TSval=2015948042 TSecr=2063686185"
"460","163.854727525","192.168.1.12","213.57.2.5","DNS","94","Standard query 0x9be7 AAAA nleditor.osi.office.net OPT"
"461","163.854896849","192.168.1.12","213.57.2.5","DNS","94","Standard query 0xd2ac A nleditor.osi.office.net OPT"
"462","163.855004062","192.168.1.12","213.57.2.5","DNS","94","Standard query 0xa4f7 HTTPS nleditor.osi.office.net OPT"
"463","163.881826978","213.57.2.5","192.168.1.12","DNS","276","Standard query response 0x9be7 AAAA nleditor.osi.office.net CNAME prod1.naturallanguageeditorservice.osi.office.net.akadns.net CNAME prod-all.naturallanguageeditorservice.osi.office.net.akadns.net CNAME prod-eu.naturallanguageeditorservice.osi.office.net.akadns.net SOA internal.akadns.net OPT"
"464","163.882296465","213.57.2.5","192.168.1.12","DNS","274","Standard query response 0xd2ac A nleditor.osi.office.net CNAME prod1.naturallanguageeditorservice.osi.office.net.akadns.net CNAME prod-all.naturallanguageeditorservice.osi.office.net.akadns.net CNAME prod-eu.naturallanguageeditorservice.osi.office.net.akadns.net A 20.126.21.36 A 20.16.167.54 A 20.73.59.29 A 20.229.111.167 OPT"
"465","163.882297866","213.57.2.5","192.168.1.12","DNS","276","Standard query response 0xa4f7 HTTPS nleditor.osi.office.net CNAME prod1.naturallanguageeditorservice.osi.office.net.akadns.net CNAME prod-all.naturallanguageeditorservice.osi.office.net.akadns.net CNAME prod-eu.naturallanguageeditorservice.osi.office.net.akadns.net SOA internal.akadns.net OPT"
"466","163.882335397","192.168.1.12","213.57.2.5","DNS","133","Standard query 0xe747 AAAA prod-eu.naturallanguageeditorservice.osi.office.net.akadns.net OPT"
"467","163.883226041","192.168.1.12","213.57.2.5","DNS","133","Standard query 0x832b HTTPS prod-eu.naturallanguageeditorservice.osi.office.net.akadns.net OPT"
"468","163.903793350","213.57.2.5","192.168.1.12","DNS","199","Standard query response 0xe747 AAAA prod-eu.naturallanguageeditorservice.osi.office.net.akadns.net SOA internal.akadns.net OPT"
"469","163.904305102","213.57.2.5","192.168.1.12","DNS","199","Standard query response 0x832b HTTPS prod-eu.naturallanguageeditorservice.osi.office.net.akadns.net SOA internal.akadns.net OPT"
"470","163.904771645","192.168.1.12","20.126.21.36","TCP","74","55568  >  443 [SYN] Seq=0 Win=64240 Len=0 MSS=1460 SACK_PERM=1 TSval=1752842318 TSecr=0 WS=128"
"471","163.988778573","20.126.21.36","192.168.1.12","TCP","66","443  >  55568 [SYN, ACK] Seq=0 Ack=1 Win=65535 Len=0 MSS=1440 WS=256 SACK_PERM=1"
"472","163.988832323","192.168.1.12","20.126.21.36","TCP","54","55568  >  443 [ACK] Seq=1 Ack=1 Win=64256 Len=0"
"473","163.989255326","192.168.1.12","20.126.21.36","TLSv1.2","571","Client Hello"
"474","164.074537001","20.126.21.36","192.168.1.12","TCP","60","443  >  55568 [ACK] Seq=1 Ack=518 Win=525056 Len=0"
"475","164.074928137","20.126.21.36","192.168.1.12","TCP","1514","443  >  55568 [ACK] Seq=1 Ack=518 Win=525056 Len=1460 [TCP segment of a reassembled PDU]"
"476","164.074954986","192.168.1.12","20.126.21.36","TCP","54","55568  >  443 [ACK] Seq=518 Ack=1461 Win=63104 Len=0"
"477","164.076124406","20.126.21.36","192.168.1.12","TCP","1514","443  >  55568 [ACK] Seq=1461 Ack=518 Win=525056 Len=1460 [TCP segment of a reassembled PDU]"
"478","164.076145078","192.168.1.12","20.126.21.36","TCP","54","55568  >  443 [ACK] Seq=518 Ack=2921 Win=63104 Len=0"
"479","164.077917285","20.126.21.36","192.168.1.12","TCP","1514","443  >  55568 [ACK] Seq=2921 Ack=518 Win=525056 Len=1460 [TCP segment of a reassembled PDU]"
"480","164.077934956","192.168.1.12","20.126.21.36","TCP","54","55568  >  443 [ACK] Seq=518 Ack=4381 Win=63104 Len=0"
"481","164.078682735","20.126.21.36","192.168.1.12","TLSv1.2","1648","Server Hello, Certificate, Certificate Status, Server Key Exchange, Server Hello Done"
"482","164.078706795","192.168.1.12","20.126.21.36","TCP","54","55568  >  443 [ACK] Seq=518 Ack=5975 Win=61568 Len=0"
"483","164.081902614","192.168.1.12","20.126.21.36","TLSv1.2","212","Client Key Exchange, Change Cipher Spec, Encrypted Handshake Message"
"484","164.082257851","192.168.1.12","20.126.21.36","TLSv1.2","650","Application Data, Application Data"
"485","164.082831998","192.168.1.12","20.126.21.36","TLSv1.2","271","Application Data"
"486","164.166531394","20.126.21.36","192.168.1.12","TCP","60","443  >  55568 [ACK] Seq=5975 Ack=1489 Win=525568 Len=0"
"487","164.166884154","20.126.21.36","192.168.1.12","TLSv1.2","105","Change Cipher Spec, Encrypted Handshake Message"
"488","164.166884472","20.126.21.36","192.168.1.12","TLSv1.2","123","Application Data"
"489","164.166884527","20.126.21.36","192.168.1.12","TLSv1.2","134","Application Data, Application Data"
"490","164.167056171","192.168.1.12","20.126.21.36","TCP","54","55568  >  443 [ACK] Seq=1489 Ack=6175 Win=64128 Len=0"
"491","164.167267542","192.168.1.12","20.126.21.36","TLSv1.2","92","Application Data"
"492","164.172543227","20.126.21.36","192.168.1.12","TCP","1514","443  >  55568 [ACK] Seq=6175 Ack=1489 Win=525568 Len=1460 [TCP segment of a reassembled PDU]"
"493","164.173024028","20.126.21.36","192.168.1.12","TCP","1514","443  >  55568 [ACK] Seq=7635 Ack=1489 Win=525568 Len=1460 [TCP segment of a reassembled PDU]"
"494","164.173069956","192.168.1.12","20.126.21.36","TCP","54","55568  >  443 [ACK] Seq=1527 Ack=9095 Win=64128 Len=0"
"495","164.174259234","20.126.21.36","192.168.1.12","TCP","1514","443  >  55568 [ACK] Seq=9095 Ack=1489 Win=525568 Len=1460 [TCP segment of a reassembled PDU]"
"496","164.175738634","20.126.21.36","192.168.1.12","TCP","1514","443  >  55568 [ACK] Seq=10555 Ack=1489 Win=525568 Len=1460 [TCP segment of a reassembled PDU]"
"497","164.175801294","192.168.1.12","20.126.21.36","TCP","54","55568  >  443 [ACK] Seq=1527 Ack=12015 Win=64128 Len=0"
"498","164.177368003","20.126.21.36","192.168.1.12","TCP","1514","443  >  55568 [ACK] Seq=12015 Ack=1489 Win=525568 Len=1460 [TCP segment of a reassembled PDU]"
"499","164.177890500","20.126.21.36","192.168.1.12","TLSv1.2","554","Application Data"
"500","164.177890581","20.126.21.36","192.168.1.12","TLSv1.2","92","Application Data"
"501","164.177936527","192.168.1.12","20.126.21.36","TCP","54","55568  >  443 [ACK] Seq=1527 Ack=14013 Win=64128 Len=0"
"502","164.251163350","20.126.21.36","192.168.1.12","TCP","60","443  >  55568 [ACK] Seq=14013 Ack=1527 Win=525312 Len=0"
"503","166.706047927","192.168.1.10","224.0.0.251","MDNS","91","Standard query 0x0000 PTR _raop._tcp.local, ""QU"" question PTR _airplay._tcp.local, ""QU"" question"
"504","167.309630844","192.168.1.12","34.237.73.95","TCP","66","[TCP Keep-Alive] 47150  >  443 [ACK] Seq=743 Ack=847 Win=501 Len=0 TSval=2581155360 TSecr=2964830994"
"505","167.524891525","34.237.73.95","192.168.1.12","TCP","66","[TCP Keep-Alive ACK] 443  >  47150 [ACK] Seq=847 Ack=744 Win=186 Len=0 TSval=2964876455 TSecr=2581110109"
"506","168.039389696","192.168.1.18","224.0.0.251","MDNS","101","Standard query 0x0000 SRV Roku 3   1GJ37V014681._airplay._tcp.local, ""QU"" question"
"507","168.039390009","192.168.1.18","224.0.0.251","MDNS","182","Standard query response 0x0000 SRV, cache flush 0 0 7000 1GJ37V014681.local A, cache flush 192.168.1.18 NSEC, cache flush Roku 3   1GJ37V014681._airplay._tcp.local NSEC, cache flush 1GJ37V014681.local"
"508","169.366024129","192.168.1.12","157.240.221.60","TLSv1.2","135","Application Data"
"509","169.441634369","157.240.221.60","192.168.1.12","TCP","66","443  >  45474 [ACK] Seq=16678 Ack=2536 Win=336 Len=0 TSval=2015953743 TSecr=2063691890"
"510","169.573634932","157.240.221.60","192.168.1.12","TLSv1.2","137","Application Data"
"511","169.617654407","192.168.1.12","157.240.221.60","TCP","66","45474  >  443 [ACK] Seq=2536 Ack=16749 Win=695 Len=0 TSval=2063692141 TSecr=2015953858"
"512","169.880949958","20.199.120.85","192.168.1.12","TCP","60","443  >  59308 [FIN, ACK] Seq=6820 Ack=1812 Win=7969 Len=0"
"513","169.881574697","192.168.1.12","20.199.120.85","TCP","54","59308  >  443 [FIN, ACK] Seq=1812 Ack=6821 Win=64128 Len=0"
"514","169.968251533","20.199.120.85","192.168.1.12","TCP","60","443  >  59308 [ACK] Seq=6821 Ack=1813 Win=7969 Len=0"
"515","170.884292537","192.168.1.12","20.199.120.85","TCP","74","55044  >  443 [SYN] Seq=0 Win=64240 Len=0 MSS=1460 SACK_PERM=1 TSval=2688920551 TSecr=0 WS=128"
"516","170.961849885","192.168.1.12","192.168.1.1","DHCP","341","DHCP Request  - Transaction ID 0x79237a8"
"517","170.972373024","20.199.120.85","192.168.1.12","TCP","66","443  >  55044 [SYN, ACK] Seq=0 Ack=1 Win=8192 Len=0 MSS=1440 WS=1 SACK_PERM=1"
"518","170.972426982","192.168.1.12","20.199.120.85","TCP","54","55044  >  443 [ACK] Seq=1 Ack=1 Win=64256 Len=0"
"519","170.972805619","192.168.1.12","20.199.120.85","TLSv1.2","571","Client Hello"
"520","171.008531450","AskeyCom_1a:19:78","Broadcast","ARP","60","Who has 192.168.1.12? Tell 192.168.1.1"
"521","171.008548652","IntelCor_eb:49:20","AskeyCom_1a:19:78","ARP","42","192.168.1.12 is at b0:7d:64:eb:49:20"
"522","171.053536248","20.199.120.85","192.168.1.12","TCP","60","443  >  55044 [ACK] Seq=1 Ack=518 Win=7675 Len=0"
"523","171.054329884","20.199.120.85","192.168.1.12","TCP","1514","443  >  55044 [PSH, ACK] Seq=1 Ack=518 Win=7675 Len=1460 [TCP segment of a reassembled PDU]"
"524","171.054373115","192.168.1.12","20.199.120.85","TCP","54","55044  >  443 [ACK] Seq=518 Ack=1461 Win=63104 Len=0"
"525","171.054923880","20.199.120.85","192.168.1.12","TCP","1514","443  >  55044 [PSH, ACK] Seq=1461 Ack=518 Win=7675 Len=1460 [TCP segment of a reassembled PDU]"
"526","171.054943835","192.168.1.12","20.199.120.85","TCP","54","55044  >  443 [ACK] Seq=518 Ack=2921 Win=63104 Len=0"
"527","171.055998393","20.199.120.85","192.168.1.12","TCP","1514","443  >  55044 [PSH, ACK] Seq=2921 Ack=518 Win=7675 Len=1460 [TCP segment of a reassembled PDU]"
"528","171.056019364","192.168.1.12","20.199.120.85","TCP","54","55044  >  443 [ACK] Seq=518 Ack=4381 Win=63104 Len=0"
"529","171.059398077","20.199.120.85","192.168.1.12","TCP","1514","443  >  55044 [PSH, ACK] Seq=4381 Ack=518 Win=7675 Len=1460 [TCP segment of a reassembled PDU]"
"530","171.059416829","192.168.1.12","20.199.120.85","TCP","54","55044  >  443 [ACK] Seq=518 Ack=5841 Win=63104 Len=0"
"531","171.133907800","20.199.120.85","192.168.1.12","TLSv1.2","141","Server Hello, Certificate, Certificate Status, Server Key Exchange, Server Hello Done"
"532","171.133942896","192.168.1.12","20.199.120.85","TCP","54","55044  >  443 [ACK] Seq=518 Ack=5928 Win=64128 Len=0"
"533","171.137342821","192.168.1.12","20.199.120.85","TLSv1.2","212","Client Key Exchange, Change Cipher Spec, Encrypted Handshake Message"
"534","171.221521151","20.199.120.85","192.168.1.12","TLSv1.2","105","Change Cipher Spec, Encrypted Handshake Message"
"535","171.222997523","192.168.1.12","20.199.120.85","TLSv1.2","329","Application Data"
"536","171.313484260","20.199.120.85","192.168.1.12","TLSv1.2","335","Application Data"
"537","171.314192078","192.168.1.12","20.199.120.85","TLSv1.2","208","Application Data"
"538","171.395630128","20.199.120.85","192.168.1.12","TLSv1.2","157","Application Data"
"539","171.396365674","192.168.1.12","20.199.120.85","TLSv1.2","538","Application Data"
"540","171.620916169","20.199.120.85","192.168.1.12","TCP","60","443  >  55044 [ACK] Seq=6363 Ack=1589 Win=8192 Len=0"
"541","171.927919972","20.199.120.85","192.168.1.12","TLSv1.2","407","Application Data"
"542","171.929084516","192.168.1.12","20.199.120.85","TLSv1.2","277","Application Data"
"543","171.965813652","192.168.1.1","192.168.1.12","DHCP","342","DHCP ACK      - Transaction ID 0x79237a8"
"544","172.017555396","fe80::a8c:14f0:c17c:d903","ff02::16","ICMPv6","150","Multicast Listener Report Message v2"
"545","172.035518218","20.199.120.85","192.168.1.12","TLSv1.2","157","Application Data"
"546","172.035522167","fe80::e2ce:c3ff:fe1a:1978","ff02::1","ICMPv6","174","Router Advertisement from e0:ce:c3:1a:19:78"
"547","172.035903768","fe80::a8c:14f0:c17c:d903","ff02::2","ICMPv6","62","Router Solicitation"
"548","172.045607896","fe80::a8c:14f0:c17c:d903","ff02::16","ICMPv6","150","Multicast Listener Report Message v2"
"549","172.077590953","192.168.1.12","20.199.120.85","TCP","54","55044  >  443 [ACK] Seq=1812 Ack=6819 Win=64128 Len=0"
"550","172.845511803","fe80::a8c:14f0:c17c:d903","ff02::16","ICMPv6","150","Multicast Listener Report Message v2"
"551","173.406425724","192.168.1.12","213.57.2.5","DNS","100","Standard query 0x2fa1 A connectivity-check.ubuntu.com OPT"
"552","173.437262195","213.57.2.5","192.168.1.12","DNS","244","Standard query response 0x2fa1 A connectivity-check.ubuntu.com A 34.122.121.32 A 91.189.91.48 A 35.224.170.84 A 185.125.190.49 A 185.125.190.48 A 185.125.190.18 A 35.232.111.17 A 91.189.91.49 A 185.125.190.17 OPT"
"553","173.438240105","192.168.1.12","34.122.121.32","TCP","74","57852  >  80 [SYN] Seq=0 Win=64240 Len=0 MSS=1460 SACK_PERM=1 TSval=2730777397 TSecr=0 WS=128"
"554","174.445545844","192.168.1.12","34.122.121.32","TCP","74","[TCP Retransmission] [TCP Port numbers reused] 57852  >  80 [SYN] Seq=0 Win=64240 Len=0 MSS=1460 SACK_PERM=1 TSval=2730778404 TSecr=0 WS=128"
"555","175.001170549","fe80::e2ce:c3ff:fe1a:1978","ff02::1","ICMPv6","174","Router Advertisement from e0:ce:c3:1a:19:78"
"556","175.013598579","fe80::a8c:14f0:c17c:d903","ff02::16","ICMPv6","150","Multicast Listener Report Message v2"
"557","175.629527347","fe80::a8c:14f0:c17c:d903","ff02::16","ICMPv6","150","Multicast Listener Report Message v2"
"558","176.230048168","140.82.113.26","192.168.1.12","TLSv1.2","91","Application Data"
"559","176.230396442","192.168.1.12","140.82.113.26","TLSv1.2","95","Application Data"
"560","176.406713418","192.168.1.12","213.57.2.5","DNS","100","Standard query 0xd3ef AAAA connectivity-check.ubuntu.com OPT"
"561","176.421235144","140.82.113.26","192.168.1.12","TCP","66","443  >  48184 [ACK] Seq=76 Ack=89 Win=70 Len=0 TSval=1909146024 TSecr=3821856032"
"562","176.438388241","213.57.2.5","192.168.1.12","DNS","268","Standard query response 0xd3ef AAAA connectivity-check.ubuntu.com AAAA 2620:2d:4000:1::2a AAAA 2001:67c:1562::24 AAAA 2620:2d:4000:1::23 AAAA 2620:2d:4000:1::2b AAAA 2001:67c:1562::23 AAAA 2620:2d:4000:1::22 OPT"
"563","176.439485134","2a00:a041:3c5d:4d00:605e:f34d:a502:2044","2620:2d:4000:1::2a","TCP","94","39974  >  80 [SYN] Seq=0 Win=64800 Len=0 MSS=1440 SACK_PERM=1 TSval=3529501829 TSecr=0 WS=128"
"564","176.461530952","192.168.1.12","34.122.121.32","TCP","74","[TCP Retransmission] [TCP Port numbers reused] 57852  >  80 [SYN] Seq=0 Win=64240 Len=0 MSS=1460 SACK_PERM=1 TSval=2730780420 TSecr=0 WS=128"
"565","176.528498793","2620:2d:4000:1::2a","2a00:a041:3c5d:4d00:605e:f34d:a502:2044","TCP","94","80  >  39974 [SYN, ACK] Seq=0 Ack=1 Win=64260 Len=0 MSS=1440 SACK_PERM=1 TSval=1218090638 TSecr=3529501829 WS=128"
"566","176.528542030","2a00:a041:3c5d:4d00:605e:f34d:a502:2044","2620:2d:4000:1::2a","TCP","86","39974  >  80 [ACK] Seq=1 Ack=1 Win=64896 Len=0 TSval=3529501918 TSecr=1218090638"
"567","176.528709269","2a00:a041:3c5d:4d00:605e:f34d:a502:2044","2620:2d:4000:1::2a","HTTP","173","GET / HTTP/1.1 "
"568","176.625649398","2620:2d:4000:1::2a","2a00:a041:3c5d:4d00:605e:f34d:a502:2044","HTTP","275","HTTP/1.1 204 No Content "
"569","176.625689648","2a00:a041:3c5d:4d00:605e:f34d:a502:2044","2620:2d:4000:1::2a","TCP","86","39974  >  80 [ACK] Seq=88 Ack=190 Win=64768 Len=0 TSval=3529502015 TSecr=1218090735"
"570","176.625858419","2a00:a041:3c5d:4d00:605e:f34d:a502:2044","2620:2d:4000:1::2a","TCP","86","39974  >  80 [FIN, ACK] Seq=88 Ack=190 Win=64768 Len=0 TSval=3529502016 TSecr=1218090735"
"571","176.626098662","2620:2d:4000:1::2a","2a00:a041:3c5d:4d00:605e:f34d:a502:2044","TCP","86","80  >  39974 [FIN, ACK] Seq=190 Ack=88 Win=64256 Len=0 TSval=1218090735 TSecr=3529501918"
"572","176.626118941","2a00:a041:3c5d:4d00:605e:f34d:a502:2044","2620:2d:4000:1::2a","TCP","86","39974  >  80 [ACK] Seq=89 Ack=191 Win=64768 Len=0 TSval=3529502016 TSecr=1218090735"
"573","176.647813416","34.122.121.32","192.168.1.12","TCP","74","80  >  57852 [SYN, ACK] Seq=0 Ack=1 Win=64768 Len=0 MSS=1420 SACK_PERM=1 TSval=1153210312 TSecr=2730780420 WS=128"
"574","176.647866019","192.168.1.12","34.122.121.32","TCP","66","57852  >  80 [ACK] Seq=1 Ack=1 Win=64256 Len=0 TSval=2730780607 TSecr=1153210312"
"575","176.648036797","192.168.1.12","34.122.121.32","HTTP","153","GET / HTTP/1.1 "
"576","176.709646038","2620:2d:4000:1::2a","2a00:a041:3c5d:4d00:605e:f34d:a502:2044","TCP","86","80  >  39974 [ACK] Seq=191 Ack=89 Win=64256 Len=0 TSval=1218090821 TSecr=3529502016"
"577","176.743069101","192.168.1.10","224.0.0.251","MDNS","91","Standard query 0x0000 PTR _raop._tcp.local, ""QU"" question PTR _airplay._tcp.local, ""QU"" question"
"578","177.229506459","192.168.1.12","34.122.121.32","TCP","153","[TCP Retransmission] 57852  >  80 [PSH, ACK] Seq=1 Ack=1 Win=64256 Len=87 TSval=2730781188 TSecr=1153210312"
"579","177.559891333","157.240.221.60","192.168.1.12","TLSv1.2","154","Application Data"
"580","177.559932043","192.168.1.12","157.240.221.60","TCP","66","45474  >  443 [ACK] Seq=2536 Ack=16837 Win=695 Len=0 TSval=2063700084 TSecr=2015961798"
"581","177.562684023","192.168.1.12","157.240.221.60","TLSv1.2","147","Application Data"
"582","177.641709753","157.240.221.60","192.168.1.12","TCP","66","443  >  45474 [ACK] Seq=16837 Ack=2617 Win=336 Len=0 TSval=2015961944 TSecr=2063700086"
"583","177.997534192","192.168.1.12","34.122.121.32","TCP","153","[TCP Retransmission] 57852  >  80 [PSH, ACK] Seq=1 Ack=1 Win=64256 Len=87 TSval=2730781956 TSecr=1153210312"
